municipio,titulo,fonte,data,resumo,link
Água Clara,Água Clara lança Plano de Desenvolvimento Municipal e define prioridades para próximo triênio - ms.agenciasebrae.com.br,ms.agenciasebrae.com.br,"Thu, 22 Jan 2026 08:00:00 GMT",Água Clara lança Plano de Desenvolvimento Municipal e define prioridades para próximo triênio  ms.agenciasebrae.com.br,https://news.google.com/rss/articles/CBMi4gFBVV95cUxQQURXSThhTjFVeU9meDRkcmxWUm0wTVg0ODlIc25uY2l0ckZmWmVHNDdHSDFLUXE4blZTbkh1ZEtaVzl4ZC1CeVZpT1hoRmpuek5La2Z1YWpoaV9JZUwxWS1TRElRT05NU3JudUs2dE5KTTNmZnNfM0ZyYlBxUzgxc2VOdVUyclgybUFwSG51djltZDNlemZxN3cxVnhGaE43T3VUbklnNnprc0tXVi0yVmxDVGJHMnFsWjczWTd6c05vVE1JZVJRcnVEc2laMktRVWc1Y015MGRGS2QxMHVYNF9n?oc=5
Água Clara,"Em Água Clara| Emendas impositivas somam R$ 3,66 milhões e reforçam investimentos públicos em 2026 - ArapuaNews",ArapuaNews,"Wed, 18 Mar 2026 02:27:00 GMT","Em Água Clara| Emendas impositivas somam R$ 3,66 milhões e reforçam investimentos públicos em 2026  ArapuaNews",https://news.google.com/rss/articles/CBMivwFBVV95cUxOTEMwMVVDbnRQTlRhMVQ0eHUxQTdmOVZkaGRFMHZmRWFNcHdRUWFoNk1lZmdidGx4RDhIQklpSFdrSUt0eVJfenZCcUFCaThoRHNvWUxER0EzUTMyOUZ2NFByaHdxdzVCOXlKN0NvZ25FRWM5UUZKa0xHNWJDRklZMzBpTFZOejFRb1FtRUdZcG9ObFBiOERZdmh5d0dydlp1NDhTNW9YQ0s3Z3FMMmU1UUVXdWZKaDAtOVVjWDc1NA?oc=5
Água Clara,"Governo de MS avança com novos investimentos de infraestrutura em Angélica, Água Clara e MS-228 - agenciadenoticias.ms.gov.br",agenciadenoticias.ms.gov.br,"Wed, 07 Jan 2026 08:00:00 GMT","Governo de MS avança com novos investimentos de infraestrutura em Angélica, Água Clara e MS-228  agenciadenoticias.ms.gov.br",https://news.google.com/rss/articles/CBMiywFBVV95cUxNdDF6c2F3dDY4MWF3QjFDeVlsbHkzTDR5RzF4WmhRSUwtWW1HV3p4V2Y0VzdlZjhiWHQzS2M2YkZ6RGFzRVRHWV9vMU1sNGJ4X01iVDdjOHBjb0tleWhsSFZVdlVnUmxsZXB4bVljTEQ0UE4wZG5MelNOSXRsd2dWaGc4QlcxSXMxa1BUcm5ub3kyeXhZTkM4SUsxeHFZWk5zNVVlUzNMa19OYzdUeF9LWkNHY3BtZHJvelZWdTRwSDdJSkc2T21xOVF1NA?oc=5
Água Clara,Seis cidades vão sediar fases regionais dos Jogos Abertos de MS 2026 entre abril e setembro - Idest,Idest,"Thu, 12 Mar 2026 13:32:00 GMT",Seis cidades vão sediar fases regionais dos Jogos Abertos de MS 2026 entre abril e setembro  Idest,https://news.google.com/rss/articles/CBMivAFBVV95cUxObHN3bWlCWmZwOGRYUkJzX3hCNVhQX1haZ2NNY200YVpOU1U4U0JHdmQwdG93N0t6Y0RqdVMwTVBDdVFZaTNUVUQ3cVhIRGZlQ3Uwcl9RYUFJUjNpQ3ZKTzA3NkFVS29KMWF1WmRRazdwVGZFelY4bGl0Vm9YdklFb3ZBVk5wYktCQ2NXU3VhVi12eFQtaTRhT0p2TldNcVYwZjFZN2xGZVU2VWU5WTA5c0lRdFhEdTA1OXJ6bA?oc=5
Água Clara,Torneio General Malan de Tênis de Mesa reúne 29 unidades da REE - sed.ms.gov.br,sed.ms.gov.br,"Mon, 17 Nov 2025 08:00:00 GMT",Torneio General Malan de Tênis de Mesa reúne 29 unidades da REE  sed.ms.gov.br,https://news.google.com/rss/articles/CBMilAFBVV95cUxQRWxIcHhKaGN5OU1JLWVmNVE3S3N0eDNUWmZLTnFvSzRnX2txMUpQVE00TnVuVXR2M1h6a2tUNE9FWEdiNHlNUDF5OXBkaHk2RUdVcFJLaVBYV3ItVWtjajBaVWZ6cmhVTURoRG01UTMyYUhfc24tS1JmVFZVME51LXotd2VsZkI0TjZTSGo5NTVJQVhB?oc=5
Amambai,Amambai participa de evento do projeto MS Alfabetiza Indí... - Prefeitura Municipal de Amambai,Prefeitura Municipal de Amambai,"Thu, 12 Mar 2026 13:52:44 GMT",Amambai participa de evento do projeto MS Alfabetiza Indí...  Prefeitura Municipal de Amambai,https://news.google.com/rss/articles/CBMiqgFBVV95cUxQaUo2My1Sb1ZKX1dzOF9TNDhKR0JuX0xBSXNfc2RXWFZPdXBmRHJ6WWVycWFHaFVzSGFuTGllS2RCcDdTemlISFJuQ3pPb281QnZ6Vk1KNHl4UEVDU0R5SF9vZXE3Ny1SVkgzRG80UU5HMk1JTHVIZHVkdlFVX1dXNjRlN2Jac3h4VXhZblhSa2hhWHIyQ2NPcTBtamxxN3lpazdiUDhILXBfdw?oc=5
Amambai,Plano de Desenvolvimento Municipal destaca protagonismo regional de Amambai e potencial agroindustrial - ms.agenciasebrae.com.br,ms.agenciasebrae.com.br,"Thu, 12 Mar 2026 15:24:49 GMT",Plano de Desenvolvimento Municipal destaca protagonismo regional de Amambai e potencial agroindustrial  ms.agenciasebrae.com.br,https://news.google.com/rss/articles/CBMi7gFBVV95cUxOTHNWNUp2NEZCTS1Mdzc4OE8tby0yMGVOU3YxVFhvSjBxRjNzV2tfd2piRlVtYm4tSWpScThQeGNHZFA3Qm5ZNDBEM1NyVE5SSnN3aXlwVEtFcDdvTllkaVBRckJiQnNJNUVLMDlKS2dIeVBWcVhVVnpOWDFCZDVDX0d3TlZ1QW1WaXl2bjhMS2VKbnZFb01kZnhuaHVYRzZHbV9EdTJUV1lvdy1CbzRDS2lvd2xhM1Y5RFMwWlZLN0xRNmI0NW9SUFhySlphRXNyT2pXaHlSempwR3RPUzBtUUtJYVh4c2tkUkxXVzV3?oc=5
Amambai,"Em Juti e Amambai, Governo de MS lança obra da MS-289 e entrega obras de educação e infrastrutura - agenciadenoticias.ms.gov.br",agenciadenoticias.ms.gov.br,"Mon, 15 Dec 2025 08:00:00 GMT","Em Juti e Amambai, Governo de MS lança obra da MS-289 e entrega obras de educação e infrastrutura  agenciadenoticias.ms.gov.br",https://news.google.com/rss/articles/CBMi7gFBVV95cUxQMnh2X0U0dUNQWk8wdGt2Mng3dHl2ZFBDRHo2RVRhMW5GXzRQdGhqTUpwLVdIZG5fc0ZQcXQyZUF6VERNeXRmeHkwS3VZYmd3cTFLV2gzbzBSbEpvdWk3SXIzOWF1SmlpRTl0QWZndVJHRkg1T1BHTlFhWGx2WW44SnZTeFFsM3NqeFo3b1lESms2NjdHMlNrRjM5Zi1Hc2dqUTVUSGVmdGlDQmpQenlpU1hYanVReXdVTkdKa0FSeHY3Y1pQTmR0aTcxTkJQcXc1NDZhQUdxWklHLTNZeEpjNElVeTMyUk1JR1d2N3NB?oc=5
Amambai,Cresol marca presença na Expobai 2025 e reforça apoio ao agronegócio em Amambai (MS) - Cresol,Cresol,"Tue, 14 Oct 2025 07:00:00 GMT",Cresol marca presença na Expobai 2025 e reforça apoio ao agronegócio em Amambai (MS)  Cresol,https://news.google.com/rss/articles/CBMiqAFBVV95cUxOZGFuUy1hWjY4LWxERDc0M05mMHdKZWpVNGZTM2NUT3Q1Y0ZrWVAtS1RpT2tVR09sNDY3d0VKZkxKeGZhNjRncHlmTXN0dXY2bjhUdzJ5TlhiVWVrNkFvZ19HU1pGNjhqOF9wR0tZbHczVTFSNU5DaGh4YWVibW0zVS1nMlVTN1Iyc0k4M1FxQXRfTFp5MEpZak5wNzBhVXVwLTlTem02MFo?oc=5
Amambai,Notícia - Amambai marca presença em lançamento do Consensualismo no Tribunal de Contas do Estado de Mato Gr... - Prefeitura Municipal de Amambai,Prefeitura Municipal de Amambai,"Fri, 27 Feb 2026 17:40:30 GMT",Notícia - Amambai marca presença em lançamento do Consensualismo no Tribunal de Contas do Estado de Mato Gr...  Prefeitura Municipal de Amambai,https://news.google.com/rss/articles/CBMi6AFBVV95cUxOWW5fdndOYkxLVkdiVFdnNHB1bEpVeFRwc0R5Yi0zaDNwU05lajh4bkNoVTFVNmNadXZZOU1CN3ptM0N4clNqN2dNSTFJeHJSaW5aRFlvM3ZYZG5uWGM0ZDlwc0RYU29qOC1sbC1pMzYtNXdYZnRsYjdVWEg5c3g3Q2JPTWw0c1NsdUFoc3J4Qks0N1I5STZ3NG5kVVd1MDJ3bXlFS2NfWkZ6Qm5MV3V5dHRMNlJWck9MeGQ1Wm1JWXpQSm5jUU9DYXBGYkxxbkpEbUJ0dkZzMDF5dkFMeWkydjN6ZkNLbTUy?oc=5
Anastácio,Palestra sobre empreendedorismo feminino será realizada em Anastácio - O Pantaneiro,O Pantaneiro,"Thu, 12 Mar 2026 11:57:00 GMT",Palestra sobre empreendedorismo feminino será realizada em Anastácio  O Pantaneiro,https://news.google.com/rss/articles/CBMiuAFBVV95cUxQdnphdUJLbUJ5cENrUUlmMTQxZl9KVzBTU183WG44d2NXRjc5WGtmRTJ1ODI0Qi10TWpHTFlvNVpvZGlUdDNPd0s0RDVlYUJuS2owa0JnUUwzbi0yZTRsdG5XNmt0V3JVRXhmNFhJVXl6bE5uUXRkbFB2LWdFTXdjMjMyN3R1OGdXNjFaRUlZdGVyeFlqQjhfNUlFVWluZnpTczQyZ2pFR2VEWFpuVThqcXd4bGVad25x?oc=5
Anastácio,Deputada defende políticas públicas e tratamento d... - Assembleia Legislativa de Mato Grosso do Sul -,Assembleia Legislativa de Mato Grosso do Sul -,"Tue, 28 Oct 2025 07:00:00 GMT",Deputada defende políticas públicas e tratamento d...  Assembleia Legislativa de Mato Grosso do Sul -,https://news.google.com/rss/articles/CBMiTEFVX3lxTFBsOUZGM29XdkJMbzgyRFVidTdNVGJDTllCcjd1dkFZcTU5aldWRDN3dVFqWmgxSFFNSDdKTVlqVWJaSUZCMFVscV9JLXQ?oc=5
Anastácio,"Anastácio recebe Workshop ""Conexão Oeste"" para impulsionar negócios locais - Aquidauana Notícias",Aquidauana Notícias,"Wed, 11 Mar 2026 11:00:30 GMT","Anastácio recebe Workshop ""Conexão Oeste"" para impulsionar negócios locais  Aquidauana Notícias",https://news.google.com/rss/articles/CBMiVEFVX3lxTE45M3U5WnpxdjFYWWVoV1NyWVdNcmRrNFRBbzduV2FlN0t5YzBKeUwzb2pmd3BsbXRoRS1ITGc2SjhRa0pRUThWTlRIVFNtWktkYlNWbg?oc=5
Anastácio,Escolas da REE participam do Campeonato Estadual Escolar de Tênis de Mesa - Consed,Consed,"Thu, 18 Sep 2025 07:00:00 GMT",Escolas da REE participam do Campeonato Estadual Escolar de Tênis de Mesa  Consed,https://news.google.com/rss/articles/CBMiqwFBVV95cUxOVDh0QWhNNHBLMDVjS1FyajFBU19Ra3hyeC1zX1R3T3hLTEpaQk00Z3Z1bmtBNTRKdC0wUjlDQ1ljNlNmdmRUbG9ESHZ2Y0QwUU5ibjZ3NXFnelRBUnJucUtuVVN3OHJyamd1bXNuZEdMQi1CTHd0OWFIUXRBSlFsakpDUTc4cVlOS2sxdjFST2V1a2ZGN1Ywc0Y2RHlQSzI0STlaWEEyX3BVbWs?oc=5
Anastácio,"Cultura, Criatividade e Economia: o papel do setor do artesanato na... - OpenEdition Journals",OpenEdition Journals,"Thu, 03 Jul 2025 13:42:26 GMT","Cultura, Criatividade e Economia: o papel do setor do artesanato na...  OpenEdition Journals",https://news.google.com/rss/articles/CBMiWkFVX3lxTE1fMEJfSDY2Y2JPR1RaMTJDdDc2TnZwdzdiNTJQVlpUS3pBQ25hR3h6OFB0NVFpVXB1anQxNm1NUl9YRTh6RW42SVNHTGw0dlhURUVJLWNUR1VoZw?oc=5
Angélica,"Governo de MS avança com novos investimentos de infraestrutura em Angélica, Água Clara e MS-228 - agenciadenoticias.ms.gov.br",agenciadenoticias.ms.gov.br,"Wed, 07 Jan 2026 08:00:00 GMT","Governo de MS avança com novos investimentos de infraestrutura em Angélica, Água Clara e MS-228  agenciadenoticias.ms.gov.br",https://news.google.com/rss/articles/CBMiywFBVV95cUxNdDF6c2F3dDY4MWF3QjFDeVlsbHkzTDR5RzF4WmhRSUwtWW1HV3p4V2Y0VzdlZjhiWHQzS2M2YkZ6RGFzRVRHWV9vMU1sNGJ4X01iVDdjOHBjb0tleWhsSFZVdlVnUmxsZXB4bVljTEQ0UE4wZG5MelNOSXRsd2dWaGc4QlcxSXMxa1BUcm5ub3kyeXhZTkM4SUsxeHFZWk5zNVVlUzNMa19OYzdUeF9LWkNHY3BtZHJvelZWdTRwSDdJSkc2T21xOVF1NA?oc=5
Angélica,Governo de MS entrega obras de pavimentação e apoia a 3ª edição da Feira AgroAngélica - www.ms.gov.br,www.ms.gov.br,"Tue, 21 Oct 2025 07:00:00 GMT",Governo de MS entrega obras de pavimentação e apoia a 3ª edição da Feira AgroAngélica  www.ms.gov.br,https://news.google.com/rss/articles/CBMitwFBVV95cUxPLXpyV1pBVUNlUWdIQ1VkazJIMWZfT0ZPdEliQnlZS1BRcTI3em1hZWFWempPMDh3Sm1CR29rRWVJYXhFREdOV1VwVW1ic3FERWdLNkhVNWI1ZG9JWjZnZHA3MkdIUlBpcXlsUElyZm5fSlJ6WmxPVi0xWC1zc19SNUstVEh3bEx3eFZCVDdWTG9lVGxFNjAwNGVFRHBaZXkzeEM5TnNlVVZkdUU0YTRfYTVhUnlvekE?oc=5
Angélica,Oficina de Upcycling ensina sobre consumo consciente no FIB 2025 - fundacaodecultura.ms.gov.br,fundacaodecultura.ms.gov.br,"Sun, 24 Aug 2025 07:00:00 GMT",Oficina de Upcycling ensina sobre consumo consciente no FIB 2025  fundacaodecultura.ms.gov.br,https://news.google.com/rss/articles/CBMiqAFBVV95cUxQT2tXeGtTb2R4VWdnTVRvWmV2cGZ1YngxVzdGOEthdk9VdlpneWhMUXJwd2JBZFhfUXMydmFjM3JSUzZ3ckRJNEZvS1k2UkZPWC1fQzY2ejRrX1lQTVVyN09wVmpicmlhUmlkVWZyRTg1QlJvZUtBQ0xXMHR1WEQ1R1pYWVFiV2o1ZGxkQl9KZmhZU2RYbFduN1pQcFFZZnA2TzRxbEpzQ28?oc=5
Angélica,Dra. Maria Angélica Gorga aponta tendências da dermatologia para 2026 - hojemais.com.br,hojemais.com.br,"Tue, 16 Dec 2025 08:00:00 GMT",Dra. Maria Angélica Gorga aponta tendências da dermatologia para 2026  hojemais.com.br,https://news.google.com/rss/articles/CBMivwFBVV95cUxOcEh4WWJtd2wwb2R0QnhjMjVoVzZBbGRzY0NKX0N4WWlaZlhIb0RsV0VNMWViMjJPOEQ1RjExbElUd1pwSUFTRk9NVVV0elhOb01Jd1IwWXFSZUFPYTFJQUdpclB1MG44Q0MwYlNybUVaR2prLUNZQTIwNzRiaWN2V2cyV2l2ZlUydldocEEwMmJXa2pLTHYxeXF1Q3J6Q0JsZkNiaUJxenVZTFZ3MG05al90NUhuXzFydVFPLWtmNA?oc=5
Angélica,Mais autonomia e menos deslocamentos: Mato Grosso do Sul incentiva diálise peritoneal - o progresso,o progresso,"Tue, 10 Feb 2026 08:00:00 GMT",Mais autonomia e menos deslocamentos: Mato Grosso do Sul incentiva diálise peritoneal  o progresso,https://news.google.com/rss/articles/CBMiugFBVV95cUxOcjhBWnFCQWVhcURIMHp5dzl3T0w1cHNvU3hVdUxJTWJGQ0N1YTluSE9pXzVja2V1ZUZ6aE1obWV1OXB1dmdBMm4zRE9sa05JbE5aV2V1SlpBSC1TMm9MRnFGYXZ6S2tBS0tTYkk0OUdkSHpmUGp3MHZMenA2eVFFNnZ5VnhnTWdxRG4yU0g5aHM0enUxVHo0ZDRWc3NKZWdMbVY4a1lGZGxHVUF6ZWxjWnRScHc5TnRhWVHSAbQBQVVfeXFMTkkzM295d3NFUjhxbV9weURWQ18xS0pZbUlhSEhOeGF4TDVDRThCb0VrQTNwMFNuMXZnaXRFYkNDLU5xREdhaGI4YWhHTlVqNmpvSDd3M2NQTDFDWmEzY3lvcnN4U0ZCNGMxRll0ZFdxMGw1bWVVRzA1clZhMks5VV9Zb251aWxCaVl1YlZtRi1TU21aV3N1SW9pY1ZHd0QzSkNFU0dOLVJLWWRMQlRMdGNoN1E5?oc=5
Aparecida do Taboado,Aparecida do Taboado mostra sua força no turismo nacional - A Tribuna News - Notícias de Campo Grande-MS - A Tribuna News,A Tribuna News,"Mon, 16 Mar 2026 16:09:32 GMT",Aparecida do Taboado mostra sua força no turismo nacional - A Tribuna News - Notícias de Campo Grande-MS  A Tribuna News,https://news.google.com/rss/articles/CBMingFBVV95cUxONFhHTy01OHFsemVGZDZ3em1nZkpDNmR3NWVDRWZpT1lvRENhcl91eFRmczlwLV9DWUsxdndBeXRGeVBBc3lJR2JZc1E2ZGs0NmhUN3hBN0QtbEhkTm1JVUl5RjBWdFo5NVhHc05NMmpZYmJXTG01TUpLRnlWRVNGSmdISUc2Z2lZMk5tT0hlQURQVHZhd2E5bG9IQ291d9IBowFBVV95cUxQOWo1NUFhSjZtcURFeUtsOEIwbUdPbko4aHlXQWlta3NBLVhKZ0xpYWdJc2lGMjZHRm1vckJwUHNxR1ZwSDlWVnVZNFR2VHRfZEN3X09MV1Rnc0l1aFJXa3R0WU1BVlJFLUp1N1VfTnctOTdmaXplakpMMVJyd2xGOVdMTFZPQWJjMTFZbTJmWWtKaGVxVW51NWI0eENrZXdKT2Nr?oc=5
Aparecida do Taboado,"Vereadores apresentam indicações voltadas à segurança, infraestrutura e qualidade de vida em Aparecida do Taboado - Costa Leste News",Costa Leste News,"Wed, 18 Mar 2026 12:18:01 GMT","Vereadores apresentam indicações voltadas à segurança, infraestrutura e qualidade de vida em Aparecida do Taboado  Costa Leste News",https://news.google.com/rss/articles/CBMi2wFBVV95cUxQYnpfZVVQbktWa3BYNm4xZ1BuOEtUa0tKNkJoTkNpS2tvNjJuWkc5VGNFMWFrUDJsQWRDelhDcG5YLUJ3NFl3dTlSSU04MmZ5VXNQaTNkNG1sd3BVT05tdGMxem1WVHB2VVFTWEdZMWJSS0JiaDU3bWlBQzVhV1h6MUx5cHpyWjNzQW9yVWl0Y1Z2VUxvWU9qRU9wZ0RmanhxMVZWMHhkWDRkcWw5NW5FOTItLW5IVkJYYkdOOWl4MWY1QS1zZ0lBV2dpYUpKMTVyVzNwcTRTNGU3Mnc?oc=5
Aparecida do Taboado,Apresentadas as atrações do Taboadão 2026 - RCN 67,RCN 67,"Tue, 24 Feb 2026 08:00:00 GMT",Apresentadas as atrações do Taboadão 2026  RCN 67,https://news.google.com/rss/articles/CBMikgFBVV95cUxQdWMzeW5ZaDMwTzdsNVpGTlRmeGlOMW95WXVKR29LQTNtOC1yS2t3a0RzYWJnZWVCeUNMd0xLNnJIRkNOb2VJZ0gwU2FsM0pKbXZiRkhmemtjNUlWcEdVcXJ6djVRNDlRX3ZLZzhqZnNob0s5OWZiMkNiX1habjdyeTlrU0Y3bTlRY19qanlScHpXZw?oc=5
Aparecida do Taboado,Neno Razuk investe mais de R$ 5 milhões em emendas e transforma municípios de MS - Assembleia Legislativa de Mato Grosso do Sul -,Assembleia Legislativa de Mato Grosso do Sul -,"Wed, 09 Jul 2025 07:00:00 GMT",Neno Razuk investe mais de R$ 5 milhões em emendas e transforma municípios de MS  Assembleia Legislativa de Mato Grosso do Sul -,https://news.google.com/rss/articles/CBMiwwFBVV95cUxQVEZZaXFodnY4Q08zWnF2clpBaXppa1o2TzRqUzZ4bktxWXE4UTF3bWh2OW5LbTFHT1AzU043UHJuak83MWJWc3lQdjVuNDh3S3I4TWJJOEsxbnpFVk9CSGNodXNKdFlNUWVJOGF6VFdkX2ZGS1REM3lnVWk5QV9XckJLLXhkcDh1MlFkSVdqZmRTa2ctU283S2E1dEoxUXcwWGxJeV9QaDFfblJnTHI1RXJDbm1WNHF2MWVYTEVMWXpPQzA?oc=5
Aparecida do Taboado,Escola Municipal Cel. João Alves Lara recebe Prêmio Escola Destaque e R$ 80 mil - Rede Jota FM,Rede Jota FM,"Sat, 13 Sep 2025 07:00:00 GMT",Escola Municipal Cel. João Alves Lara recebe Prêmio Escola Destaque e R$ 80 mil  Rede Jota FM,https://news.google.com/rss/articles/CBMixgFBVV95cUxPckZLdExnZEg0VHY1cC1HbmZfRHg4SC11WEtZdXVXaW4yZFd5aU9iWkdOckFGajRwR3BUbHl6NnNtcXlIaTM0T3FzalZCRWxrTDBDVVdNMXBJRmRvRzlOUTJYZjZRZjVaMEd3akoxbmF2cVpDczl1dzIxN2tYOVg2QlR2UzBtbEQtcEZCUU1Za2ZmNmRqNkRzOFFsM3NrRU1KaXE5Y0JSTS1IU05xczFlYmdWanUyc3Y0RjFaTWMyU2UyTXdzU1E?oc=5
Aral Moreira,"Sanesul investe R$ 3,5 milhões na ampliação do sistema de abastecimento de água em Aral Moreira - agenciadenoticias.ms.gov.br",agenciadenoticias.ms.gov.br,"Wed, 29 Oct 2025 07:00:00 GMT","Sanesul investe R$ 3,5 milhões na ampliação do sistema de abastecimento de água em Aral Moreira  agenciadenoticias.ms.gov.br",https://news.google.com/rss/articles/CBMiygFBVV95cUxOLXFQemlBczZMTGxxc2tUcW5oRFFzcXh0czM4NUt5aEloZ0xESXFOYVlaal92ZmVYQUJCbDl0cVRJdVFHejFqTnZfdUlMQ3A5bVJrcC1rbVBzdGtwWk1hcUhsUEY4cUhtTC0tM1kwZURTRUhNMXdzaDgydnRfNVlUWVE2UmRJNFpkTldQUlNFaHdXQ0pxUTlQQ3V6b3RkbVZWR1FlcmYxelJkMGRnMmZ4RnBIeVc4QU1JU2xsRGZhLWFMbU0ybHlHRTRn?oc=5
Aral Moreira,Governo de MS seleciona entidade para fomentar turismo na região de fronteira - Midiamax,Midiamax,"Tue, 10 Feb 2026 08:00:00 GMT",Governo de MS seleciona entidade para fomentar turismo na região de fronteira  Midiamax,https://news.google.com/rss/articles/CBMipgFBVV95cUxQNFI5MGh5TXdVSnFld3lnaElvd1pZTFdiNEtHTFY4RzFHNmpqRWJVNHRqbEpHQkI2UERjdFc4aEJHZjFqVXRKUDlXY2VEMEpzYjhqTjRqRi03ekZiYVFsb3RCM3pBYWlfajNpUm1xUDhRcEtYaWF5R243T1gwak9fTkhXZEFrV0llNUdmamFsZ05iZHJqT3JZVEtFQUp1S3IzMWtIaDBB?oc=5
Aral Moreira,Justiça aprova recuperação judicial do grupo Agropecuária Santa Mônica - Agro Estadão,Agro Estadão,"Tue, 16 Sep 2025 07:00:00 GMT",Justiça aprova recuperação judicial do grupo Agropecuária Santa Mônica  Agro Estadão,https://news.google.com/rss/articles/CBMiqwFBVV95cUxNZXFZUkJTWl9qSXhyNnJQUTM2NkZWMGVkaFhSWWlkSDNZTVFzMEk3Sy1tb0NPUUlQTU9iMlhIVWxacHUwUENUYzFnYVlwWnI2cllwaTNQN1J6SUd3Z0pNLVNjRTNldHRwdF9XV25RejB6Nk5rQzhGYk5Ra1U3LWlQU2Z6ZndIZGxickt5ZEpfRjBXeHRZVHNzMkhRdVZsaEo3NUFGV2x6eXUybUE?oc=5
Aral Moreira,Governo vai completar 100% de asfalto em Aral Moreira e revitalizar principal avenida - www.ms.gov.br,www.ms.gov.br,"Mon, 19 Feb 2024 08:00:00 GMT",Governo vai completar 100% de asfalto em Aral Moreira e revitalizar principal avenida  www.ms.gov.br,https://news.google.com/rss/articles/CBMitgFBVV95cUxQa1pwcjRPVTVKNXNjSUVFbTlJb0F0UWNQb3BqVkFvaE5xd05hSFJIRlpBRzZLRTFyVVUxUGZIMWpjMGh1M3ZkTmN1SzAyNXFfNVcxNVJIcjNZNW9GNVhkUTIyYzBacTk2TmxOU2F1WU43LVhpcjB0M0VkN2hXbURCUFhkNXdoWTQ4SUd1ejdCTXptM3I2OFlOVDRnQXIwVGNWdUdfZnNUWW1OMnVocjRnSXRIbVUzUQ?oc=5
Aral Moreira,Aral Moreira terá mais de R$ 7 milhões em obras de água tratada e esgotamento sanitário - Sanesul,Sanesul,"Thu, 24 Feb 2022 08:00:00 GMT",Aral Moreira terá mais de R$ 7 milhões em obras de água tratada e esgotamento sanitário  Sanesul,https://news.google.com/rss/articles/CBMitgFBVV95cUxPeTlteF9GYk9adjhQV1FxemlWZ0ZCcTB4bW9mdlpuWDdiVjUwTzNmQ2VpeTNzVThXWE5GZzlobjNndDZxdlM1Zm8yVXhYVFhOYkJGUlhiZS1PbTI1ZndBYWhDVUhpbnd5TG56MXQ3dEM2MU4yeVp5bVBWR28yQWQybm5iNzRXUTg5NXJhYjJSLVVfWjJFX0FQckF4Y0ExeVNCUjdvVmxMUEI5Wi16cW5kYlg3OWoyQQ?oc=5
Bataguassu,Sul-Mato-Grossense 2026: onde assistir ao vivo aos jogos de volta da semifinal - ge,ge,"Tue, 17 Mar 2026 19:49:49 GMT",Sul-Mato-Grossense 2026: onde assistir ao vivo aos jogos de volta da semifinal  ge,https://news.google.com/rss/articles/CBMi9wFBVV95cUxQVU1DdHRsMmFlZENPeXRWV2FLNVJfcUVNVmhCRVc1SXM5V0FyUE83Qk9nd241UFpXaGlleDZFakJYejQ0UnZMN3FBSThhQVFqYlRoVWVHSVo0OHd0eWFySTV2Q1RoRjVkR1RoS0lVZXFiTEJEZVo5TjBZYzFxUEhzR2dfR1dKb2dfeUJ0eVdLeDdkc0k3YnBoandZeFc5STNrcFJaSmg0S3BBdFFFVzN2UEszWnROLU5VVzlrRDZBeDhXX1RKbC1ZSVdGQm85VVpibjUxazRFMTItS0Nwc2xXbG1oVFdhVUdKUjE1MXY1cnZDMkVNSDlB0gGGAkFVX3lxTE1pdVM5eHI2Vi1rYlFIVGdhNWRuNEEtLUE0SVpHMzByZkhVUV9DV2F1QmxzYVRoMHgtdi1oYXhUTzBiZ21SMXdGYWQ4dUpVZ09wcXl0RlB4Tk10U2hCX0ZrSG9XSkVham1oeWdpRkJTeTlXeE9WTUMyQ3dHNTJUd2lhZ1FzbWFWdnNfTUNtT040WXdFdTBiR0pBZk1yY0tGOVlfUnowb010UHZxcVU4b3N2d3FPZWdULV9yOHM0UjRMME13VVcyaXF3THNLalRqNm1kQ00wTU54aHhreU5IZ1BvdkNvSEdwZU5yVmR6UHJLM2RYbV9wa0NGSk53bDhaME1HdUdsMXc?oc=5
Bataguassu,FESTA DA VIRADA 2026: evento de ano novo acontecerá em Bataguassu e Nova Porto XV no próximo dia 31 - prefeitura municipal de bataguassu (ms),prefeitura municipal de bataguassu (ms),"Mon, 29 Dec 2025 08:00:00 GMT",FESTA DA VIRADA 2026: evento de ano novo acontecerá em Bataguassu e Nova Porto XV no próximo dia 31  prefeitura municipal de bataguassu (ms),https://news.google.com/rss/articles/CBMi2AFBVV95cUxQS0dXNTZnNUd1NHA5am5GRlFJN1hVMGNfNk1VWmlJZkl4S2dwY2dGSzEwRlRqblFtR3NVOTFKU21qblYzMjlfZXZ0a2t5cm01bGpEM0hRTnpROEpyVUdiTWE0YjlCbFY1bXRsY3F0SEZRV2lLbmN5Y3FHd0FFSldXYm94Tm9VejV1bFJpVjVMLXZsOVpTSGY2SGRyV2EzdHVUc1FNZ1FjU3pVX3dERW9XazFST0kwdWJjUDU3YkV2ZGNWcHhlOWsyVFhTRjZTdUwyRHRCZjVteWk?oc=5
Bataguassu,Bataguassu e Corumbaense precisam de feito inédito na década para chegar à final - ge,ge,"Mon, 16 Mar 2026 19:27:26 GMT",Bataguassu e Corumbaense precisam de feito inédito na década para chegar à final  ge,https://news.google.com/rss/articles/CBMiigJBVV95cUxNQ0hBaEpkVXpsd3c0UnFvZDU3MEliNm5ZQ2NmUjdpMkExekJQQ2tpdXRNZmk1UWlXM0JhRFhGSXBvM19fY3ctU2FwN1hRWTdXVV9NVzhkTjZFbncwWFNYZW1aTF9YSDJWamdOOW5fVWlTbGZxV2RUc3g1aHZOV09pTmx6VHNBTklEM1NXcG1oUmRTWG0xODEwS1ZQNmNjQnVIUjBxY2FuMEtGblEwOWwwMkx1TThuYVVCX3pGV3hYT01ybXpldWdycDVsRlVSd0tXanF0QkZIZllQWngwQ2drcE9USFRuMXU0TGdNQWl4MUhsNWZuU2lObWhJQXBTLVp5VmtPOEVaLWZUd9IBigJBVV95cUxNQ0hBaEpkVXpsd3c0UnFvZDU3MEliNm5ZQ2NmUjdpMkExekJQQ2tpdXRNZmk1UWlXM0JhRFhGSXBvM19fY3ctU2FwN1hRWTdXVV9NVzhkTjZFbncwWFNYZW1aTF9YSDJWamdOOW5fVWlTbGZxV2RUc3g1aHZOV09pTmx6VHNBTklEM1NXcG1oUmRTWG0xODEwS1ZQNmNjQnVIUjBxY2FuMEtGblEwOWwwMkx1TThuYVVCX3pGV3hYT01ybXpldWdycDVsRlVSd0tXanF0QkZIZllQWngwQ2drcE9USFRuMXU0TGdNQWl4MUhsNWZuU2lObWhJQXBTLVp5VmtPOEVaLWZUdw?oc=5
Bataguassu,"Sul-Mato-Grossense: veja semifinalistas, confrontos das quartas e rebaixados - Primeira Página",Primeira Página,"Sun, 01 Mar 2026 08:00:00 GMT","Sul-Mato-Grossense: veja semifinalistas, confrontos das quartas e rebaixados  Primeira Página",https://news.google.com/rss/articles/CBMivwFBVV95cUxNS1gwOUp5U2hNbkJCTWJjQnNuMkpfYVpnbUZUS3JMZmI2WHhnb25DY2QzMmRidXZxc1BKVDZqdlJCVk5LdU1ReDJjc01kMlJPVFZPbjE4eU8wZUNUR0tCaF9pOU81amoxc1V0TmR4M3Y3ck9aVlJMV2RtcmlMZXh3ZmJiOW5KNTgweE1IMG5zMHFVQjY0V21SRjZCNndDc1Z2Yk5fT3NSYWJ2NGo5bjhGRlY5OTJBOG9Id1VNMHRDMA?oc=5
Bataguassu,Alunos da SEMEL representam Bataguassu nos Jogos Escolares de Mato Grosso do Sul - prefeitura municipal de bataguassu (ms),prefeitura municipal de bataguassu (ms),"Thu, 31 Jul 2025 14:54:54 GMT",Alunos da SEMEL representam Bataguassu nos Jogos Escolares de Mato Grosso do Sul  prefeitura municipal de bataguassu (ms),https://news.google.com/rss/articles/CBMiwAFBVV95cUxPUlQ2WkxpSUFlT0pyNURGT3BVS3lQa0lfMVIzNlJMd25KRzF0ZUdMM1ZCMm1meDAwa0ZGNkFHbnF4RWNXQnhydnpuQU5pQXJPR21JVlRBeC1WancwVDdOMEJLZlVxRV90RmQ1bzBuQ3daTGNDa28zS29RNVIwREZmVS1vYl83VkJTd25XSXRXRmdTcTAxN3JyaEhXRGctVGJ2d29aV0VkaGdWY3VhaHpzUXZkOGZ3N2t0Rk9CNHlLN1Y?oc=5
Batayporã,"Em Batayporã, Hashioka participa de jantar da ACEB e destaca investimentos de R$ 700 mil - Assembleia Legislativa de Mato Grosso do Sul -",Assembleia Legislativa de Mato Grosso do Sul -,"Sat, 07 Mar 2026 14:41:00 GMT","Em Batayporã, Hashioka participa de jantar da ACEB e destaca investimentos de R$ 700 mil  Assembleia Legislativa de Mato Grosso do Sul -",https://news.google.com/rss/articles/CBMiwgFBVV95cUxNd3RTWS1ISzhKZlRzZlQ3a2JvMGY2aFl6cUtGVVM1VU1FMUl1bWZVVmlSM0JNZFhWYXVUNDFZeUZtNWQ2d2V6Z0ZMNEdJcnJ5QlA4WHRoOWlCOWZGOGdKdGJNTV8zV2lEbUlEV05icEIxVXMwVFZ5bjcyRGhKY0JGdlBsTUl2emJZNXYtUHJDemNfTTZuT0ZGaTF2bmVNUlNVSVZpaFJMdy13T0hwNFliOHRSQXNwVmNlajFQbkRDTDdVQQ?oc=5
Batayporã,"Prefeitura de Batayporã - MS abre seleção para a Secretaria de Educação, Cultura, Esporte e Lazer - PCI Concursos",PCI Concursos,"Thu, 05 Mar 2026 08:00:00 GMT","Prefeitura de Batayporã - MS abre seleção para a Secretaria de Educação, Cultura, Esporte e Lazer  PCI Concursos",https://news.google.com/rss/articles/CBMizwFBVV95cUxPWHR1a1FCam5nS1dob2kyZ0tXeDZiaHR4a2xRRUt4R3Rua2lvMml0Wl9oYl80Q0lOeWRLYUlneWswSkNERUx3YkdzSnk2a1NIdVhUcTNpdk1pNExOeDBtRkpoelZ0cVYwZG56VTYzdGZaWjV1d0NhVm9QLXp1UmdGZ19wcWRSUWppQTZtZ3NCX1RVdUhDVlI3aWFKNUdBVUI1TUVyelBPbGVlMk5nS2NxZkpqTzZsWGJZbl9Sa2xoRVl4UVBHSTdILVJ6Y0d6b2s?oc=5
Batayporã,Batayporã participa de alinhamento para inclusão no Mapa do Turismo Brasileiro 2026 - Jornal da Nova,Jornal da Nova,"Tue, 24 Feb 2026 13:41:00 GMT",Batayporã participa de alinhamento para inclusão no Mapa do Turismo Brasileiro 2026  Jornal da Nova,https://news.google.com/rss/articles/CBMixAFBVV95cUxPYUZBU1JPNk1ZYk9MMzVob2Q2Mi1yOHJhb0VJVkdJNHhlN1dmbXphU2liRFdfelV3VEZ3WmM3emUwUHp1eEhyLXRZNy1wSzl6V25yRWhvaEI2M3BJS1hkZHhzQndRYlRGLV8tUVJXYlRhc295UlBEWWtJVGVwMXdnSExDZ1BDRmRBUjE4ak9SbXBubG9mVlk3QUdsUl9DdUNTVXVKUGVmeWtXcnlLc0pnRklUQlBncDQ5ejB0dWlPRUtXbFNE?oc=5
Batayporã,Concurso Prefeitura Batayporã-MS 2025 abre vagas de até R$ 16.879 - Ache Concursos,Ache Concursos,"Mon, 29 Sep 2025 07:00:00 GMT",Concurso Prefeitura Batayporã-MS 2025 abre vagas de até R$ 16.879  Ache Concursos,https://news.google.com/rss/articles/CBMiwAFBVV95cUxOZ2p6M2pNYTR5ZDlNMndXUXIxbGllTllrRGNLZ05FWGlERzU2eFNYSlNoX2dJMWNZU2p1cjQtay14S2VIZlJIYUNiMWw4UjUyZk91WjdhNDQ5QzFLZ3ZHOThiaWcyRTFodl9QU3VJcGx3QllVZmlNaS1zTV8yeWdwb3pma2tVekx0RExHNElNdVVBLTNtcWVOS0FTQjRUcUsxVVFObzNmYXdFaDFoVno5OUxGYTQxUE10VENTZjIzRW3SAcYBQVVfeXFMTXp0MG5XUmFoT2w4dWIzTjBxR0ZjdGVFZHNCNmdyM25pdi12VGNOdmtaUjdfVmZzblNELV9zMWRsbzdTU0JxZk9JRklJbHZXSEpsQUJ5NDlCWmI2OC1wYkxKbjFYaDlSLXgzR1l3YXpqRXFfR1ltejdJOUhHbVdLNnVqcE1Vd0dHeGM3S1VaZGd2NDBmcy1BR1ZFLV9adEdhN2VqcWM5b0gxS3JwV29FeWYzdkpLZDBLanM1TVUwVUZkR0VtOWJn?oc=5
Batayporã,Prefeitura de Batayporã MS abre vaga para Professor de Ensino Fundamental - Concursos no Brasil,Concursos no Brasil,"Thu, 05 Feb 2026 08:00:00 GMT",Prefeitura de Batayporã MS abre vaga para Professor de Ensino Fundamental  Concursos no Brasil,https://news.google.com/rss/articles/CBMixwFBVV95cUxOZ190T2hySW8tN2kzTU1Uc3hoOVUtSlM4TzlDeVVVUDVMQ1FwdGN1aWZxUWdQY1RENEE3RFhoVS0zalZ1eUVfM3VUWERoZ2d2UzUzbVRtXy1IZkh1ZHg2SHR2R213WUtRSDVERFoyU2I4QW9ENEVIQm1raHdsb25CSFkwSzl5RkdKeFMxOGNIMEVzOTFBbWxBNjM4U1ZXZURHZEx0ZV9LYTl3NWtnQXg4blFRR0dyUzU3VE9OSkpGZ29zZmZVeUZz?oc=5
Bela Vista,Semana do Artesão reafirma identidade cultural e fortalece economia criativa de Mato Grosso do Sul - Fronteira News,Fronteira News,"Mon, 16 Mar 2026 21:04:48 GMT",Semana do Artesão reafirma identidade cultural e fortalece economia criativa de Mato Grosso do Sul  Fronteira News,https://news.google.com/rss/articles/CBMiwgFBVV95cUxPRTBiZlBLeEpEaVpONEdwTElpTjBJM3UzelRHM08yTG1LNUROUE1DbHF6TTVuQUZCeDNzd29NRktSYjdCVFZvc3phZDVyU241c1AyRC1PRTY1Q1l1a3pOUzJ0M2JBZmhGS3REXzk4a0RhR20wdVBFa1JYLUNDQms3QkZIc0g3QjdTWE43V1QwM1VCaTZmN20zY2owWm5JU09jaGtXVW85Y0dHVERGa05jb3RJbG1NWmluRW5hRjA4TVp2Zw?oc=5
Bela Vista,Sebrae realiza Startup Day simultaneamente em 12 cidades de Mato Grosso do Sul - Diário Corumbaense,Diário Corumbaense,"Mon, 16 Mar 2026 22:00:02 GMT",Sebrae realiza Startup Day simultaneamente em 12 cidades de Mato Grosso do Sul  Diário Corumbaense,https://news.google.com/rss/articles/CBMiYEFVX3lxTE83TkduSXVIMi1oZzFDWVQ3V2lvZElrWjVqWURoakJpSGdMVVJpR2FsRnhMdU94MkVyY1hENWdOb3BIdHBwSW5ZdmRxM2NheTl4NVQ0Q09FeU9hbkhLaVN0LQ?oc=5
