municipio,categoria,titulo,fonte,data,resumo,link
Glória de Dourados,Política e Institucional,Riedel cumpre agendas em Glória de Dourados e Aparecida do Taboado nesta sexta-feira - Midiamax,Midiamax,"Fri, 01 May 2026 07:00:00 GMT",Riedel cumpre agendas em Glória de Dourados e Aparecida do Taboado nesta sexta-feira  Midiamax,https://news.google.com/rss/articles/CBMisgFBVV95cUxPQkNlX3F2V3M4YzZaWnl5ZzU1YmVKeDJ1ZU9CVVdIVWtlQWE2WGZNbVJPQnJralpOZzFwWHhEOWhPQjVzYmgtY0lrUWExeXFmLVVRc19aRDB5cUIwRVpla2U3NHNHa0JfZDN5UzZzLXRoM2Y1ZWpqWEJ1Y21HY0N2VXMtZFZCalJXNFFWd0NjZWVMbXhUb2VpOEdUSWN4NURPV1ZQeEFvNEI5bEd5US1qUzhn?oc=5
Glória de Dourados,Política e Institucional,"Glória de Dourados fecha contrato de R$ 1,9 milhão para limpeza urbana - Midiamax",Midiamax,"Sun, 22 Feb 2026 08:00:00 GMT","Glória de Dourados fecha contrato de R$ 1,9 milhão para limpeza urbana  Midiamax",https://news.google.com/rss/articles/CBMirwFBVV95cUxPdDR5M0FJUVc5cUZhaUc3Vm9BYXlDRGFHd093eWs1eWwtamg5SXdxMFNLdEwycmNaN1hocWgzWDQ1ZjJWUXlJWEN2VnhaMFhBazZPakRIbGg0WlJfSzltalJoaGRHNVQxMWxhZnFMejVGR1FoeEtYRnJ1RGpER1JtUF9ObmNXbjVwZS1ZY185c0xIUmItbzg4TkJpTTVjRGVUS3VSdU1uaWEweXZGcGd3?oc=5
Glória de Dourados,Política e Institucional,MPMS fiscaliza transporte escolar em Glória de Dourados e cobra regularização de vistorias e segurança veicular - MPMS,MPMS,"Tue, 04 Nov 2025 08:00:00 GMT",MPMS fiscaliza transporte escolar em Glória de Dourados e cobra regularização de vistorias e segurança veicular  MPMS,https://news.google.com/rss/articles/CBMi5gFBVV95cUxQN3NMVHd5MVZ3N1A3NC1BbVF6aXI4aDJTQUxWSlp2UlZTc1U5NlN1Ti1DdE4xd1pGY0d3TlNuVC02UkptcHlmUElIS2x6M01QSHp4X2NWOHBQekJYNk80cVRsYlBSdXpxeF9GN1ZPYm9rOVVIS3c1dG56TldTVS1DeUtLdkpSY1czY0oyVXRsNGZIVkFpbzJmbVZBN3ViR2hNVjhFZXJvTVZLUXNVakZ0QVFLaHc2OUZpeWt6WFpCeGFpSDRhTHJ0b3I4NGlaMFpvZ0ZULTRudU40MHBmc1ZjVGFRVnVIZw?oc=5
Iguatemi,Social e Cultura,Festival de Dança Coreografada da Melhor Idade define campeões - fundesporte.ms.gov.br,fundesporte.ms.gov.br,"Fri, 05 Dec 2025 08:00:00 GMT",Festival de Dança Coreografada da Melhor Idade define campeões  fundesporte.ms.gov.br,https://news.google.com/rss/articles/CBMingFBVV95cUxOejF5QU42UU41bFdMVmxDbDBBbDNSMFVkSTZYRHcxb3ZDVGF1OUw2NmN6ZEFQN1g0MkFyN251VjV1Mi1ldW81SHN5VnFYZnhEVDhNT2tzdnZpT3F5VGFMVnhSSEl2bVNfc1FCRkE3SUtlbVFwbW82WUp5MFM4d3JlSTJ6dUlxaGNLMWR2Ry1fMW5DMHVMa3dRMHhXeGVHUQ?oc=5
Iguatemi,Social e Cultura,"Cine Sesi tem 2º maior público do ano em Bonito com 4,9 mil pessoas - Agência de Notícias da Indústria",Agência de Notícias da Indústria,"Tue, 25 Sep 2012 07:00:00 GMT","Cine Sesi tem 2º maior público do ano em Bonito com 4,9 mil pessoas  Agência de Notícias da Indústria",https://news.google.com/rss/articles/CBMi0gFBVV95cUxQNHRsNkdrcS1vTGxMOUFyR0d1UmtSc0ZNZ1FEN1ZhZHNSRzh0XzBsUml5MENpYVZ2RXcweFdEMHh2cFBZbEYxMU5iV1k5Z3B2cmlLU0QzRDZtbGVFWkpQcmwwb2UtaUZXMDRZTm5QUlNBOWJ0azBnV01zbjNvYmRWcHZKbkRYN2doRElyZHNRQUFjMlBiUDJERWRQN1ROOHZUVmExUkJLZm5HWmFDNHNMQ2xVdktYd25hZ0ZKbnBPTEV3REJIWFlSU3ZlVE0tM05pN3c?oc=5
Iguatemi,Educação e Negócios,"Funtrab, Senac e parceiros realizam curso de Depilação em Cera para participantes do Programa Mais Social em Iguatemi - funtrab.ms.gov.br",funtrab.ms.gov.br,"Thu, 03 Jul 2025 07:00:00 GMT","Funtrab, Senac e parceiros realizam curso de Depilação em Cera para participantes do Programa Mais Social em Iguatemi  funtrab.ms.gov.br",https://news.google.com/rss/articles/CBMi4AFBVV95cUxORXotZWVYTDFNMHRRRXdXNUc2eVVleUhoV090NXNxSV9mNFdIT0xEWk9FQ3ltZGFHMUc4aGhqejJDWUdVYTUzaFJ1eVVfM3lVZ25EZURCOWNXNUI5R2d6Yl9PVEU0SHF3S0hxc0VCd0stMnFhbDQ2ZHRUemF5cmpxcHB1X0hwdjc3dkZLSzBvWnpPS0VuVVdhcm82cWpIWHdRQ0Fnem1MWVJzMHhrQlVhNE0xNV9TUFZQUHRWd0publY2eUFPb3hqalhuczUtWlVyT094b0RLNGpqUjVocE9zRg?oc=5
Iguatemi,Educação e Negócios,GIRO FUNTRAB DE NOTÍCIAS – 03/06/2025 a 16/06/2025 - funtrab.ms.gov.br,funtrab.ms.gov.br,"Tue, 03 Jun 2025 07:00:00 GMT",GIRO FUNTRAB DE NOTÍCIAS – 03/06/2025 a 16/06/2025  funtrab.ms.gov.br,https://news.google.com/rss/articles/CBMihgFBVV95cUxOdThvX3U3ay1qR2dRN04ydUZIM3JZRWVqWU53Yzc2NFlFSWVfbmFHRnlGRkpHbmRaUnNKUDB6SWlIaGZLZHViV0xvNW1QSlBfRVRORHFzMDRuMGlrbmhmZFpacFpLVWt6QzJTMThTMzlCV2hvYVF5eDE3WHhFeWw3RXBHamc2UQ?oc=5
Iguatemi,Educação e Negócios,Funtrab abre processo seletivo para engenheiro civil - funtrab.ms.gov.br,funtrab.ms.gov.br,"Thu, 11 Jun 2020 23:11:01 GMT",Funtrab abre processo seletivo para engenheiro civil  funtrab.ms.gov.br,https://news.google.com/rss/articles/CBMiiwFBVV95cUxQdkdRWlIzVnRVUHFqLXF6d1JGSWRsTVdmVzBxRV92LS1VV0wySUxXbkV0ZGNLeFZIX0dicmV4UnJDOVNQc3hIV2kxWkJDSEQ4aWpMY1lNa05XSG9tcElJdGtZcEtoQS1aTnpCZU5SNmlER3VBRF9LZzdoQjlpZk84YVVPU1R2bjhOSU93?oc=5
Iguatemi,Política e Institucional,Iguatemi e Japorã recebem obras milionárias para saúde e infraestrutura - Midiamax,Midiamax,"Thu, 14 May 2026 07:00:00 GMT",Iguatemi e Japorã recebem obras milionárias para saúde e infraestrutura  Midiamax,https://news.google.com/rss/articles/CBMitgFBVV95cUxQeXV0MkFRUi1OM2p0RjNUcURiLTdCLV9CVF9oU0l2dFNqWVF1M0Q1UkZzWDZMMlp2S3B1anM2YVBLWHRGS29FUzdKdUtySnNyZFFsdlNqMnhMTmo3cmlRejc0V2FZc1dhSzJLV05qZmlhT3hFMDNKU2h3bmJNam56REstYk9GdjhwMVhyUHRGdXFaemdKSXpJS3BYd3ZQeWNXTWVyalNuZ0FqRDZnWmp1UG8zQ29ZZw?oc=5
Iguatemi,Política e Institucional,Prefeitura de Iguatemi MS abre processo seletivo com 17 vagas em Assistência Social - Folha Dirigida,Folha Dirigida,"Sat, 24 Jan 2026 08:00:00 GMT",Prefeitura de Iguatemi MS abre processo seletivo com 17 vagas em Assistência Social  Folha Dirigida,https://news.google.com/rss/articles/CBMitAFBVV95cUxPRGtpa1Q1b2VCdHJlRzgydGVuQ2VCMlB5WTBZaHlyUW1OaThUbTdIUzRlUzBmbi1raXA3a0J1MS1jZzZjQ3BaYVlyTElrc0ExcGRqb0pjSl9Xc0tQdDlaT1Q2NWVkT0FuV2k0T3cwNU5GNUxGVms1ZUI2bmFvNUtHMWUwQVJ5dXZna3JLWC1wazZzT0pBb1FGSENFV21OX1hRaWhPRG14dkl5QlhsTVVkNUh0YnA?oc=5
Iguatemi,Política e Institucional,Secretaria de Saúde de Iguatemi terá sala com tomógrafo para exames da população iguatemiense e de toda a região - A Gazeta News,A Gazeta News,"Wed, 06 May 2026 14:38:55 GMT",Secretaria de Saúde de Iguatemi terá sala com tomógrafo para exames da população iguatemiense e de toda a região  A Gazeta News,https://news.google.com/rss/articles/CBMi6wFBVV95cUxPSDJwNXY3N3BqQVBKS05PZExBaUtKLTVPT0pNRlZpeEZpWG1TVTUzZ28zcVN4NXpQbGc4VGQ1R2pHTmt3WmdpSkZfOUhhZ0FjNUlLN1hGcmFVRm1rcjhibEpzRzRzZXRMUW9JRzlZSFBJWnFjZEh3bVJ2eVgwTWdlbE1kaHlPQ0R5dmtIbHlSSm1ZRERKVmhJZDlXWXNFWWFMMjljaG9uTkplUmtNOEVWU1puZmoteV8yTmo5WGM0QkFWMkR4UEFSSVVfNUs4aGFMdjlBd1dGUk9HekNnTEs4d0JJTWRPZk84LTFZ?oc=5
Iguatemi,Política e Institucional,"Polícia Civil inaugura a 52ª Sala Lilás do MS, em Aparecida do Taboado - SINPOL-MS",SINPOL-MS,"Mon, 29 Sep 2025 07:00:00 GMT","Polícia Civil inaugura a 52ª Sala Lilás do MS, em Aparecida do Taboado  SINPOL-MS",https://news.google.com/rss/articles/CBMiqgFBVV95cUxQVGk0WEhNM0lmQzFrc2xiRWFROUFnUkM2aGI1cnFscXk5ZDJsclloM3lyQnhUS1E5RHBSRXJrTTY1S3VGZHVITno5Y2hHUVVjWEpURG1CWHRoUEtYNkhlcDJ2cTNCTF8zSFVfYXYxRU9udTZIY1BYTmtqOHJOZWUyYTd4aGZxdzV6NzFFU1RaWkhCekplb2ZvRFVxN3ViYzVYUWZzYVRmaTZnUQ?oc=5
Iguatemi,Política e Institucional,Dos 14 aos 24 anos: processo seletivo para jovem aprendiz tem 42 vagas - Primeira Página,Primeira Página,"Mon, 23 Feb 2026 08:00:00 GMT",Dos 14 aos 24 anos: processo seletivo para jovem aprendiz tem 42 vagas  Primeira Página,https://news.google.com/rss/articles/CBMivAFBVV95cUxNMksxWDJnSnR2dFJDYWlkZ1ZmMFEzSkl0YW1BNVV5N2Z2VEU5ZDdmVmFwX2tSeGJsai1IaVdDclNSYTQ2azhSem9hVWRsWFh1U29ydkVDZl83dkR4YXh6M0tOcjZtU0tOeWMzM1ZUVDl2YmZUdnRoYktmOTZHdEdLeHFEYTR1MFIzYmdvaHlIUmlMY1R3NFpWcFMtZzF5NGJtLUttZTJPcTVmXzVCU3pDMnljWFFtVVVoTW02cg?oc=5
Itaporã,Social e Cultura,A cidade universitária que atrai famílias em busca de tranquilidade - Correio Braziliense,Correio Braziliense,"Sun, 05 Oct 2025 07:00:00 GMT",A cidade universitária que atrai famílias em busca de tranquilidade  Correio Braziliense,https://news.google.com/rss/articles/CBMitAFBVV95cUxPelRpdjlNMmtZWUJ3SlJVODlkZlh6Z24tTEppc1Rfc2o2YWpUYUJSMDB1NTNpdkxURkpTQTZkZnM3RlFwZ3hfLXRPZ1IxTUotV3ZTaTNRbFhwcmczQ1UyczF2ejN6dnNRR0kxdXQzQmJodU13WEtNUlhKQUhLSVFOWHJSR3ltZXR6VmdWXzdOaUZTSlpmNkJjRWJKUE1udG9fbXEzTG93b0FhODNrWFl3XzA4REg?oc=5
Itaporã,Social e Cultura,Neno Razuk investe mais de R$ 5 milhões em emendas e transforma municípios de MS - Assembleia Legislativa de Mato Grosso do Sul -,Assembleia Legislativa de Mato Grosso do Sul -,"Wed, 09 Jul 2025 07:00:00 GMT",Neno Razuk investe mais de R$ 5 milhões em emendas e transforma municípios de MS  Assembleia Legislativa de Mato Grosso do Sul -,https://news.google.com/rss/articles/CBMiwwFBVV95cUxQVEZZaXFodnY4Q08zWnF2clpBaXppa1o2TzRqUzZ4bktxWXE4UTF3bWh2OW5LbTFHT1AzU043UHJuak83MWJWc3lQdjVuNDh3S3I4TWJJOEsxbnpFVk9CSGNodXNKdFlNUWVJOGF6VFdkX2ZGS1REM3lnVWk5QV9XckJLLXhkcDh1MlFkSVdqZmRTa2ctU283S2E1dEoxUXcwWGxJeV9QaDFfblJnTHI1RXJDbm1WNHF2MWVYTEVMWXpPQzA?oc=5
Itaporã,Social e Cultura,Projeto Artesania fomenta cultura e geração de renda no interior por meio do artesanato - fundacaodecultura.ms.gov.br,fundacaodecultura.ms.gov.br,"Fri, 30 Aug 2024 07:00:00 GMT",Projeto Artesania fomenta cultura e geração de renda no interior por meio do artesanato  fundacaodecultura.ms.gov.br,https://news.google.com/rss/articles/CBMixwFBVV95cUxPMS1CRmJSdnVlZS1ZMWtrd3R5ZDctSnhNVlFoeUlsQ1FXUGlYMW93cnhseVRlVTRwclVEQWVvZWZTTmlndEFHaVBLeGswdjMzRjF0NVl2eDMxeVd2Sl9jWVpDZlRmM1dXblZIdEpDbnoyb0RVa2d6aVNlQnRBdG4xSklkMkFBNzVERkNmcjRsQ2VaSDJINEE0emJXQUx3WE1kZWRyTEtscDZzZFlwZmFpeHM2S2lzTmw4d1hWSDBwalRyOXVzbHRj?oc=5
Itaporã,Social e Cultura,"Cine Sesi tem 2º maior público do ano em Bonito com 4,9 mil pessoas - Agência de Notícias da Indústria",Agência de Notícias da Indústria,"Tue, 25 Sep 2012 07:00:00 GMT","Cine Sesi tem 2º maior público do ano em Bonito com 4,9 mil pessoas  Agência de Notícias da Indústria",https://news.google.com/rss/articles/CBMi0gFBVV95cUxQNHRsNkdrcS1vTGxMOUFyR0d1UmtSc0ZNZ1FEN1ZhZHNSRzh0XzBsUml5MENpYVZ2RXcweFdEMHh2cFBZbEYxMU5iV1k5Z3B2cmlLU0QzRDZtbGVFWkpQcmwwb2UtaUZXMDRZTm5QUlNBOWJ0azBnV01zbjNvYmRWcHZKbkRYN2doRElyZHNRQUFjMlBiUDJERWRQN1ROOHZUVmExUkJLZm5HWmFDNHNMQ2xVdktYd25hZ0ZKbnBPTEV3REJIWFlSU3ZlVE0tM05pN3c?oc=5
Itaporã,Educação e Negócios,Coca-Cola FEMSA Brasil em parceria com Funtrab e Semadesc oferecem capacitação gratuita para empreendedoras no Estado - funtrab.ms.gov.br,funtrab.ms.gov.br,"Thu, 01 Aug 2024 07:00:00 GMT",Coca-Cola FEMSA Brasil em parceria com Funtrab e Semadesc oferecem capacitação gratuita para empreendedoras no Estado  funtrab.ms.gov.br,https://news.google.com/rss/articles/CBMi4gFBVV95cUxPOWU0NHVIcXQ5aUhUS2JISHFUVm1sT2dLa2U0bWpZbWN4Y1NRME9KVERRSUkxZkZnZXRpOHBXQzlZaWtLaXFLaFRuNEpJZTUxbWtUSWM5ZVktdTN6cVFWc3BpVHBUWE9xbjV5Y3lxcFEweUROd3Ywam1iN3JJdEZUUVpCT1JxSEtkeDNqeUFDckpLWkZLQWI1NGpOY3czT2xRalhrY2pxVEVxb1BXX0FBQTdxTjY2NjNWSVpZdmxyUEI3MFpqSXp2VUZ1VEpLQUlWTEN5eVZjV2IyWm5BOTNycEZB?oc=5
Itaporã,Educação e Negócios,Galeria: Casa do Trabalhador de Ribas do Rio Pardo recebe as orientações - funtrab.ms.gov.br,funtrab.ms.gov.br,"Thu, 19 Nov 2020 08:00:00 GMT",Galeria: Casa do Trabalhador de Ribas do Rio Pardo recebe as orientações  funtrab.ms.gov.br,https://news.google.com/rss/articles/CBMimgFBVV95cUxQMVpXc0ZLVmRLNGRFdlEycUxrak5ncGUzRHlIWkRpMEdZSUlETnFydFRFVFNaQTFPdEJfbWdxTjdSempPTDdrbTd4S1hXTHRUZWJhYjJwLWZQTWRhUnp2NlJLUGh2UmdOVHQ3MzdSUlloQkE0RjJicFFvMWJ5RlZTV0FVZzlPX0t0OEdVVVJnV0VSRTA0bS1YVHNn?oc=5
Itaporã,Política e Institucional,"Prefeito de Itaporã participa de encontro ""Progressistas em Movimento"" em João Pessoa - Prefeitura de Itaporã - MS",Prefeitura de Itaporã - MS,"Fri, 29 May 2026 00:46:42 GMT","Prefeito de Itaporã participa de encontro ""Progressistas em Movimento"" em João Pessoa  Prefeitura de Itaporã - MS",https://news.google.com/rss/articles/CBMivwFBVV95cUxOckZrRjh1YjJnWlg1c0t3anJaQWRONU5kZEZOMU1lQTBVd1BJWFBkMGZ3ZEFYa3NuTlRUaDlwNmw1MXpBN3hQNUdNTk16TXV1ZThDdDlXUFRwTEROMDYtRE1hWUgxUFAwOTFyQnFaS0lDZWlGblk2SkZackZEelpaRWwzNEx4UU5JX3hqVllHTzJfZV94VDVaZ3hmTzczM3A5aHMyVXQ5anBJR3pIdnNnczRwa2s5ZU9Sd3ZpR2xnTQ?oc=5
Itaporã,Política e Institucional,Senadora Soraya garante bicicletas elétricas e muda rotina de agentes de saúde em Itaporã - MS Todo dia,MS Todo dia,"Wed, 27 May 2026 17:02:03 GMT",Senadora Soraya garante bicicletas elétricas e muda rotina de agentes de saúde em Itaporã  MS Todo dia,https://news.google.com/rss/articles/CBMizgFBVV95cUxQTnVGYWZTX0NrUDZORGdNallXNi15QUQyUmpla0FKcmJVRnZORXpwWjZiRDdjT09haWdTMGxGaUlkSmZMeG00emwwSVg0eDdBRS02cGtEbzY4cFdyREV2blJWU0xqbFZvbHdvVFoyY2VpR0RMYTBGazN5X3UzaHZLdVlXTENLVE1iX3VhM0F1SjFYYUh0Vm82anAwNk9iYzF4VURaZzFxMXZ3eHNJOWJYZFRiZklhMmVab29KZUVIZ2xvdDZmSUJEOFlxOHRvdw?oc=5
Itaporã,Política e Institucional,"Com 5,8 mil casos e 12 mortes, três cidades de MS decretam emergência por chikungunya - Midiamax",Midiamax,"Fri, 17 Apr 2026 07:00:00 GMT","Com 5,8 mil casos e 12 mortes, três cidades de MS decretam emergência por chikungunya  Midiamax",https://news.google.com/rss/articles/CBMirwFBVV95cUxOcldaVHp0SlJlOTBXdHZySzYyUlNHRExwLVhkQ3ctcko5Y182bjNiV3JKaFVva2RMYjNMU095TlBYTndjQTlrbDdXd0s2ZzNKbFJKTmJIOUZoSDJ4dGczMi1UX01hdGluUGxJRG5ENTM4QVBXdWx5czRlQ3lIYkF3Q3FRc2ZzM2dTYXZBOG94SGw3OXd2MVMybnA2emNmaW5kYWtpdGl4N0hWeEl0M0p3?oc=5
Itaporã,Política e Institucional,Governo desapropria área para ampliar anel viário de Itaporã - Campo Grande News,Campo Grande News,"Tue, 10 Feb 2026 08:00:00 GMT",Governo desapropria área para ampliar anel viário de Itaporã  Campo Grande News,https://news.google.com/rss/articles/CBMivgFBVV95cUxQUy1mWGN4b0gxVjZHSGtkMm9Edm9XcWJZSkpwaFZRQ3RFaHJJWHNnY2k0eVR2TUVFOThWT2MzNy1MZnlmQXQ4WFRGYlVwOG94b3N4em80MXFHM3RTck9DdzRnQmJGc01yVEd1M2RmWGpZMnJacG9DdGs3RUpTaHZfa3JSZ2gzSUZ0bFh6MzVMcUFtWmRfM3c5M1RodHljY3JYakE2THAxWHpoZVluc1pjV3E2a0tNZ0M1T0Rma1lB0gG-AUFVX3lxTE5wRmdHWE9VUlM1QlNmdWV6LWwtaFNjVW9SaUhOOUszMXJnVHEwWDNsMTRBWFVmMF91cDBCVUdYaWViRFE3SG4wWl9nODgxc0k2RVQzdWx2OTZhZ04weWpUVkZtX0d4VGRQbjEyV0JSck90Z3hDN0ZvNkV0a1RRUU50UEk0aWJ2ajltOEdGaEVSTW43Sy1Pbk1DTy1Xb1VSLWgtUlZmQ1hPSzk4OVlKckt4UzluYk5uakplUlVZdlE?oc=5
Itaporã,Política e Institucional,Fraudes em licitações: secretário de Corumbá é preso em operação - G1,G1,"Thu, 23 Oct 2025 07:00:00 GMT",Fraudes em licitações: secretário de Corumbá é preso em operação  G1,https://news.google.com/rss/articles/CBMiywFBVV95cUxNRG12SHpvaTR6UnRpQ1BpTkFUOGk1aldJLVJCNjZxZnh5OHp1cTgzN0FITTNXOUFUMWVKdW0zSnJZYlc5Nlp4TWhlcjU5eGFLSHBXZ2FDelVieDg4bkM1a1dFeVoxMkM3X2ZDTUJJQmtUaHp2ekpCcGliWnVWbmREUWdLQTNqdFUwRk9RSkp2YkY2RUw0S1hvbUx6YkMxRDNVRkFTSnA4MnA3ZFNBajgwU0Z3Tl9GRDBwVEdGTE1WTnFIMjIxU05qRHp0b9IB2gFBVV95cUxQZWlpb2dHT09nQTBmNl93WkNsWXNnRUN3ZVZkSE5uR0tTOXp1TnNSQ1EwRi1DYVJHVnZYSWNTSGFhSFE3SkMwN1VJXzFjMDJqb3NWRnF0ZmNQTElpaEpIS25SRU1PRVA2OFRzbWRTUVozck0wWUxCOXIwVF8wdkxTWHcxcHAxUHRlRFNVd21GR2pJRVFOVVpFLVY5LU8tZDlBdXR5RTMwV0xtY3RGdmZqVkliWHc0NXJkQkpNa3dyZ1YxYWtBem1JaG8zR2VSMURJNDlDc0J5RDF5QQ?oc=5
Itaquiraí,Social e Cultura,Festival de Dança Coreografada da Melhor Idade define campeões - fundesporte.ms.gov.br,fundesporte.ms.gov.br,"Fri, 05 Dec 2025 08:00:00 GMT",Festival de Dança Coreografada da Melhor Idade define campeões  fundesporte.ms.gov.br,https://news.google.com/rss/articles/CBMingFBVV95cUxOejF5QU42UU41bFdMVmxDbDBBbDNSMFVkSTZYRHcxb3ZDVGF1OUw2NmN6ZEFQN1g0MkFyN251VjV1Mi1ldW81SHN5VnFYZnhEVDhNT2tzdnZpT3F5VGFMVnhSSEl2bVNfc1FCRkE3SUtlbVFwbW82WUp5MFM4d3JlSTJ6dUlxaGNLMWR2Ry1fMW5DMHVMa3dRMHhXeGVHUQ?oc=5
Itaquiraí,Social e Cultura,Neno Razuk investe mais de R$ 5 milhões em emendas e transforma municípios de MS - Assembleia Legislativa de Mato Grosso do Sul -,Assembleia Legislativa de Mato Grosso do Sul -,"Wed, 09 Jul 2025 07:00:00 GMT",Neno Razuk investe mais de R$ 5 milhões em emendas e transforma municípios de MS  Assembleia Legislativa de Mato Grosso do Sul -,https://news.google.com/rss/articles/CBMiwwFBVV95cUxQVEZZaXFodnY4Q08zWnF2clpBaXppa1o2TzRqUzZ4bktxWXE4UTF3bWh2OW5LbTFHT1AzU043UHJuak83MWJWc3lQdjVuNDh3S3I4TWJJOEsxbnpFVk9CSGNodXNKdFlNUWVJOGF6VFdkX2ZGS1REM3lnVWk5QV9XckJLLXhkcDh1MlFkSVdqZmRTa2ctU283S2E1dEoxUXcwWGxJeV9QaDFfblJnTHI1RXJDbm1WNHF2MWVYTEVMWXpPQzA?oc=5
Itaquiraí,Social e Cultura,"Cine Sesi tem 2º maior público do ano em Bonito com 4,9 mil pessoas - Agência de Notícias da Indústria",Agência de Notícias da Indústria,"Tue, 25 Sep 2012 07:00:00 GMT","Cine Sesi tem 2º maior público do ano em Bonito com 4,9 mil pessoas  Agência de Notícias da Indústria",https://news.google.com/rss/articles/CBMi0gFBVV95cUxQNHRsNkdrcS1vTGxMOUFyR0d1UmtSc0ZNZ1FEN1ZhZHNSRzh0XzBsUml5MENpYVZ2RXcweFdEMHh2cFBZbEYxMU5iV1k5Z3B2cmlLU0QzRDZtbGVFWkpQcmwwb2UtaUZXMDRZTm5QUlNBOWJ0azBnV01zbjNvYmRWcHZKbkRYN2doRElyZHNRQUFjMlBiUDJERWRQN1ROOHZUVmExUkJLZm5HWmFDNHNMQ2xVdktYd25hZ0ZKbnBPTEV3REJIWFlSU3ZlVE0tM05pN3c?oc=5
Itaquiraí,Educação e Negócios,GIRO FUNTRAB DE NOTÍCIAS – 03/06/2025 a 16/06/2025 - funtrab.ms.gov.br,funtrab.ms.gov.br,"Tue, 03 Jun 2025 07:00:00 GMT",GIRO FUNTRAB DE NOTÍCIAS – 03/06/2025 a 16/06/2025  funtrab.ms.gov.br,https://news.google.com/rss/articles/CBMihgFBVV95cUxOdThvX3U3ay1qR2dRN04ydUZIM3JZRWVqWU53Yzc2NFlFSWVfbmFHRnlGRkpHbmRaUnNKUDB6SWlIaGZLZHViV0xvNW1QSlBfRVRORHFzMDRuMGlrbmhmZFpacFpLVWt6QzJTMThTMzlCV2hvYVF5eDE3WHhFeWw3RXBHamc2UQ?oc=5
Itaquiraí,Educação e Negócios,CCR MSVia está com 30 vagas de trabalho abertas em municípios de MS - Motiva Rodovias,Motiva Rodovias,"Fri, 01 Aug 2025 13:57:05 GMT",CCR MSVia está com 30 vagas de trabalho abertas em municípios de MS  Motiva Rodovias,https://news.google.com/rss/articles/CBMivwFBVV95cUxOd245czhPYXNyS0ZkMG03UzliYWlkeFFQRThicVNDQnRJZlZxOWo5eG5LM1ItTEJIbjRTTnF1MUEtSVc4MzVfY1JkcURsaDNiRzJkblVxUHhOUWlIS2wxX1ZCUmI5WGNtMlFnQVZadm1Pc05UUEE4X2tYN3Z3cXAwUERkWVdXNUhKU3RPVHEtRGdmWlI5WkV3Y3hST1NWUWlPX0RXU085VE5FNVAwcDNfdnA3Y1NUbDY3MHA3bXBpQQ?oc=5
Itaquiraí,Educação e Negócios,Quer trabalhar? Concessionárias de rodovias abrem vagas em vários estados - Estradas,Estradas,"Sat, 13 Jul 2024 07:00:00 GMT",Quer trabalhar? Concessionárias de rodovias abrem vagas em vários estados  Estradas,https://news.google.com/rss/articles/CBMingFBVV95cUxOLWZLVUhjTE04VnVqSS1QQ0t4bVV0WlVZNnlENU82NUZLQTBLYzZwcDUwUm84OHJEMFQ5RDNYZFhMZ08tVDdhMTh0bldHNmNUZlJSZFA1UlhkLURLeU1uTXdpMVVBNGlXcDJIbjhLUEp2YXVLUGxaRmVzdkpvRlU5cTc3Rk1NNGIxb05PSm90YnZiVVAtaG0wWHBza2dNUQ?oc=5
Itaquiraí,Educação e Negócios,Inscrições abertas para o curso de Vendedor - funtrab.ms.gov.br,funtrab.ms.gov.br,"Tue, 08 Mar 2022 08:00:00 GMT",Inscrições abertas para o curso de Vendedor  funtrab.ms.gov.br,https://news.google.com/rss/articles/CBMif0FVX3lxTE5SaWxVVmpyNWllbmJaeVlZVEE2Qm1YQ1E2MDBvekxlaWxVREl4dkNycU82MXFObDBGNWRyOEFLRnVZQUo4TlpnazNJQ2xGWHcwbDV1dF9tSlFHdGtoQlZ3WEIwcVhxMy1TbDhqbUl5OF9CTWxHVnpDdkxWZkRmX00?oc=5
Itaquiraí,Educação e Negócios,"Na Capital, EJA é ofertado em 16 escolas e na modalidade à distância; veja lista - Campo Grande News",Campo Grande News,"Tue, 19 Nov 2024 08:00:00 GMT","Na Capital, EJA é ofertado em 16 escolas e na modalidade à distância; veja lista  Campo Grande News",https://news.google.com/rss/articles/CBMi0AFBVV95cUxOV2phNVZMZGJ3M1RWSFF2LXpXemtIVXFrLUgyREttZ0RLNFQ5UjAzWThEeFBtUnhxakZmVkZNU1JHRS1vcmZuSm1pMGFuYzZrQ1gzUml6bnE1Y2xvRk1KdGxoYldNdkNYQjlEX0Zob3lCVUV1QVVKeHhMMUhNQk85QjVVV1ZYZlBfdTltUXBsUExfT0poZlZIUzNrMFJ0UFpCNGxxcVZMc2I5V056ZWJOM0JTQWhuNGZKOWZYOE1QMmdKSDEtNmhNRDdKVnUxb3Bi0gHQAUFVX3lxTE9KYUhwSmRaa0RrajQ2dmk2TW9aSGdOZ3djQk5Hb2xESXFscDI2S0UzNXprcXM5dkV5WmN3SnRYNTNhSWg3REt1ZzlkdWlUV2tLd1NnNVVOTmxNSVRUUkRaUGRZZ01nMEhLN3lPTFZ3N29sUkpHRmZYbXpYVFprcW1BSUJ2czBBTW5JZENqSE5CQzJMWEFMLU9OZFlJazQtWXBaeEkxR2Jxai1DcEFDMlNMbldUM1NIM3VxemV0OTJlOUtnbFk2RXRSNmkzLUhvTGs?oc=5
Itaquiraí,Política e Institucional,Riedel cumpre agenda em três cidades que fazem aniversário nesta quarta-feira - Midiamax,Midiamax,"Wed, 13 May 2026 07:00:00 GMT",Riedel cumpre agenda em três cidades que fazem aniversário nesta quarta-feira  Midiamax,https://news.google.com/rss/articles/CBMirgFBVV95cUxPSUdZSTd6MXg4YlVadHhlcjdxZFl0ZzJ5Zk5QS0RMNzNQVDcxRk1mczBWY0xuZC1OWmJGVTVwR3owVHVGZFJJdVlrVzVJMl9uSklBdjN2eWVnRGR6VXhOd3dzVXl1Z0M1NUx2RjdBN2JBc0x3YWNhekxmY2JBSnVQRFJ0cFBERS1SOTdOT2czSFQxTk81LWMwWW43TVZVemY3LWVielVDb196bENMOUE?oc=5
Itaquiraí,Política e Institucional,Sidrolândia (MS) receberá Mutirão de Documentação da Trabalhadora Rural — Incra - www.gov.br,www.gov.br,"Thu, 30 Oct 2025 07:00:00 GMT",Sidrolândia (MS) receberá Mutirão de Documentação da Trabalhadora Rural — Incra  www.gov.br,https://news.google.com/rss/articles/CBMiugFBVV95cUxPWE9DZU5XbDRCMHpBdEdoM09kOV9HTjZCUnZEdXV6MkJtOUdybWQ3M1llbnAwZDFMakZ6LVZLSHZkSTFtSEJRZGx4dnBleUZIWTFnV0NNeHlKOE5aU2xhZjd0ZmI4cVJlM21LSWJBWVJDTmVlUE9rTUxWT2ZRMG5INC16WmhGMWdhb1djLXpSUS1BczgwNTNPZUxMc19kTXUtNElYTldNaTkzbUQ3VndFN21DNkxrWXpfakE?oc=5
Itaquiraí,Política e Institucional,Indústria puxa geração de empregos em MS e cria mais de 2 mil vagas em março - agorams.com.br,agorams.com.br,"Wed, 13 May 2026 22:05:16 GMT",Indústria puxa geração de empregos em MS e cria mais de 2 mil vagas em março  agorams.com.br,https://news.google.com/rss/articles/CBMipwFBVV95cUxQUTNhUk80aWRDTmxEaF96TEZkYlhiUjJYcnlEMnhfNjNZekNDWXF3UkFEN1oyaDBTbGJSQ2JaNlkxWWxFTHVlMFJ4bmI1M3JNdGRhdHB6TWcxRXplOVdIamlBbENJYjBxLUtJX0pHUmM0RlA0WEtrUXdzSFdhMkZodG0tZ3cyU1p2WmlPaHQ2SW1ielo5OHJGR0VMQmp4bVFPb2ItTnpJYw?oc=5
Itaquiraí,Política e Institucional,SED anuncia 30 finalistas do Prêmio Escolas Destaque 2025 do Programa MS Alfabetiza - sed.ms.gov.br,sed.ms.gov.br,"Wed, 03 Sep 2025 07:00:00 GMT",SED anuncia 30 finalistas do Prêmio Escolas Destaque 2025 do Programa MS Alfabetiza  sed.ms.gov.br,https://news.google.com/rss/articles/CBMirwFBVV95cUxOa3dVRG5tNVVwYWRqeU04NmhZZzNXR0RPeVhrQ3NyTzdVUHlFQ09LWGttTC1LdmxSZzZLMVZlRFRfUzREeW96bzllMTRmdTkzcXZ1cE5pejl4aHpMdEY5SVFBX0xSX0JNV3FoSFVyb0pjcGsweTM2VGRCOEJkM1RXc0JteXl4amNuRk84d3dhUkh6VFZsZ2E4THdMQmtYN1Q2RkRWRTFIbEpva3VhYkNZ?oc=5
Itaquiraí,Política e Institucional,Assentadas de Itaquiraí (MS) recebem créditos e CCUs durante mutirão de documentação — Incra - www.gov.br,www.gov.br,"Fri, 05 Sep 2025 07:00:00 GMT",Assentadas de Itaquiraí (MS) recebem créditos e CCUs durante mutirão de documentação — Incra  www.gov.br,https://news.google.com/rss/articles/CBMiywFBVV95cUxORnA2clExMWJKRmtrRlNiX0d2Z3hkc3o1TTBfeEMwTVZ1NlB3WWpyd29pNWdkaEdRLVNGUTkxdlRjWnp6NEMtQTR5SEtFTXBDU2lPQmhtRVFFQ3k1WWVZUl9jRk10QXlTa281cmptMHdFVTBabVRKTnpqZ015ZkIxdlBTQk56YUZmWDY2cm8zdVJIVVkxQWhFOHNBVzlMQWpXSXhWdzZNOGhzZVdGQ2RCTHh4aHZpSEhWZkRYaXRjX0p5MERsM2FlRlR4SQ?oc=5
Ivinhema,Social e Cultura,"Agendão: fim de semana vem com Ney Matogrosso, Som da Concha, chegada do Papai Noel, exposições e shows no interior – Agência de Noticias do Governo de Mato Grosso do Sul - agenciadenoticias.ms.gov.br",agenciadenoticias.ms.gov.br,"Fri, 08 Nov 2024 08:00:00 GMT","Agendão: fim de semana vem com Ney Matogrosso, Som da Concha, chegada do Papai Noel, exposições e shows no interior – Agência de Noticias do Governo de Mato Grosso do Sul  agenciadenoticias.ms.gov.br",https://news.google.com/rss/articles/CBMi4gFBVV95cUxNWjJlZndzNnowYThwRDRlX2xxemVnR19LRUtXSExmYXJkTFRGdm5vWExEWHhYV01qYXlQanpaTmdIUTk0bTJLRTh2VWY1d04weUVMRjBXOFkzeU1jbUpqcWlzODNsbVp0SkdsMFMxUEtQVUVaN2dyQnoxbzlYWld6NWpVemEtdmRSeWxBRTdJTS1iQ1FMRXd5clBkMXAtYjBsNUVKSGRqODBhQ05pYjZVZGFrNW5XMXhwRVV5VTl0UU45OF9EaDMxWnYxa0pYcnBpbGVBOWRMOF81YkI5bV9PMkRn?oc=5
Ivinhema,Educação e Negócios,Bioenergia: rodada de empregabilidade oferece mais de 630 vagas em 15 municípios de MS - agenciadenoticias.ms.gov.br,agenciadenoticias.ms.gov.br,"Tue, 14 Oct 2025 07:00:00 GMT",Bioenergia: rodada de empregabilidade oferece mais de 630 vagas em 15 municípios de MS  agenciadenoticias.ms.gov.br,https://news.google.com/rss/articles/CBMivwFBVV95cUxQcW5JeHRPc3ZJb3hTWklBWFEwSDYxN2pvZmllZ2NTVURiMnhIWDdUUnQ1ZDF4X3BQd2xsOG44NVY2Q3FHRUd0N0dYNUdiajRuanBBMTBCcW92ZnNJNjRBS2VCRWRadmRoUUV5TUJhY1JFUlZfb21yNkhYZXZLVnUzTVgzV0lFZnN5RWt4Vl9YUjNrZkZHeVppNDJraWtBYWZnWmtBU2R4TThoWXJ5VzVubEwtN1lyUWRrYjl4RjVaTQ?oc=5
Ivinhema,Educação e Negócios,GIRO FUNTRAB DE NOTÍCIAS – 03/06/2025 a 16/06/2025 - funtrab.ms.gov.br,funtrab.ms.gov.br,"Tue, 03 Jun 2025 07:00:00 GMT",GIRO FUNTRAB DE NOTÍCIAS – 03/06/2025 a 16/06/2025  funtrab.ms.gov.br,https://news.google.com/rss/articles/CBMihgFBVV95cUxOdThvX3U3ay1qR2dRN04ydUZIM3JZRWVqWU53Yzc2NFlFSWVfbmFHRnlGRkpHbmRaUnNKUDB6SWlIaGZLZHViV0xvNW1QSlBfRVRORHFzMDRuMGlrbmhmZFpacFpLVWt6QzJTMThTMzlCV2hvYVF5eDE3WHhFeWw3RXBHamc2UQ?oc=5
Ivinhema,Educação e Negócios,Setor de bioenergia oferece 630 vagas de emprego em 15 cidades de MS - - Folha de Campo Grande -,Folha de Campo Grande -,"Tue, 14 Oct 2025 07:00:00 GMT",Setor de bioenergia oferece 630 vagas de emprego em 15 cidades de MS -  Folha de Campo Grande -,https://news.google.com/rss/articles/CBMiogFBVV95cUxQdHNHdVlJZjllaHpSQkpIOThIS0V3cHlXRmFMa1RGWEVWdHJ0Yk9Fa0hIRzJyaTRRUHEtZEJsOFpRSDZVMXpZSUdSNnBvNk5zVzNOeVdLU3RBWklWUktRSm13TGRUMW12STdjYVIwZkpYVEk3eko1U1RTMllqVFdpdk14YjhOTUctOVhud2p3cW45UDFRWE5jY0tNdm11UW9TWEE?oc=5
Ivinhema,Educação e Negócios,SENAR Abre inscrições para Curso Técnico em Agronegócio EAD: Sua Carreira no Agro Começa Aqui! - PEBSP,PEBSP,"Sun, 12 Jan 2025 08:00:00 GMT",SENAR Abre inscrições para Curso Técnico em Agronegócio EAD: Sua Carreira no Agro Começa Aqui!  PEBSP,https://news.google.com/rss/articles/CBMitgFBVV95cUxNb18yMjB6TERQdHZqLXdXcW5icnNrUzAyX2YwOW5LOXFJSXJWYl93Z1VsM3VpR0hpMmtvaTZaYVlBbXQxak5RalctOTJMMDRNd1BwNW1qaFVwN2lJSjZSRWVpZVlZWUJqUnVjY2JyWTgxQUlBVXJiQ1daaUtLTlkzbTR1clM4X2wzNG5LSF9TWWhyam9FVVNqWXduQjhua0FzQTVnbHFzLWVjRXREc2c2dUQ2d0drUQ?oc=5
Ivinhema,Educação e Negócios,Corpo de Bombeiros divulga novo resultado da seleção para bombeiros temporários - Midiamax,Midiamax,"Fri, 17 Oct 2025 07:00:00 GMT",Corpo de Bombeiros divulga novo resultado da seleção para bombeiros temporários  Midiamax,https://news.google.com/rss/articles/CBMiwwFBVV95cUxOZHdRQVgzaklJd20tdFM1cUFkNFc5ZVR0TnZ3NTBqUGlwNXhJT1F0c0ZRQnBUMFFvaTVSNXRZODBwaDl4ZmxLVm1nbUhoNUwyeUZBYVExVkliUE54NU93S25Bc3gzeWNxcDhUMFBqcUdlUjNZMTRVMVBtMWdraFNNTkZCNGZQYTJLY3g1bzJDZWRHaVA2dXNwQlIydGhRdmFlY1pxYkYxQy15UmhGSHBqLThraW5zc2hvNC02cmZfdXgyN00?oc=5
