municipio,titulo,fonte,data,resumo,link
Bela Vista,"Bela Vista pagará até R$ 1,4 milhão por ponte de concreto sobre o Rio Piripucu - Midiamax",Midiamax,"Sun, 15 Mar 2026 13:42:00 GMT","Bela Vista pagará até R$ 1,4 milhão por ponte de concreto sobre o Rio Piripucu  Midiamax",https://news.google.com/rss/articles/CBMitAFBVV95cUxOODhNdjhCS2lRWnRrWEZvUlY4b3lLR0JOa0dhd0RKLVRtT3E5TXBlcUItZVdKUGdEdWJuSHg1bVZBWTBXMTdWazI0OEIzV1RJSDFyT0dycE1qdF96Z0JFa0o5d19IdTlpWFgtQmhsWk9PM0hTeUJmdzRFVzJxM1hVbG1DT2E3WWRQb0lJeGdpbEpoejNlcjA1MjNvMTU5Z0praVdNQXhESzRNV1ZKaW9FR3pmRF8?oc=5
Bela Vista,Jogos Abertos de MS 2026: Corumbá e Ladário fecham as etapas regionais em setembro - Capital do Pantanal,Capital do Pantanal,"Fri, 13 Mar 2026 10:55:00 GMT",Jogos Abertos de MS 2026: Corumbá e Ladário fecham as etapas regionais em setembro  Capital do Pantanal,https://news.google.com/rss/articles/CBMi1wFBVV95cUxOVXNHbWtBTXV1OHd0S1lJLVV4alVVbGt2SFNpLWdXTC1LaFN6UUJIemFtWUlHdEl4NTNocXR5WUctZnlvdGE5Ym11MVJTdUhLellNMXBqQTJ1Qnh5SzVpaEtBb0hWdU5wMjdZU1JDWUF3azdUOGtILWExT0o2TzRlWGxqdWRFbk5va1pJTExyRTdzQkVPTEZkT015TnNTZWJITmNWTEVGWlRzNUppUkpYN254VUUzanRCMVB1R21xN1dKZFU0UTA0eDJPMUxrTGJfVXlZWmFKNA?oc=5
Bela Vista,MS conquista bronze no Brasileiro Sub-16 de Vôlei e atleta de Bela Vista será recebido com carreata - Fronteira News,Fronteira News,"Wed, 18 Mar 2026 19:06:04 GMT",MS conquista bronze no Brasileiro Sub-16 de Vôlei e atleta de Bela Vista será recebido com carreata  Fronteira News,https://news.google.com/rss/articles/CBMiwwFBVV95cUxQZ3N2Y29NS2xsUmFQS3FiX2N1a2xiNy1ZSkRjZG5mdmhpLWctbEUxWUk2Vmwxb2JmNDNtYkxaMXVjSGVydm1nUTVlUHF0UmtHR2tGRnhZSGZMbmVVang2N3o0WVktN2RRZWVCekNaMzFoeVV2WHBmeHRIa2RwNGRLcDd3Nk1KN0RZejdnejlZQ2lsOWFhSWZXeXMtcE1uaU90THplSy1qUTBmN21uU0x3X2s1MGFTWndNbFJ2NUVhZDNIcnM?oc=5
Brasilândia,Jogos Abertos de MS 2026 tem calendário definido com regionais em seis cidades - hojemais.com.br,hojemais.com.br,"Fri, 13 Mar 2026 13:13:00 GMT",Jogos Abertos de MS 2026 tem calendário definido com regionais em seis cidades  hojemais.com.br,https://news.google.com/rss/articles/CBMizwFBVV95cUxNRm1LWDNDWTBramFuS3NNZTlrWGVWRmV0a3BoN1BRRWs0Y0pGZGQtVTRHYUxQdGlKQ0l3LXc5M1JWVmdkN09hMDc3bFQwaHhtWGJ6MFlRdExXVjRvdUx5RjRjMkhFSHBhMXBxOGxPSEw5OU1qSXJhMnY3QW5FSDdRX3dzdFNzWnE2eEM1YURYV095V2RRcV9lTUVRdFAyMmtnNjBjLXpoZnloMF82bGVhVFktQnZiMGk4U2txc0h4VGgxZldUdC1mVWFQYjNEM0E?oc=5
Brasilândia,Prefeitura de Brasilândia-MS abre seleção para cadastro reserva - Ache Concursos,Ache Concursos,"Fri, 13 Mar 2026 14:42:00 GMT",Prefeitura de Brasilândia-MS abre seleção para cadastro reserva  Ache Concursos,https://news.google.com/rss/articles/CBMi2AFBVV95cUxPdjZ3YVNrRVkySmExczVrMWJDSldzRGNHNjFnN3JveDMydkZqblY2T0NoYUY4cU5CcXl2aDZ0UmFodm44ZF9ZNWtISTdNb3g2ZWU2Z0FpUjJaZjlYcDVNVWhqS3dLOFBTLVJzaDdrc05HZ2lXQl9yUFoyVjNIcGlxSGI2QmNEME9xWC1vSHV5dDNOZUtYc1BzU2w0N29zMUFqRGFuRV9fRUpjN3h0ZU5NZW1fY0tZcnFTaTRyVlZLbGp4eHFRX1hkXzVzcFhQaE1zOGdKMkRwU03SAd4BQVVfeXFMTjRNenduTWtrcFEyMWFTWl83OW5ZZVZpMGlBb2Q1am5KRlc3a3lxQlZ0WXN1ekxDX1dfSDFEcUFRbTNuNzA2MjQwblZYNnlvTFgxR2JDb2E4N092WnMtdEx5NVhiZDN2X1ZtUHVuYlA1VXdYTEw0R2hxaFpVUm1kWDRzbk9IdTgxVVItSVgxeTNVZnphV1VHNHZNaFhXRVdrOW11VWt6Y0IxSkZsNUtlNnh5TmJzSFVzcV9pWkdFbWdING9RLTktbnJCaXNVMktSa0NNMGJUQVZFRFJPVGF3?oc=5
Brasilândia,Seis cidades vão sediar fases regionais dos Jogos Abertos de MS 2026 entre abril e setembro - Idest,Idest,"Thu, 12 Mar 2026 13:32:00 GMT",Seis cidades vão sediar fases regionais dos Jogos Abertos de MS 2026 entre abril e setembro  Idest,https://news.google.com/rss/articles/CBMivAFBVV95cUxObHN3bWlCWmZwOGRYUkJzX3hCNVhQX1haZ2NNY200YVpOU1U4U0JHdmQwdG93N0t6Y0RqdVMwTVBDdVFZaTNUVUQ3cVhIRGZlQ3Uwcl9RYUFJUjNpQ3ZKTzA3NkFVS29KMWF1WmRRazdwVGZFelY4bGl0Vm9YdklFb3ZBVk5wYktCQ2NXU3VhVi12eFQtaTRhT0p2TldNcVYwZjFZN2xGZVU2VWU5WTA5c0lRdFhEdTA1OXJ6bA?oc=5
Brasilândia,Funtrab inaugura Casa do Trabalhador de Brasilândia e amplia acesso a emprego e qualificação profissional - funtrab.ms.gov.br,funtrab.ms.gov.br,"Mon, 19 Jan 2026 08:00:00 GMT",Funtrab inaugura Casa do Trabalhador de Brasilândia e amplia acesso a emprego e qualificação profissional  funtrab.ms.gov.br,https://news.google.com/rss/articles/CBMi0gFBVV95cUxNelFaZGVCS2lIVlZ6c3Nmb0NMMkoxVnpLOUoyeG1SOW1Dc2dMZ2lqcy1ZR1c3SHB1bWJnR0xTVWNOYUVVV012Y2h6UlgyYmJfNXRmekdBMmJtRXdvT2dOc1duTXhYb1FoSlY4aURPdGY2UXlWNURRb1JrdF9hUEtRM3NvZnBROWphQm1DcVBMRENVdkZrbmc2RmNvNHRENjI3aFhJY0pxLTZ6b0lwbE90YkY4d3FGU1R1YllBenpkMDJlYmdpSUFEN1dRVkdnakN2bUE?oc=5
Brasilândia,"Empresa seleciona projetos para apoio em Nova Andradina, Bataguassu e Brasilândia - Midiamax",Midiamax,"Thu, 15 Jan 2026 08:00:00 GMT","Empresa seleciona projetos para apoio em Nova Andradina, Bataguassu e Brasilândia  Midiamax",https://news.google.com/rss/articles/CBMirwFBVV95cUxPNmk4Sm1fVDVXLVNsT1FRT190NThtRjllQWtEajljdUVwaFNaazVNdmtPbThWSU5oNFhKSmJFdWJIRFBnMEVfeENLZk9mcDFCd1A4NV9zajVXUG5jRU5rbG1Ydl9qMHZMTFphY0ZLZ1gwTTRHSjBmM2s0Y09falVESVNaU3V4ZDF6dHhTb1IzczZRZUhmYWVvU2JXZy15akJhWXpQM2NLUU1qRlp1a0lJ?oc=5
Caarapó,"Agendão: música sertaneja, Museu do Videogame e feiras agitam o fim de semana - agenciadenoticias.ms.gov.br",agenciadenoticias.ms.gov.br,"Fri, 30 Jan 2026 08:00:00 GMT","Agendão: música sertaneja, Museu do Videogame e feiras agitam o fim de semana  agenciadenoticias.ms.gov.br",https://news.google.com/rss/articles/CBMisgFBVV95cUxNTmdvVkc4M2M5LTduazZKQ2lTMm9PYzAyc0trTnFNZElxSGltbS1BUEtiZG03UC1vWGwxd1Z1LXk5VmFpSzhJTlJ3cGtQS1lYZ1dmN09pQzlUcGlXbUJQVUxmRlhidk80dXBpOTJLT3RQVEFEcUFXZXhJVTlCUm40UDZIcVowaFY2UWRaRno3OGZhY3VYZ05iV3hQY2hKeFl4N190N2hnRkZHU0J5YnFFWnpB?oc=5
Caarapó,Só se tirar à força: deputado defende posse de fazenda em Caarapó - Campo Grande News,Campo Grande News,"Wed, 05 Nov 2025 08:00:00 GMT",Só se tirar à força: deputado defende posse de fazenda em Caarapó  Campo Grande News,https://news.google.com/rss/articles/CBMivAFBVV95cUxQNk9lb2VqZWUwXzdVZ2RhTnBSWDd3TDlsZWFkVnd3QWN1VEdtYzc5WmY4bVVPbWxxRmdVX3VESTRKWnNPa0FZU0htYUc4QzFKaVppdzRsdWp5SDh6R01wTTBTVk41cmh4Y2djaXNsUzhHTk1zWm4wMDQzVjY3SWJueGU5ZjZ2SjRqcnphd19UQm52cFo1bGdicjFoX3pFemlRNmpNM0szMlBIa29FNjRTZGNFd3dROUc5amk3btIBvAFBVV95cUxPeEVFSGtsNkVtaVdJWjRCS2l3a0tSNkFHeDVnVXNfdWY4YlBIMDBnaGdMQ1V0VHdrTXZhOFQzVndtYWZhaTV2R0U3QXJJYzFib0ctcnY0dWR0c20zTXljZ21kNThxcFpDMUJGXzZ2SFd3TWtEc1RoMV9HX18xRzNIVk9lSHlOMi1helRVaElPTWJhTWs5OWx5aFd3dmFXeFJObVk5WnY1cnBXRUtRVEtzNEsyWmN4cTVHOUJCeg?oc=5
Caarapó,Prefeitura de Caarapó - MS abre seleção para Auxiliar de Desenvolvimento Infantil - PCI Concursos,PCI Concursos,"Tue, 24 Feb 2026 08:00:00 GMT",Prefeitura de Caarapó - MS abre seleção para Auxiliar de Desenvolvimento Infantil  PCI Concursos,https://news.google.com/rss/articles/CBMivAFBVV95cUxPQVBETEpCcTkzNXYxdnlPcDBQREh4cGd5U2NadmxpLS05dENKR0pka3I4MTFvWXF3TkktT2NoMzEtemNwRkZRSHF6QzFIVEJ5dXpGZWVZTGFJVVR3dDZwT3FxNW1nUDFYS0VCUWMzMTQ1SGg5SnVySzkwM1ZFSUNUcGY2QnRfS1VyRG5JZlplQXkxQ3o4LVREbzV6eWVSeG1DOUY0MTdZQV9pYmV5Vk0wdUJieW9NTTdUYXZqSQ?oc=5
Caarapó,Prefeitura de Caarapó (MS) abre processo seletivo para Professor de Arte - Concursos no Brasil,Concursos no Brasil,"Wed, 18 Feb 2026 08:00:00 GMT",Prefeitura de Caarapó (MS) abre processo seletivo para Professor de Arte  Concursos no Brasil,https://news.google.com/rss/articles/CBMiwwFBVV95cUxPclRpQU5jeGJxNGkzVzhvV0h2ZDJ5WlFHWklNM0Rjb3lhSUpteGZTeFJVLTZTQUhLeDJaaDlEbmpxVnFlRXlhWnhVbF9VS2xicDFnTkFzQTBMRWJzLWdVTWpueU5WbHdUN0IwQ0tIZ0pqMmNRLVVXdXhPemowM2paRTI3ZGZ0QnBvU0xzM1F5NWpqMklGM1NwaHBVRDdob3A5NUZ5aWxwZXE0aUFKdENOTE1GbktzYmM3QkVoN2wtZHhUNUE?oc=5
Caarapó,Copa do Brasil sub-20: rival do São Paulo trocou de cidade duas vezes e estreia no torneio - ge,ge,"Tue, 21 Oct 2025 07:00:00 GMT",Copa do Brasil sub-20: rival do São Paulo trocou de cidade duas vezes e estreia no torneio  ge,https://news.google.com/rss/articles/CBMi_wFBVV95cUxPcnpfLTJ6OVljUlp2SWxLMTYyeHZsOXRPWnlYdDBpRkU3eFo1MTRNWndqeExVeUw4WWxkLXBqNmsyWEZzVGlrUDExbWRYYTZHUVc5TG1NcXhNd3Y3NlJNbVdWNDlwVGdMVy1IUEdQcTN6WHdEd3VuWDluWEFKTVdJYnVQdlZmSEhOUE8tN1B1NWgyNFJ1QkoxVFdpS1lDR1djclZBbGlhWXpRcjByRzk3MjJJYnFTdmxoUjBRUVFGMDl4OW9aWExENnJFbm0tS1U1Q2dYcHI5dGxRNkxRU2tpSW44Z2V0cG5MeXlfMjFvbDZwRFhYU3F5WWxhUkhkZ3fSAY4CQVVfeXFMT01GaV92TzJBaDFPQ1VDaXFMRnBfdHBfWnQtbU5PbVVGR3k3eGJOX3l1akRWZnhUN1BhQzlkZGVVbEFrVDJMMnVpc3UwQ2VaazZPSDVtWU9pYXdEcVFnNlJucEVfWDV5dUltcFYycEdSSXYtV29haWJsX3l2dTREQWZOM0RmM2RzTzZJa0FsQVE2LWtLcUtFdmhhQkwtcnZIZHc1SXVITGRBOWZtaEo4enJPV0tqYkQzRmRFVUF4QWF2aWVSclJlNE5sM1k3NHREV3ZxOTVjbWc1TjFaYWhOOXlXaDEzLVBSbmdaeUdEQ0xCdk1WY1RIWkNHRHVkLUlhaEIwMmVKN281cWhZdEJR?oc=5
Cassilândia,Fotogaleria: veja os cassilandenses que se destacaram na etapa de abertura do Motocross e os resultados - Cassilândia Notícias,Cassilândia Notícias,"Mon, 09 Mar 2026 18:24:00 GMT",Fotogaleria: veja os cassilandenses que se destacaram na etapa de abertura do Motocross e os resultados  Cassilândia Notícias,https://news.google.com/rss/articles/CBMi6AFBVV95cUxPdld3dm5uNld4TjdjQU1ZZzl2Y21RQTc2cVFjZ2lTVlItUWpVcFBFNWpsQlhxUDM3dXRxaWQxUzF3cVZEUG9mcFBRMVFtVlpDc3NLUFpORjdfblF3NTRpcms1UTV4ZFZXZEZtN0V4Ukd5QXBneDQ3UjRuQUNFVEM5WWxQcENtaWFtOEhCNkI0T3FMaG83TGxmYll2Q3AzNEVOTHlhRTVrMXNPdmVldEpXdEZobHB1eHlQMklyZFlBMVNjWVNkWVlBMUkzQmVqUk02TEkxems5LVJGakRFc01SLVhkTW1pUzdy0gHoAUFVX3lxTE56LW5NZjZ2VzVVNnV0RDNrVExEOTVOR1doUGtiWThpMkVjN1VZUVdFYUxXMFdGNVlld0doSkdVZy1ob0lULXh6Sk5kS0JpeENPV24zYXI5eHNvOGpGTzhJTTU0LTNQd0lwTXBIZVNTSG1JbUZQcHotdWdoYmlnMGtHU2VUN0dydzVEN1ZTNzk3MklhdV9NcDdISWdxLWFCejZoc1BVX05UU0ZlU0c2a0ZyUmRWSVNlZ2ZjSW9VdUxqR29Hb2dCWVRjd0REWGZyVy1RdzZBZXpkSE9SeXJmN2dRQWZWOTExdE0?oc=5
Cassilândia,Lideranças da Costa Leste se reúnem em Cassilândia para discutir desenvolvimento regional - ms.agenciasebrae.com.br,ms.agenciasebrae.com.br,"Tue, 16 Dec 2025 08:00:00 GMT",Lideranças da Costa Leste se reúnem em Cassilândia para discutir desenvolvimento regional  ms.agenciasebrae.com.br,https://news.google.com/rss/articles/CBMi3AFBVV95cUxObXJoTzY3NzBoWEpCYkFBdE5mbm9mcDRoNzJFX2t2Z2E1OXFfWHltRDhmYjJsaHhNd1pKdUp0X2hLMTBIcWdDczIyVXhldVlPMU1qdkdHV0pyb1NQeU9VMDR0VkJYdUF1djJ4Zi1jcUk2M3l3TDBzX0RMTm4ycUtfaTNIYjhoTzNzVjVDT1ZHenhhYnlKYVZ5LXR3WGMxNXBZR3l2WGNIZTFueWdHLWhZdW4yblRJdHl4WEZ2Rl9aSHJLdmsxOHdqMTJSd3FndFBYZGM4OUdoN0lFVXRT?oc=5
Cassilândia,Dias 07 e 08 de março: Cassilândia recebe a abertura do Estadual de Motocross 2026 - Jovem Sul News,Jovem Sul News,"Thu, 19 Feb 2026 08:00:00 GMT",Dias 07 e 08 de março: Cassilândia recebe a abertura do Estadual de Motocross 2026  Jovem Sul News,https://news.google.com/rss/articles/CBMiuwFBVV95cUxPcmdOWTQ5R0p6THRPVTJqV3U5aVBPOUo5MnZJOGh6RjU4c092SHV3bTN5OUFJcTg3b2VFUTRZZXllRWE1MkZCT1NyTTNPSnJxa0Z3aTlKYXpkanNTank0QnR0YUNGdEJiZnd4U3RIUktLQ3BvVXAwRE93UEx4SUZabnE0Z0dtSmVrUmpYTndHT2ZHYUdFcVdCVnI4ZGFoSGtOU1hqWmNodFp6NFVfbE90eXBwSzNXbXZIY2lV?oc=5
Cassilândia,"Cassilândia recebe a Final do Campeonato MS de Motocross 2025, neste sábado (6) - MS Todo dia",MS Todo dia,"Tue, 02 Dec 2025 08:00:00 GMT","Cassilândia recebe a Final do Campeonato MS de Motocross 2025, neste sábado (6)  MS Todo dia",https://news.google.com/rss/articles/CBMivgFBVV95cUxPTTJWck9VdDRYVVVYcnIyVHQ3aVZZR214SHN6OE04Z1BUc21qcExoOUNDSDE2eXpubUtDOFh2dXAwSWx0SUpYMkJMQl9WMDNWeF9sY3VzLUtUYmwtTC1Ddk1hT0RGYTJLTjNUaDFtWTN2UWhtc2haaW5HX0xNUTUzeDZvSWxqMFRuRGNjVno3S1hyUHF0S3BYRzRrZlBUVXg3YjZYRFVNczVtWmVGN0NTTU5BSjZISE1tSDZ3ZDZ3?oc=5
Cassilândia,Praça São José vira palco de festa e cultura durante etapa do Estadual de Motocross em Cassilândia - Rede Jota FM,Rede Jota FM,"Wed, 25 Feb 2026 08:00:00 GMT",Praça São José vira palco de festa e cultura durante etapa do Estadual de Motocross em Cassilândia  Rede Jota FM,https://news.google.com/rss/articles/CBMivAFBVV95cUxNS0c2cHV4T1lDemMtemF1Q3FNcWtxT3p4V3ZUOV9LbHpCUTM3c2wyMFh6NEJSNHF1UXJHNXhXcUZkeVJhcWxQUFY2NnhBQkhuRjZKSWU4d29KSVI4VUJ0VWFfcTU4cTFDbVlRZUdNMzh5UVVSWkpLSk5lNWJLUGU5WWl1WldPYmtsTzBqeVYzR2tMUk9Gczl6Y0pSNTZnWDNnMFRjRG9hMmI4QUhXblBLdDFXc2tXV2I5UGM0RA?oc=5
Chapadão do Sul,Governo de MS impulsiona o agro com inovação e investimentos na abertura da 28ª TecnoAgro em Chapadão do Sul - agenciadenoticias.ms.gov.br,agenciadenoticias.ms.gov.br,"Tue, 17 Mar 2026 20:37:00 GMT",Governo de MS impulsiona o agro com inovação e investimentos na abertura da 28ª TecnoAgro em Chapadão do Sul  agenciadenoticias.ms.gov.br,https://news.google.com/rss/articles/CBMi3gFBVV95cUxOQmNUN1lIWFdSR0tTY0ItZjBXMEtYN1dWbWRTWld0a2FXWWYyU05XR3VfeGRwZ08tTUtuOXlkWGNRZXFrcFZLTU4xeTFOVkUtNlZBTW1sV0diVkZzYUVqZG0wbU5ENGxPek5KdXU3SGdkMFZwd2N3VDJxcHI5N1dhNEZNUGMybWwzVC1keVo4ZVZ5NHVJMnBlTGNHanFtRlBmQVBfeFpLMnRNUUxIbHc5ZF9jaDZnOG44dlRFSnpBOHozUWxUTTRiOFlidWU3YUF2ZDZGZ1BEWHR5S2NrZUE?oc=5
Chapadão do Sul,Rodada de negócios na TecnoAgro 2026 projeta quase R$ 6 milhões em Chapadão do Sul - ms.agenciasebrae.com.br,ms.agenciasebrae.com.br,"Wed, 18 Mar 2026 14:53:01 GMT",Rodada de negócios na TecnoAgro 2026 projeta quase R$ 6 milhões em Chapadão do Sul  ms.agenciasebrae.com.br,https://news.google.com/rss/articles/CBMi0gFBVV95cUxQQkVILUhuck1HZkptdU9Qekh5dW9kRS1ydHBTZzNUQ2JKMEhvUVFNVjltOUdMekdJYng3bm11azNYRVQ5OW9QbU83ODUxblEtaG93X2o1aDVKcXAxY3I5QUFfNzktMElXb1Awbk1qOG5rTnVVVlJ4QVlGYjZIeVVFeFh2WkxJYjBhNFBnaXhoWXhtbTdiUl9fOU1YWmxxc1YzNDhiWllXSVFYWDFvRXV0RUszMTRfaGx0SWxsN084Rm15dUFmVElQZVFRcWpCWEhyYWc?oc=5
Chapadão do Sul,Tecnologia no campo impulsiona produtividade e posiciona MS entre os estados mais avançados do agro - semadesc.ms.gov.br,semadesc.ms.gov.br,"Tue, 17 Mar 2026 19:18:55 GMT",Tecnologia no campo impulsiona produtividade e posiciona MS entre os estados mais avançados do agro  semadesc.ms.gov.br,https://news.google.com/rss/articles/CBMiywFBVV95cUxQeVU3b1hYYi00STJKc3g4WDVDYVRvcndtSHZjcXRMTC1CYWMxX3Z3d3M0aVh4RGoxbkpDaHJxRF9FSUNWMmpFX3h5cWlVQU8yeXl1QXUxQVpudjhiSWF2UkRhcW53MlBsbmpkUXlKNW82UENyRlhGSmk0eVhzcTNMQ0ZucUMxZnBJbURVQ2M5M3FrbGV1Nk9qNTJrekdoTTV4R0thNUNCUnd5NXQ3QXpJb3gwQkhBNEh2MXdEdHBJQmw5dVU4bUktZFlCdw?oc=5
Chapadão do Sul,"Mato Grosso do Sul investe R$ 2,7 milhões e reforça protagonismo do agro na TecnoAgro - capitalnews.com.br",capitalnews.com.br,"Wed, 18 Mar 2026 19:25:00 GMT","Mato Grosso do Sul investe R$ 2,7 milhões e reforça protagonismo do agro na TecnoAgro  capitalnews.com.br",https://news.google.com/rss/articles/CBMi4gFBVV95cUxQaV91ZDhLR21ZMmZuMVJ2N09aak1GVzRzTFRjYk1TY1lKanNRaUJQVTlGNnNCXzFZUDVPWllfbmVUTWlTa1dMeHhNRXY4MjRCYXVJWXdKVXJFdDZTTHZoWDdCTGJPckxoMVE4WHRJRzcxT25qVFB6cjUwdFBDRFMxQnpveS0tRm9UckpHM1pKSDMzV1ZzQ3IyRDNXcURSU091QkJlOEQxT2ZlQUs3eGtGemdCWExVa2ZPQVRiX01leWlzUDhEYTR3WkFNMEI0RWg3NUtmVVVBcGRxY3dPOXc3elZn?oc=5
Chapadão do Sul,Capitão Contar marca presença na Tecnoagro em Chapadão do Sul e reforça apoio ao agronegócio - Jovem Sul News,Jovem Sul News,"Wed, 18 Mar 2026 22:10:28 GMT",Capitão Contar marca presença na Tecnoagro em Chapadão do Sul e reforça apoio ao agronegócio  Jovem Sul News,https://news.google.com/rss/articles/CBMiygFBVV95cUxNcHJUUGU0U29NX3VRNFA4TThrYVFlcU9BQ1MyZlNtdUdNZ2IzQ2dKWC1aUDFBY21fejhSZkJkSGdpOUR1dWQ2am9KNWpKaE1Ka0F4dWtyTVVPNlBjVTJfQnVCb2RoMzhScTJWZ3B4bUozc0ZPcjZDUmFkR3pSVEVnd0liOXNRTjRjbGc0TFYtcHA3WVJJMXdvN2swN2hMeWhBQjF6OFJLRTk0dEl1YXNLcWoyWnRnaU9ENDVfcnc1YWl4ZEtRY2JFdzd3?oc=5
Coronel Sapucaia,Projeto Circula MS vai levar apresentações culturais a cidades do interior - fundacaodecultura.ms.gov.br,fundacaodecultura.ms.gov.br,"Thu, 05 Mar 2026 18:53:24 GMT",Projeto Circula MS vai levar apresentações culturais a cidades do interior  fundacaodecultura.ms.gov.br,https://news.google.com/rss/articles/CBMitgFBVV95cUxNQzFGZHVXVVlMNm9kT0RVb09LdU9fZ294Z2txZ0dIQWtLYkdwUFVKbWdCVE9FM29VLV9PVXl4Ynk4OEZuZVIyNW1KckVrWlc2OHp1cldvXzBEUzZ2a1RrX0xTdXpsRUhfenFSNG54UlFLTWtSWFM4X3ltYkF6VWZvcFZ3cnVMMnM0Wmp0UVFIU0psT1Bna19VcExBMjBUQ3JPUjVreDJpa1UxdlFVVExfSE8yaDJsdw?oc=5
Coronel Sapucaia,Seis cidades vão sediar fases regionais dos Jogos Abertos de MS 2026 entre abril e setembro - Idest,Idest,"Thu, 12 Mar 2026 13:32:00 GMT",Seis cidades vão sediar fases regionais dos Jogos Abertos de MS 2026 entre abril e setembro  Idest,https://news.google.com/rss/articles/CBMivAFBVV95cUxObHN3bWlCWmZwOGRYUkJzX3hCNVhQX1haZ2NNY200YVpOU1U4U0JHdmQwdG93N0t6Y0RqdVMwTVBDdVFZaTNUVUQ3cVhIRGZlQ3Uwcl9RYUFJUjNpQ3ZKTzA3NkFVS29KMWF1WmRRazdwVGZFelY4bGl0Vm9YdklFb3ZBVk5wYktCQ2NXU3VhVi12eFQtaTRhT0p2TldNcVYwZjFZN2xGZVU2VWU5WTA5c0lRdFhEdTA1OXJ6bA?oc=5
Coronel Sapucaia,"Em Coronel Sapucaia, modalidade de Xadrez é destaque em unidade escolar da REE - sed.ms.gov.br",sed.ms.gov.br,"Tue, 17 Jun 2025 07:00:00 GMT","Em Coronel Sapucaia, modalidade de Xadrez é destaque em unidade escolar da REE  sed.ms.gov.br",https://news.google.com/rss/articles/CBMipwFBVV95cUxQMVdXWnRCR0QwOVJ3cWVLZ180ODdlSXRjaUpfbXg0TElLc2tkbEw0aHZWOC1xN3VfaFViaFVNc05GdGlIMUl3US14dDl5b1NZdjQ5X3pmeTM0ZV9VSmU1d2RSOHAtTGc5V3dxNzVmX0M3ajh4cE40UmswRzJwQUh4cjliT3NEUzVTQkpXYnVlZVB4ZHRISGNLQTZsUzBHclZuWGxqSEVCWQ?oc=5
Coronel Sapucaia,"Governo de MS investe R$ 236,8 milhões na restauração de rodovias que ligam Tacuru e Eldorado - agenciadenoticias.ms.gov.br",agenciadenoticias.ms.gov.br,"Fri, 23 Jan 2026 08:00:00 GMT","Governo de MS investe R$ 236,8 milhões na restauração de rodovias que ligam Tacuru e Eldorado  agenciadenoticias.ms.gov.br",https://news.google.com/rss/articles/CBMixwFBVV95cUxNZHhLS3c0Zkh1YmhFR2psazZGdHhPejBvenpkU01WMkJkNHdHNDlGVnVwMGU0cFl1S0hub2hnNHhtTk56bkVwSmMxNWVyZnhBR0J3QUVZSE5HVzR1aV8yV1R6VEh0b2NuQUw0eV9DREZha1dZN0hfMEVLVFVCRVpjQzlzcWVaR0JRWDF6U0xpUFN4NGZlaExkOXRCcC02QUxCaFUxakMwR1Q4ZHJhWmh4bHR3UHJmVFc5RjlQek5naVlVUS1CaVFZ?oc=5
Coronel Sapucaia,Sicredi Centro-Sul MS/BA realiza segunda edição do Circuito de Negócios em Dourados - Sicredi,Sicredi,"Tue, 18 Nov 2025 21:38:12 GMT",Sicredi Centro-Sul MS/BA realiza segunda edição do Circuito de Negócios em Dourados  Sicredi,https://news.google.com/rss/articles/CBMingFBVV95cUxQQk0xUGloXzdpMWpaczBzSENKZWY4bmJpSU11OUxucEItTE8zdnhNZ1o3c0p3RlpUaEhRb0poZjhMMEdxVkFhSVZTWmtHTGI2dm5kNTJMOG82a0xxSFRuS3UyR25zcHZHbUpvTVRMRHAtQ05xclM2dmNHaklMaFZVNDdsSTh3QmhFSU1zYl9CWDJ3ajQwRGZMaEJXdFZHZw?oc=5
Deodápolis,"Ações de Zé Teixeira buscam melhorias para Dourados, Douradina e Deodápolis - Dourados News",Dourados News,"Fri, 13 Mar 2026 12:51:00 GMT","Ações de Zé Teixeira buscam melhorias para Dourados, Douradina e Deodápolis  Dourados News",https://news.google.com/rss/articles/CBMivwFBVV95cUxNT01idlhLUzZfV3Z2SkR4ek5lMUtCSjlSRVVUWmtuV0J0aHJzQVh0X2RqeDVtVVNkR2dQRnEtMkRWY1FsZHlXMkFmUVRJWGN5bmNiTnZxeVItUVM1WFk2UUtoSHUwTjhhaEVPOWRCTnlMTjVyb0ZWLWZHOVYyZ21seEZfQ2hET3MyNWFDdUVVT1hGVmpfd2YwOEUzM1prSlhJQURmdTdWQ3A5MGRqOVBTSHFYY0dULUFoSGtnNmNYONIBtwFBVV95cUxNcUh6a3FrY3JyT0xfSkJ6MGwzN0lZbzJJUnJfOWc5a2l4TUFnQWdVQ0xrb2E4cHF5RlRkZUlKcFVLbW92Rk5HN0VwZ0dGSlFrUGwyekhYclRyNXE3cl9GeHk4WkNKNzNhTnE3V1FpendyMWMwcXFfVFpYd0kyT015ZDJ6Mm5scWZNVDhydmpsTmdSWTNSMnU2ZmJIR0ZqOXl3UDNQWGlzWEF1S0wxejNFaWVUVEV0T2M?oc=5
Deodápolis,Entrega de obras em Deodápolis e Glória de Dourados reforça compromisso do Estado com os municípios - agenciadenoticias.ms.gov.br,agenciadenoticias.ms.gov.br,"Fri, 17 Oct 2025 07:00:00 GMT",Entrega de obras em Deodápolis e Glória de Dourados reforça compromisso do Estado com os municípios  agenciadenoticias.ms.gov.br,https://news.google.com/rss/articles/CBMi2wFBVV95cUxQY2J0a3ZRTVcyOWpyUi1kZlc1OGpNRW5nRWZGWkpNRHcwY3ZJOWpBalhfLTF1dU9MNkFMM1h3dFBFRTJUeWFIN0JuZUt2RkJVRXVFSWJObHI0OFQ1dXY2OTFnbGNxbEtOa3FtYUY3U05wOGJRcWdwM0IydjAwUXQwWjl4TktSZzg3dEZlWnRkQWJYUjkzZEttSWhJR1Q5QVhZZ3NmWkxzb2ZUbEJieS1FSTkwdUxwLXlmbTFzOVJoSXZSYmN6TURtTEZkVG00U2txQkxtMUQwMS1lYUU?oc=5
Deodápolis,Arena Frigomar Rodeio Festival começa nesta quinta-feira (12) - Rede Jota FM,Rede Jota FM,"Wed, 11 Mar 2026 14:38:29 GMT",Arena Frigomar Rodeio Festival começa nesta quinta-feira (12)  Rede Jota FM,https://news.google.com/rss/articles/CBMiqgFBVV95cUxQV0xUbnRidjRKTXFqQTFOa3RzcXRXVXhOQ3llVHBlczJIM3dxRmk4ZkpnenJTY1QyRzlFenJoTDI4Y19xbXNkYjhBRnlNeFRYdFBMeVR0WVF5cnhpNklqb2NycFJaa1ZTTGJpTDJPVFFFZHhIYUJjVVF6S2d2VDFoa2ZhcmEzSXJ4aDlvTW9FTzl4YlN6aFloM3NoUmVjNTM4c1U2RElWTWJ5Zw?oc=5
Deodápolis,Deodápolis vai pagar R$ 100 mil para banda do Paraná em show de virada - Midiamax,Midiamax,"Sun, 28 Dec 2025 08:00:00 GMT",Deodápolis vai pagar R$ 100 mil para banda do Paraná em show de virada  Midiamax,https://news.google.com/rss/articles/CBMirAFBVV95cUxNVVRwQkhGc1drUVlKbThCVHNOMkJ3U0tlNzRzMmNudHFnWENxM3hMdERkblBvbXNwSm5EeFBJOGNmUFlabm5CSG9DUU9VZ2huTTdwMnpOOVI3TkpVZ0RONUZXSjJhQUp0eUQ5emFMNGF1Y0NhNWg4eTlHeWYyUXBrTkNnU3NuRkMyU3hNbGlZNEphRWVQejVrTnFnRU4zcnJmclNadE16TUJZbi1u?oc=5
Deodápolis,"Inauguração de arenas de areia amplia esporte, lazer e convivência em Deodápolis - impactonews.com.br",impactonews.com.br,"Mon, 16 Feb 2026 08:00:00 GMT","Inauguração de arenas de areia amplia esporte, lazer e convivência em Deodápolis  impactonews.com.br",https://news.google.com/rss/articles/CBMiwgFBVV95cUxOZkpGcC14T1NwTmJ5Q043OUJrOUtHbUR1UE11aHhfNFpYX2NHeWRtY0ExdzFfV3lZblozZXBQdXd6aEJtTTFkUndVTnpwTEhIdUg0TjZzNi1ZSFp6ajJRR1NoNGtSQmdNaVB3S29SeGIwUnA0RDVPeklHTWlpYjlPcmFBUkNqRy1ENTZHS1FIeV81cFFlSkkybld2aExudVYxemJaZUhjRUs4VnFCVWdScUc0RkdCdnNfM1hvUDBfd1BRUQ?oc=5
Dois Irmãos do Buriti,"Jamilson Name garante mais de R$ 1,7 mi em emendas pagas para municípios de MS - Assembleia Legislativa de Mato Grosso do Sul -",Assembleia Legislativa de Mato Grosso do Sul -,"Fri, 24 Oct 2025 07:00:00 GMT","Jamilson Name garante mais de R$ 1,7 mi em emendas pagas para municípios de MS  Assembleia Legislativa de Mato Grosso do Sul -",https://news.google.com/rss/articles/CBMiwAFBVV95cUxPV1hwUF96XzdCNFpHOUhLZUx1Yk1vYVIwYUhrTjJRUVVCcExGVzFCRGg0MmlQNTFnejJYYm0yNmkxcHBsOUtodHNtYjczb0FLdVlsQTJOTWFzWkhaQ3ZYUDlwV1hnc0R0UkppTHVJbDh3YjgyS3Q5U1F6aVRjRkhDQXlBdjgtYmlLSDJVOUVDSE03Y01lVGtad1Jid1NVTXFkejZlVjhpZzR5ZHRRWWwyQ2dYd1B5bE9pbk44VFRRZ2o?oc=5
Dois Irmãos do Buriti,"Dois Irmãos do Buriti celebra 38 anos com festa, cultura e muita música - buritinews.com.br",buritinews.com.br,"Thu, 06 Nov 2025 08:00:00 GMT","Dois Irmãos do Buriti celebra 38 anos com festa, cultura e muita música  buritinews.com.br",https://news.google.com/rss/articles/CBMirwFBVV95cUxNR0lPMW1qamlIaGtNUU1yREl5Y1E2SVBodXhoVVBBeEU2NDl2NVQ5MjBDZXBhQ210S1JKekVhN05fdE9CeWlabUtQNlpWT3E0SzZLOWpadUVoSUU5MGZ1U0JYNUtaY0x6NWdCSVdJMnVjSWdjaEhHcVhtSmNJcHVsOV85YkJ5SUEyT2NuZ3NjeVlSZUtPVGF2TlNDWllwU19fSTY1VFh3MG1BU01ySnBJ0gG0AUFVX3lxTE5OclRTWGQyeUdVeXhhWnp5RGVxMmZfVEhxNGhtMXJ6TG9oVkM0TXRIT0l3eDhXQ0N1enR4MGdGYWF0bktvQnI4cHhac0tfbGVmbk9rc3NFY1RkcGNENmxuYVoyUng1UFM5UzdYY3BFYlY1NWNuWGpwczhEdE14UTlMeDhscnI4eXpFREl3WjQyZi1PdEVVOHpoYWl2emt6SlN2c2pfUlQ5RUdDTGdtNjVEMTlLZg?oc=5
Dois Irmãos do Buriti,Neno Razuk investe mais de R$ 5 milhões em emendas e transforma municípios de MS - Assembleia Legislativa de Mato Grosso do Sul -,Assembleia Legislativa de Mato Grosso do Sul -,"Wed, 09 Jul 2025 07:00:00 GMT",Neno Razuk investe mais de R$ 5 milhões em emendas e transforma municípios de MS  Assembleia Legislativa de Mato Grosso do Sul -,https://news.google.com/rss/articles/CBMiwwFBVV95cUxQVEZZaXFodnY4Q08zWnF2clpBaXppa1o2TzRqUzZ4bktxWXE4UTF3bWh2OW5LbTFHT1AzU043UHJuak83MWJWc3lQdjVuNDh3S3I4TWJJOEsxbnpFVk9CSGNodXNKdFlNUWVJOGF6VFdkX2ZGS1REM3lnVWk5QV9XckJLLXhkcDh1MlFkSVdqZmRTa2ctU283S2E1dEoxUXcwWGxJeV9QaDFfblJnTHI1RXJDbm1WNHF2MWVYTEVMWXpPQzA?oc=5
Dois Irmãos do Buriti,"Com R$ 264 milhões, Governo de MS cria nova rota rodoviária e leva asfalto para Dois Irmãos do Buriti - agenciadenoticias.ms.gov.br",agenciadenoticias.ms.gov.br,"Thu, 29 May 2025 07:00:00 GMT","Com R$ 264 milhões, Governo de MS cria nova rota rodoviária e leva asfalto para Dois Irmãos do Buriti  agenciadenoticias.ms.gov.br",https://news.google.com/rss/articles/CBMi0gFBVV95cUxNbjh6am1QQTUyanN3bjFYLUk4bEw5TzBFVzlkV3g0UzJ3ejNVU2tyakliTVlRWVk5VWxQYUFweHVsMjRnQ1BJeC1CMU5BdFZJclJnODhWRTZzMXIwSENVc3h5V2s4dEMwS3RucUlfVzRGSTZKdGNBSFF5eTFJM0RoNE1McXB3Q25pTG1QUGNIbXh1VTZrenhWWnZwTHV4d01vdXlER0ZMWHNia3YyTnlwX3dNWERibWVJOUJLYlZCZTltZG1pQUtKaG5DR0E0ZnU3ZXc?oc=5
Dois Irmãos do Buriti,Primeira noite da Festa do Peixe terá três shows musicais em Palmeiras - O Pantaneiro,O Pantaneiro,"Fri, 09 Sep 2022 07:00:00 GMT",Primeira noite da Festa do Peixe terá três shows musicais em Palmeiras  O Pantaneiro,https://news.google.com/rss/articles/CBMiywFBVV95cUxOLUpFMzhDVUxSeUJ5N2JmSFFMdzZRUGFiTW1KVVB0ek41ZEFBQUMzU3o3aEQzV05Db1BZRHl5S0NEbmwzY0hxQmNGdU9QSl96ektTVmdvYWtaaTVPemY2b2tabGFUTkd6dFJDZFM0eGJiNDcxdE5pTHVJVzdxb2RrcTJoaEpqSjRuNlBYQWFKakdRb2dNVXJhQndjWjRzRWpxSDJOQVNGSmNqNjBqSEJrVkFNR2hpT3JBbklOQWZTRUZnXy03cWFSRHBsSQ?oc=5
Eldorado,"Caravana da Castração inicia os trabalhos de 2026 em Eldorado, na próxima quinta-feira - agenciadenoticias.ms.gov.br",agenciadenoticias.ms.gov.br,"Tue, 13 Jan 2026 08:00:00 GMT","Caravana da Castração inicia os trabalhos de 2026 em Eldorado, na próxima quinta-feira  agenciadenoticias.ms.gov.br",https://news.google.com/rss/articles/CBMivwFBVV95cUxOYWlCd2s3dVZraDdzOG42WGtnNWRVaElGNXhiNUJxbHo5Snlva3Y2NWZEOTBvTXEyemFUbjR5X2VVNjFhMXJ5SHFzRWxyWFlvUHhnOVBnR3FUWVZieGpzX182d3dxQXR5R1RtUW9sbDdxZzFEdDlsc1pkOHJmN1J6dC1BNDlhbXp2TElhdDRONlYxT2oxcHJXVTc3dXA1QXAtSnFnOUZ1eWE0Wko5QVMzZjFjdkliZ2FvWGtESk1jNA?oc=5
Eldorado,"Dentro da Hilux: amigo de Ana Castela, Luan Pereira vem a MS para show aberto ao público - Midiamax",Midiamax,"Wed, 21 Jan 2026 08:00:00 GMT","Dentro da Hilux: amigo de Ana Castela, Luan Pereira vem a MS para show aberto ao público  Midiamax",https://news.google.com/rss/articles/CBMirwFBVV95cUxOWVVRRE9yU1lHSzF3YTJlODh2cWhEQ1Atcm50RWp2R0dCVWlmb1ZuV3lWZGVSMUZCVENUS0dOQVA0dXcwa0dER2xQUG1QTmhvQWNvNkMzZFdGRFpDdldXNGt2R2dySXZEQzR6bV9UbElaLVdtVFpXRUdUQVhOcHp6VEg0SzBTWGE3OXBXcjUyVnpKWkw2S1hmcTFraXEwaWhIVEhKOW00UjRVOWRPRS1N?oc=5
