municipio,categoria,titulo,fonte,data,resumo,link
Água Clara,Social e Cultura,"Três Lagoas leva cultura e protagonismo à Teia Nacional 2026, no Espírito Santo - ArapuaNews",ArapuaNews,"Mon, 18 May 2026 14:00:00 GMT","Três Lagoas leva cultura e protagonismo à Teia Nacional 2026, no Espírito Santo  ArapuaNews",https://news.google.com/rss/articles/CBMiqAFBVV95cUxQVXNyWE5oU212VmdLdENQaEJ4RktiaUljUnFnblBDQ0xwMVEyS0JRNnhSVlV2ak9kUTN6VUpxTDdGQWtvN1p2QjdvTGJPcWt6VlZkZW1pVHNhdGRRZFYxejNjbWRfYVRVLVhxLVl2OENhVHhiRXI4NWN6UVU2Qm9ORW91eUJtWGlaSXJEaDlOcWJVNmY3NlhHRTR3S0swM1hDNDRhQk5xLXE?oc=5
Água Clara,Social e Cultura,"Agendão cultural: fim de semana tem feira criativa, teatro, astronomia e atrações culturais em MS - ArapuaNews",ArapuaNews,"Fri, 22 May 2026 22:30:00 GMT","Agendão cultural: fim de semana tem feira criativa, teatro, astronomia e atrações culturais em MS  ArapuaNews",https://news.google.com/rss/articles/CBMivgFBVV95cUxOR0FZU0dRVkNheDZCSS1EMDdwSjlnZldGdFFESU04SXNBZ0RROWhuTGJkem96eHRRVW5iVEdISW9tOHV1MVRQUDZqandic2w1aEhQRkFYM1FMNFlOYjF4NFpsQlplSld3NHMzOVVUSHh5emJUOUVJYS1mV1JGVDZxRWlhalVvdVZKQUFKRlpRX1ZHTkxHOGJHSE1GMFBTS082Smk3aEc3X3BTbTFURC1LS2QwTVpCNFFDb3JTSlVn?oc=5
Água Clara,Social e Cultura,"""A Rua é Nossa"" movimentará à Circular da Lagoa Maior com cultura, lazer e gastronomia neste domingo - ArapuaNews",ArapuaNews,"Thu, 14 May 2026 19:00:00 GMT","""A Rua é Nossa"" movimentará à Circular da Lagoa Maior com cultura, lazer e gastronomia neste domingo  ArapuaNews",https://news.google.com/rss/articles/CBMiwgFBVV95cUxQU0F3RGprSy1FV1Awc2NvRGNSRkF4eVFJTDNCMkFEeWRlWmd5RnlicmZGLWs3dzRzc3ptbWF1TmtHcmpBN3FnLTQtYUxscDNUdVAwUWJjWXk5bW1UQ214QUp0MUNpOG16QWhYWDJEMnNGNHFfWEVaYlo1elE3M2lWS1h4Z0xIVFRkMnp5NFZQWklFa1FZRUt3ZWRWZzVkbEJNcGttR0RhVFE0WFV4dy04U1hMUW1FUktrVEtXYm1KdzRMdw?oc=5
Água Clara,Social e Cultura,Neno Razuk investe mais de R$ 5 milhões em emendas e transforma municípios de MS - Assembleia Legislativa de Mato Grosso do Sul -,Assembleia Legislativa de Mato Grosso do Sul -,"Wed, 09 Jul 2025 07:00:00 GMT",Neno Razuk investe mais de R$ 5 milhões em emendas e transforma municípios de MS  Assembleia Legislativa de Mato Grosso do Sul -,https://news.google.com/rss/articles/CBMiwwFBVV95cUxQVEZZaXFodnY4Q08zWnF2clpBaXppa1o2TzRqUzZ4bktxWXE4UTF3bWh2OW5LbTFHT1AzU043UHJuak83MWJWc3lQdjVuNDh3S3I4TWJJOEsxbnpFVk9CSGNodXNKdFlNUWVJOGF6VFdkX2ZGS1REM3lnVWk5QV9XckJLLXhkcDh1MlFkSVdqZmRTa2ctU283S2E1dEoxUXcwWGxJeV9QaDFfblJnTHI1RXJDbm1WNHF2MWVYTEVMWXpPQzA?oc=5
Água Clara,Social e Cultura,"Festival América do Sul 2026 transforma Corumbá em território de encontros, arte e travessia - ArapuaNews",ArapuaNews,"Wed, 22 Apr 2026 07:00:00 GMT","Festival América do Sul 2026 transforma Corumbá em território de encontros, arte e travessia  ArapuaNews",https://news.google.com/rss/articles/CBMiugFBVV95cUxOLXFsLTdKUm1mNU11WmVSMXdkNjliMWtKTUFsYWNmSVEwbjI0VTk5TVVPekxGOU1jc3lrc3ByYWViSzZValdlcEJ2Z3NSQmRpVmRyMmdGRk8tNWxiMnJMZmNSejhyckJUQTRNUDY0amF4SjNob2dEVnRvQndzMTM0N2hEWG5MREpEUzAtRFlkZHYxQzFKQUhBMnluQ2FkU3loQ1RMRXhfTjB5WkNzc3NhSVpyWTRObUh5Tnc?oc=5
Água Clara,Educação e Negócios,Funtrab anuncia vagas em Campo Grande e Terenos com salários de até R$ 3 mil e benefícios - ArapuaNews,ArapuaNews,"Tue, 12 May 2026 22:30:00 GMT",Funtrab anuncia vagas em Campo Grande e Terenos com salários de até R$ 3 mil e benefícios  ArapuaNews,https://news.google.com/rss/articles/CBMitgFBVV95cUxNckppV1BZNUY3TTkxZXh1S21ERmEzY0dKbTRWLWg2aW93QVZVX21aeEpES1Z6RF81cGtJdzNOSXpyZXNyZG5hbTZjdTEtaW05Q1FWUEdPa3pOanpjRFEwd19HVjhDNFQ2ZC0tSDVrZC01Z1R6clFUMTU3SHFGZjlHNFA0X0RONGlsV09YN2owd2ltZ2tPd2hVMVFwODVCcG8yb3JOSUVYTk83WTJhb250S3RQWGhfdw?oc=5
Água Clara,Educação e Negócios,Sindicato divulga vagas abertas em indústrias de celulose na região do Bolsão - Midiamax,Midiamax,"Mon, 29 Dec 2025 08:00:00 GMT",Sindicato divulga vagas abertas em indústrias de celulose na região do Bolsão  Midiamax,https://news.google.com/rss/articles/CBMivwFBVV95cUxNM0NEOUpkR2FFU0RPb0xhb3hHMUVNdk14aklmdTJIbWhTX0VhaUpxYWtUdUZibE5oZ25UclJyY1JnUFhHOGFfbUdhZHJ0RTZCeGJGSGFGUFZCRGFHZ1pxQ1Zfa29VY2xmZ0RJYzFrSjNpOFJoOWwwcXBXOWZZbC1KRXZyVnM4QnVnVDJRc19fRl9rX1NEWHVQZnJoSU1ZLTU2TDdEcDdaR3MxcHpCZXN2UnJMcmFaamJ2SzUtZFJVNA?oc=5
Água Clara,Educação e Negócios,Suzano seleciona trabalhadores para preencher vagas de emprego em MS e BA - CPG Click Petróleo e Gás,CPG Click Petróleo e Gás,"Sat, 24 Jan 2026 08:00:00 GMT",Suzano seleciona trabalhadores para preencher vagas de emprego em MS e BA  CPG Click Petróleo e Gás,https://news.google.com/rss/articles/CBMipwFBVV95cUxPNUJRcHRxbUpVTTFGV2x2Zkt5b1g1cmEtV3lXYnVSVlBOMkNPUEpfLXJ3M2ZyWS1ENzF2RDJramN0eEJETGdMM1lxazVVeU1pdmVPaGZ3QklOM2JQd0RWSjlpVlhyVGU3SUxUTHRjejVoWE9jZkpRQVRqdXBPQnZHMzhLYWhHamZwczdrdFp1UHFjTzl4MnRiSV9zMlNzM2hLUmc5VWd0TQ?oc=5
Água Clara,Educação e Negócios,SESI-PA promove capacitação para professores e SENAI-MS oferece curso com bolsa de R$ 1 mil - Agência de Notícias da Indústria,Agência de Notícias da Indústria,"Fri, 20 Dec 2024 08:00:00 GMT",SESI-PA promove capacitação para professores e SENAI-MS oferece curso com bolsa de R$ 1 mil  Agência de Notícias da Indústria,https://news.google.com/rss/articles/CBMi7wFBVV95cUxPNmlhZUtSSUdPcV9LblZDNldQRm44Q21iQ3p1Ri13MkFyQUQ3bXZ4c00xRTlkWmZHWTZFeUw0X0hjUHZzNjZtMFQyeXVvbDVzWFZyU08zS1dKamMwRDRHa2F6N0N5cVZKY3B4b25TUDlwY29oaXhfMUFwM200NDNwZzRybW0xNTRoUTJVYjFSemhKVG5Sd2pnNG9aNkx0RXJ1R2JTcUp5OHIycTRxeGxHXy04MC1rMTlFVnRyTmxISVBTUVNNdHY3T0x0MWRLaHlSU0xZUWFYRnVRTnRjWFgyNElWLU1RRUZhWExFMFJPQQ?oc=5
Água Clara,Educação e Negócios,"Funtrab anuncia vários cursos gratuitos de qualificação no Estado, veja como se inscrever - funtrab.ms.gov.br",funtrab.ms.gov.br,"Thu, 18 Sep 2025 07:00:00 GMT","Funtrab anuncia vários cursos gratuitos de qualificação no Estado, veja como se inscrever  funtrab.ms.gov.br",https://news.google.com/rss/articles/CBMiuwFBVV95cUxOODR2ZHNIZHNUUnJyVU05ZXdod21jYld3UWNyaDBLZVdzQzBPZTZkQUM4Ml9fYW1OUjd0dGFUck5FVG56MFdhQTNDWlEycEhQVVRIdUx5aUJTQ0ZVT1BUeXczTkFqenZTWnp2R2YzZkZIVGViMmZtMXJfeEF3RDRsaFRUMktXTmtHSW5WaG9mZ2lOaThRNmZ3cU13ZEtLSjZJSHJfVGF3SlRKRFpWNmtJbVQ3RHo1RDVkeXdv?oc=5
Água Clara,Política e Institucional,TCE-MS rejeita contas da prefeita de Água Clara por falhas fiscais - Midiamax,Midiamax,"Mon, 04 May 2026 07:00:00 GMT",TCE-MS rejeita contas da prefeita de Água Clara por falhas fiscais  Midiamax,https://news.google.com/rss/articles/CBMirgFBVV95cUxPU2Z4cFl4WlNoR3FYYktiWHhGSy1MNDdzc0loM1lzRW5ZdjAyUFVmNFU3LWF4MS1lLVhESHppaVhrSlJNLXhJVHRsLW5DM3FjeGpzMVIyY2F6a0pUeDNiT0h5TF9hSWhFT0hVQ2FRVnBxUTdxLWN6c0RneGg0SWRLYXdEYy1GVk1Bc0ludjY4a2IwelZvNTFmNEVkTm9lcDlHcVhtdFQ0VGtqSUNJVWc?oc=5
Água Clara,Política e Institucional,Sentença condenatória é confirmada em 2º grau em ação do MPMS que investigou esquema de corrupção em Água Clara - MPMS,MPMS,"Tue, 10 Mar 2026 07:00:00 GMT",Sentença condenatória é confirmada em 2º grau em ação do MPMS que investigou esquema de corrupção em Água Clara  MPMS,https://news.google.com/rss/articles/CBMi5AFBVV95cUxNWS15bk9JemlydkhFLUl6UTJJcjlOV3BRaXdpcnV0bktGS0tESnIwQWNlek54Z1JQU2tkRmI2YnhEdlhEVlVCTEZyZFpOcGdiMFM2SWVnSzZNbTJ1X2tOM0FuVnhqWXI0NmRhdi1jRVVWSlBTeldNN0tib013eFFVZjktejRkak9SR01qREplTnFhbkZRMkNPTUU1eVN2ZHRod2RDZDQyQmlpNk5IaVJiR2hZb1ZWQzVHaEJIbXNxMkN5OTcwbTF5UEVneGNIUkZ2aWtiR00yOE81OXh2Y3gwcFBGTHI?oc=5
Água Clara,Política e Institucional,Audiência Pública apresenta prioridades da LDO 2027 em Três Lagoas - ArapuaNews,ArapuaNews,"Fri, 22 May 2026 19:00:00 GMT",Audiência Pública apresenta prioridades da LDO 2027 em Três Lagoas  ArapuaNews,https://news.google.com/rss/articles/CBMimAFBVV95cUxPMzIzRE9HOWxDc3Y1a2Y3cjRzMkNOV19Gc2JqVGVQUkZSbWFyR3NwQXdqRkJsWDE1R3RhejJ0Q1kxN21leWFOMC1HWXJkd3dmU3AxY0Z1UENPR2NuSm9iell0dk5EejJxNUFVejl1Zi1aV1U0T0tEX21JaWc2LUJ2SEwxMkVwZEg3ZDFib2F6eVpUbzRHeWFUNg?oc=5
Água Clara,Política e Institucional,Paulo Corrêa homenageia lideranças femininas que fazem a diferença em MS - A Gazeta News,A Gazeta News,"Tue, 10 Mar 2026 07:00:00 GMT",Paulo Corrêa homenageia lideranças femininas que fazem a diferença em MS  A Gazeta News,https://news.google.com/rss/articles/CBMitgFBVV95cUxQbnBLY3J3d3lqWVNKcGw2Vklra19UWGZ0a2p2NFRJYUN6MnlibWVabnYxcmo2Wk9hTkVpbzJiVkRzaVd0UWxqXy1KX0ZGdDJKZ2RORTQ3Qk5yZ3IzazZGc3U5T1VEblJteU12UXpXUXZkS3g4eTZLc3JiX210MUpJN1g4eWRSTl9na2ZDbTdrV09MUzVpZWhTQjRDZWZXVXVtNVpTZDFxOFpqZVNJaktyQ2VqZHprUQ?oc=5
Água Clara,Política e Institucional,Procedimento vai monitorar TAC para regularizar Controladoria Municipal de Água Clara - Midiamax,Midiamax,"Thu, 22 Jan 2026 08:00:00 GMT",Procedimento vai monitorar TAC para regularizar Controladoria Municipal de Água Clara  Midiamax,https://news.google.com/rss/articles/CBMiygFBVV95cUxPZk1QN2daSDZsU1lLR1MzeXRJanljUnNLYlBiR1RQWVpkcEtBeWhWVHNWcm1UODZ0S3VkNVMzSTE3WXlnTDJoZVFXUjBmX3hPMkFPcXQ1aVZ4ZVhNWHhrTzQ3LU1DU2YwTnJYcU9EdWhpd2JyR0p0ckNSMUpjaklyWE9kajU1WkVwR2EyU3l5YW5hSDBSNVVmaVNXTDZJX0g2akVJdXRjanY3d3R4OWtnQWd6QW80c0FJZ2wza0szbG5CTmI4dy1SdkJB?oc=5
Amambai,Social e Cultura,"Governo licita obras de CEUs da Cultura em quatro cidades e fortalece acesso à arte, educação e cidadania - agenciadenoticias.ms.gov.br",agenciadenoticias.ms.gov.br,"Fri, 13 Feb 2026 08:00:00 GMT","Governo licita obras de CEUs da Cultura em quatro cidades e fortalece acesso à arte, educação e cidadania  agenciadenoticias.ms.gov.br",https://news.google.com/rss/articles/CBMi2AFBVV95cUxOQ2ZybHZ2WUFrVnpaeFd4NHBBVXRVdmRHZnZOcGczWVlsbkV6R2QyVnUyY3pTOXVzRndwbXNHdVZEUlBDaWpmMG5QeEJ1MVRRbmdBQzFIWnpwMU4xeTVTNmxmUWJHaTNRWUhZSWk5RWc4RVlpSlFiMzVQNnFsZGs5R3VLLTdCY0toU1NfVHVPeEZ0cXNXaGR0blN6VkxFVG83cE12OFI1M3R5aWV6Yl9LcG9xaG42aVd4bE5OQ0ZSOGROZi1vSEJvOC1yZEVxem9kb3RaOVZzS3U?oc=5
Amambai,Social e Cultura,Ponta Porã recebe Festival Etnocultural dos Ervais - pontaporaemdia.com.br,pontaporaemdia.com.br,"Fri, 07 Jun 2024 07:00:00 GMT",Ponta Porã recebe Festival Etnocultural dos Ervais  pontaporaemdia.com.br,https://news.google.com/rss/articles/CBMinwFBVV95cUxOM0NPN1lmREpULW9ZY2w0LU5uUTJudmtVcTBxcVhRVkk5T05NOVVjZklvQzYwNWphd3JRcHJWdXAzVThId0pBRGZaUlJwOGRVRUowbjlvREtFa2FfZFR0emQ4WXlOc3daUVMtY1FCbFpLMW5vZlZEVFhkUE5pNEIxeXZQTWkzNk9Dck9YOVdSXzhMUEUtNTI4aGtLRXhnQ28?oc=5
Amambai,Social e Cultura,"Agendão: fim de semana tem MS Fashion Week, Festa do Leitão no Rolete, exposições e muito teatro - Idest",Idest,"Fri, 06 Sep 2024 07:00:00 GMT","Agendão: fim de semana tem MS Fashion Week, Festa do Leitão no Rolete, exposições e muito teatro  Idest",https://news.google.com/rss/articles/CBMiyAFBVV95cUxQQkJVNThTWks5V2FBVjMzR2VmclJoTFBHWnlSaU1Md3lHWmk0cU1VUFN3dkhFQlVya2ZmYzlRZFBHZ1RXR001dG1mUUY0d191dlFFY0FRN3VQVGdSOFlHSDFENmR2dExSN19pN0xpclZUelJtTWtfSzhIVXZoN0JWNkZIRG9GUktRVVp2aFRFU3RROUZQQkIza1F1Z1Bjd2RxaFZUWUhQaDQ2b25yR1JBWU9VY3l5VUxLTy1SVHNNU2txVzN4d2tZQg?oc=5
Amambai,Social e Cultura,"Cine Sesi tem 2º maior público do ano em Bonito com 4,9 mil pessoas - Agência de Notícias da Indústria",Agência de Notícias da Indústria,"Tue, 25 Sep 2012 07:00:00 GMT","Cine Sesi tem 2º maior público do ano em Bonito com 4,9 mil pessoas  Agência de Notícias da Indústria",https://news.google.com/rss/articles/CBMi0gFBVV95cUxQNHRsNkdrcS1vTGxMOUFyR0d1UmtSc0ZNZ1FEN1ZhZHNSRzh0XzBsUml5MENpYVZ2RXcweFdEMHh2cFBZbEYxMU5iV1k5Z3B2cmlLU0QzRDZtbGVFWkpQcmwwb2UtaUZXMDRZTm5QUlNBOWJ0azBnV01zbjNvYmRWcHZKbkRYN2doRElyZHNRQUFjMlBiUDJERWRQN1ROOHZUVmExUkJLZm5HWmFDNHNMQ2xVdktYd25hZ0ZKbnBPTEV3REJIWFlSU3ZlVE0tM05pN3c?oc=5
Amambai,Social e Cultura,Encontro de carros antigos transforma Praça São José em ponto de cultura e lazer em Amambai - A Gazeta News,A Gazeta News,"Mon, 27 Apr 2026 07:00:00 GMT",Encontro de carros antigos transforma Praça São José em ponto de cultura e lazer em Amambai  A Gazeta News,https://news.google.com/rss/articles/CBMiZkFVX3lxTE5SZVl5N0xmTk1VdWFHdEJtSVYzbzItbDFDRDJYR051Q25xYXBDUTl1SXhyMFB3RTlNVWRlSE5vdDlIZWptTnVXM21vQkVHM1lhQmRuVkU5MS05aGZYUTdUZVNZeTdkUQ?oc=5
Amambai,Educação e Negócios,Notícia - Casa do Trabalhador de Amambai divulga 49 vagas de emprego nesta quinta-feira (19) - Prefeitura Municipal de Amambai,Prefeitura Municipal de Amambai,"Wed, 18 Mar 2026 21:55:54 GMT",Notícia - Casa do Trabalhador de Amambai divulga 49 vagas de emprego nesta quinta-feira (19)  Prefeitura Municipal de Amambai,https://news.google.com/rss/articles/CBMiwwFBVV95cUxQM2NiNGE3U200SU5WWi1XMHVCTW1rRjJXY05WN21SU09TTllDd0NFc0c1VzUxTXFINVk2RXRsRVNoUEt1R3pVMFp4TzFobHV2c1RPSkxMLVZManQyaGlxOG1IQUtna1ZQNnhxMDA2LXhxUklKWGVmdDBsbWJxVmptU21SNWZldkNNMTIyaGgzYXBHUGIxdkpjbko4d25mSE5vLTFqMFdNSE8tWGRUWDRFc0t1ZUZWRFRmYlJHTXBpSkNzZW8?oc=5
Amambai,Educação e Negócios,Bioenergia: rodada de empregabilidade oferece mais de 630 vagas em 15 municípios de MS - Portal Único ms.gov.br,Portal Único ms.gov.br,"Thu, 16 Oct 2025 07:00:00 GMT",Bioenergia: rodada de empregabilidade oferece mais de 630 vagas em 15 municípios de MS  Portal Único ms.gov.br,https://news.google.com/rss/articles/CBMitwFBVV95cUxNbVkySUF3eWluQmJNak1yT3l1cWcxWVZES3BndzhCbWhzbFZ6WW1hNnZ2U0h3Y1k3bjh3N2xFX3Nxa2JjWFNkY3l2Zl92aVVWUjNxS2pvblhRWjhIOTBIdDhhQXIwX1hYTF9WLVNuQ3IzNlUzZ2hlZjBsX2FybWVmOEptRzkzaERwNnpCXzJDRWJIT0xaeXpac0xqQzNnVmhXUkt1Vy1ZUUsyTHFObW1PNmxlbzFNNlU?oc=5
Amambai,Educação e Negócios,Últimos dias de inscrições para qualificação profissional a distância no IFMS - Correio de Corumbá,Correio de Corumbá,"Thu, 26 Feb 2026 08:00:00 GMT",Últimos dias de inscrições para qualificação profissional a distância no IFMS  Correio de Corumbá,https://news.google.com/rss/articles/CBMiygFBVV95cUxQLXRzRjA4bzY4Vjhoc09PLXBSQnRyNFhyY1pGd2ZRakZSVGVLSHBoNnBoUW9aZEg2c1g3VVVlWXJWc0hvU0lpOHNFc056Z0NOSF9xQS1ZeFFTUFNIbnc4VDJocGdXYjhvZmpZdjF2OWk4UXJQZ3RHM0RnUWJESFZqdnNlWThFcENYYVhreHdscHQ3NW1VelNFWC1UcS1EMmRqUFRmX2pNMGJjYUFzelFTWG5PTzFWS0pTay1SdE1kUkxGRHlDZ1VmLWdB0gHKAUFVX3lxTFBYN1NIdzhGOC1yZUQ0ZHRoMl9WTGRqVF9jUl9nMkppRmlSaWFxc2xoYVNvRHB2OE1VYnVZMmNhNmE4T2ExbG03aGhWeElfcjNpTU1Wc21INmEyajRRdGRJTjg3U1Zrb2FyZkpVSDB6MC1JOFNVX0t2T1E4ZVJpeFVad1NFdVVzZ0lfVXBwSURoSjZOSmtLYWJoaGVxa2Eyd2F3Sk9hazJWejRXeENCTkVqN3lFLUFQcTlsRmo4NEttamNoUjV0dUtDS2c?oc=5
Amambai,Educação e Negócios,Casa do Trabalhador disponibiliza 71 oportunidades de emprego nesta terça-feira em Amambai - A Gazeta News,A Gazeta News,"Mon, 16 Jun 2025 07:00:00 GMT",Casa do Trabalhador disponibiliza 71 oportunidades de emprego nesta terça-feira em Amambai  A Gazeta News,https://news.google.com/rss/articles/CBMizgFBVV95cUxQbjYzS3hDUG11b3ZLdUV2eUhmTldXdGFLcDNBODY2c2w4Y2lwUVVuNUIweWlzN1pHWktBQWNHVWJueTRwSEJpYzF3RzhyT2FEN1c1R3o0UFRZMkZ0a2dxZURjX0dTaUg5NGtNa2ZOYmw4c2hiU1NiMnJMOWU1cWt0ZlRIMWYyQ1d1N1huTXlkVWJPTjNIWEs3X1p4dW1ieUxzN3hwUnRyNUVGSG9fM2NJX0NiS0NVaEFhdWhiaVdrdUlZRmFrVHJiLVItc3p2dw?oc=5
Amambai,Educação e Negócios,Processo seletivo dos Bombeiros MS abre 230 vagas em 30 cidades - JC Concursos,JC Concursos,"Mon, 02 Jun 2025 07:00:00 GMT",Processo seletivo dos Bombeiros MS abre 230 vagas em 30 cidades  JC Concursos,https://news.google.com/rss/articles/CBMitgFBVV95cUxOcHRfT3hTeWZpYW9CM2F4dkFaV1BaeFlUbnB6dHVqcUFkc0NxYXphVEF2cFkwcmRxYnpMSG1sZ0ZVUkE5bWpDVmZkZTN5STdOTnJTZWxZaHF4R3RQcDB2LVhybFd1LVl2NE91LVRLUGlxOEZKZlVsN1JNS0FrZG9zbHJrWE5zZDVYZ2V0WmZVV1lHZ0lTdHowaUEycThIdDRnUmc0VVhoMFplYWdsd0s4cjlQbXh6Z9IBuwFBVV95cUxNcUxOUktqa29RUlhzcVhmMDYycm96cmxjc3pnUlpVbVlpb0c1bmY3TjJmaUNWZ0RESGpRVV9ubGlteFV2U3hKYlVlSzhYb0stZ2pZeGdrcGl6MTFadkd5dHdJUFdJV3FSX2NuVTJMUS1IMmRNNC1VQWlUVWFMbjBVZEx3dWhuZnotNUxPTGxsUTRTcGFMS045TDhfSXZBS0JlaFVxQndmbkZHUllndEZ0d0Y3M3JJc0kwSXMw?oc=5
Amambai,Política e Institucional,Prefeitura de Amambai convoca população para Audiência Pú... - Prefeitura Municipal de Amambai,Prefeitura Municipal de Amambai,"Mon, 06 Apr 2026 07:00:00 GMT",Prefeitura de Amambai convoca população para Audiência Pú...  Prefeitura Municipal de Amambai,https://news.google.com/rss/articles/CBMiuwFBVV95cUxPbExpZTVKN1psbHJQUFMwYVcxX09aT3YtbGdkdDhtaFpFbWMwdXphS1ZUUUtQc3JWY1RzTU9TSjVyMkdEQ3djNFhVTnZoS1I1NzFhUjc5VXNrZmdKSHI5cm9MOFVNbUFZUHdTeG1pZnotUFoweWtNZGtDWVlZM19udXR3cUZGZVRvb216c2hvVklST2ZsbGRmN2hiSm1Bd25SUEhIaTdjSGhHbzJzYllDNzJfNjNSbUZFQmxR?oc=5
Amambai,Política e Institucional,"Prefeitura irá desembolsar R$ 1,9 milhão em indenizações para viabilizar Contorno Viário de Amambai - Midiamax",Midiamax,"Thu, 14 May 2026 07:00:00 GMT","Prefeitura irá desembolsar R$ 1,9 milhão em indenizações para viabilizar Contorno Viário de Amambai  Midiamax",https://news.google.com/rss/articles/CBMi1gFBVV95cUxPU2kxbXVlQlVWQ2ktd1BzMmNoQVFlQ1owdVlMOWJlX0FMOEkyWkhLcWtsbmoyeXJiSjBDdEdSQ3pvTjZMSFVMd1FhSmNReEFyX0lqdkxwMzZCUXQ3Z0RINi1OUWtzTDVHTkIteXlBZlBhZ2l4c1RqY08yd0JGRzNOWkVDTDdOemdSLXlZa3V0THI2SzM1Um1FZ3RZODlVVjF5VV83RGpEamdOcGlRaG5sT2o2cGk1REIyeW44RmRlajVKYXRSUGh4OEJLTDhQWjBEY1p2S0dR?oc=5
Amambai,Política e Institucional,"Em Amambai, MPMS acompanha implementação de Programas de Integridade na gestão municipal - MPMS",MPMS,"Tue, 04 Nov 2025 08:00:00 GMT","Em Amambai, MPMS acompanha implementação de Programas de Integridade na gestão municipal  MPMS",https://news.google.com/rss/articles/CBMixgFBVV95cUxOTHVITUlfVjFoY1Z6RmhwdlB5bm1fRk5HMHdFTzBYUUV4ZTlYU2dWS2hpbDZiUVE5b3MxSXc1ajVSSExydkstbGg5dEVIaXFsa09hdnI1NFFhZUl3dzE5RXJMV0NqdUVYOExfVEdWdHdCdFRvaVN4bktjUkdzNVZmTkhNRGd2alhINy1BT29oUm1saW85TXIwSW1yRTItNnFwTW1FbW92b25UdEkwMG1Ba0ItLWVaNVZUMDlxU0FVbG52MEQ2cFE?oc=5
Amambai,Política e Institucional,Prefeitura de Amambai MS abre processo seletivo para formador municipal - Folha Dirigida,Folha Dirigida,"Wed, 04 Mar 2026 08:00:00 GMT",Prefeitura de Amambai MS abre processo seletivo para formador municipal  Folha Dirigida,https://news.google.com/rss/articles/CBMipAFBVV95cUxNcVB0UENsamtCSGF4b2I2VURGaHV0TTEwNHBMUkZZdW9raXBlN2VGeGx4LWVRZ1pkQ25WamY2OVFYSDhfdTZGMERxaWltNkJFY1Juc25Lc1VoYnJ2TVBMaUlFd1lqb2U0dVh3MDZjdmlmbzRmR25GZkgxY0RaTnJaZnFRRnpVUmJzZ0pPcnZVWC1Ib0RtdUxORVZCbmRMRURlUWpobg?oc=5
Amambai,Política e Institucional,Amambai confirma convênio para construção de 50 novas moradias - Prefeitura Municipal de Amambai,Prefeitura Municipal de Amambai,"Thu, 12 Mar 2026 07:00:00 GMT",Amambai confirma convênio para construção de 50 novas moradias  Prefeitura Municipal de Amambai,https://news.google.com/rss/articles/CBMivgFBVV95cUxNUWJqQ29VWEJhYTg4S2pLcUFjNWp5bDNEQW1ZTlZjNUVtOGI4LUVNVHpkU3FsY2tEYVBYY3dDUm5zWWdLeDhYTG9BM3JUaEt5UjFVNE96SUNJa0JjanJjMWVnejBuVVpYUVp3dG9PYWlwMk1FLUxGeXlkR0JzeTBtV1BmbHI0UERHcnNvVFZxY2pxTFhrTG9rdk5yMDNiV0FJYkJtS09WTUNRTnNBYXNITjA5d3dIT05lTUVONUJ3?oc=5
Anastácio,Social e Cultura,UEMS lidera cooperação internacional com a University of Birmingham em imersão acadêmica no Pantanal - ArapuaNews,ArapuaNews,"Fri, 22 May 2026 21:00:00 GMT",UEMS lidera cooperação internacional com a University of Birmingham em imersão acadêmica no Pantanal  ArapuaNews,https://news.google.com/rss/articles/CBMixgFBVV95cUxNVWV6R3VTazZHUEJkSTN6V1owd05QZ1Z0UXRRX0NZNlNBNDViT3JPMWpZVUNPY0FhVHhGaVlQT2E2UnBDQTllTzdKTHBqT3U5RC10aXhVMnRkcEtic0g0S21yUmlKaHh0VkJqZkJRZzBXNnhQMDhuN0ZLaWlvUUk5RkY0M3F5RzhPUjIzVXg2eVNmSW1ESl9UWi1HRExURnp2VWNtcTUxM3lpTXEtYWI0dC1ETE9rMmVuWWF2dkxfSElKSTR3Rmc?oc=5
Anastácio,Social e Cultura,Aquidauana e Anastácio registram o maior volume de chuva do estado - O Pantaneiro,O Pantaneiro,"Sat, 09 May 2026 07:00:00 GMT",Aquidauana e Anastácio registram o maior volume de chuva do estado  O Pantaneiro,https://news.google.com/rss/articles/CBMitwFBVV95cUxNUFpzZnp2c2tpYm41QVBfR1EtZ0czeThhTGFkQ0xEX1RLWTR3WWRrU1JTcEdyeGh0dVB5dFJmcWQyblFJdEEwVEtJbU1QUWFCSWdPNVJycGdLa2NLN29oNWozdFlqcUhzSkIzZk1WMm9PT0pQdGl3LVRiY1o3dWU1bDVWdjZYWnZEUXZkXzFDN1ZQbnNzLTh1ZXczS0tCTllhT0FUQ1NOU0VYcHRFYlhqWE5UVmJWcHc?oc=5
Anastácio,Social e Cultura,"Cine Sesi tem 2º maior público do ano em Bonito com 4,9 mil pessoas - Agência de Notícias da Indústria",Agência de Notícias da Indústria,"Tue, 25 Sep 2012 07:00:00 GMT","Cine Sesi tem 2º maior público do ano em Bonito com 4,9 mil pessoas  Agência de Notícias da Indústria",https://news.google.com/rss/articles/CBMi0gFBVV95cUxQNHRsNkdrcS1vTGxMOUFyR0d1UmtSc0ZNZ1FEN1ZhZHNSRzh0XzBsUml5MENpYVZ2RXcweFdEMHh2cFBZbEYxMU5iV1k5Z3B2cmlLU0QzRDZtbGVFWkpQcmwwb2UtaUZXMDRZTm5QUlNBOWJ0azBnV01zbjNvYmRWcHZKbkRYN2doRElyZHNRQUFjMlBiUDJERWRQN1ROOHZUVmExUkJLZm5HWmFDNHNMQ2xVdktYd25hZ0ZKbnBPTEV3REJIWFlSU3ZlVE0tM05pN3c?oc=5
Anastácio,Social e Cultura,Cenário positivo de negócios e grandes investimentos públicos preparam MS para mudanças tributárias - ArapuaNews,ArapuaNews,"Fri, 15 May 2026 07:00:00 GMT",Cenário positivo de negócios e grandes investimentos públicos preparam MS para mudanças tributárias  ArapuaNews,https://news.google.com/rss/articles/CBMixAFBVV95cUxOZDJuX1lOcno3YWotMVhqdGtWNVpocExWZXp1Q2prY3BZUWFlcXcwWllobW1WZnNqRWVlWGxvd0RjWGpReU5QV0N0cDRBaEhZbHZGdW53VEY5cGpDZ3VuSFk5QWk5V3Z6eGNrSmtOa0tnRjFfand4NEVTdF9mOWppT1A3UklEMDBiT0Z1TWU4djFFOTdPc1VfZG1zWFEwLVBOdHh5RGNWeUFHSVJOS0xoQVdBVHVsSkRNT3VDZTd5c0ZlYjlU?oc=5
Anastácio,Social e Cultura,Casa do Artesão reúne lojistas para ampliar comércio dos produtos locais de Aquidauana - O Pantaneiro,O Pantaneiro,"Tue, 06 Sep 2022 07:00:00 GMT",Casa do Artesão reúne lojistas para ampliar comércio dos produtos locais de Aquidauana  O Pantaneiro,https://news.google.com/rss/articles/CBMiuAFBVV95cUxOMnBtNUVwY2l6Mkp2UjV3QUREZW80LTdpZXNGdlBxcWhRU29jQmJiY0xhNDAtcmthVEhJT2Q4NktvcDBEUTB1YzJZMWZVRmpJVm9jakRyTE90U2hlcnRWM21ERmhiRUtOMnVKMnpCTjRUYnd4ckpqV2kwTGtxMUgyV1o1bUloeW94Ml9WWG56Q2F3S3BlRDhMdTZuaU1tRlBuYnJvMGxJY05WQ19zc2x5eHRodUZDN1BR?oc=5
Anastácio,Educação e Negócios,Corpo de Bombeiros divulga novo resultado da seleção para bombeiros temporários - Midiamax,Midiamax,"Fri, 17 Oct 2025 07:00:00 GMT",Corpo de Bombeiros divulga novo resultado da seleção para bombeiros temporários  Midiamax,https://news.google.com/rss/articles/CBMiwwFBVV95cUxOZHdRQVgzaklJd20tdFM1cUFkNFc5ZVR0TnZ3NTBqUGlwNXhJT1F0c0ZRQnBUMFFvaTVSNXRZODBwaDl4ZmxLVm1nbUhoNUwyeUZBYVExVkliUE54NU93S25Bc3gzeWNxcDhUMFBqcUdlUjNZMTRVMVBtMWdraFNNTkZCNGZQYTJLY3g1bzJDZWRHaVA2dXNwQlIydGhRdmFlY1pxYkYxQy15UmhGSHBqLThraW5zc2hvNC02cmZfdXgyN00?oc=5
Anastácio,Educação e Negócios,Senar/MS tem vaga para quem quer crescer no agro e mudar de vida no campo - A Crítica de Campo Grande,A Crítica de Campo Grande,"Thu, 21 May 2026 07:00:00 GMT",Senar/MS tem vaga para quem quer crescer no agro e mudar de vida no campo  A Crítica de Campo Grande,https://news.google.com/rss/articles/CBMickFVX3lxTE5DRVlRM3VYbURtZ0ZldWR4b3oxcmF0ZVktUVdzV0lhTHlBMk81a0xZRm5HbzZDS0FyQnVMZjZ1NXNYcVhmMFBHU2pXWmxfbmxlb3ZtUEF2alp1cDI2UjBTNmJnY3FwcElRNkZLRVhnempWQQ?oc=5
Anastácio,Educação e Negócios,Qualificação beneficia população de MS com melhores oportunidades de emprego - O Pantaneiro,O Pantaneiro,"Tue, 03 Mar 2026 08:00:00 GMT",Qualificação beneficia população de MS com melhores oportunidades de emprego  O Pantaneiro,https://news.google.com/rss/articles/CBMiswFBVV95cUxPd2Rva055REZYekhJSFBxNjlsdjI4UjZCZHdXelA2dmgtZHZzbkNlcW5TMURQNE1aVWV2WUp0Q29PSVBwdnNQYU5vZFh6dE9HSWlzS3NwRnVzOGp0SUZGeEkwSWVhYU1SdWVPREFlTkpBY2hlVUdiNTZxd0M3dDd2VlZUUnI4S191cWtqS2Zqb0p3UG9nLTZQRVR4cUFsYUtCaTVBZVlVendrd3YtYVVtb3BlYw?oc=5
Anastácio,Educação e Negócios,Processo seletivo dos Bombeiros MS abre 230 vagas em 30 cidades - JC Concursos,JC Concursos,"Mon, 02 Jun 2025 07:00:00 GMT",Processo seletivo dos Bombeiros MS abre 230 vagas em 30 cidades  JC Concursos,https://news.google.com/rss/articles/CBMitgFBVV95cUxOcHRfT3hTeWZpYW9CM2F4dkFaV1BaeFlUbnB6dHVqcUFkc0NxYXphVEF2cFkwcmRxYnpMSG1sZ0ZVUkE5bWpDVmZkZTN5STdOTnJTZWxZaHF4R3RQcDB2LVhybFd1LVl2NE91LVRLUGlxOEZKZlVsN1JNS0FrZG9zbHJrWE5zZDVYZ2V0WmZVV1lHZ0lTdHowaUEycThIdDRnUmc0VVhoMFplYWdsd0s4cjlQbXh6Z9IBuwFBVV95cUxNcUxOUktqa29RUlhzcVhmMDYycm96cmxjc3pnUlpVbVlpb0c1bmY3TjJmaUNWZ0RESGpRVV9ubGlteFV2U3hKYlVlSzhYb0stZ2pZeGdrcGl6MTFadkd5dHdJUFdJV3FSX2NuVTJMUS1IMmRNNC1VQWlUVWFMbjBVZEx3dWhuZnotNUxPTGxsUTRTcGFMS045TDhfSXZBS0JlaFVxQndmbkZHUllndEZ0d0Y3M3JJc0kwSXMw?oc=5
Anastácio,Educação e Negócios,IFMS oferece cursos técnicos gratuitos; saiba como participar - Correio do Estado,Correio do Estado,"Tue, 10 Feb 2026 08:00:00 GMT",IFMS oferece cursos técnicos gratuitos; saiba como participar  Correio do Estado,https://news.google.com/rss/articles/CBMiqwFBVV95cUxQTDdEb1M1cWZXTFJqbUZlZEhXRmp6eGZ0LUZzS21vUEprTFFSWHhNMVhLc0F0cXRKaGV6TDJyS1RVYjRET2FwdGZESU00cmk4N3RyX21sMEpzSW44YXhvbFByQkFTNTIzbEpxMHEyYkh2S0haY0pFUVdfOUN5MWxobGJBbTdCQmJ3cE9haUxkeks5QVNub1kyUDRvUURQNVItRE5yak5WTXUxQ2s?oc=5
Anastácio,Política e Institucional,Café da manhã reúne lideranças religiosas durante comemorações dos 61 anos de Anastácio - Aquidauana Notícias,Aquidauana Notícias,"Fri, 29 May 2026 19:23:54 GMT",Café da manhã reúne lideranças religiosas durante comemorações dos 61 anos de Anastácio  Aquidauana Notícias,https://news.google.com/rss/articles/CBMiVEFVX3lxTFBibTE0d3V4S1JOazVqYXVoaVdDbUZyU3FscUdLZlRIQVNvQndTbm5KWGpBTm5TRndNODRCV2tnN09IY3pQWHd2a1BRTVM0M0R0M1VvRA?oc=5
Anastácio,Política e Institucional,Justiça atende pedido do MPMS e anula processo seletivo irregular em Anastácio - MPMS,MPMS,"Thu, 13 Nov 2025 08:00:00 GMT",Justiça atende pedido do MPMS e anula processo seletivo irregular em Anastácio  MPMS,https://news.google.com/rss/articles/CBMiugFBVV95cUxNZjNJV1BCbEZzbG4tbmlyblhZak9YM05JcHRwY3lHVTk1eElFMXd2TjVDMU1uVGxBeHhiYl80cjRISUpjaFk4aXhxS2RyZ2Z2NFpQeVFNdThHVGRnS2Vmd056UUZ4UW10ZWVycjlmLU9NQjlrc1p4RzdnMVNVMWtSbkhwRUlZTE1SRFhYMU5UNTE0X1ZVTFFfd25iNjhOZlprS3FsUTZfejBZSENjWC1TMFk3ME0yd3R0dWc?oc=5
Anastácio,Política e Institucional,Pacote de R$ 10 milhões prevê de ambulâncias no interior de MS - Midiamax,Midiamax,"Tue, 14 Apr 2026 07:00:00 GMT",Pacote de R$ 10 milhões prevê de ambulâncias no interior de MS  Midiamax,https://news.google.com/rss/articles/CBMipwFBVV95cUxNZmtuUGRfLWQ2Z04yYUUwX1FZblVFV3l5OXV6Z0EtQ2dGZXZFMDB2RmJRNUR5UXN0Z0VWNFN4RndxZENXUkExRC1vTl9HcWMxZHJSODI2dU1udHpFTWRYeHp4R1ZrM3hkRFhVUGNYRGk2MWp1S05GTlpqQ091cFdXRzFYeXlHc2ZsTzJITW5nTWFwYW1JcG9mZEY3ZGZxbWJfc3RONWNfVQ?oc=5
