municipio,categoria,titulo,fonte,data,resumo,link
Miranda,Social e Cultura,"Setesc fortalece apoio à cultura, ao esporte e ao turismo em nova edição do Contrato de Gestão - Fátima em Dia",Fátima em Dia,"Fri, 27 Feb 2026 08:00:00 GMT","Setesc fortalece apoio à cultura, ao esporte e ao turismo em nova edição do Contrato de Gestão  Fátima em Dia",https://news.google.com/rss/articles/CBMivgFBVV95cUxNRlgtT1czUmNLMmFXX3FpeklXeHNVdnNzZkxoOWYwNFNINnVmcFRObTQ2Q2VvWGU4amdJSXlZT1dnekxscEFkaEhtWVJ6QmVVRkc2SFdLNi1zdXZKdFRmV3hWcVNNc0NBWHJhTkdVYlFCM1ltT2JvNEN0b2Eyc3A2NDB0MVVlUUt0R19vcEFCZE9OQk81alN0MG9QNVppRV9GUzJHQnNWb1V1M1NNNTE5XzhVcmp0WlhYZWNBSi1n?oc=5
Miranda,Social e Cultura,Edital do FIC 2024 destina R$ 8 milhões para projetos culturais de pessoas físicas - Portal Único ms.gov.br,Portal Único ms.gov.br,"Thu, 05 Dec 2024 08:00:00 GMT",Edital do FIC 2024 destina R$ 8 milhões para projetos culturais de pessoas físicas  Portal Único ms.gov.br,https://news.google.com/rss/articles/CBMisgFBVV95cUxNRWlMSTI2MGVUTGRsQnFVSzBINE5ySUozcmItMGRrdTBlMGFhLWtuYTFYRkFSSTM1SFlNZ0JFQUxRenFvTGhEWVBXdDhWN1U5OXRzVnRibjQxVGkzR3NuZXZFU01Mc3ZIT29reHJrYVZCRXA4YW54Z2lLWmFJcmpKSXRzUTUwTWxfVGlMTGNCTHpPRmgxQlNISkY0SjczdzNxNXNmNFdyRTFNOV9Ha1FIQ3Zn?oc=5
Miranda,Educação e Negócios,Petrobras abre 715 vagas no Programa Jovem Aprendiz 2025: veja salário e benefícios - Seu Dinheiro,Seu Dinheiro,"Wed, 01 Oct 2025 11:52:07 GMT",Petrobras abre 715 vagas no Programa Jovem Aprendiz 2025: veja salário e benefícios  Seu Dinheiro,https://news.google.com/rss/articles/CBMiygFBVV95cUxQYVlFektiNGdjNkxkbEMyOFhiUV9DOWtqRURlRFg0VXNWWHRsZ2lPNjY1OEhXeHFlbHBOUE53MDdlaU9scVVITTY3YUhCSE9aUjItVzI1czVuVFdfZWlERktVSlFMMGUwcTF1UXRubGlpT0FnVFpkWE50ZkFnSFF4WkhSZlQzTWdWVkYxcHQwb0lnMGhiWGFXLTZOa0JNeUlJZlNwd01yakpaMTRXdURPeUJhTHQtU0dWemRzc2JGdEhXemNqcnNEdmZB?oc=5
Miranda,Educação e Negócios,GIRO FUNTRAB DE NOTÍCIAS – 03/06/2025 a 16/06/2025 - funtrab.ms.gov.br,funtrab.ms.gov.br,"Tue, 03 Jun 2025 07:00:00 GMT",GIRO FUNTRAB DE NOTÍCIAS – 03/06/2025 a 16/06/2025  funtrab.ms.gov.br,https://news.google.com/rss/articles/CBMihgFBVV95cUxOdThvX3U3ay1qR2dRN04ydUZIM3JZRWVqWU53Yzc2NFlFSWVfbmFHRnlGRkpHbmRaUnNKUDB6SWlIaGZLZHViV0xvNW1QSlBfRVRORHFzMDRuMGlrbmhmZFpacFpLVWt6QzJTMThTMzlCV2hvYVF5eDE3WHhFeWw3RXBHamc2UQ?oc=5
Miranda,Educação e Negócios,Corpo de Bombeiros divulga novo resultado da seleção para bombeiros temporários - Midiamax,Midiamax,"Fri, 17 Oct 2025 07:00:00 GMT",Corpo de Bombeiros divulga novo resultado da seleção para bombeiros temporários  Midiamax,https://news.google.com/rss/articles/CBMiwwFBVV95cUxOZHdRQVgzaklJd20tdFM1cUFkNFc5ZVR0TnZ3NTBqUGlwNXhJT1F0c0ZRQnBUMFFvaTVSNXRZODBwaDl4ZmxLVm1nbUhoNUwyeUZBYVExVkliUE54NU93S25Bc3gzeWNxcDhUMFBqcUdlUjNZMTRVMVBtMWdraFNNTkZCNGZQYTJLY3g1bzJDZWRHaVA2dXNwQlIydGhRdmFlY1pxYkYxQy15UmhGSHBqLThraW5zc2hvNC02cmZfdXgyN00?oc=5
Miranda,Educação e Negócios,"Com educação profissional e qualificação, MS é beneficiado com melhores oportunidades de emprego - agenciadenoticias.ms.gov.br",agenciadenoticias.ms.gov.br,"Tue, 03 Mar 2026 08:00:00 GMT","Com educação profissional e qualificação, MS é beneficiado com melhores oportunidades de emprego  agenciadenoticias.ms.gov.br",https://news.google.com/rss/articles/CBMi3gFBVV95cUxNYkRkTWpNYU1jQWs0T2pldWl3eUxiYVUwYUFVbzNLY3VFUkRLQ2J1NTR1OTMxU2t6YW5hcURiQlI3N29yU1pOSmVtVE52QUVycUQ0VnhqUmtxMXo2ZC1PZktHdGV1YW5CVGFKMjFjTmU3MWtPd1RibnVIQkJIYkVBWEt4UXZLdlJ2M3EwQlFMV3J6VkdMREZHWk0ya2hzck5peURoODJyLVI3NUVWX3VuWldySGNPVGs5M2cwY0VINlhRVkhoempUMl84NnNBTFJjVWhYbk5jVzd6aEZUNFE?oc=5
Miranda,Educação e Negócios,Escolas estaduais reabrem matrículas para cursos técnicos no Paraná - Consed,Consed,"Thu, 08 Jan 2026 08:00:00 GMT",Escolas estaduais reabrem matrículas para cursos técnicos no Paraná  Consed,https://news.google.com/rss/articles/CBMingFBVV95cUxQZGh3QldCOHJERFJvYV9tX0tGR2c4c2tlNEZSVGNuV29rQmE5bmc5bFhEeXhxbm55b0VtYVNVN25GQ1NGbHZnOVFKajRXVzRfVW81dUFBVU95QUl2Y1ZNVUdIV2dwamVkNk9veTJiekItOVBNbEd3SHRHamhON2Rud3dTeTFhakRfZlZ5Nk44MGIyUGE2em5CUzJGNm5iZw?oc=5
Miranda,Política e Institucional,"Próxima edição do Caminho do Acordo será na Aldeia Água Branca, em Aquidauana/MS - trf3.jus.br",trf3.jus.br,"Tue, 05 May 2026 07:00:00 GMT","Próxima edição do Caminho do Acordo será na Aldeia Água Branca, em Aquidauana/MS  trf3.jus.br",https://news.google.com/rss/articles/CBMitwFBVV95cUxOSjVSbWRXSHc2czhvMER6Mnd5RHVNY05jMm9iX3A2ejdJQU51VnNsMWtxdU1XTTl2Z1NSeTBqSVpCYzFhZ0Vzb0lSM2Q3STU2d2VXNjlwbEk5UlRRN3E1Y2JHd1d0d3lqTmlhMDJVVFpaVktJelJTdTFWX3Uta0NhLUQ5aWF0eFJ3VlM5cmd4WTlQM3FtaUlhRlN5RU56STdkVXY5UkQyNzZWUDNEV21DNWJsMlZhd1U?oc=5
Miranda,Política e Institucional,Dona de casa viaja 212 km para participar do Mutirão Todos em Ação – CGNotícias - campogrande.ms.gov.br,campogrande.ms.gov.br,"Sat, 25 Apr 2026 07:00:00 GMT",Dona de casa viaja 212 km para participar do Mutirão Todos em Ação – CGNotícias  campogrande.ms.gov.br,https://news.google.com/rss/articles/CBMivAFBVV95cUxNVzVBRXNMejgyeGVxSEkzSnpwc1A5SDBhaGdORHp3OC1NYVVPQ0VkTHg0NDVCb1F1TUxnRWkycEhnMUl2bHBrbXJsMDA5T2FFdmEyNjBQbnR0bi1yb29NRmdSS3NwUUpwUDdRZTRzUy1JS0VTRVF0WUtkMERpcGJRcGlQN3I1clJScDdaVlRZWFVjcmdmRVlxbnpMMlgwdTJtRUtzaXd6bzRIUm5GenRYZkJCRnpDMEd4UWt3Qg?oc=5
Miranda,Política e Institucional,"Samyr cobra recuperação da sinalização da BR – 262, entre Corumbá e Miranda - Correio de Corumbá",Correio de Corumbá,"Fri, 13 Mar 2026 07:00:00 GMT","Samyr cobra recuperação da sinalização da BR – 262, entre Corumbá e Miranda  Correio de Corumbá",https://news.google.com/rss/articles/CBMiwwFBVV95cUxONVMtNFZmSE44S3pmMUIzLUZpaXdmdzFfN1FxUFotU19Fb25VVUh3eTc1Yk9QOTVkY3MtZU1CZjRLakFscGlsZXg3NE1nOGVuSWRPSXFWYXJmVVUwcDQ5ZUdQRzVaQlZzV2FUWW1NaGVHQ0dZaFE2bnJFdlJUWU43UHR6QUlteVFyY0dKc29Va3pLdXlKNUNqa3lHWGRndWFQY1FzRzNhLU1nMEV6ZzVWNUJVMklfdnd2MzA4TnItekxnTHPSAcMBQVVfeXFMUEY5dkdzbnBzWEVBbk1QaVZEZzNNUk9nTGZiYXJrdEE2d3JHakV4QmlUdUJGb0wxMHRQc0JOYlVfdDZlTzNTMjYtNFJhM3JtNmVwYkZVeDNtaGY5blo5dDZ3S25UMVM1dXIwTDVwSzd6Vm9ueG5ab2hPZjN2aFZCbHpWTUdXeFVZRjNlUEFQdVlycHdZTlZKei1fMDYxN3FTTmtYX3lpMWMxQmdxM3NuT0lVYy1OSEZLRzJsVDNRT1M3UWdv?oc=5
Miranda,Política e Institucional,"Polícia Civil inaugura a 52ª Sala Lilás do MS, em Aparecida do Taboado - SINPOL-MS",SINPOL-MS,"Mon, 29 Sep 2025 07:00:00 GMT","Polícia Civil inaugura a 52ª Sala Lilás do MS, em Aparecida do Taboado  SINPOL-MS",https://news.google.com/rss/articles/CBMiqgFBVV95cUxQVGk0WEhNM0lmQzFrc2xiRWFROUFnUkM2aGI1cnFscXk5ZDJsclloM3lyQnhUS1E5RHBSRXJrTTY1S3VGZHVITno5Y2hHUVVjWEpURG1CWHRoUEtYNkhlcDJ2cTNCTF8zSFVfYXYxRU9udTZIY1BYTmtqOHJOZWUyYTd4aGZxdzV6NzFFU1RaWkhCekplb2ZvRFVxN3ViYzVYUWZzYVRmaTZnUQ?oc=5
Miranda,Política e Institucional,Três Lagoas debateu desafios e avanços na saúde do trabalhador em Conferência Municipal - Prefeitura Três Lagoas,Prefeitura Três Lagoas,"Fri, 11 Apr 2025 07:00:00 GMT",Três Lagoas debateu desafios e avanços na saúde do trabalhador em Conferência Municipal  Prefeitura Três Lagoas,https://news.google.com/rss/articles/CBMivgFBVV95cUxPcFdGcXhRcUllOWprV2c1dUc0TU5QSlRSUl9OLUtFaEZmaDhBLXpwZGd4UWtubmRMYTM1S1pybjV3VDFDenNqWUFxdkFJQjIzQ3RHdFFHRzFiMEJFMjZ0aVh5cUVSNUUzSGVDdVR1blVXOENYVTBFQVhnWk5ZcmN6eEhrRkFSWnl1ck5HQ3pHNmdDekJKQ2tDSTN0U29SYUVVTXVYVnZvSTVGLVhpQWZ4RVlIWHdhYzhXeDlDUl9B?oc=5
Mundo Novo,Social e Cultura,Sesc Teatro Prosa oferece semana de arte e lazer gratuito em Campo Grande - capitalnews.com.br,capitalnews.com.br,"Mon, 20 Apr 2026 07:00:00 GMT",Sesc Teatro Prosa oferece semana de arte e lazer gratuito em Campo Grande  capitalnews.com.br,https://news.google.com/rss/articles/CBMi0gFBVV95cUxPQkExNkh5blpBM2FFRXBKZGNnMXcycExSRkEzQV9uM290MTUyWDNYRS1NaHFqRld6cmpVQ0RIQ3dBX21vTE5obzZLcDhUWnpGa3RhblA2M0gwNnFZRlJMdFQ2QjVfNnpidTBwekNHOWlmVko5TFJXLVdjOTN0YzV3SkJnRnBRcGhEM2ZlR0tTWDhONDJQV2l6LXdmNXo5MldwbUdscWRIYmtWcDl4Nm90Z1ZIMi01U2Y1SjFRZG9JVHNFRkVBTlpTaXRuTDFzaEphVVE?oc=5
Mundo Novo,Social e Cultura,"Cine Sesi tem 2º maior público do ano em Bonito com 4,9 mil pessoas - Agência de Notícias da Indústria",Agência de Notícias da Indústria,"Tue, 25 Sep 2012 07:00:00 GMT","Cine Sesi tem 2º maior público do ano em Bonito com 4,9 mil pessoas  Agência de Notícias da Indústria",https://news.google.com/rss/articles/CBMi0gFBVV95cUxQNHRsNkdrcS1vTGxMOUFyR0d1UmtSc0ZNZ1FEN1ZhZHNSRzh0XzBsUml5MENpYVZ2RXcweFdEMHh2cFBZbEYxMU5iV1k5Z3B2cmlLU0QzRDZtbGVFWkpQcmwwb2UtaUZXMDRZTm5QUlNBOWJ0azBnV01zbjNvYmRWcHZKbkRYN2doRElyZHNRQUFjMlBiUDJERWRQN1ROOHZUVmExUkJLZm5HWmFDNHNMQ2xVdktYd25hZ0ZKbnBPTEV3REJIWFlSU3ZlVE0tM05pN3c?oc=5
Mundo Novo,Social e Cultura,Projeto Artesania fomenta cultura e geração de renda no interior por meio do artesanato - fundacaodecultura.ms.gov.br,fundacaodecultura.ms.gov.br,"Fri, 30 Aug 2024 07:00:00 GMT",Projeto Artesania fomenta cultura e geração de renda no interior por meio do artesanato  fundacaodecultura.ms.gov.br,https://news.google.com/rss/articles/CBMixwFBVV95cUxPMS1CRmJSdnVlZS1ZMWtrd3R5ZDctSnhNVlFoeUlsQ1FXUGlYMW93cnhseVRlVTRwclVEQWVvZWZTTmlndEFHaVBLeGswdjMzRjF0NVl2eDMxeVd2Sl9jWVpDZlRmM1dXblZIdEpDbnoyb0RVa2d6aVNlQnRBdG4xSklkMkFBNzVERkNmcjRsQ2VaSDJINEE0emJXQUx3WE1kZWRyTEtscDZzZFlwZmFpeHM2S2lzTmw4d1hWSDBwalRyOXVzbHRj?oc=5
Mundo Novo,Social e Cultura,Encontro de carros antigos transforma Praça São José em ponto de cultura e lazer em Amambai - A Gazeta News,A Gazeta News,"Mon, 27 Apr 2026 07:00:00 GMT",Encontro de carros antigos transforma Praça São José em ponto de cultura e lazer em Amambai  A Gazeta News,https://news.google.com/rss/articles/CBMiZkFVX3lxTE5SZVl5N0xmTk1VdWFHdEJtSVYzbzItbDFDRDJYR051Q25xYXBDUTl1SXhyMFB3RTlNVWRlSE5vdDlIZWptTnVXM21vQkVHM1lhQmRuVkU5MS05aGZYUTdUZVNZeTdkUQ?oc=5
Mundo Novo,Educação e Negócios,Funtrab e Biosul anunciam 2ª Rodada de Empregabilidade do Setor de Bioenergia com mais de 630 vagas em 15 municípios de MS - funtrab.ms.gov.br,funtrab.ms.gov.br,"Mon, 13 Oct 2025 07:00:00 GMT",Funtrab e Biosul anunciam 2ª Rodada de Empregabilidade do Setor de Bioenergia com mais de 630 vagas em 15 municípios de MS  funtrab.ms.gov.br,https://news.google.com/rss/articles/CBMi6AFBVV95cUxQY2luaWFYendqZk94aV9XR2trY08tdEJ6TlVmUmZwaHEtNHpydzFIczlDcVZFdmtQdVllMThTcnh5U2FLZGpfbVh2dlI5ODZVQWx4bmdPTk9McXBfaDZvTmE5dHNtM0xlVndwM3JaQTVkWkswMjduYm5CVmlDel9jTE9DazQtWERyNE9iM3ktWVNfS3A1UGFqbVlyT3AxN3l4dVF1OWk3TjhISkxhX3kyWVBWaXJiTHhzd1JDS3dIMUNaZVVkUzBNTkF2MUJ5OE1pcG9VRm9HeURTc1NjSDdfalhZZjNHMXhC?oc=5
Mundo Novo,Educação e Negócios,CCR MSVia está com 30 vagas de trabalho abertas em municípios de MS - Motiva Rodovias,Motiva Rodovias,"Fri, 01 Aug 2025 13:57:05 GMT",CCR MSVia está com 30 vagas de trabalho abertas em municípios de MS  Motiva Rodovias,https://news.google.com/rss/articles/CBMivwFBVV95cUxOd245czhPYXNyS0ZkMG03UzliYWlkeFFQRThicVNDQnRJZlZxOWo5eG5LM1ItTEJIbjRTTnF1MUEtSVc4MzVfY1JkcURsaDNiRzJkblVxUHhOUWlIS2wxX1ZCUmI5WGNtMlFnQVZadm1Pc05UUEE4X2tYN3Z3cXAwUERkWVdXNUhKU3RPVHEtRGdmWlI5WkV3Y3hST1NWUWlPX0RXU085VE5FNVAwcDNfdnA3Y1NUbDY3MHA3bXBpQQ?oc=5
Mundo Novo,Educação e Negócios,"Acabou a desculpa! SENAI tem mais de 8,3 mil vagas em vários cursos pelo Brasil - Agência de Notícias da Indústria",Agência de Notícias da Indústria,"Fri, 26 Apr 2024 07:00:00 GMT","Acabou a desculpa! SENAI tem mais de 8,3 mil vagas em vários cursos pelo Brasil  Agência de Notícias da Indústria",https://news.google.com/rss/articles/CBMiyAFBVV95cUxNcFlwckpLcUVCNG9lUVVHa1JzeWtNNFFaSVllNk9hYWVqQzRkSXdhbW85Qk1ua3oyXzJDTFowWldzZDZiWUVtbVVyVFFxWGMwNmJkWWVuNVd5MFQyT0VwYUFDQ3BqcGM0VVdFMWRZOHhQS1ExVFE1amhwRUdmdUI2UkVHdHhuSmdwRndGbWRBM1c0Njl2X29Lb3hKN3haWloxaVFKYWp1QS1NMk1rWW1RNnZwQ3J5WmtMd29MVU9jSXBkcGVlOVZFWg?oc=5
Mundo Novo,Educação e Negócios,GIRO FUNTRAB DE NOTÍCIAS – 03/06/2025 a 16/06/2025 - funtrab.ms.gov.br,funtrab.ms.gov.br,"Tue, 03 Jun 2025 07:00:00 GMT",GIRO FUNTRAB DE NOTÍCIAS – 03/06/2025 a 16/06/2025  funtrab.ms.gov.br,https://news.google.com/rss/articles/CBMihgFBVV95cUxOdThvX3U3ay1qR2dRN04ydUZIM3JZRWVqWU53Yzc2NFlFSWVfbmFHRnlGRkpHbmRaUnNKUDB6SWlIaGZLZHViV0xvNW1QSlBfRVRORHFzMDRuMGlrbmhmZFpacFpLVWt6QzJTMThTMzlCV2hvYVF5eDE3WHhFeWw3RXBHamc2UQ?oc=5
Mundo Novo,Educação e Negócios,Casa do Trabalhador de Caarapó promove vagas para Jovem Aprendiz em parceria com a Raízen - funtrab.ms.gov.br,funtrab.ms.gov.br,"Mon, 16 Jun 2025 15:32:54 GMT",Casa do Trabalhador de Caarapó promove vagas para Jovem Aprendiz em parceria com a Raízen  funtrab.ms.gov.br,https://news.google.com/rss/articles/CBMivAFBVV95cUxQTFdrWl9KLVk3S1dWU3lsU3BMRjRyZ1NoNnhBY216d3hsb2NEc0wyOEstWnVTZWIxbGN2bDlRb1Rub3RCblg1U2VxQXhIcDluRmFyNzUySWgxUU84LV9LVmp6OW1aRVVfYTNBVTJpTHFKTDFuVi1wMU45MFBWNjZzZWMtdkh5OGh6c1ByazlXNlNrZzU4Q01lRmhtLV92T0ZBWG9vRThQNFVoZW9YWmwxVWRrUWg5NVhLOUdXMw?oc=5
Mundo Novo,Política e Institucional,Visita técnica dá início a parceria com Saltos del Guairá - Prefeitura de São José do Rio Preto,Prefeitura de São José do Rio Preto,"Tue, 13 Jan 2026 08:00:00 GMT",Visita técnica dá início a parceria com Saltos del Guairá  Prefeitura de São José do Rio Preto,https://news.google.com/rss/articles/CBMingFBVV95cUxPakl0cGIxSHR5V2t3Z0l5WTd5VjctOFNBbHlfeWZTTnpVTkNLeW9GVllDXzFJMjMydWlsak01dDduQmNUNzdkME8yM3VPWklkdUhnQWdYaVNmNXRGVWlTMm5kNmp3OHNHSE9VYk5falg1SHlORHJ4SDE4Yk50T3ZKc1I1YTdkTGhHUG11TkxmTTlGNGhBWUNudHFLVmFRUQ?oc=5
Mundo Novo,Política e Institucional,"Polícia Civil inaugura a 53ª Sala Lilás do MS, em Japorã - sejusp.ms.gov.br",sejusp.ms.gov.br,"Fri, 24 Oct 2025 07:00:00 GMT","Polícia Civil inaugura a 53ª Sala Lilás do MS, em Japorã  sejusp.ms.gov.br",https://news.google.com/rss/articles/CBMijgFBVV95cUxPbExxTDdpU3U2U1otclpkdE9rRjJnTGNvNHoxd1JMOUNsLVFPUlhFSUFUVUNpb05rN2doZlFqc2FwSmhKTGhMN0JnYzZrN1ZWUFByWUhmMG5KSUFVOHJBQy1HM0xkdlMtbWlXXzZVc0w3Yk1Jb015MGk0c2VCN1ZrVXBaMVU4dXNfTGVGRFpn?oc=5
Mundo Novo,Política e Institucional,Riedel cumpre agenda em três cidades que fazem aniversário nesta quarta-feira - Midiamax,Midiamax,"Wed, 13 May 2026 07:00:00 GMT",Riedel cumpre agenda em três cidades que fazem aniversário nesta quarta-feira  Midiamax,https://news.google.com/rss/articles/CBMirgFBVV95cUxPSUdZSTd6MXg4YlVadHhlcjdxZFl0ZzJ5Zk5QS0RMNzNQVDcxRk1mczBWY0xuZC1OWmJGVTVwR3owVHVGZFJJdVlrVzVJMl9uSklBdjN2eWVnRGR6VXhOd3dzVXl1Z0M1NUx2RjdBN2JBc0x3YWNhekxmY2JBSnVQRFJ0cFBERS1SOTdOT2czSFQxTk81LWMwWW43TVZVemY3LWVielVDb196bENMOUE?oc=5
Mundo Novo,Política e Institucional,Polícia Civil inaugura a 51ª Sala Lilás em Mundo Novo - pc.ms.gov.br,pc.ms.gov.br,"Fri, 22 Aug 2025 07:00:00 GMT",Polícia Civil inaugura a 51ª Sala Lilás em Mundo Novo  pc.ms.gov.br,https://news.google.com/rss/articles/CBMihgFBVV95cUxNMUFJMjAxOHZSR0luNUF0anhENnhiMGVxTjA2dUF4WldGaXE2NG1BUzRZRll5LUc5dnVzckttR0NjVkpGdjFTQU9MblJ6YjhoUjJNNnBuN3YzTkdJaDdFTXRqRXlWcGl1d3dDTUxiT1ItTzNQU0V2VDBTVkJaQkFLdS1wejZsZw?oc=5
Mundo Novo,Política e Institucional,"Com expansão econômica em Ribas do Rio Pardo, Governo de MS investe em educação e infraestrutura - Portal Único ms.gov.br",Portal Único ms.gov.br,"Fri, 01 Aug 2025 07:00:00 GMT","Com expansão econômica em Ribas do Rio Pardo, Governo de MS investe em educação e infraestrutura  Portal Único ms.gov.br",https://news.google.com/rss/articles/CBMixAFBVV95cUxOSmdfS2ltNGl2UzNLVzhWT1lwNFFpWU9QRktlaHg3UjdkUVRtdWduc2g5Ry1QMGVKalV5WHFRQzNjbXo2eVpuWWVhRXBZT3B3TldOLTVrRlpWcS1jM2dJNE5qc3lHM0M4ZGJCdnc1YzUtcXBHenR4MENFb2c3U29lQlJRT1Y3blZhRUNfQ0M0R3hYV3RFd2hVcm8xeFZVdmNITXpSUEltT2JWY0txdDZjbTRiOU5MN1FUQ19NQXU4OVNNcmVH?oc=5
Naviraí,Social e Cultura,Neno Razuk investe mais de R$ 5 milhões em emendas e transforma municípios de MS - Assembleia Legislativa de Mato Grosso do Sul -,Assembleia Legislativa de Mato Grosso do Sul -,"Wed, 09 Jul 2025 07:00:00 GMT",Neno Razuk investe mais de R$ 5 milhões em emendas e transforma municípios de MS  Assembleia Legislativa de Mato Grosso do Sul -,https://news.google.com/rss/articles/CBMiwwFBVV95cUxQVEZZaXFodnY4Q08zWnF2clpBaXppa1o2TzRqUzZ4bktxWXE4UTF3bWh2OW5LbTFHT1AzU043UHJuak83MWJWc3lQdjVuNDh3S3I4TWJJOEsxbnpFVk9CSGNodXNKdFlNUWVJOGF6VFdkX2ZGS1REM3lnVWk5QV9XckJLLXhkcDh1MlFkSVdqZmRTa2ctU283S2E1dEoxUXcwWGxJeV9QaDFfblJnTHI1RXJDbm1WNHF2MWVYTEVMWXpPQzA?oc=5
Naviraí,Social e Cultura,"Agendão: bandeirinhas, forró e quitutes marcam o início das festas juninas em Mato Grosso do Sul - agenciadenoticias.ms.gov.br",agenciadenoticias.ms.gov.br,"Fri, 06 Jun 2025 07:00:00 GMT","Agendão: bandeirinhas, forró e quitutes marcam o início das festas juninas em Mato Grosso do Sul  agenciadenoticias.ms.gov.br",https://news.google.com/rss/articles/CBMiywFBVV95cUxPRzJQMTBIWFk5NmpsY1V4WWtWdUplRkRoTEVOenJDbmxLWTVWRE9lRkZPVzRwY3V1b3VhajR0RFZQVWxDYnpRemNWc29DeDY0TXN4UjhpUEFYY0h1bWVLbDlKWDY2bkRyLVhvU0ZWU0Yza3FqNHVHRmdTVnJ0NzU2VEgyRmFEVHlZVnpYMFk0RzJLZ0VObWwzRlQyN1o4bUlOeTU1ZjlnNUtIaUpRMWJJX1pSbmhrMWxfSmp2cDVTOUd4OEFhd3JaMmYwYw?oc=5
Naviraí,Social e Cultura,Calendário Oficial de Eventos Culturais de 2025 é definido pela Gestão Compromisso com o Futuro - navirai.ms.gov.br,navirai.ms.gov.br,"Wed, 19 Feb 2025 08:00:00 GMT",Calendário Oficial de Eventos Culturais de 2025 é definido pela Gestão Compromisso com o Futuro  navirai.ms.gov.br,https://news.google.com/rss/articles/CBMiygFBVV95cUxQaDRrODVNRzdfWHhHQ29qLVFtc3R6ckU3OTQtOElSMk1JTHpRanZ3WFhOY0NaN3NYcUczTmMwTGFNekdVT2xZWDk1QTlXc1hkMkVyeUJjV0JIb25XR3hGNXIydzJ5bGxpMGlNckdPbXYzWVBSZU1hWk9DeVp1cFBwNkFvRGVTOHQ2VUdsamNwc3RvZTFwUm1nSW1NT3F6NEI0Rkxha3liUV9KMTYyWjNqcDJWekVYQUluTUxCR1VDOE04bEJnTVhXWDJB?oc=5
Naviraí,Social e Cultura,"Colônia de Férias da FIRJAN, matrículas no SESI-MS e museu de ciência 4.0 na BA - Agência de Notícias da Indústria",Agência de Notícias da Indústria,"Fri, 25 Nov 2022 08:00:00 GMT","Colônia de Férias da FIRJAN, matrículas no SESI-MS e museu de ciência 4.0 na BA  Agência de Notícias da Indústria",https://news.google.com/rss/articles/CBMi3wFBVV95cUxNN2tMbnMwdVZmdDlBajNYTEd0eF9rYlB2Z1ZvV0pxSmVlRlZqQmUxMWJzOTU1dGpFWW9HSU5aZmQzeGVIN3FXN2lhZTg1WnY0MzhOUU4tR3F1WWlONlhCaTBoYm5OX3FYM180VlU2UWlRSW1LclJmckJFbWZnWVdBVW9oNWZQUmdBblZyQ1RGX0FHVERSeUdjeUpUUTMwY1FuM3RWVHc1WnBDOEo4MTJrNWJ5UmJqTmJDcVBNTGhudVFFbENfR3dfZ2otWUtDZTM1MGg2aHNVWkxhYlEzZlhN?oc=5
Naviraí,Social e Cultura,Ponta Porã recebe Festival Etnocultural dos Ervais - pontaporaemdia.com.br,pontaporaemdia.com.br,"Fri, 07 Jun 2024 07:00:00 GMT",Ponta Porã recebe Festival Etnocultural dos Ervais  pontaporaemdia.com.br,https://news.google.com/rss/articles/CBMinwFBVV95cUxOM0NPN1lmREpULW9ZY2w0LU5uUTJudmtVcTBxcVhRVkk5T05NOVVjZklvQzYwNWphd3JRcHJWdXAzVThId0pBRGZaUlJwOGRVRUowbjlvREtFa2FfZFR0emQ4WXlOc3daUVMtY1FCbFpLMW5vZlZEVFhkUE5pNEIxeXZQTWkzNk9Dck9YOVdSXzhMUEUtNTI4aGtLRXhnQ28?oc=5
Naviraí,Educação e Negócios,Senai MS: 2 mil vagas em cursos técnicos com bolsa de R$ 300; inscreva-se - Campo Grande News,Campo Grande News,"Fri, 13 Feb 2026 08:00:00 GMT",Senai MS: 2 mil vagas em cursos técnicos com bolsa de R$ 300; inscreva-se  Campo Grande News,https://news.google.com/rss/articles/CBMiygFBVV95cUxOWHVYVm1BR1ZyVVlueW43X1VYM3ZFMEU1ZlRfU0xfLTY3bmZFaHM1ZlZXNGFwMzJKRFhPajF1WDI1VjZ6ZWh2QkZacmtMSFlEMEJJOEI5VnN3c1Jab05rUjRCQW1ncUpoNmpBSGZnTlcwRlc5dFl6dXAySEV4bE4xZ1ViVjF2N2x0anBPNmZlTVFMQ014dVJqendPRnJLSlEtMk1vbEtkTUlEUTQzMEpUTWU2dG9ZeWI4eDEzUWtmblBOMmFxVS1SeklB0gHKAUFVX3lxTE1kbU4yTTRfSGxJMkRSUHljYThnRHh4WlppSHkwclI1Q0EyN0VVNVR1aDM2YTBpeWJvZU5hNWtBcnVoQ0xFbTBsTHBjLTg1d2dRTDM4TllLa0lEZXA2TnpPT0cxZWtrWXJtWGZJS0JveEZPVVhnTnFlT3ZfaHo1Q0JMRmt4YjI4QXdtTGQxV2UxSG1SejFEZ0hIOUVGZHNDeTlDeElucE11RG0tUUhaWm9JcHMxV2NydVgxekljWUlRQTdRWjdDVm9wSHc?oc=5
Naviraí,Educação e Negócios,"Com educação profissional e qualificação, MS é beneficiado com melhores oportunidades de emprego - tanamidianavirai.com.br",tanamidianavirai.com.br,"Wed, 04 Mar 2026 08:00:00 GMT","Com educação profissional e qualificação, MS é beneficiado com melhores oportunidades de emprego  tanamidianavirai.com.br",https://news.google.com/rss/articles/CBMiYkFVX3lxTFBoaVVkblZyNGdEaVNDLWpfTkFxM2U5UzdNZWhjWTRWbmlQblBMNDJpdGRfaFRNSkV0R0xYRXlSSU5BaUg0cDE5WmgybHcwMkREOHd4UDM0TlZ1XzRPdC1DRldn?oc=5
Naviraí,Educação e Negócios,Empresa do setor têxtil abre 50 vagas de emprego em Naviraí e oferece qualificação - funtrab.ms.gov.br,funtrab.ms.gov.br,"Wed, 02 Jul 2025 07:00:00 GMT",Empresa do setor têxtil abre 50 vagas de emprego em Naviraí e oferece qualificação  funtrab.ms.gov.br,https://news.google.com/rss/articles/CBMiswFBVV95cUxPbzdqMmtVVmtad2VvOHVBY0ZKa0hnNDdSeW9US3lNNEFhSG5iOTNoaDFXT3Awa05FTlVWYmVVajFJdm1fZ3JtTmZtbmdqTEFaSDJKbWlyYTY3Q3RPUnhzMUVfUWI0VkJMQnZ5dTZNTkxGa05SUWxPVmlPclZJUmF3aE9seWMtQ2ZNUDdIYS1pWGpVVXV5a2szbktIc2ptMmFLZG83WGNaUEdhNlpUbUJic1owVQ?oc=5
Naviraí,Educação e Negócios,IFMS abre vagas em cursos técnicos em 7 cidades; matrícula é por ordem de chegada - Campo Grande News,Campo Grande News,"Tue, 10 Feb 2026 08:00:00 GMT",IFMS abre vagas em cursos técnicos em 7 cidades; matrícula é por ordem de chegada  Campo Grande News,https://news.google.com/rss/articles/CBMirwFBVV95cUxQdDJPcWhlNnl3aFh3RERLdzkxci1QNXJEbmFXOS1lZDJVaFp5Ync0X0hTUzl1ZTAyM2V2cXZCaW90b2plSENWVnJwenBHOTgyZGM1QkxlTmJwS1pFQUx6enhaNFViMkswOG4yOV9NWjNrMEp0RDZBWmhtMzRMUW5iN041U1hNN3NwdHRFU0N4V1VaRjNWVGhpYjIzbnE1OGktcHpXXy1nVDVvVkVpanFB0gGvAUFVX3lxTE16SHZHcEVoc05JdVY4SjdxQ1NLd3BESEFDa2JQVTdNcXloWWlPNHQzVGtNY2RndThhLU9WbzgxbFJKOHhLV3FOYVB5d1JaRU01TC1qcW9USnRBVTJGOU5Td2RXV1lYWmNJOS02ZEVpMWliTUZuaEQ2RHJyWlh5OXhrT25fdldGVzI0cE5ydkVxMG9sLW9rXzZxdGNXTU5iMkRIYW9jSHh6VXRUSlB4YmM?oc=5
Naviraí,Educação e Negócios,Bioenergia: rodada de empregabilidade oferece mais de 630 vagas em 15 municípios de MS - agenciadenoticias.ms.gov.br,agenciadenoticias.ms.gov.br,"Tue, 14 Oct 2025 07:00:00 GMT",Bioenergia: rodada de empregabilidade oferece mais de 630 vagas em 15 municípios de MS  agenciadenoticias.ms.gov.br,https://news.google.com/rss/articles/CBMivwFBVV95cUxQcW5JeHRPc3ZJb3hTWklBWFEwSDYxN2pvZmllZ2NTVURiMnhIWDdUUnQ1ZDF4X3BQd2xsOG44NVY2Q3FHRUd0N0dYNUdiajRuanBBMTBCcW92ZnNJNjRBS2VCRWRadmRoUUV5TUJhY1JFUlZfb21yNkhYZXZLVnUzTVgzV0lFZnN5RWt4Vl9YUjNrZkZHeVppNDJraWtBYWZnWmtBU2R4TThoWXJ5VzVubEwtN1lyUWRrYjl4RjVaTQ?oc=5
Naviraí,Política e Institucional,Hashioka participa de evento de prestação de contas e assinatura de convênios em Naviraí - Assembleia Legislativa de Mato Grosso do Sul -,Assembleia Legislativa de Mato Grosso do Sul -,"Fri, 13 Mar 2026 07:00:00 GMT",Hashioka participa de evento de prestação de contas e assinatura de convênios em Naviraí  Assembleia Legislativa de Mato Grosso do Sul -,https://news.google.com/rss/articles/CBMizwFBVV95cUxPZHBBMGcxZXBNdmFLZHNaVVZQNTBlQnkyRG16X2p3VlFqWG9yTGlWUGNlc0Y5dzFaT1BHYnZ3ZjVudzdEWlBGc2p2Wi12NGVmZlJydmtUbURPZlFmT3pyR1M2Z2lLbzk3WnJfOG9Wb2gzeFcxNHVVQ3czU3BnaGlrVXVycjBHZGl4Vm5LUk9JcDVlbEk5alVxdXp3dGJsRkl4WmpRZ1Ffc3g1UHVWWVBaS0tnX3lSQW16MS0xWnFVdHprWUxvbjVmNV8zb3RBNkk?oc=5
Naviraí,Política e Institucional,Justiça de MS suspende cargo de procurador-geral adjunto preenchido sem concurso - Primeira Página,Primeira Página,"Wed, 13 May 2026 07:00:00 GMT",Justiça de MS suspende cargo de procurador-geral adjunto preenchido sem concurso  Primeira Página,https://news.google.com/rss/articles/CBMiuwFBVV95cUxOeXlPdXotUzZrNHVKZ2RPMW05dG1IQlhPaWVzZ19Mck9JcExMRWJpNkFfTVdYNFFTUTl1a0RGYUNBVWpYaGl2bVY0Q3NhdjJITy02QTB2U0paSlU2eWlvdHJwbFJyZWFRWUxzcHV1SHVnU28xYUpMRVRNRmJlU1liS0RLVzhFYUNoUWlTZ0t0dTlEc3pOaTJKYk95TUwzSTdPLXJodXN2REVrM2pOSEhaTEE0TWFmSnQ1NERJ?oc=5
Naviraí,Política e Institucional,Em Naviraí corte de salário do Prefeito pode impactar em redução de serviços na Saúde - navirai.ms.gov.br,navirai.ms.gov.br,"Tue, 29 Jul 2025 07:00:00 GMT",Em Naviraí corte de salário do Prefeito pode impactar em redução de serviços na Saúde  navirai.ms.gov.br,https://news.google.com/rss/articles/CBMivAFBVV95cUxNbzc4bkVic0NjOFI1bnRYUDVVRmJBdklUdG5OUEZucGU5bTBXYWh3Ykd3a09UemVsOFByMzRvMEk0a0xZck9EVlRscmt3cXdPeS1xUUNzeWpsVEJPX1J2NVZrZXRoZm1OTUVXUGlNMHVrQnoxUHZFZHhPUFhmUExSd1Z2bkJ5b3kxM0dPWExTRDh2bHNSWm04aktHakJYTW1mLUgwSlg5Ymo0MU9DRy1DLTNncmtxT2NEbTRFcw?oc=5
Naviraí,Política e Institucional,"Naviraí contrata empresa por R$ 1,4 milhão para revitalizar iluminação pública - Midiamax",Midiamax,"Fri, 24 Apr 2026 07:00:00 GMT","Naviraí contrata empresa por R$ 1,4 milhão para revitalizar iluminação pública  Midiamax",https://news.google.com/rss/articles/CBMivAFBVV95cUxQb2IwcTU2SW5qLVNXSWhiNlRPMERFdkVZWVdhZ0h1c0pySE91ZzkwcGRRR1NRTHJhMkdXd1ZqRmFiRlRLeWFEZS1MNEJCWEo4RWJvZHpiRHR2WDdUNWk3d19zWExKWDctSVhfWGlJcUxtdUw4VThHVHpWcEl6UmlVMW5YamNRa1M0QklEajNSbnVZeFg0alZ4RjlKWENGbnVweUNCQWlOejVQd2tGTlBOTVJYVWk4WjAyajQwRw?oc=5
Naviraí,Política e Institucional,Naviraiense sob investigação: uso irregular de recursos públicos? - Campo Grande News,Campo Grande News,"Tue, 10 Mar 2026 07:00:00 GMT",Naviraiense sob investigação: uso irregular de recursos públicos?  Campo Grande News,https://news.google.com/rss/articles/CBMiqgFBVV95cUxQLTZTY0xSVjB6ZGE1UHJhSENtNWctb21Hdnd6VHl5TlVtZHlLNFZJUmZnUExES09TU2RucEp2YVl2YjNDMXVKVVBiLWUtRVkyYmszRXhwcGgzRHZZME02WF9DMEM3VVZTTDV6V29sMVI4UnRCZ2JkQ0ZOblQyN3R1cndaZElpendQeUZOOV9VUk9ReGhPNlE1bUFpWGlPQWt5eHo2SVRPQUhRd9IBqgFBVV95cUxOaDBrVEJ2M3UwdjdIV1pKOV9VQkRlZnFWa0pLeGlGUXg3V0NHd2RleFJTeEJoWWhBV2psZmQ2ZHlUaHg3WU5fTHllR3dYUGNKNno0bzN1TW1faDFNbUlqWlB1REJNOWxsS2Z5RnBnV19HZzZDbDBtWW50SjVQcGM3SmZjUkhoWHBUYzJHNmtpQkVPTXJfa1AtZXhhU3VjNjNBRjBvbHBaZEZYUQ?oc=5
Nova Andradina,Social e Cultura,36ª Corrida do Trabalhador reúne em Nova Andradina atletas de quatro estados - Prefeitura Municipal de Nova Andradina,Prefeitura Municipal de Nova Andradina,"Mon, 04 May 2026 11:05:00 GMT",36ª Corrida do Trabalhador reúne em Nova Andradina atletas de quatro estados  Prefeitura Municipal de Nova Andradina,https://news.google.com/rss/articles/CBMi1AFBVV95cUxNSG9lcE5NXy1HYzRTbXRPeVdxZ1JpeU9CRlBkbDFkajNFMnF2bl9DNFRaY3kxTGdmYjlQTkRLY2xWa2U5OXlTeHBxZ2VEeGd1Rno2NTZvajRZSmQzckQxemZFbF80Qk50R04tNzVNVkd3cE43ZnYzaFhfYS14clF1eFlmcVFDMEY4cTlrVlVCS0sxZ29DV3JscUxCdmgxRV9EX3piZUlUSmRwVlI0b0FuN1VlNWgxakQ3SEpNdFRZdklCYTFNMDN6Y2tWMDUyc0tQbTE0Qw?oc=5
