municipio,categoria,titulo,fonte,data,resumo,link
Bela Vista,Política e Institucional,TJMS determina revisão do plano de drenagem em Campo Grande - Campo Grande News,Campo Grande News,"Tue, 24 Mar 2026 07:00:00 GMT",TJMS determina revisão do plano de drenagem em Campo Grande  Campo Grande News,https://news.google.com/rss/articles/CBMixwFBVV95cUxQck9VNWRnSWJ5djBtbWgtT1gwT2VaSk1ITk1yVXJCYzVWLVZlbU5aU0p2dkhESWFtcDBnODB3bWhOMUlqRlNDdko1N3VhUWVVR01MTlVHbDBzWFl1bkNXM1RZeThOemxXeWNGZFBKa0ttM0pSV19sZzBTRzZWWUFycGo2WnpFZVZIYVRHOGdac2JRM3BSS0Rid3VnOGZQQnhpcEI0SUJVLUh2ay03M2lUNUQ3cVZhNTNtS0ZlMlRpdmZoTmhOaVZr0gHHAUFVX3lxTE9QSDFTZlFqMDE3VlVzYmE5YmpmZmFtRzlSdnIzRG51bEJmNk4yZEdTanR4cDc0RnNIN0dyYXdENlBKQjNhdkp6T0ttTmVfcVM1ZzNidk9pZFdVazFnLVNyeHZoZ3plWjE0ZEFMdTV6dFlKSy0xWXRwQjI1Wl8xS3l6T2ZjTlR3czhRTjNmTGRUekIyZ2xKcXg0MlFpcXU1NEU4UjBTQzBFOE1HUEY2cVBzRFp5SjduVDhSSFZaVUhmdFV3cVE0Mk0?oc=5
Bela Vista,Política e Institucional,Descarte irregular de resíduos de saúde: MP investiga vereador em Bela Vista - Campo Grande News,Campo Grande News,"Wed, 31 Dec 2025 08:00:00 GMT",Descarte irregular de resíduos de saúde: MP investiga vereador em Bela Vista  Campo Grande News,https://news.google.com/rss/articles/CBMixwFBVV95cUxQQjVjNkEzdU10NHNTV3NJYV93UUpKWXNxMXl6ZzF0UUg5SHFXZ2VjOE9DSF83Vnl6ZDRzT3FXUkM3eEUyVlNCTHlKTi1nRjlJWEJtdXVDSmMyS0NVME1OcDZqU0NkREZjbjZFWlhqLXZRS2luRS1pcXptOEpYanhNeDl5ZXpOMGFYRDJRaWphOFpkNThpeWd0cnVqOFhuektXcTRoT294bkt4YXIyY0gwdUd5LWJHSWJyZ3pFdkhNVEFLUjJPanNB0gHHAUFVX3lxTE9XZUpRX0RPLXVKQ3pubENkc21Wa01pc0t4U0tRenpRc2c5S1FTbFZmYVFKMEdLd0dUQ0poUkl5RlRBcFU1VVY4dGJYVDdTdEdrdEdJWUZrUUpadWNFOGJjaU5KNXp3YzhqRlRTTWgta1FjOVNsdVUwcENUVDVzZDJJNzRuYWU1VU5wX2h3RExlSlVBQ2dDTFRRNThGeVA5M1RrQ1BOSmJySVJaTEJWY2UzMzZvZ2VlOERpektfVEItNE1laXJLbFk?oc=5
Brasilândia,Social e Cultura,Brasilândia se prepara para o Desfile Cívico Cultural em comemoração aos 61 anos da cidade - Notícias em Rede,Notícias em Rede,"Thu, 16 Apr 2026 14:08:01 GMT",Brasilândia se prepara para o Desfile Cívico Cultural em comemoração aos 61 anos da cidade  Notícias em Rede,https://news.google.com/rss/articles/CBMizwFBVV95cUxQNWc4T0V0M1JfdkZBQnFlTzROZ3ZPV3dEUHRMRlJDYVVpbzY4dnZfTEpQNG8tMF80ZkpkWFB1UHhQWjkwRXQwTjVQOW1kb0hwM1RDalRQMXRia053b2tZZldqSDNKZGYxblg3ZlcwUHhsb2FwUG9NUG9mdWpkeFZvWWpNcUM3T2pjb3V0ckhDSHQzRlFyQ2FXbGhWNVN3X1N5bUU4YUkxSXIzRGFva2M3M3Rhd0M3dUNEOFhiYzZkMlg1RHhNR05aOGFOSVA2UDQ?oc=5
Brasilândia,Social e Cultura,"Virada Cultural 2025 de SP: veja programação completa do evento, que completa 20 anos - G1",G1,"Thu, 15 May 2025 07:00:00 GMT","Virada Cultural 2025 de SP: veja programação completa do evento, que completa 20 anos  G1",https://news.google.com/rss/articles/CBMi2AFBVV95cUxOenN6MDR2X1VQWVZOUllUU0J3eTVMZFdPd1p5R3oyNkxmOVJ5NHp4LWJvVmRxR2hYWDVIcVJqSExiODd2WmoyOXZBaGFUS0dsbUo4XzFLdEd6N2h1OVdwcGhYYU9qLUo0LU5tY1ZKaFJqaEg2RFlHMFdIZlBsOHdlNWhremR1XzBOaXJvNWJpVmdZckw0M01KTXN0Smt5VUcyNDB6V3c0OWFRZFBiVjZOM2JObDUtVk9OSkVTNk04dEVENzVZXzZJb1JtYzdRdnoyV2llSWt3NnHSAecBQVVfeXFMTjlhNlRWQjRYLWNWTUdDbW5yc0Z0SUFneWdDdXFzUTI0Znd0cE9yekNLUHN5TmZNWVpPTDdWYzZ3Z1hyQ1dVc0ZYYzNVaEk2NFBidFJFVXBKcThkSGRicWNmSmREaHUwMjFvZU1QNmJqMHJpbW9abWt2NEtFVjZFWXRmckRYWWN2UU1mV3YtZXhHOElJbnlVYkZQREo1UmM5WnBqeW9tM19pYktQNVlCUHlqd1NNZ1lzVk9JWWdZYkRyRFU0OGlvQXZ0el91ODB6Z1p4eXRiTFp3MG51dlRKU2ZMQmxXMmQ0?oc=5
Brasilândia,Social e Cultura,"Cine Sesi Cultural finaliza 3ª etapa com 101,6 mil pessoas em 32 cidades - Agência de Notícias da Indústria",Agência de Notícias da Indústria,"Mon, 12 Nov 2012 08:00:00 GMT","Cine Sesi Cultural finaliza 3ª etapa com 101,6 mil pessoas em 32 cidades  Agência de Notícias da Indústria",https://news.google.com/rss/articles/CBMi2AFBVV95cUxPb2s0TFZTN1VsNUxCcm5kdFdhMzBnMjJIdWFITFkxa0Iza0Q0SGlMem9TeGdkU2FDeHZZUE1WR3VxVGV0T08temhMVmRwempUbW5Cdm9YN3N0aF9zYUJNZkVTTzRmbXlZc1NhZmtGUE9CbG0zblRyejhPbU5Va2ltdUU5TlJ2Zy1Gb3VJdU9oY1hSN0pBdy1ua1ZETFkxb0VfejFNLXctS0VIekNYQWNYYnBiQk5QRDJoV01uM3NRNHUxOTZyTWp0NkUyLUw3T2JhTzNlazRJNDU?oc=5
Brasilândia,Social e Cultura,"Com R$ 3,2 bilhões, MS teve aumento de 227% nos investimentos públicos nos últimos três anos - agenciadenoticias.ms.gov.br",agenciadenoticias.ms.gov.br,"Mon, 01 Apr 2024 07:00:00 GMT","Com R$ 3,2 bilhões, MS teve aumento de 227% nos investimentos públicos nos últimos três anos  agenciadenoticias.ms.gov.br",https://news.google.com/rss/articles/CBMiwwFBVV95cUxNNWJHNDZxaXVJLXRDSjNlZTEtREg5TzBXcVg1OTBQTk9JSnctd0Q1Q0Vaai1TUzRWeHBNeFVuYnM0d21DcGoxV0tYWFZFZ3o3T1ZwU0hiX040dzFKYThQaG1GSzNLNENDeFJRbUVmVGphVjA0VEFsQ01kaDZYbUJhUzN2ZVlJaENhUUNZUmRoNENXaU5saWtRRGxvdnJ1UXc5bzV1cldQUHhsZzJ5NmNKU0o4amRBNzM3bk1HTlNYTUhYX2c?oc=5
Brasilândia,Social e Cultura,"Caarapó reúne mais de 6,5 mil pessoas na praça para o Cine Sesi Cultural - Agência de Notícias da Indústria",Agência de Notícias da Indústria,"Tue, 14 Aug 2012 07:00:00 GMT","Caarapó reúne mais de 6,5 mil pessoas na praça para o Cine Sesi Cultural  Agência de Notícias da Indústria",https://news.google.com/rss/articles/CBMi2AFBVV95cUxONFBHdUp4XzhaYkZkUk5OX3V1QzBfc1NTN1N5ejhDZzEzcmgyWUVYVFIxalducnNyMnQ0RG1MMkJYWUVzbjl5SFpiUVlmZ3Axamp0akJKSGFSX1ZsZnRVWEp3TFktYjRpeVlmRFpWM1JSR0tocFBoWnhkb3RwVnRhQ3ZweUhZWjFnbmJEVmRUTDV1QVktRmM3ZU0ycHdOenZJajN4ZXR3SE1wNjNkUGpXSWhrQXZJRXdnZTlWNDZRdEtjQ2ZFcTZxUW5QVHJZa19jdWxzb1FMcU0?oc=5
Brasilândia,Educação e Negócios,Casa do Trabalhador de Brasilândia supera mil atendimentos e garante 74 inserções no mercado em pouco mais de 100 dias - funtrab.ms.gov.br,funtrab.ms.gov.br,"Mon, 04 May 2026 18:57:12 GMT",Casa do Trabalhador de Brasilândia supera mil atendimentos e garante 74 inserções no mercado em pouco mais de 100 dias  funtrab.ms.gov.br,https://news.google.com/rss/articles/CBMi4wFBVV95cUxNX2RLSDBXMGdsME5uYWlkZUJiTDdHSEYwUGwwbVEwSnRmdW56TmZ6eXRaLUdac1RzLWRfOVZfUnJlaEhUcUtiR1VBT3ktLUdjYnA5Z0pLVHBJeXg0WTRJc2NHOE1sbTIxejVWd0x1Ym0wcnFueFBGVExQQnlkbmZjUjd4STBOOTR3aDl5amd1cGh0ZEpySGJ3ZzNyaEhSQ2U2Sm1OYXdSZFdzTnhqdUNmMWhzVnBzMXNhbEh3TWFJQldFaGRYOTVUdWdma1c5X1RvOE1TZFlSamlzUzJTU3JmLVZXRQ?oc=5
Brasilândia,Política e Institucional,Funtrab inaugura Casa do Trabalhador de Brasilândia e amplia acesso a emprego e qualificação profissional - funtrab.ms.gov.br,funtrab.ms.gov.br,"Mon, 19 Jan 2026 08:00:00 GMT",Funtrab inaugura Casa do Trabalhador de Brasilândia e amplia acesso a emprego e qualificação profissional  funtrab.ms.gov.br,https://news.google.com/rss/articles/CBMi0gFBVV95cUxNelFaZGVCS2lIVlZ6c3Nmb0NMMkoxVnpLOUoyeG1SOW1Dc2dMZ2lqcy1ZR1c3SHB1bWJnR0xTVWNOYUVVV012Y2h6UlgyYmJfNXRmekdBMmJtRXdvT2dOc1duTXhYb1FoSlY4aURPdGY2UXlWNURRb1JrdF9hUEtRM3NvZnBROWphQm1DcVBMRENVdkZrbmc2RmNvNHRENjI3aFhJY0pxLTZ6b0lwbE90YkY4d3FGU1R1YllBenpkMDJlYmdpSUFEN1dRVkdnakN2bUE?oc=5
Brasilândia,Política e Institucional,"Pesquisa que transforma: Professor da rede municipal apresenta estudo sobre os impactos do programa ""Cuidar Bem"" à gestão municipal - Notícias em Rede",Notícias em Rede,"Thu, 09 Apr 2026 07:00:00 GMT","Pesquisa que transforma: Professor da rede municipal apresenta estudo sobre os impactos do programa ""Cuidar Bem"" à gestão municipal  Notícias em Rede",https://news.google.com/rss/articles/CBMihAJBVV95cUxNWWJQRGd1ZDhCQnhNalFPUUdNMDBXVlhqYTdUeVZnOVpHWDdhZnA0TXdUOTF1YVdQMHBqR2txczF3bDRnWElXM2FvVkd6Vk9DWUUzRVpmWVBnYWdQVW9xTy1scnktUkdlTTZRdzNPQ21vUWgySDY4RlVaNUZ3UWpIN2lOWmdyZmQ5N1ctakxETDRoZmVFZFNuam1qajB4aFBlWk94cmFMcUUxSnFwRmxnMGJtdnRNbzZGa3Z5akNzLVROUTN4TW9mbjVZTVZVdktjYzhRX25yRDhXX2M2bERLNV9mb3hpTUVHZW8yc2I2aTBCMTBxWjFnOHRDUkhlRG1jbVFfeQ?oc=5
Brasilândia,Política e Institucional,Prefeitura de Brasilândia-MS abre seleção para cadastro reserva - Ache Concursos,Ache Concursos,"Fri, 13 Mar 2026 07:00:00 GMT",Prefeitura de Brasilândia-MS abre seleção para cadastro reserva  Ache Concursos,https://news.google.com/rss/articles/CBMi2AFBVV95cUxPdjZ3YVNrRVkySmExczVrMWJDSldzRGNHNjFnN3JveDMydkZqblY2T0NoYUY4cU5CcXl2aDZ0UmFodm44ZF9ZNWtISTdNb3g2ZWU2Z0FpUjJaZjlYcDVNVWhqS3dLOFBTLVJzaDdrc05HZ2lXQl9yUFoyVjNIcGlxSGI2QmNEME9xWC1vSHV5dDNOZUtYc1BzU2w0N29zMUFqRGFuRV9fRUpjN3h0ZU5NZW1fY0tZcnFTaTRyVlZLbGp4eHFRX1hkXzVzcFhQaE1zOGdKMkRwU03SAd4BQVVfeXFMTjRNenduTWtrcFEyMWFTWl83OW5ZZVZpMGlBb2Q1am5KRlc3a3lxQlZ0WXN1ekxDX1dfSDFEcUFRbTNuNzA2MjQwblZYNnlvTFgxR2JDb2E4N092WnMtdEx5NVhiZDN2X1ZtUHVuYlA1VXdYTEw0R2hxaFpVUm1kWDRzbk9IdTgxVVItSVgxeTNVZnphV1VHNHZNaFhXRVdrOW11VWt6Y0IxSkZsNUtlNnh5TmJzSFVzcV9pWkdFbWdING9RLTktbnJCaXNVMktSa0NNMGJUQVZFRFJPVGF3?oc=5
Brasilândia,Política e Institucional,"Prefeitura de Brasilândia - MS republica processo seletivo com salários de até R$ 8,8 mil - PCI Concursos",PCI Concursos,"Fri, 13 Mar 2026 07:00:00 GMT","Prefeitura de Brasilândia - MS republica processo seletivo com salários de até R$ 8,8 mil  PCI Concursos",https://news.google.com/rss/articles/CBMiwwFBVV95cUxNSGE4ZEU0NnZKdl9INExuVXU0TWdZcGg3eUZHd29IaHlMbFhObjZqTkxEelhlRFZzcFJha0JyODFyNVFJeVd4RWlNV1RVRFJuczQtNloxbTlqbHNqN2dYa3I4NUJ3WTh1VmNDZFBpeWIwYVhMSkFKclNLR0p6SGxIZFVRRVhBOXFLVGZYVjJYZlJGWmZKSC1uR2ZaVlE2bV9pRmV0RnRPVDM0TnRtbVVrOThwSlNaTlFHNjkzLUhLRzZ4b1E?oc=5
Brasilândia,Política e Institucional,TRF3 e JFMS iniciam atendimentos do Juizado Especial Federal Itinerante no Assentamento Mutum em Mato Grosso do Sul - trf3.jus.br,trf3.jus.br,"Mon, 19 May 2025 07:00:00 GMT",TRF3 e JFMS iniciam atendimentos do Juizado Especial Federal Itinerante no Assentamento Mutum em Mato Grosso do Sul  trf3.jus.br,https://news.google.com/rss/articles/CBMitgFBVV95cUxNNlpfUHRJSzhqc1M3MlVzZU01TFlYQUZlNV9reEwyQkdnMFpyWVN3Ml9uM3doY1YxYy05cDJEUkJ1S2p5UzJLalBnR0R0MjBjLU13Uzlua0htVHVnLW9zMmtXbXI5bXl6T0NSRnVZb3l5bG1QOVNZU05LZVVWT2NXX0VvMTZLY2pIVVR5bXM0Mjh1eWJRcVo2ZDBaVDBMYU5ERmFYQWgxWkk0OXpKeVk4U3hqWVFSdw?oc=5
Caarapó,Social e Cultura,"Agendão: música sertaneja, Museu do Videogame e feiras agitam o fim de semana - agenciadenoticias.ms.gov.br",agenciadenoticias.ms.gov.br,"Fri, 30 Jan 2026 08:00:00 GMT","Agendão: música sertaneja, Museu do Videogame e feiras agitam o fim de semana  agenciadenoticias.ms.gov.br",https://news.google.com/rss/articles/CBMisgFBVV95cUxNTmdvVkc4M2M5LTduazZKQ2lTMm9PYzAyc0trTnFNZElxSGltbS1BUEtiZG03UC1vWGwxd1Z1LXk5VmFpSzhJTlJ3cGtQS1lYZ1dmN09pQzlUcGlXbUJQVUxmRlhidk80dXBpOTJLT3RQVEFEcUFXZXhJVTlCUm40UDZIcVowaFY2UWRaRno3OGZhY3VYZ05iV3hQY2hKeFl4N190N2hnRkZHU0J5YnFFWnpB?oc=5
Caarapó,Social e Cultura,Neno Razuk investe mais de R$ 5 milhões em emendas e transforma municípios de MS - Assembleia Legislativa de Mato Grosso do Sul -,Assembleia Legislativa de Mato Grosso do Sul -,"Wed, 09 Jul 2025 07:00:00 GMT",Neno Razuk investe mais de R$ 5 milhões em emendas e transforma municípios de MS  Assembleia Legislativa de Mato Grosso do Sul -,https://news.google.com/rss/articles/CBMiwwFBVV95cUxQVEZZaXFodnY4Q08zWnF2clpBaXppa1o2TzRqUzZ4bktxWXE4UTF3bWh2OW5LbTFHT1AzU043UHJuak83MWJWc3lQdjVuNDh3S3I4TWJJOEsxbnpFVk9CSGNodXNKdFlNUWVJOGF6VFdkX2ZGS1REM3lnVWk5QV9XckJLLXhkcDh1MlFkSVdqZmRTa2ctU283S2E1dEoxUXcwWGxJeV9QaDFfblJnTHI1RXJDbm1WNHF2MWVYTEVMWXpPQzA?oc=5
Caarapó,Social e Cultura,"Caarapó reúne mais de 6,5 mil pessoas na praça para o Cine Sesi Cultural - Agência de Notícias da Indústria",Agência de Notícias da Indústria,"Tue, 14 Aug 2012 07:00:00 GMT","Caarapó reúne mais de 6,5 mil pessoas na praça para o Cine Sesi Cultural  Agência de Notícias da Indústria",https://news.google.com/rss/articles/CBMi2AFBVV95cUxONFBHdUp4XzhaYkZkUk5OX3V1QzBfc1NTN1N5ejhDZzEzcmgyWUVYVFIxalducnNyMnQ0RG1MMkJYWUVzbjl5SFpiUVlmZ3Axamp0akJKSGFSX1ZsZnRVWEp3TFktYjRpeVlmRFpWM1JSR0tocFBoWnhkb3RwVnRhQ3ZweUhZWjFnbmJEVmRUTDV1QVktRmM3ZU0ycHdOenZJajN4ZXR3SE1wNjNkUGpXSWhrQXZJRXdnZTlWNDZRdEtjQ2ZFcTZxUW5QVHJZa19jdWxzb1FMcU0?oc=5
Caarapó,Social e Cultura,"Cine Sesi tem 2º maior público do ano em Bonito com 4,9 mil pessoas - Agência de Notícias da Indústria",Agência de Notícias da Indústria,"Tue, 25 Sep 2012 07:00:00 GMT","Cine Sesi tem 2º maior público do ano em Bonito com 4,9 mil pessoas  Agência de Notícias da Indústria",https://news.google.com/rss/articles/CBMi0gFBVV95cUxQNHRsNkdrcS1vTGxMOUFyR0d1UmtSc0ZNZ1FEN1ZhZHNSRzh0XzBsUml5MENpYVZ2RXcweFdEMHh2cFBZbEYxMU5iV1k5Z3B2cmlLU0QzRDZtbGVFWkpQcmwwb2UtaUZXMDRZTm5QUlNBOWJ0azBnV01zbjNvYmRWcHZKbkRYN2doRElyZHNRQUFjMlBiUDJERWRQN1ROOHZUVmExUkJLZm5HWmFDNHNMQ2xVdktYd25hZ0ZKbnBPTEV3REJIWFlSU3ZlVE0tM05pN3c?oc=5
Caarapó,Social e Cultura,"Cine Sesi Cultural finaliza 3ª etapa com 101,6 mil pessoas em 32 cidades - Agência de Notícias da Indústria",Agência de Notícias da Indústria,"Mon, 12 Nov 2012 08:00:00 GMT","Cine Sesi Cultural finaliza 3ª etapa com 101,6 mil pessoas em 32 cidades  Agência de Notícias da Indústria",https://news.google.com/rss/articles/CBMi2AFBVV95cUxPb2s0TFZTN1VsNUxCcm5kdFdhMzBnMjJIdWFITFkxa0Iza0Q0SGlMem9TeGdkU2FDeHZZUE1WR3VxVGV0T08temhMVmRwempUbW5Cdm9YN3N0aF9zYUJNZkVTTzRmbXlZc1NhZmtGUE9CbG0zblRyejhPbU5Va2ltdUU5TlJ2Zy1Gb3VJdU9oY1hSN0pBdy1ua1ZETFkxb0VfejFNLXctS0VIekNYQWNYYnBiQk5QRDJoV01uM3NRNHUxOTZyTWp0NkUyLUw3T2JhTzNlazRJNDU?oc=5
Caarapó,Educação e Negócios,Bioenergia: rodada de empregabilidade oferece mais de 630 vagas em 15 municípios de MS - Portal Único ms.gov.br,Portal Único ms.gov.br,"Thu, 16 Oct 2025 07:00:00 GMT",Bioenergia: rodada de empregabilidade oferece mais de 630 vagas em 15 municípios de MS  Portal Único ms.gov.br,https://news.google.com/rss/articles/CBMitwFBVV95cUxNbVkySUF3eWluQmJNak1yT3l1cWcxWVZES3BndzhCbWhzbFZ6WW1hNnZ2U0h3Y1k3bjh3N2xFX3Nxa2JjWFNkY3l2Zl92aVVWUjNxS2pvblhRWjhIOTBIdDhhQXIwX1hYTF9WLVNuQ3IzNlUzZ2hlZjBsX2FybWVmOEptRzkzaERwNnpCXzJDRWJIT0xaeXpac0xqQzNnVmhXUkt1Vy1ZUUsyTHFObW1PNmxlbzFNNlU?oc=5
Caarapó,Educação e Negócios,MS registra alta de empregos formais em julho de 2025 com saldo de 3.023 vagas - funtrab.ms.gov.br,funtrab.ms.gov.br,"Thu, 28 Aug 2025 07:00:00 GMT",MS registra alta de empregos formais em julho de 2025 com saldo de 3.023 vagas  funtrab.ms.gov.br,https://news.google.com/rss/articles/CBMirgFBVV95cUxQRkh0Mm5nSExZRUVOLXdrd2VmSUJ6ZFdoMVRLdV92N3NYZElmOTJvRUNfNzM4TGJwdHNtbXFKZzdIY1pWT1FMOGQwMnd1cEVyZkRSbmZyQVd1bk4yWEh6WGhXdDQyWmdJamRVU09xQzAzY3R1X2lBQkZpNDZYUXRNSTlyOGJkRzJyTWlBQzkyS1lEaDNlb0JQM0dtd2xqbHB4U1RQQW8zRS1Dcjh5Qmc?oc=5
Caarapó,Educação e Negócios,Raízen abre mais de 400 vagas para programa de aprendiz - Revista Cultivar,Revista Cultivar,"Tue, 21 Oct 2025 07:00:00 GMT",Raízen abre mais de 400 vagas para programa de aprendiz  Revista Cultivar,https://news.google.com/rss/articles/CBMimwFBVV95cUxQdE0tMDZKM2Y1bXdaaG5LVFhrbWx5QXV4ajN3YkJhbDdUa2drWXctR3FhQmxXY2wwMnNDWGdqZGsyZXRwVWdDYUk5cjB4ZFljelVxRzFZWlV6NDNaLV9nZVpxMkpjNEt3eXdpMjFpV3NxTUF5SEVMVlNyZ3pCWWxYU2E3Y1g4Tk1mX21za3VvclVaV3FsdjExbFVhUQ?oc=5
Caarapó,Educação e Negócios,Funtrab e Biosul iniciam 2ª Rodada da Empregabilidade com 637 vagas em 15 municípios - semadesc.ms.gov.br,semadesc.ms.gov.br,"Fri, 17 Oct 2025 07:00:00 GMT",Funtrab e Biosul iniciam 2ª Rodada da Empregabilidade com 637 vagas em 15 municípios  semadesc.ms.gov.br,https://news.google.com/rss/articles/CBMitwFBVV95cUxPLTExZjBSc2RrVkRVbndZUm83LVg3VlhnWHRzV0tkeF81ZllZU2hmck4yRmt1ZGZPNVI3Ylc4RnhsbVBOU3Y4Z0FWM2RlZkE3MGJKSzQ5NHdaQXBBbWNCWm9jdHpJakhDbTVUdDRPM3ptTnBVcWZpSzdKN1U1ZFVlTTlpSlJxSUw5ZFVYcnNIcmROcnRyeGwyWFdRVTZxTXkwdDJSUGhNOGFmR1dPdzluVFZVREtQMkE?oc=5
Caarapó,Educação e Negócios,GIRO FUNTRAB DE NOTÍCIAS – 03/06/2025 a 16/06/2025 - funtrab.ms.gov.br,funtrab.ms.gov.br,"Tue, 03 Jun 2025 07:00:00 GMT",GIRO FUNTRAB DE NOTÍCIAS – 03/06/2025 a 16/06/2025  funtrab.ms.gov.br,https://news.google.com/rss/articles/CBMihgFBVV95cUxOdThvX3U3ay1qR2dRN04ydUZIM3JZRWVqWU53Yzc2NFlFSWVfbmFHRnlGRkpHbmRaUnNKUDB6SWlIaGZLZHViV0xvNW1QSlBfRVRORHFzMDRuMGlrbmhmZFpacFpLVWt6QzJTMThTMzlCV2hvYVF5eDE3WHhFeWw3RXBHamc2UQ?oc=5
Caarapó,Política e Institucional,"Câmara de Caarapó devolve à prefeitura R$ 3,7 milhões; dinheiro ajuda erguer hospital e quitar folha do serviço municipal - Midiamax",Midiamax,"Fri, 09 Jan 2026 08:00:00 GMT","Câmara de Caarapó devolve à prefeitura R$ 3,7 milhões; dinheiro ajuda erguer hospital e quitar folha do serviço municipal  Midiamax",https://news.google.com/rss/articles/CBMi8wFBVV95cUxNVkRUNkpSbUlyYkRLRlBlX0cyd1p1RmotUkplX0ctdW5NVTJTVHVQRi11VE94WEM3VDJHSjdXQVNwbHpabWZtbllyVFBFemZ6TlZrWEMyajZKdVpFY1owY0ZINVZtZXdJakttbWJnS20wZVEyNjRfdklidW1JeU80T1Y0UWg3QzNWOXV5UHg5RDRBZ1Q3d3V2WEUwT1Jud1NJQ0ZWaVE0MnhIbnZ5blFmMGdydC1sdjFWb0dja1VFS2V0Szk5WS1sUkt6ajB5eENoSTlYMWdabTZEel8tQ3ppT1pfZUVFTFFXRjF5SkpfX0pPSGM?oc=5
Caarapó,Política e Institucional,Prefeitura abre licitação para ampliar balneário de Caarapó com novos quiosques e banheiros - capitalnews.com.br,capitalnews.com.br,"Mon, 26 Jan 2026 08:00:00 GMT",Prefeitura abre licitação para ampliar balneário de Caarapó com novos quiosques e banheiros  capitalnews.com.br,https://news.google.com/rss/articles/CBMi7AFBVV95cUxNOHFsM0FIQ1Y0ZjRfOTdRc0hWcGc0SFptWmxaZWhfRmZtNUd3WUpFOTJmc09wVHdseGdxemVkV1VXZzNwajIydGZoOURxVUtwWjh2WlZvUEFDaHR0TFZrUTRlbVI5QUNVVHFNN1E5ZnpnVGVyT0Iya3ZmNVl3Rm5CSzF4N0FlTEtvOGJ4ZmUza3lwSzFSRlQ1STRXeGFpUFdVRkktWkZNd1ZZcEx3SENHRzc3TVVMWG1FQm5keFVBaHZsd1VnSnZwRlM4bFFRMlVsUVNTRzRtOVJBa0dKWFFxT3oyeWd4a19TS21ZZA?oc=5
Caarapó,Política e Institucional,Prefeitura de Caarapó (MS) publica edital com oportunidades em diversos níveis - Concursos no Brasil,Concursos no Brasil,"Tue, 03 Feb 2026 08:00:00 GMT",Prefeitura de Caarapó (MS) publica edital com oportunidades em diversos níveis  Concursos no Brasil,https://news.google.com/rss/articles/CBMiywFBVV95cUxOQWlab0tuc2xBaFhXSnRraVdOTkdHcXJWMWJpVURlNGpQZG5pN3hFLVYwNnhyWnVPaXJ5dlJpbmFGUVJuX0VCUmZURzljcEJ2TTN4R3BVbl9DMHhzOUxaYXFUeVNaYlN3RlBtTDdLYm5VTHF4bG9jN1o0M3U5SklhTFRJYXhOR2RoMzA3NE12bzNlRmNhcWZRX19FbFd3T1k5U0E5RGIwYTd0c0dkZGtCWEtWb3ZfYjVxSkZEY3UzQkJZVmllWHhUVmpDcw?oc=5
Caarapó,Política e Institucional,"Sem licitação, Prefeitura de Caarapó firma contrato de R$ 390 mil para plataforma de IA - Caarapó News",Caarapó News,"Fri, 16 Jan 2026 08:00:00 GMT","Sem licitação, Prefeitura de Caarapó firma contrato de R$ 390 mil para plataforma de IA  Caarapó News",https://news.google.com/rss/articles/CBMiywFBVV95cUxPcFAxb3E4SF95TGEwNFFkT2xwYmNXUEl5N3g3QzNDSTFTcTVKQndocTduSUt5SWpYNnZnQUdmX1U0OHM5RnNrRzRKM2VCVUVhVHpaNVhVb3RSOUp6STRHamxTekpHT0JENVFOTjVRWUVaVmNRSXlYcXdoa0RNdUtXN0pqcVVEVDFWRDJYc1JDOFNpQUZtaWZyVzk5RzlETldoQzdEc0lVYk1LOWVPTURnY2p0YTExMlVvTmx1ZmhQTENHN0VsRHd0WkkxTQ?oc=5
Caarapó,Política e Institucional,"Para escoamento de produção e acesso urbano, Caarapó apresenta projetos de pavimentação ao MS Ativo - agenciadenoticias.ms.gov.br",agenciadenoticias.ms.gov.br,"Mon, 19 May 2025 07:00:00 GMT","Para escoamento de produção e acesso urbano, Caarapó apresenta projetos de pavimentação ao MS Ativo  agenciadenoticias.ms.gov.br",https://news.google.com/rss/articles/CBMi0AFBVV95cUxQNUNrZ19jWFVXVmdZYmVnTkRhbXpGdjRSRm5wZXN4MWsycjVKUG1yWW9hX3Y4U1ZnakI0bnhJXzVvaHAzczQwbzhiU2pJT21mUUc4aElHODRiSEg0MjZ1S2FQbC1tS0tEZ0VpaVFwemc5YlhleDVBaTZQRUtEbnRZZWhoemlPc1RSNGtCVlZJTWNTalZyM1VSajFybWdHYWtYVC1TRFBJRWxrQktPYVU4cEs2R2NZdmJHWm41NnR1by1GMVpyX3dlZDdGR1pDeEVX?oc=5
Cassilândia,Social e Cultura,Oficina estratégica realizada pela Fundtur MS fortalece planejamento do turismo em Cassilândia - Mato Grosso do Sul Notícias,Mato Grosso do Sul Notícias,"Thu, 23 Apr 2026 00:11:38 GMT",Oficina estratégica realizada pela Fundtur MS fortalece planejamento do turismo em Cassilândia  Mato Grosso do Sul Notícias,https://news.google.com/rss/articles/CBMi2gFBVV95cUxQcDlYNlYzdkJkTGotOW51MXg0V2l3N085dkVXZldqMDFKaE1JYjFyVkRoSmNfNHV0NTZZOFpSQXpDQU9NcTdIWnk2SkZwRk1Bc3ZWXzM4cFVfQVNPZWd4akJ5NUEzUDRoQnZ3d3p5UDZscHU0Ulg2NnJIb1hDcGRLRnNJN3lsU0F0YWRYMGdabFV4Y2RwQmRHVno1TkI5a1ZHek16YlltTC1vY0YzeU9sR1FObUxfRURxcGFDZWlwa29HcEJIUjFMWmFDb3oxOHBOM1hfSWF5VXA4Zw?oc=5
Cassilândia,Social e Cultura,"Cine Sesi Cultural finaliza 3ª etapa com 101,6 mil pessoas em 32 cidades - Agência de Notícias da Indústria",Agência de Notícias da Indústria,"Mon, 12 Nov 2012 08:00:00 GMT","Cine Sesi Cultural finaliza 3ª etapa com 101,6 mil pessoas em 32 cidades  Agência de Notícias da Indústria",https://news.google.com/rss/articles/CBMi2AFBVV95cUxPb2s0TFZTN1VsNUxCcm5kdFdhMzBnMjJIdWFITFkxa0Iza0Q0SGlMem9TeGdkU2FDeHZZUE1WR3VxVGV0T08temhMVmRwempUbW5Cdm9YN3N0aF9zYUJNZkVTTzRmbXlZc1NhZmtGUE9CbG0zblRyejhPbU5Va2ltdUU5TlJ2Zy1Gb3VJdU9oY1hSN0pBdy1ua1ZETFkxb0VfejFNLXctS0VIekNYQWNYYnBiQk5QRDJoV01uM3NRNHUxOTZyTWp0NkUyLUw3T2JhTzNlazRJNDU?oc=5
Cassilândia,Social e Cultura,Infraestrutura aérea de MS avança com investimentos que conectam o Estado ao mundo - agenciadenoticias.ms.gov.br,agenciadenoticias.ms.gov.br,"Sat, 28 Dec 2024 08:00:00 GMT",Infraestrutura aérea de MS avança com investimentos que conectam o Estado ao mundo  agenciadenoticias.ms.gov.br,https://news.google.com/rss/articles/CBMiuwFBVV95cUxPelJQaEVNMmk0RkNneEpRVWZ2QVM2Qi1xOVdpMnZicURDcUVKM0NTcDV1Y0RiNXNYYWxzOW9ianFsTjNDSkM5RWc3MHRBNjRrb1JsZEJQdFlvSDdKRmloX2VVemxMSzJHWDJsMXR0U1gtT01OTFoxcUdyOU5XcXpqanRUTUtwSmtjaExlVjNfei1ReXllMG1sVDJBRWFZbzlmTEJiVThCUUMzYTlSN2RyeGpWRXNmQ2o1eFZB?oc=5
Cassilândia,Social e Cultura,"Caarapó reúne mais de 6,5 mil pessoas na praça para o Cine Sesi Cultural - Agência de Notícias da Indústria",Agência de Notícias da Indústria,"Tue, 14 Aug 2012 07:00:00 GMT","Caarapó reúne mais de 6,5 mil pessoas na praça para o Cine Sesi Cultural  Agência de Notícias da Indústria",https://news.google.com/rss/articles/CBMi2AFBVV95cUxONFBHdUp4XzhaYkZkUk5OX3V1QzBfc1NTN1N5ejhDZzEzcmgyWUVYVFIxalducnNyMnQ0RG1MMkJYWUVzbjl5SFpiUVlmZ3Axamp0akJKSGFSX1ZsZnRVWEp3TFktYjRpeVlmRFpWM1JSR0tocFBoWnhkb3RwVnRhQ3ZweUhZWjFnbmJEVmRUTDV1QVktRmM3ZU0ycHdOenZJajN4ZXR3SE1wNjNkUGpXSWhrQXZJRXdnZTlWNDZRdEtjQ2ZFcTZxUW5QVHJZa19jdWxzb1FMcU0?oc=5
Cassilândia,Social e Cultura,"Cine Sesi tem 2º maior público do ano em Bonito com 4,9 mil pessoas - Agência de Notícias da Indústria",Agência de Notícias da Indústria,"Tue, 25 Sep 2012 07:00:00 GMT","Cine Sesi tem 2º maior público do ano em Bonito com 4,9 mil pessoas  Agência de Notícias da Indústria",https://news.google.com/rss/articles/CBMi0gFBVV95cUxQNHRsNkdrcS1vTGxMOUFyR0d1UmtSc0ZNZ1FEN1ZhZHNSRzh0XzBsUml5MENpYVZ2RXcweFdEMHh2cFBZbEYxMU5iV1k5Z3B2cmlLU0QzRDZtbGVFWkpQcmwwb2UtaUZXMDRZTm5QUlNBOWJ0azBnV01zbjNvYmRWcHZKbkRYN2doRElyZHNRQUFjMlBiUDJERWRQN1ROOHZUVmExUkJLZm5HWmFDNHNMQ2xVdktYd25hZ0ZKbnBPTEV3REJIWFlSU3ZlVE0tM05pN3c?oc=5
Cassilândia,Educação e Negócios,"Funtrab anuncia vários cursos gratuitos de qualificação no Estado, veja como se inscrever - funtrab.ms.gov.br",funtrab.ms.gov.br,"Thu, 18 Sep 2025 07:00:00 GMT","Funtrab anuncia vários cursos gratuitos de qualificação no Estado, veja como se inscrever  funtrab.ms.gov.br",https://news.google.com/rss/articles/CBMiuwFBVV95cUxOODR2ZHNIZHNUUnJyVU05ZXdod21jYld3UWNyaDBLZVdzQzBPZTZkQUM4Ml9fYW1OUjd0dGFUck5FVG56MFdhQTNDWlEycEhQVVRIdUx5aUJTQ0ZVT1BUeXczTkFqenZTWnp2R2YzZkZIVGViMmZtMXJfeEF3RDRsaFRUMktXTmtHSW5WaG9mZ2lOaThRNmZ3cU13ZEtLSjZJSHJfVGF3SlRKRFpWNmtJbVQ3RHo1RDVkeXdv?oc=5
Cassilândia,Política e Institucional,"Ao lado do prefeito Rodrigo, Caravina entrega recu... - Assembleia Legislativa de Mato Grosso do Sul -",Assembleia Legislativa de Mato Grosso do Sul -,"Fri, 08 May 2026 22:56:00 GMT","Ao lado do prefeito Rodrigo, Caravina entrega recu...  Assembleia Legislativa de Mato Grosso do Sul -",https://news.google.com/rss/articles/CBMitAFBVV95cUxONklXSHpITDZMNzYxUkVCS19yTGdvaVlzQU5jVTdCVHl1dEZhRGk5ZHFCUVFvQVJTNzdKREVPSDJibDVXYjh3WFNSNGd1dG1EVlY3bjVLTDZ5T0FFRXFvZFJEV1VXZ1pqZjNUYUo2RUhkdGZ5UTdLSi1PZFExUVFUYi1QWk16eEU4TkRWUUxiSWhXR0U0Q0pXYm41NmtfZll5cjNiNVRRbElVTVJaSzlteDV0Snk?oc=5
Cassilândia,Política e Institucional,Cassilândia recebe R$ 500 mil articulados por Geraldo para ampliar exames e diagnóstico precoce - Dourados News,Dourados News,"Thu, 07 May 2026 20:35:00 GMT",Cassilândia recebe R$ 500 mil articulados por Geraldo para ampliar exames e diagnóstico precoce  Dourados News,https://news.google.com/rss/articles/CBMiwgFBVV95cUxQRGFva3d5NkFUV20xZml6bW95U1g0SkJXV1g0NExiVEZodnVWWDRfTHQ4U1FsWjRnWnIzSlJSaTF4ZXpORFktTkZ1R3NONTdWaFRLMmxqUzRjVTVpQ2dDcTZFR1dDemx6UkNWODlnSUVkbFJ2eUJBUnY4X1pnaUExNzdDREhSdkZQTzQ0SjdMaW4zRGVPV3NNbkxibG1wWkFTR1pvZkU3YVc3VkFSMk5kN0ptQ2hCOWxoUjNkaVM2UVRXUdIBugFBVV95cUxOWlFyeVN3dTRyZFNDcTBTcl82NnhmT0VJcnp4SUhFYlJOQl9Ib3lXeldEdWs5ZFlWR2hXWksydF96VjFZRTd0RFNFZ3Z5cDg2YmR3REdVUW9SeUkwbHBrVUt1UEltTU1wNjJLbUtfNExxZUV1SDJOaUQ5VkEyMlhCMk1OdURKSmxyS0VYam9SRzVpbzNFY2hDV2szaEwzdkR4REhlVmtuQ2ZaSHpoUHljRjRPNVlSWUg0T3c?oc=5
Cassilândia,Política e Institucional,Prefeitura de Cassilândia convida população para Audiência Pública da LDO 2027 - O Correio News,O Correio News,"Mon, 13 Apr 2026 11:53:01 GMT",Prefeitura de Cassilândia convida população para Audiência Pública da LDO 2027  O Correio News,https://news.google.com/rss/articles/CBMivwFBVV95cUxNMHJVQ3p6blFLVHJOMlFFSHVQdDZDeEVCanJSM0llOWZkRjREcm5NM3JmXzVhV002TzlXd1NKNEV6dF90TFZtc0djejQyTmJycUhIR2FRZThmdi1XVVhfZEtkM3RzRHk3QS1VNmxfRUljVE91UnhkMFNJbENCaFAyZU5OUlFUbGJkZmhWb3NCOU83YnprZXJ0RWtzeHVrS09DVGRkNmRHN2lfRVZiOVlkRDBqYlZrQkM2UU1LdlNWWQ?oc=5
Cassilândia,Política e Institucional,"Após cancelar contratações por fraude, Cassilândia volta à mira de investigação por seleção temporária - Midiamax",Midiamax,"Tue, 13 Jan 2026 08:00:00 GMT","Após cancelar contratações por fraude, Cassilândia volta à mira de investigação por seleção temporária  Midiamax",https://news.google.com/rss/articles/CBMi2AFBVV95cUxOMktMbUw2TlE4Y1oxdTRHeHcwSl83LWhsbjZXNEIwUXZ6c2NNZ3BiMzA3WkdhVmlweU9UbGI5VHRnOFJUMzdUcDhvdF9YWEM2Y19HY0l4dEduU1d3b2JrVG5tUl9GWkc4SDdxSWJXRW9rajhvYzItOEhmdGFfTjdHMEdZN01pT3VDSlNIRFdlVkZWUXNJU21JVVV5UkY3bXllYWdOM2gyOTJOckR6QXkxTG8zOGRWeHZfQTgyOTNibnBwSXBVczlRdmdvR3FqZHVlWV9NQm5OWWo?oc=5
