municipio,categoria,titulo,fonte,data,resumo,link
Água Clara,Social e Cultura,Neno Razuk investe mais de R$ 5 milhões em emendas e transforma municípios de MS - Assembleia Legislativa de Mato Grosso do Sul -,Assembleia Legislativa de Mato Grosso do Sul -,"Wed, 09 Jul 2025 07:00:00 GMT",Neno Razuk investe mais de R$ 5 milhões em emendas e transforma municípios de MS  Assembleia Legislativa de Mato Grosso do Sul -,https://news.google.com/rss/articles/CBMiwwFBVV95cUxQVEZZaXFodnY4Q08zWnF2clpBaXppa1o2TzRqUzZ4bktxWXE4UTF3bWh2OW5LbTFHT1AzU043UHJuak83MWJWc3lQdjVuNDh3S3I4TWJJOEsxbnpFVk9CSGNodXNKdFlNUWVJOGF6VFdkX2ZGS1REM3lnVWk5QV9XckJLLXhkcDh1MlFkSVdqZmRTa2ctU283S2E1dEoxUXcwWGxJeV9QaDFfblJnTHI1RXJDbm1WNHF2MWVYTEVMWXpPQzA?oc=5
Água Clara,Social e Cultura,Água Clara em festa: Governo do Estado entrega novas moradias e dá início a obra na MS-324 - ArapuaNews,ArapuaNews,"Sun, 08 Feb 2026 08:00:00 GMT",Água Clara em festa: Governo do Estado entrega novas moradias e dá início a obra na MS-324  ArapuaNews,https://news.google.com/rss/articles/CBMitwFBVV95cUxOaXZXckg4T1FGX0JhM3l4bGhueVNOSnJfT2NuX2cyenNnSTlrVDZpNTUzT2RSTXFDb2RZbExaRHlSdjQ4cUxONlBsYTQxQWNHZU5IVTNQSjZ3amUyQXRnc29mYXhHM1hCOVNwWWZYTDlCWHFyNElXdDIxSi1zeXVOU2ZyOXpCQi15aWw0TXBHZUdqZWxWNmVYMjBLMEJSZTVibGs3dFN2SUZIcTVWZjZfLUhISXNQU0U?oc=5
Água Clara,Social e Cultura,Infraestrutura aérea de MS avança com investimentos que conectam o Estado ao mundo - agenciadenoticias.ms.gov.br,agenciadenoticias.ms.gov.br,"Sat, 28 Dec 2024 08:00:00 GMT",Infraestrutura aérea de MS avança com investimentos que conectam o Estado ao mundo  agenciadenoticias.ms.gov.br,https://news.google.com/rss/articles/CBMiuwFBVV95cUxPelJQaEVNMmk0RkNneEpRVWZ2QVM2Qi1xOVdpMnZicURDcUVKM0NTcDV1Y0RiNXNYYWxzOW9ianFsTjNDSkM5RWc3MHRBNjRrb1JsZEJQdFlvSDdKRmloX2VVemxMSzJHWDJsMXR0U1gtT01OTFoxcUdyOU5XcXpqanRUTUtwSmtjaExlVjNfei1ReXllMG1sVDJBRWFZbzlmTEJiVThCUUMzYTlSN2RyeGpWRXNmQ2o1eFZB?oc=5
Água Clara,Social e Cultura,"FCMS comemora o ""Ano do Teatro"" em Mato Grosso do Sul - O Pantaneiro",O Pantaneiro,"Sat, 24 Dec 2011 08:00:00 GMT","FCMS comemora o ""Ano do Teatro"" em Mato Grosso do Sul  O Pantaneiro",https://news.google.com/rss/articles/CBMinwFBVV95cUxObFV4VW5rN1hDM3Vra3NDWVJtb1BjRWVINXdkUXhEYS04dkU1TG5UdlpTaWcxX2FZV05ucTVaemd5ckdDTUtSWG1uUHNLLTBCUldaVlhGdEVfVFJydkJoMUsyQ0NaYjNaNV9YUm5qY0JmRkdIU1JRajRzc09UbG0tR214VV9wVGI4dmVpS3N5emExZnA1MUZVTUMyNnpha1E?oc=5
Água Clara,Social e Cultura,11ª Festa das Nações movimenta Água Clara/MS de 9 a 11 de maio - ArapuaNews,ArapuaNews,"Mon, 05 May 2025 07:00:00 GMT",11ª Festa das Nações movimenta Água Clara/MS de 9 a 11 de maio  ArapuaNews,https://news.google.com/rss/articles/CBMikwFBVV95cUxPeWtQd0lFS25XMEMwem9sdGk1MEN2TEVjYmQwalBSR2FOVmR3RG1ZRC1DT01uc29xNHg1ZXF0RDRtb3FJV2c1NUtQTlZ3VjE1cVAwZTdLYU5Vd1JUbDFwaUlnMVdiVlpHWmpxN0FiZEFjcVV1ZFpGM1hzc1hvd0Q5bFJMNnN4R0RkRFhjS2E4d0lhLXc?oc=5
Água Clara,Educação e Negócios,Sindicato divulga vagas abertas em indústrias de celulose na região do Bolsão - Midiamax,Midiamax,"Mon, 29 Dec 2025 08:00:00 GMT",Sindicato divulga vagas abertas em indústrias de celulose na região do Bolsão  Midiamax,https://news.google.com/rss/articles/CBMivwFBVV95cUxNM0NEOUpkR2FFU0RPb0xhb3hHMUVNdk14aklmdTJIbWhTX0VhaUpxYWtUdUZibE5oZ25UclJyY1JnUFhHOGFfbUdhZHJ0RTZCeGJGSGFGUFZCRGFHZ1pxQ1Zfa29VY2xmZ0RJYzFrSjNpOFJoOWwwcXBXOWZZbC1KRXZyVnM4QnVnVDJRc19fRl9rX1NEWHVQZnJoSU1ZLTU2TDdEcDdaR3MxcHpCZXN2UnJMcmFaamJ2SzUtZFJVNA?oc=5
Água Clara,Educação e Negócios,Cursos gratuitos da Funtrab seguem com inscrições abertas em Campo Grande e no interior de MS - funtrab.ms.gov.br,funtrab.ms.gov.br,"Thu, 09 Oct 2025 07:00:00 GMT",Cursos gratuitos da Funtrab seguem com inscrições abertas em Campo Grande e no interior de MS  funtrab.ms.gov.br,https://news.google.com/rss/articles/CBMiwgFBVV95cUxOM0NaODBJLVZIMDktU3ppbkVKcWdkZFJacGlMY0VjZ1ZmZFdnSFdvVG5ZbWlLM1hxckRBY3J1M1VRMVNvcW4zTmQtREpiMkFZX2RTTndfZTFMU0hOWmRiOURZZk4teENFYWg2dFJPVHU3alhBdHduc3RJd21oVmNtTGprR1hkcERycWJjdVBfQXRENTdKMU4zT2M2ZnV1RlNrTVEyWF9VVzI1aXBobjlkVkdQZ21YWVhsUWJVcFM0dk9HUQ?oc=5
Água Clara,Educação e Negócios,SESI-PA promove capacitação para professores e SENAI-MS oferece curso com bolsa de R$ 1 mil - Agência de Notícias da Indústria,Agência de Notícias da Indústria,"Fri, 20 Dec 2024 08:00:00 GMT",SESI-PA promove capacitação para professores e SENAI-MS oferece curso com bolsa de R$ 1 mil  Agência de Notícias da Indústria,https://news.google.com/rss/articles/CBMi7wFBVV95cUxPNmlhZUtSSUdPcV9LblZDNldQRm44Q21iQ3p1Ri13MkFyQUQ3bXZ4c00xRTlkWmZHWTZFeUw0X0hjUHZzNjZtMFQyeXVvbDVzWFZyU08zS1dKamMwRDRHa2F6N0N5cVZKY3B4b25TUDlwY29oaXhfMUFwM200NDNwZzRybW0xNTRoUTJVYjFSemhKVG5Sd2pnNG9aNkx0RXJ1R2JTcUp5OHIycTRxeGxHXy04MC1rMTlFVnRyTmxISVBTUVNNdHY3T0x0MWRLaHlSU0xZUWFYRnVRTnRjWFgyNElWLU1RRUZhWExFMFJPQQ?oc=5
Água Clara,Educação e Negócios,Suzano seleciona trabalhadores para preencher vagas de emprego em MS e BA - CPG Click Petróleo e Gás,CPG Click Petróleo e Gás,"Sat, 24 Jan 2026 08:00:00 GMT",Suzano seleciona trabalhadores para preencher vagas de emprego em MS e BA  CPG Click Petróleo e Gás,https://news.google.com/rss/articles/CBMipwFBVV95cUxPNUJRcHRxbUpVTTFGV2x2Zkt5b1g1cmEtV3lXYnVSVlBOMkNPUEpfLXJ3M2ZyWS1ENzF2RDJramN0eEJETGdMM1lxazVVeU1pdmVPaGZ3QklOM2JQd0RWSjlpVlhyVGU3SUxUTHRjejVoWE9jZkpRQVRqdXBPQnZHMzhLYWhHamZwczdrdFp1UHFjTzl4MnRiSV9zMlNzM2hLUmc5VWd0TQ?oc=5
Água Clara,Educação e Negócios,Suzano abre nove processos seletivos para Água Clara e Ribas do Rio Pardo/MS - ArapuaNews,ArapuaNews,"Fri, 05 Dec 2025 08:00:00 GMT",Suzano abre nove processos seletivos para Água Clara e Ribas do Rio Pardo/MS  ArapuaNews,https://news.google.com/rss/articles/CBMipgFBVV95cUxQWVJDUjAyUFVuX3ktNEgtbWRmMUVURTRwTkhnRU1Ka1pNaHBqUW9US0JXVUtLOEpOU3FscTM3UjZFVm5fTkpyWlhHS3BLeTJsWWFwWnhXOFdGYjhVNkItTGs3YkJWbksxN0ctNENGU3lFQXJTTzIybTZ6SkdOWml3dXY5NWp0QWNJajQ5alVJOTZnYmJuM3N3UEw3cjNmVWZIR1ZqeGl3?oc=5
Água Clara,Política e Institucional,TCE-MS rejeita contas da prefeita de Água Clara por falhas fiscais - Midiamax,Midiamax,"Mon, 04 May 2026 18:16:00 GMT",TCE-MS rejeita contas da prefeita de Água Clara por falhas fiscais  Midiamax,https://news.google.com/rss/articles/CBMirgFBVV95cUxPU2Z4cFl4WlNoR3FYYktiWHhGSy1MNDdzc0loM1lzRW5ZdjAyUFVmNFU3LWF4MS1lLVhESHppaVhrSlJNLXhJVHRsLW5DM3FjeGpzMVIyY2F6a0pUeDNiT0h5TF9hSWhFT0hVQ2FRVnBxUTdxLWN6c0RneGg0SWRLYXdEYy1GVk1Bc0ludjY4a2IwelZvNTFmNEVkTm9lcDlHcVhtdFQ0VGtqSUNJVWc?oc=5
Água Clara,Política e Institucional,Sentença condenatória é confirmada em 2º grau em ação do MPMS que investigou esquema de corrupção em Água Clara - MPMS,MPMS,"Tue, 10 Mar 2026 07:00:00 GMT",Sentença condenatória é confirmada em 2º grau em ação do MPMS que investigou esquema de corrupção em Água Clara  MPMS,https://news.google.com/rss/articles/CBMi5AFBVV95cUxNWS15bk9JemlydkhFLUl6UTJJcjlOV3BRaXdpcnV0bktGS0tESnIwQWNlek54Z1JQU2tkRmI2YnhEdlhEVlVCTEZyZFpOcGdiMFM2SWVnSzZNbTJ1X2tOM0FuVnhqWXI0NmRhdi1jRVVWSlBTeldNN0tib013eFFVZjktejRkak9SR01qREplTnFhbkZRMkNPTUU1eVN2ZHRod2RDZDQyQmlpNk5IaVJiR2hZb1ZWQzVHaEJIbXNxMkN5OTcwbTF5UEVneGNIUkZ2aWtiR00yOE81OXh2Y3gwcFBGTHI?oc=5
Água Clara,Política e Institucional,"Polícia Civil inaugura a 53ª Sala Lilás do MS, em Japorã - pc.ms.gov.br",pc.ms.gov.br,"Fri, 24 Oct 2025 07:00:00 GMT","Polícia Civil inaugura a 53ª Sala Lilás do MS, em Japorã  pc.ms.gov.br",https://news.google.com/rss/articles/CBMiiAFBVV95cUxQQlpya005cXlFb0RtSFNMYnlTR3VIZFA2SlVlUk9pM09kUm1xR2dEeWk5VXZaUEFna2I3akpPb05OaUFySXhhVUlYekl4SG5DXzRzaGNiYTZpelJiOWpKU0JTZ2xrR3lNNzgxbjg4ZVktX290WnpuQlJySUVyb0E3R0s4ckFvTVR4?oc=5
Água Clara,Política e Institucional,MP exige concurso público para controlador interno em Água Clara - Campo Grande News,Campo Grande News,"Sat, 02 Aug 2025 07:00:00 GMT",MP exige concurso público para controlador interno em Água Clara  Campo Grande News,https://news.google.com/rss/articles/CBMitwFBVV95cUxQQnhnZ1V2RnppZ3J0LWZTaE9nd2duRTB6VVdPLXVXRVQ1NHlZT3NTMTkyRVY1STY2bmVHcVFPeWNzRGVNaGVCbndyZnA4YTNPWXZzN1RNb3pkT1FvTFFUVXN2MWd4Q2l2VXdlckZ1VTRHZXpmdXJuX0YwN25wVUloYTJSNUdJSUVkS08zWGhMWGQteVJwOVJnT2JnNUI1T3pVYmFGcFJEaWsxajByLWp2UHBKVDVtWlXSAbcBQVVfeXFMTVZVLUVXNl9BS0hlRnNPMWNFZXZBb284cFZnMEJCREpCSW9iTnEwY1hMUDI5Ym1reVozRHhwR2lfWldrVkhYdzhlWWpfanlOY2pkSUM2aE9tWEJGd29TcXprM1RhM25ITDV5aThKUEJUeWRiS0pLR0hBMm5YYTI4djlSM1MxTWhNUjBHYUhTaWV0NWpkaHpZdjQ2SGpvQUp6Skx5VDBFeWtRMFRVRF9MdXJmN09DZDNR?oc=5
Água Clara,Política e Institucional,Procedimento vai monitorar TAC para regularizar Controladoria Municipal de Água Clara - Midiamax,Midiamax,"Thu, 22 Jan 2026 08:00:00 GMT",Procedimento vai monitorar TAC para regularizar Controladoria Municipal de Água Clara  Midiamax,https://news.google.com/rss/articles/CBMiygFBVV95cUxPZk1QN2daSDZsU1lLR1MzeXRJanljUnNLYlBiR1RQWVpkcEtBeWhWVHNWcm1UODZ0S3VkNVMzSTE3WXlnTDJoZVFXUjBmX3hPMkFPcXQ1aVZ4ZVhNWHhrTzQ3LU1DU2YwTnJYcU9EdWhpd2JyR0p0ckNSMUpjaklyWE9kajU1WkVwR2EyU3l5YW5hSDBSNVVmaVNXTDZJX0g2akVJdXRjanY3d3R4OWtnQWd6QW80c0FJZ2wza0szbG5CTmI4dy1SdkJB?oc=5
Amambai,Social e Cultura,"Governo licita obras de CEUs da Cultura em quatro cidades e fortalece acesso à arte, educação e cidadania - Portal Único ms.gov.br",Portal Único ms.gov.br,"Sat, 14 Feb 2026 08:00:00 GMT","Governo licita obras de CEUs da Cultura em quatro cidades e fortalece acesso à arte, educação e cidadania  Portal Único ms.gov.br",https://news.google.com/rss/articles/CBMi0AFBVV95cUxQS3JiTldxcUpiZ0tHUGFKRnhqT29xbDE5TklUbUNIR3l2Z01Qb1dOa2ttTVo4Q0k0TGR1V3JOTXVmNDR5WE5CSko3MmdoclVpZk0yVzl1SXBTODhjZ01aWndobUo3dzA0Mm5yWVZyTmxGb3lQc05QZE5XRnNESERqQVlVMXZNMDRMcVkyazhjVGgzYnNLRU42Uk00ZzB3SUQzUFMzWm55M2MzWXJPNElVbWlQOWxTSGJ1V1BNSFZDdHhSTzRxUTZibVk0eDV2QUow?oc=5
Amambai,Social e Cultura,"Governo de MS garante repasse de R$ 1,32 milhão para o carnaval de Corumbá 2025 - agenciadenoticias.ms.gov.br",agenciadenoticias.ms.gov.br,"Fri, 29 Nov 2024 08:00:00 GMT","Governo de MS garante repasse de R$ 1,32 milhão para o carnaval de Corumbá 2025  agenciadenoticias.ms.gov.br",https://news.google.com/rss/articles/CBMitAFBVV95cUxNSWpPQThldEZ5ZTNqX3hRd21ycDUwOFRSX0luTXhwRi1QWnhZOUtyNnlvdGRWSFFRNkRQcm9qVmxJT05LdVpPUDE5bEQzRDdCbGZvSlh2XzhGalNKWGFZcldwWWM3Q29CbGhMUGNLOTVJUXh1MEFQLUtzaDlxUEJwQ3YyX0dtaXRvSW5NUDhaRFdZc0xEekNnNmJ6NWFpUFhtNjczVENwY1IxSFY0WXB3ZnRnSXI?oc=5
Amambai,Social e Cultura,"Cine Sesi Cultural finaliza 3ª etapa com 101,6 mil pessoas em 32 cidades - Agência de Notícias da Indústria",Agência de Notícias da Indústria,"Mon, 12 Nov 2012 08:00:00 GMT","Cine Sesi Cultural finaliza 3ª etapa com 101,6 mil pessoas em 32 cidades  Agência de Notícias da Indústria",https://news.google.com/rss/articles/CBMi2AFBVV95cUxPb2s0TFZTN1VsNUxCcm5kdFdhMzBnMjJIdWFITFkxa0Iza0Q0SGlMem9TeGdkU2FDeHZZUE1WR3VxVGV0T08temhMVmRwempUbW5Cdm9YN3N0aF9zYUJNZkVTTzRmbXlZc1NhZmtGUE9CbG0zblRyejhPbU5Va2ltdUU5TlJ2Zy1Gb3VJdU9oY1hSN0pBdy1ua1ZETFkxb0VfejFNLXctS0VIekNYQWNYYnBiQk5QRDJoV01uM3NRNHUxOTZyTWp0NkUyLUw3T2JhTzNlazRJNDU?oc=5
Amambai,Social e Cultura,Esporte é instrumento de preservação e fortalecimento das tradições indígenas em MS - fundesporte.ms.gov.br,fundesporte.ms.gov.br,"Tue, 12 Dec 2023 08:00:00 GMT",Esporte é instrumento de preservação e fortalecimento das tradições indígenas em MS  fundesporte.ms.gov.br,https://news.google.com/rss/articles/CBMiugFBVV95cUxPLUdkVnhXY25ZZUwzdnZOY01NUzVpQ1B2T0JpWlJueWdaUGMyV1J1cVgtU1pjTHNKeS1SY2N2bllkQUN0cnJPWUIzMGNZOUcxSEswcjJuRkttNGlGbS1aTXpOOTZINVU2U0p3U1M0clN2ZjJoQ3NjSDFidjlDNlhNYnNvak1RbnNUWjNBZm9ibGhycHRrUjZRdW9zOV94WEhPSi1NcnM0cHFRNXhKTzkwQjBLbl9DMWRCUEE?oc=5
Amambai,Social e Cultura,"Agendão: fim de semana tem MS Fashion Week, Festa do Leitão no Rolete, exposições e muito teatro - Idest",Idest,"Fri, 06 Sep 2024 07:00:00 GMT","Agendão: fim de semana tem MS Fashion Week, Festa do Leitão no Rolete, exposições e muito teatro  Idest",https://news.google.com/rss/articles/CBMiyAFBVV95cUxQQkJVNThTWks5V2FBVjMzR2VmclJoTFBHWnlSaU1Md3lHWmk0cU1VUFN3dkhFQlVya2ZmYzlRZFBHZ1RXR001dG1mUUY0d191dlFFY0FRN3VQVGdSOFlHSDFENmR2dExSN19pN0xpclZUelJtTWtfSzhIVXZoN0JWNkZIRG9GUktRVVp2aFRFU3RROUZQQkIza1F1Z1Bjd2RxaFZUWUhQaDQ2b25yR1JBWU9VY3l5VUxLTy1SVHNNU2txVzN4d2tZQg?oc=5
Amambai,Educação e Negócios,Últimos dias de inscrições para qualificação profissional a distância no IFMS - Correio de Corumbá,Correio de Corumbá,"Thu, 26 Feb 2026 08:00:00 GMT",Últimos dias de inscrições para qualificação profissional a distância no IFMS  Correio de Corumbá,https://news.google.com/rss/articles/CBMiygFBVV95cUxQLXRzRjA4bzY4Vjhoc09PLXBSQnRyNFhyY1pGd2ZRakZSVGVLSHBoNnBoUW9aZEg2c1g3VVVlWXJWc0hvU0lpOHNFc056Z0NOSF9xQS1ZeFFTUFNIbnc4VDJocGdXYjhvZmpZdjF2OWk4UXJQZ3RHM0RnUWJESFZqdnNlWThFcENYYVhreHdscHQ3NW1VelNFWC1UcS1EMmRqUFRmX2pNMGJjYUFzelFTWG5PTzFWS0pTay1SdE1kUkxGRHlDZ1VmLWdB0gHKAUFVX3lxTFBYN1NIdzhGOC1yZUQ0ZHRoMl9WTGRqVF9jUl9nMkppRmlSaWFxc2xoYVNvRHB2OE1VYnVZMmNhNmE4T2ExbG03aGhWeElfcjNpTU1Wc21INmEyajRRdGRJTjg3U1Zrb2FyZkpVSDB6MC1JOFNVX0t2T1E4ZVJpeFVad1NFdVVzZ0lfVXBwSURoSjZOSmtLYWJoaGVxa2Eyd2F3Sk9hazJWejRXeENCTkVqN3lFLUFQcTlsRmo4NEttamNoUjV0dUtDS2c?oc=5
Amambai,Educação e Negócios,Bioenergia: rodada de empregabilidade oferece mais de 630 vagas em 15 municípios de MS - Portal Único ms.gov.br,Portal Único ms.gov.br,"Thu, 16 Oct 2025 07:00:00 GMT",Bioenergia: rodada de empregabilidade oferece mais de 630 vagas em 15 municípios de MS  Portal Único ms.gov.br,https://news.google.com/rss/articles/CBMitwFBVV95cUxNbVkySUF3eWluQmJNak1yT3l1cWcxWVZES3BndzhCbWhzbFZ6WW1hNnZ2U0h3Y1k3bjh3N2xFX3Nxa2JjWFNkY3l2Zl92aVVWUjNxS2pvblhRWjhIOTBIdDhhQXIwX1hYTF9WLVNuQ3IzNlUzZ2hlZjBsX2FybWVmOEptRzkzaERwNnpCXzJDRWJIT0xaeXpac0xqQzNnVmhXUkt1Vy1ZUUsyTHFObW1PNmxlbzFNNlU?oc=5
Amambai,Educação e Negócios,"Funtrab anuncia vários cursos gratuitos de qualificação no Estado, veja como se inscrever - funtrab.ms.gov.br",funtrab.ms.gov.br,"Thu, 18 Sep 2025 07:00:00 GMT","Funtrab anuncia vários cursos gratuitos de qualificação no Estado, veja como se inscrever  funtrab.ms.gov.br",https://news.google.com/rss/articles/CBMiuwFBVV95cUxOODR2ZHNIZHNUUnJyVU05ZXdod21jYld3UWNyaDBLZVdzQzBPZTZkQUM4Ml9fYW1OUjd0dGFUck5FVG56MFdhQTNDWlEycEhQVVRIdUx5aUJTQ0ZVT1BUeXczTkFqenZTWnp2R2YzZkZIVGViMmZtMXJfeEF3RDRsaFRUMktXTmtHSW5WaG9mZ2lOaThRNmZ3cU13ZEtLSjZJSHJfVGF3SlRKRFpWNmtJbVQ3RHo1RDVkeXdv?oc=5
Amambai,Educação e Negócios,Corpo de Bombeiros divulga novo resultado da seleção para bombeiros temporários - Midiamax,Midiamax,"Fri, 17 Oct 2025 07:00:00 GMT",Corpo de Bombeiros divulga novo resultado da seleção para bombeiros temporários  Midiamax,https://news.google.com/rss/articles/CBMiwwFBVV95cUxOZHdRQVgzaklJd20tdFM1cUFkNFc5ZVR0TnZ3NTBqUGlwNXhJT1F0c0ZRQnBUMFFvaTVSNXRZODBwaDl4ZmxLVm1nbUhoNUwyeUZBYVExVkliUE54NU93S25Bc3gzeWNxcDhUMFBqcUdlUjNZMTRVMVBtMWdraFNNTkZCNGZQYTJLY3g1bzJDZWRHaVA2dXNwQlIydGhRdmFlY1pxYkYxQy15UmhGSHBqLThraW5zc2hvNC02cmZfdXgyN00?oc=5
Amambai,Educação e Negócios,Casa do Trabalhador disponibiliza 61 oportunidades de emprego nesta quarta-feira em Amambai - A Gazeta News,A Gazeta News,"Tue, 24 Jun 2025 07:00:00 GMT",Casa do Trabalhador disponibiliza 61 oportunidades de emprego nesta quarta-feira em Amambai  A Gazeta News,https://news.google.com/rss/articles/CBMi0gFBVV95cUxPMWVFNWlDckxsVzRLMDJoZHpaRlNXOEw1M250RUpWTjRVVGlRNjZLaWlLTjlocldDSTRpLTdHbFFTa3FjY1l0NUVORGR4Nlc3RXlsT0FSaU5MMWhsWWxwOTJONU1MdVZhMG9aNlBZSFJjYVBENE5ZdVRQc19OR0h1bXhJSk96Wkx2WUtjZXk2bzVTQ3NwaW1CNHlZaVNQZnJZbGFLVWg2R2FQVXJuSGNiOVMyaU9ob3JqeHg1Rmo2ZDR6V1dzVUItYW03RGJqbDhWSFE?oc=5
Amambai,Política e Institucional,Amambai confirma convênio para construção de 50 novas mor... - Prefeitura Municipal de Amambai,Prefeitura Municipal de Amambai,"Thu, 12 Mar 2026 22:12:41 GMT",Amambai confirma convênio para construção de 50 novas mor...  Prefeitura Municipal de Amambai,https://news.google.com/rss/articles/CBMiqwFBVV95cUxOZHJ1R2s1RWpyUEx0YXZHYV9ndlo4c2FnNFdPcENwT2hNWE10UnZfVVBwMFlYUTlmQXljQ0JYVE81VzlSRUhPQ0lnRjZCQnhxbGl0dVNnVndQcGhtVVhFQnMxRmZLZDlBSjRRRmJsaHZwcVIxZzlkZ1lmVkR6dVc3dEp6bV9SdG4xRWkzMVZWZUpSb0NuaUtkS3k2dzdqeUhpUHBheUdHTVhVZ1U?oc=5
Amambai,Política e Institucional,Prefeitura de Amambaí (MS) abre processo seletivo para a zona rural - Concursos no Brasil,Concursos no Brasil,"Thu, 23 Apr 2026 07:00:00 GMT",Prefeitura de Amambaí (MS) abre processo seletivo para a zona rural  Concursos no Brasil,https://news.google.com/rss/articles/CBMivAFBVV95cUxNY3NDVlNUbklWUWF1RnNtelFXODZJNXVGVHpQX1M4NVhCcUJyOWZabldfM0w0WHVrN2dWVU1XZVBGVHdfSFBib2ZyUUE1QkNmUUJyQ3BJcHVzUW5hRjJHak9yazBHVDZxM2cxdlljVmtrazYwVl9IQnR1RGdrcXlIZEFOU3BKczRMLUdHZ1dfLUhsMjV0eTJWME5meGlGZzJ5Z05IZ0NsdlpfWllkVlIwUFhGYWt2emprcS13Mw?oc=5
Amambai,Política e Institucional,Prefeitura de Amambai MS abre processo seletivo para formador municipal - Folha Dirigida,Folha Dirigida,"Wed, 04 Mar 2026 08:00:00 GMT",Prefeitura de Amambai MS abre processo seletivo para formador municipal  Folha Dirigida,https://news.google.com/rss/articles/CBMipAFBVV95cUxNcVB0UENsamtCSGF4b2I2VURGaHV0TTEwNHBMUkZZdW9raXBlN2VGeGx4LWVRZ1pkQ25WamY2OVFYSDhfdTZGMERxaWltNkJFY1Juc25Lc1VoYnJ2TVBMaUlFd1lqb2U0dVh3MDZjdmlmbzRmR25GZkgxY0RaTnJaZnFRRnpVUmJzZ0pPcnZVWC1Ib0RtdUxORVZCbmRMRURlUWpobg?oc=5
Amambai,Política e Institucional,Notícia - Amambai leva desafios da drenagem urbana ao debate estadual - Prefeitura Municipal de Amambai,Prefeitura Municipal de Amambai,"Tue, 24 Mar 2026 07:00:00 GMT",Notícia - Amambai leva desafios da drenagem urbana ao debate estadual  Prefeitura Municipal de Amambai,https://news.google.com/rss/articles/CBMipwFBVV95cUxOeTlfalN3b2pwaS11dWtjbXZPTlREWGJNVXZfaURVcUJTWWVPa0JBcFVMZ2lhcnBHZTNqQ3hIRXUwSG1PeUNfX0dYZW9BWXVIZU1adFJxQVo1LVp2cEpnWWppb0VGM0hlQ01JbE1PbS1IWjVsM1ZFUGVVTzVxeXRYR24waEEtWGxUd01UakNHZXVId3RsQmRXWTNmTmZ2R19VUm5KX3JlRQ?oc=5
Amambai,Política e Institucional,Por meio de requerimento Suzana pede informações sobre convênio de trânsito entre Amambai e Governo do Estado - A Gazeta News,A Gazeta News,"Wed, 04 Mar 2026 08:00:00 GMT",Por meio de requerimento Suzana pede informações sobre convênio de trânsito entre Amambai e Governo do Estado  A Gazeta News,https://news.google.com/rss/articles/CBMi5wFBVV95cUxQVVdGSzBMNWJtdWdQRmNRT29ESkFRVHllZTFDcFdKREpWYVh2MTNVZ2R5SExCa3dPM1ZCeXp6WUJyTUFQNjJWRjZDV0ZLeUpuTFpwODVMa0lBdmVzVUpGcTE4bHpIYmFGUE1zY3A0T1ppRWhEb3Y5VE1wWmJBdDNGa29UMWxsQ0pkdnZjdHUtQXE2b3I4STZ0V1d6MGIzTlo3N1hLZThfWlA1cmNoYl9FSzR0Wjh0c2tpa1RFaHlQS3Z2OEFpcTlEdlduc0FDcHp3Z1dQQk5EOFdRaVFBQUw4TlA1ckFvSEU?oc=5
Anastácio,Social e Cultura,"Cine Sesi Cultural finaliza 3ª etapa com 101,6 mil pessoas em 32 cidades - Agência de Notícias da Indústria",Agência de Notícias da Indústria,"Mon, 12 Nov 2012 08:00:00 GMT","Cine Sesi Cultural finaliza 3ª etapa com 101,6 mil pessoas em 32 cidades  Agência de Notícias da Indústria",https://news.google.com/rss/articles/CBMi2AFBVV95cUxPb2s0TFZTN1VsNUxCcm5kdFdhMzBnMjJIdWFITFkxa0Iza0Q0SGlMem9TeGdkU2FDeHZZUE1WR3VxVGV0T08temhMVmRwempUbW5Cdm9YN3N0aF9zYUJNZkVTTzRmbXlZc1NhZmtGUE9CbG0zblRyejhPbU5Va2ltdUU5TlJ2Zy1Gb3VJdU9oY1hSN0pBdy1ua1ZETFkxb0VfejFNLXctS0VIekNYQWNYYnBiQk5QRDJoV01uM3NRNHUxOTZyTWp0NkUyLUw3T2JhTzNlazRJNDU?oc=5
Anastácio,Social e Cultura,Aquidauana e Anastácio registram o maior volume de chuva do estado - O Pantaneiro,O Pantaneiro,"Sat, 09 May 2026 17:25:00 GMT",Aquidauana e Anastácio registram o maior volume de chuva do estado  O Pantaneiro,https://news.google.com/rss/articles/CBMitwFBVV95cUxNUFpzZnp2c2tpYm41QVBfR1EtZ0czeThhTGFkQ0xEX1RLWTR3WWRrU1JTcEdyeGh0dVB5dFJmcWQyblFJdEEwVEtJbU1QUWFCSWdPNVJycGdLa2NLN29oNWozdFlqcUhzSkIzZk1WMm9PT0pQdGl3LVRiY1o3dWU1bDVWdjZYWnZEUXZkXzFDN1ZQbnNzLTh1ZXczS0tCTllhT0FUQ1NOU0VYcHRFYlhqWE5UVmJWcHc?oc=5
Anastácio,Social e Cultura,"Caarapó reúne mais de 6,5 mil pessoas na praça para o Cine Sesi Cultural - Agência de Notícias da Indústria",Agência de Notícias da Indústria,"Tue, 14 Aug 2012 07:00:00 GMT","Caarapó reúne mais de 6,5 mil pessoas na praça para o Cine Sesi Cultural  Agência de Notícias da Indústria",https://news.google.com/rss/articles/CBMi2AFBVV95cUxONFBHdUp4XzhaYkZkUk5OX3V1QzBfc1NTN1N5ejhDZzEzcmgyWUVYVFIxalducnNyMnQ0RG1MMkJYWUVzbjl5SFpiUVlmZ3Axamp0akJKSGFSX1ZsZnRVWEp3TFktYjRpeVlmRFpWM1JSR0tocFBoWnhkb3RwVnRhQ3ZweUhZWjFnbmJEVmRUTDV1QVktRmM3ZU0ycHdOenZJajN4ZXR3SE1wNjNkUGpXSWhrQXZJRXdnZTlWNDZRdEtjQ2ZFcTZxUW5QVHJZa19jdWxzb1FMcU0?oc=5
Anastácio,Social e Cultura,"Anastácio celebra 60 anos com desfile cívico, escolar e militar nesta quinta-feira - O Pantaneiro",O Pantaneiro,"Thu, 08 May 2025 07:00:00 GMT","Anastácio celebra 60 anos com desfile cívico, escolar e militar nesta quinta-feira  O Pantaneiro",https://news.google.com/rss/articles/CBMiuAFBVV95cUxPX0txYl82UjNjT0xxOHRsY1VVNnpPWlZsMlNVM2NaaXdIUG55eGRqS1h3YXk4aUxzMjhxSGhBakZGVlBuQXJGTURtck5CYk9HeWxIMWJmUUF4YTc4X3hicENieDdCeW41TW1ZeHhJZ29IWmVyZUo5SFRacVY5UGdNS1hmME9ka3NZcmFPbnB0eHM1WUNISXNPTTJ1U0ozZ0hMZ3B4d2huSENZSjlZcGtXZldHYXFMVHBK?oc=5
Anastácio,Social e Cultura,"Cine Sesi tem 2º maior público do ano em Bonito com 4,9 mil pessoas - Agência de Notícias da Indústria",Agência de Notícias da Indústria,"Tue, 25 Sep 2012 07:00:00 GMT","Cine Sesi tem 2º maior público do ano em Bonito com 4,9 mil pessoas  Agência de Notícias da Indústria",https://news.google.com/rss/articles/CBMi0gFBVV95cUxQNHRsNkdrcS1vTGxMOUFyR0d1UmtSc0ZNZ1FEN1ZhZHNSRzh0XzBsUml5MENpYVZ2RXcweFdEMHh2cFBZbEYxMU5iV1k5Z3B2cmlLU0QzRDZtbGVFWkpQcmwwb2UtaUZXMDRZTm5QUlNBOWJ0azBnV01zbjNvYmRWcHZKbkRYN2doRElyZHNRQUFjMlBiUDJERWRQN1ROOHZUVmExUkJLZm5HWmFDNHNMQ2xVdktYd25hZ0ZKbnBPTEV3REJIWFlSU3ZlVE0tM05pN3c?oc=5
Anastácio,Educação e Negócios,Corpo de Bombeiros divulga novo resultado da seleção para bombeiros temporários - Midiamax,Midiamax,"Fri, 17 Oct 2025 07:00:00 GMT",Corpo de Bombeiros divulga novo resultado da seleção para bombeiros temporários  Midiamax,https://news.google.com/rss/articles/CBMiwwFBVV95cUxOZHdRQVgzaklJd20tdFM1cUFkNFc5ZVR0TnZ3NTBqUGlwNXhJT1F0c0ZRQnBUMFFvaTVSNXRZODBwaDl4ZmxLVm1nbUhoNUwyeUZBYVExVkliUE54NU93S25Bc3gzeWNxcDhUMFBqcUdlUjNZMTRVMVBtMWdraFNNTkZCNGZQYTJLY3g1bzJDZWRHaVA2dXNwQlIydGhRdmFlY1pxYkYxQy15UmhGSHBqLThraW5zc2hvNC02cmZfdXgyN00?oc=5
Anastácio,Educação e Negócios,Qualificação beneficia população de MS com melhores oportunidades de emprego - O Pantaneiro,O Pantaneiro,"Tue, 03 Mar 2026 08:00:00 GMT",Qualificação beneficia população de MS com melhores oportunidades de emprego  O Pantaneiro,https://news.google.com/rss/articles/CBMiswFBVV95cUxPd2Rva055REZYekhJSFBxNjlsdjI4UjZCZHdXelA2dmgtZHZzbkNlcW5TMURQNE1aVWV2WUp0Q29PSVBwdnNQYU5vZFh6dE9HSWlzS3NwRnVzOGp0SUZGeEkwSWVhYU1SdWVPREFlTkpBY2hlVUdiNTZxd0M3dDd2VlZUUnI4S191cWtqS2Zqb0p3UG9nLTZQRVR4cUFsYUtCaTVBZVlVendrd3YtYVVtb3BlYw?oc=5
Anastácio,Educação e Negócios,MS Ativo: Governo de MS promove encontros regionais para fortalecer a gestão municipal - funtrab.ms.gov.br,funtrab.ms.gov.br,"Mon, 12 May 2025 07:00:00 GMT",MS Ativo: Governo de MS promove encontros regionais para fortalecer a gestão municipal  funtrab.ms.gov.br,https://news.google.com/rss/articles/CBMitwFBVV95cUxNMUs2d1NJbWpjbklpQ2YtY2hRYlJIM1dOQUs0V0ZYbFVLWHZKMTVPQm1vVFlDbi1NXzRKX3lUQl9WUGpSSEJMTU11YUVRc2FqN3JYQkdrdG9ncWdDOFdybGdRTXRfWDhpcWxyb05XbkJjYjcxcnNVMjRCRURoWDdlbHNfYkZYWlZkY3VONnhBa1hIOF9TRFBxZ0pNblpaeS1WWkE4OEY3bmxlZE5uWGhTbG4xXzhrRE0?oc=5
Anastácio,Educação e Negócios,Processo seletivo dos Bombeiros MS abre 230 vagas em 30 cidades - JC Concursos,JC Concursos,"Mon, 02 Jun 2025 07:00:00 GMT",Processo seletivo dos Bombeiros MS abre 230 vagas em 30 cidades  JC Concursos,https://news.google.com/rss/articles/CBMitgFBVV95cUxOcHRfT3hTeWZpYW9CM2F4dkFaV1BaeFlUbnB6dHVqcUFkc0NxYXphVEF2cFkwcmRxYnpMSG1sZ0ZVUkE5bWpDVmZkZTN5STdOTnJTZWxZaHF4R3RQcDB2LVhybFd1LVl2NE91LVRLUGlxOEZKZlVsN1JNS0FrZG9zbHJrWE5zZDVYZ2V0WmZVV1lHZ0lTdHowaUEycThIdDRnUmc0VVhoMFplYWdsd0s4cjlQbXh6Z9IBuwFBVV95cUxNcUxOUktqa29RUlhzcVhmMDYycm96cmxjc3pnUlpVbVlpb0c1bmY3TjJmaUNWZ0RESGpRVV9ubGlteFV2U3hKYlVlSzhYb0stZ2pZeGdrcGl6MTFadkd5dHdJUFdJV3FSX2NuVTJMUS1IMmRNNC1VQWlUVWFMbjBVZEx3dWhuZnotNUxPTGxsUTRTcGFMS045TDhfSXZBS0JlaFVxQndmbkZHUllndEZ0d0Y3M3JJc0kwSXMw?oc=5
Anastácio,Educação e Negócios,Junho começa com nove concursos públicos abertos em MS; veja a lista completa aqui! - Enfoque MS,Enfoque MS,"Mon, 02 Jun 2025 07:00:00 GMT",Junho começa com nove concursos públicos abertos em MS; veja a lista completa aqui!  Enfoque MS,https://news.google.com/rss/articles/CBMisAFBVV95cUxPSWlFLXFKRERVNllkTFo3OVprcklMY084eUVIelN4VkVJbE15NFBLWEhOOWxEd0ttczhHNHF0elNLQkJYZFRLR25KZ3NBOXprV19ZVEs0Tk80dVA2b3ExUmR3RDFZa0JidDZTdjB5d2RlOFFKUkxCM01TYm5UXzFmQ1A5Ykw4SEd2TEJVTzRnc3JVRENFOGlvQ3lON0xTSGZNblFNd0o2anYyOXFiUU1JbdIBtgFBVV95cUxOSEpFTDJoT2xnSldPS1dwYWJKNUVEQ1A4RnBMNDNmRU9GSW53ZnkxUWFFdTZSUW83NHRvQkxPbk5vaXVwdUFrNzlSYkMtQkw1a2FDeHpURW5MMzdyZU9jb2doUnBBWUR2NEcxci1IWUxkTGE1S1JqOEptVjU1ajdnNTROZ2VFczVucWM0VXE5Y09Pc0JWUHRSTUtrNkdsR296VFI2bEtWMmNHNW51Q096NXp1V2FBQQ?oc=5
Anastácio,Política e Institucional,Anastácio conquista Selo Ouro de Alfabetização pelo 2°ano e recebe homenagem estadual - O Pantaneiro,O Pantaneiro,"Tue, 28 Apr 2026 07:00:00 GMT",Anastácio conquista Selo Ouro de Alfabetização pelo 2°ano e recebe homenagem estadual  O Pantaneiro,https://news.google.com/rss/articles/CBMitgFBVV95cUxPRXFoU0Z2VW94bUxwNWd5Z2pRTkYzRUVQLXkzUGFwSTNxSkNvRmxSVVlPbUtuUFJid09QUTFMUkpHaTRncjdHNXBod1Z6TWVEaEpVT3JNbHVtVzgxcFIzd2VhQWphNlVzTDFFMThmbjFsSGZDdHUxY2xyUmRuSGJ5dzVOZnhYcEYzSHZfdkdBMVFKXzdMdjU0RC16YldXenZ1MWp1MHB6Z1hYMTdMM3pTWUhVUHl6Zw?oc=5
Anastácio,Política e Institucional,Pacote de R$ 10 milhões prevê de ambulâncias no interior de MS - Midiamax,Midiamax,"Tue, 14 Apr 2026 07:00:00 GMT",Pacote de R$ 10 milhões prevê de ambulâncias no interior de MS  Midiamax,https://news.google.com/rss/articles/CBMipwFBVV95cUxNZmtuUGRfLWQ2Z04yYUUwX1FZblVFV3l5OXV6Z0EtQ2dGZXZFMDB2RmJRNUR5UXN0Z0VWNFN4RndxZENXUkExRC1vTl9HcWMxZHJSODI2dU1udHpFTWRYeHp4R1ZrM3hkRFhVUGNYRGk2MWp1S05GTlpqQ091cFdXRzFYeXlHc2ZsTzJITW5nTWFwYW1JcG9mZEY3ZGZxbWJfc3RONWNfVQ?oc=5
