municipio,categoria,titulo,fonte,data,resumo,link
Ladário,Educação e Negócios,Funtrab inaugura Casa do Trabalhador de Brasilândia e amplia acesso a emprego e qualificação profissional - funtrab.ms.gov.br,funtrab.ms.gov.br,"Mon, 19 Jan 2026 08:00:00 GMT",Funtrab inaugura Casa do Trabalhador de Brasilândia e amplia acesso a emprego e qualificação profissional  funtrab.ms.gov.br,https://news.google.com/rss/articles/CBMi0gFBVV95cUxNelFaZGVCS2lIVlZ6c3Nmb0NMMkoxVnpLOUoyeG1SOW1Dc2dMZ2lqcy1ZR1c3SHB1bWJnR0xTVWNOYUVVV012Y2h6UlgyYmJfNXRmekdBMmJtRXdvT2dOc1duTXhYb1FoSlY4aURPdGY2UXlWNURRb1JrdF9hUEtRM3NvZnBROWphQm1DcVBMRENVdkZrbmc2RmNvNHRENjI3aFhJY0pxLTZ6b0lwbE90YkY4d3FGU1R1YllBenpkMDJlYmdpSUFEN1dRVkdnakN2bUE?oc=5
Ladário,Educação e Negócios,IFMS abre inscrições para curso que amplia acesso ao ensino médio técnico - Correio de Corumbá,Correio de Corumbá,"Mon, 02 Mar 2026 08:00:00 GMT",IFMS abre inscrições para curso que amplia acesso ao ensino médio técnico  Correio de Corumbá,https://news.google.com/rss/articles/CBMixAFBVV95cUxNY3NDVDN0azJuMUNWVy05dURZcWFlVXVCN3VuY0M3M3hidXFsRWxZOTh4Yy1EUFZfcjJzQ0NnZlZYaWhqU2VnQy1YbThKOVptWi10ZW93anotQXFXVjlfcHJnSVRVNVBTS3RQcGR1TXhsUk0xRTJBTWpqT2NRSjZEeUpYU29ydVIzWE5oNXJLb3hxcGVZaG5UYXJ4WE8zWmVHcThVMnI1VTBYRHl4ckxWUjdtb19WMk82ckloQVNsM1dKdTQx0gHEAUFVX3lxTE1fSEFaZWg1YmJZVXpDUVRTVmhZZHdoeEpGX29vWUN1LVo4blNFN2NKSU5nc0pkRGV4TUd3RDRVMTZBMjI3aTdiTnhVMHRkUERiX2kyTGFrRmdlZm01WnlQYXhNX3F2ZDBzM01nSVhBbzNLMDdqSjlmVUxmS19IXzI0c1ZrMXVnY3BGOGJXT2lTdkowWDR1UXRlV0NfaHNmY18tRlhyUlFnN2JyZHZHVHk5YktWc0VYeFhaaUg3ajI3SGxIZEQ?oc=5
Ladário,Educação e Negócios,IFMS abre 480 vagas para curso preparatório gratuito com bolsa de R$ 200 - Campo Grande News,Campo Grande News,"Mon, 02 Mar 2026 08:00:00 GMT",IFMS abre 480 vagas para curso preparatório gratuito com bolsa de R$ 200  Campo Grande News,https://news.google.com/rss/articles/CBMixgFBVV95cUxPdzNQYWQwS0l1MXIxdHZHVkU0YjQzY0J5aXc5WVJRNnI0Yi1wR0Z1TUpVcmRHMkF5QTYwWUpQbldGUnh1c1ktODVJSThGUWRHQmk0YkFEUmRNNm9tNy1qcHl3bTF5a1c0RlFKRUNCclBPcGQxcU50bEdpdF9hWkxIaTh0QXp4bjVKbU5GWW9lbWNXOTRIVF80UjNDenYtT0szMGxCNi1KZ0pFT3I2dmZMaFZvdEtQbzdqWmwwYURoVVFaOVh2dkHSAcYBQVVfeXFMTmlXUzBoaXRCYkdGU2VVenZGb0FEVjlQTGtfVnFaQ1hKQUhva3Foclk2ZnVTbmRVSDhldzMtakp5VWc4c1VDQWdNbmNnQV82U09PUDUwNDF6bGVhTWpWOVl4UFJDb1Q0UlRhUTNvZXFXa2JoNUpzSVgtTjRXbUNkY2hVVUppXzVQMm91eEJTUC1jTEJEZmpsNmRiVmJ1bUR1ZUsxSVZhZjQ5N3VlZFRWRzhnc28ycTdwUmtuMzBKWU5aUEtRcUFR?oc=5
Ladário,Política e Institucional,"Prefeitura de Ladário pagará R$ 1,1 milhão para colocar secretarias em contêineres - Midiamax",Midiamax,"Sun, 22 Feb 2026 08:00:00 GMT","Prefeitura de Ladário pagará R$ 1,1 milhão para colocar secretarias em contêineres  Midiamax",https://news.google.com/rss/articles/CBMivwFBVV95cUxNTVhDWGswUGw0SVVYVUZaX1F3X0U2WlNQN1Q2SnA0YS1Oei1sRXMxN1IyYnNJS2xsNHJnX3FFc3ZUUXk2QWpVN3dPS0sxU2lBZVF5NHY2bTdZSTZSa2dhMm1YNWNWU2cxdEQxVm9XTzFEYXdhMGp4ajlXdGNyZDNWTXVldkJFTjBzaC1yMnF0Vm5LazRTRXVsU0Voa3U2QngzdEstd0NLejFXeVRIOXlrRVV0MjJkNnJqOW5xVGhjSQ?oc=5
Ladário,Política e Institucional,Audiência pública vai apresentar demarcação de áreas da União em Ladário no dia 24 de fevereiro - Correio de Corumbá,Correio de Corumbá,"Sat, 21 Feb 2026 08:00:00 GMT",Audiência pública vai apresentar demarcação de áreas da União em Ladário no dia 24 de fevereiro  Correio de Corumbá,https://news.google.com/rss/articles/CBMi4AFBVV95cUxNQlphY3dDU2RLeWE3V2pDbGNybjhiQVR1amZqSWtFQjVhZlg1SjJzNFRRMnVjWEJwYjdyX0VGZF9hdVRXUUh0ajNyOUx1YXdEZUpxUWxTUlhVZmZYcXFVQnllNVhWbFZkdXF1Vk9KZWg4ZG4xOWRoTVJLeUV4YzJMd3pGRl9tUVplb3dlQmo0ZWpnVnBXdWRNdlZ3ZE91Z1hkeVRsWWw3aGNIdkVwQnVHUzV3QVpCTi1qRy1iYnRsRlJ0ZVdvX1R3VkdjZzhnZmxDZHlUek81eVB2bVVVM05MSNIB4AFBVV95cUxNQnJZeThIc2txamtKS3dlRS1VWVpzTUV5Q2J1U19CZllNNVFWWmozZUV3UUZTU3NfNnMwbXBTeWptNmZvVEVVWDlHcGFaZXN0YXdHejRGaW1UWUxTWFdGNkRNSUNRRzJyYllEUzByeUJXRXNOQUZvZGNFOGYwZ2pzTnA3VnQzbGRhTVNaNkJteUpFWEwxbGZOYmY4Wm1zMFFFQ0hfbl9pTzdDUUc5a1hhZmk4R0d6bWxmTDg5cDQ5b1FtVDBuNHYyY3RyWmhUejVOUVFRSGk5TEF4eVZJLXN1Ng?oc=5
Ladário,Política e Institucional,"27ª Feapan impulsiona negócios, turismo e cultura no Pantanal com apoio da Prefeitura de Corumbá - Município de Corumbá",Município de Corumbá,"Tue, 30 Sep 2025 07:00:00 GMT","27ª Feapan impulsiona negócios, turismo e cultura no Pantanal com apoio da Prefeitura de Corumbá  Município de Corumbá",https://news.google.com/rss/articles/CBMiygFBVV95cUxNWDFHVm42ekI1T3Rfa0Yxei1oTENXUFJXcUxnSGFBX001YWZYbElaOUhJRjhyRUwxNVY3cTBxanlyYkFuNFEyVnFicC1MV3NXUlZNcVpzbHBDd2hYYTU3RWpvU0lFWEtEdDcteWc4STRxQVF3eFdjRkprYlZ4blNZMS05NFpiczcyWWRZaWFFclFsM3pob3I2a0ZZR3RqVE9QVTJsU0pCaXBjb3VacXFSRFhiY3AzWkR3WWxFQmpkRjY2SWpOMjJFdVdn?oc=5
Ladário,Política e Institucional,Contrato milionário feito sem licitação é anulado em Ladário após recomendação do MP - Folha MS,Folha MS,"Thu, 09 Oct 2025 07:00:00 GMT",Contrato milionário feito sem licitação é anulado em Ladário após recomendação do MP  Folha MS,https://news.google.com/rss/articles/CBMifkFVX3lxTE5EVEQ5djRKanU3d3U4MTZhc0hVQ3hLbFA0bmlBZmlyazA3VEhYUXI2YTVaRXBRYTVzRGtLMHJLbzdscFdZY1JQN2JZYnNteFlvNnRuN25kdXlFTW5GVDdhN00xZWdyZ3NwcnhDOVBFbHdjMHBGWXgxT1NXSlhSdw?oc=5
Ladário,Política e Institucional,Reforma do Estádio Vicente Fortunato vai custar mais de R$ 2 milhões - Diário Corumbaense,Diário Corumbaense,"Thu, 15 Jun 2023 07:00:00 GMT",Reforma do Estádio Vicente Fortunato vai custar mais de R$ 2 milhões  Diário Corumbaense,https://news.google.com/rss/articles/CBMiW0FVX3lxTE1iSEJmaW1JX3duVmxyMnNCOV9QVUF1LWw4RGpValAwVkxCbTl0aktZVktydWtNRlFPNFBaSVRzd05UVlZSbDhnUGVfRzViaEhCRnJMczBYUV9GaEE?oc=5
Miranda,Social e Cultura,Economia criativa impulsiona desenvolvimento regional e promove inclusão em MS - Portal Único ms.gov.br,Portal Único ms.gov.br,"Mon, 29 Dec 2025 08:00:00 GMT",Economia criativa impulsiona desenvolvimento regional e promove inclusão em MS  Portal Único ms.gov.br,https://news.google.com/rss/articles/CBMizwFBVV95cUxObVVlak5fUnhyTUJoS0RIRGYxY2JqRHJ6Y0pmYXEtWTVEM19fTGtPWHd0em8ydENCVWtEOU16TW5ZQmk3QlJ5R3pKckZOVHowS2ZDLUJtRy15UVg3VHNFbngzSTVfZkJkMTRQU1dnX2tPcXo3RklMVWF5TENielgtVHlZNGMweXdFWXNzZ2pfSFlZWFdtT0IzY2ZHS2xBVmxGWTVhQWxTaHhXMmFMQWNONFdRMEo1UUh5RFNnSF9HZHM4cTVTMld6Q3VEQ3hKSVU?oc=5
Miranda,Social e Cultura,Governo de MS destaca fortalecimento da cultura no encerramento de Fórum Nacional em Bonito - agenciadenoticias.ms.gov.br,agenciadenoticias.ms.gov.br,"Fri, 22 Aug 2025 07:00:00 GMT",Governo de MS destaca fortalecimento da cultura no encerramento de Fórum Nacional em Bonito  agenciadenoticias.ms.gov.br,https://news.google.com/rss/articles/CBMixwFBVV95cUxPWkRPRWdWMTFMNm5KM1p6VTBlVGszX3V6dnJETGdaVDM0Z2VpVFhfN1RKWjJZT2lsVTJLYmtMVlpWV0JHNjlsU1FUSDZWa1BEOFotdWtmZnE1R2RLTzhxZGFGWElWNHE0Z3poX1ZNYklnQm1pZXRFcVlJVXJNQlJCNU1hYzNueGdXek1ZdmNYcVF1V2JkbHhfVHZUMHZiOUJBTjZRN3E4SVBBQkpVb3VmR2hHSV9yc01lNGFpeXR3eGRueFBZWHk0?oc=5
Miranda,Social e Cultura,Festival de Inverno de Bonito terá 150 atrações durante cinco dias de arte e cultura - Diário Corumbaense,Diário Corumbaense,"Mon, 29 Jul 2024 07:00:00 GMT",Festival de Inverno de Bonito terá 150 atrações durante cinco dias de arte e cultura  Diário Corumbaense,https://news.google.com/rss/articles/CBMiW0FVX3lxTE5LXzNYWkhYYWFBZjQ1b0MwS2RyeUMwZGVBZWZac3hvM3lfbFBxUjhBUy1NR0Z4NDk2WHE1Wi1pTldkTFh5SXQ2R3p4dTBDN3RpYWYycmp3V0JQLUU?oc=5
Miranda,Social e Cultura,"Com abertura nesta quinta-feira, Jogos Escolares da Juventude de MS 2024 tem recorde de participações - fundesporte.ms.gov.br",fundesporte.ms.gov.br,"Mon, 03 Jun 2024 07:00:00 GMT","Com abertura nesta quinta-feira, Jogos Escolares da Juventude de MS 2024 tem recorde de participações  fundesporte.ms.gov.br",https://news.google.com/rss/articles/CBMi0AFBVV95cUxOVlRleV9EWHE4dVp5YXozQThKaDNhV3o0MUk0NlB1bXNkNkdxYUl6cnF0NGVHRWU2QnhxaGZZSjl1bElscWo0MHdad2RPVTNWQjZsTTJZVVQyREh1V2VCX25veHNxR1BZWUZuV3M2R25JN2JsVVlhSVNONTRyZ1REU1dzaVJqOUlFNnM5aW9id2IyRHdXeHlqNFN4VmpaUXExQ3otdm90MXB5c25jZUo0NVB3dl9zWm1EVmRqNmJkOV9ON1dvQXV1alA4QnRFQ0Vp?oc=5
Miranda,Social e Cultura,Conheça 23 Patrimônios da Humanidade que ficam no Brasil — Ministério do Turismo - www.gov.br,www.gov.br,"Mon, 31 Jan 2022 08:00:00 GMT",Conheça 23 Patrimônios da Humanidade que ficam no Brasil — Ministério do Turismo  www.gov.br,https://news.google.com/rss/articles/CBMi1AFBVV95cUxQaUhyeWl6VkZXS2NaMFFrMXc0TXE1OHo5dlliVzA3Z3NBS25xY3JmakhoRGRqdXhsNHJSbFd2MDRQSkl2b0psUFFia3k5b0k0N3JxWmRfNjlqdFllc3k4N0hOWW9UV0ZEWVo3ekZEYlRuMmhzX1BDTkd4akY2OUNEWDRDcGVLelY1WWNORmg5NXJzbFB5RXo3MVFCV1YybFJPZl8yVXkwdXVzSllXVkNsLWtkdlBjYnhCc1VtN3NUV0JTamhSY1VvRnBoTkszUkRWelJQTA?oc=5
Miranda,Educação e Negócios,"Com educação profissional e qualificação, MS é beneficiado com melhores oportunidades de emprego - Portal Único ms.gov.br",Portal Único ms.gov.br,"Thu, 05 Mar 2026 08:00:00 GMT","Com educação profissional e qualificação, MS é beneficiado com melhores oportunidades de emprego  Portal Único ms.gov.br",https://news.google.com/rss/articles/CBMi1gFBVV95cUxPWDVZUV80MTJnQ3NES2VWLXNxVnlxaXlOeE5ZR3E5TFZPVXNvRU9oMjlxSHRiS0wzNl9FRXRxT1JCSjBWOXM0NFVfaUVKdDE3N2c3dTIwb3FYNW4tSWdkWHM0eEZIMVd5M21WOHdBbV9Ed25zVXhvZlpZTHVRSGZPS0dJM1paZm9qcVk3NUd0OTFHZGp1bUltNDRDR3MyWlZPa05vcDBBaWMwVEVyaUJiUEFzTXl5MUxMUUhNdVEySlJ2bE1QUnlmTWZCYzRqSHRoSWdlUWxB?oc=5
Miranda,Educação e Negócios,Funtrab inaugura Casa do Trabalhador de Brasilândia e amplia acesso a emprego e qualificação profissional - funtrab.ms.gov.br,funtrab.ms.gov.br,"Mon, 19 Jan 2026 08:00:00 GMT",Funtrab inaugura Casa do Trabalhador de Brasilândia e amplia acesso a emprego e qualificação profissional  funtrab.ms.gov.br,https://news.google.com/rss/articles/CBMi0gFBVV95cUxNelFaZGVCS2lIVlZ6c3Nmb0NMMkoxVnpLOUoyeG1SOW1Dc2dMZ2lqcy1ZR1c3SHB1bWJnR0xTVWNOYUVVV012Y2h6UlgyYmJfNXRmekdBMmJtRXdvT2dOc1duTXhYb1FoSlY4aURPdGY2UXlWNURRb1JrdF9hUEtRM3NvZnBROWphQm1DcVBMRENVdkZrbmc2RmNvNHRENjI3aFhJY0pxLTZ6b0lwbE90YkY4d3FGU1R1YllBenpkMDJlYmdpSUFEN1dRVkdnakN2bUE?oc=5
Miranda,Educação e Negócios,Petrobras abre 715 vagas no Programa Jovem Aprendiz 2025: veja salário e benefícios - Seu Dinheiro,Seu Dinheiro,"Wed, 01 Oct 2025 07:00:00 GMT",Petrobras abre 715 vagas no Programa Jovem Aprendiz 2025: veja salário e benefícios  Seu Dinheiro,https://news.google.com/rss/articles/CBMiygFBVV95cUxQYVlFektiNGdjNkxkbEMyOFhiUV9DOWtqRURlRFg0VXNWWHRsZ2lPNjY1OEhXeHFlbHBOUE53MDdlaU9scVVITTY3YUhCSE9aUjItVzI1czVuVFdfZWlERktVSlFMMGUwcTF1UXRubGlpT0FnVFpkWE50ZkFnSFF4WkhSZlQzTWdWVkYxcHQwb0lnMGhiWGFXLTZOa0JNeUlJZlNwd01yakpaMTRXdURPeUJhTHQtU0dWemRzc2JGdEhXemNqcnNEdmZB?oc=5
Miranda,Educação e Negócios,Corpo de Bombeiros divulga novo resultado da seleção para bombeiros temporários - Midiamax,Midiamax,"Fri, 17 Oct 2025 07:00:00 GMT",Corpo de Bombeiros divulga novo resultado da seleção para bombeiros temporários  Midiamax,https://news.google.com/rss/articles/CBMiwwFBVV95cUxOZHdRQVgzaklJd20tdFM1cUFkNFc5ZVR0TnZ3NTBqUGlwNXhJT1F0c0ZRQnBUMFFvaTVSNXRZODBwaDl4ZmxLVm1nbUhoNUwyeUZBYVExVkliUE54NU93S25Bc3gzeWNxcDhUMFBqcUdlUjNZMTRVMVBtMWdraFNNTkZCNGZQYTJLY3g1bzJDZWRHaVA2dXNwQlIydGhRdmFlY1pxYkYxQy15UmhGSHBqLThraW5zc2hvNC02cmZfdXgyN00?oc=5
Miranda,Educação e Negócios,Governo de MS oferece cursos de qualificação na área de economia criativa a partir de agosto - Portal Único ms.gov.br,Portal Único ms.gov.br,"Fri, 19 Jul 2024 07:00:00 GMT",Governo de MS oferece cursos de qualificação na área de economia criativa a partir de agosto  Portal Único ms.gov.br,https://news.google.com/rss/articles/CBMiwAFBVV95cUxQUkd4YzNxV2FXZGpySm1xMnFVX3ZWOXZMOXlPTkQ1X2JSS0NFUUFNR2ZMLTVhQlNiejNJZVdydmpNb2JLSWIyM3gtcnItTUNVbFhlLTJKSEg5OGFGNVRQbFJnNmhudlctVjc1Z09vdGJXSEx0UnVhSW55MTFHWWhQaVBBZ3Q4UDlEeE9WVWF6VE1mR2dCR1o4cC01SGJITlc5dGE3WDN6UFYyclNZWXNiYXQwLW12RFFkYzNOdHhHelc?oc=5
Miranda,Política e Institucional,"TRF3 e JFMS abrem a 9ª edição do projeto “Caminho do Acordo”, na Aldeia Cachoeirinha, em Miranda/MS - trf3.jus.br",trf3.jus.br,"Thu, 09 Oct 2025 07:00:00 GMT","TRF3 e JFMS abrem a 9ª edição do projeto “Caminho do Acordo”, na Aldeia Cachoeirinha, em Miranda/MS  trf3.jus.br",https://news.google.com/rss/articles/CBMiswFBVV95cUxQaGdLMEcwRWkwYU1ONmY2VjFBNE1jQXZyOEwta0tua3ItdXNORV9vWmVqOC1rbDFpVnRGelFHb09OeTdZSFppU3VsVmJUY3M0N1N5dzFnS1ZDU3RRYlZTWXRfcUxnZWJOSTBfYUViU1BwRDFJeWNDNTBGeVJqUklhYjBEU1NOTHJNZ0RkRUk0dXdLZ3JpMm5DN2NiVGRBWDZFR1lUMDRFUFFQY2pDOC00VzdDNA?oc=5
Miranda,Política e Institucional,"Polícia Civil inaugura a 53ª Sala Lilás do MS, em Japorã - pc.ms.gov.br",pc.ms.gov.br,"Fri, 24 Oct 2025 07:00:00 GMT","Polícia Civil inaugura a 53ª Sala Lilás do MS, em Japorã  pc.ms.gov.br",https://news.google.com/rss/articles/CBMiiAFBVV95cUxQQlpya005cXlFb0RtSFNMYnlTR3VIZFA2SlVlUk9pM09kUm1xR2dEeWk5VXZaUEFna2I3akpPb05OaUFySXhhVUlYekl4SG5DXzRzaGNiYTZpelJiOWpKU0JTZ2xrR3lNNzgxbjg4ZVktX290WnpuQlJySUVyb0E3R0s4ckFvTVR4?oc=5
Miranda,Política e Institucional,Sejusp entrega veículos para reforçar segurança em aldeias indígenas de Miranda - sejusp.ms.gov.br,sejusp.ms.gov.br,"Wed, 10 Sep 2025 07:00:00 GMT",Sejusp entrega veículos para reforçar segurança em aldeias indígenas de Miranda  sejusp.ms.gov.br,https://news.google.com/rss/articles/CBMirgFBVV95cUxOQXdZRWtmelJrVUtMMS1CdEhoenc3Y3RjMHk5SlljamJqbXh5aXVnU3NTblN2VUFWRjhNNXlXVDF5YzB0M3RiU3J4Tjh3SXJ3TkxBMDlraVczLUhlVGhhSVZ4dWpwTXVFN1RJRXlQdzJHUTUzek1iWDBucllybUNGNTlFVU1mLVRrR2cwM2JQQmZPekh5RVVMMWtHcFlRUjQxZDVnc0h5emJ2MlE1WkE?oc=5
Miranda,Política e Institucional,"Falece Dr Nelson Kawamura, médico em diversas cidades do MS - O Pantaneiro",O Pantaneiro,"Sun, 26 Apr 2026 07:00:00 GMT","Falece Dr Nelson Kawamura, médico em diversas cidades do MS  O Pantaneiro",https://news.google.com/rss/articles/CBMipwFBVV95cUxPMzZ1UG9DZHI0LWtDVndueGNWcVVkXzMxeEhuaG1qVGN5WTh5RENxUk1YMGsyd3lFeVFwNEV3TV92Z2w1WkpGeFVKUzZncEh4Ni1xUFIyNjVySnFmNkI4NVB5VEQxVUIxN0d5ZUJXRkdGWHNETkhaeXhfbjdkWVk5TE8taWp5V2JhcFA4YlRZYlEzZHUzSS1DeVh6Z0M3dFlNQ0xOUGJndw?oc=5
Miranda,Política e Institucional,Prefeitura de Miranda MS abre processo seletivo para contratar docentes - Concursos no Brasil,Concursos no Brasil,"Fri, 07 Nov 2025 08:00:00 GMT",Prefeitura de Miranda MS abre processo seletivo para contratar docentes  Concursos no Brasil,https://news.google.com/rss/articles/CBMixAFBVV95cUxQY3lvRDY4SFFXNHdqQ2RWRHpSN0E3dXI0VHU0dkw3d3dESlJBUU55NGp4cXRVaE9UVFZFUG9nbnMtMzdkQUotR1hSbDJJYmNJQ0FncHdXUjdYaWotdkl3bERVSjFieTRDVEdtYVQxa1hFQTJaZk1FMTl0RHREMF9NeWhYdVd2QVNqa3NmTkQ5d2lXN0o1SUhlZk9vNW9MVnB3SktBX2syd1dPQlJTMzcyRnBiYkNBaUxUWFJuMmoteUZVNHNy?oc=5
Mundo Novo,Social e Cultura,Sesc Teatro Prosa oferece semana de arte e lazer gratuito em Campo Grande - capitalnews.com.br,capitalnews.com.br,"Mon, 20 Apr 2026 22:41:00 GMT",Sesc Teatro Prosa oferece semana de arte e lazer gratuito em Campo Grande  capitalnews.com.br,https://news.google.com/rss/articles/CBMi0gFBVV95cUxPQkExNkh5blpBM2FFRXBKZGNnMXcycExSRkEzQV9uM290MTUyWDNYRS1NaHFqRld6cmpVQ0RIQ3dBX21vTE5obzZLcDhUWnpGa3RhblA2M0gwNnFZRlJMdFQ2QjVfNnpidTBwekNHOWlmVko5TFJXLVdjOTN0YzV3SkJnRnBRcGhEM2ZlR0tTWDhONDJQV2l6LXdmNXo5MldwbUdscWRIYmtWcDl4Nm90Z1ZIMi01U2Y1SjFRZG9JVHNFRkVBTlpTaXRuTDFzaEphVVE?oc=5
Mundo Novo,Social e Cultura,Infraestrutura aérea de MS avança com investimentos que conectam o Estado ao mundo - agenciadenoticias.ms.gov.br,agenciadenoticias.ms.gov.br,"Sat, 28 Dec 2024 08:00:00 GMT",Infraestrutura aérea de MS avança com investimentos que conectam o Estado ao mundo  agenciadenoticias.ms.gov.br,https://news.google.com/rss/articles/CBMiuwFBVV95cUxPelJQaEVNMmk0RkNneEpRVWZ2QVM2Qi1xOVdpMnZicURDcUVKM0NTcDV1Y0RiNXNYYWxzOW9ianFsTjNDSkM5RWc3MHRBNjRrb1JsZEJQdFlvSDdKRmloX2VVemxMSzJHWDJsMXR0U1gtT01OTFoxcUdyOU5XcXpqanRUTUtwSmtjaExlVjNfei1ReXllMG1sVDJBRWFZbzlmTEJiVThCUUMzYTlSN2RyeGpWRXNmQ2o1eFZB?oc=5
Mundo Novo,Social e Cultura,"Live comemora aniversário de Ponta Porã com muita música, história e cultura - Prefeitura Municipal de Ponta Porã",Prefeitura Municipal de Ponta Porã,"Sat, 17 Jul 2021 07:00:00 GMT","Live comemora aniversário de Ponta Porã com muita música, história e cultura  Prefeitura Municipal de Ponta Porã",https://news.google.com/rss/articles/CBMiXkFVX3lxTE53cTdDQmIwdTZlSWN0VUV0cmZydVh1NUlvYlZSYU1oT1hhdE9FdHlNMm1TUFBCTUZUS1UtYmRISEhibTJfOTB4Sm96eTYtMVk0VC03S0x2em5idEtiYVE?oc=5
Mundo Novo,Social e Cultura,"Cine Sesi tem 2º maior público do ano em Bonito com 4,9 mil pessoas - Agência de Notícias da Indústria",Agência de Notícias da Indústria,"Tue, 25 Sep 2012 07:00:00 GMT","Cine Sesi tem 2º maior público do ano em Bonito com 4,9 mil pessoas  Agência de Notícias da Indústria",https://news.google.com/rss/articles/CBMi0gFBVV95cUxQNHRsNkdrcS1vTGxMOUFyR0d1UmtSc0ZNZ1FEN1ZhZHNSRzh0XzBsUml5MENpYVZ2RXcweFdEMHh2cFBZbEYxMU5iV1k5Z3B2cmlLU0QzRDZtbGVFWkpQcmwwb2UtaUZXMDRZTm5QUlNBOWJ0azBnV01zbjNvYmRWcHZKbkRYN2doRElyZHNRQUFjMlBiUDJERWRQN1ROOHZUVmExUkJLZm5HWmFDNHNMQ2xVdktYd25hZ0ZKbnBPTEV3REJIWFlSU3ZlVE0tM05pN3c?oc=5
Mundo Novo,Social e Cultura,Projeto Artesania fomenta cultura e geração de renda no interior por meio do artesanato - Portal Único ms.gov.br,Portal Único ms.gov.br,"Fri, 30 Aug 2024 07:00:00 GMT",Projeto Artesania fomenta cultura e geração de renda no interior por meio do artesanato  Portal Único ms.gov.br,https://news.google.com/rss/articles/CBMiugFBVV95cUxPd05UcnQ0bVBBcG9VSjZ0TlhwVWd3TjNFeXhNVS1ZWTNIZllfZ2dRRnpYdU9tUTlRajdNTXB2VThYN3BxOUYwcEY2YUdEQmU0dlFaV3c4bWt4Tjc2a3NwWTJyV2daaGZiTE1GbEdRUUdBZ2ZOYVpORlMzXzBKRWVYWXM4M0VaeU9OTXZfWHY5ZWZneFFSYkcxVW9PVzlBdlRrOXctcXJMTGhlLUtCTjBiWkFtaXhUSTdReGc?oc=5
Mundo Novo,Educação e Negócios,Funtrab e SENAI-MS abrem vagas para cursos gratuitos e fortalecem qualificação profissional no Estado - funtrab.ms.gov.br,funtrab.ms.gov.br,"Thu, 07 May 2026 13:05:04 GMT",Funtrab e SENAI-MS abrem vagas para cursos gratuitos e fortalecem qualificação profissional no Estado  funtrab.ms.gov.br,https://news.google.com/rss/articles/CBMizAFBVV95cUxQcFhKcmNSMkNMTVNlUDdWV1U4WW5hQmFlNXVqUm52WkRRYkFuWXJxbS14Ukhyc3FqdkFsanBxZHdIMGc5bzVxV2drUkY5WEc0cEFYOVdtdXB1dllwWHJjb3N1cEFUS1JtVUJRUUVnTkZyN0RuQl82YmlUS0dLendBN3d3UzVJUjJwdW9xS1R6cWx5XzJEd2ktVWk2a241eFNjTGNmTlJlY3hNT2JTVV9SdGFVclV1TlJBMFZwOXBfZ0RlaDNJY094T2NKZnY?oc=5
Mundo Novo,Educação e Negócios,Confira a programação completa do Delas Day 2026 - funtrab.ms.gov.br,funtrab.ms.gov.br,"Tue, 24 Feb 2026 08:00:00 GMT",Confira a programação completa do Delas Day 2026  funtrab.ms.gov.br,https://news.google.com/rss/articles/CBMihgFBVV95cUxNcllWT01Kb1dMMFZuT3VPNXFqS185U0Zkb3lGc1IxNndEanV1VEppVmpyc1EtREo1OHVZOWM2VXRPb3liTVBLUkNlbjJtVDgwOEozLXpVTUY2akRrc0dmNTRqd0sydVo2Yk1vUzV2M0pqZVBQQ0FpUVR6RmJ6REFMWFhVQ0JWUQ?oc=5
Mundo Novo,Política e Institucional,Polícia Civil inaugura a 51ª Sala Lilás em Mundo Novo - pc.ms.gov.br,pc.ms.gov.br,"Sat, 04 Oct 2025 02:28:16 GMT",Polícia Civil inaugura a 51ª Sala Lilás em Mundo Novo  pc.ms.gov.br,https://news.google.com/rss/articles/CBMihgFBVV95cUxNMUFJMjAxOHZSR0luNUF0anhENnhiMGVxTjA2dUF4WldGaXE2NG1BUzRZRll5LUc5dnVzckttR0NjVkpGdjFTQU9MblJ6YjhoUjJNNnBuN3YzTkdJaDdFTXRqRXlWcGl1d3dDTUxiT1ItTzNQU0V2VDBTVkJaQkFLdS1wejZsZw?oc=5
Mundo Novo,Política e Institucional,"Polícia Civil inaugura a 53ª Sala Lilás do MS, em Japorã - sejusp.ms.gov.br",sejusp.ms.gov.br,"Fri, 24 Oct 2025 07:00:00 GMT","Polícia Civil inaugura a 53ª Sala Lilás do MS, em Japorã  sejusp.ms.gov.br",https://news.google.com/rss/articles/CBMijgFBVV95cUxPbExxTDdpU3U2U1otclpkdE9rRjJnTGNvNHoxd1JMOUNsLVFPUlhFSUFUVUNpb05rN2doZlFqc2FwSmhKTGhMN0JnYzZrN1ZWUFByWUhmMG5KSUFVOHJBQy1HM0xkdlMtbWlXXzZVc0w3Yk1Jb015MGk0c2VCN1ZrVXBaMVU4dXNfTGVGRFpn?oc=5
Mundo Novo,Política e Institucional,Ex-prefeito de Japorã ganha cargo semelhante ao do prefeito e passa a ser investigado - Midiamax,Midiamax,"Fri, 31 Oct 2025 07:00:00 GMT",Ex-prefeito de Japorã ganha cargo semelhante ao do prefeito e passa a ser investigado  Midiamax,https://news.google.com/rss/articles/CBMisAFBVV95cUxNTzYzSm5Iby01S0gwVjl5cWxnNnZiSkhhb002ejcxMkVrZW16SFl1WHhLQTBheHVrNG1EUW03SXgySVhKSGE2X19XVEdBQmhid28xNnhvN0NzaU9SLTJvUXhyYTFNT3p6bm0tLWVTSjZLZmhxOG4tekZIZDY5ZGZVOWZ3ZEc3NzRXcnBWcEQ1Qi1pRHVXd1lKOWV5SzRvYlBGUy1yS3ZpWHNxWUhiaWxSSg?oc=5
Mundo Novo,Política e Institucional,Prefeitura abre inscrições para concurso público com 166 vagas - Dourados News,Dourados News,"Sun, 03 Aug 2025 07:00:00 GMT",Prefeitura abre inscrições para concurso público com 166 vagas  Dourados News,https://news.google.com/rss/articles/CBMivAFBVV95cUxQeVg3U1BoZzJ1b0xPRThrLTloNF8tMU1wOEVzd3NrRnFKWi1qb08zZ2IzQkU3X3d0aGJ5bUZQcDVmLU5ZbFlTNlRXV2RHc19DcFpuUExUQWVhREhnT2o0NHJNSHVlRjJCaUh0bUtHa0lJYXNndUlkR3VUb29ZcmRtOTJ1T0pDWDFzeVEyMWVHMlNKdzJtcUNkRWhhbVF4bm1tdXNDejRmOGZkZG5RVEpGUVZuMktLLVRpN0YtdtIBtgFBVV95cUxQc0xKa2FVRjJzWnZaLVZaUDFYcjVTbGZuTjhKclNsTDZYVjRpQkJuZVZ5a3liVkM4VTdBNEVHNk5yZ1owaFRNdlY5eVFCS1VOMnhDb3dWNVNHYTQyclA1a3RFdEcwNVp2eTljTEF6cWt4TWlUemRoNkFQYVZhNnJGQzRlbXQyZ2JTVFRMTHNHczJ6aVgxX0gxenJNT3lLdWdGdGRyallWY3dFNUFqRTlCdVF6a2lzQQ?oc=5
Mundo Novo,Política e Institucional,Mundo Novo contrata sete escritórios de advogados em menos de um ano - Midiamax,Midiamax,"Sun, 16 Nov 2025 08:00:00 GMT",Mundo Novo contrata sete escritórios de advogados em menos de um ano  Midiamax,https://news.google.com/rss/articles/CBMirgFBVV95cUxOZXJkZGc1RWNDejhaQzZEdVQweE1kbGctcV9OeURiQTdHa21ueXN3NFZjSHBBd2xVbk9TcUw0VDh6SEhCek1iYTVnVU9iS0NTM0pYTzlnYjFWZWRJOTExUlR6MEVQc0RyTGZmQy1RZ2pQcGctT3BTWDJ4Ymt2dzFtcGEwR0lKdzJZMjV6dHY2M2FSUGdFMjlSRlF3Z3NYZG4zZTc5a0hmWmJjQkJPRkE?oc=5
Naviraí,Social e Cultura,"Governo licita obras de CEUs da Cultura em quatro cidades e fortalece acesso à arte, educação e cidadania - Portal Único ms.gov.br",Portal Único ms.gov.br,"Sat, 14 Feb 2026 08:00:00 GMT","Governo licita obras de CEUs da Cultura em quatro cidades e fortalece acesso à arte, educação e cidadania  Portal Único ms.gov.br",https://news.google.com/rss/articles/CBMi0AFBVV95cUxQS3JiTldxcUpiZ0tHUGFKRnhqT29xbDE5TklUbUNIR3l2Z01Qb1dOa2ttTVo4Q0k0TGR1V3JOTXVmNDR5WE5CSko3MmdoclVpZk0yVzl1SXBTODhjZ01aWndobUo3dzA0Mm5yWVZyTmxGb3lQc05QZE5XRnNESERqQVlVMXZNMDRMcVkyazhjVGgzYnNLRU42Uk00ZzB3SUQzUFMzWm55M2MzWXJPNElVbWlQOWxTSGJ1V1BNSFZDdHhSTzRxUTZibVk0eDV2QUow?oc=5
Naviraí,Social e Cultura,Neno Razuk investe mais de R$ 5 milhões em emendas e transforma municípios de MS - Assembleia Legislativa de Mato Grosso do Sul -,Assembleia Legislativa de Mato Grosso do Sul -,"Wed, 09 Jul 2025 07:00:00 GMT",Neno Razuk investe mais de R$ 5 milhões em emendas e transforma municípios de MS  Assembleia Legislativa de Mato Grosso do Sul -,https://news.google.com/rss/articles/CBMiwwFBVV95cUxQVEZZaXFodnY4Q08zWnF2clpBaXppa1o2TzRqUzZ4bktxWXE4UTF3bWh2OW5LbTFHT1AzU043UHJuak83MWJWc3lQdjVuNDh3S3I4TWJJOEsxbnpFVk9CSGNodXNKdFlNUWVJOGF6VFdkX2ZGS1REM3lnVWk5QV9XckJLLXhkcDh1MlFkSVdqZmRTa2ctU283S2E1dEoxUXcwWGxJeV9QaDFfblJnTHI1RXJDbm1WNHF2MWVYTEVMWXpPQzA?oc=5
Naviraí,Social e Cultura,"Agendão: bandeirinhas, forró e quitutes marcam o início das festas juninas em Mato Grosso do Sul - agenciadenoticias.ms.gov.br",agenciadenoticias.ms.gov.br,"Fri, 06 Jun 2025 07:00:00 GMT","Agendão: bandeirinhas, forró e quitutes marcam o início das festas juninas em Mato Grosso do Sul  agenciadenoticias.ms.gov.br",https://news.google.com/rss/articles/CBMiywFBVV95cUxPRzJQMTBIWFk5NmpsY1V4WWtWdUplRkRoTEVOenJDbmxLWTVWRE9lRkZPVzRwY3V1b3VhajR0RFZQVWxDYnpRemNWc29DeDY0TXN4UjhpUEFYY0h1bWVLbDlKWDY2bkRyLVhvU0ZWU0Yza3FqNHVHRmdTVnJ0NzU2VEgyRmFEVHlZVnpYMFk0RzJLZ0VObWwzRlQyN1o4bUlOeTU1ZjlnNUtIaUpRMWJJX1pSbmhrMWxfSmp2cDVTOUd4OEFhd3JaMmYwYw?oc=5
Naviraí,Social e Cultura,Calendário Oficial de Eventos Culturais de 2025 é definido pela Gestão Compromisso com o Futuro - navirai.ms.gov.br,navirai.ms.gov.br,"Wed, 19 Feb 2025 08:00:00 GMT",Calendário Oficial de Eventos Culturais de 2025 é definido pela Gestão Compromisso com o Futuro  navirai.ms.gov.br,https://news.google.com/rss/articles/CBMiygFBVV95cUxQaDRrODVNRzdfWHhHQ29qLVFtc3R6ckU3OTQtOElSMk1JTHpRanZ3WFhOY0NaN3NYcUczTmMwTGFNekdVT2xZWDk1QTlXc1hkMkVyeUJjV0JIb25XR3hGNXIydzJ5bGxpMGlNckdPbXYzWVBSZU1hWk9DeVp1cFBwNkFvRGVTOHQ2VUdsamNwc3RvZTFwUm1nSW1NT3F6NEI0Rkxha3liUV9KMTYyWjNqcDJWekVYQUluTUxCR1VDOE04bEJnTVhXWDJB?oc=5
Naviraí,Social e Cultura,"Cine Sesi Cultural finaliza 3ª etapa com 101,6 mil pessoas em 32 cidades - Agência de Notícias da Indústria",Agência de Notícias da Indústria,"Mon, 12 Nov 2012 08:00:00 GMT","Cine Sesi Cultural finaliza 3ª etapa com 101,6 mil pessoas em 32 cidades  Agência de Notícias da Indústria",https://news.google.com/rss/articles/CBMi2AFBVV95cUxPb2s0TFZTN1VsNUxCcm5kdFdhMzBnMjJIdWFITFkxa0Iza0Q0SGlMem9TeGdkU2FDeHZZUE1WR3VxVGV0T08temhMVmRwempUbW5Cdm9YN3N0aF9zYUJNZkVTTzRmbXlZc1NhZmtGUE9CbG0zblRyejhPbU5Va2ltdUU5TlJ2Zy1Gb3VJdU9oY1hSN0pBdy1ua1ZETFkxb0VfejFNLXctS0VIekNYQWNYYnBiQk5QRDJoV01uM3NRNHUxOTZyTWp0NkUyLUw3T2JhTzNlazRJNDU?oc=5
Naviraí,Educação e Negócios,Senai MS: 2 mil vagas em cursos técnicos com bolsa de R$ 300; inscreva-se - Campo Grande News,Campo Grande News,"Fri, 13 Feb 2026 08:00:00 GMT",Senai MS: 2 mil vagas em cursos técnicos com bolsa de R$ 300; inscreva-se  Campo Grande News,https://news.google.com/rss/articles/CBMiygFBVV95cUxOWHVYVm1BR1ZyVVlueW43X1VYM3ZFMEU1ZlRfU0xfLTY3bmZFaHM1ZlZXNGFwMzJKRFhPajF1WDI1VjZ6ZWh2QkZacmtMSFlEMEJJOEI5VnN3c1Jab05rUjRCQW1ncUpoNmpBSGZnTlcwRlc5dFl6dXAySEV4bE4xZ1ViVjF2N2x0anBPNmZlTVFMQ014dVJqendPRnJLSlEtMk1vbEtkTUlEUTQzMEpUTWU2dG9ZeWI4eDEzUWtmblBOMmFxVS1SeklB0gHKAUFVX3lxTE1kbU4yTTRfSGxJMkRSUHljYThnRHh4WlppSHkwclI1Q0EyN0VVNVR1aDM2YTBpeWJvZU5hNWtBcnVoQ0xFbTBsTHBjLTg1d2dRTDM4TllLa0lEZXA2TnpPT0cxZWtrWXJtWGZJS0JveEZPVVhnTnFlT3ZfaHo1Q0JMRmt4YjI4QXdtTGQxV2UxSG1SejFEZ0hIOUVGZHNDeTlDeElucE11RG0tUUhaWm9JcHMxV2NydVgxekljWUlRQTdRWjdDVm9wSHc?oc=5
