municipio,qtd_noticias_encontradas,temas_frequentes,resumo_para_slide
Brasilândia,15,"brasilândia, abre, funtrab, fundesporte, cine","Festival de Dança Coreografada da Melhor Idade define campeões - fundesporte.ms.gov.br Cine Sesi Cultural finaliza 3ª etapa com 101,6 mil pessoas em 32 cidades - Agência de Notícias da Indústria Virada Cultural 2025 de SP: veja programação completa do evento, que completa 20 anos - G1 Plano Estadual de Esporte e Lazer de MS trará diretrizes do setor para os próximos 10 anos - fundesporte.ms.gov.br Cine Sesi tem 2º maior público do ano em Bonito com 4,9 mil pessoas - Agência de Notícias da Indústria Casa do Trabalhador de Brasilândia anuncia vaga imediata e abre inscrições para cursos de qualificação - funtrab.ms.gov.br Setor de Tecnologia abre mais de 200 mil vagas para cursos de capacitação - IT Forum - IT Forum SENAR Jovem Rural: Programa busca reter talentos no campo e possibilita empregabilidade - cnabrasil.org.br Suzano abre vagas em 3 cidades de MS para áreas florestal e de manutenção - Midiamax Funtrab inaugura Casa do Trabalhador de Brasilândia e amplia acesso a emprego e qualificação profissional - funtrab.ms.gov.br Prefeita de Brasilândia ignora investigação do MP e fecha contrato milionário com empresa de réu por fraude - Perfil News Ministério Público apura nepotismo na contratação de nove parentes no interior - Investiga MS Empreiteira da Capital vai construir creche no Valle Verde II por R$ 3,1 milhões - Midiamax REFERÊNCIA: Almoxarifado Central de Bataguassu recebe visitas técnicas das Prefeituras de Água Clara e Brasilândia - prefeitura municipal de bataguassu (ms) Prefeitura de Brasilândia - MS republica processo seletivo com salários de até R$ 8,8 mil - PCI Concursos Festival de Dança Coreografada da Melhor Idade define campeões  fundesporte.ms.gov.br Cine Sesi Cultural finaliza 3ª etapa com 101,6 mil pessoas em 32 cidades  Agência de Notícias da Indústria Virada Cultural 2025 de SP: veja programação completa do evento, que completa 20 anos  G1 Plano Estadual de Esporte e Lazer de MS trará diretrizes do setor para os próximos 10 anos  fundesporte.ms.gov.br Cine Sesi tem 2º maior público do ano em Bonito com 4,9 mil pessoas  Agência de Notícias da Indústria Casa do Trabalhador de Brasilândia anuncia vaga imediata e abre inscrições para cursos de qualificação  funtrab.ms.gov.br Setor de Tecnologia abre mais de 200 mil vagas para cursos de capacitação - IT Forum  IT Forum SENAR Jovem Rural: Programa busca reter talentos no campo e possibilita empregabilidade  cnabrasil.org.br Suzano abre vagas em 3 cidades de MS para áreas florestal e de manutenção  Midiamax Funtrab inaugura Casa do Trabalhador de Brasilândia e amplia acesso a emprego e qualificação profissional  funtrab.ms.gov.br Prefeita de Brasilândia ignora investigação do MP e fecha contrato milionário com empresa de réu por fraude  Perfil News Ministério Público apura nepotismo na contratação de nove parentes no interior  Investiga MS Empreiteira da Capital vai construir creche no Valle Verde II por R$ 3,1 milhões  Midiamax REFERÊNCIA: Almoxarifado Central de Bataguassu recebe visitas técnicas das Prefeituras de Água Clara e Brasilândia  prefeitura municipal de bataguassu (ms) Prefeitura de Brasilândia - MS republica processo seletivo com salários de até R$ 8,8 mil  PCI Concursos"
Caarapó,15,"vagas, caarapó, municípios, milhões, mato","Neno Razuk investe mais de R$ 5 milhões em emendas e transforma municípios de MS - Assembleia Legislativa de Mato Grosso do Sul - Cine Sesi Cultural finaliza 3ª etapa com 101,6 mil pessoas em 32 cidades - Agência de Notícias da Indústria Senadora Soraya garante mais de R$ 28 milhões para 23 municípios de Mato Grosso do Sul em maio - MS Todo dia Cine Sesi tem 2º maior público do ano em Bonito com 4,9 mil pessoas - Agência de Notícias da Indústria Baile do Trabalhador acontece neste sábado no CTG em Amambai - A Gazeta News Bioenergia: rodada de empregabilidade oferece mais de 630 vagas em 15 municípios de MS - Portal Único ms.gov.br Casa do Trabalhador de Caarapó promove vagas para Jovem Aprendiz em parceria com a Raízen - funtrab.ms.gov.br CCR MSVia está com 30 vagas de trabalho abertas em municípios de MS - Motiva Rodovias Raízen abre mais de 400 vagas para programa de aprendiz - Revista Cultivar Setor de bioenergia oferece 630 vagas de emprego em 15 cidades de MS - - Folha de Campo Grande - MPMS e parceiros inauguram padaria em presídio de Caarapó com recursos de penas pecuniárias e ANPPs - MPMS Câmara de Caarapó devolve à prefeitura R$ 3,7 milhões; dinheiro ajuda erguer hospital e quitar folha do serviço municipal - Midiamax Semadesc participa da abertura da Exposição Agropecuária de Caarapó - semadesc.ms.gov.br Polícia Civil inaugura a 52ª Sala Lilás do MS em Aparecida do Taboado - Costa Leste News Prefeitura veta próprio projeto que promovia reforma administrativa em Caarapó - Midiamax Neno Razuk investe mais de R$ 5 milhões em emendas e transforma municípios de MS  Assembleia Legislativa de Mato Grosso do Sul - Cine Sesi Cultural finaliza 3ª etapa com 101,6 mil pessoas em 32 cidades  Agência de Notícias da Indústria Senadora Soraya garante mais de R$ 28 milhões para 23 municípios de Mato Grosso do Sul em maio  MS Todo dia Cine Sesi tem 2º maior público do ano em Bonito com 4,9 mil pessoas  Agência de Notícias da Indústria Baile do Trabalhador acontece neste sábado no CTG em Amambai  A Gazeta News Bioenergia: rodada de empregabilidade oferece mais de 630 vagas em 15 municípios de MS  Portal Único ms.gov.br Casa do Trabalhador de Caarapó promove vagas para Jovem Aprendiz em parceria com a Raízen  funtrab.ms.gov.br CCR MSVia está com 30 vagas de trabalho abertas em municípios de MS  Motiva Rodovias Raízen abre mais de 400 vagas para programa de aprendiz  Revista Cultivar Setor de bioenergia oferece 630 vagas de emprego em 15 cidades de MS -  Folha de Campo Grande - MPMS e parceiros inauguram padaria em presídio de Caarapó com recursos de penas pecuniárias e ANPPs  MPMS Câmara de Caarapó devolve à prefeitura R$ 3,7 milhões; dinheiro ajuda erguer hospital e quitar folha do serviço municipal  Midiamax Semadesc participa da abertura da Exposição Agropecuária de Caarapó  semadesc.ms.gov.br Polícia Civil inaugura a 52ª Sala Lilás do MS em Aparecida do Taboado  Costa Leste News Prefeitura veta próprio projeto que promovia reforma administrativa em Caarapó  Midiamax"
Cassilândia,12,"cassilândia, funtrab, notícias, cine, sesi","Cine Sesi Cultural finaliza 3ª etapa com 101,6 mil pessoas em 32 cidades - Agência de Notícias da Indústria Cine Sesi tem 2º maior público do ano em Bonito com 4,9 mil pessoas - Agência de Notícias da Indústria Últimos dias de inscrições para qualificação profissional a distância no IFMS - Correio de Corumbá GIRO FUNTRAB DE NOTÍCIAS – 03/06/2025 a 16/06/2025 - funtrab.ms.gov.br GIRO FUNTRAB DE NOTÍCIAS – 25/11/2024 a 02/12/2024 - funtrab.ms.gov.br Concurso ﻿Cassilândia MS: SAIU! Veja - Blog Gran Cursos Online Funtrab em Cassilândia inicia segundo ciclo do Projeto “Jovem de Futuro” - funtrab.ms.gov.br Prefeitura de Cassilândia realiza nova oficina da revisão do Plano Diretor no Bairro Santa Rita - MS Todo dia Prefeito Rodrigo Freitas recebe vice-governador Barbosinha em Cassilândia para fortalecer parcerias com o Estado - O CORREIO NEWS Servidora morre após cair de ponte durante trilha com ex-marido em Cassilândia - G1 Prefeitura de Cassilândia divulga calendário de feriados e pontos facultativos para 2026 - Cassilândia Notícias Cassilândia divulga lista final de candidatos aptos para prova do Conselho Tutelar - MS Todo dia Cine Sesi Cultural finaliza 3ª etapa com 101,6 mil pessoas em 32 cidades  Agência de Notícias da Indústria Cine Sesi tem 2º maior público do ano em Bonito com 4,9 mil pessoas  Agência de Notícias da Indústria Últimos dias de inscrições para qualificação profissional a distância no IFMS  Correio de Corumbá GIRO FUNTRAB DE NOTÍCIAS – 03/06/2025 a 16/06/2025  funtrab.ms.gov.br GIRO FUNTRAB DE NOTÍCIAS – 25/11/2024 a 02/12/2024  funtrab.ms.gov.br Concurso ﻿Cassilândia MS: SAIU! Veja  Blog Gran Cursos Online Funtrab em Cassilândia inicia segundo ciclo do Projeto “Jovem de Futuro”  funtrab.ms.gov.br Prefeitura de Cassilândia realiza nova oficina da revisão do Plano Diretor no Bairro Santa Rita  MS Todo dia Prefeito Rodrigo Freitas recebe vice-governador Barbosinha em Cassilândia para fortalecer parcerias com o Estado  O CORREIO NEWS Servidora morre após cair de ponte durante trilha com ex-marido em Cassilândia  G1 Prefeitura de Cassilândia divulga calendário de feriados e pontos facultativos para 2026  Cassilândia Notícias Cassilândia divulga lista final de candidatos aptos para prova do Conselho Tutelar  MS Todo dia"
Chapadão do Sul,15,"portal, único, inscrições, correio, news","Plano Estadual de Esporte e Lazer de MS trará diretrizes do setor para os próximos 10 anos - Portal Único ms.gov.br Centro de Referência de Esporte e Cultura Escolar abre inscrições para atividades gratuitas - Portal Único ms.gov.br Caxias do Sul é eleita a 14ª cidade mais feliz do Brasil - Rádio Solaris Copa ED Adventure agitou paraisdo e se consolida no cenário esportivo regional - O CORREIO NEWS Festival de Dança Coreografada da Melhor Idade define campeões - fundesporte.ms.gov.br Últimos dias de inscrições para qualificação profissional a distância no IFMS - Correio de Corumbá Programa Qualificação de Jovem abre inscrições em Chapadão do Sul - Diário Chapadense Bioenergia: rodada de empregabilidade oferece mais de 630 vagas em 15 municípios de MS - Portal Único ms.gov.br GIRO FUNTRAB DE NOTÍCIAS – 03/06/2025 a 16/06/2025 - funtrab.ms.gov.br Educação que transforma: 100% dos municípios de Mato Grosso do Sul contam com ensino profissionalizante - sed.ms.gov.br Servidor em cargo técnico teria assinado contas do Fundeb como responsável contábil, aponta denúncia ao TCE - MS Todo dia Audiência pública destaca superávit fiscal, responsabilidade financeira e 99,66% de adimplência em Chapadão do Sul - Jovem Sul News Com Fiems, Paulo Corrêa articula desconto de até 20% na conta de energia para 74 municípios de MS - O CORREIO NEWS Polícia Civil inaugura a 53ª Sala Lilás do MS, em Japorã - sejusp.ms.gov.br Polícia Civil inaugura a 52ª Sala Lilás do MS, em Aparecida do Taboado - SINPOL-MS Plano Estadual de Esporte e Lazer de MS trará diretrizes do setor para os próximos 10 anos  Portal Único ms.gov.br Centro de Referência de Esporte e Cultura Escolar abre inscrições para atividades gratuitas  Portal Único ms.gov.br Caxias do Sul é eleita a 14ª cidade mais feliz do Brasil  Rádio Solaris Copa ED Adventure agitou paraisdo e se consolida no cenário esportivo regional  O CORREIO NEWS Festival de Dança Coreografada da Melhor Idade define campeões  fundesporte.ms.gov.br Últimos dias de inscrições para qualificação profissional a distância no IFMS  Correio de Corumbá Programa Qualificação de Jovem abre inscrições em Chapadão do Sul  Diário Chapadense Bioenergia: rodada de empregabilidade oferece mais de 630 vagas em 15 municípios de MS  Portal Único ms.gov.br GIRO FUNTRAB DE NOTÍCIAS – 03/06/2025 a 16/06/2025  funtrab.ms.gov.br Educação que transforma: 100% dos municípios de Mato Grosso do Sul contam com ensino profissionalizante  sed.ms.gov.br Servidor em cargo técnico teria assinado contas do Fundeb como responsável contábil, aponta denúncia ao TCE  MS Todo dia Audiência pública destaca superávit fiscal, responsabilidade financeira e 99,66% de adimplência em Chapadão do Sul  Jovem Sul News Com Fiems, Paulo Corrêa articula desconto de até 20% na conta de energia para 74 municípios de MS  O CORREIO NEWS Polícia Civil inaugura a 53ª Sala Lilás do MS, em Japorã  sejusp.ms.gov.br Polícia Civil inaugura a 52ª Sala Lilás do MS, em Aparecida do Taboado  SINPOL-MS"
Coronel Sapucaia,15,"news, gazeta, prefeitura, gaeco, pessoas","A cidade de MS que está entre as piores em qualidade de vida no Brasil, segundo levantamento - G1 Cine Sesi tem 2º maior público do ano em Bonito com 4,9 mil pessoas - Agência de Notícias da Indústria Cine Sesi Cultural finaliza 3ª etapa com 101,6 mil pessoas em 32 cidades - Agência de Notícias da Indústria Com apoio do Governo, Taboadão 2026 movimenta turismo, cultura e economia da região - A Gazeta News Com participação de competidores do MS e do PR, Open de tiro foi sucesso em Amambai - A Gazeta News Semana começa com mais de 500 vagas em concursos de MS e salários de R$ 13 mil - Midiamax Prefeitura de Ponta Porã - MS abre edital de Processo Seletivo com diversos cargos - PCI Concursos Notícias, galeria de fotos, vídeos de Amambai-MS e região | Página 30 - A Gazeta News Corpo de Bombeiros controlam incêndio à residência em Amambai - A Gazeta News Secretaria de Educação-MS abre 415 vagas para Assistente de Atividades Educacionais - Ache Concursos Gaeco volta à Prefeitura de Coronel Sapucaia contra grupo que fraudou licitações - Midiamax Prefeitura tem 90 dias para regulamentar uso de nome social de pessoas trans - Campo Grande News Gaeco apreende fortuna em nova fase de operação contra corrupção em Coronel Sapucaia - ojacare.com.br Empresa investigada pelo Gaeco recebeu R$ 15 milhões em Coronel Sapucaia - brasilnoticia.com.br Operação do Gaeco mira suposto esquema em contratos públicos em prefeitura de MS - agorams.com.br A cidade de MS que está entre as piores em qualidade de vida no Brasil, segundo levantamento  G1 Cine Sesi tem 2º maior público do ano em Bonito com 4,9 mil pessoas  Agência de Notícias da Indústria Cine Sesi Cultural finaliza 3ª etapa com 101,6 mil pessoas em 32 cidades  Agência de Notícias da Indústria Com apoio do Governo, Taboadão 2026 movimenta turismo, cultura e economia da região  A Gazeta News Com participação de competidores do MS e do PR, Open de tiro foi sucesso em Amambai  A Gazeta News Semana começa com mais de 500 vagas em concursos de MS e salários de R$ 13 mil  Midiamax Prefeitura de Ponta Porã - MS abre edital de Processo Seletivo com diversos cargos  PCI Concursos Notícias, galeria de fotos, vídeos de Amambai-MS e região | Página 30  A Gazeta News Corpo de Bombeiros controlam incêndio à residência em Amambai  A Gazeta News Secretaria de Educação-MS abre 415 vagas para Assistente de Atividades Educacionais  Ache Concursos Gaeco volta à Prefeitura de Coronel Sapucaia contra grupo que fraudou licitações  Midiamax Prefeitura tem 90 dias para regulamentar uso de nome social de pessoas trans  Campo Grande News Gaeco apreende fortuna em nova fase de operação contra corrupção em Coronel Sapucaia  ojacare.com.br Empresa investigada pelo Gaeco recebeu R$ 15 milhões em Coronel Sapucaia  brasilnoticia.com.br Operação do Gaeco mira suposto esquema em contratos públicos em prefeitura de MS  agorams.com.br"
Deodápolis,9,"deodápolis, vagas, lilás, abre, jovens","Neno Razuk investe mais de R$ 5 milhões em emendas e transforma municípios de MS - Assembleia Legislativa de Mato Grosso do Sul - Atvos abre 50 vagas para jovens aprendizes em Nova Alvorada do Sul e Deodápolis -MS - JornalCana 75 vagas de jovens aprendizes em Deodápolis, Glória de Dourados e Nova Alvorada do Sul - Rede Jota FM Secretaria de Educação-MS abre 415 vagas para Assistente de Atividades Educacionais - Ache Concursos Deodápolis lança Plano de Desenvolvimento Municipal com foco em inovação e fortalecimento econômico - ms.agenciasebrae.com.br MPMS intensifica ações em Deodápolis no Agosto Lilás e fortalece rede de proteção às mulheres - MPMS Deodápolis terá polo empresarial de 22 hectares com recursos do PRÓ-DESENVOLVE - semadesc.ms.gov.br Polícia Civil inaugura a 52ª Sala Lilás do MS em Aparecida do Taboado - Costa Leste News Polícia Civil inaugura a 53ª Sala Lilás do MS, em Japorã - sejusp.ms.gov.br Neno Razuk investe mais de R$ 5 milhões em emendas e transforma municípios de MS  Assembleia Legislativa de Mato Grosso do Sul - Atvos abre 50 vagas para jovens aprendizes em Nova Alvorada do Sul e Deodápolis -MS  JornalCana 75 vagas de jovens aprendizes em Deodápolis, Glória de Dourados e Nova Alvorada do Sul  Rede Jota FM Secretaria de Educação-MS abre 415 vagas para Assistente de Atividades Educacionais  Ache Concursos Deodápolis lança Plano de Desenvolvimento Municipal com foco em inovação e fortalecimento econômico  ms.agenciasebrae.com.br MPMS intensifica ações em Deodápolis no Agosto Lilás e fortalece rede de proteção às mulheres  MPMS Deodápolis terá polo empresarial de 22 hectares com recursos do PRÓ-DESENVOLVE  semadesc.ms.gov.br Polícia Civil inaugura a 52ª Sala Lilás do MS em Aparecida do Taboado  Costa Leste News Polícia Civil inaugura a 53ª Sala Lilás do MS, em Japorã  sejusp.ms.gov.br"
Dois Irmãos do Buriti,13,"milhões, municípios, assembleia, legislativa, mato","Neno Razuk investe mais de R$ 5 milhões em emendas e transforma municípios de MS - Assembleia Legislativa de Mato Grosso do Sul - Carreta-palco do Circuito Cultura MS segue para a região central com nova rodada de apresentações - agenciadenoticias.ms.gov.br Mais R$ 536 milhões: investimento do Governo de MS em rodovias impulsiona o desenvolvimento do Estado - Portal Único ms.gov.br Cine Sesi Cultural finaliza 3ª etapa com 101,6 mil pessoas em 32 cidades - Agência de Notícias da Indústria Investimentos públicos garantem qualidade de vida e potencializam turismo em Rio Verde - agenciadenoticias.ms.gov.br Legislação que regulariza o trabalho do menor é de... - Assembleia Legislativa de Mato Grosso do Sul - Na Capital, EJA é ofertado em 16 escolas e na modalidade à distância; veja lista - Campo Grande News Secretaria de Educação-MS abre 415 vagas para Assistente de Atividades Educacionais - Ache Concursos Audiência pública em Aquidauana reforça mobilização pela duplicação da BR-262 - O Pantaneiro Com Fiems, Paulo Corrêa articula desconto de até 20% na conta de energia para 74 municípios de MS - O CORREIO NEWS Polícia Civil inaugura a 53ª Sala Lilás do MS, em Japorã - sejusp.ms.gov.br Polícia Civil inaugura a 53ª Sala Lilás do MS, em Japorã - pc.ms.gov.br Começa amanhã o Projeto Caminho do Acordo na Aldeia São João - trf3.jus.br Neno Razuk investe mais de R$ 5 milhões em emendas e transforma municípios de MS  Assembleia Legislativa de Mato Grosso do Sul - Carreta-palco do Circuito Cultura MS segue para a região central com nova rodada de apresentações  agenciadenoticias.ms.gov.br Mais R$ 536 milhões: investimento do Governo de MS em rodovias impulsiona o desenvolvimento do Estado  Portal Único ms.gov.br Cine Sesi Cultural finaliza 3ª etapa com 101,6 mil pessoas em 32 cidades  Agência de Notícias da Indústria Investimentos públicos garantem qualidade de vida e potencializam turismo em Rio Verde  agenciadenoticias.ms.gov.br Legislação que regulariza o trabalho do menor é de...  Assembleia Legislativa de Mato Grosso do Sul - Na Capital, EJA é ofertado em 16 escolas e na modalidade à distância; veja lista  Campo Grande News Secretaria de Educação-MS abre 415 vagas para Assistente de Atividades Educacionais  Ache Concursos Audiência pública em Aquidauana reforça mobilização pela duplicação da BR-262  O Pantaneiro Com Fiems, Paulo Corrêa articula desconto de até 20% na conta de energia para 74 municípios de MS  O CORREIO NEWS Polícia Civil inaugura a 53ª Sala Lilás do MS, em Japorã  sejusp.ms.gov.br Polícia Civil inaugura a 53ª Sala Lilás do MS, em Japorã  pc.ms.gov.br Começa amanhã o Projeto Caminho do Acordo na Aldeia São João  trf3.jus.br"
Eldorado,15,"notícias, sesi, agência, indústria, vagas","UEMS lança Pantanal Tech MS 2026 com programação que integra ciência, produção e qualidade de vida - Portal Único ms.gov.br SESI-MS apresenta projeto de carbono na COP30 e SESI-SP investe em inovação na saúde - Agência de Notícias da Indústria Circuito Sesc de Artes chega a 9 cidades do Vale do Ribeira - Sesc São Paulo Cine Sesi Cultural finaliza 3ª etapa com 101,6 mil pessoas em 32 cidades - Agência de Notícias da Indústria Cine Sesi tem 2º maior público do ano em Bonito com 4,9 mil pessoas - Agência de Notícias da Indústria Petrobras, Raízen, Eldorado e mais: confira as vagas de emprego no setor de logística, nesta sexta (22) - Tecnologística GIRO FUNTRAB DE NOTÍCIAS – 30/07/2025 a 06/08/2025 - funtrab.ms.gov.br Acabou a desculpa! SENAI tem mais de 8,3 mil vagas em vários cursos pelo Brasil - Agência de Notícias da Indústria Eldorado Brasil abre 50 vagas para programa Jovem Aprendiz em Três Lagoas (MS) - Portal Celulose Atvos abre 50 vagas para jovens aprendizes em Nova Alvorada do Sul e Deodápolis -MS - JornalCana Com Fiems, Paulo Corrêa articula desconto de até 20% na conta de energia para 74 municípios de MS - O CORREIO NEWS Sem exigência de escolaridade: prefeitura abre seletivo com salário de R$ 1,5 mil - Primeira Página MP investiga irregularidades na criação de cargos em Eldorado - Campo Grande News Polícia Civil inaugura a 53ª Sala Lilás do MS, em Japorã - sejusp.ms.gov.br Polícia Civil inaugura a 52ª Sala Lilás do MS, em Aparecida do Taboado - SINPOL-MS UEMS lança Pantanal Tech MS 2026 com programação que integra ciência, produção e qualidade de vida  Portal Único ms.gov.br SESI-MS apresenta projeto de carbono na COP30 e SESI-SP investe em inovação na saúde  Agência de Notícias da Indústria Circuito Sesc de Artes chega a 9 cidades do Vale do Ribeira  Sesc São Paulo Cine Sesi Cultural finaliza 3ª etapa com 101,6 mil pessoas em 32 cidades  Agência de Notícias da Indústria Cine Sesi tem 2º maior público do ano em Bonito com 4,9 mil pessoas  Agência de Notícias da Indústria Petrobras, Raízen, Eldorado e mais: confira as vagas de emprego no setor de logística, nesta sexta (22)  Tecnologística GIRO FUNTRAB DE NOTÍCIAS – 30/07/2025 a 06/08/2025  funtrab.ms.gov.br Acabou a desculpa! SENAI tem mais de 8,3 mil vagas em vários cursos pelo Brasil  Agência de Notícias da Indústria Eldorado Brasil abre 50 vagas para programa Jovem Aprendiz em Três Lagoas (MS)  Portal Celulose Atvos abre 50 vagas para jovens aprendizes em Nova Alvorada do Sul e Deodápolis -MS  JornalCana Com Fiems, Paulo Corrêa articula desconto de até 20% na conta de energia para 74 municípios de MS  O CORREIO NEWS Sem exigência de escolaridade: prefeitura abre seletivo com salário de R$ 1,5 mil  Primeira Página MP investiga irregularidades na criação de cargos em Eldorado  Campo Grande News Polícia Civil inaugura a 53ª Sala Lilás do MS, em Japorã  sejusp.ms.gov.br Polícia Civil inaugura a 52ª Sala Lilás do MS, em Aparecida do Taboado  SINPOL-MS"
Fátima do Sul,15,"campo, grande, cidades, bombeiros, vagas","Cresce 24% o número de brasileiros migrando para essa cidade universitária de alto padrão perto do Paraguai nos últimos 12 anos - Correio Braziliense AFLAMS empossa três novas acadêmicas e amplia representatividade cultural em Mato Grosso do Sul - A Crítica de Campo Grande Senadora Soraya garante mais de R$ 28 milhões para 23 municípios de Mato Grosso do Sul em maio - MS Todo dia Clima bom, gente acolhedora e futuro promissor em uma das cidades mais estratégicas do Brasil - Revista Oeste Confira a agenda cultural do fim de semana ? Veja - Blog Gran Cursos Online SAD - SEJUSP- CBMMS divulga Processo Seletivo com 230 vagas - PCI Concursos Com Fiems, Paulo Corrêa articula desconto de até 20% na conta de energia para 74 municípios de MS - O CORREIO NEWS Falece Dr Nelson Kawamura, médico em diversas cidades do MS - O Pantaneiro FINANÇAS: Decreto impõe prazos para fornecedores e servidores municipais em Fátima do Sul - Fátima em Dia Investigação mira prefeitura por 'gato de energia' em inauguração de UBS e perda de vacinas - Midiamax Governo de MS entrega Unidade Regional de Perícia em Fátima do Sul - Portal Único ms.gov.br Cresce 24% o número de brasileiros migrando para essa cidade universitária de alto padrão perto do Paraguai nos últimos 12 anos  Correio Braziliense AFLAMS empossa três novas acadêmicas e amplia representatividade cultural em Mato Grosso do Sul  A Crítica de Campo Grande Senadora Soraya garante mais de R$ 28 milhões para 23 municípios de Mato Grosso do Sul em maio  MS Todo dia Clima bom, gente acolhedora e futuro promissor em uma das cidades mais estratégicas do Brasil  Revista Oeste Confira a agenda cultural do fim de semana ? Veja  Blog Gran Cursos Online SAD - SEJUSP- CBMMS divulga Processo Seletivo com 230 vagas  PCI Concursos Com Fiems, Paulo Corrêa articula desconto de até 20% na conta de energia para 74 municípios de MS  O CORREIO NEWS Falece Dr Nelson Kawamura, médico em diversas cidades do MS  O Pantaneiro FINANÇAS: Decreto impõe prazos para fornecedores e servidores municipais em Fátima do Sul  Fátima em Dia Investigação mira prefeitura por 'gato de energia' em inauguração de UBS e perda de vacinas  Midiamax Governo de MS entrega Unidade Regional de Perícia em Fátima do Sul  Portal Único ms.gov.br"
