municipio,qtd_noticias_encontradas,temas_frequentes,resumo_para_slide
Água Clara,15,"água, clara, recebe, arapuanews, mato","Ponta Porã recebe etapa dos Jogos da Melhor Idade com disputas de bocha - Portal Único ms.gov.br Água Clara em festa: Governo do Estado entrega novas moradias e dá início a obra na MS-324 - ArapuaNews Neno Razuk investe mais de R$ 5 milhões em emendas e transforma municípios de MS - Assembleia Legislativa de Mato Grosso do Sul - No Corredor Bioceânico, Ribas do Rio Pardo, tem 83,70% de cobertura do esgoto - Notícias do Cerrado FCMS comemora o ""Ano do Teatro"" em Mato Grosso do Sul - O Pantaneiro Cursos gratuitos da Funtrab seguem com inscrições abertas em Campo Grande e no interior de MS - funtrab.ms.gov.br SESI-PA promove capacitação para professores e SENAI-MS oferece curso com bolsa de R$ 1 mil - Agência de Notícias da Indústria Suzano seleciona trabalhadores para preencher vagas de emprego em MS e BA - CPG Click Petróleo e Gás Suzano abre nove processos seletivos para Água Clara e Ribas do Rio Pardo/MS - ArapuaNews Empresas têm mais de 14 mil vagas de emprego, estágio, trainee e jovem aprendiz - AJN1 TCE-MS rejeita contas da prefeita de Água Clara por falhas fiscais - Midiamax Sentença condenatória é confirmada em 2º grau em ação do MPMS que investigou esquema de corrupção em Água Clara - MPMS Polícia Civil inaugura a 53ª Sala Lilás do MS, em Japorã - pc.ms.gov.br REFERÊNCIA: Almoxarifado Central de Bataguassu recebe visitas técnicas das Prefeituras de Água Clara e Brasilândia - prefeitura municipal de bataguassu (ms) MP exige concurso público para controlador interno em Água Clara - Campo Grande News Ponta Porã recebe etapa dos Jogos da Melhor Idade com disputas de bocha  Portal Único ms.gov.br Água Clara em festa: Governo do Estado entrega novas moradias e dá início a obra na MS-324  ArapuaNews Neno Razuk investe mais de R$ 5 milhões em emendas e transforma municípios de MS  Assembleia Legislativa de Mato Grosso do Sul - No Corredor Bioceânico, Ribas do Rio Pardo, tem 83,70% de cobertura do esgoto  Notícias do Cerrado FCMS comemora o ""Ano do Teatro"" em Mato Grosso do Sul  O Pantaneiro Cursos gratuitos da Funtrab seguem com inscrições abertas em Campo Grande e no interior de MS  funtrab.ms.gov.br SESI-PA promove capacitação para professores e SENAI-MS oferece curso com bolsa de R$ 1 mil  Agência de Notícias da Indústria Suzano seleciona trabalhadores para preencher vagas de emprego em MS e BA  CPG Click Petróleo e Gás Suzano abre nove processos seletivos para Água Clara e Ribas do Rio Pardo/MS  ArapuaNews Empresas têm mais de 14 mil vagas de emprego, estágio, trainee e jovem aprendiz  AJN1 TCE-MS rejeita contas da prefeita de Água Clara por falhas fiscais  Midiamax Sentença condenatória é confirmada em 2º grau em ação do MPMS que investigou esquema de corrupção em Água Clara  MPMS Polícia Civil inaugura a 53ª Sala Lilás do MS, em Japorã  pc.ms.gov.br REFERÊNCIA: Almoxarifado Central de Bataguassu recebe visitas técnicas das Prefeituras de Água Clara e Brasilândia  prefeitura municipal de bataguassu (ms) MP exige concurso público para controlador interno em Água Clara  Campo Grande News"
Amambai,14,"amambai, prefeitura, municipal, governo, portal","Governo licita obras de CEUs da Cultura em quatro cidades e fortalece acesso à arte, educação e cidadania - Portal Único ms.gov.br Governo de MS garante repasse de R$ 1,32 milhão para o carnaval de Corumbá 2025 - agenciadenoticias.ms.gov.br Esporte é instrumento de preservação e fortalecimento das tradições indígenas em MS - fundesporte.ms.gov.br Agendão: fim de semana tem MS Fashion Week, Festa do Leitão no Rolete, exposições e muito teatro - Idest Bioenergia: rodada de empregabilidade oferece mais de 630 vagas em 15 municípios de MS - Portal Único ms.gov.br Funtrab anuncia vários cursos gratuitos de qualificação no Estado, veja como se inscrever - funtrab.ms.gov.br Últimos dias de inscrições para qualificação profissional a distância no IFMS - Correio de Corumbá Corpo de Bombeiros divulga novo resultado da seleção para bombeiros temporários - Midiamax Casa do Trabalhador disponibiliza 61 oportunidades de emprego nesta quarta-feira em Amambai - A Gazeta News Prefeitura irá desembolsar R$ 1,9 milhão em indenizações para viabilizar Contorno Viário de Amambai - Midiamax Amambai confirma convênio para construção de 50 novas mor... - Prefeitura Municipal de Amambai Em Amambai, MPMS acompanha implementação de Programas de Integridade na gestão municipal - MPMS Prefeitura de Amambai MS abre processo seletivo para formador municipal - Folha Dirigida Prefeitura de Amambaí (MS) abre processo seletivo para a zona rural - Concursos no Brasil Governo licita obras de CEUs da Cultura em quatro cidades e fortalece acesso à arte, educação e cidadania  Portal Único ms.gov.br Governo de MS garante repasse de R$ 1,32 milhão para o carnaval de Corumbá 2025  agenciadenoticias.ms.gov.br Esporte é instrumento de preservação e fortalecimento das tradições indígenas em MS  fundesporte.ms.gov.br Agendão: fim de semana tem MS Fashion Week, Festa do Leitão no Rolete, exposições e muito teatro  Idest Bioenergia: rodada de empregabilidade oferece mais de 630 vagas em 15 municípios de MS  Portal Único ms.gov.br Funtrab anuncia vários cursos gratuitos de qualificação no Estado, veja como se inscrever  funtrab.ms.gov.br Últimos dias de inscrições para qualificação profissional a distância no IFMS  Correio de Corumbá Corpo de Bombeiros divulga novo resultado da seleção para bombeiros temporários  Midiamax Casa do Trabalhador disponibiliza 61 oportunidades de emprego nesta quarta-feira em Amambai  A Gazeta News Prefeitura irá desembolsar R$ 1,9 milhão em indenizações para viabilizar Contorno Viário de Amambai  Midiamax Amambai confirma convênio para construção de 50 novas mor...  Prefeitura Municipal de Amambai Em Amambai, MPMS acompanha implementação de Programas de Integridade na gestão municipal  MPMS Prefeitura de Amambai MS abre processo seletivo para formador municipal  Folha Dirigida Prefeitura de Amambaí (MS) abre processo seletivo para a zona rural  Concursos no Brasil"
Anastácio,13,"anastácio, pantaneiro, midiamax, bombeiros, aquidauana","Aquidauana e Anastácio registram o maior volume de chuva do estado - O Pantaneiro Começa a contagem regressiva para a grandiosa Festa da Farinha de Anastácio - O Pantaneiro Casa do Artesão reúne lojistas para ampliar comércio dos produtos locais de Aquidauana - O Pantaneiro Corpo de Bombeiros divulga novo resultado da seleção para bombeiros temporários - Midiamax GIRO FUNTRAB DE NOTÍCIAS -12/05/2025 a 17/05/2025 - funtrab.ms.gov.br Processo seletivo dos Bombeiros MS abre 230 vagas em 30 cidades - JC Concursos Na Capital, EJA é ofertado em 16 escolas e na modalidade à distância; veja lista - Campo Grande News Candidatos aprovados na seleção para bombeiro são convocados para curso de capacitação - Midiamax Anastácio conquista Selo Ouro de Alfabetização pelo 2°ano e recebe homenagem estadual - O Pantaneiro Pacote de R$ 10 milhões prevê de ambulâncias no interior de MS - Midiamax Justiça atende pedido do MPMS e anula processo seletivo irregular em Anastácio - MPMS Anastácio celebra 61 anos com programação especial e Festa da Farinha - O Pantaneiro Ex-prefeito de Anastácio é condenado por prejuízo de R$ 591 mil e fica inelegível - Midiamax Aquidauana e Anastácio registram o maior volume de chuva do estado  O Pantaneiro Começa a contagem regressiva para a grandiosa Festa da Farinha de Anastácio  O Pantaneiro Casa do Artesão reúne lojistas para ampliar comércio dos produtos locais de Aquidauana  O Pantaneiro Corpo de Bombeiros divulga novo resultado da seleção para bombeiros temporários  Midiamax GIRO FUNTRAB DE NOTÍCIAS -12/05/2025 a 17/05/2025  funtrab.ms.gov.br Processo seletivo dos Bombeiros MS abre 230 vagas em 30 cidades  JC Concursos Na Capital, EJA é ofertado em 16 escolas e na modalidade à distância; veja lista  Campo Grande News Candidatos aprovados na seleção para bombeiro são convocados para curso de capacitação  Midiamax Anastácio conquista Selo Ouro de Alfabetização pelo 2°ano e recebe homenagem estadual  O Pantaneiro Pacote de R$ 10 milhões prevê de ambulâncias no interior de MS  Midiamax Justiça atende pedido do MPMS e anula processo seletivo irregular em Anastácio  MPMS Anastácio celebra 61 anos com programação especial e Festa da Farinha  O Pantaneiro Ex-prefeito de Anastácio é condenado por prejuízo de R$ 591 mil e fica inelegível  Midiamax"
Angélica,10,"prefeitura, novos, funtrab, inaugura, após","Festival gratuito celebra o Dia Internacional do Yoga no Parque das Nações Indígenas - agenciadenoticias.ms.gov.br Conheça os perfis e atribuições dos novos secretários e diretores da Prefeitura de Campo Grande - campogrande.ms.gov.br Projeto “ODS nos Muros” encerra atividades com roda de conversa e galeria digital - fundacaodecultura.ms.gov.br Funtrab inaugura Casa do Trabalhador de Brasilândia e amplia acesso a emprego e qualificação profissional - funtrab.ms.gov.br Adecoagro inicia Programa Jovens Talentos Aprendizes com Deficiência - JornalCana Polícia Civil inaugura a 53ª Sala Lilás do MS, em Japorã - pc.ms.gov.br Prefeitura empossa novos membros Conselho Municipal dos Direitos da Mulher - Município de Corumbá Após Justiça afastar procurador de Angélica, advogados cobram demissão de nomeado por Papy - Midiamax Prefeitura de Angélica (MS) anuncia seletivo na área da Educação - Concursos no Brasil Ivinhema decreta calamidade pública após chuvas de até 120 milímetros - Diário Corumbaense Festival gratuito celebra o Dia Internacional do Yoga no Parque das Nações Indígenas  agenciadenoticias.ms.gov.br Conheça os perfis e atribuições dos novos secretários e diretores da Prefeitura de Campo Grande  campogrande.ms.gov.br Projeto “ODS nos Muros” encerra atividades com roda de conversa e galeria digital  fundacaodecultura.ms.gov.br Funtrab inaugura Casa do Trabalhador de Brasilândia e amplia acesso a emprego e qualificação profissional  funtrab.ms.gov.br Adecoagro inicia Programa Jovens Talentos Aprendizes com Deficiência  JornalCana Polícia Civil inaugura a 53ª Sala Lilás do MS, em Japorã  pc.ms.gov.br Prefeitura empossa novos membros Conselho Municipal dos Direitos da Mulher  Município de Corumbá Após Justiça afastar procurador de Angélica, advogados cobram demissão de nomeado por Papy  Midiamax Prefeitura de Angélica (MS) anuncia seletivo na área da Educação  Concursos no Brasil Ivinhema decreta calamidade pública após chuvas de até 120 milímetros  Diário Corumbaense"
Aparecida do Taboado,15,"aparecida, taboado, news, vagas, cursos","Com apoio do Governo, Taboadão 2026 movimenta turismo, cultura e economia da região - agenciadenoticias.ms.gov.br Taboadão 2026 reforça tradição e impulsiona economia em Aparecida do Taboado - Notícias do Cerrado Governo de MS leva investimentos em educação e infraestrutura a Aparecida do Taboado - Portal Único ms.gov.br Neno Razuk investe mais de R$ 5 milhões em emendas e transforma municípios de MS - Assembleia Legislativa de Mato Grosso do Sul - Raça Negra é atração confirmada no Festival de Praia 2025 em Aparecida do Taboado - Costa Leste News Senai MS: 2 mil vagas em cursos técnicos com bolsa de R$ 300; inscreva-se - Campo Grande News Bioenergia: rodada de empregabilidade oferece mais de 630 vagas em 15 municípios de MS - agenciadenoticias.ms.gov.br Cursos gratuitos da Funtrab seguem com inscrições abertas em Campo Grande e no interior de MS - funtrab.ms.gov.br SENAI oferece 60 vagas em cursos técnicos gratuitos em Aparecida do Taboado com auxílio mensal - Costa Leste News Rodada de Empregabilidade mostra a diversidade de profissões que movem o setor de Bioenergia em MS - Cana Online Investimentos: Coronel David cumpre agenda com Rie... - Assembleia Legislativa de Mato Grosso do Sul - Pacote de R$ 10 milhões prevê de ambulâncias no interior de MS - Midiamax Contrato de iluminação irá custar R$ 1,16 milhão para Aparecida do Taboado - Midiamax Aparecida do Taboado pagará R$ 1 milhão para instalar 649 lâmpadas de LED - Midiamax Polícia Civil inaugura a 52ª Sala Lilás do MS, em Aparecida do Taboado - pc.ms.gov.br Com apoio do Governo, Taboadão 2026 movimenta turismo, cultura e economia da região  agenciadenoticias.ms.gov.br Taboadão 2026 reforça tradição e impulsiona economia em Aparecida do Taboado  Notícias do Cerrado Governo de MS leva investimentos em educação e infraestrutura a Aparecida do Taboado  Portal Único ms.gov.br Neno Razuk investe mais de R$ 5 milhões em emendas e transforma municípios de MS  Assembleia Legislativa de Mato Grosso do Sul - Raça Negra é atração confirmada no Festival de Praia 2025 em Aparecida do Taboado  Costa Leste News Senai MS: 2 mil vagas em cursos técnicos com bolsa de R$ 300; inscreva-se  Campo Grande News Bioenergia: rodada de empregabilidade oferece mais de 630 vagas em 15 municípios de MS  agenciadenoticias.ms.gov.br Cursos gratuitos da Funtrab seguem com inscrições abertas em Campo Grande e no interior de MS  funtrab.ms.gov.br SENAI oferece 60 vagas em cursos técnicos gratuitos em Aparecida do Taboado com auxílio mensal  Costa Leste News Rodada de Empregabilidade mostra a diversidade de profissões que movem o setor de Bioenergia em MS  Cana Online Investimentos: Coronel David cumpre agenda com Rie...  Assembleia Legislativa de Mato Grosso do Sul - Pacote de R$ 10 milhões prevê de ambulâncias no interior de MS  Midiamax Contrato de iluminação irá custar R$ 1,16 milhão para Aparecida do Taboado  Midiamax Aparecida do Taboado pagará R$ 1 milhão para instalar 649 lâmpadas de LED  Midiamax Polícia Civil inaugura a 52ª Sala Lilás do MS, em Aparecida do Taboado  pc.ms.gov.br"
Aral Moreira,14,"abre, ifms, teatro, fronteira, três","Com investimento do FIC, Grupo UBU chega com teatro em nove cidades na região sul-fronteira de MS - fundacaodecultura.ms.gov.br Com R$ 3,2 bilhões, MS teve aumento de 227% nos investimentos públicos nos últimos três anos - agenciadenoticias.ms.gov.br Justiça permite venda de estádio avaliado em mais de R$ 33 milhões em Ponta Porã (MS) - G1 FCMS comemora o ""Ano do Teatro"" em Mato Grosso do Sul - O Pantaneiro Da aldeia ao pomar: trabalhadores indígenas de MS colhem novas oportunidades no Rio Grande do Sul - funtrab.ms.gov.br IFMS abre seleção para cursos de qualificação profissional a distância - diariodigital.com.br Quer se qualificar sem sair de casa? Cursos EAD gratuitos do IFMS para assistente, operador e vendedor têm inscrições abertas e exigem apenas CPF - CPG Click Petróleo e Gás Com vagas ilimitadas, IFMS abre inscrições para Curso de Operador de Computador 100% EAD - PEBSP Sanesul abre processo seletivo com 40 vagas e salário de até R$ 3.189,38 - G1 Polícia Civil inaugura a 53ª Sala Lilás do MS, em Japorã - sejusp.ms.gov.br Carreta da Saúde terá atendimento no Posto Canaã, no Distrito de Nova Itamarati nesta semana - Prefeitura Municipal de Ponta Porã Da aldeia ao pomar: trabalhadores indígenas de MS colhem novas oportunidades no Rio Grande do Sul - funtrab.ms.gov.br Fundesporte investe na construção de pista de caminhada em Aral Moreira - fundesporte.ms.gov.br MPMS abre procedimento para investigar funcionamento das controladorias em três municípios da fronteira - MPMS Com investimento do FIC, Grupo UBU chega com teatro em nove cidades na região sul-fronteira de MS  fundacaodecultura.ms.gov.br Com R$ 3,2 bilhões, MS teve aumento de 227% nos investimentos públicos nos últimos três anos  agenciadenoticias.ms.gov.br Justiça permite venda de estádio avaliado em mais de R$ 33 milhões em Ponta Porã (MS)  G1 FCMS comemora o ""Ano do Teatro"" em Mato Grosso do Sul  O Pantaneiro Da aldeia ao pomar: trabalhadores indígenas de MS colhem novas oportunidades no Rio Grande do Sul  funtrab.ms.gov.br IFMS abre seleção para cursos de qualificação profissional a distância  diariodigital.com.br Quer se qualificar sem sair de casa? Cursos EAD gratuitos do IFMS para assistente, operador e vendedor têm inscrições abertas e exigem apenas CPF  CPG Click Petróleo e Gás Com vagas ilimitadas, IFMS abre inscrições para Curso de Operador de Computador 100% EAD  PEBSP Sanesul abre processo seletivo com 40 vagas e salário de até R$ 3.189,38  G1 Polícia Civil inaugura a 53ª Sala Lilás do MS, em Japorã  sejusp.ms.gov.br Carreta da Saúde terá atendimento no Posto Canaã, no Distrito de Nova Itamarati nesta semana  Prefeitura Municipal de Ponta Porã Da aldeia ao pomar: trabalhadores indígenas de MS colhem novas oportunidades no Rio Grande do Sul  funtrab.ms.gov.br Fundesporte investe na construção de pista de caminhada em Aral Moreira  fundesporte.ms.gov.br MPMS abre procedimento para investigar funcionamento das controladorias em três municípios da fronteira  MPMS"
Bataguassu,14,"bataguassu, concursos, prefeitura, seletivo, abre","Festival de Dança Coreografada da Melhor Idade define campeões - fundesporte.ms.gov.br Agendão: fim de semana vem com stand-up, espetáculos, Natal na Praça e rodeio - agenciadenoticias.ms.gov.br DESTAQUE: Bataguassu sedia o maior evento de OFF ROAD do MS! - prefeitura municipal de bataguassu (ms) Turismo rural, pesca e eventos no caminho do Pontal do Paranapanema - www.gov.br Agendão: fim de semana tem MS Fashion Week, Festa do Leitão no Rolete, exposições e muito teatro - Idest Funtrab abre vaga exclusiva para PcD com salário de R$ 1,9 mil e benefícios - funtrab.ms.gov.br Corpo de Bombeiros divulga novo resultado da seleção para bombeiros temporários - Midiamax Processo seletivo dos Bombeiros MS abre 230 vagas em 30 cidades - JC Concursos SAD - SEJUSP- CBMMS divulga Processo Seletivo com 230 vagas - PCI Concursos SEGURANÇA PÚBLICA: Distrito de Nova Porto XV celebra reativação do destacamento da Polícia Militar - prefeitura municipal de bataguassu (ms) Prefeitura de Bataguassu - MS abre vagas e cadastro de reserva em processo seletivo simplificado - PCI Concursos Sem concursos, prefeita de Bataguassu é proibida de nomear comissionados - Midiamax Ribas do Rio Pardo recebe comitiva de Bataguassu para troca de experiências sobre desenvolvimento e gestão - Boca do Povo News Prefeitura de Bataguassu (MS) anuncia seletivo para Monitor de Turismo e Eventos - Concursos no Brasil Festival de Dança Coreografada da Melhor Idade define campeões  fundesporte.ms.gov.br Agendão: fim de semana vem com stand-up, espetáculos, Natal na Praça e rodeio  agenciadenoticias.ms.gov.br DESTAQUE: Bataguassu sedia o maior evento de OFF ROAD do MS! prefeitura municipal de bataguassu (ms) Turismo rural, pesca e eventos no caminho do Pontal do Paranapanema  www.gov.br Agendão: fim de semana tem MS Fashion Week, Festa do Leitão no Rolete, exposições e muito teatro  Idest Funtrab abre vaga exclusiva para PcD com salário de R$ 1,9 mil e benefícios  funtrab.ms.gov.br Corpo de Bombeiros divulga novo resultado da seleção para bombeiros temporários  Midiamax Processo seletivo dos Bombeiros MS abre 230 vagas em 30 cidades  JC Concursos SAD - SEJUSP- CBMMS divulga Processo Seletivo com 230 vagas  PCI Concursos SEGURANÇA PÚBLICA: Distrito de Nova Porto XV celebra reativação do destacamento da Polícia Militar  prefeitura municipal de bataguassu (ms) Prefeitura de Bataguassu - MS abre vagas e cadastro de reserva em processo seletivo simplificado  PCI Concursos Sem concursos, prefeita de Bataguassu é proibida de nomear comissionados  Midiamax Ribas do Rio Pardo recebe comitiva de Bataguassu para troca de experiências sobre desenvolvimento e gestão  Boca do Povo News Prefeitura de Bataguassu (MS) anuncia seletivo para Monitor de Turismo e Eventos  Concursos no Brasil"
Batayporã,9,"batayporã, prefeitura, abre, processo, seletivo","Festival de Dança Coreografada da Melhor Idade define campeões - fundesporte.ms.gov.br Governo de MS garante repasse de R$ 1,32 milhão para o carnaval de Corumbá 2025 - agenciadenoticias.ms.gov.br Em Batayporã, mais de 140 oportunidades de emprego nesta sexta - funtrab.ms.gov.br Prefeitura de Batayporã abre processo seletivo com 54 vagas na área da saúde - Midiamax Hashioka visita prefeito Germino e reforça parceri... - Assembleia Legislativa de Mato Grosso do Sul - Prefeitura de Batayporã MS abre processo seletivo com 4 vagas - Folha Dirigida Prefeitura de Batayporã - MS abre processo seletivo para profissionais alfabetizados - PCI Concursos Prefeitura de Batayporã (MS) abre vagas de níveis alfabetizado e fundamental - Concursos no Brasil Prefeitura de Batayporã - MS abre processo seletivo para professor de ensino fundamental - PCI Concursos Festival de Dança Coreografada da Melhor Idade define campeões  fundesporte.ms.gov.br Governo de MS garante repasse de R$ 1,32 milhão para o carnaval de Corumbá 2025  agenciadenoticias.ms.gov.br Em Batayporã, mais de 140 oportunidades de emprego nesta sexta  funtrab.ms.gov.br Prefeitura de Batayporã abre processo seletivo com 54 vagas na área da saúde  Midiamax Hashioka visita prefeito Germino e reforça parceri...  Assembleia Legislativa de Mato Grosso do Sul - Prefeitura de Batayporã MS abre processo seletivo com 4 vagas  Folha Dirigida Prefeitura de Batayporã - MS abre processo seletivo para profissionais alfabetizados  PCI Concursos Prefeitura de Batayporã (MS) abre vagas de níveis alfabetizado e fundamental  Concursos no Brasil Prefeitura de Batayporã - MS abre processo seletivo para professor de ensino fundamental  PCI Concursos"
Bela Vista,15,"mpms, bela, vista, bombeiros, midiamax","MITsp - Mostra Internacional de Teatro de São Paulo apresenta a programação de sua 11ª edição - Canal Aberto - Assessoria de Imprensa Agendão: fim de semana tem Expobel, Ação Cidadania, teatro, festas julinas e feirinhas - agenciadenoticias.ms.gov.br Cidade do MS se consolida como portal do Mercosul - O Antagonista Vencedores do Prêmio Braztoa de Sustentabilidade 2024 são anunciados durante cerimônia em Gramado (RS) - www.gov.br Virada Cultural 2025 de SP: veja programação completa do evento, que completa 20 anos - G1 MPMS participa de reunião técnica para ampliar oportunidades a jovens em situação de vulnerabilidade em Bela Vista - MPMS Corpo de Bombeiros divulga novo resultado da seleção para bombeiros temporários - Midiamax GIRO FUNTRAB DE NOTÍCIAS – 03/06/2025 a 16/06/2025 - funtrab.ms.gov.br Estado abre curso gratuito de Comércio Exterior voltado à Rota Bioceânica e jovens do interior - Aquidauana Notícias Bombeiros divulgam resultado da seleção que ofertou 230 vagas para soldado auxiliar - Midiamax Defensoria ajuíza ação para regularizar moradias de 50 famílias em MS - diariodigital.com.br Vistorias apontaram déficit de funcionários e até comida vencida em Asilo de Bela Vista - Midiamax Semana política: CPI, suspensão de mandato, plano da Fiems e nova pesquisa - Investiga MS Mais de 110 concursos públicos reúnem quase 223 mil vagas no país - AJN1 Proteção à infância: MPMS recomenda restrição à divulgação de imagens de crianças por órgãos públicos em Bela Vista - MPMS MITsp - Mostra Internacional de Teatro de São Paulo apresenta a programação de sua 11ª edição  Canal Aberto - Assessoria de Imprensa Agendão: fim de semana tem Expobel, Ação Cidadania, teatro, festas julinas e feirinhas  agenciadenoticias.ms.gov.br Cidade do MS se consolida como portal do Mercosul  O Antagonista Vencedores do Prêmio Braztoa de Sustentabilidade 2024 são anunciados durante cerimônia em Gramado (RS)  www.gov.br Virada Cultural 2025 de SP: veja programação completa do evento, que completa 20 anos  G1 MPMS participa de reunião técnica para ampliar oportunidades a jovens em situação de vulnerabilidade em Bela Vista  MPMS Corpo de Bombeiros divulga novo resultado da seleção para bombeiros temporários  Midiamax GIRO FUNTRAB DE NOTÍCIAS – 03/06/2025 a 16/06/2025  funtrab.ms.gov.br Estado abre curso gratuito de Comércio Exterior voltado à Rota Bioceânica e jovens do interior  Aquidauana Notícias Bombeiros divulgam resultado da seleção que ofertou 230 vagas para soldado auxiliar  Midiamax Defensoria ajuíza ação para regularizar moradias de 50 famílias em MS  diariodigital.com.br Vistorias apontaram déficit de funcionários e até comida vencida em Asilo de Bela Vista  Midiamax Semana política: CPI, suspensão de mandato, plano da Fiems e nova pesquisa  Investiga MS Mais de 110 concursos públicos reúnem quase 223 mil vagas no país  AJN1 Proteção à infância: MPMS recomenda restrição à divulgação de imagens de crianças por órgãos públicos em Bela Vista  MPMS"
