municipio,qtd_noticias_encontradas,temas_frequentes,resumo_para_slide
Glória de Dourados,14,"glória, dourados, funtrab, vagas, semana","Semana S deve reunir 15 mil pessoas e impulsionar comércio e turismo em Campo Grande - A Crítica de Campo Grande Festival de Dança Coreografada da Melhor Idade define campeões - fundesporte.ms.gov.br Jogos Abertos de Mato Grosso do Sul terão seis etapas regionais em 2026, entre abril e setembro - agenciadenoticias.ms.gov.br Cresce 24% o número de brasileiros migrando para essa cidade universitária de alto padrão perto do Paraguai nos últimos 12 anos - Correio Braziliense Municipalismo: Governo de MS investe em infraestrutura e apoia feira agropecuária em Glória de Dourados - ArapuaNews Funtrab e Biosul anunciam 2ª Rodada de Empregabilidade do Setor de Bioenergia com mais de 630 vagas em 15 municípios de MS - funtrab.ms.gov.br Semana começa com 14 processos seletivos abertos em MS; veja todos aqui! - Enfoque MS Edital aberto: pós graduação destinado ao cooperativismo e empreendimentos solidários - funtrab.ms.gov.br 75 vagas de jovens aprendizes em Deodápolis, Glória de Dourados e Nova Alvorada do Sul - Rede Jota FM TCE-MS participa de lançamento de Programa de Compliance em Glória de Dourados - TCE-MS Glória de Dourados adia licitação após arquitetos questionarem exclusividade de obras para engenheiros - Midiamax MPMS fiscaliza transporte escolar em Glória de Dourados e cobra regularização de vistorias e segurança veicular - MPMS Mais de 110 concursos públicos reúnem quase 223 mil vagas no país - AJN1 Polícia Civil inaugura a 53ª Sala Lilás do MS, em Japorã - sejusp.ms.gov.br Semana S deve reunir 15 mil pessoas e impulsionar comércio e turismo em Campo Grande  A Crítica de Campo Grande Festival de Dança Coreografada da Melhor Idade define campeões  fundesporte.ms.gov.br Jogos Abertos de Mato Grosso do Sul terão seis etapas regionais em 2026, entre abril e setembro  agenciadenoticias.ms.gov.br Cresce 24% o número de brasileiros migrando para essa cidade universitária de alto padrão perto do Paraguai nos últimos 12 anos  Correio Braziliense Municipalismo: Governo de MS investe em infraestrutura e apoia feira agropecuária em Glória de Dourados  ArapuaNews Funtrab e Biosul anunciam 2ª Rodada de Empregabilidade do Setor de Bioenergia com mais de 630 vagas em 15 municípios de MS  funtrab.ms.gov.br Semana começa com 14 processos seletivos abertos em MS; veja todos aqui! Enfoque MS Edital aberto: pós graduação destinado ao cooperativismo e empreendimentos solidários  funtrab.ms.gov.br 75 vagas de jovens aprendizes em Deodápolis, Glória de Dourados e Nova Alvorada do Sul  Rede Jota FM TCE-MS participa de lançamento de Programa de Compliance em Glória de Dourados  TCE-MS Glória de Dourados adia licitação após arquitetos questionarem exclusividade de obras para engenheiros  Midiamax MPMS fiscaliza transporte escolar em Glória de Dourados e cobra regularização de vistorias e segurança veicular  MPMS Mais de 110 concursos públicos reúnem quase 223 mil vagas no país  AJN1 Polícia Civil inaugura a 53ª Sala Lilás do MS, em Japorã  sejusp.ms.gov.br"
Iguatemi,9,"iguatemi, prefeitura, midiamax, obras, saúde","Festival de Dança Coreografada da Melhor Idade define campeões - fundesporte.ms.gov.br 16 filmes e animações gratuitas para refletir sobre as infâncias - PORVIR Investimentos do Governo do Estado em Itaquiraí somam mais de R$ 82 milhões - agenciadenoticias.ms.gov.br Seis Casas do Trabalhador fecham no feriado de 8 de dezembro em MS - funtrab.ms.gov.br Prefeitura irá desembolsar R$ 1,9 milhão em indenizações para viabilizar Contorno Viário de Amambai - Midiamax Iguatemi e Japorã recebem obras milionárias para saúde e infraestrutura - Midiamax Iguatemi recebe conjunto de obras de habitação, saúde e mobilidade urbana ao cidadão - msemfoco.com.br Prefeitura de Iguatemi MS abre processo seletivo com 17 vagas em Assistência Social - Folha Dirigida Dos 14 aos 24 anos: processo seletivo para jovem aprendiz tem 42 vagas - Primeira Página Festival de Dança Coreografada da Melhor Idade define campeões  fundesporte.ms.gov.br 16 filmes e animações gratuitas para refletir sobre as infâncias  PORVIR Investimentos do Governo do Estado em Itaquiraí somam mais de R$ 82 milhões  agenciadenoticias.ms.gov.br Seis Casas do Trabalhador fecham no feriado de 8 de dezembro em MS  funtrab.ms.gov.br Prefeitura irá desembolsar R$ 1,9 milhão em indenizações para viabilizar Contorno Viário de Amambai  Midiamax Iguatemi e Japorã recebem obras milionárias para saúde e infraestrutura  Midiamax Iguatemi recebe conjunto de obras de habitação, saúde e mobilidade urbana ao cidadão  msemfoco.com.br Prefeitura de Iguatemi MS abre processo seletivo com 17 vagas em Assistência Social  Folha Dirigida Dos 14 aos 24 anos: processo seletivo para jovem aprendiz tem 42 vagas  Primeira Página"
Itaporã,9,"funtrab, itaporã, municípios, campo, grande","Neno Razuk investe mais de R$ 5 milhões em emendas e transforma municípios de MS - Assembleia Legislativa de Mato Grosso do Sul - Projeto Artesania fomenta cultura e geração de renda no interior por meio do artesanato - Portal Único ms.gov.br Funtrab e Biosul anunciam 2ª Rodada de Empregabilidade do Setor de Bioenergia com mais de 630 vagas em 15 municípios de MS - funtrab.ms.gov.br Edital aberto: pós graduação destinado ao cooperativismo e empreendimentos solidários - funtrab.ms.gov.br “Hora do Tributo” da OAB Dourados debate reforma tributária com presença da Sefaz - pontaporaemdia.com.br Com 5,8 mil casos e 12 mortes, três cidades de MS decretam emergência por chikungunya - Midiamax Governo desapropria área para ampliar anel viário de Itaporã - Campo Grande News Presidente do Sindicato Rural e diretoria reforçam o convite para a EXPOITA 2025 - Prefeitura de Itaporã MP investiga desvio de verba da educação em rodeio de Itaporã - Campo Grande News Neno Razuk investe mais de R$ 5 milhões em emendas e transforma municípios de MS  Assembleia Legislativa de Mato Grosso do Sul - Projeto Artesania fomenta cultura e geração de renda no interior por meio do artesanato  Portal Único ms.gov.br Funtrab e Biosul anunciam 2ª Rodada de Empregabilidade do Setor de Bioenergia com mais de 630 vagas em 15 municípios de MS  funtrab.ms.gov.br Edital aberto: pós graduação destinado ao cooperativismo e empreendimentos solidários  funtrab.ms.gov.br “Hora do Tributo” da OAB Dourados debate reforma tributária com presença da Sefaz  pontaporaemdia.com.br Com 5,8 mil casos e 12 mortes, três cidades de MS decretam emergência por chikungunya  Midiamax Governo desapropria área para ampliar anel viário de Itaporã  Campo Grande News Presidente do Sindicato Rural e diretoria reforçam o convite para a EXPOITA 2025  Prefeitura de Itaporã MP investiga desvio de verba da educação em rodeio de Itaporã  Campo Grande News"
Itaquiraí,10,"milhões, municípios, governo, estado, itaquiraí","Festival de Dança Coreografada da Melhor Idade define campeões - fundesporte.ms.gov.br Neno Razuk investe mais de R$ 5 milhões em emendas e transforma municípios de MS - Assembleia Legislativa de Mato Grosso do Sul - Investimentos do Governo do Estado em Itaquiraí somam mais de R$ 82 milhões - agenciadenoticias.ms.gov.br GIRO FUNTRAB DE NOTÍCIAS – 03/06/2025 a 16/06/2025 - funtrab.ms.gov.br Senai abre 355 vagas em cursos gratuitos em 13 cidades de MS - Campo Grande News Começa hoje a Expo Itaquiraí 2026 com show de Atitude 67, rodeio e transporte gratuito para a população - tanamidianavirai.com.br Sidrolândia (MS) receberá Mutirão de Documentação da Trabalhadora Rural — Incra - www.gov.br SED anuncia 30 finalistas do Prêmio Escolas Destaque 2025 do Programa MS Alfabetiza - sed.ms.gov.br Naviraí receberá o Governo do Estado e prefeitos de 6 municípios na 4ª etapa do MS Ativo - navirai.ms.gov.br Cidadania e Segurança: ‘MS em Ação’ leva serviços gratuitos à Aldeia Porto Lindo, em Japorã - agenciadenoticias.ms.gov.br Festival de Dança Coreografada da Melhor Idade define campeões  fundesporte.ms.gov.br Neno Razuk investe mais de R$ 5 milhões em emendas e transforma municípios de MS  Assembleia Legislativa de Mato Grosso do Sul - Investimentos do Governo do Estado em Itaquiraí somam mais de R$ 82 milhões  agenciadenoticias.ms.gov.br GIRO FUNTRAB DE NOTÍCIAS – 03/06/2025 a 16/06/2025  funtrab.ms.gov.br Senai abre 355 vagas em cursos gratuitos em 13 cidades de MS  Campo Grande News Começa hoje a Expo Itaquiraí 2026 com show de Atitude 67, rodeio e transporte gratuito para a população  tanamidianavirai.com.br Sidrolândia (MS) receberá Mutirão de Documentação da Trabalhadora Rural — Incra  www.gov.br SED anuncia 30 finalistas do Prêmio Escolas Destaque 2025 do Programa MS Alfabetiza  sed.ms.gov.br Naviraí receberá o Governo do Estado e prefeitos de 6 municípios na 4ª etapa do MS Ativo  navirai.ms.gov.br Cidadania e Segurança: ‘MS em Ação’ leva serviços gratuitos à Aldeia Porto Lindo, em Japorã  agenciadenoticias.ms.gov.br"
Ivinhema,11,"estado, calamidade, pública, ivinhema, bioenergia","Projeto Artesania fomenta cultura e geração de renda no interior por meio do artesanato - Portal Único ms.gov.br Bioenergia: rodada de empregabilidade oferece mais de 630 vagas em 15 municípios de MS - agenciadenoticias.ms.gov.br Funtrab anuncia vários cursos gratuitos de qualificação no Estado, veja como se inscrever - funtrab.ms.gov.br Rodada de Empregabilidade mostra a diversidade de profissões que movem o setor de Bioenergia em MS - Cana Online Corpo de Bombeiros divulga novo resultado da seleção para bombeiros temporários - Midiamax SENAR Abre inscrições para Curso Técnico em Agronegócio EAD: Sua Carreira no Agro Começa Aqui! - PEBSP ALEMS reconhece estado de calamidade pública em Iv... - Assembleia Legislativa de Mato Grosso do Sul - Deputados reconhecem estado de calamidade pública em Ivinhema - Midiamax Prefeitura de Batayporã MS abre processo seletivo com 4 vagas - Folha Dirigida Renato Câmara cumpre agenda em Ivinhema com entrega na Escola Angelina Jaime Tebet - Diário MS News Ivinhema decreta calamidade pública após chuvas de até 120 milímetros - Diário Corumbaense Projeto Artesania fomenta cultura e geração de renda no interior por meio do artesanato  Portal Único ms.gov.br Bioenergia: rodada de empregabilidade oferece mais de 630 vagas em 15 municípios de MS  agenciadenoticias.ms.gov.br Funtrab anuncia vários cursos gratuitos de qualificação no Estado, veja como se inscrever  funtrab.ms.gov.br Rodada de Empregabilidade mostra a diversidade de profissões que movem o setor de Bioenergia em MS  Cana Online Corpo de Bombeiros divulga novo resultado da seleção para bombeiros temporários  Midiamax SENAR Abre inscrições para Curso Técnico em Agronegócio EAD: Sua Carreira no Agro Começa Aqui! PEBSP ALEMS reconhece estado de calamidade pública em Iv...  Assembleia Legislativa de Mato Grosso do Sul - Deputados reconhecem estado de calamidade pública em Ivinhema  Midiamax Prefeitura de Batayporã MS abre processo seletivo com 4 vagas  Folha Dirigida Renato Câmara cumpre agenda em Ivinhema com entrega na Escola Angelina Jaime Tebet  Diário MS News Ivinhema decreta calamidade pública após chuvas de até 120 milímetros  Diário Corumbaense"
Jardim,11,"jardim, mutirão, cidades, interior, brasil","Do vinhedo paulista às águas termais goianas: as 6 cidades do interior para viver bem no Brasil - Revista Oeste Governo licita obras de CEUs da Cultura em quatro cidades e fortalece acesso à arte, educação e cidadania - Portal Único ms.gov.br Último Agendão de 2025 traz show com Di Ferrero, teatro infantil e atrações natalinas pelo interior - agenciadenoticias.ms.gov.br Tradição, aventura e cultura: Confira o roteiro de eventos que agitam o Brasil no mês de Setembro - www.gov.br Neno Razuk investe mais de R$ 5 milhões em emendas e transforma municípios de MS - Assembleia Legislativa de Mato Grosso do Sul - Funtrab leva serviços de empregabilidade ao MS Cidadão no Jardim Los Angeles neste sábado - funtrab.ms.gov.br Dona de casa viaja 212 km para participar do Mutirão Todos em Ação – CGNotícias - campogrande.ms.gov.br PARTICIPE – Prefeitura de TL realiza audiência pública para prestação de contas do 1º quadrimestre de 2026 - ArapuaNews De saúde a lazer, mutirão leva mais de 300 serviços gratuitos ao Jardim Anache - Midiamax Na Expoagro, governador Eduardo Riedel anuncia que Dourados vai receber R$ 30 milhões para recapear linhas de ônibus - RCN 67 Sábado tem Mutirão Todos em Ação no Jardim Anache – CGNotícias - campogrande.ms.gov.br Do vinhedo paulista às águas termais goianas: as 6 cidades do interior para viver bem no Brasil  Revista Oeste Governo licita obras de CEUs da Cultura em quatro cidades e fortalece acesso à arte, educação e cidadania  Portal Único ms.gov.br Último Agendão de 2025 traz show com Di Ferrero, teatro infantil e atrações natalinas pelo interior  agenciadenoticias.ms.gov.br Tradição, aventura e cultura: Confira o roteiro de eventos que agitam o Brasil no mês de Setembro  www.gov.br Neno Razuk investe mais de R$ 5 milhões em emendas e transforma municípios de MS  Assembleia Legislativa de Mato Grosso do Sul - Funtrab leva serviços de empregabilidade ao MS Cidadão no Jardim Los Angeles neste sábado  funtrab.ms.gov.br Dona de casa viaja 212 km para participar do Mutirão Todos em Ação – CGNotícias  campogrande.ms.gov.br PARTICIPE – Prefeitura de TL realiza audiência pública para prestação de contas do 1º quadrimestre de 2026  ArapuaNews De saúde a lazer, mutirão leva mais de 300 serviços gratuitos ao Jardim Anache  Midiamax Na Expoagro, governador Eduardo Riedel anuncia que Dourados vai receber R$ 30 milhões para recapear linhas de ônibus  RCN 67 Sábado tem Mutirão Todos em Ação no Jardim Anache – CGNotícias  campogrande.ms.gov.br"
Ladário,13,"prefeitura, corumbá, ifms, município, diário","Prefeitura participa de entrega de óculos do projeto “Olhos que Inspiram” no IFMS - Município de Corumbá Moinho in Concert entra na reta final dos ensaios para celebrar os caminhos que levam ao céu - Diário MS News Neno Razuk investe mais de R$ 5 milhões em emendas e transforma municípios de MS - Assembleia Legislativa de Mato Grosso do Sul - Junho chega trazendo as festas de São João e outros eventos por todo o país — Ministério do Turismo - www.gov.br Parceria entre Governo de MS e Marinha possibilita pesquisa, atendimento médico e combate a incêndios - Portal Único ms.gov.br IFMS abre 480 vagas para curso preparatório gratuito com bolsa de R$ 200 - Campo Grande News IFMS abre inscrições para curso que amplia acesso ao ensino médio técnico - Correio de Corumbá GIRO FUNTRAB DE NOTÍCIAS – 03/06/2025 a 16/06/2025 - funtrab.ms.gov.br Prefeitura de Ladário pagará R$ 1,1 milhão para colocar secretarias em contêineres - Midiamax 27ª Feapan impulsiona negócios, turismo e cultura no Pantanal com apoio da Prefeitura de Corumbá - Município de Corumbá Contrato milionário feito sem licitação é anulado em Ladário após recomendação do MP - Folha MS Reforma do Estádio Vicente Fortunato vai custar mais de R$ 2 milhões - Diário Corumbaense 'Mensalinho': Justiça mantém condenações de prefeito, secretários e vereadores por corrupção em prefeitura de MS - G1 Prefeitura participa de entrega de óculos do projeto “Olhos que Inspiram” no IFMS  Município de Corumbá Moinho in Concert entra na reta final dos ensaios para celebrar os caminhos que levam ao céu  Diário MS News Neno Razuk investe mais de R$ 5 milhões em emendas e transforma municípios de MS  Assembleia Legislativa de Mato Grosso do Sul - Junho chega trazendo as festas de São João e outros eventos por todo o país — Ministério do Turismo  www.gov.br Parceria entre Governo de MS e Marinha possibilita pesquisa, atendimento médico e combate a incêndios  Portal Único ms.gov.br IFMS abre 480 vagas para curso preparatório gratuito com bolsa de R$ 200  Campo Grande News IFMS abre inscrições para curso que amplia acesso ao ensino médio técnico  Correio de Corumbá GIRO FUNTRAB DE NOTÍCIAS – 03/06/2025 a 16/06/2025  funtrab.ms.gov.br Prefeitura de Ladário pagará R$ 1,1 milhão para colocar secretarias em contêineres  Midiamax 27ª Feapan impulsiona negócios, turismo e cultura no Pantanal com apoio da Prefeitura de Corumbá  Município de Corumbá Contrato milionário feito sem licitação é anulado em Ladário após recomendação do MP  Folha MS Reforma do Estádio Vicente Fortunato vai custar mais de R$ 2 milhões  Diário Corumbaense 'Mensalinho': Justiça mantém condenações de prefeito, secretários e vereadores por corrupção em prefeitura de MS  G1"
Miranda,15,"portal, único, miranda, amplia, políticas","Mapeamento de Criativos de MS continua em 2026 e amplia construção de políticas públicas para o setor - agenciadenoticias.ms.gov.br Economia criativa impulsiona desenvolvimento regional e promove inclusão em MS - agenciadenoticias.ms.gov.br Festival de Inverno de Bonito terá 150 atrações durante cinco dias de arte e cultura - Diário Corumbaense Encontro estadual apresenta calendário esportivo, diretrizes e alinha políticas públicas em MS - Portal Único ms.gov.br Com mais de R$ 8 milhões para fomentar e difundir cultura sul-mato-grossense, inscrições do FIC abrem no dia 16 - fundacaodecultura.ms.gov.br Com educação profissional e qualificação, MS é beneficiado com melhores oportunidades de emprego - Portal Único ms.gov.br Casa do Trabalhador de Maracaju amplia oportunidades para jovens aprendizes - funtrab.ms.gov.br Petrobras abre 715 vagas no Programa Jovem Aprendiz 2025: veja salário e benefícios - Seu Dinheiro Corpo de Bombeiros divulga novo resultado da seleção para bombeiros temporários - Midiamax Governo de MS oferece cursos de qualificação na área de economia criativa a partir de agosto - Portal Único ms.gov.br Dona de casa viaja 212 km para participar do Mutirão Todos em Ação – CGNotícias - campogrande.ms.gov.br TRF3 e JFMS abrem a 9ª edição do projeto “Caminho do Acordo”, na Aldeia Cachoeirinha, em Miranda/MS - trf3.jus.br Sejusp entrega veículos para reforçar segurança em aldeias indígenas de Miranda - sejusp.ms.gov.br Polícia Civil inaugura a 52ª Sala Lilás do MS, em Aparecida do Taboado - pc.ms.gov.br Entrevista com o prefeito de Miranda, Fabinho Florença, no Jornal da Top - Diário MS News Mapeamento de Criativos de MS continua em 2026 e amplia construção de políticas públicas para o setor  agenciadenoticias.ms.gov.br Economia criativa impulsiona desenvolvimento regional e promove inclusão em MS  agenciadenoticias.ms.gov.br Festival de Inverno de Bonito terá 150 atrações durante cinco dias de arte e cultura  Diário Corumbaense Encontro estadual apresenta calendário esportivo, diretrizes e alinha políticas públicas em MS  Portal Único ms.gov.br Com mais de R$ 8 milhões para fomentar e difundir cultura sul-mato-grossense, inscrições do FIC abrem no dia 16  fundacaodecultura.ms.gov.br Com educação profissional e qualificação, MS é beneficiado com melhores oportunidades de emprego  Portal Único ms.gov.br Casa do Trabalhador de Maracaju amplia oportunidades para jovens aprendizes  funtrab.ms.gov.br Petrobras abre 715 vagas no Programa Jovem Aprendiz 2025: veja salário e benefícios  Seu Dinheiro Corpo de Bombeiros divulga novo resultado da seleção para bombeiros temporários  Midiamax Governo de MS oferece cursos de qualificação na área de economia criativa a partir de agosto  Portal Único ms.gov.br Dona de casa viaja 212 km para participar do Mutirão Todos em Ação – CGNotícias  campogrande.ms.gov.br TRF3 e JFMS abrem a 9ª edição do projeto “Caminho do Acordo”, na Aldeia Cachoeirinha, em Miranda/MS  trf3.jus.br Sejusp entrega veículos para reforçar segurança em aldeias indígenas de Miranda  sejusp.ms.gov.br Polícia Civil inaugura a 52ª Sala Lilás do MS, em Aparecida do Taboado  pc.ms.gov.br Entrevista com o prefeito de Miranda, Fabinho Florença, no Jornal da Top  Diário MS News"
Mundo Novo,12,"midiamax, funtrab, polícia, civil, inaugura","Sesc Teatro Prosa oferece semana de arte e lazer gratuito em Campo Grande - capitalnews.com.br Ponta Porã recebe etapa dos Jogos da Melhor Idade com disputas de bocha - Portal Único ms.gov.br 2003 – Assassinado Henrique Spengler, artista plástico e pesquisador - Midiamax Com alta de 11,7%, turismo cresce em Mato Grosso do Sul e impulsiona a economia regional - agenciadenoticias.ms.gov.br Projeto Artesania fomenta cultura e geração de renda no interior por meio do artesanato - agenciadenoticias.ms.gov.br Funtrab e SENAI-MS abrem vagas para cursos gratuitos e fortalecem qualificação profissional no Estado - funtrab.ms.gov.br Confira a programação completa do Delas Day 2026 - funtrab.ms.gov.br Polícia Civil inaugura a 53ª Sala Lilás do MS, em Japorã - sejusp.ms.gov.br Polícia Civil inaugura a 51ª Sala Lilás em Mundo Novo - pc.ms.gov.br Ex-prefeito de Japorã ganha cargo semelhante ao do prefeito e passa a ser investigado - Midiamax Polícia Civil inaugura a 53ª Sala Lilás do MS, em Japorã - pc.ms.gov.br Mundo Novo contrata sete escritórios de advogados em menos de um ano - Midiamax Sesc Teatro Prosa oferece semana de arte e lazer gratuito em Campo Grande  capitalnews.com.br Ponta Porã recebe etapa dos Jogos da Melhor Idade com disputas de bocha  Portal Único ms.gov.br 2003 – Assassinado Henrique Spengler, artista plástico e pesquisador  Midiamax Com alta de 11,7%, turismo cresce em Mato Grosso do Sul e impulsiona a economia regional  agenciadenoticias.ms.gov.br Projeto Artesania fomenta cultura e geração de renda no interior por meio do artesanato  agenciadenoticias.ms.gov.br Funtrab e SENAI-MS abrem vagas para cursos gratuitos e fortalecem qualificação profissional no Estado  funtrab.ms.gov.br Confira a programação completa do Delas Day 2026  funtrab.ms.gov.br Polícia Civil inaugura a 53ª Sala Lilás do MS, em Japorã  sejusp.ms.gov.br Polícia Civil inaugura a 51ª Sala Lilás em Mundo Novo  pc.ms.gov.br Ex-prefeito de Japorã ganha cargo semelhante ao do prefeito e passa a ser investigado  Midiamax Polícia Civil inaugura a 53ª Sala Lilás do MS, em Japorã  pc.ms.gov.br Mundo Novo contrata sete escritórios de advogados em menos de um ano  Midiamax"
