municipio,qtd_noticias_encontradas,temas_frequentes,resumo_para_slide
Água Clara,15,"água, clara, registra, arapuanews, recebe","Boletim Epidemiológico: MS registra 4.834 casos confirmados de chikungunya - ArapuaNews Ponta Porã recebe etapa dos Jogos da Melhor Idade com disputas de bocha - Portal Único ms.gov.br Neno Razuk investe mais de R$ 5 milhões em emendas e transforma municípios de MS - Assembleia Legislativa de Mato Grosso do Sul - No Corredor Bioceânico, Ribas do Rio Pardo, tem 83,70% de cobertura do esgoto - Notícias do Cerrado FCMS comemora o ""Ano do Teatro"" em Mato Grosso do Sul - O Pantaneiro MS registra alta de empregos formais em julho de 2025 com saldo de 3.023 vagas - funtrab.ms.gov.br SESI-PA promove capacitação para professores e SENAI-MS oferece curso com bolsa de R$ 1 mil - Agência de Notícias da Indústria Suzano abre nove processos seletivos para Água Clara e Ribas do Rio Pardo/MS - ArapuaNews Empresas têm mais de 14 mil vagas de emprego, estágio, trainee e jovem aprendiz - AJN1 Tem CNH E? Confira vaga para motorista tritrem de empresa de celulose em MS - Midiamax Sentença condenatória é confirmada em 2º grau em ação do MPMS que investigou esquema de corrupção em Água Clara - MPMS Polícia Civil inaugura a 53ª Sala Lilás do MS, em Japorã - sejusp.ms.gov.br Procedimento vai monitorar TAC para regularizar Controladoria Municipal de Água Clara - Midiamax Polícia Civil inaugura a 53ª Sala Lilás do MS, em Japorã - pc.ms.gov.br REFERÊNCIA: Almoxarifado Central de Bataguassu recebe visitas técnicas das Prefeituras de Água Clara e Brasilândia - prefeitura municipal de bataguassu (ms) Boletim Epidemiológico: MS registra 4.834 casos confirmados de chikungunya  ArapuaNews Ponta Porã recebe etapa dos Jogos da Melhor Idade com disputas de bocha  Portal Único ms.gov.br Neno Razuk investe mais de R$ 5 milhões em emendas e transforma municípios de MS  Assembleia Legislativa de Mato Grosso do Sul - No Corredor Bioceânico, Ribas do Rio Pardo, tem 83,70% de cobertura do esgoto  Notícias do Cerrado FCMS comemora o ""Ano do Teatro"" em Mato Grosso do Sul  O Pantaneiro MS registra alta de empregos formais em julho de 2025 com saldo de 3.023 vagas  funtrab.ms.gov.br SESI-PA promove capacitação para professores e SENAI-MS oferece curso com bolsa de R$ 1 mil  Agência de Notícias da Indústria Suzano abre nove processos seletivos para Água Clara e Ribas do Rio Pardo/MS  ArapuaNews Empresas têm mais de 14 mil vagas de emprego, estágio, trainee e jovem aprendiz  AJN1 Tem CNH E? Confira vaga para motorista tritrem de empresa de celulose em MS  Midiamax Sentença condenatória é confirmada em 2º grau em ação do MPMS que investigou esquema de corrupção em Água Clara  MPMS Polícia Civil inaugura a 53ª Sala Lilás do MS, em Japorã  sejusp.ms.gov.br Procedimento vai monitorar TAC para regularizar Controladoria Municipal de Água Clara  Midiamax Polícia Civil inaugura a 53ª Sala Lilás do MS, em Japorã  pc.ms.gov.br REFERÊNCIA: Almoxarifado Central de Bataguassu recebe visitas técnicas das Prefeituras de Água Clara e Brasilândia  prefeitura municipal de bataguassu (ms)"
Amambai,14,"amambai, prefeitura, municipal, cultura, vagas","Governo licita obras de CEUs da Cultura em quatro cidades e fortalece acesso à arte, educação e cidadania - Portal Único ms.gov.br O projeto Grafite & Cultura, que une arte urbana, cultura e educação ambiental, encerrou nesta terça-feira (14) as atividades na Escola Estadual Frei Thimoteo Van Den Broeck, no Jardim Esperança, em Mogi das Cruzes. A iniciativa, que teve início no dia 7 d - instagram.com Esporte é instrumento de preservação e fortalecimento das tradições indígenas em MS - fundesporte.ms.gov.br Agendão: fim de semana tem MS Fashion Week, Festa do Leitão no Rolete, exposições e muito teatro - Idest Bioenergia: rodada de empregabilidade oferece mais de 630 vagas em 15 municípios de MS - Portal Único ms.gov.br Funtrab anuncia vários cursos gratuitos de qualificação no Estado, veja como se inscrever - funtrab.ms.gov.br Corpo de Bombeiros divulga novo resultado da seleção para bombeiros temporários - Midiamax Casa do Trabalhador de Amambai anuncia 78 vagas de emprego para esta terça-feira, 9 de julho - Prefeitura Municipal de Amambai Notícia - Casa do Trabalhador oferece 89 vagas de emprego e reforça parcerias para desenvolvimento profissi... - Prefeitura Municipal de Amambai Prefeitura irá desembolsar R$ 1,9 milhão em indenizações para viabilizar Contorno Viário de Amambai - Midiamax Amambai: Servidores públicos municipais poderão ter até 20% de desconto na conta de energia elétrica - A Gazeta News Amambai confirma convênio para construção de 50 novas mor... - Prefeitura Municipal de Amambai Em Amambai, MPMS acompanha implementação de Programas de Integridade na gestão municipal - MPMS Prefeitura de Amambai MS abre processo seletivo para formador municipal - Folha Dirigida Governo licita obras de CEUs da Cultura em quatro cidades e fortalece acesso à arte, educação e cidadania  Portal Único ms.gov.br O projeto Grafite & Cultura, que une arte urbana, cultura e educação ambiental, encerrou nesta terça-feira (14) as atividades na Escola Estadual Frei Thimoteo Van Den Broeck, no Jardim Esperança, em Mogi das Cruzes. A iniciativa, que teve início no dia 7 d  instagram.com Esporte é instrumento de preservação e fortalecimento das tradições indígenas em MS  fundesporte.ms.gov.br Agendão: fim de semana tem MS Fashion Week, Festa do Leitão no Rolete, exposições e muito teatro  Idest Bioenergia: rodada de empregabilidade oferece mais de 630 vagas em 15 municípios de MS  Portal Único ms.gov.br Funtrab anuncia vários cursos gratuitos de qualificação no Estado, veja como se inscrever  funtrab.ms.gov.br Corpo de Bombeiros divulga novo resultado da seleção para bombeiros temporários  Midiamax Casa do Trabalhador de Amambai anuncia 78 vagas de emprego para esta terça-feira, 9 de julho  Prefeitura Municipal de Amambai Notícia - Casa do Trabalhador oferece 89 vagas de emprego e reforça parcerias para desenvolvimento profissi...  Prefeitura Municipal de Amambai Prefeitura irá desembolsar R$ 1,9 milhão em indenizações para viabilizar Contorno Viário de Amambai  Midiamax Amambai: Servidores públicos municipais poderão ter até 20% de desconto na conta de energia elétrica  A Gazeta News Amambai confirma convênio para construção de 50 novas mor...  Prefeitura Municipal de Amambai Em Amambai, MPMS acompanha implementação de Programas de Integridade na gestão municipal  MPMS Prefeitura de Amambai MS abre processo seletivo para formador municipal  Folha Dirigida"
Anastácio,13,"pantaneiro, anastácio, bombeiros, aquidauana, festa","Aquidauana e Anastácio registram o maior volume de chuva do estado - O Pantaneiro Começa a contagem regressiva para a grandiosa Festa da Farinha de Anastácio - O Pantaneiro Casa do Artesão reúne lojistas para ampliar comércio dos produtos locais de Aquidauana - O Pantaneiro Corpo de Bombeiros divulga novo resultado da seleção para bombeiros temporários - Midiamax GIRO FUNTRAB DE NOTÍCIAS -12/05/2025 a 17/05/2025 - funtrab.ms.gov.br Processo seletivo dos Bombeiros MS abre 230 vagas em 30 cidades - JC Concursos Qualificação beneficia população de MS com melhores oportunidades de emprego - O Pantaneiro Na Capital, EJA é ofertado em 16 escolas e na modalidade à distância; veja lista - Campo Grande News Anastácio conquista Selo Ouro de Alfabetização pelo 2°ano e recebe homenagem estadual - O Pantaneiro Pacote de R$ 10 milhões prevê de ambulâncias no interior de MS - Midiamax Justiça atende pedido do MPMS e anula processo seletivo irregular em Anastácio - MPMS Polícia Civil inaugura a 52ª Sala Lilás do MS em Aparecida do Taboado - Costa Leste News Anastácio celebra 61 anos com programação especial e Festa da Farinha - O Pantaneiro Aquidauana e Anastácio registram o maior volume de chuva do estado  O Pantaneiro Começa a contagem regressiva para a grandiosa Festa da Farinha de Anastácio  O Pantaneiro Casa do Artesão reúne lojistas para ampliar comércio dos produtos locais de Aquidauana  O Pantaneiro Corpo de Bombeiros divulga novo resultado da seleção para bombeiros temporários  Midiamax GIRO FUNTRAB DE NOTÍCIAS -12/05/2025 a 17/05/2025  funtrab.ms.gov.br Processo seletivo dos Bombeiros MS abre 230 vagas em 30 cidades  JC Concursos Qualificação beneficia população de MS com melhores oportunidades de emprego  O Pantaneiro Na Capital, EJA é ofertado em 16 escolas e na modalidade à distância; veja lista  Campo Grande News Anastácio conquista Selo Ouro de Alfabetização pelo 2°ano e recebe homenagem estadual  O Pantaneiro Pacote de R$ 10 milhões prevê de ambulâncias no interior de MS  Midiamax Justiça atende pedido do MPMS e anula processo seletivo irregular em Anastácio  MPMS Polícia Civil inaugura a 52ª Sala Lilás do MS em Aparecida do Taboado  Costa Leste News Anastácio celebra 61 anos com programação especial e Festa da Farinha  O Pantaneiro"
Angélica,10,"prefeitura, novos, jovens, festival, gratuito","Festival gratuito celebra o Dia Internacional do Yoga no Parque das Nações Indígenas - agenciadenoticias.ms.gov.br Conheça os perfis e atribuições dos novos secretários e diretores da Prefeitura de Campo Grande - campogrande.ms.gov.br Projeto “ODS nos Muros” encerra atividades com roda de conversa e galeria digital - fundacaodecultura.ms.gov.br Casa do Trabalhador de Três Lagoas promove Feirão de Vagas para inserção de jovens no mercado de trabalho - funtrab.ms.gov.br Adecoagro inicia Programa Jovens Talentos Aprendizes com Deficiência - Iviagora Polícia Civil inaugura a 52ª Sala Lilás do MS, em Aparecida do Taboado - pc.ms.gov.br Prefeitura empossa novos membros Conselho Municipal dos Direitos da Mulher - Município de Corumbá Prefeitura de Angélica (MS) anuncia seletivo na área da Educação - Concursos no Brasil Ivinhema decreta calamidade pública após chuvas de até 120 milímetros - Diário Corumbaense Prefeituras de MS terão que cobrir rombo causado pelo Banco Master, diz Governo Federal - Correio do Estado Festival gratuito celebra o Dia Internacional do Yoga no Parque das Nações Indígenas  agenciadenoticias.ms.gov.br Conheça os perfis e atribuições dos novos secretários e diretores da Prefeitura de Campo Grande  campogrande.ms.gov.br Projeto “ODS nos Muros” encerra atividades com roda de conversa e galeria digital  fundacaodecultura.ms.gov.br Casa do Trabalhador de Três Lagoas promove Feirão de Vagas para inserção de jovens no mercado de trabalho  funtrab.ms.gov.br Adecoagro inicia Programa Jovens Talentos Aprendizes com Deficiência  Iviagora Polícia Civil inaugura a 52ª Sala Lilás do MS, em Aparecida do Taboado  pc.ms.gov.br Prefeitura empossa novos membros Conselho Municipal dos Direitos da Mulher  Município de Corumbá Prefeitura de Angélica (MS) anuncia seletivo na área da Educação  Concursos no Brasil Ivinhema decreta calamidade pública após chuvas de até 120 milímetros  Diário Corumbaense Prefeituras de MS terão que cobrir rombo causado pelo Banco Master, diz Governo Federal  Correio do Estado"
Aparecida do Taboado,15,"aparecida, taboado, news, vagas, cursos","Saúde na Escola leva atendimentos e cuidado aos alunos da APAE em Aparecida do Taboado - A Tribuna News - - A Tribuna News Com apoio do Governo, Taboadão 2026 movimenta turismo, cultura e economia da região - agenciadenoticias.ms.gov.br Taboadão 2026 reforça tradição e impulsiona economia em Aparecida do Taboado - Notícias do Cerrado Governo de MS leva investimentos em educação e infraestrutura a Aparecida do Taboado - Portal Único ms.gov.br Neno Razuk investe mais de R$ 5 milhões em emendas e transforma municípios de MS - Assembleia Legislativa de Mato Grosso do Sul - Senai MS: 2 mil vagas em cursos técnicos com bolsa de R$ 300; inscreva-se - Campo Grande News SENAI oferece 60 vagas em cursos técnicos gratuitos em Aparecida do Taboado com auxílio mensal - Costa Leste News Bioenergia: rodada de empregabilidade oferece mais de 630 vagas em 15 municípios de MS - agenciadenoticias.ms.gov.br Funtrab anuncia vários cursos gratuitos de qualificação no Estado, veja como se inscrever - funtrab.ms.gov.br Corpo de Bombeiros divulga novo resultado da seleção para bombeiros temporários - Midiamax Investimentos: Coronel David cumpre agenda com Rie... - Assembleia Legislativa de Mato Grosso do Sul - Riedel cumpre agendas em Glória de Dourados e Aparecida do Taboado nesta sexta-feira - Midiamax Polícia Civil inaugura a 52ª Sala Lilás do MS, em Aparecida do Taboado - pc.ms.gov.br Com expansão da rede de apoio às mulheres, MS inaugura Sala Lilás em Aparecida do Taboado - sejusp.ms.gov.br Aparecida do Taboado implanta sistema de monitoramento inteligente com mais de 70 câmeras - RCN 67 Saúde na Escola leva atendimentos e cuidado aos alunos da APAE em Aparecida do Taboado - A Tribuna News -  A Tribuna News Com apoio do Governo, Taboadão 2026 movimenta turismo, cultura e economia da região  agenciadenoticias.ms.gov.br Taboadão 2026 reforça tradição e impulsiona economia em Aparecida do Taboado  Notícias do Cerrado Governo de MS leva investimentos em educação e infraestrutura a Aparecida do Taboado  Portal Único ms.gov.br Neno Razuk investe mais de R$ 5 milhões em emendas e transforma municípios de MS  Assembleia Legislativa de Mato Grosso do Sul - Senai MS: 2 mil vagas em cursos técnicos com bolsa de R$ 300; inscreva-se  Campo Grande News SENAI oferece 60 vagas em cursos técnicos gratuitos em Aparecida do Taboado com auxílio mensal  Costa Leste News Bioenergia: rodada de empregabilidade oferece mais de 630 vagas em 15 municípios de MS  agenciadenoticias.ms.gov.br Funtrab anuncia vários cursos gratuitos de qualificação no Estado, veja como se inscrever  funtrab.ms.gov.br Corpo de Bombeiros divulga novo resultado da seleção para bombeiros temporários  Midiamax Investimentos: Coronel David cumpre agenda com Rie...  Assembleia Legislativa de Mato Grosso do Sul - Riedel cumpre agendas em Glória de Dourados e Aparecida do Taboado nesta sexta-feira  Midiamax Polícia Civil inaugura a 52ª Sala Lilás do MS, em Aparecida do Taboado  pc.ms.gov.br Com expansão da rede de apoio às mulheres, MS inaugura Sala Lilás em Aparecida do Taboado  sejusp.ms.gov.br Aparecida do Taboado implanta sistema de monitoramento inteligente com mais de 70 câmeras  RCN 67"
Aral Moreira,13,"inscrições, ifms, teatro, últimos, mato","Com investimento do FIC, Grupo UBU chega com teatro em nove cidades na região sul-fronteira de MS - fundacaodecultura.ms.gov.br Com R$ 3,2 bilhões, MS teve aumento de 227% nos investimentos públicos nos últimos três anos - agenciadenoticias.ms.gov.br FCMS comemora o ""Ano do Teatro"" em Mato Grosso do Sul - O Pantaneiro Últimos dias de inscrições para qualificação profissional a distância no IFMS - Correio de Corumbá MS registra saldo de 2.718 empregos formais em agosto, com destaque para setores de Construção e Indústria - funtrab.ms.gov.br Quer se qualificar sem sair de casa? Cursos EAD gratuitos do IFMS para assistente, operador e vendedor têm inscrições abertas e exigem apenas CPF - CPG Click Petróleo e Gás Com vagas ilimitadas, IFMS abre inscrições para Curso de Operador de Computador 100% EAD - PEBSP Sanesul abre processo seletivo com 40 vagas e salário de até R$ 3.189,38 - G1 Polícia Civil inaugura a 53ª Sala Lilás do MS, em Japorã - sejusp.ms.gov.br Morre Irimar Carvalho, ex-prefeito de Aral Moreira - Midiamax Estudantes da rede pública são premiados em cerimônia do projeto MPT na Escola em Mato Grosso do Sul - agorams.com.br Ponta Porã sedia fase dos Jogos Abertos Regionais de MS - Prefeitura Municipal de Ponta Porã Fundesporte investe na construção de pista de caminhada em Aral Moreira - fundesporte.ms.gov.br Com investimento do FIC, Grupo UBU chega com teatro em nove cidades na região sul-fronteira de MS  fundacaodecultura.ms.gov.br Com R$ 3,2 bilhões, MS teve aumento de 227% nos investimentos públicos nos últimos três anos  agenciadenoticias.ms.gov.br FCMS comemora o ""Ano do Teatro"" em Mato Grosso do Sul  O Pantaneiro Últimos dias de inscrições para qualificação profissional a distância no IFMS  Correio de Corumbá MS registra saldo de 2.718 empregos formais em agosto, com destaque para setores de Construção e Indústria  funtrab.ms.gov.br Quer se qualificar sem sair de casa? Cursos EAD gratuitos do IFMS para assistente, operador e vendedor têm inscrições abertas e exigem apenas CPF  CPG Click Petróleo e Gás Com vagas ilimitadas, IFMS abre inscrições para Curso de Operador de Computador 100% EAD  PEBSP Sanesul abre processo seletivo com 40 vagas e salário de até R$ 3.189,38  G1 Polícia Civil inaugura a 53ª Sala Lilás do MS, em Japorã  sejusp.ms.gov.br Morre Irimar Carvalho, ex-prefeito de Aral Moreira  Midiamax Estudantes da rede pública são premiados em cerimônia do projeto MPT na Escola em Mato Grosso do Sul  agorams.com.br Ponta Porã sedia fase dos Jogos Abertos Regionais de MS  Prefeitura Municipal de Ponta Porã Fundesporte investe na construção de pista de caminhada em Aral Moreira  fundesporte.ms.gov.br"
Bataguassu,12,"bataguassu, prefeitura, semana, agendão, agenciadenoticias","Agendão cultural: fim de semana tem shows nacionais, feiras criativas, teatro e festas populares em MS - agenciadenoticias.ms.gov.br Festival de Dança Coreografada da Melhor Idade define campeões - fundesporte.ms.gov.br Agendão: fim de semana vem com stand-up, espetáculos, Natal na Praça e rodeio - agenciadenoticias.ms.gov.br DESTAQUE: Bataguassu sedia o maior evento de OFF ROAD do MS! - prefeitura municipal de bataguassu (ms) Agendão: fim de semana tem MS Fashion Week, Festa do Leitão no Rolete, exposições e muito teatro - Idest Semana da Empregabilidade mobilizou cerca de 300 trabalhadores na Casa do Trabalhador de Bataguassu - funtrab.ms.gov.br Corpo de Bombeiros divulga novo resultado da seleção para bombeiros temporários - Midiamax Prefeitura firma parceria com Polícia Militar e Governo do Estado para implementar o PROMUSE - prefeitura municipal de bataguassu (ms) Prefeitura de Bataguassu MS abre processo seletivo para Educação em 2026 - Folha Dirigida Com possibilidade de novas chamadas para alunos, curso de Direito da UEMS em Bataguassu inicia aulas - agenciadenoticias.ms.gov.br Sem concursos, prefeita de Bataguassu é proibida de nomear comissionados - Midiamax Na Feicc, Prefeitura de Bataguassu vai divulgar potencialidades econômicas do município - FIEMS Agendão cultural: fim de semana tem shows nacionais, feiras criativas, teatro e festas populares em MS  agenciadenoticias.ms.gov.br Festival de Dança Coreografada da Melhor Idade define campeões  fundesporte.ms.gov.br Agendão: fim de semana vem com stand-up, espetáculos, Natal na Praça e rodeio  agenciadenoticias.ms.gov.br DESTAQUE: Bataguassu sedia o maior evento de OFF ROAD do MS! prefeitura municipal de bataguassu (ms) Agendão: fim de semana tem MS Fashion Week, Festa do Leitão no Rolete, exposições e muito teatro  Idest Semana da Empregabilidade mobilizou cerca de 300 trabalhadores na Casa do Trabalhador de Bataguassu  funtrab.ms.gov.br Corpo de Bombeiros divulga novo resultado da seleção para bombeiros temporários  Midiamax Prefeitura firma parceria com Polícia Militar e Governo do Estado para implementar o PROMUSE  prefeitura municipal de bataguassu (ms) Prefeitura de Bataguassu MS abre processo seletivo para Educação em 2026  Folha Dirigida Com possibilidade de novas chamadas para alunos, curso de Direito da UEMS em Bataguassu inicia aulas  agenciadenoticias.ms.gov.br Sem concursos, prefeita de Bataguassu é proibida de nomear comissionados  Midiamax Na Feicc, Prefeitura de Bataguassu vai divulgar potencialidades econômicas do município  FIEMS"
Batayporã,10,"batayporã, abre, prefeitura, vagas, processo","Festival de Dança Coreografada da Melhor Idade define campeões - fundesporte.ms.gov.br Em Batayporã, mais de 140 oportunidades de emprego nesta sexta - funtrab.ms.gov.br Frigorífico Zanchetta abre vagas de emprego em Batayporã - Jornal da Nova Prefeitura de Batayporã abre processo seletivo com 54 vagas na área da saúde - Midiamax Edital aberto: pós graduação destinado ao cooperativismo e empreendimentos solidários - funtrab.ms.gov.br Hashioka visita prefeito Germino e reforça parceri... - Assembleia Legislativa de Mato Grosso do Sul - Prefeitura de Batayporã MS abre processo seletivo com 4 vagas - Folha Dirigida Prefeitura de Batayporã - MS abre processo seletivo para profissionais alfabetizados - PCI Concursos Prefeitura de Batayporã (MS) abre vagas de níveis alfabetizado e fundamental - Concursos no Brasil Prefeitura de Batayporã - MS abre processo seletivo para professor de ensino fundamental - PCI Concursos Festival de Dança Coreografada da Melhor Idade define campeões  fundesporte.ms.gov.br Em Batayporã, mais de 140 oportunidades de emprego nesta sexta  funtrab.ms.gov.br Frigorífico Zanchetta abre vagas de emprego em Batayporã  Jornal da Nova Prefeitura de Batayporã abre processo seletivo com 54 vagas na área da saúde  Midiamax Edital aberto: pós graduação destinado ao cooperativismo e empreendimentos solidários  funtrab.ms.gov.br Hashioka visita prefeito Germino e reforça parceri...  Assembleia Legislativa de Mato Grosso do Sul - Prefeitura de Batayporã MS abre processo seletivo com 4 vagas  Folha Dirigida Prefeitura de Batayporã - MS abre processo seletivo para profissionais alfabetizados  PCI Concursos Prefeitura de Batayporã (MS) abre vagas de níveis alfabetizado e fundamental  Concursos no Brasil Prefeitura de Batayporã - MS abre processo seletivo para professor de ensino fundamental  PCI Concursos"
Bela Vista,15,"mpms, notícias, bela, vista, programação","MITsp - Mostra Internacional de Teatro de São Paulo apresenta a programação de sua 11ª edição - Canal Aberto - Assessoria de Imprensa Cidade do MS se consolida como portal do Mercosul - O Antagonista Virada Cultural 2025 de SP: veja programação completa do evento, que completa 20 anos - G1 Câmara de Vereadores de Três Lagoas realiza Sessão Solene para homenagear Profissionais de Educação Física - Hojemais Sesc inaugura nova unidade no Centro de SP nesta sexta com exposição fotográfica e show de Martinho da Vila - G1 Estado abre curso gratuito de Comércio Exterior voltado à Rota Bioceânica e jovens do interior - Aquidauana Notícias GIRO FUNTRAB DE NOTÍCIAS – 03/06/2025 a 16/06/2025 - funtrab.ms.gov.br MPMS participa de reunião técnica para ampliar oportunidades a jovens em situação de vulnerabilidade em Bela Vista - MPMS Corpo de Bombeiros divulga novo resultado da seleção para bombeiros temporários - Midiamax Abertas vagas para estágio no IEL! São 2,3 mil oportunidades em diversos cursos - Agência de Notícias da Indústria Prefeitos de Mato Grosso do Sul serão reconhecidos com o título de Prefeito Inovador 2026 - A Gazeta News Relatório confirma insalubridade e zero prestação de contas no Asilo de Bela Vista - Midiamax Defensoria ajuíza ação para regularizar moradias de 50 famílias em MS - diariodigital.com.br Proteção à infância: MPMS recomenda restrição à divulgação de imagens de crianças por órgãos públicos em Bela Vista - MPMS Semana política: CPI, suspensão de mandato, plano da Fiems e nova pesquisa - Investiga MS MITsp - Mostra Internacional de Teatro de São Paulo apresenta a programação de sua 11ª edição  Canal Aberto - Assessoria de Imprensa Cidade do MS se consolida como portal do Mercosul  O Antagonista Virada Cultural 2025 de SP: veja programação completa do evento, que completa 20 anos  G1 Câmara de Vereadores de Três Lagoas realiza Sessão Solene para homenagear Profissionais de Educação Física  Hojemais Sesc inaugura nova unidade no Centro de SP nesta sexta com exposição fotográfica e show de Martinho da Vila  G1 Estado abre curso gratuito de Comércio Exterior voltado à Rota Bioceânica e jovens do interior  Aquidauana Notícias GIRO FUNTRAB DE NOTÍCIAS – 03/06/2025 a 16/06/2025  funtrab.ms.gov.br MPMS participa de reunião técnica para ampliar oportunidades a jovens em situação de vulnerabilidade em Bela Vista  MPMS Corpo de Bombeiros divulga novo resultado da seleção para bombeiros temporários  Midiamax Abertas vagas para estágio no IEL! São 2,3 mil oportunidades em diversos cursos  Agência de Notícias da Indústria Prefeitos de Mato Grosso do Sul serão reconhecidos com o título de Prefeito Inovador 2026  A Gazeta News Relatório confirma insalubridade e zero prestação de contas no Asilo de Bela Vista  Midiamax Defensoria ajuíza ação para regularizar moradias de 50 famílias em MS  diariodigital.com.br Proteção à infância: MPMS recomenda restrição à divulgação de imagens de crianças por órgãos públicos em Bela Vista  MPMS Semana política: CPI, suspensão de mandato, plano da Fiems e nova pesquisa  Investiga MS"
