municipio,qtd_noticias_encontradas,temas_frequentes,resumo_para_slide
Glória de Dourados,15,"funtrab, municípios, glória, dourados, melhor","As 10 cidades com melhor qualidade de vida de MS; Campo Grande lidera ranking estadual - G1 Três Lagoas encerra Jogos da Melhor Idade com participação de 48 municípios de Mato Grosso do Sul - Perfil - Perfil News Cresce 24% o número de brasileiros migrando para essa cidade universitária de alto padrão perto do Paraguai nos últimos 12 anos - Correio Braziliense Municipalismo: Governo de MS investe em infraestrutura e apoia feira agropecuária em Glória de Dourados - ArapuaNews Festival de Dança Coreografada da Melhor Idade define campeões - fundesporte.ms.gov.br Funtrab e Biosul anunciam 2ª Rodada de Empregabilidade do Setor de Bioenergia com mais de 630 vagas em 15 municípios de MS - funtrab.ms.gov.br Educação que transforma: 100% dos municípios de Mato Grosso do Sul contam com ensino profissionalizante - sed.ms.gov.br Mestrado Profissional em Recursos Hídricos (PROFAGUA) abre seleção para 36 vagas de aluno especial - uems.br GIRO FUNTRAB DE NOTÍCIAS – 03/06/2025 a 16/06/2025 - funtrab.ms.gov.br Quer se qualificar de graça? Funtrab abre cursos gratuitos em MS com o Senac - funtrab.ms.gov.br Com Fiems, Paulo Corrêa articula desconto de até 20% na conta de energia para 74 municípios de MS - O CORREIO NEWS TCE-MS participa de lançamento de Programa de Compliance em Glória de Dourados - TCE-MS MPMS fiscaliza transporte escolar em Glória de Dourados e cobra regularização de vistorias e segurança veicular - MPMS Riedel cumpre agendas em Glória de Dourados e Aparecida do Taboado nesta sexta-feira - Midiamax Polícia Civil inaugura a 53ª Sala Lilás do MS, em Japorã - sejusp.ms.gov.br As 10 cidades com melhor qualidade de vida de MS; Campo Grande lidera ranking estadual  G1 Três Lagoas encerra Jogos da Melhor Idade com participação de 48 municípios de Mato Grosso do Sul - Perfil  Perfil News Cresce 24% o número de brasileiros migrando para essa cidade universitária de alto padrão perto do Paraguai nos últimos 12 anos  Correio Braziliense Municipalismo: Governo de MS investe em infraestrutura e apoia feira agropecuária em Glória de Dourados  ArapuaNews Festival de Dança Coreografada da Melhor Idade define campeões  fundesporte.ms.gov.br Funtrab e Biosul anunciam 2ª Rodada de Empregabilidade do Setor de Bioenergia com mais de 630 vagas em 15 municípios de MS  funtrab.ms.gov.br Educação que transforma: 100% dos municípios de Mato Grosso do Sul contam com ensino profissionalizante  sed.ms.gov.br Mestrado Profissional em Recursos Hídricos (PROFAGUA) abre seleção para 36 vagas de aluno especial  uems.br GIRO FUNTRAB DE NOTÍCIAS – 03/06/2025 a 16/06/2025  funtrab.ms.gov.br Quer se qualificar de graça? Funtrab abre cursos gratuitos em MS com o Senac  funtrab.ms.gov.br Com Fiems, Paulo Corrêa articula desconto de até 20% na conta de energia para 74 municípios de MS  O CORREIO NEWS TCE-MS participa de lançamento de Programa de Compliance em Glória de Dourados  TCE-MS MPMS fiscaliza transporte escolar em Glória de Dourados e cobra regularização de vistorias e segurança veicular  MPMS Riedel cumpre agendas em Glória de Dourados e Aparecida do Taboado nesta sexta-feira  Midiamax Polícia Civil inaugura a 53ª Sala Lilás do MS, em Japorã  sejusp.ms.gov.br"
Iguatemi,15,"gazeta, news, funtrab, notícias, confira","Festival de Dança Coreografada da Melhor Idade define campeões - fundesporte.ms.gov.br Fim de semana de Páscoa em Fortaleza tem shows, caça aos ovos, cinema e mais; confira a agenda - G1 Cine Sesi Cultural finaliza 3ª etapa com 101,6 mil pessoas em 32 cidades - Agência de Notícias da Indústria Cine Sesi tem 2º maior público do ano em Bonito com 4,9 mil pessoas - Agência de Notícias da Indústria Fazenda eleva para 4,5% estimativa de inflação com guerra e petróleo - A Gazeta News GIRO FUNTRAB DE NOTÍCIAS – 03/06/2025 a 16/06/2025 - funtrab.ms.gov.br Estão abertas inscrições para cursos gratuitos de beleza, gastronomia, moda, informática em MS; confira lista - G1 Funtrab expande a emissão de Carteira de Trabalho no MS - funtrab.ms.gov.br Empregos - Hora Campinas Jornal A Gazeta – Edição de 12 de maio de 2026 - A Gazeta News Prefeitura de Iguatemi MS abre processo seletivo com 17 vagas em Assistência Social - Folha Dirigida Dos 14 aos 24 anos: processo seletivo para jovem aprendiz tem 42 vagas - Primeira Página Polícia Civil inaugura a 52ª Sala Lilás do MS em Aparecida do Taboado - Costa Leste News Iguatemi é 1º lugar no estado e conquista nota A no tesouro nacional pelo segundo ano consecutivo - A Gazeta News Polícia Civil inaugura a 53ª Sala Lilás do MS, em Japorã - sejusp.ms.gov.br Festival de Dança Coreografada da Melhor Idade define campeões  fundesporte.ms.gov.br Fim de semana de Páscoa em Fortaleza tem shows, caça aos ovos, cinema e mais; confira a agenda  G1 Cine Sesi Cultural finaliza 3ª etapa com 101,6 mil pessoas em 32 cidades  Agência de Notícias da Indústria Cine Sesi tem 2º maior público do ano em Bonito com 4,9 mil pessoas  Agência de Notícias da Indústria Fazenda eleva para 4,5% estimativa de inflação com guerra e petróleo  A Gazeta News GIRO FUNTRAB DE NOTÍCIAS – 03/06/2025 a 16/06/2025  funtrab.ms.gov.br Estão abertas inscrições para cursos gratuitos de beleza, gastronomia, moda, informática em MS; confira lista  G1 Funtrab expande a emissão de Carteira de Trabalho no MS  funtrab.ms.gov.br Empregos  Hora Campinas Jornal A Gazeta – Edição de 12 de maio de 2026  A Gazeta News Prefeitura de Iguatemi MS abre processo seletivo com 17 vagas em Assistência Social  Folha Dirigida Dos 14 aos 24 anos: processo seletivo para jovem aprendiz tem 42 vagas  Primeira Página Polícia Civil inaugura a 52ª Sala Lilás do MS em Aparecida do Taboado  Costa Leste News Iguatemi é 1º lugar no estado e conquista nota A no tesouro nacional pelo segundo ano consecutivo  A Gazeta News Polícia Civil inaugura a 53ª Sala Lilás do MS, em Japorã  sejusp.ms.gov.br"
Itaporã,13,"itaporã, notícias, agência, indústria, cultural","Caracol celebrou 61 anos com entregas de casas, lançamentos de obras e agenda cultural - Portal Único ms.gov.br Neno Razuk investe mais de R$ 5 milhões em emendas e transforma municípios de MS - Assembleia Legislativa de Mato Grosso do Sul - Cine Sesi Cultural finaliza 3ª etapa com 101,6 mil pessoas em 32 cidades - Agência de Notícias da Indústria Projeto Artesania fomenta cultura e geração de renda no interior por meio do artesanato - Portal Único ms.gov.br Cine Sesi tem 2º maior público do ano em Bonito com 4,9 mil pessoas - Agência de Notícias da Indústria GIRO FUNTRAB DE NOTÍCIAS – 25/11/2024 a 02/12/2024 - funtrab.ms.gov.br Abertas vagas para estágio no IEL! São 2,3 mil oportunidades em diversos cursos - Agência de Notícias da Indústria Secretaria de Educação-MS abre 415 vagas para Assistente de Atividades Educacionais - Ache Concursos Pacco assina convênio para revitalização do Calçadão Frei Paulino - Prefeitura de Itaporã - MS Prefeito de Itaporã participa de encontro ""Progressistas em Movimento"" em João Pessoa - Prefeitura de Itaporã - MS Senadora Soraya garante bicicletas elétricas e muda rotina de agentes de saúde em Itaporã - MS Todo dia Com 5,8 mil casos e 12 mortes, três cidades de MS decretam emergência por chikungunya - Midiamax Governo desapropria área para ampliar anel viário de Itaporã - Campo Grande News Caracol celebrou 61 anos com entregas de casas, lançamentos de obras e agenda cultural  Portal Único ms.gov.br Neno Razuk investe mais de R$ 5 milhões em emendas e transforma municípios de MS  Assembleia Legislativa de Mato Grosso do Sul - Cine Sesi Cultural finaliza 3ª etapa com 101,6 mil pessoas em 32 cidades  Agência de Notícias da Indústria Projeto Artesania fomenta cultura e geração de renda no interior por meio do artesanato  Portal Único ms.gov.br Cine Sesi tem 2º maior público do ano em Bonito com 4,9 mil pessoas  Agência de Notícias da Indústria GIRO FUNTRAB DE NOTÍCIAS – 25/11/2024 a 02/12/2024  funtrab.ms.gov.br Abertas vagas para estágio no IEL! São 2,3 mil oportunidades em diversos cursos  Agência de Notícias da Indústria Secretaria de Educação-MS abre 415 vagas para Assistente de Atividades Educacionais  Ache Concursos Pacco assina convênio para revitalização do Calçadão Frei Paulino  Prefeitura de Itaporã - MS Prefeito de Itaporã participa de encontro ""Progressistas em Movimento"" em João Pessoa  Prefeitura de Itaporã - MS Senadora Soraya garante bicicletas elétricas e muda rotina de agentes de saúde em Itaporã  MS Todo dia Com 5,8 mil casos e 12 mortes, três cidades de MS decretam emergência por chikungunya  Midiamax Governo desapropria área para ampliar anel viário de Itaporã  Campo Grande News"
Itaquiraí,14,"notícias, vagas, municípios, agência, indústria","Festival de Dança Coreografada da Melhor Idade define campeões - fundesporte.ms.gov.br Neno Razuk investe mais de R$ 5 milhões em emendas e transforma municípios de MS - Assembleia Legislativa de Mato Grosso do Sul - Cine Sesi Cultural finaliza 3ª etapa com 101,6 mil pessoas em 32 cidades - Agência de Notícias da Indústria Cine Sesi tem 2º maior público do ano em Bonito com 4,9 mil pessoas - Agência de Notícias da Indústria GIRO FUNTRAB DE NOTÍCIAS – 03/06/2025 a 16/06/2025 - funtrab.ms.gov.br Acabou a desculpa! Concessionárias de rodovias abrem vagas em vários estados - Estradas Instituto PROA oferece 750 vagas gratuitas para jovens conquistarem o primeiro emprego no Estado - funtrab.ms.gov.br Assentadas de Itaquiraí (MS) recebem créditos e CCUs durante mutirão de documentação — Incra - GOV.BR SED anuncia 30 finalistas do Prêmio Escolas Destaque 2025 do Programa MS Alfabetiza - sed.ms.gov.br Vereadores querem obrigar Prefeitura de Itaquiraí a custear exames na rede privada - Midiamax Naviraí receberá o Governo do Estado e prefeitos de 6 municípios na 4ª etapa do MS Ativo - navirai.ms.gov.br Polícia Civil inaugura a 52ª Sala Lilás do MS em Aparecida do Taboado - Costa Leste News Festival de Dança Coreografada da Melhor Idade define campeões  fundesporte.ms.gov.br Neno Razuk investe mais de R$ 5 milhões em emendas e transforma municípios de MS  Assembleia Legislativa de Mato Grosso do Sul - Cine Sesi Cultural finaliza 3ª etapa com 101,6 mil pessoas em 32 cidades  Agência de Notícias da Indústria Cine Sesi tem 2º maior público do ano em Bonito com 4,9 mil pessoas  Agência de Notícias da Indústria GIRO FUNTRAB DE NOTÍCIAS – 03/06/2025 a 16/06/2025  funtrab.ms.gov.br Acabou a desculpa! Concessionárias de rodovias abrem vagas em vários estados  Estradas Instituto PROA oferece 750 vagas gratuitas para jovens conquistarem o primeiro emprego no Estado  funtrab.ms.gov.br Assentadas de Itaquiraí (MS) recebem créditos e CCUs durante mutirão de documentação — Incra  GOV.BR SED anuncia 30 finalistas do Prêmio Escolas Destaque 2025 do Programa MS Alfabetiza  sed.ms.gov.br Vereadores querem obrigar Prefeitura de Itaquiraí a custear exames na rede privada  Midiamax Naviraí receberá o Governo do Estado e prefeitos de 6 municípios na 4ª etapa do MS Ativo  navirai.ms.gov.br Polícia Civil inaugura a 52ª Sala Lilás do MS em Aparecida do Taboado  Costa Leste News"
Ivinhema,12,"news, bioenergia, vagas, ivinhema, portal","Projeto Artesania fomenta cultura e geração de renda no interior por meio do artesanato - Portal Único ms.gov.br Com participação de competidores do MS e do PR, Open de tiro foi sucesso em Amambai - A Gazeta News Bioenergia: rodada de empregabilidade oferece mais de 630 vagas em 15 municípios de MS - Portal Único ms.gov.br GIRO FUNTRAB DE NOTÍCIAS – 03/06/2025 a 16/06/2025 - funtrab.ms.gov.br Setor de bioenergia oferece 630 vagas de emprego em 15 cidades de MS - - Folha de Campo Grande - Rodada de Empregabilidade mostra a diversidade de profissões que movem o setor de Bioenergia em MS - Cana Online SENAR Abre inscrições para Curso Técnico em Agronegócio EAD: Sua Carreira no Agro Começa Aqui! - PEBSP Renato Câmara cumpre agenda em Ivinhema com entrega na Escola Angelina Jaime Tebet - Assembleia Legislativa de Mato Grosso do Sul - Cirurgia irregular no SUS: MP investiga hospital em Ivinhema - Campo Grande News Prefeitura de Batayporã MS abre processo seletivo com 4 vagas - Folha Dirigida Ivinhema decreta estado de calamidade após registrar maior volume de chuvas do Brasil - Midiamax Polícia Civil inaugura a 52ª Sala Lilás do MS em Aparecida do Taboado - Costa Leste News Projeto Artesania fomenta cultura e geração de renda no interior por meio do artesanato  Portal Único ms.gov.br Com participação de competidores do MS e do PR, Open de tiro foi sucesso em Amambai  A Gazeta News Bioenergia: rodada de empregabilidade oferece mais de 630 vagas em 15 municípios de MS  Portal Único ms.gov.br GIRO FUNTRAB DE NOTÍCIAS – 03/06/2025 a 16/06/2025  funtrab.ms.gov.br Setor de bioenergia oferece 630 vagas de emprego em 15 cidades de MS -  Folha de Campo Grande - Rodada de Empregabilidade mostra a diversidade de profissões que movem o setor de Bioenergia em MS  Cana Online SENAR Abre inscrições para Curso Técnico em Agronegócio EAD: Sua Carreira no Agro Começa Aqui! PEBSP Renato Câmara cumpre agenda em Ivinhema com entrega na Escola Angelina Jaime Tebet  Assembleia Legislativa de Mato Grosso do Sul - Cirurgia irregular no SUS: MP investiga hospital em Ivinhema  Campo Grande News Prefeitura de Batayporã MS abre processo seletivo com 4 vagas  Folha Dirigida Ivinhema decreta estado de calamidade após registrar maior volume de chuvas do Brasil  Midiamax Polícia Civil inaugura a 52ª Sala Lilás do MS em Aparecida do Taboado  Costa Leste News"
Jardim,15,"campo, grande, abre, jardim, semana","Agendão cultural: fim de semana tem festival gastronômico, observação astronômica, feiras e atrações culturais em MS - pontaporaemdia.com.br Governo licita obras de CEUs da Cultura em quatro cidades e fortalece acesso à arte, educação e cidadania - Portal Único ms.gov.br Do vinhedo paulista às águas termais goianas: as 6 cidades do interior para viver bem no Brasil - Revista Oeste Tradição, aventura e cultura: Confira o roteiro de eventos que agitam o Brasil no mês de Setembro - GOV.BR Semana S terá Michel Teló, palestras e ações gratuitas em Campo Grande e no interior - A Crítica de Campo Grande IFMS abre vagas na graduação para portador de diploma, transferência e reingresso - Correio de Corumbá Classificados do Edimilson: veja as vagas de emprego da semana de 23 a 27 de março - G1 IFMS abre 480 vagas para curso preparatório gratuito com bolsa de R$ 200 - Campo Grande News Oferta inédita no IFMS abre curso de informática para mulheres - Correio de Corumbá Ministério Público do MS abre concurso para promotor com salário de R$ 33,9 mil - Portal Notícias Goiás Yuri pede e Estado faz convênio de R$ 9,5 milhões para asfaltar Jardim Pelicano e Carisma - Dourados News Dona de casa viaja 212 km para participar do Mutirão Todos em Ação – CGNotícias - campogrande.ms.gov.br Jamilson Name solicita troca de lâmpadas no Jardim Noroeste, em Campo Grande - Assembleia Legislativa de Mato Grosso do Sul - De saúde a lazer, mutirão leva mais de 300 serviços gratuitos ao Jardim Anache - Midiamax Sábado tem Mutirão Todos em Ação no Jardim Anache – CGNotícias - campogrande.ms.gov.br Agendão cultural: fim de semana tem festival gastronômico, observação astronômica, feiras e atrações culturais em MS  pontaporaemdia.com.br Governo licita obras de CEUs da Cultura em quatro cidades e fortalece acesso à arte, educação e cidadania  Portal Único ms.gov.br Do vinhedo paulista às águas termais goianas: as 6 cidades do interior para viver bem no Brasil  Revista Oeste Tradição, aventura e cultura: Confira o roteiro de eventos que agitam o Brasil no mês de Setembro  GOV.BR Semana S terá Michel Teló, palestras e ações gratuitas em Campo Grande e no interior  A Crítica de Campo Grande IFMS abre vagas na graduação para portador de diploma, transferência e reingresso  Correio de Corumbá Classificados do Edimilson: veja as vagas de emprego da semana de 23 a 27 de março  G1 IFMS abre 480 vagas para curso preparatório gratuito com bolsa de R$ 200  Campo Grande News Oferta inédita no IFMS abre curso de informática para mulheres  Correio de Corumbá Ministério Público do MS abre concurso para promotor com salário de R$ 33,9 mil  Portal Notícias Goiás Yuri pede e Estado faz convênio de R$ 9,5 milhões para asfaltar Jardim Pelicano e Carisma  Dourados News Dona de casa viaja 212 km para participar do Mutirão Todos em Ação – CGNotícias  campogrande.ms.gov.br Jamilson Name solicita troca de lâmpadas no Jardim Noroeste, em Campo Grande  Assembleia Legislativa de Mato Grosso do Sul - De saúde a lazer, mutirão leva mais de 300 serviços gratuitos ao Jardim Anache  Midiamax Sábado tem Mutirão Todos em Ação no Jardim Anache – CGNotícias  campogrande.ms.gov.br"
Ladário,15,"ladário, news, mato, vagas, moinho","Moinho Cultural recebe premiação em São Paulo durante noite de gala da BrazilFoundation - Diário MS News Junho chega trazendo as festas de São João e outros eventos por todo o país — Ministério do Turismo - GOV.BR Neno Razuk investe mais de R$ 5 milhões em emendas e transforma municípios de MS - Assembleia Legislativa de Mato Grosso do Sul - Parceria entre Governo de MS e Marinha possibilita pesquisa, atendimento médico e combate a incêndios - Portal Único ms.gov.br Moinho Cultural sai em turnê por Mato Grosso do Sul com o espetáculo Guadakan - fundacaodecultura.ms.gov.br IFMS abre inscrições para curso que amplia acesso ao ensino médio técnico - Correio de Corumbá IFMS abre 480 vagas para curso preparatório gratuito com bolsa de R$ 200 - Campo Grande News Instituto PROA oferece 750 vagas gratuitas para jovens conquistarem o primeiro emprego no Estado - funtrab.ms.gov.br SEST SENAT analisa cenário dos cursos técnicos e elenca iniciativas pela qualificação profissional - Confederação Nacional do Transporte - CNT Procurando estágio? IEL tem mais de 1,7 mil vagas pelo Brasil, com bolsa de até R$ 2 mil - Agência de Notícias da Indústria MP manda Ladário cancelar contrato com empresa do irmão do vice-prefeito - Jornal O sul-mato-grossense Maio Amarelo: passeio ciclístico reúne famílias e promove conscientização no trânsito em Ladário - Correio de Corumbá MPMS manda Prefeitura de Ladário cancelar contrato com empresa ligada ao vice-prefeito - Folha MS Prefeitura de Ladário pagará R$ 1,1 milhão para colocar secretarias em contêineres - Midiamax Polícia Civil inaugura a 52ª Sala Lilás do MS em Aparecida do Taboado - Costa Leste News Moinho Cultural recebe premiação em São Paulo durante noite de gala da BrazilFoundation  Diário MS News Junho chega trazendo as festas de São João e outros eventos por todo o país — Ministério do Turismo  GOV.BR Neno Razuk investe mais de R$ 5 milhões em emendas e transforma municípios de MS  Assembleia Legislativa de Mato Grosso do Sul - Parceria entre Governo de MS e Marinha possibilita pesquisa, atendimento médico e combate a incêndios  Portal Único ms.gov.br Moinho Cultural sai em turnê por Mato Grosso do Sul com o espetáculo Guadakan  fundacaodecultura.ms.gov.br IFMS abre inscrições para curso que amplia acesso ao ensino médio técnico  Correio de Corumbá IFMS abre 480 vagas para curso preparatório gratuito com bolsa de R$ 200  Campo Grande News Instituto PROA oferece 750 vagas gratuitas para jovens conquistarem o primeiro emprego no Estado  funtrab.ms.gov.br SEST SENAT analisa cenário dos cursos técnicos e elenca iniciativas pela qualificação profissional  Confederação Nacional do Transporte - CNT Procurando estágio? IEL tem mais de 1,7 mil vagas pelo Brasil, com bolsa de até R$ 2 mil  Agência de Notícias da Indústria MP manda Ladário cancelar contrato com empresa do irmão do vice-prefeito  Jornal O sul-mato-grossense Maio Amarelo: passeio ciclístico reúne famílias e promove conscientização no trânsito em Ladário  Correio de Corumbá MPMS manda Prefeitura de Ladário cancelar contrato com empresa ligada ao vice-prefeito  Folha MS Prefeitura de Ladário pagará R$ 1,1 milhão para colocar secretarias em contêineres  Midiamax Polícia Civil inaugura a 52ª Sala Lilás do MS em Aparecida do Taboado  Costa Leste News"
Miranda,15,"miranda, corumbá, culturais, secretário, marcelo","Perifeirarte leva formação e mobilização comunitária a Porto Murtinho com programação integrada e atividades culturais - Radio Quarteto Entrevista com o ex-secretário Marcelo Miranda, Jornal da Top - Diário MS News Edital do FIC 2024 destina R$ 8 milhões para projetos culturais de pessoas físicas - Portal Único ms.gov.br Governo de MS garante repasse de R$ 1,32 milhão para o carnaval de Corumbá 2025 - agenciadenoticias.ms.gov.br Ex-diretor-presidente da Fundesporte, Marcelo Miranda é empossado secretário de Turismo, Esporte, Cultura e Cidadania - fundesporte.ms.gov.br Com educação profissional e qualificação, MS é beneficiado com melhores oportunidades de emprego - agenciadenoticias.ms.gov.br GIRO FUNTRAB DE NOTÍCIAS – 03/06/2025 a 16/06/2025 - funtrab.ms.gov.br Petrobras abre 715 vagas no Programa Jovem Aprendiz 2025: veja salário e benefícios - Seu Dinheiro Governo de MS oferece cursos de qualificação na área de economia criativa a partir de agosto - Portal Único ms.gov.br Corpo de Bombeiros divulga novo resultado da seleção para bombeiros temporários - Midiamax Dona de casa viaja 212 km para participar do Mutirão Todos em Ação – CGNotícias - campogrande.ms.gov.br Samyr cobra recuperação da sinalização da BR – 262, entre Corumbá e Miranda - Correio de Corumbá Falece Dr Nelson Kawamura, médico em diversas cidades do MS - O Pantaneiro Polícia Civil inaugura a 52ª Sala Lilás do MS em Aparecida do Taboado - Costa Leste News Três Lagoas debateu desafios e avanços na saúde do trabalhador em Conferência Municipal - Prefeitura Três Lagoas Perifeirarte leva formação e mobilização comunitária a Porto Murtinho com programação integrada e atividades culturais  Radio Quarteto Entrevista com o ex-secretário Marcelo Miranda, Jornal da Top  Diário MS News Edital do FIC 2024 destina R$ 8 milhões para projetos culturais de pessoas físicas  Portal Único ms.gov.br Governo de MS garante repasse de R$ 1,32 milhão para o carnaval de Corumbá 2025  agenciadenoticias.ms.gov.br Ex-diretor-presidente da Fundesporte, Marcelo Miranda é empossado secretário de Turismo, Esporte, Cultura e Cidadania  fundesporte.ms.gov.br Com educação profissional e qualificação, MS é beneficiado com melhores oportunidades de emprego  agenciadenoticias.ms.gov.br GIRO FUNTRAB DE NOTÍCIAS – 03/06/2025 a 16/06/2025  funtrab.ms.gov.br Petrobras abre 715 vagas no Programa Jovem Aprendiz 2025: veja salário e benefícios  Seu Dinheiro Governo de MS oferece cursos de qualificação na área de economia criativa a partir de agosto  Portal Único ms.gov.br Corpo de Bombeiros divulga novo resultado da seleção para bombeiros temporários  Midiamax Dona de casa viaja 212 km para participar do Mutirão Todos em Ação – CGNotícias  campogrande.ms.gov.br Samyr cobra recuperação da sinalização da BR – 262, entre Corumbá e Miranda  Correio de Corumbá Falece Dr Nelson Kawamura, médico em diversas cidades do MS  O Pantaneiro Polícia Civil inaugura a 52ª Sala Lilás do MS em Aparecida do Taboado  Costa Leste News Três Lagoas debateu desafios e avanços na saúde do trabalhador em Conferência Municipal  Prefeitura Três Lagoas"
