municipio,qtd_noticias_encontradas,temas_frequentes,resumo_para_slide
Glória de Dourados,15,"funtrab, melhor, glória, dourados, idade","As 10 cidades com melhor qualidade de vida de MS; Campo Grande lidera ranking estadual - G1 Festival de Dança Coreografada da Melhor Idade define campeões - fundesporte.ms.gov.br Cresce 24% o número de brasileiros migrando para essa cidade universitária de alto padrão perto do Paraguai nos últimos 12 anos - Correio Braziliense Três Lagoas encerra Jogos da Melhor Idade com participação de 48 municípios de Mato Grosso do Sul - Perfil - Perfil News Três Lagoas recebe mais de 700 atletas na abertura dos Jogos da Melhor Idade - Prefeitura Três Lagoas IFMS oferece cursos técnicos gratuitos; saiba como participar - Correio do Estado Educação que transforma: 100% dos municípios de Mato Grosso do Sul contam com ensino profissionalizante - sed.ms.gov.br GIRO FUNTRAB DE NOTÍCIAS – 03/06/2025 a 16/06/2025 - funtrab.ms.gov.br Quer se qualificar de graça? Funtrab abre cursos gratuitos em MS com o Senac - funtrab.ms.gov.br Mais de 1.400 vagas gratuitas em cursos de qualificação estão com inscrições abertas em MS - funtrab.ms.gov.br TCE-MS participa de lançamento de Programa de Compliance em Glória de Dourados - TCE-MS Glória de Dourados adia licitação após arquitetos questionarem exclusividade de obras para engenheiros - Midiamax MPMS fiscaliza transporte escolar em Glória de Dourados e cobra regularização de vistorias e segurança veicular - MPMS Polícia Civil inaugura a 53ª Sala Lilás do MS, em Japorã - sejusp.ms.gov.br Glória de Dourados abre seleção para cadastro reserva de professores em 2026 - Folha Dirigida As 10 cidades com melhor qualidade de vida de MS; Campo Grande lidera ranking estadual  G1 Festival de Dança Coreografada da Melhor Idade define campeões  fundesporte.ms.gov.br Cresce 24% o número de brasileiros migrando para essa cidade universitária de alto padrão perto do Paraguai nos últimos 12 anos  Correio Braziliense Três Lagoas encerra Jogos da Melhor Idade com participação de 48 municípios de Mato Grosso do Sul - Perfil  Perfil News Três Lagoas recebe mais de 700 atletas na abertura dos Jogos da Melhor Idade  Prefeitura Três Lagoas IFMS oferece cursos técnicos gratuitos; saiba como participar  Correio do Estado Educação que transforma: 100% dos municípios de Mato Grosso do Sul contam com ensino profissionalizante  sed.ms.gov.br GIRO FUNTRAB DE NOTÍCIAS – 03/06/2025 a 16/06/2025  funtrab.ms.gov.br Quer se qualificar de graça? Funtrab abre cursos gratuitos em MS com o Senac  funtrab.ms.gov.br Mais de 1.400 vagas gratuitas em cursos de qualificação estão com inscrições abertas em MS  funtrab.ms.gov.br TCE-MS participa de lançamento de Programa de Compliance em Glória de Dourados  TCE-MS Glória de Dourados adia licitação após arquitetos questionarem exclusividade de obras para engenheiros  Midiamax MPMS fiscaliza transporte escolar em Glória de Dourados e cobra regularização de vistorias e segurança veicular  MPMS Polícia Civil inaugura a 53ª Sala Lilás do MS, em Japorã  sejusp.ms.gov.br Glória de Dourados abre seleção para cadastro reserva de professores em 2026  Folha Dirigida"
Iguatemi,11,"funtrab, iguatemi, processo, seletivo, abre","Festival de Dança Coreografada da Melhor Idade define campeões - fundesporte.ms.gov.br Cine Sesi tem 2º maior público do ano em Bonito com 4,9 mil pessoas - Agência de Notícias da Indústria MS: BPMRv apreende 1,2 tonelada de drogas e causa prejuízo de R$ 2,7 milhões ao crime - A Gazeta News Funtrab, Senac e parceiros realizam curso de Depilação em Cera para participantes do Programa Mais Social em Iguatemi - funtrab.ms.gov.br GIRO FUNTRAB DE NOTÍCIAS – 03/06/2025 a 16/06/2025 - funtrab.ms.gov.br Funtrab abre processo seletivo para engenheiro civil - funtrab.ms.gov.br Polícia Civil inaugura a 53ª Sala Lilás do MS, em Japorã - sejusp.ms.gov.br Prefeitura de Iguatemi MS abre processo seletivo com 17 vagas em Assistência Social - Folha Dirigida Secretaria de Saúde de Iguatemi terá sala com tomógrafo para exames da população iguatemiense e de toda a região - A Gazeta News Prefeitura de Iguatemi abre processo seletivo com 27 vagas - Midiamax Dos 14 aos 24 anos: processo seletivo para jovem aprendiz tem 42 vagas - Primeira Página Festival de Dança Coreografada da Melhor Idade define campeões  fundesporte.ms.gov.br Cine Sesi tem 2º maior público do ano em Bonito com 4,9 mil pessoas  Agência de Notícias da Indústria MS: BPMRv apreende 1,2 tonelada de drogas e causa prejuízo de R$ 2,7 milhões ao crime  A Gazeta News Funtrab, Senac e parceiros realizam curso de Depilação em Cera para participantes do Programa Mais Social em Iguatemi  funtrab.ms.gov.br GIRO FUNTRAB DE NOTÍCIAS – 03/06/2025 a 16/06/2025  funtrab.ms.gov.br Funtrab abre processo seletivo para engenheiro civil  funtrab.ms.gov.br Polícia Civil inaugura a 53ª Sala Lilás do MS, em Japorã  sejusp.ms.gov.br Prefeitura de Iguatemi MS abre processo seletivo com 17 vagas em Assistência Social  Folha Dirigida Secretaria de Saúde de Iguatemi terá sala com tomógrafo para exames da população iguatemiense e de toda a região  A Gazeta News Prefeitura de Iguatemi abre processo seletivo com 27 vagas  Midiamax Dos 14 aos 24 anos: processo seletivo para jovem aprendiz tem 42 vagas  Primeira Página"
Itaporã,11,"itaporã, funtrab, cidade, universitária, atrai","A cidade universitária que atrai famílias em busca de tranquilidade - Correio Braziliense Neno Razuk investe mais de R$ 5 milhões em emendas e transforma municípios de MS - Assembleia Legislativa de Mato Grosso do Sul - Projeto Artesania fomenta cultura e geração de renda no interior por meio do artesanato - fundacaodecultura.ms.gov.br Cine Sesi tem 2º maior público do ano em Bonito com 4,9 mil pessoas - Agência de Notícias da Indústria Coca-Cola FEMSA Brasil em parceria com Funtrab e Semadesc oferecem capacitação gratuita para empreendedoras no Estado - funtrab.ms.gov.br Galeria: Casa do Trabalhador de Ribas do Rio Pardo recebe as orientações - funtrab.ms.gov.br Prefeito de Itaporã participa de encontro ""Progressistas em Movimento"" em João Pessoa - Prefeitura de Itaporã - MS Senadora Soraya garante bicicletas elétricas e muda rotina de agentes de saúde em Itaporã - MS Todo dia Com 5,8 mil casos e 12 mortes, três cidades de MS decretam emergência por chikungunya - Midiamax Governo desapropria área para ampliar anel viário de Itaporã - Campo Grande News Fraudes em licitações: secretário de Corumbá é preso em operação - G1 A cidade universitária que atrai famílias em busca de tranquilidade  Correio Braziliense Neno Razuk investe mais de R$ 5 milhões em emendas e transforma municípios de MS  Assembleia Legislativa de Mato Grosso do Sul - Projeto Artesania fomenta cultura e geração de renda no interior por meio do artesanato  fundacaodecultura.ms.gov.br Cine Sesi tem 2º maior público do ano em Bonito com 4,9 mil pessoas  Agência de Notícias da Indústria Coca-Cola FEMSA Brasil em parceria com Funtrab e Semadesc oferecem capacitação gratuita para empreendedoras no Estado  funtrab.ms.gov.br Galeria: Casa do Trabalhador de Ribas do Rio Pardo recebe as orientações  funtrab.ms.gov.br Prefeito de Itaporã participa de encontro ""Progressistas em Movimento"" em João Pessoa  Prefeitura de Itaporã - MS Senadora Soraya garante bicicletas elétricas e muda rotina de agentes de saúde em Itaporã  MS Todo dia Com 5,8 mil casos e 12 mortes, três cidades de MS decretam emergência por chikungunya  Midiamax Governo desapropria área para ampliar anel viário de Itaporã  Campo Grande News Fraudes em licitações: secretário de Corumbá é preso em operação  G1"
Itaquiraí,13,"funtrab, news, itaquiraí, municípios, notícias","Festival de Dança Coreografada da Melhor Idade define campeões - fundesporte.ms.gov.br Neno Razuk investe mais de R$ 5 milhões em emendas e transforma municípios de MS - Assembleia Legislativa de Mato Grosso do Sul - Cine Sesi tem 2º maior público do ano em Bonito com 4,9 mil pessoas - Agência de Notícias da Indústria GIRO FUNTRAB DE NOTÍCIAS – 03/06/2025 a 16/06/2025 - funtrab.ms.gov.br CCR MSVia está com 30 vagas de trabalho abertas em municípios de MS - Motiva Rodovias Quer trabalhar? Concessionárias de rodovias abrem vagas em vários estados - Estradas Inscrições abertas para o curso de Vendedor - funtrab.ms.gov.br Na Capital, EJA é ofertado em 16 escolas e na modalidade à distância; veja lista - Campo Grande News Assentadas de Itaquiraí (MS) recebem créditos e CCUs durante mutirão de documentação — Incra - www.gov.br SED anuncia 30 finalistas do Prêmio Escolas Destaque 2025 do Programa MS Alfabetiza - sed.ms.gov.br Vereadores querem obrigar Prefeitura de Itaquiraí a custear exames na rede privada - Midiamax Polícia Civil inaugura a 52ª Sala Lilás do MS em Aparecida do Taboado - Costa Leste News Justiça determina atualização de portais de transparência em Itaquiraí/MS - Campo Grande News Festival de Dança Coreografada da Melhor Idade define campeões  fundesporte.ms.gov.br Neno Razuk investe mais de R$ 5 milhões em emendas e transforma municípios de MS  Assembleia Legislativa de Mato Grosso do Sul - Cine Sesi tem 2º maior público do ano em Bonito com 4,9 mil pessoas  Agência de Notícias da Indústria GIRO FUNTRAB DE NOTÍCIAS – 03/06/2025 a 16/06/2025  funtrab.ms.gov.br CCR MSVia está com 30 vagas de trabalho abertas em municípios de MS  Motiva Rodovias Quer trabalhar? Concessionárias de rodovias abrem vagas em vários estados  Estradas Inscrições abertas para o curso de Vendedor  funtrab.ms.gov.br Na Capital, EJA é ofertado em 16 escolas e na modalidade à distância; veja lista  Campo Grande News Assentadas de Itaquiraí (MS) recebem créditos e CCUs durante mutirão de documentação — Incra  www.gov.br SED anuncia 30 finalistas do Prêmio Escolas Destaque 2025 do Programa MS Alfabetiza  sed.ms.gov.br Vereadores querem obrigar Prefeitura de Itaquiraí a custear exames na rede privada  Midiamax Polícia Civil inaugura a 52ª Sala Lilás do MS em Aparecida do Taboado  Costa Leste News Justiça determina atualização de portais de transparência em Itaquiraí/MS  Campo Grande News"
Ivinhema,11,"vagas, ivinhema, mato, grosso, agenciadenoticias","Agendão: fim de semana vem com Ney Matogrosso, Som da Concha, chegada do Papai Noel, exposições e shows no interior – Agência de Noticias do Governo de Mato Grosso do Sul - agenciadenoticias.ms.gov.br Bioenergia: rodada de empregabilidade oferece mais de 630 vagas em 15 municípios de MS - agenciadenoticias.ms.gov.br GIRO FUNTRAB DE NOTÍCIAS – 03/06/2025 a 16/06/2025 - funtrab.ms.gov.br Setor de bioenergia oferece 630 vagas de emprego em 15 cidades de MS - - Folha de Campo Grande - SENAR Abre inscrições para Curso Técnico em Agronegócio EAD: Sua Carreira no Agro Começa Aqui! - PEBSP Corpo de Bombeiros divulga novo resultado da seleção para bombeiros temporários - Midiamax Renato Câmara cumpre agenda em Ivinhema com entrega na Escola Angelina Jaime Tebet - Assembleia Legislativa de Mato Grosso do Sul - Deputados reconhecem estado de calamidade pública em Ivinhema - Midiamax Prefeitura de Batayporã MS abre processo seletivo com 4 vagas - Folha Dirigida Ivinhema decreta calamidade após chuvas de 120 mm - Campo Grande News Polícia Civil inaugura a 52ª Sala Lilás do MS em Aparecida do Taboado - Costa Leste News Agendão: fim de semana vem com Ney Matogrosso, Som da Concha, chegada do Papai Noel, exposições e shows no interior – Agência de Noticias do Governo de Mato Grosso do Sul  agenciadenoticias.ms.gov.br Bioenergia: rodada de empregabilidade oferece mais de 630 vagas em 15 municípios de MS  agenciadenoticias.ms.gov.br GIRO FUNTRAB DE NOTÍCIAS – 03/06/2025 a 16/06/2025  funtrab.ms.gov.br Setor de bioenergia oferece 630 vagas de emprego em 15 cidades de MS -  Folha de Campo Grande - SENAR Abre inscrições para Curso Técnico em Agronegócio EAD: Sua Carreira no Agro Começa Aqui! PEBSP Corpo de Bombeiros divulga novo resultado da seleção para bombeiros temporários  Midiamax Renato Câmara cumpre agenda em Ivinhema com entrega na Escola Angelina Jaime Tebet  Assembleia Legislativa de Mato Grosso do Sul - Deputados reconhecem estado de calamidade pública em Ivinhema  Midiamax Prefeitura de Batayporã MS abre processo seletivo com 4 vagas  Folha Dirigida Ivinhema decreta calamidade após chuvas de 120 mm  Campo Grande News Polícia Civil inaugura a 52ª Sala Lilás do MS em Aparecida do Taboado  Costa Leste News"
Jardim,15,"semana, campo, grande, jardim, agendão","Agendão cultural: fim de semana tem festival gastronômico, observação astronômica, feiras e atrações culturais em MS - pontaporaemdia.com.br Agendão cultural: fim de semana tem feira criativa, teatro, astronomia e atrações culturais em MS - ArapuaNews Semana S terá Michel Teló, palestras e ações gratuitas em Campo Grande e no interior - A Crítica de Campo Grande Agendão: Jazz, shows gratuitos e programação de Natal movimentam fim de semana - agenciadenoticias.ms.gov.br Tradição, aventura e cultura: Confira o roteiro de eventos que agitam o Brasil no mês de Setembro - www.gov.br CIEE oferece 107 vagas de estágio no Mato Grosso do Sul - Correio de Corumbá Vitória recebe maior evento de reciclagem do ES e SESI Campinas sedia festival de cinema ambiental - Agência de Notícias da Indústria IFMS abre 480 vagas para curso preparatório gratuito com bolsa de R$ 200 - Campo Grande News GIRO FUNTRAB DE NOTÍCIAS – 03/06/2025 a 16/06/2025 - funtrab.ms.gov.br Corpo de Bombeiros divulga novo resultado da seleção para bombeiros temporários - Midiamax MONA Serra do Bom Jardim celebra 23 anos de preservação ambiental e valorização histórica em Alcinópolis - MS Todo dia Yuri Pede E Estado Faz Convênio De R$ 9,5 Milhões Para Asfaltar Jardim Pelicano E Carisma - Folha do MS Dona de casa viaja 212 km para participar do Mutirão Todos em Ação – CGNotícias - campogrande.ms.gov.br Jamilson Name solicita troca de lâmpadas no Jardim Noroeste, em Campo Grande - Assembleia Legislativa de Mato Grosso do Sul - Sábado tem Mutirão Todos em Ação no Jardim Anache – CGNotícias - campogrande.ms.gov.br Agendão cultural: fim de semana tem festival gastronômico, observação astronômica, feiras e atrações culturais em MS  pontaporaemdia.com.br Agendão cultural: fim de semana tem feira criativa, teatro, astronomia e atrações culturais em MS  ArapuaNews Semana S terá Michel Teló, palestras e ações gratuitas em Campo Grande e no interior  A Crítica de Campo Grande Agendão: Jazz, shows gratuitos e programação de Natal movimentam fim de semana  agenciadenoticias.ms.gov.br Tradição, aventura e cultura: Confira o roteiro de eventos que agitam o Brasil no mês de Setembro  www.gov.br CIEE oferece 107 vagas de estágio no Mato Grosso do Sul  Correio de Corumbá Vitória recebe maior evento de reciclagem do ES e SESI Campinas sedia festival de cinema ambiental  Agência de Notícias da Indústria IFMS abre 480 vagas para curso preparatório gratuito com bolsa de R$ 200  Campo Grande News GIRO FUNTRAB DE NOTÍCIAS – 03/06/2025 a 16/06/2025  funtrab.ms.gov.br Corpo de Bombeiros divulga novo resultado da seleção para bombeiros temporários  Midiamax MONA Serra do Bom Jardim celebra 23 anos de preservação ambiental e valorização histórica em Alcinópolis  MS Todo dia Yuri Pede E Estado Faz Convênio De R$ 9,5 Milhões Para Asfaltar Jardim Pelicano E Carisma  Folha do MS Dona de casa viaja 212 km para participar do Mutirão Todos em Ação – CGNotícias  campogrande.ms.gov.br Jamilson Name solicita troca de lâmpadas no Jardim Noroeste, em Campo Grande  Assembleia Legislativa de Mato Grosso do Sul - Sábado tem Mutirão Todos em Ação no Jardim Anache – CGNotícias  campogrande.ms.gov.br"
Ladário,15,"news, curso, prefeitura, ladário, recebe","Moinho Cultural recebe premiação em São Paulo durante noite de gala da BrazilFoundation - Diário MS News Neno Razuk investe mais de R$ 5 milhões em emendas e transforma municípios de MS - Assembleia Legislativa de Mato Grosso do Sul - Agendão: carnaval chega com tudo em MS e toma ruas, feiras e cidades do interior - agenciadenoticias.ms.gov.br Junho chega trazendo as festas de São João e outros eventos por todo o país — Ministério do Turismo - www.gov.br Parceria entre Governo de MS e Marinha possibilita pesquisa, atendimento médico e combate a incêndios - Portal Único ms.gov.br IFMS abre inscrições para curso que amplia acesso ao ensino médio técnico - Correio de Corumbá IFMS abre 480 vagas para curso preparatório gratuito com bolsa de R$ 200 - Campo Grande News Inscrições abertas para o curso de Vendedor - funtrab.ms.gov.br Procurando estágio? IEL tem mais de 1,7 mil vagas pelo Brasil, com bolsa de até R$ 2 mil - Agência de Notícias da Indústria Galeria: Casa do Trabalhador de Ribas do Rio Pardo recebe as orientações - funtrab.ms.gov.br MPMS manda Prefeitura de Ladário cancelar contrato com empresa ligada ao vice-prefeito - Folha MS Maio Amarelo: passeio ciclístico reúne famílias e promove conscientização no trânsito em Ladário - Correio de Corumbá Prefeitura de Ladário pagará R$ 1,1 milhão para colocar secretarias em contêineres - Midiamax 'Mensalinho': Justiça mantém condenações de prefeito, secretários e vereadores por corrupção em prefeitura de MS - G1 Polícia Civil inaugura a 52ª Sala Lilás do MS em Aparecida do Taboado - Costa Leste News Moinho Cultural recebe premiação em São Paulo durante noite de gala da BrazilFoundation  Diário MS News Neno Razuk investe mais de R$ 5 milhões em emendas e transforma municípios de MS  Assembleia Legislativa de Mato Grosso do Sul - Agendão: carnaval chega com tudo em MS e toma ruas, feiras e cidades do interior  agenciadenoticias.ms.gov.br Junho chega trazendo as festas de São João e outros eventos por todo o país — Ministério do Turismo  www.gov.br Parceria entre Governo de MS e Marinha possibilita pesquisa, atendimento médico e combate a incêndios  Portal Único ms.gov.br IFMS abre inscrições para curso que amplia acesso ao ensino médio técnico  Correio de Corumbá IFMS abre 480 vagas para curso preparatório gratuito com bolsa de R$ 200  Campo Grande News Inscrições abertas para o curso de Vendedor  funtrab.ms.gov.br Procurando estágio? IEL tem mais de 1,7 mil vagas pelo Brasil, com bolsa de até R$ 2 mil  Agência de Notícias da Indústria Galeria: Casa do Trabalhador de Ribas do Rio Pardo recebe as orientações  funtrab.ms.gov.br MPMS manda Prefeitura de Ladário cancelar contrato com empresa ligada ao vice-prefeito  Folha MS Maio Amarelo: passeio ciclístico reúne famílias e promove conscientização no trânsito em Ladário  Correio de Corumbá Prefeitura de Ladário pagará R$ 1,1 milhão para colocar secretarias em contêineres  Midiamax 'Mensalinho': Justiça mantém condenações de prefeito, secretários e vereadores por corrupção em prefeitura de MS  G1 Polícia Civil inaugura a 52ª Sala Lilás do MS em Aparecida do Taboado  Costa Leste News"
Miranda,15,"culturais, agenciadenoticias, campo, grande, abre","Perifeirarte leva formação e mobilização comunitária a Porto Murtinho com programação integrada e atividades culturais - Radio Quarteto Governo de Mato Grosso do Sul realiza Festival de Inverno de Bonito 2025 a partir desta quarta-feira - agenciadenoticias.ms.gov.br Campo Grande abre inscrições gratuitas para aulas de danças urbanas na Casa de Cultura - A Crítica de Campo Grande Setesc fortalece apoio à cultura, ao esporte e ao turismo em nova edição do Contrato de Gestão - Fátima em Dia Edital do FIC 2024 destina R$ 8 milhões para projetos culturais de pessoas físicas - Portal Único ms.gov.br Petrobras abre 715 vagas no Programa Jovem Aprendiz 2025: veja salário e benefícios - Seu Dinheiro GIRO FUNTRAB DE NOTÍCIAS – 03/06/2025 a 16/06/2025 - funtrab.ms.gov.br Corpo de Bombeiros divulga novo resultado da seleção para bombeiros temporários - Midiamax Com educação profissional e qualificação, MS é beneficiado com melhores oportunidades de emprego - agenciadenoticias.ms.gov.br Escritório Social da Agepen transforma recomeços e amplia oportunidades para egressos do sistema prisional - Portal Único ms.gov.br Dona de casa viaja 212 km para participar do Mutirão Todos em Ação – CGNotícias - campogrande.ms.gov.br Audiência pública debate demarcação de áreas da União em Aquidauana e Anastácio - O Pantaneiro Samyr cobra recuperação da sinalização da BR – 262, entre Corumbá e Miranda - Correio de Corumbá TRF3 e JFMS abrem a 9ª edição do projeto “Caminho do Acordo”, na Aldeia Cachoeirinha, em Miranda/MS - trf3.jus.br Polícia Civil inaugura a 52ª Sala Lilás do MS, em Aparecida do Taboado - SINPOL-MS Perifeirarte leva formação e mobilização comunitária a Porto Murtinho com programação integrada e atividades culturais  Radio Quarteto Governo de Mato Grosso do Sul realiza Festival de Inverno de Bonito 2025 a partir desta quarta-feira  agenciadenoticias.ms.gov.br Campo Grande abre inscrições gratuitas para aulas de danças urbanas na Casa de Cultura  A Crítica de Campo Grande Setesc fortalece apoio à cultura, ao esporte e ao turismo em nova edição do Contrato de Gestão  Fátima em Dia Edital do FIC 2024 destina R$ 8 milhões para projetos culturais de pessoas físicas  Portal Único ms.gov.br Petrobras abre 715 vagas no Programa Jovem Aprendiz 2025: veja salário e benefícios  Seu Dinheiro GIRO FUNTRAB DE NOTÍCIAS – 03/06/2025 a 16/06/2025  funtrab.ms.gov.br Corpo de Bombeiros divulga novo resultado da seleção para bombeiros temporários  Midiamax Com educação profissional e qualificação, MS é beneficiado com melhores oportunidades de emprego  agenciadenoticias.ms.gov.br Escritório Social da Agepen transforma recomeços e amplia oportunidades para egressos do sistema prisional  Portal Único ms.gov.br Dona de casa viaja 212 km para participar do Mutirão Todos em Ação – CGNotícias  campogrande.ms.gov.br Audiência pública debate demarcação de áreas da União em Aquidauana e Anastácio  O Pantaneiro Samyr cobra recuperação da sinalização da BR – 262, entre Corumbá e Miranda  Correio de Corumbá TRF3 e JFMS abrem a 9ª edição do projeto “Caminho do Acordo”, na Aldeia Cachoeirinha, em Miranda/MS  trf3.jus.br Polícia Civil inaugura a 52ª Sala Lilás do MS, em Aparecida do Taboado  SINPOL-MS"
Mundo Novo,14,"funtrab, vagas, notícias, lazer, agência","Sesc Teatro Prosa oferece semana de arte e lazer gratuito em Campo Grande - capitalnews.com.br Cine Sesi tem 2º maior público do ano em Bonito com 4,9 mil pessoas - Agência de Notícias da Indústria Projeto Artesania fomenta cultura e geração de renda no interior por meio do artesanato - fundacaodecultura.ms.gov.br Encontro de carros antigos transforma Praça São José em ponto de cultura e lazer em Amambai - A Gazeta News GIRO FUNTRAB DE NOTÍCIAS – 03/06/2025 a 16/06/2025 - funtrab.ms.gov.br Acabou a desculpa! SENAI tem mais de 8,3 mil vagas em vários cursos pelo Brasil - Agência de Notícias da Indústria CCR MSVia está com 30 vagas de trabalho abertas em municípios de MS - Motiva Rodovias Funtrab e Biosul anunciam 2ª Rodada de Empregabilidade do Setor de Bioenergia com mais de 630 vagas em 15 municípios de MS - funtrab.ms.gov.br Casa do Trabalhador de Caarapó promove vagas para Jovem Aprendiz em parceria com a Raízen - funtrab.ms.gov.br Visita técnica dá início a parceria com Saltos del Guairá - Prefeitura de São José do Rio Preto Polícia Civil inaugura a 53ª Sala Lilás do MS, em Japorã - sejusp.ms.gov.br Riedel cumpre agenda em três cidades que fazem aniversário nesta quarta-feira - Midiamax Polícia Civil inaugura a 51ª Sala Lilás em Mundo Novo - pc.ms.gov.br Com expansão econômica em Ribas do Rio Pardo, Governo de MS investe em educação e infraestrutura - Portal Único ms.gov.br Sesc Teatro Prosa oferece semana de arte e lazer gratuito em Campo Grande  capitalnews.com.br Cine Sesi tem 2º maior público do ano em Bonito com 4,9 mil pessoas  Agência de Notícias da Indústria Projeto Artesania fomenta cultura e geração de renda no interior por meio do artesanato  fundacaodecultura.ms.gov.br Encontro de carros antigos transforma Praça São José em ponto de cultura e lazer em Amambai  A Gazeta News GIRO FUNTRAB DE NOTÍCIAS – 03/06/2025 a 16/06/2025  funtrab.ms.gov.br Acabou a desculpa! SENAI tem mais de 8,3 mil vagas em vários cursos pelo Brasil  Agência de Notícias da Indústria CCR MSVia está com 30 vagas de trabalho abertas em municípios de MS  Motiva Rodovias Funtrab e Biosul anunciam 2ª Rodada de Empregabilidade do Setor de Bioenergia com mais de 630 vagas em 15 municípios de MS  funtrab.ms.gov.br Casa do Trabalhador de Caarapó promove vagas para Jovem Aprendiz em parceria com a Raízen  funtrab.ms.gov.br Visita técnica dá início a parceria com Saltos del Guairá  Prefeitura de São José do Rio Preto Polícia Civil inaugura a 53ª Sala Lilás do MS, em Japorã  sejusp.ms.gov.br Riedel cumpre agenda em três cidades que fazem aniversário nesta quarta-feira  Midiamax Polícia Civil inaugura a 51ª Sala Lilás em Mundo Novo  pc.ms.gov.br Com expansão econômica em Ribas do Rio Pardo, Governo de MS investe em educação e infraestrutura  Portal Único ms.gov.br"
