municipio,qtd_noticias_encontradas,temas_frequentes,resumo_para_slide
Brasilândia,12,"brasilândia, notícias, funtrab, completa, casa","Cine Sesi tem 2º maior público do ano em Bonito com 4,9 mil pessoas - Agência de Notícias da Indústria Virada Cultural 2025 de SP: veja programação completa do evento, que completa 20 anos - G1 Casa do Trabalhador de Brasilândia anuncia vaga imediata e abre inscrições para cursos de qualificação - funtrab.ms.gov.br Funtrab inaugura Casa do Trabalhador de Brasilândia e amplia acesso a emprego e qualificação profissional - funtrab.ms.gov.br A Suzano, empresa fabricante de bioprodutos desenvolvidos a partir do cultivo de eucalipto, recebe, somente até este domingo (29), inscrições para novas oportunidades de trabalho. As vagas são para três cargos diferentes para atuar nos municípios de Suz - instagram.com Setor de Tecnologia abre mais de 200 mil vagas para cursos de capacitação - IT Forum - IT Forum SENAR Jovem Rural: Programa busca reter talentos no campo e possibilita empregabilidade - cnabrasil.org.br Brasilândia brilha na 18ª Olimpíada Nacional em História do Brasil com três equipes classificadas para a final em Campinas - Notícias em Rede Brasilândia define prioridades para impulsionar desenvolvimento econômico e qualidade de vida até 2028 - Notícias do Cerrado Empreiteira da Capital vai construir creche no Valle Verde II por R$ 3,1 milhões - Midiamax Brasilândia: Processo Seletivo com Salários de até R$ 8,8 mil - Campo Grande News Prefeitura de Brasilândia - MS republica processo seletivo com salários de até R$ 8,8 mil - PCI Concursos Cine Sesi tem 2º maior público do ano em Bonito com 4,9 mil pessoas  Agência de Notícias da Indústria Virada Cultural 2025 de SP: veja programação completa do evento, que completa 20 anos  G1 Casa do Trabalhador de Brasilândia anuncia vaga imediata e abre inscrições para cursos de qualificação  funtrab.ms.gov.br Funtrab inaugura Casa do Trabalhador de Brasilândia e amplia acesso a emprego e qualificação profissional  funtrab.ms.gov.br A Suzano, empresa fabricante de bioprodutos desenvolvidos a partir do cultivo de eucalipto, recebe, somente até este domingo (29), inscrições para novas oportunidades de trabalho. As vagas são para três cargos diferentes para atuar nos municípios de Suz  instagram.com Setor de Tecnologia abre mais de 200 mil vagas para cursos de capacitação - IT Forum  IT Forum SENAR Jovem Rural: Programa busca reter talentos no campo e possibilita empregabilidade  cnabrasil.org.br Brasilândia brilha na 18ª Olimpíada Nacional em História do Brasil com três equipes classificadas para a final em Campinas  Notícias em Rede Brasilândia define prioridades para impulsionar desenvolvimento econômico e qualidade de vida até 2028  Notícias do Cerrado Empreiteira da Capital vai construir creche no Valle Verde II por R$ 3,1 milhões  Midiamax Brasilândia: Processo Seletivo com Salários de até R$ 8,8 mil  Campo Grande News Prefeitura de Brasilândia - MS republica processo seletivo com salários de até R$ 8,8 mil  PCI Concursos"
Caarapó,12,"vagas, caarapó, aprendiz, raízen, agenciadenoticias","Agendão: música sertaneja, Museu do Videogame e feiras agitam o fim de semana - agenciadenoticias.ms.gov.br Cine Sesi tem 2º maior público do ano em Bonito com 4,9 mil pessoas - Agência de Notícias da Indústria Bioenergia: rodada de empregabilidade oferece mais de 630 vagas em 15 municípios de MS - Portal Único ms.gov.br Casa do Trabalhador de Caarapó promove vagas para Jovem Aprendiz em parceria com a Raízen - funtrab.ms.gov.br CCR MSVia está com 30 vagas de trabalho abertas em municípios de MS - Motiva Rodovias Raízen abre mais de 250 vagas para programa de aprendiz - JornalCana Raízen abre mais de 400 vagas para programa de aprendiz - Revista Cultivar MPMS e parceiros inauguram padaria em presídio de Caarapó com recursos de penas pecuniárias e ANPPs - MPMS Câmara de Caarapó devolve à prefeitura R$ 3,7 milhões; dinheiro ajuda erguer hospital e quitar folha do serviço municipal - Midiamax Polícia Civil inaugura a 52ª Sala Lilás do MS em Aparecida do Taboado - Costa Leste News Prefeitura veta próprio projeto que promovia reforma administrativa em Caarapó - Midiamax Para escoamento de produção e acesso urbano, Caarapó apresenta projetos de pavimentação ao MS Ativo - agenciadenoticias.ms.gov.br Agendão: música sertaneja, Museu do Videogame e feiras agitam o fim de semana  agenciadenoticias.ms.gov.br Cine Sesi tem 2º maior público do ano em Bonito com 4,9 mil pessoas  Agência de Notícias da Indústria Bioenergia: rodada de empregabilidade oferece mais de 630 vagas em 15 municípios de MS  Portal Único ms.gov.br Casa do Trabalhador de Caarapó promove vagas para Jovem Aprendiz em parceria com a Raízen  funtrab.ms.gov.br CCR MSVia está com 30 vagas de trabalho abertas em municípios de MS  Motiva Rodovias Raízen abre mais de 250 vagas para programa de aprendiz  JornalCana Raízen abre mais de 400 vagas para programa de aprendiz  Revista Cultivar MPMS e parceiros inauguram padaria em presídio de Caarapó com recursos de penas pecuniárias e ANPPs  MPMS Câmara de Caarapó devolve à prefeitura R$ 3,7 milhões; dinheiro ajuda erguer hospital e quitar folha do serviço municipal  Midiamax Polícia Civil inaugura a 52ª Sala Lilás do MS em Aparecida do Taboado  Costa Leste News Prefeitura veta próprio projeto que promovia reforma administrativa em Caarapó  Midiamax Para escoamento de produção e acesso urbano, Caarapó apresenta projetos de pavimentação ao MS Ativo  agenciadenoticias.ms.gov.br"
Cassilândia,12,"cassilândia, correio, funtrab, notícias, news","Cine Sesi tem 2º maior público do ano em Bonito com 4,9 mil pessoas - Agência de Notícias da Indústria Com presença Bicampeão Paraolímpico Yeltsin Jacques inaugurado o Complexo Esportivo de Chapadão do Sul - O CORREIO NEWS A Câmara Municipal de Salesópolis está com inscrições abertas para um novo concurso público destinado ao preenchimento de duas vagas imediatas e formação de cadastro reserva. Ao todo, o processo seletivo contempla oportunidades para cinco cargos, - instagram.com Funtrab atua na 2ª Feira de Empregabilidade do Grau Técnico com oferta de mais de mil vagas e serviços ao trabalhador - funtrab.ms.gov.br Últimos dias de inscrições para qualificação profissional a distância no IFMS - Correio de Corumbá Funtrab e Biosul anunciam 2ª Rodada de Empregabilidade do Setor de Bioenergia com mais de 630 vagas em 15 municípios de MS - funtrab.ms.gov.br Sine divulga mais de 400 oportunidades de trabalho nesta quinta (21) - pi.gov.br Reunião da Câmara: confira o resumo completo da sessão de 22/06/2026 - Cassilândia Notícias Prefeitura de Cassilândia oficializa implantação do sistema 1DOC para modernizar gestão pública - O CORREIO NEWS Prefeitura de Cassilândia realiza audiência pública para avaliação do Plano Municipal de Educação - MS Todo dia Programa Horário Estendido vai acabar em MS; Secretário garante continuidade em Cassilândia - Cassilândia Notícias Cassilândia adere a programa que poderá garantir até 20% de desconto na conta de energia elétrica - O CORREIO NEWS Cine Sesi tem 2º maior público do ano em Bonito com 4,9 mil pessoas  Agência de Notícias da Indústria Com presença Bicampeão Paraolímpico Yeltsin Jacques inaugurado o Complexo Esportivo de Chapadão do Sul  O CORREIO NEWS A Câmara Municipal de Salesópolis está com inscrições abertas para um novo concurso público destinado ao preenchimento de duas vagas imediatas e formação de cadastro reserva. Ao todo, o processo seletivo contempla oportunidades para cinco cargos,  instagram.com Funtrab atua na 2ª Feira de Empregabilidade do Grau Técnico com oferta de mais de mil vagas e serviços ao trabalhador  funtrab.ms.gov.br Últimos dias de inscrições para qualificação profissional a distância no IFMS  Correio de Corumbá Funtrab e Biosul anunciam 2ª Rodada de Empregabilidade do Setor de Bioenergia com mais de 630 vagas em 15 municípios de MS  funtrab.ms.gov.br Sine divulga mais de 400 oportunidades de trabalho nesta quinta (21)  pi.gov.br Reunião da Câmara: confira o resumo completo da sessão de 22/06/2026  Cassilândia Notícias Prefeitura de Cassilândia oficializa implantação do sistema 1DOC para modernizar gestão pública  O CORREIO NEWS Prefeitura de Cassilândia realiza audiência pública para avaliação do Plano Municipal de Educação  MS Todo dia Programa Horário Estendido vai acabar em MS; Secretário garante continuidade em Cassilândia  Cassilândia Notícias Cassilândia adere a programa que poderá garantir até 20% de desconto na conta de energia elétrica  O CORREIO NEWS"
Chapadão do Sul,15,"chapadão, news, campo, grande, jovem","""Chapadão do Sul será referência em qualidade de vida"", afirma Walter Schlatter - A Crítica de Campo Grande Festival de Dança Coreografada da Melhor Idade define campeões - fundesporte.ms.gov.br As 10 cidades com melhor qualidade de vida de MS; Campo Grande lidera ranking estadual - G1 Festival Gastronômico 2026 de Chapadão do Sul será com com grandes shows e promete a maior festa dos sabores - Jovem Sul News Investimentos impulsionam nova etapa de desenvolvimento em Chapadão do Sul - ArapuaNews Bioenergia: rodada de empregabilidade oferece mais de 630 vagas em 15 municípios de MS - Portal Único ms.gov.br Funtrab e SENAI-MS abrem vagas para cursos gratuitos e fortalecem qualificação profissional no Estado - funtrab.ms.gov.br Últimos dias de inscrições para qualificação profissional a distância no IFMS - Correio de Corumbá 630 vagas no setor de bioenergia em MS: confira as oportunidades - Campo Grande News Rodada de Empregabilidade mostra a diversidade de profissões que movem o setor de Bioenergia em MS - Cana Online Prefeitura de Chapadão do Sul publica nota de pesar pelo falecimento do ex-governador Marcelo Miranda - Jovem Sul News Mato Grosso do Sul perde Grazielle Machado, ex-deputada estadual e filha de Londres Machado - MS Todo dia Chapadão do Sul realiza audiência pública para discutir políticas voltadas à causa animal - O CORREIO NEWS Chapadão do Sul avança para implantar programa pioneiro de bem-estar animal e controle populacional - Jovem Sul News “Planejamento é a base gestão pública e ferramenta para desenvolvimento dos municípios”, diz titular da Semadesc - semadesc.ms.gov.br ""Chapadão do Sul será referência em qualidade de vida"", afirma Walter Schlatter  A Crítica de Campo Grande Festival de Dança Coreografada da Melhor Idade define campeões  fundesporte.ms.gov.br As 10 cidades com melhor qualidade de vida de MS; Campo Grande lidera ranking estadual  G1 Festival Gastronômico 2026 de Chapadão do Sul será com com grandes shows e promete a maior festa dos sabores  Jovem Sul News Investimentos impulsionam nova etapa de desenvolvimento em Chapadão do Sul  ArapuaNews Bioenergia: rodada de empregabilidade oferece mais de 630 vagas em 15 municípios de MS  Portal Único ms.gov.br Funtrab e SENAI-MS abrem vagas para cursos gratuitos e fortalecem qualificação profissional no Estado  funtrab.ms.gov.br Últimos dias de inscrições para qualificação profissional a distância no IFMS  Correio de Corumbá 630 vagas no setor de bioenergia em MS: confira as oportunidades  Campo Grande News Rodada de Empregabilidade mostra a diversidade de profissões que movem o setor de Bioenergia em MS  Cana Online Prefeitura de Chapadão do Sul publica nota de pesar pelo falecimento do ex-governador Marcelo Miranda  Jovem Sul News Mato Grosso do Sul perde Grazielle Machado, ex-deputada estadual e filha de Londres Machado  MS Todo dia Chapadão do Sul realiza audiência pública para discutir políticas voltadas à causa animal  O CORREIO NEWS Chapadão do Sul avança para implantar programa pioneiro de bem-estar animal e controle populacional  Jovem Sul News “Planejamento é a base gestão pública e ferramenta para desenvolvimento dos municípios”, diz titular da Semadesc  semadesc.ms.gov.br"
Coronel Sapucaia,12,"prefeitura, coronel, sapucaia, gaeco, midiamax","A cidade de MS que está entre as piores em qualidade de vida no Brasil, segundo levantamento - G1 Com investimento do FIC, Grupo UBU chega com teatro em nove cidades na região sul-fronteira de MS - fundacaodecultura.ms.gov.br Cine Sesi tem 2º maior público do ano em Bonito com 4,9 mil pessoas - Agência de Notícias da Indústria MS aparece entre os estados com melhor qualidade de vida do Brasil, mas desigualdade preocupa - G1 Prefeitura de Coronel Sapucaia antecipa homenagem ao Dia do Gari e reforça valorização aos trabalhadores da limpeza urbana - A Gazeta News Semana começa com mais de 500 vagas em concursos de MS e salários de R$ 13 mil - Midiamax Secretaria de Educação-MS abre 415 vagas para Assistente de Atividades Educacionais - Ache Concursos Gaeco volta à Prefeitura de Coronel Sapucaia contra grupo que fraudou licitações - Midiamax Prefeitura tem 90 dias para regulamentar uso de nome social de pessoas trans - Campo Grande News Gaeco apreende fortuna em nova fase de operação contra corrupção em Coronel Sapucaia - ojacare.com.br Empresa investigada pelo Gaeco recebeu R$ 15 milhões em Coronel Sapucaia - Midiamax Operação do Gaeco mira suposto esquema em contratos públicos em prefeitura de MS - agorams.com.br A cidade de MS que está entre as piores em qualidade de vida no Brasil, segundo levantamento  G1 Com investimento do FIC, Grupo UBU chega com teatro em nove cidades na região sul-fronteira de MS  fundacaodecultura.ms.gov.br Cine Sesi tem 2º maior público do ano em Bonito com 4,9 mil pessoas  Agência de Notícias da Indústria MS aparece entre os estados com melhor qualidade de vida do Brasil, mas desigualdade preocupa  G1 Prefeitura de Coronel Sapucaia antecipa homenagem ao Dia do Gari e reforça valorização aos trabalhadores da limpeza urbana  A Gazeta News Semana começa com mais de 500 vagas em concursos de MS e salários de R$ 13 mil  Midiamax Secretaria de Educação-MS abre 415 vagas para Assistente de Atividades Educacionais  Ache Concursos Gaeco volta à Prefeitura de Coronel Sapucaia contra grupo que fraudou licitações  Midiamax Prefeitura tem 90 dias para regulamentar uso de nome social de pessoas trans  Campo Grande News Gaeco apreende fortuna em nova fase de operação contra corrupção em Coronel Sapucaia  ojacare.com.br Empresa investigada pelo Gaeco recebeu R$ 15 milhões em Coronel Sapucaia  Midiamax Operação do Gaeco mira suposto esquema em contratos públicos em prefeitura de MS  agorams.com.br"
Deodápolis,9,"deodápolis, mpms, abre, vagas, educação","Agendão: Expogrande, Festival Expressão de Rua e festas no interior agitam o fim de semana em MS - agenciadenoticias.ms.gov.br Atvos abre 50 vagas para jovens aprendizes em Nova Alvorada do Sul e Deodápolis -MS - JornalCana Senai prorroga inscrições para 300 bolsas de formação educacional em MS - Campo Grande News Secretaria de Educação-MS abre 415 vagas para Assistente de Atividades Educacionais - Ache Concursos Deodápolis lança Plano de Desenvolvimento Municipal com foco em inovação e fortalecimento econômico - ms.agenciasebrae.com.br MPMS intensifica ações em Deodápolis no Agosto Lilás e fortalece rede de proteção às mulheres - MPMS Polícia Civil inaugura a 52ª Sala Lilás do MS, em Aparecida do Taboado - SINPOL-MS Conselho do MPMS arquiva investigações e aprecia medida à animosidade de advogados - Midiamax Prefeito de Deodápolis troca secretário de Educação - Midiamax Agendão: Expogrande, Festival Expressão de Rua e festas no interior agitam o fim de semana em MS  agenciadenoticias.ms.gov.br Atvos abre 50 vagas para jovens aprendizes em Nova Alvorada do Sul e Deodápolis -MS  JornalCana Senai prorroga inscrições para 300 bolsas de formação educacional em MS  Campo Grande News Secretaria de Educação-MS abre 415 vagas para Assistente de Atividades Educacionais  Ache Concursos Deodápolis lança Plano de Desenvolvimento Municipal com foco em inovação e fortalecimento econômico  ms.agenciasebrae.com.br MPMS intensifica ações em Deodápolis no Agosto Lilás e fortalece rede de proteção às mulheres  MPMS Polícia Civil inaugura a 52ª Sala Lilás do MS, em Aparecida do Taboado  SINPOL-MS Conselho do MPMS arquiva investigações e aprecia medida à animosidade de advogados  Midiamax Prefeito de Deodápolis troca secretário de Educação  Midiamax"
Dois Irmãos do Buriti,13,"agenciadenoticias, maior, público, pessoas, news","Carreta-palco do Circuito Cultura MS segue para a região central com nova rodada de apresentações - agenciadenoticias.ms.gov.br Sob a proteção das áreas naturais - Sesc São Paulo Cine Sesi tem 2º maior público do ano em Bonito com 4,9 mil pessoas - Agência de Notícias da Indústria Agendão: Expogrande, Festival Expressão de Rua e festas no interior agitam o fim de semana em MS - agenciadenoticias.ms.gov.br Mais R$ 536 milhões: investimento do Governo de MS em rodovias impulsiona o desenvolvimento do Estado - A Gazeta News Em seis anos, projetos apoiados pela Suzano retiraram 31 mil pessoas da linha da pobreza em Mato Grosso do Sul - ArapuaNews Na Capital, EJA é ofertado em 16 escolas e na modalidade à distância; veja lista - Campo Grande News Secretaria de Educação-MS abre 415 vagas para Assistente de Atividades Educacionais - Ache Concursos Polícia Civil inaugura a 53ª Sala Lilás do MS, em Japorã - sejusp.ms.gov.br Audiência pública em Aquidauana reforça mobilização pela duplicação da BR-262 - O Pantaneiro Caminho do Acordo conclui 12ª edição com cerca de 750 atendimentos a comunidades indígenas de Paranhos/MS - trf3.jus.br Campo Grande passa a integrar diretoria do maior consórcio público de saúde do Brasil – CGNotícias - campogrande.ms.gov.br Diretor da PDIB recebe Moção de Congratulação da Câmara Municipal por trabalhos em prol da segurança pública - agepen.ms.gov.br Carreta-palco do Circuito Cultura MS segue para a região central com nova rodada de apresentações  agenciadenoticias.ms.gov.br Sob a proteção das áreas naturais  Sesc São Paulo Cine Sesi tem 2º maior público do ano em Bonito com 4,9 mil pessoas  Agência de Notícias da Indústria Agendão: Expogrande, Festival Expressão de Rua e festas no interior agitam o fim de semana em MS  agenciadenoticias.ms.gov.br Mais R$ 536 milhões: investimento do Governo de MS em rodovias impulsiona o desenvolvimento do Estado  A Gazeta News Em seis anos, projetos apoiados pela Suzano retiraram 31 mil pessoas da linha da pobreza em Mato Grosso do Sul  ArapuaNews Na Capital, EJA é ofertado em 16 escolas e na modalidade à distância; veja lista  Campo Grande News Secretaria de Educação-MS abre 415 vagas para Assistente de Atividades Educacionais  Ache Concursos Polícia Civil inaugura a 53ª Sala Lilás do MS, em Japorã  sejusp.ms.gov.br Audiência pública em Aquidauana reforça mobilização pela duplicação da BR-262  O Pantaneiro Caminho do Acordo conclui 12ª edição com cerca de 750 atendimentos a comunidades indígenas de Paranhos/MS  trf3.jus.br Campo Grande passa a integrar diretoria do maior consórcio público de saúde do Brasil – CGNotícias  campogrande.ms.gov.br Diretor da PDIB recebe Moção de Congratulação da Câmara Municipal por trabalhos em prol da segurança pública  agepen.ms.gov.br"
Eldorado,13,"notícias, eldorado, vagas, sesi, agência","SESI-MS apresenta projeto de carbono na COP30 e SESI-SP investe em inovação na saúde - Agência de Notícias da Indústria Circuito Sesc de Artes chega a 9 cidades do Vale do Ribeira - Sesc São Paulo Cine Sesi tem 2º maior público do ano em Bonito com 4,9 mil pessoas - Agência de Notícias da Indústria Petrobras, Raízen, Eldorado e mais: confira as vagas de emprego no setor de logística, nesta sexta (22) - Tecnologística Acabou a desculpa! SENAI tem mais de 8,3 mil vagas em vários cursos pelo Brasil - Agência de Notícias da Indústria GIRO FUNTRAB DE NOTÍCIAS – 30/07/2025 a 06/08/2025 - funtrab.ms.gov.br Semana começa com mais de 500 vagas em concursos de MS e salários de R$ 13 mil - Midiamax Atvos abre 50 vagas para jovens aprendizes em Nova Alvorada do Sul e Deodápolis -MS - JornalCana Eldorado Brasil e Prefeitura entregam agasalhos para crianças atendidas pelo CRASE - ArapuaNews Sala do Empreendedor de Eldorado é reinaugurada com nova identidade visual - ms.agenciasebrae.com.br Sem exigência de escolaridade: prefeitura abre seletivo com salário de R$ 1,5 mil - Primeira Página Servidora assassinada por ex em Eldorado: 10º feminicídio em MS - Campo Grande News Mutirão de Documentação leva serviços a 1,7 mil pessoas em Sidrolândia (MS) - GOV.BR SESI-MS apresenta projeto de carbono na COP30 e SESI-SP investe em inovação na saúde  Agência de Notícias da Indústria Circuito Sesc de Artes chega a 9 cidades do Vale do Ribeira  Sesc São Paulo Cine Sesi tem 2º maior público do ano em Bonito com 4,9 mil pessoas  Agência de Notícias da Indústria Petrobras, Raízen, Eldorado e mais: confira as vagas de emprego no setor de logística, nesta sexta (22)  Tecnologística Acabou a desculpa! SENAI tem mais de 8,3 mil vagas em vários cursos pelo Brasil  Agência de Notícias da Indústria GIRO FUNTRAB DE NOTÍCIAS – 30/07/2025 a 06/08/2025  funtrab.ms.gov.br Semana começa com mais de 500 vagas em concursos de MS e salários de R$ 13 mil  Midiamax Atvos abre 50 vagas para jovens aprendizes em Nova Alvorada do Sul e Deodápolis -MS  JornalCana Eldorado Brasil e Prefeitura entregam agasalhos para crianças atendidas pelo CRASE  ArapuaNews Sala do Empreendedor de Eldorado é reinaugurada com nova identidade visual  ms.agenciasebrae.com.br Sem exigência de escolaridade: prefeitura abre seletivo com salário de R$ 1,5 mil  Primeira Página Servidora assassinada por ex em Eldorado: 10º feminicídio em MS  Campo Grande News Mutirão de Documentação leva serviços a 1,7 mil pessoas em Sidrolândia (MS)  GOV.BR"
Fátima do Sul,15,"fátima, portal, único, cidades, bombeiros","Cresce 24% o número de brasileiros migrando para essa cidade universitária de alto padrão perto do Paraguai nos últimos 12 anos - Correio Braziliense A Energia que Transforma: MSGÁS destina mais de R$ 3 milhões para projetos sociais e impacta 28 mil vidas - Portal Único ms.gov.br Clima bom, gente acolhedora e futuro promissor em uma das cidades mais estratégicas do Brasil - Revista Oeste Cine Sesi tem 2º maior público do ano em Bonito com 4,9 mil pessoas - Agência de Notícias da Indústria Projeto Circula Cultura MS encerra primeira edição com público de 25 mil pessoas em 42 municípios - Fátima News Programa MS Supera está com inscrições abertas até o dia 11 de março; tire suas dúvidas - Portal Único ms.gov.br Corpo de Bombeiros divulga novo resultado da seleção para bombeiros temporários - Midiamax Escritório Social da Agepen transforma recomeços e amplia oportunidades para egressos do sistema prisional - Portal Único ms.gov.br Processo seletivo dos Bombeiros MS abre 230 vagas em 30 cidades - JC Concursos SAD - SEJUSP- CBMMS divulga Processo Seletivo com 230 vagas - PCI Concursos Homem procurado pela Justiça de SP é preso pela Polícia Civil em Fátima do Sul - A Crítica de Campo Grande Ação integrada das Polícias Civis prende foragido da Justiça de São Paulo em Fátima do Sul - Fátima em Dia Em solenidade de troca de comando do 3º BPM, Marçal destaca avanço histórico na segurança - Dourados News Previdência de Angélica que investiu no Master é autônoma, diz prefeitura após operação - Midiamax Falece Dr Nelson Kawamura, médico em diversas cidades do MS - O Pantaneiro Cresce 24% o número de brasileiros migrando para essa cidade universitária de alto padrão perto do Paraguai nos últimos 12 anos  Correio Braziliense A Energia que Transforma: MSGÁS destina mais de R$ 3 milhões para projetos sociais e impacta 28 mil vidas  Portal Único ms.gov.br Clima bom, gente acolhedora e futuro promissor em uma das cidades mais estratégicas do Brasil  Revista Oeste Cine Sesi tem 2º maior público do ano em Bonito com 4,9 mil pessoas  Agência de Notícias da Indústria Projeto Circula Cultura MS encerra primeira edição com público de 25 mil pessoas em 42 municípios  Fátima News Programa MS Supera está com inscrições abertas até o dia 11 de março; tire suas dúvidas  Portal Único ms.gov.br Corpo de Bombeiros divulga novo resultado da seleção para bombeiros temporários  Midiamax Escritório Social da Agepen transforma recomeços e amplia oportunidades para egressos do sistema prisional  Portal Único ms.gov.br Processo seletivo dos Bombeiros MS abre 230 vagas em 30 cidades  JC Concursos SAD - SEJUSP- CBMMS divulga Processo Seletivo com 230 vagas  PCI Concursos Homem procurado pela Justiça de SP é preso pela Polícia Civil em Fátima do Sul  A Crítica de Campo Grande Ação integrada das Polícias Civis prende foragido da Justiça de São Paulo em Fátima do Sul  Fátima em Dia Em solenidade de troca de comando do 3º BPM, Marçal destaca avanço histórico na segurança  Dourados News Previdência de Angélica que investiu no Master é autônoma, diz prefeitura após operação  Midiamax Falece Dr Nelson Kawamura, médico em diversas cidades do MS  O Pantaneiro"
