municipio,qtd_noticias_encontradas,temas_frequentes,resumo_para_slide
Brasilândia,9,"campo, completa, público, notícias, grande","Virada Cultural 2025 de SP: veja programação completa do evento, que completa 20 anos - G1 Cine Sesi tem 2º maior público do ano em Bonito com 4,9 mil pessoas - Agência de Notícias da Indústria Galeria: Casa do Trabalhador de Ribas do Rio Pardo recebe as orientações - funtrab.ms.gov.br SENAR Jovem Rural: Programa busca reter talentos no campo e possibilita empregabilidade - cnabrasil.org.br Gestão sustentável ganha força em Campo Grande - Notícias em Rede Ministério Público apura nepotismo na contratação de nove parentes no interior - Investiga MS A Prefeitura de Nova Brasilândia D’Oeste, em Rondônia, por meio da Secretaria Municipal de Obras e Serviços Públicos (SEMOSP), abriu Processo Seletivo Simplificado para preencher 11 vagas temporárias destinadas a cargos de nível fundamental compl - instagram.com TJ-MS condena improbidade em contrato de R$ 893 mil em Brasilândia - Campo Grande News Polícia Civil inaugura a 52ª Sala Lilás do MS em Aparecida do Taboado - Costa Leste News Virada Cultural 2025 de SP: veja programação completa do evento, que completa 20 anos  G1 Cine Sesi tem 2º maior público do ano em Bonito com 4,9 mil pessoas  Agência de Notícias da Indústria Galeria: Casa do Trabalhador de Ribas do Rio Pardo recebe as orientações  funtrab.ms.gov.br SENAR Jovem Rural: Programa busca reter talentos no campo e possibilita empregabilidade  cnabrasil.org.br Gestão sustentável ganha força em Campo Grande  Notícias em Rede Ministério Público apura nepotismo na contratação de nove parentes no interior  Investiga MS A Prefeitura de Nova Brasilândia D’Oeste, em Rondônia, por meio da Secretaria Municipal de Obras e Serviços Públicos (SEMOSP), abriu Processo Seletivo Simplificado para preencher 11 vagas temporárias destinadas a cargos de nível fundamental compl  instagram.com TJ-MS condena improbidade em contrato de R$ 893 mil em Brasilândia  Campo Grande News Polícia Civil inaugura a 52ª Sala Lilás do MS em Aparecida do Taboado  Costa Leste News"
Caarapó,13,"caarapó, vagas, funtrab, milhões, transforma","Neno Razuk investe mais de R$ 5 milhões em emendas e transforma municípios de MS - Assembleia Legislativa de Mato Grosso do Sul - Cine Sesi tem 2º maior público do ano em Bonito com 4,9 mil pessoas - Agência de Notícias da Indústria Encontro de carros antigos transforma Praça São José em ponto de cultura e lazer em Amambai - A Gazeta News Funtrab leva oportunidade de recomeço a internos do presídio de Caarapó com curso de pizzaiolo - funtrab.ms.gov.br Casa do Trabalhador de Caarapó promove vagas para Jovem Aprendiz em parceria com a Raízen - funtrab.ms.gov.br Bioenergia: rodada de empregabilidade oferece mais de 630 vagas em 15 municípios de MS - agenciadenoticias.ms.gov.br Raízen abre mais de 400 vagas para programa de aprendiz - Revista Cultivar Gigante da bioenergia oferece 400 vagas de emprego para jovens em todo o País - Gazeta de São Paulo MPMS e parceiros inauguram padaria em presídio de Caarapó com recursos de penas pecuniárias e ANPPs - MPMS Semadesc participa da abertura da Exposição Agropecuária de Caarapó - semadesc.ms.gov.br Câmara de Caarapó devolve à prefeitura R$ 3,7 milhões; dinheiro ajuda erguer hospital e quitar folha do serviço municipal - Midiamax Prefeitura abre licitação para ampliar balneário de Caarapó com novos quiosques e banheiros - capitalnews.com.br Lei proíbe nomeação de agressores de mulheres em Caarapó e prevê demissão de servidores - Midiamax Neno Razuk investe mais de R$ 5 milhões em emendas e transforma municípios de MS  Assembleia Legislativa de Mato Grosso do Sul - Cine Sesi tem 2º maior público do ano em Bonito com 4,9 mil pessoas  Agência de Notícias da Indústria Encontro de carros antigos transforma Praça São José em ponto de cultura e lazer em Amambai  A Gazeta News Funtrab leva oportunidade de recomeço a internos do presídio de Caarapó com curso de pizzaiolo  funtrab.ms.gov.br Casa do Trabalhador de Caarapó promove vagas para Jovem Aprendiz em parceria com a Raízen  funtrab.ms.gov.br Bioenergia: rodada de empregabilidade oferece mais de 630 vagas em 15 municípios de MS  agenciadenoticias.ms.gov.br Raízen abre mais de 400 vagas para programa de aprendiz  Revista Cultivar Gigante da bioenergia oferece 400 vagas de emprego para jovens em todo o País  Gazeta de São Paulo MPMS e parceiros inauguram padaria em presídio de Caarapó com recursos de penas pecuniárias e ANPPs  MPMS Semadesc participa da abertura da Exposição Agropecuária de Caarapó  semadesc.ms.gov.br Câmara de Caarapó devolve à prefeitura R$ 3,7 milhões; dinheiro ajuda erguer hospital e quitar folha do serviço municipal  Midiamax Prefeitura abre licitação para ampliar balneário de Caarapó com novos quiosques e banheiros  capitalnews.com.br Lei proíbe nomeação de agressores de mulheres em Caarapó e prevê demissão de servidores  Midiamax"
Cassilândia,10,"cassilândia, todo, prefeitura, pública, notícias","Soraya Thronicke investe R$ 1 milhão para fortalecer eventos culturais da Feira Central, turismo e economia em MS - MS Todo dia Cine Sesi tem 2º maior público do ano em Bonito com 4,9 mil pessoas - Agência de Notícias da Indústria Galeria: Casa do Trabalhador de Ribas do Rio Pardo recebe as orientações - funtrab.ms.gov.br Últimos dias de inscrições para qualificação profissional a distância no IFMS - Correio de Corumbá Concurso ﻿Cassilândia MS: SAIU! Veja - Blog Gran Cursos Online Prefeitura de Cassilândia realiza nova oficina da revisão do Plano Diretor no Bairro Santa Rita - MS Todo dia Prefeitura de Cassilândia convida população para Audiência Pública da LDO 2027 - O Correio News Cassilândia conquista espaço inédito em conselho nacional de previdência pública - MS Todo dia Prefeitura de Cassilândia divulga calendário de feriados e pontos facultativos para 2026 - Cassilândia Notícias Pela primeira vez, Cassilândia representa MS em conselho nacional da previdência pública - MS Todo dia Soraya Thronicke investe R$ 1 milhão para fortalecer eventos culturais da Feira Central, turismo e economia em MS  MS Todo dia Cine Sesi tem 2º maior público do ano em Bonito com 4,9 mil pessoas  Agência de Notícias da Indústria Galeria: Casa do Trabalhador de Ribas do Rio Pardo recebe as orientações  funtrab.ms.gov.br Últimos dias de inscrições para qualificação profissional a distância no IFMS  Correio de Corumbá Concurso ﻿Cassilândia MS: SAIU! Veja  Blog Gran Cursos Online Prefeitura de Cassilândia realiza nova oficina da revisão do Plano Diretor no Bairro Santa Rita  MS Todo dia Prefeitura de Cassilândia convida população para Audiência Pública da LDO 2027  O Correio News Cassilândia conquista espaço inédito em conselho nacional de previdência pública  MS Todo dia Prefeitura de Cassilândia divulga calendário de feriados e pontos facultativos para 2026  Cassilândia Notícias Pela primeira vez, Cassilândia representa MS em conselho nacional da previdência pública  MS Todo dia"
Chapadão do Sul,15,"setor, chapadão, bioenergia, pública, estadual","Plano Estadual de Esporte e Lazer de MS trará diretrizes do setor para os próximos 10 anos - Portal Único ms.gov.br As 10 cidades com melhor qualidade de vida de MS; Campo Grande lidera ranking estadual - G1 Festival de Dança Coreografada da Melhor Idade define campeões - fundesporte.ms.gov.br Campanha Eu Respeito de Novembro tem como tema o Conhecimento - UFMS Caxias do Sul é eleita a 14ª cidade mais feliz do Brasil - Rádio Solaris Programa Qualificação de Jovem abre inscrições em Chapadão do Sul - Diário Chapadense Bioenergia: rodada de empregabilidade oferece mais de 630 vagas em 15 municípios de MS - agenciadenoticias.ms.gov.br GIRO FUNTRAB DE NOTÍCIAS – 03/06/2025 a 16/06/2025 - funtrab.ms.gov.br Rodada de Empregabilidade mostra a diversidade de profissões que movem o setor de Bioenergia em MS - Cana Online Setor de bioenergia oferece 630 vagas de emprego em 15 cidades de MS - - Folha de Campo Grande - Audiência pública destaca superávit fiscal, responsabilidade financeira e 99,66% de adimplência em Chapadão do Sul - Jovem Sul News João Carlos Krug desiste de pré-candidatura a deputado federal por motivos particulares - Diário Chapadense “Planejamento é a base gestão pública e ferramenta para desenvolvimento dos municípios”, diz titular da Semadesc - semadesc.ms.gov.br Chapadão do Sul realizará Audiência Pública da Causa Animal no dia 15 de junho - O Correio News Polícia Civil inaugura a 53ª Sala Lilás do MS, em Japorã - sejusp.ms.gov.br Plano Estadual de Esporte e Lazer de MS trará diretrizes do setor para os próximos 10 anos  Portal Único ms.gov.br As 10 cidades com melhor qualidade de vida de MS; Campo Grande lidera ranking estadual  G1 Festival de Dança Coreografada da Melhor Idade define campeões  fundesporte.ms.gov.br Campanha Eu Respeito de Novembro tem como tema o Conhecimento  UFMS Caxias do Sul é eleita a 14ª cidade mais feliz do Brasil  Rádio Solaris Programa Qualificação de Jovem abre inscrições em Chapadão do Sul  Diário Chapadense Bioenergia: rodada de empregabilidade oferece mais de 630 vagas em 15 municípios de MS  agenciadenoticias.ms.gov.br GIRO FUNTRAB DE NOTÍCIAS – 03/06/2025 a 16/06/2025  funtrab.ms.gov.br Rodada de Empregabilidade mostra a diversidade de profissões que movem o setor de Bioenergia em MS  Cana Online Setor de bioenergia oferece 630 vagas de emprego em 15 cidades de MS -  Folha de Campo Grande - Audiência pública destaca superávit fiscal, responsabilidade financeira e 99,66% de adimplência em Chapadão do Sul  Jovem Sul News João Carlos Krug desiste de pré-candidatura a deputado federal por motivos particulares  Diário Chapadense “Planejamento é a base gestão pública e ferramenta para desenvolvimento dos municípios”, diz titular da Semadesc  semadesc.ms.gov.br Chapadão do Sul realizará Audiência Pública da Causa Animal no dia 15 de junho  O Correio News Polícia Civil inaugura a 53ª Sala Lilás do MS, em Japorã  sejusp.ms.gov.br"
Coronel Sapucaia,15,"news, pessoas, gazeta, prefeitura, gaeco","MS aparece entre os estados com melhor qualidade de vida do Brasil, mas desigualdade preocupa - G1 A cidade de MS que está entre as piores em qualidade de vida no Brasil, segundo levantamento - G1 Cine Sesi tem 2º maior público do ano em Bonito com 4,9 mil pessoas - Agência de Notícias da Indústria Semana do MEI 2026 será realizada em Amambai com palestras, orientações e incentivo ao empreendedorismo - A Gazeta News Central de Libras Digital começa a funcionar em unidades e amplia acesso de pessoas surdas ao novo RG - A Gazeta News IFMS oferece cursos técnicos gratuitos; saiba como participar - Correio do Estado Seis Casas do Trabalhador fecham no feriado de 8 de dezembro em MS - funtrab.ms.gov.br Prefeitura de Ponta Porã - MS abre edital de Processo Seletivo com diversos cargos - PCI Concursos Notícias, galeria de fotos, vídeos de Amambai-MS e região | Página 25 - A Gazeta News Secretaria de Educação-MS abre 415 vagas para Assistente de Atividades Educacionais - Ache Concursos Gaeco volta à Prefeitura de Coronel Sapucaia contra grupo que fraudou licitações - Midiamax Polícia Civil inaugura a 53ª Sala Lilás do MS, em Japorã - sejusp.ms.gov.br Prefeitura tem 90 dias para regulamentar uso de nome social de pessoas trans - Campo Grande News Empresa investigada pelo Gaeco recebeu R$ 15 milhões em Coronel Sapucaia - brasilnoticia.com.br Gaeco apreende fortuna em nova fase de operação contra corrupção em Coronel Sapucaia - ojacare.com.br MS aparece entre os estados com melhor qualidade de vida do Brasil, mas desigualdade preocupa  G1 A cidade de MS que está entre as piores em qualidade de vida no Brasil, segundo levantamento  G1 Cine Sesi tem 2º maior público do ano em Bonito com 4,9 mil pessoas  Agência de Notícias da Indústria Semana do MEI 2026 será realizada em Amambai com palestras, orientações e incentivo ao empreendedorismo  A Gazeta News Central de Libras Digital começa a funcionar em unidades e amplia acesso de pessoas surdas ao novo RG  A Gazeta News IFMS oferece cursos técnicos gratuitos; saiba como participar  Correio do Estado Seis Casas do Trabalhador fecham no feriado de 8 de dezembro em MS  funtrab.ms.gov.br Prefeitura de Ponta Porã - MS abre edital de Processo Seletivo com diversos cargos  PCI Concursos Notícias, galeria de fotos, vídeos de Amambai-MS e região | Página 25  A Gazeta News Secretaria de Educação-MS abre 415 vagas para Assistente de Atividades Educacionais  Ache Concursos Gaeco volta à Prefeitura de Coronel Sapucaia contra grupo que fraudou licitações  Midiamax Polícia Civil inaugura a 53ª Sala Lilás do MS, em Japorã  sejusp.ms.gov.br Prefeitura tem 90 dias para regulamentar uso de nome social de pessoas trans  Campo Grande News Empresa investigada pelo Gaeco recebeu R$ 15 milhões em Coronel Sapucaia  brasilnoticia.com.br Gaeco apreende fortuna em nova fase de operação contra corrupção em Coronel Sapucaia  ojacare.com.br"
Deodápolis,11,"deodápolis, vagas, abre, jovens, aprendizes","Neno Razuk investe mais de R$ 5 milhões em emendas e transforma municípios de MS - Assembleia Legislativa de Mato Grosso do Sul - Usina abre 50 vagas para jovens aprendizes em Nova Alvorada do Sul e Deodápolis - Fátima em Dia Atvos abre 50 vagas para jovens aprendizes em Nova Alvorada do Sul e Deodápolis -MS - JornalCana IFMS oferece cursos técnicos gratuitos; saiba como participar - Correio do Estado 75 vagas de jovens aprendizes em Deodápolis, Glória de Dourados e Nova Alvorada do Sul - Rede Jota FM Secretaria de Educação-MS abre 415 vagas para Assistente de Atividades Educacionais - Ache Concursos Deodápolis lança Plano de Desenvolvimento Municipal com foco em inovação e fortalecimento econômico - ms.agenciasebrae.com.br Prefeito de Deodápolis troca secretário de Educação - Midiamax MPMS intensifica ações em Deodápolis no Agosto Lilás e fortalece rede de proteção às mulheres - MPMS Deodápolis terá polo empresarial de 22 hectares com recursos do PRÓ-DESENVOLVE - semadesc.ms.gov.br Polícia Civil inaugura a 53ª Sala Lilás do MS, em Japorã - sejusp.ms.gov.br Neno Razuk investe mais de R$ 5 milhões em emendas e transforma municípios de MS  Assembleia Legislativa de Mato Grosso do Sul - Usina abre 50 vagas para jovens aprendizes em Nova Alvorada do Sul e Deodápolis  Fátima em Dia Atvos abre 50 vagas para jovens aprendizes em Nova Alvorada do Sul e Deodápolis -MS  JornalCana IFMS oferece cursos técnicos gratuitos; saiba como participar  Correio do Estado 75 vagas de jovens aprendizes em Deodápolis, Glória de Dourados e Nova Alvorada do Sul  Rede Jota FM Secretaria de Educação-MS abre 415 vagas para Assistente de Atividades Educacionais  Ache Concursos Deodápolis lança Plano de Desenvolvimento Municipal com foco em inovação e fortalecimento econômico  ms.agenciasebrae.com.br Prefeito de Deodápolis troca secretário de Educação  Midiamax MPMS intensifica ações em Deodápolis no Agosto Lilás e fortalece rede de proteção às mulheres  MPMS Deodápolis terá polo empresarial de 22 hectares com recursos do PRÓ-DESENVOLVE  semadesc.ms.gov.br Polícia Civil inaugura a 53ª Sala Lilás do MS, em Japorã  sejusp.ms.gov.br"
Dois Irmãos do Buriti,14,"assembleia, legislativa, mato, grosso, buriti","Neno Razuk investe mais de R$ 5 milhões em emendas e transforma municípios de MS - Assembleia Legislativa de Mato Grosso do Sul - Investimentos públicos garantem qualidade de vida e potencializam turismo em Rio Verde - agenciadenoticias.ms.gov.br Agendão: Som da Concha, festivais do tango, hip-hop e da cultura japonesa marcam feriado prolongado em MS - pontaporaemdia.com.br Evento reúne cavalgada, provas de laço, esportes de aventura, shows e competidores de 14 estados - Buriti News Cine Sesi tem 2º maior público do ano em Bonito com 4,9 mil pessoas - Agência de Notícias da Indústria IFMS oferece cursos técnicos gratuitos; saiba como participar - Correio do Estado Na Capital, EJA é ofertado em 16 escolas e na modalidade à distância; veja lista - Campo Grande News Legislação que regulariza o trabalho do menor é de... - Assembleia Legislativa de Mato Grosso do Sul - Secretaria de Educação-MS abre 415 vagas para Assistente de Atividades Educacionais - Ache Concursos Caminho do Acordo leva cerca de 600 atendimentos à Aldeia Água Branca, em Aquidauana/MS - trf3.jus.br Dois Irmãos do Buriti inaugura novo plenário da Câmara Municipal - O Pantaneiro VÍDEO: Costa Rica decreta estado de calamidade após tempestades - Midiamax Polícia Civil inaugura a 53ª Sala Lilás do MS, em Japorã - sejusp.ms.gov.br Solenidade de posse da prefeita Adriane Lopes será nesta quarta-feira (1º) – CGNotícias - campogrande.ms.gov.br Neno Razuk investe mais de R$ 5 milhões em emendas e transforma municípios de MS  Assembleia Legislativa de Mato Grosso do Sul - Investimentos públicos garantem qualidade de vida e potencializam turismo em Rio Verde  agenciadenoticias.ms.gov.br Agendão: Som da Concha, festivais do tango, hip-hop e da cultura japonesa marcam feriado prolongado em MS  pontaporaemdia.com.br Evento reúne cavalgada, provas de laço, esportes de aventura, shows e competidores de 14 estados  Buriti News Cine Sesi tem 2º maior público do ano em Bonito com 4,9 mil pessoas  Agência de Notícias da Indústria IFMS oferece cursos técnicos gratuitos; saiba como participar  Correio do Estado Na Capital, EJA é ofertado em 16 escolas e na modalidade à distância; veja lista  Campo Grande News Legislação que regulariza o trabalho do menor é de...  Assembleia Legislativa de Mato Grosso do Sul - Secretaria de Educação-MS abre 415 vagas para Assistente de Atividades Educacionais  Ache Concursos Caminho do Acordo leva cerca de 600 atendimentos à Aldeia Água Branca, em Aquidauana/MS  trf3.jus.br Dois Irmãos do Buriti inaugura novo plenário da Câmara Municipal  O Pantaneiro VÍDEO: Costa Rica decreta estado de calamidade após tempestades  Midiamax Polícia Civil inaugura a 53ª Sala Lilás do MS, em Japorã  sejusp.ms.gov.br Solenidade de posse da prefeita Adriane Lopes será nesta quarta-feira (1º) – CGNotícias  campogrande.ms.gov.br"
Eldorado,13,"notícias, eldorado, vagas, sesi, agência","SESI-MS apresenta projeto de carbono na COP30 e SESI-SP investe em inovação na saúde - Agência de Notícias da Indústria Circuito Sesc de Artes chega a 9 cidades do Vale do Ribeira - Sesc São Paulo Cine Sesi tem 2º maior público do ano em Bonito com 4,9 mil pessoas - Agência de Notícias da Indústria Petrobras, Raízen, Eldorado e mais: confira as vagas de emprego no setor de logística, nesta sexta (22) - Tecnologística Sindicato divulga vagas abertas em indústrias de celulose na região do Bolsão - Midiamax Acabou a desculpa! SENAI tem mais de 8,3 mil vagas em vários cursos pelo Brasil - Agência de Notícias da Indústria GIRO FUNTRAB DE NOTÍCIAS – 30/07/2025 a 06/08/2025 - funtrab.ms.gov.br Eldorado Brasil abre 50 vagas para programa Jovem Aprendiz em Três Lagoas (MS) - Portal Celulose Polícia Civil inaugura a 53ª Sala Lilás do MS, em Japorã - sejusp.ms.gov.br Para oferecer mais comodidade à população, em breve Depac-Centro mudará de endereço - pc.ms.gov.br Servidora assassinada por ex em Eldorado: 10º feminicídio em MS - Campo Grande News Prefeitura de São Luís divulga calendário das matrículas 2026 - O Maranhense Escola Municipal Eldorado recebeu projeto “Cultura Robótica” e uniu tecnologia, arte e sustentabilidade - Prefeitura de Sidrolândia SESI-MS apresenta projeto de carbono na COP30 e SESI-SP investe em inovação na saúde  Agência de Notícias da Indústria Circuito Sesc de Artes chega a 9 cidades do Vale do Ribeira  Sesc São Paulo Cine Sesi tem 2º maior público do ano em Bonito com 4,9 mil pessoas  Agência de Notícias da Indústria Petrobras, Raízen, Eldorado e mais: confira as vagas de emprego no setor de logística, nesta sexta (22)  Tecnologística Sindicato divulga vagas abertas em indústrias de celulose na região do Bolsão  Midiamax Acabou a desculpa! SENAI tem mais de 8,3 mil vagas em vários cursos pelo Brasil  Agência de Notícias da Indústria GIRO FUNTRAB DE NOTÍCIAS – 30/07/2025 a 06/08/2025  funtrab.ms.gov.br Eldorado Brasil abre 50 vagas para programa Jovem Aprendiz em Três Lagoas (MS)  Portal Celulose Polícia Civil inaugura a 53ª Sala Lilás do MS, em Japorã  sejusp.ms.gov.br Para oferecer mais comodidade à população, em breve Depac-Centro mudará de endereço  pc.ms.gov.br Servidora assassinada por ex em Eldorado: 10º feminicídio em MS  Campo Grande News Prefeitura de São Luís divulga calendário das matrículas 2026  O Maranhense Escola Municipal Eldorado recebeu projeto “Cultura Robótica” e uniu tecnologia, arte e sustentabilidade  Prefeitura de Sidrolândia"
Fátima do Sul,15,"fátima, cultural, cidades, bombeiros, correio","Cresce 24% o número de brasileiros migrando para essa cidade universitária de alto padrão perto do Paraguai nos últimos 12 anos - Correio Braziliense AFLAMS empossa três novas acadêmicas e amplia representatividade cultural em Mato Grosso do Sul - A Crítica de Campo Grande Clima bom, gente acolhedora e futuro promissor em uma das cidades mais estratégicas do Brasil - Revista Oeste Agendão cultural: fim de semana tem feira criativa, teatro, astronomia e atrações culturais em MS - ArapuaNews Confira a agenda cultural do fim de semana ? - Primeira Página Corpo de Bombeiros divulga novo resultado da seleção para bombeiros temporários - Midiamax IFMS oferece cursos técnicos gratuitos; saiba como participar - Correio do Estado Com 20 mil inscritos, concurso da Alems tem 250 candidatos por vaga - Fátima em Dia Processo seletivo dos Bombeiros MS abre 230 vagas em 30 cidades - JC Concursos SAD - SEJUSP- CBMMS divulga Processo Seletivo com 230 vagas - PCI Concursos Prefeitura de Angélica nega envolvimento em investigação da Polícia Federal sobre previdência municipal - Fátima em Dia Projeto declara de utilidade pública estadual o Sindicato Rural de Fátima do Sul - O sul-mato-grossense Falece Dr Nelson Kawamura, médico em diversas cidades do MS - O Pantaneiro Investigação mira prefeitura por 'gato de energia' em inauguração de UBS e perda de vacinas - Midiamax Governo de MS entrega Unidade Regional de Perícia em Fátima do Sul - Portal Único ms.gov.br Cresce 24% o número de brasileiros migrando para essa cidade universitária de alto padrão perto do Paraguai nos últimos 12 anos  Correio Braziliense AFLAMS empossa três novas acadêmicas e amplia representatividade cultural em Mato Grosso do Sul  A Crítica de Campo Grande Clima bom, gente acolhedora e futuro promissor em uma das cidades mais estratégicas do Brasil  Revista Oeste Agendão cultural: fim de semana tem feira criativa, teatro, astronomia e atrações culturais em MS  ArapuaNews Confira a agenda cultural do fim de semana ? Primeira Página Corpo de Bombeiros divulga novo resultado da seleção para bombeiros temporários  Midiamax IFMS oferece cursos técnicos gratuitos; saiba como participar  Correio do Estado Com 20 mil inscritos, concurso da Alems tem 250 candidatos por vaga  Fátima em Dia Processo seletivo dos Bombeiros MS abre 230 vagas em 30 cidades  JC Concursos SAD - SEJUSP- CBMMS divulga Processo Seletivo com 230 vagas  PCI Concursos Prefeitura de Angélica nega envolvimento em investigação da Polícia Federal sobre previdência municipal  Fátima em Dia Projeto declara de utilidade pública estadual o Sindicato Rural de Fátima do Sul  O sul-mato-grossense Falece Dr Nelson Kawamura, médico em diversas cidades do MS  O Pantaneiro Investigação mira prefeitura por 'gato de energia' em inauguração de UBS e perda de vacinas  Midiamax Governo de MS entrega Unidade Regional de Perícia em Fátima do Sul  Portal Único ms.gov.br"
