municipio,qtd_noticias_encontradas,temas_frequentes,resumo_para_slide
Água Clara,5,"água, clara, conselho, pastores, confirma","Conselho de Pastores confirma Marcha para Jesus em Água Clara com presença de David Quinlan - ArapuaNews Água Clara lança Plano de Desenvolvimento Municipal e define prioridades para próximo triênio - semadesc.ms.gov.br Torneio General Malan de Tênis de Mesa reúne 29 unidades da REE - sed.ms.gov.br Sul-Mato-Grossense Sub-13: jogos, datas e formato da edição que começa neste sábado - ge Água Clara aditiva contrato de R$ 1,2 milhão para decoração natalina e chama atenção de moradores - Midiamax Conselho de Pastores confirma Marcha para Jesus em Água Clara com presença de David Quinlan  ArapuaNews Água Clara lança Plano de Desenvolvimento Municipal e define prioridades para próximo triênio  semadesc.ms.gov.br Torneio General Malan de Tênis de Mesa reúne 29 unidades da REE  sed.ms.gov.br Sul-Mato-Grossense Sub-13: jogos, datas e formato da edição que começa neste sábado  ge Água Clara aditiva contrato de R$ 1,2 milhão para decoração natalina e chama atenção de moradores  Midiamax"
Amambai,5,"amambai, mato, tornará, neste, final","Amambai se tornará neste final da semana a capital do laço comprido de Mato Grosso do Sul - A Gazeta News Presidente Bitto Pereira e Chayene do Amaral recebem Moção de Congratulação da Câmara de Amambai - OABMS Notícia - Amambai marca presença em lançamento do Consensualismo no Tribunal de Contas do Estado de Mato Gr... - Prefeitura Municipal de Amambai Oficina gratuita reúne parceiros e orienta sobre as competências do profissional do futuro em Amambai - - Amambai Notícias Governo licita obras de CEUs da Cultura em quatro cidades e fortalece acesso à arte, educação e cidadania - agenciadenoticias.ms.gov.br Amambai se tornará neste final da semana a capital do laço comprido de Mato Grosso do Sul  A Gazeta News Presidente Bitto Pereira e Chayene do Amaral recebem Moção de Congratulação da Câmara de Amambai  OABMS Notícia - Amambai marca presença em lançamento do Consensualismo no Tribunal de Contas do Estado de Mato Gr...  Prefeitura Municipal de Amambai Oficina gratuita reúne parceiros e orienta sobre as competências do profissional do futuro em Amambai -  Amambai Notícias Governo licita obras de CEUs da Cultura em quatro cidades e fortalece acesso à arte, educação e cidadania  agenciadenoticias.ms.gov.br"
Anastácio,5,"anastácio, crime, filha, suspeita, cultura",Crime em família: filha é suspeita de planejar assassinato dos pais - G1 De dinossauros à cultura pantaneira: identidade local vira estratégia de desenvolvimento em Nioaque e Anastácio - ms.agenciasebrae.com.br Programa “Circula Cultura MS” leva agenda cultural a Anastácio - Jornal Notícias do Estado Escolas da REE participam do Campeonato Estadual Escolar de Tênis de Mesa - sed.ms.gov.br Faxina após crime levanta suspeita contra filha em duplo homicídio em Anastácio - capitalnews.com.br Crime em família: filha é suspeita de planejar assassinato dos pais  G1 De dinossauros à cultura pantaneira: identidade local vira estratégia de desenvolvimento em Nioaque e Anastácio  ms.agenciasebrae.com.br Programa “Circula Cultura MS” leva agenda cultural a Anastácio  Jornal Notícias do Estado Escolas da REE participam do Campeonato Estadual Escolar de Tênis de Mesa  sed.ms.gov.br Faxina após crime levanta suspeita contra filha em duplo homicídio em Anastácio  capitalnews.com.br
Angélica,5,"angélica, maria, gorga, aponta, tendências",Dra. Maria Angélica Gorga aponta tendências da dermatologia para 2026 - Hojemais.com.br Governo de MS entrega obras de pavimentação e apoia a 3ª edição da Feira AgroAngélica - www.ms.gov.br Luciano Huck expõe ataques de pânico de Angélica 10 anos após acidente em Mato Grosso do Sul - Midiamax Arenas esportivas do programa MS Bom de Bola são inauguradas em Angélica e Coxim - fundesporte.ms.gov.br Oficina de Upcycling ensina sobre consumo consciente no FIB 2025 - fundacaodecultura.ms.gov.br Dra. Maria Angélica Gorga aponta tendências da dermatologia para 2026  Hojemais.com.br Governo de MS entrega obras de pavimentação e apoia a 3ª edição da Feira AgroAngélica  www.ms.gov.br Luciano Huck expõe ataques de pânico de Angélica 10 anos após acidente em Mato Grosso do Sul  Midiamax Arenas esportivas do programa MS Bom de Bola são inauguradas em Angélica e Coxim  fundesporte.ms.gov.br Oficina de Upcycling ensina sobre consumo consciente no FIB 2025  fundacaodecultura.ms.gov.br
Aparecida do Taboado,5,"atrações, taboadão, juma, girolando, campeã",“Juma” é Girolando campeã em competição de vacas com produção de leite impressionante - Primeira Página Neno Razuk investe mais de R$ 5 milhões em emendas e transforma municípios d... - Assembleia Legislativa de Mato Grosso do Sul - Apresentadas as atrações do Taboadão 2026 - RCN 67 Taboadão 2026 divulga primeiras atrações e apresenta detalhes da próxima edição - Costa Leste News Governo de MS lança programa que garante pós-graduação gratuita para servidores - agorams.com.br “Juma” é Girolando campeã em competição de vacas com produção de leite impressionante  Primeira Página Neno Razuk investe mais de R$ 5 milhões em emendas e transforma municípios d...  Assembleia Legislativa de Mato Grosso do Sul - Apresentadas as atrações do Taboadão 2026  RCN 67 Taboadão 2026 divulga primeiras atrações e apresenta detalhes da próxima edição  Costa Leste News Governo de MS lança programa que garante pós-graduação gratuita para servidores  agorams.com.br
Aral Moreira,5,"aral, moreira, news, gazeta, mantém","TRE-MS mantém condenação de 14 por abuso em Aral Moreira - Campo Grande News Vereadores de Aral Moreira participam do UCVMS Summit e reforçam compromisso com fortalecimento do Legislativo - A Gazeta News Sanesul investe R$ 3,5 milhões na ampliação do sistema de abastecimento de água em Aral Moreira - www.ms.gov.br Governo de MS seleciona entidade para fomentar turismo na região de fronteira - Midiamax Cooperativa Lar promove palestra do Abril Verde em Aral Moreira - A Gazeta News TRE-MS mantém condenação de 14 por abuso em Aral Moreira  Campo Grande News Vereadores de Aral Moreira participam do UCVMS Summit e reforçam compromisso com fortalecimento do Legislativo  A Gazeta News Sanesul investe R$ 3,5 milhões na ampliação do sistema de abastecimento de água em Aral Moreira  www.ms.gov.br Governo de MS seleciona entidade para fomentar turismo na região de fronteira  Midiamax Cooperativa Lar promove palestra do Abril Verde em Aral Moreira  A Gazeta News"
Bataguassu,5,"bataguassu, mato, operário, caravina, propõe","Caravina propõe inclusão do Off Road Bataguassu no calendário oficial do Estado - Assembleia Legislativa de Mato Grosso do Sul - Polícia Civil prestigia evento acadêmico sobre o enfrentamento à violência contra a mulher em Bataguassu - pc.ms.gov.br Empreendedorismo feminino ganha força em Bataguassu com inauguração da Casa da Costura Sustentável - ms.agenciasebrae.com.br Ex-Bataguassu, Diego Souza é o novo técnico do Operário-MS - ge Operário volta a vencer Bataguassu e é tricampeão sul-mato-grossense - Correio de Corumbá Caravina propõe inclusão do Off Road Bataguassu no calendário oficial do Estado  Assembleia Legislativa de Mato Grosso do Sul - Polícia Civil prestigia evento acadêmico sobre o enfrentamento à violência contra a mulher em Bataguassu  pc.ms.gov.br Empreendedorismo feminino ganha força em Bataguassu com inauguração da Casa da Costura Sustentável  ms.agenciasebrae.com.br Ex-Bataguassu, Diego Souza é o novo técnico do Operário-MS  ge Operário volta a vencer Bataguassu e é tricampeão sul-mato-grossense  Correio de Corumbá"
Batayporã,5,"batayporã, cultura, prefeitura, abre, participa","Governo de MS recebe embaixadora da República Tcheca e celebra cooperação em comércio, inovação e cultura - agenciadenoticias.ms.gov.br Prefeitura de Batayporã - MS abre seleção para a Secretaria de Educação, Cultura, Esporte e Lazer - PCI Concursos Prefeitura de Batayporã abre processo seletivo para professor do ensino fundamental - Midiamax Batayporã participa de alinhamento para inclusão no Mapa do Turismo Brasileiro 2026 - Jornal da Nova Caravina participa de MS Ativo e Batayporã define novas obras de infraestrutura - Assembleia Legislativa de Mato Grosso do Sul - Governo de MS recebe embaixadora da República Tcheca e celebra cooperação em comércio, inovação e cultura  agenciadenoticias.ms.gov.br Prefeitura de Batayporã - MS abre seleção para a Secretaria de Educação, Cultura, Esporte e Lazer  PCI Concursos Prefeitura de Batayporã abre processo seletivo para professor do ensino fundamental  Midiamax Batayporã participa de alinhamento para inclusão no Mapa do Turismo Brasileiro 2026  Jornal da Nova Caravina participa de MS Ativo e Batayporã define novas obras de infraestrutura  Assembleia Legislativa de Mato Grosso do Sul -"
Bela Vista,5,"bela, vista, semana, news, grande","Bela Vista terá fim de semana de grande movimentação com esporte, feira e show musical - Fronteira News Tradição e emoção tomam conta de Bela Vista com o Encontro Estadual de Laço Comprido - Planalto News Com 106 atletas, delegação de MS disputa etapa nacional das Paralimpíadas Escolares - agenciadenoticias.ms.gov.br Semana da Justiça Restaurativa fortalece cultura de paz nas escolas de MS com 68 atividades em todo o Estado - sed.ms.gov.br Projeto Circula MS vai levar apresentações culturais a cidades do interior - fundacaodecultura.ms.gov.br Bela Vista terá fim de semana de grande movimentação com esporte, feira e show musical  Fronteira News Tradição e emoção tomam conta de Bela Vista com o Encontro Estadual de Laço Comprido  Planalto News Com 106 atletas, delegação de MS disputa etapa nacional das Paralimpíadas Escolares  agenciadenoticias.ms.gov.br Semana da Justiça Restaurativa fortalece cultura de paz nas escolas de MS com 68 atividades em todo o Estado  sed.ms.gov.br Projeto Circula MS vai levar apresentações culturais a cidades do interior  fundacaodecultura.ms.gov.br"
Brasilândia,5,"brasilândia, copa, ciclismo, atletas, quatro",Lei: Associação em Brasilândia é declarada de Utilidade Pública - Assembleia Legislativa de Mato Grosso do Sul - Brasilândia sedia 8ª Copa ABD de Ciclismo com atletas de quatro estados e renda revertida à AVCC - Notícias em Rede Brasilândia recebe 1ª etapa da Copa ABD de Ciclismo 100k com atletas de quatro estados e renda revertida à AVCC - Notícias em Rede Obra de pavimentação da MS-040 entre Santa Rita e Brasilândia vai impulsionar economia regional - agenciadenoticias.ms.gov.br Caminhoneiro morre ao bater em carreta que bloqueava a pista após pane na MS-395 - G1 Lei: Associação em Brasilândia é declarada de Utilidade Pública  Assembleia Legislativa de Mato Grosso do Sul - Brasilândia sedia 8ª Copa ABD de Ciclismo com atletas de quatro estados e renda revertida à AVCC  Notícias em Rede Brasilândia recebe 1ª etapa da Copa ABD de Ciclismo 100k com atletas de quatro estados e renda revertida à AVCC  Notícias em Rede Obra de pavimentação da MS-040 entre Santa Rita e Brasilândia vai impulsionar economia regional  agenciadenoticias.ms.gov.br Caminhoneiro morre ao bater em carreta que bloqueava a pista após pane na MS-395  G1
Caarapó,5,"caarapó, prefeitura, abre, processo, seletivo","Prefeitura de Caarapó - MS abre processo seletivo para Auxiliar de Desenvolvimento Infantil - PCI Concursos Agendão: música sertaneja, Museu do Videogame e feiras agitam o fim de semana - agenciadenoticias.ms.gov.br Só se tirar à força: deputado defende posse de fazenda em Caarapó - Campo Grande News Copa do Brasil sub-20: rival do São Paulo trocou de cidade duas vezes e estreia no torneio - ge Prefeitura abre licitação para ampliar balneário de Caarapó com novos quiosques e banheiros - capitalnews.com.br Prefeitura de Caarapó - MS abre processo seletivo para Auxiliar de Desenvolvimento Infantil  PCI Concursos Agendão: música sertaneja, Museu do Videogame e feiras agitam o fim de semana  agenciadenoticias.ms.gov.br Só se tirar à força: deputado defende posse de fazenda em Caarapó  Campo Grande News Copa do Brasil sub-20: rival do São Paulo trocou de cidade duas vezes e estreia no torneio  ge Prefeitura abre licitação para ampliar balneário de Caarapó com novos quiosques e banheiros  capitalnews.com.br"
Cassilândia,5,"cassilândia, news, recebe, motocross, discute",Cassilândia discute o futuro do turismo em workshop estratégico - O Correio News Cassilândia recebe evento de motocross com pilotos de vários estados neste fim de semana - MS Todo dia Lideranças da Costa Leste se reúnem em Cassilândia para discutir desenvolvimento regional - ms.agenciasebrae.com.br Dias 07 e 08 de março: Cassilândia recebe a abertura do Estadual de Motocross 2026 - Jovem Sul News Câmara de Cassilândia firma contrato com a Fapec para concurso público - Midiamax Cassilândia discute o futuro do turismo em workshop estratégico  O Correio News Cassilândia recebe evento de motocross com pilotos de vários estados neste fim de semana  MS Todo dia Lideranças da Costa Leste se reúnem em Cassilândia para discutir desenvolvimento regional  ms.agenciasebrae.com.br Dias 07 e 08 de março: Cassilândia recebe a abertura do Estadual de Motocross 2026  Jovem Sul News Câmara de Cassilândia firma contrato com a Fapec para concurso público  Midiamax
Chapadão do Sul,5,"news, mato, grosso, campo, grande",A Mídia Eletrônica mais completa de Mato Grosso do Sul - Jovem Sul News Clubes de Campo Grande brilham no Atletismo em MS - Campo Grande News Ponta Porã recebe etapa dos Jogos da Melhor Idade com disputas de bocha - agenciadenoticias.ms.gov.br Prefeitura de Chapadão do Sul promove capacitação de estagiários e supervisores - Diário Chapadense Festival Gastronômico 2026 terá grandes shows e promete a maior festa dos sabores de Mato Grosso do Sul - Chapadense News A Mídia Eletrônica mais completa de Mato Grosso do Sul  Jovem Sul News Clubes de Campo Grande brilham no Atletismo em MS  Campo Grande News Ponta Porã recebe etapa dos Jogos da Melhor Idade com disputas de bocha  agenciadenoticias.ms.gov.br Prefeitura de Chapadão do Sul promove capacitação de estagiários e supervisores  Diário Chapadense Festival Gastronômico 2026 terá grandes shows e promete a maior festa dos sabores de Mato Grosso do Sul  Chapadense News
Coronel Sapucaia,5,"coronel, sapucaia, projeto, circula, operação","MP faz operação contra fraudes em licitações e afasta servidores na fronteira - G1 Em Coronel Sapucaia, modalidade de Xadrez é destaque em unidade escolar da REE - sed.ms.gov.br Projeto “Circula Cultura MS” chega a Coronel Sapucaia no dia 3 de maio - A Gazeta News Governo de MS investe R$ 236,8 milhões na restauração de rodovias que ligam Tacuru e Eldorado - www.ms.gov.br Projeto Circula MS vai levar apresentações culturais a cidades do interior - fundacaodecultura.ms.gov.br MP faz operação contra fraudes em licitações e afasta servidores na fronteira  G1 Em Coronel Sapucaia, modalidade de Xadrez é destaque em unidade escolar da REE  sed.ms.gov.br Projeto “Circula Cultura MS” chega a Coronel Sapucaia no dia 3 de maio  A Gazeta News Governo de MS investe R$ 236,8 milhões na restauração de rodovias que ligam Tacuru e Eldorado  www.ms.gov.br Projeto Circula MS vai levar apresentações culturais a cidades do interior  fundacaodecultura.ms.gov.br"
Deodápolis,5,"deodápolis, dourados, entrega, obras, glória","Entrega de obras em Deodápolis e Glória de Dourados reforça compromisso do Estado com os municípios - agenciadenoticias.ms.gov.br Deodápolis vai pagar R$ 100 mil para banda do Paraná em show de virada - Midiamax JAMS 2026 terá seis etapas regionais entre abril e setembro - diariodigital.com.br Arena Frigomar Rodeio Festival começa nesta quinta-feira (12) - Rede Jota FM Ações de Zé Teixeira buscam melhorias para Dourados, Douradina e Deodápolis - pontaporaemdia.com.br Entrega de obras em Deodápolis e Glória de Dourados reforça compromisso do Estado com os municípios  agenciadenoticias.ms.gov.br Deodápolis vai pagar R$ 100 mil para banda do Paraná em show de virada  Midiamax JAMS 2026 terá seis etapas regionais entre abril e setembro  diariodigital.com.br Arena Frigomar Rodeio Festival começa nesta quinta-feira (12)  Rede Jota FM Ações de Zé Teixeira buscam melhorias para Dourados, Douradina e Deodápolis  pontaporaemdia.com.br"
Dois Irmãos do Buriti,5,"buriti, dois, irmãos, emendas, municípios","Governo promove inclusão produtiva apoiando agroindustrialização em Dois Irmãos do Buriti - agenciadenoticias.ms.gov.br Dois Irmãos do Buriti celebra 38 anos com festa, cultura e muita música - Buriti News Jamilson Name garante mais de R$ 1,7 mi em emendas pagas para municípios de ... - Assembleia Legislativa de Mato Grosso do Sul - Neno Razuk investe mais de R$ 5 milhões em emendas e transforma municípios d... - Assembleia Legislativa de Mato Grosso do Sul - Indicações de Zé Teixeira buscam recursos para estrutura urbana e turismo - pontaporaemdia.com.br Governo promove inclusão produtiva apoiando agroindustrialização em Dois Irmãos do Buriti  agenciadenoticias.ms.gov.br Dois Irmãos do Buriti celebra 38 anos com festa, cultura e muita música  Buriti News Jamilson Name garante mais de R$ 1,7 mi em emendas pagas para municípios de ...  Assembleia Legislativa de Mato Grosso do Sul - Neno Razuk investe mais de R$ 5 milhões em emendas e transforma municípios d...  Assembleia Legislativa de Mato Grosso do Sul - Indicações de Zé Teixeira buscam recursos para estrutura urbana e turismo  pontaporaemdia.com.br"
Eldorado,5,"eldorado, fiems, cultura, organizacional, formação","Cultura organizacional e formação de talentos são destaques da Eldorado em evento de RH em MS - ArapuaNews Governo de MS investe R$ 236,8 milhões na restauração de rodovias que ligam Tacuru e Eldorado - www.ms.gov.br Caravana da Castração inicia os trabalhos de 2026 em Eldorado, na próxima quinta-feira - agenciadenoticias.ms.gov.br Inovação na gestão de pessoas é tema do 2º Fórum Fiems Capital Humano; inscrições abertas - FIEMS Dentro da Hilux: amigo de Ana Castela, Luan Pereira vem a MS para show aberto ao público - Midiamax Cultura organizacional e formação de talentos são destaques da Eldorado em evento de RH em MS  ArapuaNews Governo de MS investe R$ 236,8 milhões na restauração de rodovias que ligam Tacuru e Eldorado  www.ms.gov.br Caravana da Castração inicia os trabalhos de 2026 em Eldorado, na próxima quinta-feira  agenciadenoticias.ms.gov.br Inovação na gestão de pessoas é tema do 2º Fórum Fiems Capital Humano; inscrições abertas  FIEMS Dentro da Hilux: amigo de Ana Castela, Luan Pereira vem a MS para show aberto ao público  Midiamax"
Fátima do Sul,5,"mato, grosso, dourados, sicredi, jogos","Jogos Abertos de Mato Grosso do Sul terão seis etapas regionais em 2026, entre abril e setembro - agenciadenoticias.ms.gov.br Jamilson Name garante mais de R$ 1,7 mi em emendas pagas para municípios de ... - Assembleia Legislativa de Mato Grosso do Sul - Caravana da Castração: 2ª etapa atende 9,6 mil animais e avança para Grande Dourados e Cone Sul - www.ms.gov.br Sicredi Centro-Sul MS/BA realiza segunda edição do Circuito de Negócios em Dourados - Sicredi Apagão nacional afetou 9 cidades em MS - G1 Jogos Abertos de Mato Grosso do Sul terão seis etapas regionais em 2026, entre abril e setembro  agenciadenoticias.ms.gov.br Jamilson Name garante mais de R$ 1,7 mi em emendas pagas para municípios de ...  Assembleia Legislativa de Mato Grosso do Sul - Caravana da Castração: 2ª etapa atende 9,6 mil animais e avança para Grande Dourados e Cone Sul  www.ms.gov.br Sicredi Centro-Sul MS/BA realiza segunda edição do Circuito de Negócios em Dourados  Sicredi Apagão nacional afetou 9 cidades em MS  G1"
Glória de Dourados,5,"projeto, melhor, idade, propõe, inclusão","Ponta Porã recebe etapa dos Jogos da Melhor Idade com disputas de bocha - agenciadenoticias.ms.gov.br Projeto propõe inclusão da “Paixão de Cristo” de Glória de Dourados no calendário oficial de eventos - Assembleia Legislativa de Mato Grosso do Sul - Projeto propõe inclusão da “Paixão de Cristo” de Glória de Dourados no calendário oficial de eventos - O sul-mato-grossense Projeto Circula MS vai levar apresentações culturais a cidades do interior - fundacaodecultura.ms.gov.br Com 179 participantes, Festival de Dança Coreografada da Melhor Idade será realizado em Campo Grande - fundesporte.ms.gov.br Ponta Porã recebe etapa dos Jogos da Melhor Idade com disputas de bocha  agenciadenoticias.ms.gov.br Projeto propõe inclusão da “Paixão de Cristo” de Glória de Dourados no calendário oficial de eventos  Assembleia Legislativa de Mato Grosso do Sul - Projeto propõe inclusão da “Paixão de Cristo” de Glória de Dourados no calendário oficial de eventos  O sul-mato-grossense Projeto Circula MS vai levar apresentações culturais a cidades do interior  fundacaodecultura.ms.gov.br Com 179 participantes, Festival de Dança Coreografada da Melhor Idade será realizado em Campo Grande  fundesporte.ms.gov.br"
Iguatemi,5,"iguatemi, governo, festival, dança, coreografada","Festival de Dança Coreografada da Melhor Idade define campeões - fundesporte.ms.gov.br Governo de MS investe R$ 236,8 milhões na restauração de rodovias que ligam Tacuru e Eldorado - www.ms.gov.br Paulo Corrêa solicita Rodoanel em Iguatemi para ga... - Assembleia Legislativa de Mato Grosso do Sul - Polícia Civil participa de sessão solene de encerramento do “Agosto Lilás” em Iguatemi - pc.ms.gov.br Governo amplia investimentos em Iguatemi e reforça presença nos municípios - diariodigital.com.br Festival de Dança Coreografada da Melhor Idade define campeões  fundesporte.ms.gov.br Governo de MS investe R$ 236,8 milhões na restauração de rodovias que ligam Tacuru e Eldorado  www.ms.gov.br Paulo Corrêa solicita Rodoanel em Iguatemi para ga...  Assembleia Legislativa de Mato Grosso do Sul - Polícia Civil participa de sessão solene de encerramento do “Agosto Lilás” em Iguatemi  pc.ms.gov.br Governo amplia investimentos em Iguatemi e reforça presença nos municípios  diariodigital.com.br"
Itaporã,5,"itaporã, copa, judô, etapa, circuito",A 2ª Copa Itaporã de Judô – 3ª Etapa do Circuito Estadual 2026 repercute nos órgãos de imprensa do estado. - Prefeitura de Itaporã Itaporã sedia com sucesso a 2ª Copa Itaporã de Judô – 3ª Etapa do Circuito Estadual 2026 - Prefeitura de Itaporã MP investiga desvio de verba da educação em rodeio de Itaporã - Campo Grande News A cidade impulsionada pelo agronegócio que oferece bem-estar e oportunidades para quem quer viver bem - Correio Braziliense Delegado da Polícia Civil participa de evento “Mulheres que Transformam” e orienta população sobre direitos das mulheres em Itaporã - pontaporaemdia.com.br A 2ª Copa Itaporã de Judô – 3ª Etapa do Circuito Estadual 2026 repercute nos órgãos de imprensa do estado. Prefeitura de Itaporã Itaporã sedia com sucesso a 2ª Copa Itaporã de Judô – 3ª Etapa do Circuito Estadual 2026  Prefeitura de Itaporã MP investiga desvio de verba da educação em rodeio de Itaporã  Campo Grande News A cidade impulsionada pelo agronegócio que oferece bem-estar e oportunidades para quem quer viver bem  Correio Braziliense Delegado da Polícia Civil participa de evento “Mulheres que Transformam” e orienta população sobre direitos das mulheres em Itaporã  pontaporaemdia.com.br
Itaquiraí,5,"itaquiraí, mato, grosso, começa, mudar","ETE: Itaquiraí começa a mudar com chegada das obras de esgoto - G1 Jogos Abertos de Mato Grosso do Sul terão seis etapas regionais em 2026, entre abril e setembro - www.ms.gov.br Barbosinha cumpre agenda em Itaquiraí, Eldorado e Japorã nesta quinta-feira - Midiamax Escola Estadual Tertulina Martins de Oliveira conquista destaque na 1ª Bienal do Livro de Mato Grosso do Sul - sed.ms.gov.br Primeiro ginásio poliesportivo de Itaquiraí é inaugurado com investimento do Governo do Estado - fundesporte.ms.gov.br ETE: Itaquiraí começa a mudar com chegada das obras de esgoto  G1 Jogos Abertos de Mato Grosso do Sul terão seis etapas regionais em 2026, entre abril e setembro  www.ms.gov.br Barbosinha cumpre agenda em Itaquiraí, Eldorado e Japorã nesta quinta-feira  Midiamax Escola Estadual Tertulina Martins de Oliveira conquista destaque na 1ª Bienal do Livro de Mato Grosso do Sul  sed.ms.gov.br Primeiro ginásio poliesportivo de Itaquiraí é inaugurado com investimento do Governo do Estado  fundesporte.ms.gov.br"
Ivinhema,5,"ivinhema, série, vence, uberlândia, segue","Ivinhema vence Uberlândia e segue líder no Brasileirão Série D - Primeira Página Saúde e bem-estar: Zé Teixeira intercede pela popu... - Assembleia Legislativa de Mato Grosso do Sul - Presidente do Ivinhema renuncia do cargo por motivos pessoais: 'eu estava cansado' - ge Operário e Ivinhema disputam liderança na segunda rodada da Série D - RCN 67 Bate-papo literário sobre o Vale do Ivinhema no Sesc, 28 de março - Campo Grande News Ivinhema vence Uberlândia e segue líder no Brasileirão Série D  Primeira Página Saúde e bem-estar: Zé Teixeira intercede pela popu...  Assembleia Legislativa de Mato Grosso do Sul - Presidente do Ivinhema renuncia do cargo por motivos pessoais: 'eu estava cansado'  ge Operário e Ivinhema disputam liderança na segunda rodada da Série D  RCN 67 Bate-papo literário sobre o Vale do Ivinhema no Sesc, 28 de março  Campo Grande News"
