municipio,qtd_noticias_encontradas,temas_frequentes,resumo_para_slide
Naviraí,15,"vagas, naviraí, mato, grosso, campo","Neno Razuk investe mais de R$ 5 milhões em emendas e transforma municípios de MS - Assembleia Legislativa de Mato Grosso do Sul - Agendão: bandeirinhas, forró e quitutes marcam o início das festas juninas em Mato Grosso do Sul - agenciadenoticias.ms.gov.br Calendário Oficial de Eventos Culturais de 2025 é definido pela Gestão Compromisso com o Futuro - navirai.ms.gov.br Colônia de Férias da FIRJAN, matrículas no SESI-MS e museu de ciência 4.0 na BA - Agência de Notícias da Indústria Ponta Porã recebe Festival Etnocultural dos Ervais - pontaporaemdia.com.br Senai MS: 2 mil vagas em cursos técnicos com bolsa de R$ 300; inscreva-se - Campo Grande News Com educação profissional e qualificação, MS é beneficiado com melhores oportunidades de emprego - tanamidianavirai.com.br Empresa do setor têxtil abre 50 vagas de emprego em Naviraí e oferece qualificação - funtrab.ms.gov.br IFMS abre vagas em cursos técnicos em 7 cidades; matrícula é por ordem de chegada - Campo Grande News Bioenergia: rodada de empregabilidade oferece mais de 630 vagas em 15 municípios de MS - agenciadenoticias.ms.gov.br Hashioka participa de evento de prestação de contas e assinatura de convênios em Naviraí - Assembleia Legislativa de Mato Grosso do Sul - Justiça de MS suspende cargo de procurador-geral adjunto preenchido sem concurso - Primeira Página Em Naviraí corte de salário do Prefeito pode impactar em redução de serviços na Saúde - navirai.ms.gov.br Naviraí contrata empresa por R$ 1,4 milhão para revitalizar iluminação pública - Midiamax Naviraiense sob investigação: uso irregular de recursos públicos? - Campo Grande News Neno Razuk investe mais de R$ 5 milhões em emendas e transforma municípios de MS  Assembleia Legislativa de Mato Grosso do Sul - Agendão: bandeirinhas, forró e quitutes marcam o início das festas juninas em Mato Grosso do Sul  agenciadenoticias.ms.gov.br Calendário Oficial de Eventos Culturais de 2025 é definido pela Gestão Compromisso com o Futuro  navirai.ms.gov.br Colônia de Férias da FIRJAN, matrículas no SESI-MS e museu de ciência 4.0 na BA  Agência de Notícias da Indústria Ponta Porã recebe Festival Etnocultural dos Ervais  pontaporaemdia.com.br Senai MS: 2 mil vagas em cursos técnicos com bolsa de R$ 300; inscreva-se  Campo Grande News Com educação profissional e qualificação, MS é beneficiado com melhores oportunidades de emprego  tanamidianavirai.com.br Empresa do setor têxtil abre 50 vagas de emprego em Naviraí e oferece qualificação  funtrab.ms.gov.br IFMS abre vagas em cursos técnicos em 7 cidades; matrícula é por ordem de chegada  Campo Grande News Bioenergia: rodada de empregabilidade oferece mais de 630 vagas em 15 municípios de MS  agenciadenoticias.ms.gov.br Hashioka participa de evento de prestação de contas e assinatura de convênios em Naviraí  Assembleia Legislativa de Mato Grosso do Sul - Justiça de MS suspende cargo de procurador-geral adjunto preenchido sem concurso  Primeira Página Em Naviraí corte de salário do Prefeito pode impactar em redução de serviços na Saúde  navirai.ms.gov.br Naviraí contrata empresa por R$ 1,4 milhão para revitalizar iluminação pública  Midiamax Naviraiense sob investigação: uso irregular de recursos públicos? Campo Grande News"
Nova Andradina,15,"nova, andradina, prefeitura, vagas, municípios","36ª Corrida do Trabalhador reúne em Nova Andradina atletas de quatro estados - Prefeitura Municipal de Nova Andradina Festival de Dança Coreografada da Melhor Idade define campeões - fundesporte.ms.gov.br Modelo de Municipalismo Ativo vira marca do Governo e acelera obras, serviços e inclusão social em todo o MS - Portal Único ms.gov.br Jogos da Melhor Idade movimentam Três Lagoas com 800 atletas de 48 municípios - RCN 67 Prática da atividade física movimentou a comunidade neste fim de semana - UFMS Senai MS: 2 mil vagas em cursos técnicos com bolsa de R$ 300; inscreva-se - Campo Grande News Bioenergia: rodada de empregabilidade oferece mais de 630 vagas em 15 municípios de MS - agenciadenoticias.ms.gov.br Mais de 1.400 vagas gratuitas em cursos de qualificação estão com inscrições abertas em MS - funtrab.ms.gov.br Funtrab e Biosul iniciam 2ª Rodada da Empregabilidade com 637 vagas em 15 municípios - semadesc.ms.gov.br IFMS abre inscrições para curso que amplia acesso ao ensino médio técnico - Correio de Corumbá Detentos iniciam atividades na limpeza urbana de Nova Andradina - - Prefeitura Municipal de Nova Andradina Parceria entre Agepen e Nova Andradina garante economia superior a 50% e amplia política de trabalho prisional - sejusp.ms.gov.br Prefeitura de Nova Andradina é alvo de investigação após não incluir cotas em contratações - Midiamax Agepen e Prefeitura firmam parceria para utilização de mão de obra prisional na limpeza urbana de Nova Andradina - agepen.ms.gov.br Corrida dos Bombeiros de Nova Andradina reúne mais de 600 participantes e leva militares ao pódio - bombeiros.ms.gov.br 36ª Corrida do Trabalhador reúne em Nova Andradina atletas de quatro estados  Prefeitura Municipal de Nova Andradina Festival de Dança Coreografada da Melhor Idade define campeões  fundesporte.ms.gov.br Modelo de Municipalismo Ativo vira marca do Governo e acelera obras, serviços e inclusão social em todo o MS  Portal Único ms.gov.br Jogos da Melhor Idade movimentam Três Lagoas com 800 atletas de 48 municípios  RCN 67 Prática da atividade física movimentou a comunidade neste fim de semana  UFMS Senai MS: 2 mil vagas em cursos técnicos com bolsa de R$ 300; inscreva-se  Campo Grande News Bioenergia: rodada de empregabilidade oferece mais de 630 vagas em 15 municípios de MS  agenciadenoticias.ms.gov.br Mais de 1.400 vagas gratuitas em cursos de qualificação estão com inscrições abertas em MS  funtrab.ms.gov.br Funtrab e Biosul iniciam 2ª Rodada da Empregabilidade com 637 vagas em 15 municípios  semadesc.ms.gov.br IFMS abre inscrições para curso que amplia acesso ao ensino médio técnico  Correio de Corumbá Detentos iniciam atividades na limpeza urbana de Nova Andradina -  Prefeitura Municipal de Nova Andradina Parceria entre Agepen e Nova Andradina garante economia superior a 50% e amplia política de trabalho prisional  sejusp.ms.gov.br Prefeitura de Nova Andradina é alvo de investigação após não incluir cotas em contratações  Midiamax Agepen e Prefeitura firmam parceria para utilização de mão de obra prisional na limpeza urbana de Nova Andradina  agepen.ms.gov.br Corrida dos Bombeiros de Nova Andradina reúne mais de 600 participantes e leva militares ao pódio  bombeiros.ms.gov.br"
Paranaíba,15,"paranaíba, oferece, bioenergia, campo, grande","Sesc Movimenta oferece 27 atividades gratuitas em Uberlândia e Uberaba; veja programação - G1 Tradição, aventura e cultura: Confira o roteiro de eventos que agitam o Brasil no mês de Setembro - www.gov.br Cine Sesi tem 2º maior público do ano em Bonito com 4,9 mil pessoas - Agência de Notícias da Indústria Virada Cultural 2025 de SP: veja programação completa do evento, que completa 20 anos - G1 O pobre Rio Paranaíba - Diário da Manhã Bioenergia: rodada de empregabilidade oferece mais de 630 vagas em 15 municípios de MS - agenciadenoticias.ms.gov.br Secretaria de Saúde de Paranaíba - MS abre seleção com salários de até R$ 9.857,09 - PCI Concursos Cursos para mulheres em MS: bolsa de até R$ 720 em 8 cidades - Campo Grande News Rodada de Empregabilidade mostra a diversidade de profissões que movem o setor de Bioenergia em MS - Cana Online Setor de bioenergia oferece 630 vagas de emprego em 15 cidades de MS - - Folha de Campo Grande - Paranaíba pagará R$ 10,5 milhões para empreiteira construir escola de tempo integral - Midiamax Prefeitura suspende diárias após decisão judicial sobre obras de drenagem - Campo Grande News PREVIM Paranaíba-MS abre seleção para Advogado com salário de R$ 4,8 mil - Folha Dirigida Investigado por crimes contra a administração pública da Prefeitura de Inocência é preso em Jales/SP - pc.ms.gov.br Paranaíba é destaque estadual no Programa AdaptaCidades - Prefeitura Municipal de Paranaíba-MS Sesc Movimenta oferece 27 atividades gratuitas em Uberlândia e Uberaba; veja programação  G1 Tradição, aventura e cultura: Confira o roteiro de eventos que agitam o Brasil no mês de Setembro  www.gov.br Cine Sesi tem 2º maior público do ano em Bonito com 4,9 mil pessoas  Agência de Notícias da Indústria Virada Cultural 2025 de SP: veja programação completa do evento, que completa 20 anos  G1 O pobre Rio Paranaíba  Diário da Manhã Bioenergia: rodada de empregabilidade oferece mais de 630 vagas em 15 municípios de MS  agenciadenoticias.ms.gov.br Secretaria de Saúde de Paranaíba - MS abre seleção com salários de até R$ 9.857,09  PCI Concursos Cursos para mulheres em MS: bolsa de até R$ 720 em 8 cidades  Campo Grande News Rodada de Empregabilidade mostra a diversidade de profissões que movem o setor de Bioenergia em MS  Cana Online Setor de bioenergia oferece 630 vagas de emprego em 15 cidades de MS -  Folha de Campo Grande - Paranaíba pagará R$ 10,5 milhões para empreiteira construir escola de tempo integral  Midiamax Prefeitura suspende diárias após decisão judicial sobre obras de drenagem  Campo Grande News PREVIM Paranaíba-MS abre seleção para Advogado com salário de R$ 4,8 mil  Folha Dirigida Investigado por crimes contra a administração pública da Prefeitura de Inocência é preso em Jales/SP  pc.ms.gov.br Paranaíba é destaque estadual no Programa AdaptaCidades  Prefeitura Municipal de Paranaíba-MS"
Paranhos,11,"paranhos, milhões, abre, vagas, novo","Neno Razuk investe mais de R$ 5 milhões em emendas e transforma municípios de MS - Assembleia Legislativa de Mato Grosso do Sul - Cine Sesi tem 2º maior público do ano em Bonito com 4,9 mil pessoas - Agência de Notícias da Indústria Agendão: Som da Concha, festivais do tango, hip-hop e da cultura japonesa marcam feriado prolongado em MS - pontaporaemdia.com.br Mineradora abre vagas para Jovem Aprendiz em Mara Rosa (GO) - stgnews.com.br IFMS oferece cursos técnicos gratuitos; saiba como participar - Correio do Estado Secretaria de Educação-MS abre 415 vagas para Assistente de Atividades Educacionais - Ache Concursos Equipe da Justiça Federal/MS realiza visita técnica em Paranhos para tratar da próxima edição do projeto “Caminho do Acordo” - trf3.jus.br Pacote de R$ 10 milhões prevê de ambulâncias no interior de MS - Midiamax Novo prefeito de Paranhos faz exoneração em massa e nomeia novos integrantes do primeiro escalão - G1 Novo prefeito de Paranhos exonera secretariado em 7 de novembro - Campo Grande News Polícia Civil inaugura a 52ª Sala Lilás do MS em Aparecida do Taboado - Costa Leste News Neno Razuk investe mais de R$ 5 milhões em emendas e transforma municípios de MS  Assembleia Legislativa de Mato Grosso do Sul - Cine Sesi tem 2º maior público do ano em Bonito com 4,9 mil pessoas  Agência de Notícias da Indústria Agendão: Som da Concha, festivais do tango, hip-hop e da cultura japonesa marcam feriado prolongado em MS  pontaporaemdia.com.br Mineradora abre vagas para Jovem Aprendiz em Mara Rosa (GO)  stgnews.com.br IFMS oferece cursos técnicos gratuitos; saiba como participar  Correio do Estado Secretaria de Educação-MS abre 415 vagas para Assistente de Atividades Educacionais  Ache Concursos Equipe da Justiça Federal/MS realiza visita técnica em Paranhos para tratar da próxima edição do projeto “Caminho do Acordo”  trf3.jus.br Pacote de R$ 10 milhões prevê de ambulâncias no interior de MS  Midiamax Novo prefeito de Paranhos faz exoneração em massa e nomeia novos integrantes do primeiro escalão  G1 Novo prefeito de Paranhos exonera secretariado em 7 de novembro  Campo Grande News Polícia Civil inaugura a 52ª Sala Lilás do MS em Aparecida do Taboado  Costa Leste News"
Porto Murtinho,15,"porto, murtinho, funtrab, rota, bioceânica","Potencial turístico da Rota Bioceânica abre nova perspectiva de negócios para Mato Grosso do Sul - semadesc.ms.gov.br Perifeirarte leva formação e mobilização comunitária a Porto Murtinho com programação integrada e atividades culturais - Radio Quarteto Porto Murtinho avança em obras de saúde, infraestrutura e turismo, de olho na consolidação da Rota Bioceânica - agenciadenoticias.ms.gov.br Mato Grosso do Sul no início do século XXI: entre transições e permanências - OpenEdition Journals Caravana da Castração avança em MS com mais de 1 mil atendimentos nos primeiros municípios do programa - Portal Único ms.gov.br Candidatos aprovados na seleção para bombeiro são convocados para curso de capacitação - Midiamax Funtrab, MS Qualifica e Mais Social realizam cursos gratuitos em Sonora e Porto Murtinho - funtrab.ms.gov.br Acabou a desculpa! SENAI tem mais de 8,3 mil vagas em vários cursos pelo Brasil - Agência de Notícias da Indústria GIRO FUNTRAB DE NOTÍCIAS – 03/06/2025 a 16/06/2025 - funtrab.ms.gov.br Corpo de Bombeiros divulga novo resultado da seleção para bombeiros temporários - Midiamax Porto Murtinho avança em obras de saúde, infraestrutura e turismo, de olho na consolidação da Rota Bioceânica - agenciadenoticias.ms.gov.br Pacote de R$ 10 milhões prevê de ambulâncias no interior de MS - Midiamax Moradores de Porto Murtinho/MS recebem serviços de cidadania em nova edição do Juizado Especial Federal Itinerante - trf3.jus.br Polícia Civil inaugura a 53ª Sala Lilás do MS, em Japorã - sejusp.ms.gov.br Justiça Federal leva cidadania a trabalhadores rurais e indígenas em Porto Murtinho/MS de 24 a 28 de novembro - trf3.jus.br Potencial turístico da Rota Bioceânica abre nova perspectiva de negócios para Mato Grosso do Sul  semadesc.ms.gov.br Perifeirarte leva formação e mobilização comunitária a Porto Murtinho com programação integrada e atividades culturais  Radio Quarteto Porto Murtinho avança em obras de saúde, infraestrutura e turismo, de olho na consolidação da Rota Bioceânica  agenciadenoticias.ms.gov.br Mato Grosso do Sul no início do século XXI: entre transições e permanências  OpenEdition Journals Caravana da Castração avança em MS com mais de 1 mil atendimentos nos primeiros municípios do programa  Portal Único ms.gov.br Candidatos aprovados na seleção para bombeiro são convocados para curso de capacitação  Midiamax Funtrab, MS Qualifica e Mais Social realizam cursos gratuitos em Sonora e Porto Murtinho  funtrab.ms.gov.br Acabou a desculpa! SENAI tem mais de 8,3 mil vagas em vários cursos pelo Brasil  Agência de Notícias da Indústria GIRO FUNTRAB DE NOTÍCIAS – 03/06/2025 a 16/06/2025  funtrab.ms.gov.br Corpo de Bombeiros divulga novo resultado da seleção para bombeiros temporários  Midiamax Porto Murtinho avança em obras de saúde, infraestrutura e turismo, de olho na consolidação da Rota Bioceânica  agenciadenoticias.ms.gov.br Pacote de R$ 10 milhões prevê de ambulâncias no interior de MS  Midiamax Moradores de Porto Murtinho/MS recebem serviços de cidadania em nova edição do Juizado Especial Federal Itinerante  trf3.jus.br Polícia Civil inaugura a 53ª Sala Lilás do MS, em Japorã  sejusp.ms.gov.br Justiça Federal leva cidadania a trabalhadores rurais e indígenas em Porto Murtinho/MS de 24 a 28 de novembro  trf3.jus.br"
Ribas do Rio Pardo,15,"arapuanews, três, vagas, ribas, lagoas","Três Lagoas leva cultura e protagonismo à Teia Nacional 2026, no Espírito Santo - ArapuaNews Jogos da Melhor Idade movimentam Três Lagoas com 800 atletas de 48 municípios - RCN 67 Agendão cultural: fim de semana tem feira criativa, teatro, astronomia e atrações culturais em MS - ArapuaNews Fundtur-MS lança guia de afroturismo e apresenta estratégia para fortalecer o segmento - ArapuaNews Neno Razuk investe mais de R$ 5 milhões em emendas e transforma municípios de MS - Assembleia Legislativa de Mato Grosso do Sul - Funtrab terá seletiva para motorista de ônibus com vagas em Ribas do Rio Pardo - funtrab.ms.gov.br Sindicato divulga vagas abertas em indústrias de celulose na região do Bolsão - Midiamax Suzano abre três processos seletivos para vagas operacionais em Ribas do Rio Pardo - ArapuaNews Suzano oferece bolsas de R$ 1,8 mil em curso de eletromecânica em MS - diariodigital.com.br Suzano seleciona trabalhadores para preencher vagas de emprego em MS e BA - CPG Click Petróleo e Gás Ribas do Rio Pardo: quando indústria e educação se unem para outra cidade nascer - FIEMS Moradores de Porto Murtinho/MS recebem serviços de cidadania em nova edição do Juizado Especial Federal Itinerante - trf3.jus.br Polícia Civil inaugura a 53ª Sala Lilás do MS, em Japorã - sejusp.ms.gov.br Audiência Pública apresenta prioridades da LDO 2027 em Três Lagoas - ArapuaNews Dispensa em licitação de R$ 3,8 milhões para coleta de lixo em Ribas entra na mira de inquérito - Midiamax Três Lagoas leva cultura e protagonismo à Teia Nacional 2026, no Espírito Santo  ArapuaNews Jogos da Melhor Idade movimentam Três Lagoas com 800 atletas de 48 municípios  RCN 67 Agendão cultural: fim de semana tem feira criativa, teatro, astronomia e atrações culturais em MS  ArapuaNews Fundtur-MS lança guia de afroturismo e apresenta estratégia para fortalecer o segmento  ArapuaNews Neno Razuk investe mais de R$ 5 milhões em emendas e transforma municípios de MS  Assembleia Legislativa de Mato Grosso do Sul - Funtrab terá seletiva para motorista de ônibus com vagas em Ribas do Rio Pardo  funtrab.ms.gov.br Sindicato divulga vagas abertas em indústrias de celulose na região do Bolsão  Midiamax Suzano abre três processos seletivos para vagas operacionais em Ribas do Rio Pardo  ArapuaNews Suzano oferece bolsas de R$ 1,8 mil em curso de eletromecânica em MS  diariodigital.com.br Suzano seleciona trabalhadores para preencher vagas de emprego em MS e BA  CPG Click Petróleo e Gás Ribas do Rio Pardo: quando indústria e educação se unem para outra cidade nascer  FIEMS Moradores de Porto Murtinho/MS recebem serviços de cidadania em nova edição do Juizado Especial Federal Itinerante  trf3.jus.br Polícia Civil inaugura a 53ª Sala Lilás do MS, em Japorã  sejusp.ms.gov.br Audiência Pública apresenta prioridades da LDO 2027 em Três Lagoas  ArapuaNews Dispensa em licitação de R$ 3,8 milhões para coleta de lixo em Ribas entra na mira de inquérito  Midiamax"
Sete Quedas,13,"sete, quedas, gazeta, news, funtrab","Sete Quedas amplia infraestrutura, saneamento e lazer com investimentos superiores a R$ 23 milhões - agenciadenoticias.ms.gov.br Notícias, galeria de fotos, vídeos de Amambai-MS e região | Página 25 - A Gazeta News Casa do Trabalhador disponibiliza 57 oportunidades de emprego nesta quinta-feira em Amambai - A Gazeta News Seis Casas do Trabalhador fecham no feriado de 8 de dezembro em MS - funtrab.ms.gov.br IFMS oferece cursos técnicos gratuitos; saiba como participar - Correio do Estado Semadesc e Sebrae entregam Plano de Desenvolvimento para seis municípios de MS - funtrab.ms.gov.br Funtrab disponibiliza vagas para técnicos de enfermagem - funtrab.ms.gov.br A Gazeta publica suplemento especial pelo aniversário de 46 anos de Sete Quedas - A Gazeta News Abastecimento da frota municipal custará R$ 2,9 milhões em Sete Quedas - Midiamax Polícia Civil inaugura a 53ª Sala Lilás do MS, em Japorã - sejusp.ms.gov.br Processo seletivo simplificado Prefeitura de Sete Quedas MS Educação - Folha Dirigida Procura por vacina contra Chikungunya segue baixa e Prefeitura cria unidade volante - Dourados News Sete Quedas: Encontro de Líderes dos Territórios Empreendedores promete impulsionar desenvolvimento sustentável em Mato Grosso do Sul - A Gazeta News Sete Quedas amplia infraestrutura, saneamento e lazer com investimentos superiores a R$ 23 milhões  agenciadenoticias.ms.gov.br Notícias, galeria de fotos, vídeos de Amambai-MS e região | Página 25  A Gazeta News Casa do Trabalhador disponibiliza 57 oportunidades de emprego nesta quinta-feira em Amambai  A Gazeta News Seis Casas do Trabalhador fecham no feriado de 8 de dezembro em MS  funtrab.ms.gov.br IFMS oferece cursos técnicos gratuitos; saiba como participar  Correio do Estado Semadesc e Sebrae entregam Plano de Desenvolvimento para seis municípios de MS  funtrab.ms.gov.br Funtrab disponibiliza vagas para técnicos de enfermagem  funtrab.ms.gov.br A Gazeta publica suplemento especial pelo aniversário de 46 anos de Sete Quedas  A Gazeta News Abastecimento da frota municipal custará R$ 2,9 milhões em Sete Quedas  Midiamax Polícia Civil inaugura a 53ª Sala Lilás do MS, em Japorã  sejusp.ms.gov.br Processo seletivo simplificado Prefeitura de Sete Quedas MS Educação  Folha Dirigida Procura por vacina contra Chikungunya segue baixa e Prefeitura cria unidade volante  Dourados News Sete Quedas: Encontro de Líderes dos Territórios Empreendedores promete impulsionar desenvolvimento sustentável em Mato Grosso do Sul  A Gazeta News"
Sonora,15,"vagas, sonora, sesc, municípios, cidades","Sonora Brasil Sesc terá mostra comemorativa em Porto Alegre e apresentações em 6 cidades do interior do RS - Sesc/RS Moinho in Concert entra na reta final dos ensaios para celebrar os caminhos que levam ao céu - Diário MS News Neno Razuk investe mais de R$ 5 milhões em emendas e transforma municípios de MS - Assembleia Legislativa de Mato Grosso do Sul - Semana Modos de Acessar 2021 - Sesc São Paulo Virada Cultural 2025 de SP: veja programação completa do evento, que completa 20 anos - G1 Bioenergia: rodada de empregabilidade oferece mais de 630 vagas em 15 municípios de MS - agenciadenoticias.ms.gov.br Senai MS: 2 mil vagas em cursos técnicos com bolsa de R$ 300; inscreva-se - Campo Grande News GIRO FUNTRAB DE NOTÍCIAS – 03/06/2025 a 16/06/2025 - funtrab.ms.gov.br CCR MSVia está com 30 vagas de trabalho abertas em municípios de MS - Motiva Rodovias Setor de bioenergia oferece 630 vagas de emprego em 15 cidades de MS - - Folha de Campo Grande - Show nacional é interrompido após fechamento de avenida e som acima do permitido em Cuiabá - G1 Concurso Secretaria Municipal de Educação Sonora MS abre 2 vagas - Folha Dirigida Sonora fecha contrato de R$ 2 milhões com empresa envolvida em fraudes em Mato Grosso - Midiamax Sonora: Clarice Ewerling entrega cinco veículos durante visita do governador Eduardo Riedel - Idest Multa para quem queima fogos em Cuiabá pode passar de R$ 5 mil e fiscalização é redobrada no réveillon - Primeira Página Sonora Brasil Sesc terá mostra comemorativa em Porto Alegre e apresentações em 6 cidades do interior do RS  Sesc/RS Moinho in Concert entra na reta final dos ensaios para celebrar os caminhos que levam ao céu  Diário MS News Neno Razuk investe mais de R$ 5 milhões em emendas e transforma municípios de MS  Assembleia Legislativa de Mato Grosso do Sul - Semana Modos de Acessar 2021  Sesc São Paulo Virada Cultural 2025 de SP: veja programação completa do evento, que completa 20 anos  G1 Bioenergia: rodada de empregabilidade oferece mais de 630 vagas em 15 municípios de MS  agenciadenoticias.ms.gov.br Senai MS: 2 mil vagas em cursos técnicos com bolsa de R$ 300; inscreva-se  Campo Grande News GIRO FUNTRAB DE NOTÍCIAS – 03/06/2025 a 16/06/2025  funtrab.ms.gov.br CCR MSVia está com 30 vagas de trabalho abertas em municípios de MS  Motiva Rodovias Setor de bioenergia oferece 630 vagas de emprego em 15 cidades de MS -  Folha de Campo Grande - Show nacional é interrompido após fechamento de avenida e som acima do permitido em Cuiabá  G1 Concurso Secretaria Municipal de Educação Sonora MS abre 2 vagas  Folha Dirigida Sonora fecha contrato de R$ 2 milhões com empresa envolvida em fraudes em Mato Grosso  Midiamax Sonora: Clarice Ewerling entrega cinco veículos durante visita do governador Eduardo Riedel  Idest Multa para quem queima fogos em Cuiabá pode passar de R$ 5 mil e fiscalização é redobrada no réveillon  Primeira Página"
