municipio,qtd_noticias_encontradas,temas_frequentes,resumo_para_slide
Água Clara,15,"água, clara, arapuanews, campo, grande","Água Clara confirma Raça Negra e Rafa & Junior na Festa das Nações 2026 com entrada gratuita - ArapuaNews Água Clara entra na rota da arte e da emoção com a chegada do Circula Cultura MS - ArapuaNews Água Clara realiza a Semana Mundial do Brincar 2026 com o tema “A Potência dos Encontros” - ArapuaNews Sesi e Suzano fortalecem cultura de segurança e impulsionam transformação de Ribas do Rio Pardo - ArapuaNews Lenine encanta público no MS ao Vivo com sucessos antigos e novos em Campo Grande - ArapuaNews A Suzano, empresa fabricante de bioprodutos desenvolvidos a partir do cultivo de eucalipto, recebe, somente até este domingo (29), inscrições para novas oportunidades de trabalho. As vagas são para três cargos diferentes para atuar nos municípios de Suz - instagram.com Suzano abre três processos seletivos para vagas operacionais em Ribas do Rio Pardo - ArapuaNews SESI-PA promove capacitação para professores e SENAI-MS oferece curso com bolsa de R$ 1 mil - Agência de Notícias da Indústria Funtrab anuncia vários cursos gratuitos de qualificação no Estado, veja como se inscrever - funtrab.ms.gov.br Na Capital, EJA é ofertado em 16 escolas e na modalidade à distância; veja lista - Campo Grande News Morre Marcelo Miranda, ex-governador de Mato Grosso do Sul e ex-prefeito de Campo Grande - Portal Água Clara MS Homem esfaqueia companheira por ciúmes e é preso em Água Clara - - Folha de Campo Grande - TCE-MS rejeita contas da prefeita de Água Clara por falhas fiscais - Midiamax Água Clara promove evento “TEAcolher em Rede” para fortalecer inclusão e acolhimento - ArapuaNews Senadora Soraya Thronicke convida população de Costa Rica para participar da Caravana da Castração - MS Todo dia Água Clara confirma Raça Negra e Rafa & Junior na Festa das Nações 2026 com entrada gratuita  ArapuaNews Água Clara entra na rota da arte e da emoção com a chegada do Circula Cultura MS  ArapuaNews Água Clara realiza a Semana Mundial do Brincar 2026 com o tema “A Potência dos Encontros”  ArapuaNews Sesi e Suzano fortalecem cultura de segurança e impulsionam transformação de Ribas do Rio Pardo  ArapuaNews Lenine encanta público no MS ao Vivo com sucessos antigos e novos em Campo Grande  ArapuaNews A Suzano, empresa fabricante de bioprodutos desenvolvidos a partir do cultivo de eucalipto, recebe, somente até este domingo (29), inscrições para novas oportunidades de trabalho. As vagas são para três cargos diferentes para atuar nos municípios de Suz  instagram.com Suzano abre três processos seletivos para vagas operacionais em Ribas do Rio Pardo  ArapuaNews SESI-PA promove capacitação para professores e SENAI-MS oferece curso com bolsa de R$ 1 mil  Agência de Notícias da Indústria Funtrab anuncia vários cursos gratuitos de qualificação no Estado, veja como se inscrever  funtrab.ms.gov.br Na Capital, EJA é ofertado em 16 escolas e na modalidade à distância; veja lista  Campo Grande News Morre Marcelo Miranda, ex-governador de Mato Grosso do Sul e ex-prefeito de Campo Grande  Portal Água Clara MS Homem esfaqueia companheira por ciúmes e é preso em Água Clara -  Folha de Campo Grande - TCE-MS rejeita contas da prefeita de Água Clara por falhas fiscais  Midiamax Água Clara promove evento “TEAcolher em Rede” para fortalecer inclusão e acolhimento  ArapuaNews Senadora Soraya Thronicke convida população de Costa Rica para participar da Caravana da Castração  MS Todo dia"
Amambai,14,"amambai, municipal, prefeitura, portal, único","Governo licita obras de CEUs da Cultura em quatro cidades e fortalece acesso à arte, educação e cidadania - Portal Único ms.gov.br Coração Valente: com 16% de internos indígenas, presídio de Amambai fortalece cidadania e valores étnicos - Portal Único ms.gov.br Cine Sesi tem 2º maior público do ano em Bonito com 4,9 mil pessoas - Agência de Notícias da Indústria Agendão: fim de semana tem MS Fashion Week, Festa do Leitão no Rolete, exposições e muito teatro - Idest Bioenergia: rodada de empregabilidade oferece mais de 630 vagas em 15 municípios de MS - Portal Único ms.gov.br Últimos dias de inscrições para qualificação profissional a distância no IFMS - Correio de Corumbá Corpo de Bombeiros divulga novo resultado da seleção para bombeiros temporários - Midiamax Notícia - Casa do Trabalhador oferece 89 vagas de emprego e reforça parcerias para desenvolvimento profissi... - Prefeitura Municipal de Amambai Processo seletivo dos Bombeiros MS abre 230 vagas em 30 cidades - JC Concursos Defensoria Itinerante leva atendimento gratuito à população de Amambai nesta sexta-feira - Prefeitura Municipal de Amambai ação de saúde do senar realiza atendimentos gratuitos e beneficia moradores de amambai - Prefeitura Municipal de Amambai Em Amambai, MPMS acompanha implementação de Programas de Integridade na gestão municipal - MPMS TCE-MS vê irregularidades em convênio de R$ 7,7 milhões para reforma de hospital em Amambai - Midiamax Prefeitura de Amambai MS abre processo seletivo para formador municipal - Qconcursos Folha Dirigida Governo licita obras de CEUs da Cultura em quatro cidades e fortalece acesso à arte, educação e cidadania  Portal Único ms.gov.br Coração Valente: com 16% de internos indígenas, presídio de Amambai fortalece cidadania e valores étnicos  Portal Único ms.gov.br Cine Sesi tem 2º maior público do ano em Bonito com 4,9 mil pessoas  Agência de Notícias da Indústria Agendão: fim de semana tem MS Fashion Week, Festa do Leitão no Rolete, exposições e muito teatro  Idest Bioenergia: rodada de empregabilidade oferece mais de 630 vagas em 15 municípios de MS  Portal Único ms.gov.br Últimos dias de inscrições para qualificação profissional a distância no IFMS  Correio de Corumbá Corpo de Bombeiros divulga novo resultado da seleção para bombeiros temporários  Midiamax Notícia - Casa do Trabalhador oferece 89 vagas de emprego e reforça parcerias para desenvolvimento profissi...  Prefeitura Municipal de Amambai Processo seletivo dos Bombeiros MS abre 230 vagas em 30 cidades  JC Concursos Defensoria Itinerante leva atendimento gratuito à população de Amambai nesta sexta-feira  Prefeitura Municipal de Amambai ação de saúde do senar realiza atendimentos gratuitos e beneficia moradores de amambai  Prefeitura Municipal de Amambai Em Amambai, MPMS acompanha implementação de Programas de Integridade na gestão municipal  MPMS TCE-MS vê irregularidades em convênio de R$ 7,7 milhões para reforma de hospital em Amambai  Midiamax Prefeitura de Amambai MS abre processo seletivo para formador municipal  Qconcursos Folha Dirigida"
Anastácio,14,"anastácio, pantaneiro, bombeiros, aquidauana, maior","Agendão: treinão, festas juninas, circo e eventos culturais movimentam MS neste fim de semana - agenciadenoticias.ms.gov.br Aquidauana e Anastácio registram o maior volume de chuva do estado - O Pantaneiro Cine Sesi tem 2º maior público do ano em Bonito com 4,9 mil pessoas - Agência de Notícias da Indústria Tereré é declarado Patrimônio Imaterial e Cultural de MS - O Pantaneiro Corpo de Bombeiros divulga novo resultado da seleção para bombeiros temporários - Midiamax Qualificação beneficia população de MS com melhores oportunidades de emprego - O Pantaneiro Na Capital, EJA é ofertado em 16 escolas e na modalidade à distância; veja lista - Campo Grande News Concursos Contabilidade 2021: confira aqui as previsões! - Blog Gran Cursos Online Processo seletivo dos Bombeiros MS abre 230 vagas em 30 cidades - JC Concursos Estudantes de Anastácio são incentivados ao empreendedorismo com metodologia especial de ensino - ms.agenciasebrae.com.br Lei: Declarada utilidade pública Rede Feminina de Combate ao Câncer de Anastácio - ArapuaNews Audiência pública debate demarcação de áreas da União em Aquidauana e Anastácio - O Pantaneiro Justiça atende pedido do MPMS e anula processo seletivo irregular em Anastácio - MPMS Pacote de R$ 10 milhões prevê de ambulâncias no interior de MS - Midiamax Agendão: treinão, festas juninas, circo e eventos culturais movimentam MS neste fim de semana  agenciadenoticias.ms.gov.br Aquidauana e Anastácio registram o maior volume de chuva do estado  O Pantaneiro Cine Sesi tem 2º maior público do ano em Bonito com 4,9 mil pessoas  Agência de Notícias da Indústria Tereré é declarado Patrimônio Imaterial e Cultural de MS  O Pantaneiro Corpo de Bombeiros divulga novo resultado da seleção para bombeiros temporários  Midiamax Qualificação beneficia população de MS com melhores oportunidades de emprego  O Pantaneiro Na Capital, EJA é ofertado em 16 escolas e na modalidade à distância; veja lista  Campo Grande News Concursos Contabilidade 2021: confira aqui as previsões! Blog Gran Cursos Online Processo seletivo dos Bombeiros MS abre 230 vagas em 30 cidades  JC Concursos Estudantes de Anastácio são incentivados ao empreendedorismo com metodologia especial de ensino  ms.agenciasebrae.com.br Lei: Declarada utilidade pública Rede Feminina de Combate ao Câncer de Anastácio  ArapuaNews Audiência pública debate demarcação de áreas da União em Aquidauana e Anastácio  O Pantaneiro Justiça atende pedido do MPMS e anula processo seletivo irregular em Anastácio  MPMS Pacote de R$ 10 milhões prevê de ambulâncias no interior de MS  Midiamax"
Angélica,12,"prefeitura, novos, atividades, adecoagro, jornalcana","Conheça os perfis e atribuições dos novos secretários e diretores da Prefeitura de Campo Grande – CGNotícias - campogrande.ms.gov.br Cine Sesi tem 2º maior público do ano em Bonito com 4,9 mil pessoas - Agência de Notícias da Indústria Projeto “ODS nos Muros” encerra atividades com roda de conversa e galeria digital - fundacaodecultura.ms.gov.br Confira a programação completa do Delas Day 2026 - funtrab.ms.gov.br Adecoagro inicia Programa Jovens Talentos Aprendizes com Deficiência - JornalCana Adecoagro oferece curso gratuito para formação de operadores de máquinas - JornalCana Secretaria de Educação-MS abre 415 vagas para Assistente de Atividades Educacionais - Ache Concursos PF mira institutos de previdência de cidades de MS que investiram R$ 9 milhões no Banco Master - G1 Previdência de Angélica que investiu no Master é autônoma, diz prefeitura após operação - Midiamax Polícia Civil inaugura a 53ª Sala Lilás do MS, em Japorã - sejusp.ms.gov.br Prefeitura empossa novos membros Conselho Municipal dos Direitos da Mulher - Município de Corumbá Angélica-MS abre seleção para cadastro reserva na Educação em 2026 - Qconcursos Folha Dirigida Conheça os perfis e atribuições dos novos secretários e diretores da Prefeitura de Campo Grande – CGNotícias  campogrande.ms.gov.br Cine Sesi tem 2º maior público do ano em Bonito com 4,9 mil pessoas  Agência de Notícias da Indústria Projeto “ODS nos Muros” encerra atividades com roda de conversa e galeria digital  fundacaodecultura.ms.gov.br Confira a programação completa do Delas Day 2026  funtrab.ms.gov.br Adecoagro inicia Programa Jovens Talentos Aprendizes com Deficiência  JornalCana Adecoagro oferece curso gratuito para formação de operadores de máquinas  JornalCana Secretaria de Educação-MS abre 415 vagas para Assistente de Atividades Educacionais  Ache Concursos PF mira institutos de previdência de cidades de MS que investiram R$ 9 milhões no Banco Master  G1 Previdência de Angélica que investiu no Master é autônoma, diz prefeitura após operação  Midiamax Polícia Civil inaugura a 53ª Sala Lilás do MS, em Japorã  sejusp.ms.gov.br Prefeitura empossa novos membros Conselho Municipal dos Direitos da Mulher  Município de Corumbá Angélica-MS abre seleção para cadastro reserva na Educação em 2026  Qconcursos Folha Dirigida"
Aparecida do Taboado,15,"aparecida, taboado, news, vagas, midiamax","Indicações apresentadas na Câmara Municipal abordam saúde, trânsito, infraestrutura, cultura e assistência social em Aparecida do Taboado - Costa Leste News Taboadão 2026 reforça tradição e impulsiona economia em Aparecida do Taboado - Notícias do Cerrado Agendão: fim de semana tem Expobel, Ação Cidadania, teatro, festas julinas e feirinhas - agenciadenoticias.ms.gov.br Colônia de Férias da FIRJAN, matrículas no SESI-MS e museu de ciência 4.0 na BA - Agência de Notícias da Indústria Neno Razuk destina R$ 5,3 milhões para cidades do interior - capitalnews.com.br Bioenergia: rodada de empregabilidade oferece mais de 630 vagas em 15 municípios de MS - Portal Único ms.gov.br Senai MS: 2 mil vagas em cursos técnicos com bolsa de R$ 300; inscreva-se - Campo Grande News SENAI oferece 60 vagas em cursos técnicos gratuitos em Aparecida do Taboado com auxílio mensal - Costa Leste News Últimos dias de inscrições para qualificação profissional a distância no IFMS - Correio de Corumbá Rodada de Empregabilidade mostra a diversidade de profissões que movem o setor de Bioenergia em MS - Cana Online Aparecida do Taboado pagará R$ 1 milhão para instalar 649 lâmpadas de LED - Midiamax Pacote de R$ 10 milhões prevê de ambulâncias no interior de MS - Midiamax Contrato de iluminação irá custar R$ 1,16 milhão para Aparecida do Taboado - Midiamax Polícia Civil inaugura a 52ª Sala Lilás do MS, em Aparecida do Taboado - pc.ms.gov.br Com expansão da rede de apoio às mulheres, MS inaugura Sala Lilás em Aparecida do Taboado - sejusp.ms.gov.br Indicações apresentadas na Câmara Municipal abordam saúde, trânsito, infraestrutura, cultura e assistência social em Aparecida do Taboado  Costa Leste News Taboadão 2026 reforça tradição e impulsiona economia em Aparecida do Taboado  Notícias do Cerrado Agendão: fim de semana tem Expobel, Ação Cidadania, teatro, festas julinas e feirinhas  agenciadenoticias.ms.gov.br Colônia de Férias da FIRJAN, matrículas no SESI-MS e museu de ciência 4.0 na BA  Agência de Notícias da Indústria Neno Razuk destina R$ 5,3 milhões para cidades do interior  capitalnews.com.br Bioenergia: rodada de empregabilidade oferece mais de 630 vagas em 15 municípios de MS  Portal Único ms.gov.br Senai MS: 2 mil vagas em cursos técnicos com bolsa de R$ 300; inscreva-se  Campo Grande News SENAI oferece 60 vagas em cursos técnicos gratuitos em Aparecida do Taboado com auxílio mensal  Costa Leste News Últimos dias de inscrições para qualificação profissional a distância no IFMS  Correio de Corumbá Rodada de Empregabilidade mostra a diversidade de profissões que movem o setor de Bioenergia em MS  Cana Online Aparecida do Taboado pagará R$ 1 milhão para instalar 649 lâmpadas de LED  Midiamax Pacote de R$ 10 milhões prevê de ambulâncias no interior de MS  Midiamax Contrato de iluminação irá custar R$ 1,16 milhão para Aparecida do Taboado  Midiamax Polícia Civil inaugura a 52ª Sala Lilás do MS, em Aparecida do Taboado  pc.ms.gov.br Com expansão da rede de apoio às mulheres, MS inaugura Sala Lilás em Aparecida do Taboado  sejusp.ms.gov.br"
Aral Moreira,10,"inscrições, ifms, vagas, abre, operador","Últimos dias de inscrições para qualificação profissional a distância no IFMS - Correio de Corumbá Com vagas ilimitadas, IFMS abre inscrições para Curso de Operador de Computador 100% EAD - PEBSP Quer se qualificar sem sair de casa? Cursos EAD gratuitos do IFMS para assistente, operador e vendedor têm inscrições abertas e exigem apenas CPF - CPG Click Petróleo e Gás Sanesul abre processo seletivo com 40 vagas e salário de até R$ 3.189,38 - G1 Secretaria de Educação-MS abre 415 vagas para Assistente de Atividades Educacionais - Ache Concursos Governo promove obras de infraestrutura urbana para transformar realidade de Aral Moreira - ArapuaNews Polícia Civil inaugura a 53ª Sala Lilás do MS, em Japorã - sejusp.ms.gov.br Ponta Porã sedia fase dos Jogos Abertos Regionais de MS - Prefeitura Municipal de Ponta Porã SPU/MS agenda audiência sobre demarcação de rios no MS - Campo Grande News Ação conjunta de vacinação fortalece integração entre Brasil e Paraguai na fronteira - agenciadenoticias.ms.gov.br Últimos dias de inscrições para qualificação profissional a distância no IFMS  Correio de Corumbá Com vagas ilimitadas, IFMS abre inscrições para Curso de Operador de Computador 100% EAD  PEBSP Quer se qualificar sem sair de casa? Cursos EAD gratuitos do IFMS para assistente, operador e vendedor têm inscrições abertas e exigem apenas CPF  CPG Click Petróleo e Gás Sanesul abre processo seletivo com 40 vagas e salário de até R$ 3.189,38  G1 Secretaria de Educação-MS abre 415 vagas para Assistente de Atividades Educacionais  Ache Concursos Governo promove obras de infraestrutura urbana para transformar realidade de Aral Moreira  ArapuaNews Polícia Civil inaugura a 53ª Sala Lilás do MS, em Japorã  sejusp.ms.gov.br Ponta Porã sedia fase dos Jogos Abertos Regionais de MS  Prefeitura Municipal de Ponta Porã SPU/MS agenda audiência sobre demarcação de rios no MS  Campo Grande News Ação conjunta de vacinação fortalece integração entre Brasil e Paraguai na fronteira  agenciadenoticias.ms.gov.br"
Bataguassu,14,"bataguassu, prefeitura, municipal, vagas, turismo","Festival de Dança Coreografada da Melhor Idade define campeões - fundesporte.ms.gov.br Turismo rural, pesca e eventos no caminho do Pontal do Paranapanema - GOV.BR Centro de Esporte e Cultura oferece atividades gratuitas em Campo Grande - Campo Grande News A tocha olímpica em um destino abençoado pela natureza — Ministério do Turismo - GOV.BR Jovens de Bataguassu terão acesso a cursos técnicos gratuitos com bolsa de R$ 300 - prefeitura municipal de bataguassu (ms) Corpo de Bombeiros divulga novo resultado da seleção para bombeiros temporários - Midiamax Faça um curso técnico gratuito e ganhe R$ 300 por mês: são 60 vagas abertas em cursos técnicos gratuitos para estudar Eletrotécnica ou Planejamento e Controle da Produção (PCP) com apoio do SENAI-MS e da Prefeitura de Bataguassu - CPG Click Petróleo e Gás GIRO FUNTRAB DE NOTÍCIAS – 30/07/2025 a 06/08/2025 - funtrab.ms.gov.br SAD - SEJUSP- CBMMS divulga Processo Seletivo com 230 vagas - PCI Concursos Prestação de contas entregue com sucesso: Bataguassu se destaca no primeiro ano de utilização do e-Sfinge - prefeitura municipal de bataguassu (ms) Plano de Desenvolvimento Municipal projeta Bataguassu como hub logístico e produtivo no leste de Mato Grosso do Sul - ms.agenciasebrae.com.br Projetos de pavimentação custarão até R$ 7,8 milhões a Bataguassu - Midiamax Prefeitura firma parceria com Polícia Militar e Governo do Estado para implementar o PROMUSE - prefeitura municipal de bataguassu (ms) Prefeitura de Bataguassu - MS abre vagas e cadastro de reserva em processo seletivo simplificado - PCI Concursos Festival de Dança Coreografada da Melhor Idade define campeões  fundesporte.ms.gov.br Turismo rural, pesca e eventos no caminho do Pontal do Paranapanema  GOV.BR Centro de Esporte e Cultura oferece atividades gratuitas em Campo Grande  Campo Grande News A tocha olímpica em um destino abençoado pela natureza — Ministério do Turismo  GOV.BR Jovens de Bataguassu terão acesso a cursos técnicos gratuitos com bolsa de R$ 300  prefeitura municipal de bataguassu (ms) Corpo de Bombeiros divulga novo resultado da seleção para bombeiros temporários  Midiamax Faça um curso técnico gratuito e ganhe R$ 300 por mês: são 60 vagas abertas em cursos técnicos gratuitos para estudar Eletrotécnica ou Planejamento e Controle da Produção (PCP) com apoio do SENAI-MS e da Prefeitura de Bataguassu  CPG Click Petróleo e Gás GIRO FUNTRAB DE NOTÍCIAS – 30/07/2025 a 06/08/2025  funtrab.ms.gov.br SAD - SEJUSP- CBMMS divulga Processo Seletivo com 230 vagas  PCI Concursos Prestação de contas entregue com sucesso: Bataguassu se destaca no primeiro ano de utilização do e-Sfinge  prefeitura municipal de bataguassu (ms) Plano de Desenvolvimento Municipal projeta Bataguassu como hub logístico e produtivo no leste de Mato Grosso do Sul  ms.agenciasebrae.com.br Projetos de pavimentação custarão até R$ 7,8 milhões a Bataguassu  Midiamax Prefeitura firma parceria com Polícia Militar e Governo do Estado para implementar o PROMUSE  prefeitura municipal de bataguassu (ms) Prefeitura de Bataguassu - MS abre vagas e cadastro de reserva em processo seletivo simplificado  PCI Concursos"
Batayporã,11,"abre, concursos, prefeitura, batayporã, vagas","Festival de Dança Coreografada da Melhor Idade define campeões - fundesporte.ms.gov.br Prefeitura de Batayporã-MS abre vagas para Técnico em Radiologia - Ache Concursos Frigorífico Zanchetta abre vagas de emprego em Batayporã - Jornal da Nova Aeronáutica e mais 7 concursos abrem inscrições nos dias 11 e 12/06 - Ache Concursos Câmara de Jateí-MS abre concurso público para 3 cargos - Ache Concursos Secretaria de Educação-MS abre 415 vagas para Assistente de Atividades Educacionais - Ache Concursos Hashioka visita prefeito Germino e reforça parceri... - Assembleia Legislativa de Mato Grosso do Sul - Prefeitura de Batayporã MS abre processo seletivo com 4 vagas - Qconcursos Folha Dirigida Prefeitura de Batayporã - MS abre processo seletivo para professor de ensino fundamental - PCI Concursos Prefeitura de Batayporã - MS abre vagas para Coveiro, Tratorista, Pedreiro e Trabalhador Braçal - PCI Concursos Ponta Porã é beneficiada com parceria da Assomasul com Itaipu e Faculdade Pólis Civitas - Prefeitura Municipal de Ponta Porã Festival de Dança Coreografada da Melhor Idade define campeões  fundesporte.ms.gov.br Prefeitura de Batayporã-MS abre vagas para Técnico em Radiologia  Ache Concursos Frigorífico Zanchetta abre vagas de emprego em Batayporã  Jornal da Nova Aeronáutica e mais 7 concursos abrem inscrições nos dias 11 e 12/06  Ache Concursos Câmara de Jateí-MS abre concurso público para 3 cargos  Ache Concursos Secretaria de Educação-MS abre 415 vagas para Assistente de Atividades Educacionais  Ache Concursos Hashioka visita prefeito Germino e reforça parceri...  Assembleia Legislativa de Mato Grosso do Sul - Prefeitura de Batayporã MS abre processo seletivo com 4 vagas  Qconcursos Folha Dirigida Prefeitura de Batayporã - MS abre processo seletivo para professor de ensino fundamental  PCI Concursos Prefeitura de Batayporã - MS abre vagas para Coveiro, Tratorista, Pedreiro e Trabalhador Braçal  PCI Concursos Ponta Porã é beneficiada com parceria da Assomasul com Itaipu e Faculdade Pólis Civitas  Prefeitura Municipal de Ponta Porã"
Bela Vista,15,"abre, notícias, midiamax, seleção, completa","MS lança o 1º Festival de Cultura da Rota Bioceânica e abre seleção para artistas! - Enfoque MS Agendão: fim de semana tem Expobel, Ação Cidadania, teatro, festas julinas e feirinhas - agenciadenoticias.ms.gov.br Vencedores do Prêmio Braztoa de Sustentabilidade 2024 são anunciados durante cerimônia em Gramado (RS) - GOV.BR Virada Cultural 2025 de SP: veja programação completa do evento, que completa 20 anos - G1 Cine Sesi tem 2º maior público do ano em Bonito com 4,9 mil pessoas - Agência de Notícias da Indústria GIRO FUNTRAB DE NOTÍCIAS – 03/06/2025 a 16/06/2025 - funtrab.ms.gov.br Corpo de Bombeiros divulga novo resultado da seleção para bombeiros temporários - Midiamax Sebrae/MS abre processo seletivo com vagas em Campo Grande - ms.agenciasebrae.com.br Vaga de estágio no IEL: 1,8 mil oportunidades pelo Brasil - Agência de Notícias da Indústria Senai abre mais de 5 mil vagas gratuitas para cursos de qualificação profissional no ES - G1 Secretário municipal de Planejamento e Eficiência de SP, Clodoaldo Pelizzoni, morre aos 56 anos - G1 Promotoria pede que Justiça monitore gastos da prefeitura de Bela Vista ao transferir idosos - Midiamax Audiência pública vai debater demarcação de áreas da União em Ponta Porã - diariodigital.com.br Após sentença, prefeitura cobra ata para agilizar transferência de idosos em Bela Vista - Midiamax MP proíbe município de expor fotos de alunos sem autorização dos pais - Campo Grande News MS lança o 1º Festival de Cultura da Rota Bioceânica e abre seleção para artistas! Enfoque MS Agendão: fim de semana tem Expobel, Ação Cidadania, teatro, festas julinas e feirinhas  agenciadenoticias.ms.gov.br Vencedores do Prêmio Braztoa de Sustentabilidade 2024 são anunciados durante cerimônia em Gramado (RS)  GOV.BR Virada Cultural 2025 de SP: veja programação completa do evento, que completa 20 anos  G1 Cine Sesi tem 2º maior público do ano em Bonito com 4,9 mil pessoas  Agência de Notícias da Indústria GIRO FUNTRAB DE NOTÍCIAS – 03/06/2025 a 16/06/2025  funtrab.ms.gov.br Corpo de Bombeiros divulga novo resultado da seleção para bombeiros temporários  Midiamax Sebrae/MS abre processo seletivo com vagas em Campo Grande  ms.agenciasebrae.com.br Vaga de estágio no IEL: 1,8 mil oportunidades pelo Brasil  Agência de Notícias da Indústria Senai abre mais de 5 mil vagas gratuitas para cursos de qualificação profissional no ES  G1 Secretário municipal de Planejamento e Eficiência de SP, Clodoaldo Pelizzoni, morre aos 56 anos  G1 Promotoria pede que Justiça monitore gastos da prefeitura de Bela Vista ao transferir idosos  Midiamax Audiência pública vai debater demarcação de áreas da União em Ponta Porã  diariodigital.com.br Após sentença, prefeitura cobra ata para agilizar transferência de idosos em Bela Vista  Midiamax MP proíbe município de expor fotos de alunos sem autorização dos pais  Campo Grande News"
