municipio,qtd_noticias_encontradas,temas_frequentes,resumo_para_slide
Brasilândia,8,"brasilândia, municipal, completa, anos, casa","Virada Cultural 2025 de SP: veja programação completa do evento, que completa 20 anos - G1 Com R$ 3,2 bilhões, MS teve aumento de 227% nos investimentos públicos nos últimos três anos - agenciadenoticias.ms.gov.br Casa do Trabalhador de Brasilândia supera mil atendimentos e garante 74 inserções no mercado em pouco mais de 100 dias - funtrab.ms.gov.br Casa do Trabalhador de Brasilândia supera mil atendimentos e garante 74 inserções no mercado em pouco mais de 100 dias - funtrab.ms.gov.br REFERÊNCIA: Almoxarifado Central de Bataguassu recebe visitas técnicas das Prefeituras de Água Clara e Brasilândia - prefeitura municipal de bataguassu (ms) Pesquisa que transforma: Professor da rede municipal apresenta estudo sobre os impactos do programa ""Cuidar Bem"" à gestão municipal - Notícias em Rede Prefeitura de Brasilândia-MS abre seleção para cadastro reserva - Ache Concursos TJ-MS condena improbidade em contrato de R$ 893 mil em Brasilândia - Campo Grande News Virada Cultural 2025 de SP: veja programação completa do evento, que completa 20 anos  G1 Com R$ 3,2 bilhões, MS teve aumento de 227% nos investimentos públicos nos últimos três anos  agenciadenoticias.ms.gov.br Casa do Trabalhador de Brasilândia supera mil atendimentos e garante 74 inserções no mercado em pouco mais de 100 dias  funtrab.ms.gov.br Casa do Trabalhador de Brasilândia supera mil atendimentos e garante 74 inserções no mercado em pouco mais de 100 dias  funtrab.ms.gov.br REFERÊNCIA: Almoxarifado Central de Bataguassu recebe visitas técnicas das Prefeituras de Água Clara e Brasilândia  prefeitura municipal de bataguassu (ms) Pesquisa que transforma: Professor da rede municipal apresenta estudo sobre os impactos do programa ""Cuidar Bem"" à gestão municipal  Notícias em Rede Prefeitura de Brasilândia-MS abre seleção para cadastro reserva  Ache Concursos TJ-MS condena improbidade em contrato de R$ 893 mil em Brasilândia  Campo Grande News"
Caarapó,11,"caarapó, vagas, funtrab, municípios, semadesc","Neno Razuk investe mais de R$ 5 milhões em emendas e transforma municípios de MS - Assembleia Legislativa de Mato Grosso do Sul - Bioenergia: rodada de empregabilidade oferece mais de 630 vagas em 15 municípios de MS - agenciadenoticias.ms.gov.br MS registra alta de empregos formais em julho de 2025 com saldo de 3.023 vagas - funtrab.ms.gov.br Funtrab e Biosul iniciam 2ª Rodada da Empregabilidade com 637 vagas em 15 municípios - semadesc.ms.gov.br Raízen abre mais de 400 vagas para programa de aprendiz - Revista Cultivar GIRO FUNTRAB DE NOTÍCIAS – 10/09/2025 a 25/09/2025 - funtrab.ms.gov.br Caarapó abre processo para empresas interessadas no fornecimento de utensílios para a Assistência Social - A Gazeta News Câmara de Caarapó devolve à prefeitura R$ 3,7 milhões; dinheiro ajuda erguer hospital e quitar folha do serviço municipal - Midiamax Semadesc participa da abertura da Exposição Agropecuária de Caarapó - semadesc.ms.gov.br Prefeitura abre licitação para ampliar balneário de Caarapó com novos quiosques e banheiros - capitalnews.com.br Prefeitura de Caarapó (MS) publica edital com oportunidades em diversos níveis - Concursos no Brasil Neno Razuk investe mais de R$ 5 milhões em emendas e transforma municípios de MS  Assembleia Legislativa de Mato Grosso do Sul - Bioenergia: rodada de empregabilidade oferece mais de 630 vagas em 15 municípios de MS  agenciadenoticias.ms.gov.br MS registra alta de empregos formais em julho de 2025 com saldo de 3.023 vagas  funtrab.ms.gov.br Funtrab e Biosul iniciam 2ª Rodada da Empregabilidade com 637 vagas em 15 municípios  semadesc.ms.gov.br Raízen abre mais de 400 vagas para programa de aprendiz  Revista Cultivar GIRO FUNTRAB DE NOTÍCIAS – 10/09/2025 a 25/09/2025  funtrab.ms.gov.br Caarapó abre processo para empresas interessadas no fornecimento de utensílios para a Assistência Social  A Gazeta News Câmara de Caarapó devolve à prefeitura R$ 3,7 milhões; dinheiro ajuda erguer hospital e quitar folha do serviço municipal  Midiamax Semadesc participa da abertura da Exposição Agropecuária de Caarapó  semadesc.ms.gov.br Prefeitura abre licitação para ampliar balneário de Caarapó com novos quiosques e banheiros  capitalnews.com.br Prefeitura de Caarapó (MS) publica edital com oportunidades em diversos níveis  Concursos no Brasil"
Cassilândia,7,"cassilândia, mato, grosso, prefeito, rodrigo","Oficina estratégica realizada pela Fundtur MS fortalece planejamento do turismo em Cassilândia - Mato Grosso do Sul Notícias Feirão de Empregos da Arauco Celulose do Brasil S.A. oferece vagas na área florestal em Cassilândia - funtrab.ms.gov.br Ao lado do prefeito Rodrigo, Caravina entrega recu... - Assembleia Legislativa de Mato Grosso do Sul - Prefeito Rodrigo Freitas cria Plano Municipal do Esporte em Cassilândia com Bolsa Atleta e investimentos até 2036 - MS Todo dia Saúde de Cassilândia realizou mais de 95 procedimentos e atendimentos durante o mês de abril - MS Todo dia Sebrae/MS, Governo do Estado e Prefeitura lançam Plano de Desenvolvimento Municipal de Cassilândia - O Correio News Servidora morre após cair de ponte durante trilha com ex-marido em Cassilândia - G1 Oficina estratégica realizada pela Fundtur MS fortalece planejamento do turismo em Cassilândia  Mato Grosso do Sul Notícias Feirão de Empregos da Arauco Celulose do Brasil S.A. oferece vagas na área florestal em Cassilândia  funtrab.ms.gov.br Ao lado do prefeito Rodrigo, Caravina entrega recu...  Assembleia Legislativa de Mato Grosso do Sul - Prefeito Rodrigo Freitas cria Plano Municipal do Esporte em Cassilândia com Bolsa Atleta e investimentos até 2036  MS Todo dia Saúde de Cassilândia realizou mais de 95 procedimentos e atendimentos durante o mês de abril  MS Todo dia Sebrae/MS, Governo do Estado e Prefeitura lançam Plano de Desenvolvimento Municipal de Cassilândia  O Correio News Servidora morre após cair de ponte durante trilha com ex-marido em Cassilândia  G1"
Chapadão do Sul,15,"funtrab, vagas, pública, news, audiência","Semana S oferece cursos grátis e show de Michel Teló - Campo Grande News Ponta Porã recebe etapa dos Jogos da Melhor Idade com disputas de bocha - Portal Único ms.gov.br Plano Estadual de Esporte e Lazer de MS trará diretrizes do setor para os próximos 10 anos - agenciadenoticias.ms.gov.br Festival de Dança Coreografada da Melhor Idade define campeões - fundesporte.ms.gov.br Funtrab leva serviços de emprego e cidadania em ação social do Projeto Asas do Futuro na Cohab - funtrab.ms.gov.br Funtrab anuncia vagas em Campo Grande e Terenos com salários de até R$ 3 mil e benefícios - funtrab.ms.gov.br Bioenergia: rodada de empregabilidade oferece mais de 630 vagas em 15 municípios de MS - Portal Único ms.gov.br Abertas inscrições para oficinas de artesanato na Casa de Qualificação da Funtrab - funtrab.ms.gov.br Casa do Trabalhador de Dourados disponibiliza 52 vagas nesta quarta-feira - funtrab.ms.gov.br Funtrab disponibiliza 43 vagas para técnico de enfermagem - funtrab.ms.gov.br Chapadão do Sul realizará Audiência Pública da Causa Animal no dia 15 de junho. Cães de rua estarão na pauta - Chapadense News Prefeitura convoca população para Audiência Pública da Saúde referente ao 1º quadrimestre de 2026 - Jovem Sul News Prefeitura de Alcinópolis apresenta planejamento financeiro e prioridades para 2027 durante audiência pública - MS Todo dia “Planejamento é a base gestão pública e ferramenta para desenvolvimento dos municípios”, diz titular da Semadesc - semadesc.ms.gov.br Polícia Civil inaugura a 53ª Sala Lilás do MS, em Japorã - pc.ms.gov.br Semana S oferece cursos grátis e show de Michel Teló  Campo Grande News Ponta Porã recebe etapa dos Jogos da Melhor Idade com disputas de bocha  Portal Único ms.gov.br Plano Estadual de Esporte e Lazer de MS trará diretrizes do setor para os próximos 10 anos  agenciadenoticias.ms.gov.br Festival de Dança Coreografada da Melhor Idade define campeões  fundesporte.ms.gov.br Funtrab leva serviços de emprego e cidadania em ação social do Projeto Asas do Futuro na Cohab  funtrab.ms.gov.br Funtrab anuncia vagas em Campo Grande e Terenos com salários de até R$ 3 mil e benefícios  funtrab.ms.gov.br Bioenergia: rodada de empregabilidade oferece mais de 630 vagas em 15 municípios de MS  Portal Único ms.gov.br Abertas inscrições para oficinas de artesanato na Casa de Qualificação da Funtrab  funtrab.ms.gov.br Casa do Trabalhador de Dourados disponibiliza 52 vagas nesta quarta-feira  funtrab.ms.gov.br Funtrab disponibiliza 43 vagas para técnico de enfermagem  funtrab.ms.gov.br Chapadão do Sul realizará Audiência Pública da Causa Animal no dia 15 de junho. Cães de rua estarão na pauta  Chapadense News Prefeitura convoca população para Audiência Pública da Saúde referente ao 1º quadrimestre de 2026  Jovem Sul News Prefeitura de Alcinópolis apresenta planejamento financeiro e prioridades para 2027 durante audiência pública  MS Todo dia “Planejamento é a base gestão pública e ferramenta para desenvolvimento dos municípios”, diz titular da Semadesc  semadesc.ms.gov.br Polícia Civil inaugura a 53ª Sala Lilás do MS, em Japorã  pc.ms.gov.br"
Coronel Sapucaia,12,"gaeco, prefeitura, coronel, sapucaia, contra","Expogrande 2026: Fiems leva educação e inovação, além de curso de fabricação de linguiça - agorams.com.br Agendão: fim de semana vem com stand-up, espetáculos, Natal na Praça e rodeio - agenciadenoticias.ms.gov.br Seis Casas do Trabalhador fecham no feriado de 8 de dezembro em MS - funtrab.ms.gov.br Alunos da rede estadual de MS aliam Ensino Médio a cursos técnicos e conquistam empregos - Campo Grande News Semana começa com 14 processos seletivos abertos em MS; veja todos aqui! - Enfoque MS Secretaria de Educação-MS abre 415 vagas para Assistente de Atividades Educacionais - Ache Concursos 75 vagas de jovens aprendizes em Deodápolis, Glória de Dourados e Nova Alvorada do Sul - Rede Jota FM Gaeco volta à Prefeitura de Coronel Sapucaia contra grupo que fraudou licitações - Midiamax Prefeitura tem 90 dias para regulamentar uso de nome social de pessoas trans - Campo Grande News Gaeco apreende fortuna em nova fase de operação contra corrupção em Coronel Sapucaia - ojacare.com.br Empresa investigada pelo Gaeco recebeu R$ 15 milhões em Coronel Sapucaia - brasilnoticia.com.br Gaeco deflagra operação “Mão Dupla” contra corrupção em prefeitura de MS - Idest Expogrande 2026: Fiems leva educação e inovação, além de curso de fabricação de linguiça  agorams.com.br Agendão: fim de semana vem com stand-up, espetáculos, Natal na Praça e rodeio  agenciadenoticias.ms.gov.br Seis Casas do Trabalhador fecham no feriado de 8 de dezembro em MS  funtrab.ms.gov.br Alunos da rede estadual de MS aliam Ensino Médio a cursos técnicos e conquistam empregos  Campo Grande News Semana começa com 14 processos seletivos abertos em MS; veja todos aqui! Enfoque MS Secretaria de Educação-MS abre 415 vagas para Assistente de Atividades Educacionais  Ache Concursos 75 vagas de jovens aprendizes em Deodápolis, Glória de Dourados e Nova Alvorada do Sul  Rede Jota FM Gaeco volta à Prefeitura de Coronel Sapucaia contra grupo que fraudou licitações  Midiamax Prefeitura tem 90 dias para regulamentar uso de nome social de pessoas trans  Campo Grande News Gaeco apreende fortuna em nova fase de operação contra corrupção em Coronel Sapucaia  ojacare.com.br Empresa investigada pelo Gaeco recebeu R$ 15 milhões em Coronel Sapucaia  brasilnoticia.com.br Gaeco deflagra operação “Mão Dupla” contra corrupção em prefeitura de MS  Idest"
Deodápolis,12,"deodápolis, mpms, vagas, mato, grosso","Neno Razuk investe mais de R$ 5 milhões em emendas e transforma municípios de MS - Assembleia Legislativa de Mato Grosso do Sul - Agendão: Expogrande, Festival Expressão de Rua e festas no interior agitam o fim de semana em MS - agenciadenoticias.ms.gov.br MS Ativo: Governo de MS promove encontros regionais para fortalecer a gestão municipal - funtrab.ms.gov.br Atvos abre 50 vagas para jovens aprendizes em Nova Alvorada do Sul e Deodápolis -MS - JornalCana 75 vagas de jovens aprendizes em Deodápolis, Glória de Dourados e Nova Alvorada do Sul - Rede Jota FM Empresa quebra paradigma, capacita e emprega filhos de funcionários - notícias em Mato Grosso do Sul - G1 Secretaria de Educação-MS abre 415 vagas para Assistente de Atividades Educacionais - Ache Concursos MPMS intensifica ações em Deodápolis no Agosto Lilás e fortalece rede de proteção às mulheres - MPMS Polícia Civil inaugura a 53ª Sala Lilás do MS, em Japorã - pc.ms.gov.br Projeto Plantando Liberdade: reintegração social e sustentabilidade ambiental em Deodápolis - MPMS Deodápolis terá polo empresarial de 22 hectares com recursos do PRÓ-DESENVOLVE - semadesc.ms.gov.br Conselho do MPMS arquiva investigações e aprecia medida à animosidade de advogados - Midiamax Neno Razuk investe mais de R$ 5 milhões em emendas e transforma municípios de MS  Assembleia Legislativa de Mato Grosso do Sul - Agendão: Expogrande, Festival Expressão de Rua e festas no interior agitam o fim de semana em MS  agenciadenoticias.ms.gov.br MS Ativo: Governo de MS promove encontros regionais para fortalecer a gestão municipal  funtrab.ms.gov.br Atvos abre 50 vagas para jovens aprendizes em Nova Alvorada do Sul e Deodápolis -MS  JornalCana 75 vagas de jovens aprendizes em Deodápolis, Glória de Dourados e Nova Alvorada do Sul  Rede Jota FM Empresa quebra paradigma, capacita e emprega filhos de funcionários - notícias em Mato Grosso do Sul  G1 Secretaria de Educação-MS abre 415 vagas para Assistente de Atividades Educacionais  Ache Concursos MPMS intensifica ações em Deodápolis no Agosto Lilás e fortalece rede de proteção às mulheres  MPMS Polícia Civil inaugura a 53ª Sala Lilás do MS, em Japorã  pc.ms.gov.br Projeto Plantando Liberdade: reintegração social e sustentabilidade ambiental em Deodápolis  MPMS Deodápolis terá polo empresarial de 22 hectares com recursos do PRÓ-DESENVOLVE  semadesc.ms.gov.br Conselho do MPMS arquiva investigações e aprecia medida à animosidade de advogados  Midiamax"
Dois Irmãos do Buriti,15,"campo, grande, news, buriti, cultura","Carreta-palco do Circuito Cultura MS segue para a região central com nova rodada de apresentações - agenciadenoticias.ms.gov.br Neno Razuk investe mais de R$ 5 milhões em emendas e transforma municípios de MS - Assembleia Legislativa de Mato Grosso do Sul - Festival de Inverno em Campo Grande: turismo rural revela encantos do Brasil - Campo Grande News Com o dobro de barracas, retorno da Festa do Peixe deve ter mais de 3.500 mil kg de pescado - O Pantaneiro Agendão: Expogrande, Festival Expressão de Rua e festas no interior agitam o fim de semana em MS - agenciadenoticias.ms.gov.br Citricultura cresce em Mato Grosso do Sul e muda a vida de trabalhadores - funtrab.ms.gov.br Na Capital, EJA é ofertado em 16 escolas e na modalidade à distância; veja lista - Campo Grande News Suzano abre três processos seletivos para vagas operacionais em Ribas do Rio Pardo - ArapuaNews Secretaria de Educação-MS abre 415 vagas para Assistente de Atividades Educacionais - Ache Concursos Voucher Desenvolvedor: Governo vai abrir inscrições de processo seletivo para curso de qualificação de TI - ArapuaNews Próxima edição do Caminho do Acordo será na Aldeia Água Branca, em Aquidauana/MS - trf3.jus.br Polícia Civil inaugura a 53ª Sala Lilás do MS, em Japorã - pc.ms.gov.br Dois Irmãos do Buriti inaugura novo plenário da Câmara Municipal - O Pantaneiro Dois Irmãos do Buriti celebra 38 anos com festa, cultura e muita música - Buriti News Caos histórico: destaques, decisões e impactos na saúde pública de MS em 2025 - Midiamax Carreta-palco do Circuito Cultura MS segue para a região central com nova rodada de apresentações  agenciadenoticias.ms.gov.br Neno Razuk investe mais de R$ 5 milhões em emendas e transforma municípios de MS  Assembleia Legislativa de Mato Grosso do Sul - Festival de Inverno em Campo Grande: turismo rural revela encantos do Brasil  Campo Grande News Com o dobro de barracas, retorno da Festa do Peixe deve ter mais de 3.500 mil kg de pescado  O Pantaneiro Agendão: Expogrande, Festival Expressão de Rua e festas no interior agitam o fim de semana em MS  agenciadenoticias.ms.gov.br Citricultura cresce em Mato Grosso do Sul e muda a vida de trabalhadores  funtrab.ms.gov.br Na Capital, EJA é ofertado em 16 escolas e na modalidade à distância; veja lista  Campo Grande News Suzano abre três processos seletivos para vagas operacionais em Ribas do Rio Pardo  ArapuaNews Secretaria de Educação-MS abre 415 vagas para Assistente de Atividades Educacionais  Ache Concursos Voucher Desenvolvedor: Governo vai abrir inscrições de processo seletivo para curso de qualificação de TI  ArapuaNews Próxima edição do Caminho do Acordo será na Aldeia Água Branca, em Aquidauana/MS  trf3.jus.br Polícia Civil inaugura a 53ª Sala Lilás do MS, em Japorã  pc.ms.gov.br Dois Irmãos do Buriti inaugura novo plenário da Câmara Municipal  O Pantaneiro Dois Irmãos do Buriti celebra 38 anos com festa, cultura e muita música  Buriti News Caos histórico: destaques, decisões e impactos na saúde pública de MS em 2025  Midiamax"
Eldorado,15,"eldorado, funtrab, abre, anos, notícias","Eldorado 50 anos: Governo reafirma a cultura como eixo estratégico do desenvolvimento do Estado - MSdoSul Eldorado celebrou 50 anos com entrega do Espaço Cultural Arandu e novos investimentos na cidade - ArapuaNews Hashioka participa das comemorações pelos 50 anos de Eldorado e inaugura Centro de eventos - O sul-mato-grossense SESI-MS apresenta projeto de carbono na COP30 e SESI-SP investe em inovação na saúde - Agência de Notícias da Indústria Circuito Sesc de Artes chega a 9 cidades do Vale do Ribeira - Sesc São Paulo GIRO FUNTRAB DE NOTÍCIAS – 19/07/2025 a 29/07/2025 - funtrab.ms.gov.br Fundação Hospitalar de Eldorado (MS) abre seletivo com salário até R$ 3,8 mil - Concursos no Brasil Eldorado Brasil abre 50 vagas para programa Jovem Aprendiz em Três Lagoas (MS) - Portal Celulose GIRO FUNTRAB DE NOTÍCIAS – 30/07/2025 a 06/08/2025 - funtrab.ms.gov.br Senai abre 355 vagas em cursos gratuitos em 13 cidades de MS - Campo Grande News Polícia Civil inaugura a 53ª Sala Lilás do MS, em Japorã - sejusp.ms.gov.br Sem exigência de escolaridade: prefeitura abre seletivo com salário de R$ 1,5 mil - Primeira Página Prefeitura de Eldorado (MS) publica edital de processo seletivo - Concursos no Brasil MP investiga irregularidades na criação de cargos em Eldorado - Campo Grande News Dia de Campo do Amendoim reúne produtores rurais em Eldorado - A Gazeta News Eldorado 50 anos: Governo reafirma a cultura como eixo estratégico do desenvolvimento do Estado  MSdoSul Eldorado celebrou 50 anos com entrega do Espaço Cultural Arandu e novos investimentos na cidade  ArapuaNews Hashioka participa das comemorações pelos 50 anos de Eldorado e inaugura Centro de eventos  O sul-mato-grossense SESI-MS apresenta projeto de carbono na COP30 e SESI-SP investe em inovação na saúde  Agência de Notícias da Indústria Circuito Sesc de Artes chega a 9 cidades do Vale do Ribeira  Sesc São Paulo GIRO FUNTRAB DE NOTÍCIAS – 19/07/2025 a 29/07/2025  funtrab.ms.gov.br Fundação Hospitalar de Eldorado (MS) abre seletivo com salário até R$ 3,8 mil  Concursos no Brasil Eldorado Brasil abre 50 vagas para programa Jovem Aprendiz em Três Lagoas (MS)  Portal Celulose GIRO FUNTRAB DE NOTÍCIAS – 30/07/2025 a 06/08/2025  funtrab.ms.gov.br Senai abre 355 vagas em cursos gratuitos em 13 cidades de MS  Campo Grande News Polícia Civil inaugura a 53ª Sala Lilás do MS, em Japorã  sejusp.ms.gov.br Sem exigência de escolaridade: prefeitura abre seletivo com salário de R$ 1,5 mil  Primeira Página Prefeitura de Eldorado (MS) publica edital de processo seletivo  Concursos no Brasil MP investiga irregularidades na criação de cargos em Eldorado  Campo Grande News Dia de Campo do Amendoim reúne produtores rurais em Eldorado  A Gazeta News"
Fátima do Sul,15,"fátima, bombeiros, vagas, anos, correio","Cresce 24% o número de brasileiros migrando para essa cidade universitária de alto padrão perto do Paraguai nos últimos 12 anos - Correio Braziliense Clima bom, gente acolhedora e futuro promissor em uma das cidades mais estratégicas do Brasil - Revista Oeste Confira a agenda cultural do fim de semana ? - Primeira Página AGENDÃO: Fim de semana tem Campão Cultural, Expogrande e feiras criativas, confira a programação - Fátima News Plano Estadual de Esporte e Lazer de MS trará diretrizes do setor para os próximos 10 anos - Fátima News Corpo de Bombeiros divulga novo resultado da seleção para bombeiros temporários - Midiamax Com economia forte e diversificada, MS atrai empresas e tem geração de emprego em todas as áreas - funtrab.ms.gov.br Processo seletivo dos Bombeiros MS abre 230 vagas em 30 cidades - JC Concursos SAD - SEJUSP- CBMMS divulga Processo Seletivo com 230 vagas - PCI Concursos Bombeiros divulgam resultado da seleção que ofertou 230 vagas para soldado auxiliar - Midiamax MPMS recomenda implantação de Caps I em Fátima do Sul para fortalecer rede de saúde mental - MPMS FINANÇAS: Decreto impõe prazos para fornecedores e servidores municipais em Fátima do Sul - Fátima em Dia Adriane e prefeitos de MS terão que cobrir rombo de R$ 16 milhões investidos no Master - ojacare.com.br Prefeitura de Dourados amplia oferta de cursos gratuitos para educadores - diariodigital.com.br Prefeituras de MS terão que cobrir rombo causado pelo Banco Master, diz Governo Federal - Correio do Estado Cresce 24% o número de brasileiros migrando para essa cidade universitária de alto padrão perto do Paraguai nos últimos 12 anos  Correio Braziliense Clima bom, gente acolhedora e futuro promissor em uma das cidades mais estratégicas do Brasil  Revista Oeste Confira a agenda cultural do fim de semana ? Primeira Página AGENDÃO: Fim de semana tem Campão Cultural, Expogrande e feiras criativas, confira a programação  Fátima News Plano Estadual de Esporte e Lazer de MS trará diretrizes do setor para os próximos 10 anos  Fátima News Corpo de Bombeiros divulga novo resultado da seleção para bombeiros temporários  Midiamax Com economia forte e diversificada, MS atrai empresas e tem geração de emprego em todas as áreas  funtrab.ms.gov.br Processo seletivo dos Bombeiros MS abre 230 vagas em 30 cidades  JC Concursos SAD - SEJUSP- CBMMS divulga Processo Seletivo com 230 vagas  PCI Concursos Bombeiros divulgam resultado da seleção que ofertou 230 vagas para soldado auxiliar  Midiamax MPMS recomenda implantação de Caps I em Fátima do Sul para fortalecer rede de saúde mental  MPMS FINANÇAS: Decreto impõe prazos para fornecedores e servidores municipais em Fátima do Sul  Fátima em Dia Adriane e prefeitos de MS terão que cobrir rombo de R$ 16 milhões investidos no Master  ojacare.com.br Prefeitura de Dourados amplia oferta de cursos gratuitos para educadores  diariodigital.com.br Prefeituras de MS terão que cobrir rombo causado pelo Banco Master, diz Governo Federal  Correio do Estado"
