municipio,qtd_noticias_encontradas,temas_frequentes,resumo_para_slide
Brasilândia,8,"brasilândia, funtrab, completa, anos, casa","Virada Cultural 2025 de SP: veja programação completa do evento, que completa 20 anos - G1 Com R$ 3,2 bilhões, MS teve aumento de 227% nos investimentos públicos nos últimos três anos - agenciadenoticias.ms.gov.br Casa do Trabalhador de Brasilândia divulga 20 vagas de emprego em comércio, setor rural e serviços - funtrab.ms.gov.br Funtrab inaugura Casa do Trabalhador de Brasilândia e amplia acesso a emprego e qualificação profissional - funtrab.ms.gov.br Prefeitura de Brasilândia-MS abre seleção para cadastro reserva - Ache Concursos Pesquisa que transforma: Professor da rede municipal apresenta estudo sobre os impactos do programa ""Cuidar Bem"" à gestão municipal - Inteligência Brasil Imprensa TJ-MS condena improbidade em contrato de R$ 893 mil em Brasilândia - Campo Grande News Prefeitura de Brasilândia - MS republica processo seletivo com salários de até R$ 8,8 mil - PCI Concursos Virada Cultural 2025 de SP: veja programação completa do evento, que completa 20 anos  G1 Com R$ 3,2 bilhões, MS teve aumento de 227% nos investimentos públicos nos últimos três anos  agenciadenoticias.ms.gov.br Casa do Trabalhador de Brasilândia divulga 20 vagas de emprego em comércio, setor rural e serviços  funtrab.ms.gov.br Funtrab inaugura Casa do Trabalhador de Brasilândia e amplia acesso a emprego e qualificação profissional  funtrab.ms.gov.br Prefeitura de Brasilândia-MS abre seleção para cadastro reserva  Ache Concursos Pesquisa que transforma: Professor da rede municipal apresenta estudo sobre os impactos do programa ""Cuidar Bem"" à gestão municipal  Inteligência Brasil Imprensa TJ-MS condena improbidade em contrato de R$ 893 mil em Brasilândia  Campo Grande News Prefeitura de Brasilândia - MS republica processo seletivo com salários de até R$ 8,8 mil  PCI Concursos"
Caarapó,12,"caarapó, vagas, funtrab, municípios, bioenergia","Governo licita obras de CEUs da Cultura em quatro cidades e fortalece acesso à arte, educação e cidadania - Portal Único ms.gov.br Neno Razuk investe mais de R$ 5 milhões em emendas e transforma municípios de MS - Assembleia Legislativa de Mato Grosso do Sul - Bioenergia: rodada de empregabilidade oferece mais de 630 vagas em 15 municípios de MS - agenciadenoticias.ms.gov.br MS registra alta de empregos formais em julho de 2025 com saldo de 3.023 vagas - funtrab.ms.gov.br Raízen abre mais de 400 vagas para programa de aprendiz - Revista Cultivar GIRO FUNTRAB DE NOTÍCIAS – 10/09/2025 a 25/09/2025 - funtrab.ms.gov.br Rodada de Empregabilidade mostra a diversidade de profissões que movem o setor de Bioenergia em MS - Cana Online Semadesc participa da abertura da Exposição Agropecuária de Caarapó - semadesc.ms.gov.br Lei proíbe nomeação de agressores de mulheres em Caarapó e prevê demissão de servidores - Midiamax Prefeitura abre licitação para ampliar balneário de Caarapó com novos quiosques e banheiros - capitalnews.com.br MPMS e parceiros inauguram padaria em presídio de Caarapó com recursos de penas pecuniárias e ANPPs - tanamidianavirai.com.br Caarapó: vereador quer suspender contrato sem licitação com advogado alvo do MPMS - Midiamax Governo licita obras de CEUs da Cultura em quatro cidades e fortalece acesso à arte, educação e cidadania  Portal Único ms.gov.br Neno Razuk investe mais de R$ 5 milhões em emendas e transforma municípios de MS  Assembleia Legislativa de Mato Grosso do Sul - Bioenergia: rodada de empregabilidade oferece mais de 630 vagas em 15 municípios de MS  agenciadenoticias.ms.gov.br MS registra alta de empregos formais em julho de 2025 com saldo de 3.023 vagas  funtrab.ms.gov.br Raízen abre mais de 400 vagas para programa de aprendiz  Revista Cultivar GIRO FUNTRAB DE NOTÍCIAS – 10/09/2025 a 25/09/2025  funtrab.ms.gov.br Rodada de Empregabilidade mostra a diversidade de profissões que movem o setor de Bioenergia em MS  Cana Online Semadesc participa da abertura da Exposição Agropecuária de Caarapó  semadesc.ms.gov.br Lei proíbe nomeação de agressores de mulheres em Caarapó e prevê demissão de servidores  Midiamax Prefeitura abre licitação para ampliar balneário de Caarapó com novos quiosques e banheiros  capitalnews.com.br MPMS e parceiros inauguram padaria em presídio de Caarapó com recursos de penas pecuniárias e ANPPs  tanamidianavirai.com.br Caarapó: vereador quer suspender contrato sem licitação com advogado alvo do MPMS  Midiamax"
Cassilândia,8,"cassilândia, planejamento, mato, grosso, notícias","Oficina estratégica realizada pela Fundtur MS fortalece planejamento do turismo em Cassilândia - Mato Grosso do Sul Notícias GIRO FUNTRAB DE NOTÍCIAS – 14/08/2025 a 25/08/2025 - funtrab.ms.gov.br Últimos dias de inscrições para qualificação profissional a distância no IFMS - Correio de Corumbá Ao lado do prefeito Rodrigo, Caravina entrega recu... - Assembleia Legislativa de Mato Grosso do Sul - Prefeitura de Alcinópolis apresenta planejamento financeiro e prioridades para 2027 durante audiência pública - MS Todo dia Saúde de Cassilândia realizou mais de 95 procedimentos e atendimentos durante o mês de abril - MS Todo dia Sebrae/MS, Governo do Estado e Prefeitura lançam Plano de Desenvolvimento Municipal de Cassilândia - O Correio News Cassilândia recebe R$ 500 mil articulados por Geraldo para ampliar exames e diagnóstico precoce - Dourados News Oficina estratégica realizada pela Fundtur MS fortalece planejamento do turismo em Cassilândia  Mato Grosso do Sul Notícias GIRO FUNTRAB DE NOTÍCIAS – 14/08/2025 a 25/08/2025  funtrab.ms.gov.br Últimos dias de inscrições para qualificação profissional a distância no IFMS  Correio de Corumbá Ao lado do prefeito Rodrigo, Caravina entrega recu...  Assembleia Legislativa de Mato Grosso do Sul - Prefeitura de Alcinópolis apresenta planejamento financeiro e prioridades para 2027 durante audiência pública  MS Todo dia Saúde de Cassilândia realizou mais de 95 procedimentos e atendimentos durante o mês de abril  MS Todo dia Sebrae/MS, Governo do Estado e Prefeitura lançam Plano de Desenvolvimento Municipal de Cassilândia  O Correio News Cassilândia recebe R$ 500 mil articulados por Geraldo para ampliar exames e diagnóstico precoce  Dourados News"
Chapadão do Sul,15,"funtrab, vagas, chapadão, audiência, pública","Nem passado, nem futuro: MS aposta na conexão entre gerações para construir políticas públicas - agenciadenoticias.ms.gov.br Funtrab participa da II Conferência Nacional do Trabalho em São Paulo - funtrab.ms.gov.br Festival de Dança Coreografada da Melhor Idade define campeões - fundesporte.ms.gov.br Caxias do Sul é eleita a 14ª cidade mais feliz do Brasil - Rádio Solaris Ponta Porã recebe etapa dos Jogos da Melhor Idade com disputas de bocha - agenciadenoticias.ms.gov.br Funtrab anuncia vagas em Campo Grande e Terenos com salários de até R$ 3 mil e benefícios - funtrab.ms.gov.br Bioenergia: rodada de empregabilidade oferece mais de 630 vagas em 15 municípios de MS - Portal Único ms.gov.br Casa do Trabalhador em Nova Alvorada do Sul realiza processo seletivo para menor aprendiz - funtrab.ms.gov.br Funtrab disponibiliza 43 vagas para técnico de enfermagem - funtrab.ms.gov.br Casa do Trabalhador em Costa Rica oferece 180 vagas de empregos - funtrab.ms.gov.br Chapadão do Sul realizará Audiência Pública da Causa Animal no dia 15 de junho - O Correio News Prefeitura de Alcinópolis apresenta planejamento financeiro e prioridades para 2027 durante audiência pública - MS Todo dia Prefeitura convoca população para Audiência Pública da Saúde referente ao 1º quadrimestre de 2026 - Jovem Sul News Falecimento de recém-nascido leva Secretaria de Saúde de Chapadão do Sul a publicar nota de pesar - Jovem Sul News Vereador Junior Teixeira pede transmissão ao vivo de licitações por mais transparência na prefeitura de Chapadão do Sul - MS Todo dia Nem passado, nem futuro: MS aposta na conexão entre gerações para construir políticas públicas  agenciadenoticias.ms.gov.br Funtrab participa da II Conferência Nacional do Trabalho em São Paulo  funtrab.ms.gov.br Festival de Dança Coreografada da Melhor Idade define campeões  fundesporte.ms.gov.br Caxias do Sul é eleita a 14ª cidade mais feliz do Brasil  Rádio Solaris Ponta Porã recebe etapa dos Jogos da Melhor Idade com disputas de bocha  agenciadenoticias.ms.gov.br Funtrab anuncia vagas em Campo Grande e Terenos com salários de até R$ 3 mil e benefícios  funtrab.ms.gov.br Bioenergia: rodada de empregabilidade oferece mais de 630 vagas em 15 municípios de MS  Portal Único ms.gov.br Casa do Trabalhador em Nova Alvorada do Sul realiza processo seletivo para menor aprendiz  funtrab.ms.gov.br Funtrab disponibiliza 43 vagas para técnico de enfermagem  funtrab.ms.gov.br Casa do Trabalhador em Costa Rica oferece 180 vagas de empregos  funtrab.ms.gov.br Chapadão do Sul realizará Audiência Pública da Causa Animal no dia 15 de junho  O Correio News Prefeitura de Alcinópolis apresenta planejamento financeiro e prioridades para 2027 durante audiência pública  MS Todo dia Prefeitura convoca população para Audiência Pública da Saúde referente ao 1º quadrimestre de 2026  Jovem Sul News Falecimento de recém-nascido leva Secretaria de Saúde de Chapadão do Sul a publicar nota de pesar  Jovem Sul News Vereador Junior Teixeira pede transmissão ao vivo de licitações por mais transparência na prefeitura de Chapadão do Sul  MS Todo dia"
Coronel Sapucaia,12,"gaeco, coronel, sapucaia, educação, semana","Expogrande 2026: Fiems leva educação e inovação, além de curso de fabricação de linguiça - agorams.com.br Agendão: fim de semana vem com stand-up, espetáculos, Natal na Praça e rodeio - agenciadenoticias.ms.gov.br Seis Casas do Trabalhador fecham no feriado de 8 de dezembro em MS - funtrab.ms.gov.br 75 vagas de jovens aprendizes em Deodápolis, Glória de Dourados e Nova Alvorada do Sul - Rede Jota FM Semana começa com 14 processos seletivos abertos em MS; veja todos aqui! - Enfoque MS Secretaria de Educação-MS abre 415 vagas para Assistente de Atividades Educacionais - Ache Concursos Finais da edição 2023 da Copa Anderson Mansano de Futebol serão nesta quarta em Amambai - A Gazeta News Gaeco volta à Prefeitura de Coronel Sapucaia contra grupo que fraudou licitações - Midiamax Polícia Civil inaugura a 53ª Sala Lilás do MS, em Japorã - sejusp.ms.gov.br Prefeitura tem 90 dias para regulamentar uso de nome social de pessoas trans - Campo Grande News Gaeco apreende fortuna em nova fase de operação contra corrupção em Coronel Sapucaia - ojacare.com.br Empresa investigada pelo Gaeco recebeu R$ 15 milhões em Coronel Sapucaia - brasilnoticia.com.br Expogrande 2026: Fiems leva educação e inovação, além de curso de fabricação de linguiça  agorams.com.br Agendão: fim de semana vem com stand-up, espetáculos, Natal na Praça e rodeio  agenciadenoticias.ms.gov.br Seis Casas do Trabalhador fecham no feriado de 8 de dezembro em MS  funtrab.ms.gov.br 75 vagas de jovens aprendizes em Deodápolis, Glória de Dourados e Nova Alvorada do Sul  Rede Jota FM Semana começa com 14 processos seletivos abertos em MS; veja todos aqui! Enfoque MS Secretaria de Educação-MS abre 415 vagas para Assistente de Atividades Educacionais  Ache Concursos Finais da edição 2023 da Copa Anderson Mansano de Futebol serão nesta quarta em Amambai  A Gazeta News Gaeco volta à Prefeitura de Coronel Sapucaia contra grupo que fraudou licitações  Midiamax Polícia Civil inaugura a 53ª Sala Lilás do MS, em Japorã  sejusp.ms.gov.br Prefeitura tem 90 dias para regulamentar uso de nome social de pessoas trans  Campo Grande News Gaeco apreende fortuna em nova fase de operação contra corrupção em Coronel Sapucaia  ojacare.com.br Empresa investigada pelo Gaeco recebeu R$ 15 milhões em Coronel Sapucaia  brasilnoticia.com.br"
Deodápolis,12,"deodápolis, mpms, vagas, mato, grosso","Neno Razuk investe mais de R$ 5 milhões em emendas e transforma municípios de MS - Assembleia Legislativa de Mato Grosso do Sul - Agendão: Expogrande, Festival Expressão de Rua e festas no interior agitam o fim de semana em MS - agenciadenoticias.ms.gov.br 75 vagas de jovens aprendizes em Deodápolis, Glória de Dourados e Nova Alvorada do Sul - Rede Jota FM Edital aberto: pós graduação destinado ao cooperativismo e empreendimentos solidários - funtrab.ms.gov.br Atvos abre 50 vagas para jovens aprendizes em Nova Alvorada do Sul e Deodápolis -MS - JornalCana Empresa quebra paradigma, capacita e emprega filhos de funcionários - notícias em Mato Grosso do Sul - G1 Secretaria de Educação-MS abre 415 vagas para Assistente de Atividades Educacionais - Ache Concursos MPMS intensifica ações em Deodápolis no Agosto Lilás e fortalece rede de proteção às mulheres - MPMS Polícia Civil inaugura a 52ª Sala Lilás do MS, em Aparecida do Taboado - pc.ms.gov.br Projeto Plantando Liberdade: reintegração social e sustentabilidade ambiental em Deodápolis - MPMS Deodápolis terá polo empresarial de 22 hectares com recursos do PRÓ-DESENVOLVE - semadesc.ms.gov.br Conselho do MPMS arquiva investigações e aprecia medida à animosidade de advogados - Midiamax Neno Razuk investe mais de R$ 5 milhões em emendas e transforma municípios de MS  Assembleia Legislativa de Mato Grosso do Sul - Agendão: Expogrande, Festival Expressão de Rua e festas no interior agitam o fim de semana em MS  agenciadenoticias.ms.gov.br 75 vagas de jovens aprendizes em Deodápolis, Glória de Dourados e Nova Alvorada do Sul  Rede Jota FM Edital aberto: pós graduação destinado ao cooperativismo e empreendimentos solidários  funtrab.ms.gov.br Atvos abre 50 vagas para jovens aprendizes em Nova Alvorada do Sul e Deodápolis -MS  JornalCana Empresa quebra paradigma, capacita e emprega filhos de funcionários - notícias em Mato Grosso do Sul  G1 Secretaria de Educação-MS abre 415 vagas para Assistente de Atividades Educacionais  Ache Concursos MPMS intensifica ações em Deodápolis no Agosto Lilás e fortalece rede de proteção às mulheres  MPMS Polícia Civil inaugura a 52ª Sala Lilás do MS, em Aparecida do Taboado  pc.ms.gov.br Projeto Plantando Liberdade: reintegração social e sustentabilidade ambiental em Deodápolis  MPMS Deodápolis terá polo empresarial de 22 hectares com recursos do PRÓ-DESENVOLVE  semadesc.ms.gov.br Conselho do MPMS arquiva investigações e aprecia medida à animosidade de advogados  Midiamax"
Dois Irmãos do Buriti,15,"agenciadenoticias, mato, grosso, inaugura, pantaneiro","Carreta-palco do Circuito Cultura MS segue para a região central com nova rodada de apresentações - agenciadenoticias.ms.gov.br Neno Razuk investe mais de R$ 5 milhões em emendas e transforma municípios de MS - Assembleia Legislativa de Mato Grosso do Sul - Jogos Abertos de Mato Grosso do Sul terão seis etapas regionais em 2026, entre abril e setembro - agenciadenoticias.ms.gov.br Com o dobro de barracas, retorno da Festa do Peixe deve ter mais de 3.500 mil kg de pescado - O Pantaneiro Agendão: Expogrande, Festival Expressão de Rua e festas no interior agitam o fim de semana em MS - agenciadenoticias.ms.gov.br Citricultura cresce em Mato Grosso do Sul e muda a vida de trabalhadores - funtrab.ms.gov.br Edital aberto: pós graduação destinado ao cooperativismo e empreendimentos solidários - funtrab.ms.gov.br Na Capital, EJA é ofertado em 16 escolas e na modalidade à distância; veja lista - Campo Grande News Voucher Desenvolvedor: Governo vai abrir inscrições de processo seletivo para curso de qualificação de TI - ArapuaNews Secretaria de Educação-MS abre 415 vagas para Assistente de Atividades Educacionais - Ache Concursos Próxima edição do Caminho do Acordo será na Aldeia Água Branca, em Aquidauana/MS - trf3.jus.br Polícia Civil inaugura a 53ª Sala Lilás do MS, em Japorã - sejusp.ms.gov.br Dois Irmãos do Buriti inaugura novo plenário da Câmara Municipal - O Pantaneiro Caos histórico: destaques, decisões e impactos na saúde pública de MS em 2025 - Midiamax Polícia Civil inaugura a 53ª Sala Lilás do MS, em Japorã - pc.ms.gov.br Carreta-palco do Circuito Cultura MS segue para a região central com nova rodada de apresentações  agenciadenoticias.ms.gov.br Neno Razuk investe mais de R$ 5 milhões em emendas e transforma municípios de MS  Assembleia Legislativa de Mato Grosso do Sul - Jogos Abertos de Mato Grosso do Sul terão seis etapas regionais em 2026, entre abril e setembro  agenciadenoticias.ms.gov.br Com o dobro de barracas, retorno da Festa do Peixe deve ter mais de 3.500 mil kg de pescado  O Pantaneiro Agendão: Expogrande, Festival Expressão de Rua e festas no interior agitam o fim de semana em MS  agenciadenoticias.ms.gov.br Citricultura cresce em Mato Grosso do Sul e muda a vida de trabalhadores  funtrab.ms.gov.br Edital aberto: pós graduação destinado ao cooperativismo e empreendimentos solidários  funtrab.ms.gov.br Na Capital, EJA é ofertado em 16 escolas e na modalidade à distância; veja lista  Campo Grande News Voucher Desenvolvedor: Governo vai abrir inscrições de processo seletivo para curso de qualificação de TI  ArapuaNews Secretaria de Educação-MS abre 415 vagas para Assistente de Atividades Educacionais  Ache Concursos Próxima edição do Caminho do Acordo será na Aldeia Água Branca, em Aquidauana/MS  trf3.jus.br Polícia Civil inaugura a 53ª Sala Lilás do MS, em Japorã  sejusp.ms.gov.br Dois Irmãos do Buriti inaugura novo plenário da Câmara Municipal  O Pantaneiro Caos histórico: destaques, decisões e impactos na saúde pública de MS em 2025  Midiamax Polícia Civil inaugura a 53ª Sala Lilás do MS, em Japorã  pc.ms.gov.br"
Eldorado,15,"eldorado, news, abre, seletivo, concursos","Eldorado celebrou 50 anos com entrega do Espaço Cultural Arandu e novos investimentos na cidade - ArapuaNews Saúde na Escola leva atendimentos e cuidado aos alunos da APAE em Aparecida do Taboado - A Tribuna News - - A Tribuna News Último Agendão de 2025 traz show com Di Ferrero, teatro infantil e atrações natalinas pelo interior - agenciadenoticias.ms.gov.br SESI-MS apresenta projeto de carbono na COP30 e SESI-SP investe em inovação na saúde - Agência de Notícias da Indústria Circuito Sesc de Artes chega a 9 cidades do Vale do Ribeira - Sesc São Paulo Semadesc e Sebrae entregam Plano de Desenvolvimento para seis municípios de MS - funtrab.ms.gov.br Fundação Hospitalar de Eldorado (MS) abre seletivo com salário até R$ 3,8 mil - Concursos no Brasil Eldorado Brasil abre 50 vagas para programa Jovem Aprendiz em Três Lagoas (MS) - Portal Celulose Tem CNH E? Confira vaga para motorista tritrem de empresa de celulose em MS - Midiamax Atvos abre 50 vagas para jovens aprendizes em Nova Alvorada do Sul e Deodápolis -MS - JornalCana Prefeitura de Eldorado (MS) publica edital de processo seletivo - Concursos no Brasil Semadesc e Sebrae entregam Plano de Desenvolvimento para seis municípios de MS - funtrab.ms.gov.br Dia de Campo do Amendoim reúne produtores rurais em Eldorado - A Gazeta News Prefeitura de Batayporã - MS abre processo seletivo para profissionais alfabetizados - PCI Concursos MP investiga irregularidades na criação de cargos em Eldorado - Campo Grande News Eldorado celebrou 50 anos com entrega do Espaço Cultural Arandu e novos investimentos na cidade  ArapuaNews Saúde na Escola leva atendimentos e cuidado aos alunos da APAE em Aparecida do Taboado - A Tribuna News -  A Tribuna News Último Agendão de 2025 traz show com Di Ferrero, teatro infantil e atrações natalinas pelo interior  agenciadenoticias.ms.gov.br SESI-MS apresenta projeto de carbono na COP30 e SESI-SP investe em inovação na saúde  Agência de Notícias da Indústria Circuito Sesc de Artes chega a 9 cidades do Vale do Ribeira  Sesc São Paulo Semadesc e Sebrae entregam Plano de Desenvolvimento para seis municípios de MS  funtrab.ms.gov.br Fundação Hospitalar de Eldorado (MS) abre seletivo com salário até R$ 3,8 mil  Concursos no Brasil Eldorado Brasil abre 50 vagas para programa Jovem Aprendiz em Três Lagoas (MS)  Portal Celulose Tem CNH E? Confira vaga para motorista tritrem de empresa de celulose em MS  Midiamax Atvos abre 50 vagas para jovens aprendizes em Nova Alvorada do Sul e Deodápolis -MS  JornalCana Prefeitura de Eldorado (MS) publica edital de processo seletivo  Concursos no Brasil Semadesc e Sebrae entregam Plano de Desenvolvimento para seis municípios de MS  funtrab.ms.gov.br Dia de Campo do Amendoim reúne produtores rurais em Eldorado  A Gazeta News Prefeitura de Batayporã - MS abre processo seletivo para profissionais alfabetizados  PCI Concursos MP investiga irregularidades na criação de cargos em Eldorado  Campo Grande News"
Fátima do Sul,15,"fátima, cidades, bombeiros, confira, cultural","Cresce 24% o número de brasileiros migrando para essa cidade universitária de alto padrão perto do Paraguai nos últimos 12 anos - Correio Braziliense Clima bom, gente acolhedora e futuro promissor em uma das cidades mais estratégicas do Brasil - Revista Oeste Boletim Epidemiológico: MS registra 4.834 casos confirmados de chikungunya - ArapuaNews Confira a agenda cultural do fim de semana ? - Primeira Página AGENDÃO: Fim de semana tem Campão Cultural, Expogrande e feiras criativas, confira a programação - Fátima News Corpo de Bombeiros divulga novo resultado da seleção para bombeiros temporários - Midiamax Edital aberto: pós graduação destinado ao cooperativismo e empreendimentos solidários - funtrab.ms.gov.br Processo seletivo dos Bombeiros MS abre 230 vagas em 30 cidades - JC Concursos SAD - SEJUSP- CBMMS divulga Processo Seletivo com 230 vagas - PCI Concursos Com economia forte e diversificada, MS atrai empresas e tem geração de emprego em todas as áreas - funtrab.ms.gov.br Com R$ 7 mi no Master, Fátima do Sul espera Câmara para decidir sobre aplicações privadas - Midiamax Falece Dr Nelson Kawamura, médico em diversas cidades do MS - O Pantaneiro FINANÇAS: Decreto impõe prazos para fornecedores e servidores municipais em Fátima do Sul - Fátima em Dia Adriane e prefeitos de MS terão que cobrir rombo de R$ 16 milhões investidos no Master - ojacare.com.br Governo de MS entrega Unidade Regional de Perícia e Identificação em Fátima do Sul - sejusp.ms.gov.br Cresce 24% o número de brasileiros migrando para essa cidade universitária de alto padrão perto do Paraguai nos últimos 12 anos  Correio Braziliense Clima bom, gente acolhedora e futuro promissor em uma das cidades mais estratégicas do Brasil  Revista Oeste Boletim Epidemiológico: MS registra 4.834 casos confirmados de chikungunya  ArapuaNews Confira a agenda cultural do fim de semana ? Primeira Página AGENDÃO: Fim de semana tem Campão Cultural, Expogrande e feiras criativas, confira a programação  Fátima News Corpo de Bombeiros divulga novo resultado da seleção para bombeiros temporários  Midiamax Edital aberto: pós graduação destinado ao cooperativismo e empreendimentos solidários  funtrab.ms.gov.br Processo seletivo dos Bombeiros MS abre 230 vagas em 30 cidades  JC Concursos SAD - SEJUSP- CBMMS divulga Processo Seletivo com 230 vagas  PCI Concursos Com economia forte e diversificada, MS atrai empresas e tem geração de emprego em todas as áreas  funtrab.ms.gov.br Com R$ 7 mi no Master, Fátima do Sul espera Câmara para decidir sobre aplicações privadas  Midiamax Falece Dr Nelson Kawamura, médico em diversas cidades do MS  O Pantaneiro FINANÇAS: Decreto impõe prazos para fornecedores e servidores municipais em Fátima do Sul  Fátima em Dia Adriane e prefeitos de MS terão que cobrir rombo de R$ 16 milhões investidos no Master  ojacare.com.br Governo de MS entrega Unidade Regional de Perícia e Identificação em Fátima do Sul  sejusp.ms.gov.br"
