municipio,qtd_noticias_encontradas,temas_frequentes,resumo_para_slide
Água Clara,14,"arapuanews, água, clara, midiamax, três","Três Lagoas leva cultura e protagonismo à Teia Nacional 2026, no Espírito Santo - ArapuaNews Obras de captação no rio Paraguai recebem R$ 26,4 milhões e reforçam abastecimento em Corumbá - ArapuaNews Neno Razuk investe mais de R$ 5 milhões em emendas e transforma municípios de MS - Assembleia Legislativa de Mato Grosso do Sul - 11ª Festa das Nações é sucesso em Água Clara com apoio da prefeita Gerolina Alves e Governo de MS - ArapuaNews Suzano seleciona trabalhadores para preencher vagas de emprego em MS e BA - CPG Click Petróleo e Gás SESI-PA promove capacitação para professores e SENAI-MS oferece curso com bolsa de R$ 1 mil - Agência de Notícias da Indústria Funtrab anuncia vários cursos gratuitos de qualificação no Estado, veja como se inscrever - funtrab.ms.gov.br MS Florestal tem mais de 30 vagas de emprego abertas para três cidades do Estado - Midiamax Veracel e Senai Bahia oferecem cursos gratuitos para formação técnica e inclusão social - Portal Celulose TCE-MS rejeita contas da prefeita de Água Clara por falhas fiscais - Midiamax Polícia Civil inaugura a 53ª Sala Lilás do MS, em Japorã - sejusp.ms.gov.br Prefeito Dr. Cassiano Maia participa da alvorada festiva pelos 107 anos do Hospital Auxiliadora - ArapuaNews REFERÊNCIA: Almoxarifado Central de Bataguassu recebe visitas técnicas das Prefeituras de Água Clara e Brasilândia - prefeitura municipal de bataguassu (ms) Procedimento vai monitorar TAC para regularizar Controladoria Municipal de Água Clara - Midiamax Três Lagoas leva cultura e protagonismo à Teia Nacional 2026, no Espírito Santo  ArapuaNews Obras de captação no rio Paraguai recebem R$ 26,4 milhões e reforçam abastecimento em Corumbá  ArapuaNews Neno Razuk investe mais de R$ 5 milhões em emendas e transforma municípios de MS  Assembleia Legislativa de Mato Grosso do Sul - 11ª Festa das Nações é sucesso em Água Clara com apoio da prefeita Gerolina Alves e Governo de MS  ArapuaNews Suzano seleciona trabalhadores para preencher vagas de emprego em MS e BA  CPG Click Petróleo e Gás SESI-PA promove capacitação para professores e SENAI-MS oferece curso com bolsa de R$ 1 mil  Agência de Notícias da Indústria Funtrab anuncia vários cursos gratuitos de qualificação no Estado, veja como se inscrever  funtrab.ms.gov.br MS Florestal tem mais de 30 vagas de emprego abertas para três cidades do Estado  Midiamax Veracel e Senai Bahia oferecem cursos gratuitos para formação técnica e inclusão social  Portal Celulose TCE-MS rejeita contas da prefeita de Água Clara por falhas fiscais  Midiamax Polícia Civil inaugura a 53ª Sala Lilás do MS, em Japorã  sejusp.ms.gov.br Prefeito Dr. Cassiano Maia participa da alvorada festiva pelos 107 anos do Hospital Auxiliadora  ArapuaNews REFERÊNCIA: Almoxarifado Central de Bataguassu recebe visitas técnicas das Prefeituras de Água Clara e Brasilândia  prefeitura municipal de bataguassu (ms) Procedimento vai monitorar TAC para regularizar Controladoria Municipal de Água Clara  Midiamax"
Amambai,15,"amambai, prefeitura, municipal, cidades, vagas","Governo licita obras de CEUs da Cultura em quatro cidades e fortalece acesso à arte, educação e cidadania - Portal Único ms.gov.br Cine Sesi Cultural finaliza 3ª etapa com 101,6 mil pessoas em 32 cidades - Agência de Notícias da Indústria Cine Sesi tem 2º maior público do ano em Bonito com 4,9 mil pessoas - Agência de Notícias da Indústria Fazenda eleva para 4,5% estimativa de inflação com guerra e petróleo - A Gazeta News Com apoio do Governo, Taboadão 2026 movimenta turismo, cultura e economia da região - A Gazeta News Bioenergia: rodada de empregabilidade oferece mais de 630 vagas em 15 municípios de MS - Portal Único ms.gov.br Corpo de Bombeiros divulga novo resultado da seleção para bombeiros temporários - Midiamax Notícia - Casa do Trabalhador oferece 89 vagas de emprego e reforça parcerias para desenvolvimento profissi... - Prefeitura Municipal de Amambai Últimos dias de inscrições para qualificação profissional a distância no IFMS - Correio de Corumbá Processo seletivo dos Bombeiros MS abre 230 vagas em 30 cidades - JC Concursos TCE-MS vê irregularidades em convênio de R$ 7,7 milhões para reforma de hospital em Amambai - Midiamax Amambai confirma convênio para construção de 50 novas mor... - Prefeitura Municipal de Amambai Em Amambai, MPMS acompanha implementação de Programas de Integridade na gestão municipal - MPMS Prefeitura de Amambai MS abre processo seletivo para formador municipal - Folha Dirigida Prefeitura irá desembolsar R$ 1,9 milhão em indenizações para viabilizar Contorno Viário de Amambai - Midiamax Governo licita obras de CEUs da Cultura em quatro cidades e fortalece acesso à arte, educação e cidadania  Portal Único ms.gov.br Cine Sesi Cultural finaliza 3ª etapa com 101,6 mil pessoas em 32 cidades  Agência de Notícias da Indústria Cine Sesi tem 2º maior público do ano em Bonito com 4,9 mil pessoas  Agência de Notícias da Indústria Fazenda eleva para 4,5% estimativa de inflação com guerra e petróleo  A Gazeta News Com apoio do Governo, Taboadão 2026 movimenta turismo, cultura e economia da região  A Gazeta News Bioenergia: rodada de empregabilidade oferece mais de 630 vagas em 15 municípios de MS  Portal Único ms.gov.br Corpo de Bombeiros divulga novo resultado da seleção para bombeiros temporários  Midiamax Notícia - Casa do Trabalhador oferece 89 vagas de emprego e reforça parcerias para desenvolvimento profissi...  Prefeitura Municipal de Amambai Últimos dias de inscrições para qualificação profissional a distância no IFMS  Correio de Corumbá Processo seletivo dos Bombeiros MS abre 230 vagas em 30 cidades  JC Concursos TCE-MS vê irregularidades em convênio de R$ 7,7 milhões para reforma de hospital em Amambai  Midiamax Amambai confirma convênio para construção de 50 novas mor...  Prefeitura Municipal de Amambai Em Amambai, MPMS acompanha implementação de Programas de Integridade na gestão municipal  MPMS Prefeitura de Amambai MS abre processo seletivo para formador municipal  Folha Dirigida Prefeitura irá desembolsar R$ 1,9 milhão em indenizações para viabilizar Contorno Viário de Amambai  Midiamax"
Anastácio,15,"aquidauana, pantaneiro, notícias, anastácio, bombeiros","Cine Sesi Cultural finaliza 3ª etapa com 101,6 mil pessoas em 32 cidades - Agência de Notícias da Indústria Aquidauana realiza 10ª edição da Paixão de Cristo com teatro ao ar livre e show musical - O Pantaneiro Cine Sesi tem 2º maior público do ano em Bonito com 4,9 mil pessoas - Agência de Notícias da Indústria Aquidauana e Anastácio registram o maior volume de chuva do estado - O Pantaneiro Casa do Artesão reúne lojistas para ampliar comércio dos produtos locais de Aquidauana - O Pantaneiro Corpo de Bombeiros divulga novo resultado da seleção para bombeiros temporários - Midiamax Senar/MS tem vaga para quem quer crescer no agro e mudar de vida no campo - A Crítica de Campo Grande Qualificação beneficia população de MS com melhores oportunidades de emprego - O Pantaneiro Na Capital, EJA é ofertado em 16 escolas e na modalidade à distância; veja lista - Campo Grande News Processo seletivo dos Bombeiros MS abre 230 vagas em 30 cidades - JC Concursos Audiência pública em Aquidauana reforça mobilização pela duplicação da BR-262 - O Pantaneiro Café da manhã reúne lideranças religiosas durante comemorações dos 61 anos de Anastácio - Aquidauana Notícias Pacote de R$ 10 milhões prevê de ambulâncias no interior de MS - Midiamax Polícia Civil inaugura a 52ª Sala Lilás do MS em Aparecida do Taboado - Costa Leste News Audiência pública debate demarcação de áreas da União em Aquidauana e Anastácio - O Pantaneiro Cine Sesi Cultural finaliza 3ª etapa com 101,6 mil pessoas em 32 cidades  Agência de Notícias da Indústria Aquidauana realiza 10ª edição da Paixão de Cristo com teatro ao ar livre e show musical  O Pantaneiro Cine Sesi tem 2º maior público do ano em Bonito com 4,9 mil pessoas  Agência de Notícias da Indústria Aquidauana e Anastácio registram o maior volume de chuva do estado  O Pantaneiro Casa do Artesão reúne lojistas para ampliar comércio dos produtos locais de Aquidauana  O Pantaneiro Corpo de Bombeiros divulga novo resultado da seleção para bombeiros temporários  Midiamax Senar/MS tem vaga para quem quer crescer no agro e mudar de vida no campo  A Crítica de Campo Grande Qualificação beneficia população de MS com melhores oportunidades de emprego  O Pantaneiro Na Capital, EJA é ofertado em 16 escolas e na modalidade à distância; veja lista  Campo Grande News Processo seletivo dos Bombeiros MS abre 230 vagas em 30 cidades  JC Concursos Audiência pública em Aquidauana reforça mobilização pela duplicação da BR-262  O Pantaneiro Café da manhã reúne lideranças religiosas durante comemorações dos 61 anos de Anastácio  Aquidauana Notícias Pacote de R$ 10 milhões prevê de ambulâncias no interior de MS  Midiamax Polícia Civil inaugura a 52ª Sala Lilás do MS em Aparecida do Taboado  Costa Leste News Audiência pública debate demarcação de áreas da União em Aquidauana e Anastácio  O Pantaneiro"
Angélica,12,"prefeitura, cine, sesi, pessoas, agência","Cine Sesi tem 2º maior público do ano em Bonito com 4,9 mil pessoas - Agência de Notícias da Indústria Conheça os perfis e atribuições dos novos secretários e diretores da Prefeitura de Campo Grande - campogrande.ms.gov.br Cine Sesi Cultural finaliza 3ª etapa com 101,6 mil pessoas em 32 cidades - Agência de Notícias da Indústria Confira a programação completa do Delas Day 2026 - funtrab.ms.gov.br Adecoagro inicia Programa Jovens Talentos Aprendizes com Deficiência - diariodigital.com.br Abertas inscrições para curso gratuito de auxiliar administrativo - funtrab.ms.gov.br Secretaria de Educação-MS abre 415 vagas para Assistente de Atividades Educacionais - Ache Concursos Previdência de Angélica que investiu no Master é autônoma, diz prefeitura após operação - Midiamax Operações da PF cumprem sete mandados de busca e apreensão em Angélica e um em Fátima do Sul - RCN 67 Polícia Civil inaugura a 53ª Sala Lilás do MS, em Japorã - sejusp.ms.gov.br Prefeitura empossa novos membros Conselho Municipal dos Direitos da Mulher - Município de Corumbá Moradores de assentamentos protestam contra transferência de escola da zona rural de Goiás - Jornal Opção Cine Sesi tem 2º maior público do ano em Bonito com 4,9 mil pessoas  Agência de Notícias da Indústria Conheça os perfis e atribuições dos novos secretários e diretores da Prefeitura de Campo Grande  campogrande.ms.gov.br Cine Sesi Cultural finaliza 3ª etapa com 101,6 mil pessoas em 32 cidades  Agência de Notícias da Indústria Confira a programação completa do Delas Day 2026  funtrab.ms.gov.br Adecoagro inicia Programa Jovens Talentos Aprendizes com Deficiência  diariodigital.com.br Abertas inscrições para curso gratuito de auxiliar administrativo  funtrab.ms.gov.br Secretaria de Educação-MS abre 415 vagas para Assistente de Atividades Educacionais  Ache Concursos Previdência de Angélica que investiu no Master é autônoma, diz prefeitura após operação  Midiamax Operações da PF cumprem sete mandados de busca e apreensão em Angélica e um em Fátima do Sul  RCN 67 Polícia Civil inaugura a 53ª Sala Lilás do MS, em Japorã  sejusp.ms.gov.br Prefeitura empossa novos membros Conselho Municipal dos Direitos da Mulher  Município de Corumbá Moradores de assentamentos protestam contra transferência de escola da zona rural de Goiás  Jornal Opção"
Aparecida do Taboado,15,"aparecida, taboado, notícias, vagas, sesi","Taboadão 2026 reforça tradição e impulsiona economia em Aparecida do Taboado - Notícias do Cerrado Neno Razuk investe mais de R$ 5 milhões em emendas e transforma municípios de MS - Assembleia Legislativa de Mato Grosso do Sul - Estudantes do SESI apresentam inovações no maior evento científico da América Latina - Agência de Notícias da Indústria Estudantes do SESI são premiados em feira científica da USP - Agência de Notícias da Indústria Cine Sesi tem 2º maior público do ano em Bonito com 4,9 mil pessoas - Agência de Notícias da Indústria Bioenergia: rodada de empregabilidade oferece mais de 630 vagas em 15 municípios de MS - Portal Único ms.gov.br Senai MS: 2 mil vagas em cursos técnicos com bolsa de R$ 300; inscreva-se - Campo Grande News SENAI oferece 60 vagas em cursos técnicos gratuitos em Aparecida do Taboado com auxílio mensal - Costa Leste News Setor de bioenergia oferece 630 vagas de emprego em 15 cidades de MS - - Folha de Campo Grande - Funtrab expande a emissão de Carteira de Trabalho no MS - funtrab.ms.gov.br Investimentos: Coronel David cumpre agenda com Rie... - Assembleia Legislativa de Mato Grosso do Sul - Vice-governador Barbosinha visita Aparecida do Taboado e vereadores solicitam reforço na segurança pública - Costa Leste News Polícia Civil inaugura a 52ª Sala Lilás do MS, em Aparecida do Taboado - pc.ms.gov.br Com expansão da rede de apoio às mulheres, MS inaugura Sala Lilás em Aparecida do Taboado - sejusp.ms.gov.br Contrato de iluminação irá custar R$ 1,16 milhão para Aparecida do Taboado - Midiamax Taboadão 2026 reforça tradição e impulsiona economia em Aparecida do Taboado  Notícias do Cerrado Neno Razuk investe mais de R$ 5 milhões em emendas e transforma municípios de MS  Assembleia Legislativa de Mato Grosso do Sul - Estudantes do SESI apresentam inovações no maior evento científico da América Latina  Agência de Notícias da Indústria Estudantes do SESI são premiados em feira científica da USP  Agência de Notícias da Indústria Cine Sesi tem 2º maior público do ano em Bonito com 4,9 mil pessoas  Agência de Notícias da Indústria Bioenergia: rodada de empregabilidade oferece mais de 630 vagas em 15 municípios de MS  Portal Único ms.gov.br Senai MS: 2 mil vagas em cursos técnicos com bolsa de R$ 300; inscreva-se  Campo Grande News SENAI oferece 60 vagas em cursos técnicos gratuitos em Aparecida do Taboado com auxílio mensal  Costa Leste News Setor de bioenergia oferece 630 vagas de emprego em 15 cidades de MS -  Folha de Campo Grande - Funtrab expande a emissão de Carteira de Trabalho no MS  funtrab.ms.gov.br Investimentos: Coronel David cumpre agenda com Rie...  Assembleia Legislativa de Mato Grosso do Sul - Vice-governador Barbosinha visita Aparecida do Taboado e vereadores solicitam reforço na segurança pública  Costa Leste News Polícia Civil inaugura a 52ª Sala Lilás do MS, em Aparecida do Taboado  pc.ms.gov.br Com expansão da rede de apoio às mulheres, MS inaugura Sala Lilás em Aparecida do Taboado  sejusp.ms.gov.br Contrato de iluminação irá custar R$ 1,16 milhão para Aparecida do Taboado  Midiamax"
Aral Moreira,15,"news, gazeta, inscrições, ifms, cursos","Senadora Soraya garante mais de R$ 28 milhões para 23 municípios de Mato Grosso do Sul em maio - MS Todo dia Prefeitos destacam pacote de R$ 176,6 milhões em obras de saneamento lançado pelo Governo de MS - A Gazeta News Prefeitura de Caarapó recebe emenda de R$ 600 mil para reforma de posto de saúde no bairro Santo Antônio - A Gazeta News Lígia Borges pede cancha de bocha para idosos do Programa Conviver em Amambai - A Gazeta News Programa de Aquisição de Alimentos beneficia famílias indígenas em Amambai - A Gazeta News Últimos dias de inscrições para qualificação profissional a distância no IFMS - Correio de Corumbá Os 3 cursos EAD gratuitos do IFMS que todo mundo está querendo; Inscrições até HOJE! - PEBSP Sanesul abre processo seletivo com 40 vagas e salário de até R$ 3.189,38 - G1 Com Fiems, Paulo Corrêa articula desconto de até 20% na conta de energia para 74 municípios de MS - O CORREIO NEWS Aral Moreira lidera ranking de educação no MS em 2025 - Campo Grande News Polícia Civil inaugura a 53ª Sala Lilás do MS, em Japorã - sejusp.ms.gov.br Estudantes da rede pública são premiados em cerimônia do projeto MPT na Escola em Mato Grosso do Sul - agorams.com.br Polícia Civil inaugura a 52ª Sala Lilás do MS em Aparecida do Taboado - Costa Leste News Senadora Soraya garante mais de R$ 28 milhões para 23 municípios de Mato Grosso do Sul em maio  MS Todo dia Prefeitos destacam pacote de R$ 176,6 milhões em obras de saneamento lançado pelo Governo de MS  A Gazeta News Prefeitura de Caarapó recebe emenda de R$ 600 mil para reforma de posto de saúde no bairro Santo Antônio  A Gazeta News Lígia Borges pede cancha de bocha para idosos do Programa Conviver em Amambai  A Gazeta News Programa de Aquisição de Alimentos beneficia famílias indígenas em Amambai  A Gazeta News Últimos dias de inscrições para qualificação profissional a distância no IFMS  Correio de Corumbá Os 3 cursos EAD gratuitos do IFMS que todo mundo está querendo; Inscrições até HOJE! PEBSP Sanesul abre processo seletivo com 40 vagas e salário de até R$ 3.189,38  G1 Com Fiems, Paulo Corrêa articula desconto de até 20% na conta de energia para 74 municípios de MS  O CORREIO NEWS Aral Moreira lidera ranking de educação no MS em 2025  Campo Grande News Polícia Civil inaugura a 53ª Sala Lilás do MS, em Japorã  sejusp.ms.gov.br Estudantes da rede pública são premiados em cerimônia do projeto MPT na Escola em Mato Grosso do Sul  agorams.com.br Polícia Civil inaugura a 52ª Sala Lilás do MS em Aparecida do Taboado  Costa Leste News"
Bataguassu,13,"bataguassu, prefeitura, campo, grande, agendão","Centro de Esporte e Cultura oferece atividades gratuitas em Campo Grande - Campo Grande News Festival de Dança Coreografada da Melhor Idade define campeões - fundesporte.ms.gov.br Agendão cultural: fim de semana tem shows nacionais, feiras criativas, teatro e festas populares em MS - agenciadenoticias.ms.gov.br Agendão: fim de semana tem MS Fashion Week, Festa do Leitão no Rolete, exposições e muito teatro - Idest Turismo rural, pesca e eventos no caminho do Pontal do Paranapanema - GOV.BR Cidade de MS concede bolsa de R$ 300 para jovens fazerem cursos grauitos - diariodigital.com.br Senai está com inscrições abertas para nove vagas em seis municípios - Midiamax Abertas inscrições para curso gratuito de auxiliar administrativo - funtrab.ms.gov.br Prestação de contas entregue com sucesso: Bataguassu se destaca no primeiro ano de utilização do e-Sfinge - Notícias em Rede Prefeitura de Bataguassu MS abre processo seletivo para Educação em 2026 - Folha Dirigida Prefeitura firma parceria com Polícia Militar e Governo do Estado para implementar o PROMUSE - prefeitura municipal de bataguassu (ms) Plano de Desenvolvimento Municipal projeta Bataguassu como hub logístico e produtivo no leste de Mato Grosso do Sul - ms.agenciasebrae.com.br Câmara de Bataguassu rejeita recurso após empresa denunciar irregularidade em licitação - Midiamax Centro de Esporte e Cultura oferece atividades gratuitas em Campo Grande  Campo Grande News Festival de Dança Coreografada da Melhor Idade define campeões  fundesporte.ms.gov.br Agendão cultural: fim de semana tem shows nacionais, feiras criativas, teatro e festas populares em MS  agenciadenoticias.ms.gov.br Agendão: fim de semana tem MS Fashion Week, Festa do Leitão no Rolete, exposições e muito teatro  Idest Turismo rural, pesca e eventos no caminho do Pontal do Paranapanema  GOV.BR Cidade de MS concede bolsa de R$ 300 para jovens fazerem cursos grauitos  diariodigital.com.br Senai está com inscrições abertas para nove vagas em seis municípios  Midiamax Abertas inscrições para curso gratuito de auxiliar administrativo  funtrab.ms.gov.br Prestação de contas entregue com sucesso: Bataguassu se destaca no primeiro ano de utilização do e-Sfinge  Notícias em Rede Prefeitura de Bataguassu MS abre processo seletivo para Educação em 2026  Folha Dirigida Prefeitura firma parceria com Polícia Militar e Governo do Estado para implementar o PROMUSE  prefeitura municipal de bataguassu (ms) Plano de Desenvolvimento Municipal projeta Bataguassu como hub logístico e produtivo no leste de Mato Grosso do Sul  ms.agenciasebrae.com.br Câmara de Bataguassu rejeita recurso após empresa denunciar irregularidade em licitação  Midiamax"
Batayporã,11,"funtrab, vagas, prefeitura, batayporã, abre",Festival de Dança Coreografada da Melhor Idade define campeões - fundesporte.ms.gov.br Funtrab anuncia vagas em Campo Grande e Terenos com salários de até R$ 3 mil e benefícios - funtrab.ms.gov.br Funtrab e SENAI-MS abrem vagas para cursos gratuitos e fortalecem qualificação profissional no Estado - funtrab.ms.gov.br Funtrab atua na 2ª Feira de Empregabilidade do Grau Técnico com oferta de mais de mil vagas e serviços ao trabalhador - funtrab.ms.gov.br Funtrab e Biosul anunciam 2ª Rodada de Empregabilidade do Setor de Bioenergia com mais de 630 vagas em 15 municípios de MS - funtrab.ms.gov.br Programa “MS Qualifica” oferece em janeiro 27 cursos de capacitação em 10 municípios do Estado - funtrab.ms.gov.br Hashioka visita prefeito Germino e reforça parceri... - Assembleia Legislativa de Mato Grosso do Sul - Prefeitura de Batayporã MS abre processo seletivo com 4 vagas - Folha Dirigida Prefeitura de Batayporã - MS abre processo seletivo para professor de ensino fundamental - PCI Concursos Polícia Civil inaugura a 52ª Sala Lilás do MS em Aparecida do Taboado - Costa Leste News Prefeitura de Batayporã MS abre processo seletivo com 2 vagas - Folha Dirigida Festival de Dança Coreografada da Melhor Idade define campeões  fundesporte.ms.gov.br Funtrab anuncia vagas em Campo Grande e Terenos com salários de até R$ 3 mil e benefícios  funtrab.ms.gov.br Funtrab e SENAI-MS abrem vagas para cursos gratuitos e fortalecem qualificação profissional no Estado  funtrab.ms.gov.br Funtrab atua na 2ª Feira de Empregabilidade do Grau Técnico com oferta de mais de mil vagas e serviços ao trabalhador  funtrab.ms.gov.br Funtrab e Biosul anunciam 2ª Rodada de Empregabilidade do Setor de Bioenergia com mais de 630 vagas em 15 municípios de MS  funtrab.ms.gov.br Programa “MS Qualifica” oferece em janeiro 27 cursos de capacitação em 10 municípios do Estado  funtrab.ms.gov.br Hashioka visita prefeito Germino e reforça parceri...  Assembleia Legislativa de Mato Grosso do Sul - Prefeitura de Batayporã MS abre processo seletivo com 4 vagas  Folha Dirigida Prefeitura de Batayporã - MS abre processo seletivo para professor de ensino fundamental  PCI Concursos Polícia Civil inaugura a 52ª Sala Lilás do MS em Aparecida do Taboado  Costa Leste News Prefeitura de Batayporã MS abre processo seletivo com 2 vagas  Folha Dirigida
Bela Vista,15,"bela, vista, notícias, midiamax, vagas","Senadora Soraya garante mais de R$ 28 milhões para 23 municípios de Mato Grosso do Sul em maio - MS Todo dia Credencial Sesc facilita o acesso a lazer, educação, cultura, saúde e turismo para trabalhadores do comércio - agorams.com.br Hotel Sesc Bonito é opção de descanso e contato com a natureza em feriados e fins de semana - agorams.com.br Vencedores do Prêmio Braztoa de Sustentabilidade 2024 são anunciados durante cerimônia em Gramado (RS) - GOV.BR Cine Sesi tem 2º maior público do ano em Bonito com 4,9 mil pessoas - Agência de Notícias da Indústria Oferta inédita no IFMS abre curso de informática para mulheres - Correio de Corumbá GIRO FUNTRAB DE NOTÍCIAS – 03/06/2025 a 16/06/2025 - funtrab.ms.gov.br Corpo de Bombeiros divulga novo resultado da seleção para bombeiros temporários - Midiamax Procurando estágio? - Blog Gran Cursos Online Promotoria pede que Justiça monitore gastos da prefeitura de Bela Vista ao transferir idosos - Midiamax Com Fiems, Paulo Corrêa articula desconto de até 20% na conta de energia para 74 municípios de MS - O CORREIO NEWS Concursos Prefeituras 2026: Confira os editais com centenas de vagas - Blog Gran Cursos Online MPMS solicita transferência imediata da gestão de Instituição para Idosos à Prefeitura de Bela Vista - Fátima em Dia Vistorias apontam falhas há uma década e Justiça suspende diretoria do Asilo de Bela Vista - Midiamax Senadora Soraya garante mais de R$ 28 milhões para 23 municípios de Mato Grosso do Sul em maio  MS Todo dia Credencial Sesc facilita o acesso a lazer, educação, cultura, saúde e turismo para trabalhadores do comércio  agorams.com.br Hotel Sesc Bonito é opção de descanso e contato com a natureza em feriados e fins de semana  agorams.com.br Vencedores do Prêmio Braztoa de Sustentabilidade 2024 são anunciados durante cerimônia em Gramado (RS)  GOV.BR Cine Sesi tem 2º maior público do ano em Bonito com 4,9 mil pessoas  Agência de Notícias da Indústria Oferta inédita no IFMS abre curso de informática para mulheres  Correio de Corumbá GIRO FUNTRAB DE NOTÍCIAS – 03/06/2025 a 16/06/2025  funtrab.ms.gov.br Corpo de Bombeiros divulga novo resultado da seleção para bombeiros temporários  Midiamax Procurando estágio? Blog Gran Cursos Online Promotoria pede que Justiça monitore gastos da prefeitura de Bela Vista ao transferir idosos  Midiamax Com Fiems, Paulo Corrêa articula desconto de até 20% na conta de energia para 74 municípios de MS  O CORREIO NEWS Concursos Prefeituras 2026: Confira os editais com centenas de vagas  Blog Gran Cursos Online MPMS solicita transferência imediata da gestão de Instituição para Idosos à Prefeitura de Bela Vista  Fátima em Dia Vistorias apontam falhas há uma década e Justiça suspende diretoria do Asilo de Bela Vista  Midiamax"
