municipio,qtd_noticias_encontradas,temas_frequentes,resumo_para_slide
Glória de Dourados,15,"funtrab, dourados, glória, melhor, uems","UEMS/Dourados: Acadêmicos de Turismo promovem tarde de lazer e integração para participantes da UNAMI - uems.br A cidade universitária próxima ao Paraguai que registrou crescimento de 24% e virou destino de quem busca qualidade de vida - Correio Braziliense Festival de Dança Coreografada da Melhor Idade define campeões - fundesporte.ms.gov.br As 10 cidades com melhor qualidade de vida de MS; Campo Grande lidera ranking estadual - G1 Três Lagoas recebe mais de 700 atletas na abertura dos Jogos da Melhor Idade - Prefeitura Três Lagoas Funtrab e SENAI-MS abrem vagas para cursos gratuitos e fortalecem qualificação profissional no Estado - funtrab.ms.gov.br Funtrab oferece vagas para advogado, informática, RH, vigilante (PcD) e costureira - funtrab.ms.gov.br Confira a programação completa do Delas Day 2026 - funtrab.ms.gov.br Educação que transforma: 100% dos municípios de Mato Grosso do Sul contam com ensino profissionalizante - sed.ms.gov.br Casa do Trabalhador de Brasilândia anuncia vaga imediata e abre inscrições para cursos de qualificação - funtrab.ms.gov.br TCE-MS participa de lançamento de Programa de Compliance em Glória de Dourados - TCE-MS MPMS fiscaliza transporte escolar em Glória de Dourados e cobra regularização de vistorias e segurança veicular - MPMS Glória de Dourados adia licitação após arquitetos questionarem exclusividade de obras para engenheiros - Midiamax Polícia Civil inaugura a 52ª Sala Lilás do MS, em Aparecida do Taboado - pc.ms.gov.br Glória de Dourados abre seleção para cadastro reserva de professores em 2026 - Qconcursos Folha Dirigida UEMS/Dourados: Acadêmicos de Turismo promovem tarde de lazer e integração para participantes da UNAMI  uems.br A cidade universitária próxima ao Paraguai que registrou crescimento de 24% e virou destino de quem busca qualidade de vida  Correio Braziliense Festival de Dança Coreografada da Melhor Idade define campeões  fundesporte.ms.gov.br As 10 cidades com melhor qualidade de vida de MS; Campo Grande lidera ranking estadual  G1 Três Lagoas recebe mais de 700 atletas na abertura dos Jogos da Melhor Idade  Prefeitura Três Lagoas Funtrab e SENAI-MS abrem vagas para cursos gratuitos e fortalecem qualificação profissional no Estado  funtrab.ms.gov.br Funtrab oferece vagas para advogado, informática, RH, vigilante (PcD) e costureira  funtrab.ms.gov.br Confira a programação completa do Delas Day 2026  funtrab.ms.gov.br Educação que transforma: 100% dos municípios de Mato Grosso do Sul contam com ensino profissionalizante  sed.ms.gov.br Casa do Trabalhador de Brasilândia anuncia vaga imediata e abre inscrições para cursos de qualificação  funtrab.ms.gov.br TCE-MS participa de lançamento de Programa de Compliance em Glória de Dourados  TCE-MS MPMS fiscaliza transporte escolar em Glória de Dourados e cobra regularização de vistorias e segurança veicular  MPMS Glória de Dourados adia licitação após arquitetos questionarem exclusividade de obras para engenheiros  Midiamax Polícia Civil inaugura a 52ª Sala Lilás do MS, em Aparecida do Taboado  pc.ms.gov.br Glória de Dourados abre seleção para cadastro reserva de professores em 2026  Qconcursos Folha Dirigida"
Iguatemi,12,"vagas, processo, seletivo, notícias, funtrab","Festival de Dança Coreografada da Melhor Idade define campeões - fundesporte.ms.gov.br Cine Sesi tem 2º maior público do ano em Bonito com 4,9 mil pessoas - Agência de Notícias da Indústria GIRO FUNTRAB DE NOTÍCIAS – 03/06/2025 a 16/06/2025 - funtrab.ms.gov.br Vagas temporárias, de estágio e jovem aprendiz: veja oportunidades de trabalho abertas nesta semana - G1 SAD - SEJUSP- CBMMS divulga Processo Seletivo com 230 vagas - PCI Concursos Empregos - Hora Campinas Prefeitura de Campo Grande - MS abre Processo Seletivo para Assistente Educacional Inclusivo - PCI Concursos Prefeitura de Iguatemi MS abre processo seletivo com 17 vagas em Assistência Social - Qconcursos Folha Dirigida Iguatemi e Japorã recebem obras milionárias para saúde e infraestrutura - Midiamax Polícia Civil inaugura a 52ª Sala Lilás do MS, em Aparecida do Taboado - SINPOL-MS SPU/MS agenda audiência sobre demarcação de rios no MS - Campo Grande News Dos 14 aos 24 anos: processo seletivo para jovem aprendiz tem 42 vagas - Primeira Página Festival de Dança Coreografada da Melhor Idade define campeões  fundesporte.ms.gov.br Cine Sesi tem 2º maior público do ano em Bonito com 4,9 mil pessoas  Agência de Notícias da Indústria GIRO FUNTRAB DE NOTÍCIAS – 03/06/2025 a 16/06/2025  funtrab.ms.gov.br Vagas temporárias, de estágio e jovem aprendiz: veja oportunidades de trabalho abertas nesta semana  G1 SAD - SEJUSP- CBMMS divulga Processo Seletivo com 230 vagas  PCI Concursos Empregos  Hora Campinas Prefeitura de Campo Grande - MS abre Processo Seletivo para Assistente Educacional Inclusivo  PCI Concursos Prefeitura de Iguatemi MS abre processo seletivo com 17 vagas em Assistência Social  Qconcursos Folha Dirigida Iguatemi e Japorã recebem obras milionárias para saúde e infraestrutura  Midiamax Polícia Civil inaugura a 52ª Sala Lilás do MS, em Aparecida do Taboado  SINPOL-MS SPU/MS agenda audiência sobre demarcação de rios no MS  Campo Grande News Dos 14 aos 24 anos: processo seletivo para jovem aprendiz tem 42 vagas  Primeira Página"
Itaporã,10,"itaporã, projeto, interior, cidades, agência","Projeto Artesania fomenta cultura e geração de renda no interior por meio do artesanato - Portal Único ms.gov.br Neno Razuk destina R$ 5,3 milhões para cidades do interior - capitalnews.com.br Cine Sesi tem 2º maior público do ano em Bonito com 4,9 mil pessoas - Agência de Notícias da Indústria Abertas vagas para estágio no IEL! São 2,3 mil oportunidades em diversos cursos - Agência de Notícias da Indústria Secretaria de Educação-MS abre 415 vagas para Assistente de Atividades Educacionais - Ache Concursos Com foco no atendimento humanizado, MPMS capacita focais do Projeto Acolhida em Itaporã - Prefeitura de Itaporã - MS Com 5,8 mil casos e 12 mortes, três cidades de MS decretam emergência por chikungunya - Midiamax Governo desapropria área para ampliar anel viário de Itaporã - Campo Grande News MP investiga desvio de verba da educação em rodeio de Itaporã - Campo Grande News Fraudes em licitações: secretário de Corumbá é preso em operação - G1 Projeto Artesania fomenta cultura e geração de renda no interior por meio do artesanato  Portal Único ms.gov.br Neno Razuk destina R$ 5,3 milhões para cidades do interior  capitalnews.com.br Cine Sesi tem 2º maior público do ano em Bonito com 4,9 mil pessoas  Agência de Notícias da Indústria Abertas vagas para estágio no IEL! São 2,3 mil oportunidades em diversos cursos  Agência de Notícias da Indústria Secretaria de Educação-MS abre 415 vagas para Assistente de Atividades Educacionais  Ache Concursos Com foco no atendimento humanizado, MPMS capacita focais do Projeto Acolhida em Itaporã  Prefeitura de Itaporã - MS Com 5,8 mil casos e 12 mortes, três cidades de MS decretam emergência por chikungunya  Midiamax Governo desapropria área para ampliar anel viário de Itaporã  Campo Grande News MP investiga desvio de verba da educação em rodeio de Itaporã  Campo Grande News Fraudes em licitações: secretário de Corumbá é preso em operação  G1"
Itaquiraí,12,"itaquiraí, notícias, vagas, funtrab, pessoas","Festival de Dança Coreografada da Melhor Idade define campeões - fundesporte.ms.gov.br Cine Sesi tem 2º maior público do ano em Bonito com 4,9 mil pessoas - Agência de Notícias da Indústria CCR MSVia está com 30 vagas de trabalho abertas em municípios de MS - Motiva Rodovias GIRO FUNTRAB DE NOTÍCIAS – 03/06/2025 a 16/06/2025 - funtrab.ms.gov.br Acabou a desculpa! Concessionárias de rodovias abrem vagas em vários estados - Estradas Casa do Trabalhador de Itaquiraí leva orientações sobre emprego e cidadania ao Mutirão Agraer no Assentamento Santo Antônio - funtrab.ms.gov.br Itaquiraí lança Plano de Desenvolvimento Municipal para diversificar e fortalecer a economia local - ms.agenciasebrae.com.br Após articulação de Paulo Corrêa, 74 municípios de MS podem ter acesso a desconto de até 20% na conta de luz - O CORREIO NEWS Contagem regressiva: Expo Itaquiraí 2026 promete três dias de festa, grandes shows e rodeio em maio - tanamidianavirai.com.br Mutirão de Documentação leva serviços a 1,7 mil pessoas em Sidrolândia (MS) - GOV.BR Vereadores querem obrigar Prefeitura de Itaquiraí a custear exames na rede privada - Midiamax Festival de Dança Coreografada da Melhor Idade define campeões  fundesporte.ms.gov.br Cine Sesi tem 2º maior público do ano em Bonito com 4,9 mil pessoas  Agência de Notícias da Indústria CCR MSVia está com 30 vagas de trabalho abertas em municípios de MS  Motiva Rodovias GIRO FUNTRAB DE NOTÍCIAS – 03/06/2025 a 16/06/2025  funtrab.ms.gov.br Acabou a desculpa! Concessionárias de rodovias abrem vagas em vários estados  Estradas Casa do Trabalhador de Itaquiraí leva orientações sobre emprego e cidadania ao Mutirão Agraer no Assentamento Santo Antônio  funtrab.ms.gov.br Itaquiraí lança Plano de Desenvolvimento Municipal para diversificar e fortalecer a economia local  ms.agenciasebrae.com.br Após articulação de Paulo Corrêa, 74 municípios de MS podem ter acesso a desconto de até 20% na conta de luz  O CORREIO NEWS Contagem regressiva: Expo Itaquiraí 2026 promete três dias de festa, grandes shows e rodeio em maio  tanamidianavirai.com.br Mutirão de Documentação leva serviços a 1,7 mil pessoas em Sidrolândia (MS)  GOV.BR Vereadores querem obrigar Prefeitura de Itaquiraí a custear exames na rede privada  Midiamax"
Ivinhema,11,"midiamax, prefeitura, portal, único, bioenergia",Projeto Artesania fomenta cultura e geração de renda no interior por meio do artesanato - Portal Único ms.gov.br Bioenergia: rodada de empregabilidade oferece mais de 630 vagas em 15 municípios de MS - Portal Único ms.gov.br GIRO FUNTRAB DE NOTÍCIAS – 03/06/2025 a 16/06/2025 - funtrab.ms.gov.br Corpo de Bombeiros divulga novo resultado da seleção para bombeiros temporários - Midiamax Rodada de Empregabilidade mostra a diversidade de profissões que movem o setor de Bioenergia em MS - Cana Online Adecoagro inicia Programa Jovens Talentos Aprendizes com Deficiência - JornalCana Agehab e prefeitura estendem convênio para construção de 20 casas populares em Ivinhema - Midiamax Renato Câmara cumpre agenda em Ivinhema com entrega na Escola Angelina Jaime Tebet - Assembleia Legislativa de Mato Grosso do Sul - Prefeitura de Batayporã MS abre processo seletivo com 4 vagas - Qconcursos Folha Dirigida Polícia Civil inaugura a 52ª Sala Lilás do MS em Aparecida do Taboado - Costa Leste News Juliano Ferro desiste de renunciar para vice não assumir prefeitura: ‘Toda a equipe seria substituída’ - Midiamax Projeto Artesania fomenta cultura e geração de renda no interior por meio do artesanato  Portal Único ms.gov.br Bioenergia: rodada de empregabilidade oferece mais de 630 vagas em 15 municípios de MS  Portal Único ms.gov.br GIRO FUNTRAB DE NOTÍCIAS – 03/06/2025 a 16/06/2025  funtrab.ms.gov.br Corpo de Bombeiros divulga novo resultado da seleção para bombeiros temporários  Midiamax Rodada de Empregabilidade mostra a diversidade de profissões que movem o setor de Bioenergia em MS  Cana Online Adecoagro inicia Programa Jovens Talentos Aprendizes com Deficiência  JornalCana Agehab e prefeitura estendem convênio para construção de 20 casas populares em Ivinhema  Midiamax Renato Câmara cumpre agenda em Ivinhema com entrega na Escola Angelina Jaime Tebet  Assembleia Legislativa de Mato Grosso do Sul - Prefeitura de Batayporã MS abre processo seletivo com 4 vagas  Qconcursos Folha Dirigida Polícia Civil inaugura a 52ª Sala Lilás do MS em Aparecida do Taboado  Costa Leste News Juliano Ferro desiste de renunciar para vice não assumir prefeitura: ‘Toda a equipe seria substituída’  Midiamax
Jardim,15,"news, semana, cultura, vagas, campo","Agendão: treinão, festas juninas, circo e eventos culturais movimentam MS neste fim de semana - agenciadenoticias.ms.gov.br Governo licita obras de CEUs da Cultura em quatro cidades e fortalece acesso à arte, educação e cidadania - Portal Único ms.gov.br Indicações apresentadas na Câmara Municipal abordam saúde, trânsito, infraestrutura, cultura e assistência social em Aparecida do Taboado - Costa Leste News Tradição, aventura e cultura: Confira o roteiro de eventos que agitam o Brasil no mês de Setembro - GOV.BR Agendão: fim de semana tem dança, cinema, teatro e feira cultural em Mato Grosso do Sul - agenciadenoticias.ms.gov.br Funtrab oferece vagas para advogado, informática, RH, vigilante (PcD) e costureira - funtrab.ms.gov.br IFMS abre vagas na graduação para portador de diploma, transferência e reingresso - Correio de Corumbá Cursos para mulheres em MS: bolsa de até R$ 720 em 8 cidades - Campo Grande News Classificados do Edimilson: veja as vagas de emprego da semana de 23 a 27 de março - G1 Vitória recebe maior evento de reciclagem do ES e SESI Campinas sedia festival de cinema ambiental - Agência de Notícias da Indústria Prefeitura lança jogo digital para estudantes com foco no combate à dengue - Dourados News Sábado tem Mutirão Todos em Ação no Jardim Anache – CGNotícias - campogrande.ms.gov.br Após assassinato, rua do Jardim das Macaúbas entra na rota para receber iluminação - Midiamax Dona de casa viaja 212 km para participar do Mutirão Todos em Ação – CGNotícias - campogrande.ms.gov.br TJMS determina revisão do plano de drenagem em Campo Grande - Campo Grande News Agendão: treinão, festas juninas, circo e eventos culturais movimentam MS neste fim de semana  agenciadenoticias.ms.gov.br Governo licita obras de CEUs da Cultura em quatro cidades e fortalece acesso à arte, educação e cidadania  Portal Único ms.gov.br Indicações apresentadas na Câmara Municipal abordam saúde, trânsito, infraestrutura, cultura e assistência social em Aparecida do Taboado  Costa Leste News Tradição, aventura e cultura: Confira o roteiro de eventos que agitam o Brasil no mês de Setembro  GOV.BR Agendão: fim de semana tem dança, cinema, teatro e feira cultural em Mato Grosso do Sul  agenciadenoticias.ms.gov.br Funtrab oferece vagas para advogado, informática, RH, vigilante (PcD) e costureira  funtrab.ms.gov.br IFMS abre vagas na graduação para portador de diploma, transferência e reingresso  Correio de Corumbá Cursos para mulheres em MS: bolsa de até R$ 720 em 8 cidades  Campo Grande News Classificados do Edimilson: veja as vagas de emprego da semana de 23 a 27 de março  G1 Vitória recebe maior evento de reciclagem do ES e SESI Campinas sedia festival de cinema ambiental  Agência de Notícias da Indústria Prefeitura lança jogo digital para estudantes com foco no combate à dengue  Dourados News Sábado tem Mutirão Todos em Ação no Jardim Anache – CGNotícias  campogrande.ms.gov.br Após assassinato, rua do Jardim das Macaúbas entra na rota para receber iluminação  Midiamax Dona de casa viaja 212 km para participar do Mutirão Todos em Ação – CGNotícias  campogrande.ms.gov.br TJMS determina revisão do plano de drenagem em Campo Grande  Campo Grande News"
Ladário,15,"ladário, vagas, agenciadenoticias, moinho, meio","Junho chega trazendo as festas de São João e outros eventos por todo o país — Ministério do Turismo - GOV.BR Bonitinho integra crianças e famílias à programação do Festival de Inverno de Bonito 2025 - agenciadenoticias.ms.gov.br Moinho Cultural sai em turnê por Mato Grosso do Sul com o espetáculo Guadakan - fundacaodecultura.ms.gov.br Projeto Artesania fomenta cultura e geração de renda no interior por meio do artesanato - Portal Único ms.gov.br Moinho in Concert entra na reta final dos ensaios para celebrar os caminhos que levam ao céu - Correio de Corumbá Funtrab anuncia vagas em Campo Grande e Terenos com salários de até R$ 3 mil e benefícios - agenciadenoticias.ms.gov.br IFMS abre 480 vagas para curso preparatório gratuito com bolsa de R$ 200 - Campo Grande News Programa Jovens do Amanhã oferece 2 mil vagas para cursos no Senai - Diário Corumbaense CNU 2025: prova será aplicada em 5 cidades de MS neste domingo - G1 CNU 2025: entenda a distribuição de cargos e vagas por estado - Blog Gran Cursos Online Investimentos em infraestrutura e saúde marcaram agenda do Governo de MS em Ladário - agenciadenoticias.ms.gov.br Ladário agenda audiência pública para discutir LDO 2027 - Midiamax MPMS manda Prefeitura de Ladário cancelar contrato com empresa ligada ao vice-prefeito - Folha MS Ladário promove Semana do Meio Ambiente com ações de educação ambiental, sustentabilidade e participação da comunidade - Correio de Corumbá Prefeitura de Ladário pagará R$ 1,1 milhão para colocar secretarias em contêineres - Midiamax Junho chega trazendo as festas de São João e outros eventos por todo o país — Ministério do Turismo  GOV.BR Bonitinho integra crianças e famílias à programação do Festival de Inverno de Bonito 2025  agenciadenoticias.ms.gov.br Moinho Cultural sai em turnê por Mato Grosso do Sul com o espetáculo Guadakan  fundacaodecultura.ms.gov.br Projeto Artesania fomenta cultura e geração de renda no interior por meio do artesanato  Portal Único ms.gov.br Moinho in Concert entra na reta final dos ensaios para celebrar os caminhos que levam ao céu  Correio de Corumbá Funtrab anuncia vagas em Campo Grande e Terenos com salários de até R$ 3 mil e benefícios  agenciadenoticias.ms.gov.br IFMS abre 480 vagas para curso preparatório gratuito com bolsa de R$ 200  Campo Grande News Programa Jovens do Amanhã oferece 2 mil vagas para cursos no Senai  Diário Corumbaense CNU 2025: prova será aplicada em 5 cidades de MS neste domingo  G1 CNU 2025: entenda a distribuição de cargos e vagas por estado  Blog Gran Cursos Online Investimentos em infraestrutura e saúde marcaram agenda do Governo de MS em Ladário  agenciadenoticias.ms.gov.br Ladário agenda audiência pública para discutir LDO 2027  Midiamax MPMS manda Prefeitura de Ladário cancelar contrato com empresa ligada ao vice-prefeito  Folha MS Ladário promove Semana do Meio Ambiente com ações de educação ambiental, sustentabilidade e participação da comunidade  Correio de Corumbá Prefeitura de Ladário pagará R$ 1,1 milhão para colocar secretarias em contêineres  Midiamax"
Miranda,15,"marcelo, miranda, governador, milhões, campo","Com investimento de R$ 2,6 milhões, Carnaval de Campo Grande deve reunir mais de 100 mil foliões - agenciadenoticias.ms.gov.br Entrevista com o ex-secretário Marcelo Miranda, Jornal da Top - Diário MS News Edital do FIC 2024 destina R$ 8 milhões para projetos culturais de pessoas físicas - Portal Único ms.gov.br Ex-diretor-presidente da Fundesporte, Marcelo Miranda é empossado secretário de Turismo, Esporte, Cultura e Cidadania - fundesporte.ms.gov.br TCE-MS inaugura Espaço Cultural com exposição, música, poesia e emoção - TCE-MS Com educação profissional e qualificação, MS é beneficiado com melhores oportunidades de emprego - agenciadenoticias.ms.gov.br Escritório Social da Agepen transforma recomeços e amplia oportunidades para egressos do sistema prisional - Portal Único ms.gov.br Petrobras abre 715 vagas no Programa Jovem Aprendiz 2025: veja salário e benefícios - Seu Dinheiro GIRO FUNTRAB DE NOTÍCIAS – 03/06/2025 a 16/06/2025 - funtrab.ms.gov.br Corpo de Bombeiros divulga novo resultado da seleção para bombeiros temporários - Midiamax Luto: ALEMS se despede de Marcelo Miranda e relembra sua trajetória ... - Assembleia Legislativa de Mato Grosso do Sul - Prefeitura de Chapadão do Sul publica nota de pesar pelo falecimento do ex-governador Marcelo Miranda - Jovem Sul News Ex-governador Marcelo Miranda morre aos 87 anos em Campo Grande - capitalnews.com.br Luto em MS pela morte de Marcelo Miranda - Hojemais Morre Marcelo Miranda, ex-governador de Mato Grosso do Sul - Diário Corumbaense Com investimento de R$ 2,6 milhões, Carnaval de Campo Grande deve reunir mais de 100 mil foliões  agenciadenoticias.ms.gov.br Entrevista com o ex-secretário Marcelo Miranda, Jornal da Top  Diário MS News Edital do FIC 2024 destina R$ 8 milhões para projetos culturais de pessoas físicas  Portal Único ms.gov.br Ex-diretor-presidente da Fundesporte, Marcelo Miranda é empossado secretário de Turismo, Esporte, Cultura e Cidadania  fundesporte.ms.gov.br TCE-MS inaugura Espaço Cultural com exposição, música, poesia e emoção  TCE-MS Com educação profissional e qualificação, MS é beneficiado com melhores oportunidades de emprego  agenciadenoticias.ms.gov.br Escritório Social da Agepen transforma recomeços e amplia oportunidades para egressos do sistema prisional  Portal Único ms.gov.br Petrobras abre 715 vagas no Programa Jovem Aprendiz 2025: veja salário e benefícios  Seu Dinheiro GIRO FUNTRAB DE NOTÍCIAS – 03/06/2025 a 16/06/2025  funtrab.ms.gov.br Corpo de Bombeiros divulga novo resultado da seleção para bombeiros temporários  Midiamax Luto: ALEMS se despede de Marcelo Miranda e relembra sua trajetória ...  Assembleia Legislativa de Mato Grosso do Sul - Prefeitura de Chapadão do Sul publica nota de pesar pelo falecimento do ex-governador Marcelo Miranda  Jovem Sul News Ex-governador Marcelo Miranda morre aos 87 anos em Campo Grande  capitalnews.com.br Luto em MS pela morte de Marcelo Miranda  Hojemais Morre Marcelo Miranda, ex-governador de Mato Grosso do Sul  Diário Corumbaense"
Mundo Novo,14,"funtrab, vagas, mundo, novo, sesi","Sesi e Suzano fortalecem cultura de segurança e impulsionam transformação de Ribas do Rio Pardo - ArapuaNews Sesc Teatro Prosa oferece semana de arte e lazer gratuito em Campo Grande - capitalnews.com.br Projeto Artesania fomenta cultura e geração de renda no interior por meio do artesanato - Portal Único ms.gov.br Cine Sesi tem 2º maior público do ano em Bonito com 4,9 mil pessoas - Agência de Notícias da Indústria Funtrab e SENAI-MS abrem vagas para cursos gratuitos e fortalecem qualificação profissional no Estado - funtrab.ms.gov.br Funtrab oferece vagas para advogado, informática, RH, vigilante (PcD) e costureira - funtrab.ms.gov.br Confira a programação completa do Delas Day 2026 - funtrab.ms.gov.br CCR MSVia está com 30 vagas de trabalho abertas em municípios de MS - Motiva Rodovias Casa do Trabalhador de Brasilândia anuncia vaga imediata e abre inscrições para cursos de qualificação - funtrab.ms.gov.br Prefeitura de Mundo Novo abre licitação para construção de ponte de concreto - O TEMPO Mundo Novo recebe repasse de R$ 350 mil para ações de saúde pública - Midiamax Polícia Civil inaugura a 51ª Sala Lilás em Mundo Novo - pc.ms.gov.br Polícia Civil inaugura a 53ª Sala Lilás do MS, em Japorã - sejusp.ms.gov.br Justiça Itinerante de Dourados realiza abertura de 51 ações em Amambai - Dourados News Sesi e Suzano fortalecem cultura de segurança e impulsionam transformação de Ribas do Rio Pardo  ArapuaNews Sesc Teatro Prosa oferece semana de arte e lazer gratuito em Campo Grande  capitalnews.com.br Projeto Artesania fomenta cultura e geração de renda no interior por meio do artesanato  Portal Único ms.gov.br Cine Sesi tem 2º maior público do ano em Bonito com 4,9 mil pessoas  Agência de Notícias da Indústria Funtrab e SENAI-MS abrem vagas para cursos gratuitos e fortalecem qualificação profissional no Estado  funtrab.ms.gov.br Funtrab oferece vagas para advogado, informática, RH, vigilante (PcD) e costureira  funtrab.ms.gov.br Confira a programação completa do Delas Day 2026  funtrab.ms.gov.br CCR MSVia está com 30 vagas de trabalho abertas em municípios de MS  Motiva Rodovias Casa do Trabalhador de Brasilândia anuncia vaga imediata e abre inscrições para cursos de qualificação  funtrab.ms.gov.br Prefeitura de Mundo Novo abre licitação para construção de ponte de concreto  O TEMPO Mundo Novo recebe repasse de R$ 350 mil para ações de saúde pública  Midiamax Polícia Civil inaugura a 51ª Sala Lilás em Mundo Novo  pc.ms.gov.br Polícia Civil inaugura a 53ª Sala Lilás do MS, em Japorã  sejusp.ms.gov.br Justiça Itinerante de Dourados realiza abertura de 51 ações em Amambai  Dourados News"
