municipio,qtd_noticias_encontradas,temas_frequentes,resumo_para_slide
Glória de Dourados,13,"glória, dourados, melhor, idade, semana","Ponta Porã recebe etapa dos Jogos da Melhor Idade com disputas de bocha - Portal Único ms.gov.br Semana S deve reunir 15 mil pessoas e impulsionar comércio e turismo em Campo Grande - A Crítica de Campo Grande Cresce 24% o número de brasileiros migrando para essa cidade universitária de alto padrão perto do Paraguai nos últimos 12 anos - Correio Braziliense Festival de Dança Coreografada da Melhor Idade define campeões - fundesporte.ms.gov.br Municipalismo: Governo de MS investe em infraestrutura e apoia feira agropecuária em Glória de Dourados - ArapuaNews Funtrab inaugura Casa do Trabalhador de Brasilândia e amplia acesso a emprego e qualificação profissional - funtrab.ms.gov.br Semana começa com 14 processos seletivos abertos em MS; veja todos aqui! - Enfoque MS 75 vagas de jovens aprendizes em Deodápolis, Glória de Dourados e Nova Alvorada do Sul - Rede Jota FM TCE-MS participa de lançamento de Programa de Compliance em Glória de Dourados - TCE-MS Glória de Dourados adia licitação após arquitetos questionarem exclusividade de obras para engenheiros - Midiamax MPMS fiscaliza transporte escolar em Glória de Dourados e cobra regularização de vistorias e segurança veicular - MPMS Polícia Civil inaugura a 53ª Sala Lilás do MS, em Japorã - pc.ms.gov.br Mais de 110 concursos públicos reúnem quase 223 mil vagas no país - AJN1 Ponta Porã recebe etapa dos Jogos da Melhor Idade com disputas de bocha  Portal Único ms.gov.br Semana S deve reunir 15 mil pessoas e impulsionar comércio e turismo em Campo Grande  A Crítica de Campo Grande Cresce 24% o número de brasileiros migrando para essa cidade universitária de alto padrão perto do Paraguai nos últimos 12 anos  Correio Braziliense Festival de Dança Coreografada da Melhor Idade define campeões  fundesporte.ms.gov.br Municipalismo: Governo de MS investe em infraestrutura e apoia feira agropecuária em Glória de Dourados  ArapuaNews Funtrab inaugura Casa do Trabalhador de Brasilândia e amplia acesso a emprego e qualificação profissional  funtrab.ms.gov.br Semana começa com 14 processos seletivos abertos em MS; veja todos aqui! Enfoque MS 75 vagas de jovens aprendizes em Deodápolis, Glória de Dourados e Nova Alvorada do Sul  Rede Jota FM TCE-MS participa de lançamento de Programa de Compliance em Glória de Dourados  TCE-MS Glória de Dourados adia licitação após arquitetos questionarem exclusividade de obras para engenheiros  Midiamax MPMS fiscaliza transporte escolar em Glória de Dourados e cobra regularização de vistorias e segurança veicular  MPMS Polícia Civil inaugura a 53ª Sala Lilás do MS, em Japorã  pc.ms.gov.br Mais de 110 concursos públicos reúnem quase 223 mil vagas no país  AJN1"
Iguatemi,9,"iguatemi, funtrab, inaugura, japorã, prefeitura","Festival de Dança Coreografada da Melhor Idade define campeões - fundesporte.ms.gov.br 16 filmes e animações gratuitas para refletir sobre as infâncias - PORVIR Investimentos do Governo do Estado em Itaquiraí somam mais de R$ 82 milhões - agenciadenoticias.ms.gov.br Funtrab inaugura Casa do Trabalhador de Brasilândia e amplia acesso a emprego e qualificação profissional - funtrab.ms.gov.br Iguatemi e Japorã recebem obras milionárias para saúde e infraestrutura - Midiamax Polícia Civil inaugura a 53ª Sala Lilás do MS, em Japorã - pc.ms.gov.br Prefeitura de Iguatemi MS abre processo seletivo com 17 vagas em Assistência Social - Folha Dirigida Dos 14 aos 24 anos: processo seletivo para jovem aprendiz tem 42 vagas - Primeira Página Prefeitura de Iguatemi divulga a lista de aprovados no programa Jovem Aprendiz Municipal - A Gazeta News Festival de Dança Coreografada da Melhor Idade define campeões  fundesporte.ms.gov.br 16 filmes e animações gratuitas para refletir sobre as infâncias  PORVIR Investimentos do Governo do Estado em Itaquiraí somam mais de R$ 82 milhões  agenciadenoticias.ms.gov.br Funtrab inaugura Casa do Trabalhador de Brasilândia e amplia acesso a emprego e qualificação profissional  funtrab.ms.gov.br Iguatemi e Japorã recebem obras milionárias para saúde e infraestrutura  Midiamax Polícia Civil inaugura a 53ª Sala Lilás do MS, em Japorã  pc.ms.gov.br Prefeitura de Iguatemi MS abre processo seletivo com 17 vagas em Assistência Social  Folha Dirigida Dos 14 aos 24 anos: processo seletivo para jovem aprendiz tem 42 vagas  Primeira Página Prefeitura de Iguatemi divulga a lista de aprovados no programa Jovem Aprendiz Municipal  A Gazeta News"
Itaporã,8,"itaporã, funtrab, campo, grande, news","Neno Razuk investe mais de R$ 5 milhões em emendas e transforma municípios de MS - Assembleia Legislativa de Mato Grosso do Sul - Projeto Artesania fomenta cultura e geração de renda no interior por meio do artesanato - Portal Único ms.gov.br Funtrab inaugura Casa do Trabalhador de Brasilândia e amplia acesso a emprego e qualificação profissional - funtrab.ms.gov.br Com 5,8 mil casos e 12 mortes, três cidades de MS decretam emergência por chikungunya - Midiamax “Hora do Tributo” da OAB Dourados debate reforma tributária com presença da Sefaz - agorams.com.br Governo desapropria área para ampliar anel viário de Itaporã - Campo Grande News Presidente do Sindicato Rural e diretoria reforçam o convite para a EXPOITA 2025 - Prefeitura de Itaporã MP investiga desvio de verba da educação em rodeio de Itaporã - Campo Grande News Neno Razuk investe mais de R$ 5 milhões em emendas e transforma municípios de MS  Assembleia Legislativa de Mato Grosso do Sul - Projeto Artesania fomenta cultura e geração de renda no interior por meio do artesanato  Portal Único ms.gov.br Funtrab inaugura Casa do Trabalhador de Brasilândia e amplia acesso a emprego e qualificação profissional  funtrab.ms.gov.br Com 5,8 mil casos e 12 mortes, três cidades de MS decretam emergência por chikungunya  Midiamax “Hora do Tributo” da OAB Dourados debate reforma tributária com presença da Sefaz  agorams.com.br Governo desapropria área para ampliar anel viário de Itaporã  Campo Grande News Presidente do Sindicato Rural e diretoria reforçam o convite para a EXPOITA 2025  Prefeitura de Itaporã MP investiga desvio de verba da educação em rodeio de Itaporã  Campo Grande News"
Itaquiraí,11,"agenciadenoticias, itaquiraí, milhões, investimentos, funtrab","Festival de Dança Coreografada da Melhor Idade define campeões - fundesporte.ms.gov.br Plano Estadual de Esporte e Lazer de MS trará diretrizes do setor para os próximos 10 anos - agenciadenoticias.ms.gov.br Neno Razuk investe mais de R$ 5 milhões em emendas e transforma municípios de MS - Assembleia Legislativa de Mato Grosso do Sul - Investimentos do Governo do Estado em Itaquiraí somam mais de R$ 82 milhões - agenciadenoticias.ms.gov.br Funtrab inaugura Casa do Trabalhador de Brasilândia e amplia acesso a emprego e qualificação profissional - funtrab.ms.gov.br Senai abre 355 vagas em cursos gratuitos em 13 cidades de MS - Campo Grande News Começa hoje a Expo Itaquiraí 2026 com show de Atitude 67, rodeio e transporte gratuito para a população - tanamidianavirai.com.br Sidrolândia (MS) receberá Mutirão de Documentação da Trabalhadora Rural — Incra - www.gov.br Alcinópolis recebe moradias e reforço na frota pública em nova rodada de investimentos estaduais - agenciadenoticias.ms.gov.br Vereadores querem obrigar Prefeitura de Itaquiraí a custear exames na rede privada - Midiamax SED anuncia 30 finalistas do Prêmio Escolas Destaque 2025 do Programa MS Alfabetiza - sed.ms.gov.br Festival de Dança Coreografada da Melhor Idade define campeões  fundesporte.ms.gov.br Plano Estadual de Esporte e Lazer de MS trará diretrizes do setor para os próximos 10 anos  agenciadenoticias.ms.gov.br Neno Razuk investe mais de R$ 5 milhões em emendas e transforma municípios de MS  Assembleia Legislativa de Mato Grosso do Sul - Investimentos do Governo do Estado em Itaquiraí somam mais de R$ 82 milhões  agenciadenoticias.ms.gov.br Funtrab inaugura Casa do Trabalhador de Brasilândia e amplia acesso a emprego e qualificação profissional  funtrab.ms.gov.br Senai abre 355 vagas em cursos gratuitos em 13 cidades de MS  Campo Grande News Começa hoje a Expo Itaquiraí 2026 com show de Atitude 67, rodeio e transporte gratuito para a população  tanamidianavirai.com.br Sidrolândia (MS) receberá Mutirão de Documentação da Trabalhadora Rural — Incra  www.gov.br Alcinópolis recebe moradias e reforço na frota pública em nova rodada de investimentos estaduais  agenciadenoticias.ms.gov.br Vereadores querem obrigar Prefeitura de Itaquiraí a custear exames na rede privada  Midiamax SED anuncia 30 finalistas do Prêmio Escolas Destaque 2025 do Programa MS Alfabetiza  sed.ms.gov.br"
Ivinhema,11,"ivinhema, calamidade, interior, bioenergia, rodada",Projeto Artesania fomenta cultura e geração de renda no interior por meio do artesanato - Portal Único ms.gov.br Bioenergia: rodada de empregabilidade oferece mais de 630 vagas em 15 municípios de MS - agenciadenoticias.ms.gov.br Cursos gratuitos da Funtrab seguem com inscrições abertas em Campo Grande e no interior de MS - funtrab.ms.gov.br Rodada de Empregabilidade mostra a diversidade de profissões que movem o setor de Bioenergia em MS - Cana Online Corpo de Bombeiros divulga novo resultado da seleção para bombeiros temporários - Midiamax SENAR Abre inscrições para Curso Técnico em Agronegócio EAD: Sua Carreira no Agro Começa Aqui! - PEBSP Renato Câmara cumpre agenda em Ivinhema com entrega na Escola Angelina Jaime Tebet - Diário MS News Prefeitura de Batayporã MS abre processo seletivo com 4 vagas - Folha Dirigida ALEMS reconhece estado de calamidade pública em Iv... - Assembleia Legislativa de Mato Grosso do Sul - Deputados reconhecem estado de calamidade pública em Ivinhema - Midiamax Ivinhema decreta calamidade após chuvas de 120 mm - Campo Grande News Projeto Artesania fomenta cultura e geração de renda no interior por meio do artesanato  Portal Único ms.gov.br Bioenergia: rodada de empregabilidade oferece mais de 630 vagas em 15 municípios de MS  agenciadenoticias.ms.gov.br Cursos gratuitos da Funtrab seguem com inscrições abertas em Campo Grande e no interior de MS  funtrab.ms.gov.br Rodada de Empregabilidade mostra a diversidade de profissões que movem o setor de Bioenergia em MS  Cana Online Corpo de Bombeiros divulga novo resultado da seleção para bombeiros temporários  Midiamax SENAR Abre inscrições para Curso Técnico em Agronegócio EAD: Sua Carreira no Agro Começa Aqui! PEBSP Renato Câmara cumpre agenda em Ivinhema com entrega na Escola Angelina Jaime Tebet  Diário MS News Prefeitura de Batayporã MS abre processo seletivo com 4 vagas  Folha Dirigida ALEMS reconhece estado de calamidade pública em Iv...  Assembleia Legislativa de Mato Grosso do Sul - Deputados reconhecem estado de calamidade pública em Ivinhema  Midiamax Ivinhema decreta calamidade após chuvas de 120 mm  Campo Grande News
Jardim,14,"interior, brasil, mato, grosso, águas","Do vinhedo paulista às águas termais goianas: as 6 cidades do interior para viver bem no Brasil - Revista Oeste Último Agendão de 2025 traz show com Di Ferrero, teatro infantil e atrações natalinas pelo interior - agenciadenoticias.ms.gov.br Tradição, aventura e cultura: Confira o roteiro de eventos que agitam o Brasil no mês de Setembro - www.gov.br Neno Razuk investe mais de R$ 5 milhões em emendas e transforma municípios de MS - Assembleia Legislativa de Mato Grosso do Sul - O paraíso escondido no Brasil tão preservado que suas águas cristalinas parecem brilhar - Correio Braziliense Funtrab leva serviços de empregabilidade ao MS Cidadão no Jardim Los Angeles neste sábado - funtrab.ms.gov.br SENAR Abre inscrições para Curso Técnico em Agronegócio EAD: Sua Carreira no Agro Começa Aqui! - PEBSP Energisa oferece vagas de trabalho na Capital e interior de MS - diariodigital.com.br Correios publica edital com 62 vagas para jovens aprendizes em Mato Grosso do Sul - Costa Leste News Pavimentação asfáltica já chegou em 87% das vias de Ponta Porã - Prefeitura Municipal de Ponta Porã Dona de casa viaja 212 km para participar do Mutirão Todos em Ação – CGNotícias - campogrande.ms.gov.br PARTICIPE – Prefeitura de TL realiza audiência pública para prestação de contas do 1º quadrimestre de 2026 - ArapuaNews Na Expoagro, governador Eduardo Riedel anuncia que Dourados vai receber R$ 30 milhões para recapear linhas de ônibus - RCN 67 Jamilson Name solicita troca de lâmpadas no Jardim Noroeste, em Campo Grande - Assembleia Legislativa de Mato Grosso do Sul - Do vinhedo paulista às águas termais goianas: as 6 cidades do interior para viver bem no Brasil  Revista Oeste Último Agendão de 2025 traz show com Di Ferrero, teatro infantil e atrações natalinas pelo interior  agenciadenoticias.ms.gov.br Tradição, aventura e cultura: Confira o roteiro de eventos que agitam o Brasil no mês de Setembro  www.gov.br Neno Razuk investe mais de R$ 5 milhões em emendas e transforma municípios de MS  Assembleia Legislativa de Mato Grosso do Sul - O paraíso escondido no Brasil tão preservado que suas águas cristalinas parecem brilhar  Correio Braziliense Funtrab leva serviços de empregabilidade ao MS Cidadão no Jardim Los Angeles neste sábado  funtrab.ms.gov.br SENAR Abre inscrições para Curso Técnico em Agronegócio EAD: Sua Carreira no Agro Começa Aqui! PEBSP Energisa oferece vagas de trabalho na Capital e interior de MS  diariodigital.com.br Correios publica edital com 62 vagas para jovens aprendizes em Mato Grosso do Sul  Costa Leste News Pavimentação asfáltica já chegou em 87% das vias de Ponta Porã  Prefeitura Municipal de Ponta Porã Dona de casa viaja 212 km para participar do Mutirão Todos em Ação – CGNotícias  campogrande.ms.gov.br PARTICIPE – Prefeitura de TL realiza audiência pública para prestação de contas do 1º quadrimestre de 2026  ArapuaNews Na Expoagro, governador Eduardo Riedel anuncia que Dourados vai receber R$ 30 milhões para recapear linhas de ônibus  RCN 67 Jamilson Name solicita troca de lâmpadas no Jardim Noroeste, em Campo Grande  Assembleia Legislativa de Mato Grosso do Sul -"
Ladário,13,"corumbá, prefeitura, correio, ifms, ladário","Prefeitura participa de entrega de óculos do projeto “Olhos que Inspiram” no IFMS - Município de Corumbá Moinho Cultural recebe premiação em São Paulo durante noite de gala da BrazilFoundation - Diário MS News Neno Razuk investe mais de R$ 5 milhões em emendas e transforma municípios de MS - Assembleia Legislativa de Mato Grosso do Sul - Moinho in Concert entra na reta final dos ensaios para celebrar os caminhos que levam ao céu - Correio de Corumbá Junho chega trazendo as festas de São João e outros eventos por todo o país — Ministério do Turismo - www.gov.br Funtrab inaugura Casa do Trabalhador de Brasilândia e amplia acesso a emprego e qualificação profissional - funtrab.ms.gov.br IFMS abre inscrições para curso que amplia acesso ao ensino médio técnico - Correio de Corumbá IFMS abre 480 vagas para curso preparatório gratuito com bolsa de R$ 200 - Campo Grande News Prefeitura de Ladário pagará R$ 1,1 milhão para colocar secretarias em contêineres - Midiamax Audiência pública vai apresentar demarcação de áreas da União em Ladário no dia 24 de fevereiro - Correio de Corumbá Prefeitura e forças de segurança definem esquema para o Carnaval 2026 em Corumbá - Correio de Corumbá 27ª Feapan impulsiona negócios, turismo e cultura no Pantanal com apoio da Prefeitura de Corumbá - Município de Corumbá Contrato milionário feito sem licitação é anulado em Ladário após recomendação do MP - Folha MS Prefeitura participa de entrega de óculos do projeto “Olhos que Inspiram” no IFMS  Município de Corumbá Moinho Cultural recebe premiação em São Paulo durante noite de gala da BrazilFoundation  Diário MS News Neno Razuk investe mais de R$ 5 milhões em emendas e transforma municípios de MS  Assembleia Legislativa de Mato Grosso do Sul - Moinho in Concert entra na reta final dos ensaios para celebrar os caminhos que levam ao céu  Correio de Corumbá Junho chega trazendo as festas de São João e outros eventos por todo o país — Ministério do Turismo  www.gov.br Funtrab inaugura Casa do Trabalhador de Brasilândia e amplia acesso a emprego e qualificação profissional  funtrab.ms.gov.br IFMS abre inscrições para curso que amplia acesso ao ensino médio técnico  Correio de Corumbá IFMS abre 480 vagas para curso preparatório gratuito com bolsa de R$ 200  Campo Grande News Prefeitura de Ladário pagará R$ 1,1 milhão para colocar secretarias em contêineres  Midiamax Audiência pública vai apresentar demarcação de áreas da União em Ladário no dia 24 de fevereiro  Correio de Corumbá Prefeitura e forças de segurança definem esquema para o Carnaval 2026 em Corumbá  Correio de Corumbá 27ª Feapan impulsiona negócios, turismo e cultura no Pantanal com apoio da Prefeitura de Corumbá  Município de Corumbá Contrato milionário feito sem licitação é anulado em Ladário após recomendação do MP  Folha MS"
Miranda,15,"portal, único, corumbá, qualificação, miranda","Economia criativa impulsiona desenvolvimento regional e promove inclusão em MS - Portal Único ms.gov.br Festival de Inverno de Bonito terá 150 atrações durante cinco dias de arte e cultura - Diário Corumbaense Governo de MS garante repasse de R$ 1,32 milhão para o carnaval de Corumbá 2025 - agenciadenoticias.ms.gov.br Com abertura nesta quinta-feira, Jogos Escolares da Juventude de MS 2024 tem recorde de participações - fundesporte.ms.gov.br Conheça 23 Patrimônios da Humanidade que ficam no Brasil — Ministério do Turismo - www.gov.br Com educação profissional e qualificação, MS é beneficiado com melhores oportunidades de emprego - Portal Único ms.gov.br Funtrab inaugura Casa do Trabalhador de Brasilândia e amplia acesso a emprego e qualificação profissional - funtrab.ms.gov.br Petrobras abre 715 vagas no Programa Jovem Aprendiz 2025: veja salário e benefícios - Seu Dinheiro Corpo de Bombeiros divulga novo resultado da seleção para bombeiros temporários - Midiamax Governo de MS oferece cursos de qualificação na área de economia criativa a partir de agosto - Portal Único ms.gov.br Dona de casa viaja 212 km para participar do Mutirão Todos em Ação – CGNotícias - campogrande.ms.gov.br Samyr cobra recuperação da sinalização da BR – 262, entre Corumbá e Miranda - Correio de Corumbá TRF3 e JFMS abrem a 9ª edição do projeto “Caminho do Acordo”, na Aldeia Cachoeirinha, em Miranda/MS - trf3.jus.br Sejusp entrega veículos para reforçar segurança em aldeias indígenas de Miranda - sejusp.ms.gov.br Polícia Civil inaugura a 52ª Sala Lilás do MS, em Aparecida do Taboado - pc.ms.gov.br Economia criativa impulsiona desenvolvimento regional e promove inclusão em MS  Portal Único ms.gov.br Festival de Inverno de Bonito terá 150 atrações durante cinco dias de arte e cultura  Diário Corumbaense Governo de MS garante repasse de R$ 1,32 milhão para o carnaval de Corumbá 2025  agenciadenoticias.ms.gov.br Com abertura nesta quinta-feira, Jogos Escolares da Juventude de MS 2024 tem recorde de participações  fundesporte.ms.gov.br Conheça 23 Patrimônios da Humanidade que ficam no Brasil — Ministério do Turismo  www.gov.br Com educação profissional e qualificação, MS é beneficiado com melhores oportunidades de emprego  Portal Único ms.gov.br Funtrab inaugura Casa do Trabalhador de Brasilândia e amplia acesso a emprego e qualificação profissional  funtrab.ms.gov.br Petrobras abre 715 vagas no Programa Jovem Aprendiz 2025: veja salário e benefícios  Seu Dinheiro Corpo de Bombeiros divulga novo resultado da seleção para bombeiros temporários  Midiamax Governo de MS oferece cursos de qualificação na área de economia criativa a partir de agosto  Portal Único ms.gov.br Dona de casa viaja 212 km para participar do Mutirão Todos em Ação – CGNotícias  campogrande.ms.gov.br Samyr cobra recuperação da sinalização da BR – 262, entre Corumbá e Miranda  Correio de Corumbá TRF3 e JFMS abrem a 9ª edição do projeto “Caminho do Acordo”, na Aldeia Cachoeirinha, em Miranda/MS  trf3.jus.br Sejusp entrega veículos para reforçar segurança em aldeias indígenas de Miranda  sejusp.ms.gov.br Polícia Civil inaugura a 52ª Sala Lilás do MS, em Aparecida do Taboado  pc.ms.gov.br"
Mundo Novo,12,"funtrab, mato, inaugura, hashioka, mundo","Hashioka acompanha agenda do Governo em Mundo Novo e visita beneficiada com emenda - O sul-mato-grossense Ponta Porã recebe etapa dos Jogos da Melhor Idade com disputas de bocha - Portal Único ms.gov.br Sesc Teatro Prosa oferece semana de arte e lazer gratuito em Campo Grande - capitalnews.com.br Hashioka participa das comemorações pelos 50 anos de Eldorado e inaugura Centro de eventos - O sul-mato-grossense Com alta de 11,7%, turismo cresce em Mato Grosso do Sul e impulsiona a economia regional - agenciadenoticias.ms.gov.br Funtrab e SENAI-MS abrem vagas para cursos gratuitos e fortalecem qualificação profissional no Estado - funtrab.ms.gov.br Confira a programação completa do Delas Day 2026 - funtrab.ms.gov.br Com Carnaval, Prefeitura e Câmara de Sidrolândia têm ‘semana de dois dias’ - Midiamax Polícia Civil inaugura a 51ª Sala Lilás em Mundo Novo - pc.ms.gov.br Polícia Civil inaugura a 53ª Sala Lilás do MS, em Japorã - sejusp.ms.gov.br SES e parceiros nacionais e internacionais se reúnem para discutir saúde nas fronteiras Brasil–Paraguai - saude.ms.gov.br Casa do Trabalhador de Três Lagoas promove Feirão de Vagas para inserção de jovens no mercado de trabalho - funtrab.ms.gov.br Hashioka acompanha agenda do Governo em Mundo Novo e visita beneficiada com emenda  O sul-mato-grossense Ponta Porã recebe etapa dos Jogos da Melhor Idade com disputas de bocha  Portal Único ms.gov.br Sesc Teatro Prosa oferece semana de arte e lazer gratuito em Campo Grande  capitalnews.com.br Hashioka participa das comemorações pelos 50 anos de Eldorado e inaugura Centro de eventos  O sul-mato-grossense Com alta de 11,7%, turismo cresce em Mato Grosso do Sul e impulsiona a economia regional  agenciadenoticias.ms.gov.br Funtrab e SENAI-MS abrem vagas para cursos gratuitos e fortalecem qualificação profissional no Estado  funtrab.ms.gov.br Confira a programação completa do Delas Day 2026  funtrab.ms.gov.br Com Carnaval, Prefeitura e Câmara de Sidrolândia têm ‘semana de dois dias’  Midiamax Polícia Civil inaugura a 51ª Sala Lilás em Mundo Novo  pc.ms.gov.br Polícia Civil inaugura a 53ª Sala Lilás do MS, em Japorã  sejusp.ms.gov.br SES e parceiros nacionais e internacionais se reúnem para discutir saúde nas fronteiras Brasil–Paraguai  saude.ms.gov.br Casa do Trabalhador de Três Lagoas promove Feirão de Vagas para inserção de jovens no mercado de trabalho  funtrab.ms.gov.br"
