municipio,qtd_noticias_encontradas,temas_frequentes,resumo_para_slide
Água Clara,15,"arapuanews, água, clara, funtrab, vagas","Três Lagoas leva cultura e protagonismo à Teia Nacional 2026, no Espírito Santo - ArapuaNews Agendão cultural: fim de semana tem feira criativa, teatro, astronomia e atrações culturais em MS - ArapuaNews Neno Razuk investe mais de R$ 5 milhões em emendas e transforma municípios de MS - Assembleia Legislativa de Mato Grosso do Sul - Festival América do Sul 2026 transforma Corumbá em território de encontros, arte e travessia - ArapuaNews Suzano entrega áreas de lazer e vivência no bairro Santo Antônio em Ribas do Rio Pardo (MS) - ArapuaNews Funtrab anuncia vagas em Campo Grande e Terenos com salários de até R$ 3 mil e benefícios - ArapuaNews Sindicato divulga vagas abertas em indústrias de celulose na região do Bolsão - Midiamax Suzano seleciona trabalhadores para preencher vagas de emprego em MS e BA - CPG Click Petróleo e Gás SESI-PA promove capacitação para professores e SENAI-MS oferece curso com bolsa de R$ 1 mil - Agência de Notícias da Indústria Funtrab anuncia vários cursos gratuitos de qualificação no Estado, veja como se inscrever - funtrab.ms.gov.br TCE-MS rejeita contas da prefeita de Água Clara por falhas fiscais - Midiamax Sentença condenatória é confirmada em 2º grau em ação do MPMS que investigou esquema de corrupção em Água Clara - MPMS Audiência Pública apresenta prioridades da LDO 2027 em Três Lagoas - ArapuaNews Procedimento vai monitorar TAC para regularizar Controladoria Municipal de Água Clara - Midiamax Conselho de Pastores confirma Marcha para Jesus em Água Clara com presença de David Quinlan - ArapuaNews Três Lagoas leva cultura e protagonismo à Teia Nacional 2026, no Espírito Santo  ArapuaNews Agendão cultural: fim de semana tem feira criativa, teatro, astronomia e atrações culturais em MS  ArapuaNews Neno Razuk investe mais de R$ 5 milhões em emendas e transforma municípios de MS  Assembleia Legislativa de Mato Grosso do Sul - Festival América do Sul 2026 transforma Corumbá em território de encontros, arte e travessia  ArapuaNews Suzano entrega áreas de lazer e vivência no bairro Santo Antônio em Ribas do Rio Pardo (MS)  ArapuaNews Funtrab anuncia vagas em Campo Grande e Terenos com salários de até R$ 3 mil e benefícios  ArapuaNews Sindicato divulga vagas abertas em indústrias de celulose na região do Bolsão  Midiamax Suzano seleciona trabalhadores para preencher vagas de emprego em MS e BA  CPG Click Petróleo e Gás SESI-PA promove capacitação para professores e SENAI-MS oferece curso com bolsa de R$ 1 mil  Agência de Notícias da Indústria Funtrab anuncia vários cursos gratuitos de qualificação no Estado, veja como se inscrever  funtrab.ms.gov.br TCE-MS rejeita contas da prefeita de Água Clara por falhas fiscais  Midiamax Sentença condenatória é confirmada em 2º grau em ação do MPMS que investigou esquema de corrupção em Água Clara  MPMS Audiência Pública apresenta prioridades da LDO 2027 em Três Lagoas  ArapuaNews Procedimento vai monitorar TAC para regularizar Controladoria Municipal de Água Clara  Midiamax Conselho de Pastores confirma Marcha para Jesus em Água Clara com presença de David Quinlan  ArapuaNews"
Amambai,15,"amambai, prefeitura, municipal, notícia, divulga","Governo licita obras de CEUs da Cultura em quatro cidades e fortalece acesso à arte, educação e cidadania - agenciadenoticias.ms.gov.br Ponta Porã recebe Festival Etnocultural dos Ervais - pontaporaemdia.com.br Agendão: fim de semana tem MS Fashion Week, Festa do Leitão no Rolete, exposições e muito teatro - Idest Coração Valente: com 16% de internos indígenas, presídio de Amambai fortalece cidadania e valores étnicos - agenciadenoticias.ms.gov.br Cine Sesi tem 2º maior público do ano em Bonito com 4,9 mil pessoas - Agência de Notícias da Indústria Notícia - Casa do Trabalhador de Amambai divulga 49 vagas de emprego nesta quinta-feira (19) - Prefeitura Municipal de Amambai Bioenergia: rodada de empregabilidade oferece mais de 630 vagas em 15 municípios de MS - Portal Único ms.gov.br Corpo de Bombeiros divulga novo resultado da seleção para bombeiros temporários - Midiamax Casa do Trabalhador disponibiliza 71 oportunidades de emprego nesta terça-feira em Amambai - A Gazeta News Notícia - Prefeitura de Amambai divulga vagas de emprego para esta segunda-feira (27) - Prefeitura Municipal de Amambai Amambai confirma convênio para construção de 50 novas moradias - Prefeitura Municipal de Amambai Prefeitura irá desembolsar R$ 1,9 milhão em indenizações para viabilizar Contorno Viário de Amambai - Midiamax Em Amambai, MPMS acompanha implementação de Programas de Integridade na gestão municipal - MPMS Prefeitura de Amambai MS abre processo seletivo para formador municipal - Folha Dirigida Notícia - Amambai leva desafios da drenagem urbana ao debate estadual - Prefeitura Municipal de Amambai Governo licita obras de CEUs da Cultura em quatro cidades e fortalece acesso à arte, educação e cidadania  agenciadenoticias.ms.gov.br Ponta Porã recebe Festival Etnocultural dos Ervais  pontaporaemdia.com.br Agendão: fim de semana tem MS Fashion Week, Festa do Leitão no Rolete, exposições e muito teatro  Idest Coração Valente: com 16% de internos indígenas, presídio de Amambai fortalece cidadania e valores étnicos  agenciadenoticias.ms.gov.br Cine Sesi tem 2º maior público do ano em Bonito com 4,9 mil pessoas  Agência de Notícias da Indústria Notícia - Casa do Trabalhador de Amambai divulga 49 vagas de emprego nesta quinta-feira (19)  Prefeitura Municipal de Amambai Bioenergia: rodada de empregabilidade oferece mais de 630 vagas em 15 municípios de MS  Portal Único ms.gov.br Corpo de Bombeiros divulga novo resultado da seleção para bombeiros temporários  Midiamax Casa do Trabalhador disponibiliza 71 oportunidades de emprego nesta terça-feira em Amambai  A Gazeta News Notícia - Prefeitura de Amambai divulga vagas de emprego para esta segunda-feira (27)  Prefeitura Municipal de Amambai Amambai confirma convênio para construção de 50 novas moradias  Prefeitura Municipal de Amambai Prefeitura irá desembolsar R$ 1,9 milhão em indenizações para viabilizar Contorno Viário de Amambai  Midiamax Em Amambai, MPMS acompanha implementação de Programas de Integridade na gestão municipal  MPMS Prefeitura de Amambai MS abre processo seletivo para formador municipal  Folha Dirigida Notícia - Amambai leva desafios da drenagem urbana ao debate estadual  Prefeitura Municipal de Amambai"
Anastácio,15,"pantaneiro, aquidauana, anastácio, bombeiros, maior","Aquidauana e Anastácio registram o maior volume de chuva do estado - O Pantaneiro Cine Sesi tem 2º maior público do ano em Bonito com 4,9 mil pessoas - Agência de Notícias da Indústria Cenário positivo de negócios e grandes investimentos públicos preparam MS para mudanças tributárias - ArapuaNews Aquidauana realiza 10ª edição da Paixão de Cristo com teatro ao ar livre e show musical - O Pantaneiro UEMS lidera cooperação com a University of Birmingham em ação no Pantanal - O Pantaneiro Corpo de Bombeiros divulga novo resultado da seleção para bombeiros temporários - Midiamax Senar/MS tem vaga para quem quer crescer no agro e mudar de vida no campo - A Crítica de Campo Grande Qualificação beneficia população de MS com melhores oportunidades de emprego - O Pantaneiro Processo seletivo dos Bombeiros MS abre 230 vagas em 30 cidades - JC Concursos IFMS oferece cursos técnicos gratuitos; saiba como participar - Correio do Estado Café da manhã reúne lideranças religiosas durante comemorações dos 61 anos de Anastácio - Aquidauana Notícias Justiça atende pedido do MPMS e anula processo seletivo irregular em Anastácio - MPMS Pacote de R$ 10 milhões prevê de ambulâncias no interior de MS - Midiamax Audiência pública debate demarcação de áreas da União em Aquidauana e Anastácio - O Pantaneiro Polícia Civil inaugura a 52ª Sala Lilás do MS em Aparecida do Taboado - Costa Leste News Aquidauana e Anastácio registram o maior volume de chuva do estado  O Pantaneiro Cine Sesi tem 2º maior público do ano em Bonito com 4,9 mil pessoas  Agência de Notícias da Indústria Cenário positivo de negócios e grandes investimentos públicos preparam MS para mudanças tributárias  ArapuaNews Aquidauana realiza 10ª edição da Paixão de Cristo com teatro ao ar livre e show musical  O Pantaneiro UEMS lidera cooperação com a University of Birmingham em ação no Pantanal  O Pantaneiro Corpo de Bombeiros divulga novo resultado da seleção para bombeiros temporários  Midiamax Senar/MS tem vaga para quem quer crescer no agro e mudar de vida no campo  A Crítica de Campo Grande Qualificação beneficia população de MS com melhores oportunidades de emprego  O Pantaneiro Processo seletivo dos Bombeiros MS abre 230 vagas em 30 cidades  JC Concursos IFMS oferece cursos técnicos gratuitos; saiba como participar  Correio do Estado Café da manhã reúne lideranças religiosas durante comemorações dos 61 anos de Anastácio  Aquidauana Notícias Justiça atende pedido do MPMS e anula processo seletivo irregular em Anastácio  MPMS Pacote de R$ 10 milhões prevê de ambulâncias no interior de MS  Midiamax Audiência pública debate demarcação de áreas da União em Aquidauana e Anastácio  O Pantaneiro Polícia Civil inaugura a 52ª Sala Lilás do MS em Aparecida do Taboado  Costa Leste News"
Angélica,9,"prefeitura, novos, campo, grande, após","Cine Sesi tem 2º maior público do ano em Bonito com 4,9 mil pessoas - Agência de Notícias da Indústria Conheça os perfis e atribuições dos novos secretários e diretores da Prefeitura de Campo Grande - campogrande.ms.gov.br Galeria: Casa do Trabalhador de Ribas do Rio Pardo recebe as orientações - funtrab.ms.gov.br Adecoagro inicia Programa Jovens Talentos Aprendizes com Deficiência - Iviagora Previdência de Angélica que investiu no Master é autônoma, diz prefeitura após operação - Midiamax Polícia Civil inaugura a 53ª Sala Lilás do MS, em Japorã - sejusp.ms.gov.br Prefeitura empossa novos membros Conselho Municipal dos Direitos da Mulher - Município de Corumbá Moradores de assentamentos protestam contra transferência de escola da zona rural de Goiás - Jornal Opção Ivinhema decreta calamidade após chuvas de 120 mm - Campo Grande News Cine Sesi tem 2º maior público do ano em Bonito com 4,9 mil pessoas  Agência de Notícias da Indústria Conheça os perfis e atribuições dos novos secretários e diretores da Prefeitura de Campo Grande  campogrande.ms.gov.br Galeria: Casa do Trabalhador de Ribas do Rio Pardo recebe as orientações  funtrab.ms.gov.br Adecoagro inicia Programa Jovens Talentos Aprendizes com Deficiência  Iviagora Previdência de Angélica que investiu no Master é autônoma, diz prefeitura após operação  Midiamax Polícia Civil inaugura a 53ª Sala Lilás do MS, em Japorã  sejusp.ms.gov.br Prefeitura empossa novos membros Conselho Municipal dos Direitos da Mulher  Município de Corumbá Moradores de assentamentos protestam contra transferência de escola da zona rural de Goiás  Jornal Opção Ivinhema decreta calamidade após chuvas de 120 mm  Campo Grande News"
Aparecida do Taboado,15,"aparecida, taboado, vagas, notícias, sesi","Taboadão 2026 reforça tradição e impulsiona economia em Aparecida do Taboado - Notícias do Cerrado Neno Razuk investe mais de R$ 5 milhões em emendas e transforma municípios de MS - Assembleia Legislativa de Mato Grosso do Sul - Com apoio do Governo, Taboadão 2026 movimenta turismo, cultura e economia da região - agenciadenoticias.ms.gov.br Estudantes do SESI apresentam inovações no maior evento científico da América Latina - Agência de Notícias da Indústria Colônia de Férias da FIRJAN, matrículas no SESI-MS e museu de ciência 4.0 na BA - Agência de Notícias da Indústria Senai MS: 2 mil vagas em cursos técnicos com bolsa de R$ 300; inscreva-se - Campo Grande News SENAI oferece 60 vagas em cursos técnicos gratuitos em Aparecida do Taboado com auxílio mensal - Costa Leste News Bioenergia: rodada de empregabilidade oferece mais de 630 vagas em 15 municípios de MS - agenciadenoticias.ms.gov.br Setor de bioenergia oferece 630 vagas de emprego em 15 cidades de MS - - Folha de Campo Grande - Escola Sesi lança edital com 42 vagas gratuitas no ensino médio em MS - Correio de Corumbá Vice-governador Barbosinha visita Aparecida do Taboado e vereadores solicitam reforço na segurança pública - Costa Leste News Investimentos: Coronel David cumpre agenda com Rie... - Assembleia Legislativa de Mato Grosso do Sul - Contrato de iluminação irá custar R$ 1,16 milhão para Aparecida do Taboado - Midiamax Pacote de R$ 10 milhões prevê de ambulâncias no interior de MS - Midiamax Aparecida do Taboado pagará R$ 1 milhão para instalar 649 lâmpadas de LED - Midiamax Taboadão 2026 reforça tradição e impulsiona economia em Aparecida do Taboado  Notícias do Cerrado Neno Razuk investe mais de R$ 5 milhões em emendas e transforma municípios de MS  Assembleia Legislativa de Mato Grosso do Sul - Com apoio do Governo, Taboadão 2026 movimenta turismo, cultura e economia da região  agenciadenoticias.ms.gov.br Estudantes do SESI apresentam inovações no maior evento científico da América Latina  Agência de Notícias da Indústria Colônia de Férias da FIRJAN, matrículas no SESI-MS e museu de ciência 4.0 na BA  Agência de Notícias da Indústria Senai MS: 2 mil vagas em cursos técnicos com bolsa de R$ 300; inscreva-se  Campo Grande News SENAI oferece 60 vagas em cursos técnicos gratuitos em Aparecida do Taboado com auxílio mensal  Costa Leste News Bioenergia: rodada de empregabilidade oferece mais de 630 vagas em 15 municípios de MS  agenciadenoticias.ms.gov.br Setor de bioenergia oferece 630 vagas de emprego em 15 cidades de MS -  Folha de Campo Grande - Escola Sesi lança edital com 42 vagas gratuitas no ensino médio em MS  Correio de Corumbá Vice-governador Barbosinha visita Aparecida do Taboado e vereadores solicitam reforço na segurança pública  Costa Leste News Investimentos: Coronel David cumpre agenda com Rie...  Assembleia Legislativa de Mato Grosso do Sul - Contrato de iluminação irá custar R$ 1,16 milhão para Aparecida do Taboado  Midiamax Pacote de R$ 10 milhões prevê de ambulâncias no interior de MS  Midiamax Aparecida do Taboado pagará R$ 1 milhão para instalar 649 lâmpadas de LED  Midiamax"
Aral Moreira,12,"ifms, inscrições, news, cursos, gratuitos","Com investimento do FIC, Grupo UBU chega com teatro em nove cidades na região sul-fronteira de MS - fundacaodecultura.ms.gov.br Encontro de carros antigos transforma Praça São José em ponto de cultura e lazer em Amambai - A Gazeta News Últimos dias de inscrições para qualificação profissional a distância no IFMS - Correio de Corumbá IFMS: Inscrições abertas para cursos gratuitos a distância em 2026 - Campo Grande News Quer se qualificar sem sair de casa? Cursos EAD gratuitos do IFMS para assistente, operador e vendedor têm inscrições abertas e exigem apenas CPF - CPG Click Petróleo e Gás Com vagas ilimitadas, IFMS abre inscrições para Curso de Operador de Computador 100% EAD - PEBSP IFMS oferece cursos técnicos gratuitos; saiba como participar - Correio do Estado Polícia Civil inaugura a 53ª Sala Lilás do MS, em Japorã - sejusp.ms.gov.br Ponta Porã sedia fase dos Jogos Abertos Regionais de MS - Prefeitura Municipal de Ponta Porã Vereador de Aral Moreira se livra de condenação de R$ 506 mil por ‘falha’ de 13 anos atrás - Midiamax Retomada de obras em Aral Moreira: MPMS acompanha processo - Campo Grande News Ação conjunta de vacinação fortalece integração entre Brasil e Paraguai na fronteira - agenciadenoticias.ms.gov.br Com investimento do FIC, Grupo UBU chega com teatro em nove cidades na região sul-fronteira de MS  fundacaodecultura.ms.gov.br Encontro de carros antigos transforma Praça São José em ponto de cultura e lazer em Amambai  A Gazeta News Últimos dias de inscrições para qualificação profissional a distância no IFMS  Correio de Corumbá IFMS: Inscrições abertas para cursos gratuitos a distância em 2026  Campo Grande News Quer se qualificar sem sair de casa? Cursos EAD gratuitos do IFMS para assistente, operador e vendedor têm inscrições abertas e exigem apenas CPF  CPG Click Petróleo e Gás Com vagas ilimitadas, IFMS abre inscrições para Curso de Operador de Computador 100% EAD  PEBSP IFMS oferece cursos técnicos gratuitos; saiba como participar  Correio do Estado Polícia Civil inaugura a 53ª Sala Lilás do MS, em Japorã  sejusp.ms.gov.br Ponta Porã sedia fase dos Jogos Abertos Regionais de MS  Prefeitura Municipal de Ponta Porã Vereador de Aral Moreira se livra de condenação de R$ 506 mil por ‘falha’ de 13 anos atrás  Midiamax Retomada de obras em Aral Moreira: MPMS acompanha processo  Campo Grande News Ação conjunta de vacinação fortalece integração entre Brasil e Paraguai na fronteira  agenciadenoticias.ms.gov.br"
Bataguassu,15,"bataguassu, processo, seletivo, concursos, prefeitura","Centro de Esporte e Cultura oferece atividades gratuitas em Campo Grande - Campo Grande News Festival de Dança Coreografada da Melhor Idade define campeões - fundesporte.ms.gov.br Agendão cultural: fim de semana tem shows nacionais, feiras criativas, teatro e festas populares em MS - agenciadenoticias.ms.gov.br Turismo rural, pesca e eventos no caminho do Pontal do Paranapanema - www.gov.br Agendão: fim de semana tem MS Fashion Week, Festa do Leitão no Rolete, exposições e muito teatro - Idest GIRO FUNTRAB DE NOTÍCIAS – 19/07/2025 a 29/07/2025 - funtrab.ms.gov.br Galeria: Casa do Trabalhador de Ribas do Rio Pardo recebe as orientações - funtrab.ms.gov.br Corpo de Bombeiros divulga novo resultado da seleção para bombeiros temporários - Midiamax Processo seletivo dos Bombeiros MS abre 230 vagas em 30 cidades - JC Concursos SAD - SEJUSP- CBMMS divulga Processo Seletivo com 230 vagas - PCI Concursos Prefeitura firma parceria com Polícia Militar e Governo do Estado para implementar o PROMUSE - prefeitura municipal de bataguassu (ms) MAIS CONFORTO E DIGNIDADE: Rede Municipal de Ensino recebe mais de 21 mil peças de uniformes escolares em Bataguassu - Notícias em Rede Prefeitura de Bataguassu MS abre processo seletivo para Educação em 2026 - Folha Dirigida Prefeitura de Bataguassu - MS abre vagas e cadastro de reserva em processo seletivo simplificado - PCI Concursos Sem concursos, prefeita de Bataguassu é proibida de nomear comissionados - Midiamax Centro de Esporte e Cultura oferece atividades gratuitas em Campo Grande  Campo Grande News Festival de Dança Coreografada da Melhor Idade define campeões  fundesporte.ms.gov.br Agendão cultural: fim de semana tem shows nacionais, feiras criativas, teatro e festas populares em MS  agenciadenoticias.ms.gov.br Turismo rural, pesca e eventos no caminho do Pontal do Paranapanema  www.gov.br Agendão: fim de semana tem MS Fashion Week, Festa do Leitão no Rolete, exposições e muito teatro  Idest GIRO FUNTRAB DE NOTÍCIAS – 19/07/2025 a 29/07/2025  funtrab.ms.gov.br Galeria: Casa do Trabalhador de Ribas do Rio Pardo recebe as orientações  funtrab.ms.gov.br Corpo de Bombeiros divulga novo resultado da seleção para bombeiros temporários  Midiamax Processo seletivo dos Bombeiros MS abre 230 vagas em 30 cidades  JC Concursos SAD - SEJUSP- CBMMS divulga Processo Seletivo com 230 vagas  PCI Concursos Prefeitura firma parceria com Polícia Militar e Governo do Estado para implementar o PROMUSE  prefeitura municipal de bataguassu (ms) MAIS CONFORTO E DIGNIDADE: Rede Municipal de Ensino recebe mais de 21 mil peças de uniformes escolares em Bataguassu  Notícias em Rede Prefeitura de Bataguassu MS abre processo seletivo para Educação em 2026  Folha Dirigida Prefeitura de Bataguassu - MS abre vagas e cadastro de reserva em processo seletivo simplificado  PCI Concursos Sem concursos, prefeita de Bataguassu é proibida de nomear comissionados  Midiamax"
Batayporã,11,"funtrab, abre, vagas, prefeitura, batayporã",Festival de Dança Coreografada da Melhor Idade define campeões - fundesporte.ms.gov.br Funtrab e Biosul anunciam 2ª Rodada de Empregabilidade do Setor de Bioenergia com mais de 630 vagas em 15 municípios de MS - funtrab.ms.gov.br Inscrições abertas para o curso de Vendedor - funtrab.ms.gov.br Senai abre inscrições para cursos gratuitos em Dourados e Ponta Porã - funtrab.ms.gov.br Confira a programação completa do Delas Day 2026 - funtrab.ms.gov.br Funtrab abre 20 vagas para curso de Manipulação de Alimentos - funtrab.ms.gov.br Hashioka visita prefeito Germino e reforça parceri... - Assembleia Legislativa de Mato Grosso do Sul - Prefeitura de Batayporã MS abre processo seletivo com 4 vagas - Folha Dirigida Prefeitura de Batayporã - MS abre processo seletivo para profissionais alfabetizados - PCI Concursos Prefeitura de Batayporã MS abre processo seletivo com 2 vagas - Folha Dirigida Prefeitura de Batayporã - MS abre processo seletivo para professor de ensino fundamental - PCI Concursos Festival de Dança Coreografada da Melhor Idade define campeões  fundesporte.ms.gov.br Funtrab e Biosul anunciam 2ª Rodada de Empregabilidade do Setor de Bioenergia com mais de 630 vagas em 15 municípios de MS  funtrab.ms.gov.br Inscrições abertas para o curso de Vendedor  funtrab.ms.gov.br Senai abre inscrições para cursos gratuitos em Dourados e Ponta Porã  funtrab.ms.gov.br Confira a programação completa do Delas Day 2026  funtrab.ms.gov.br Funtrab abre 20 vagas para curso de Manipulação de Alimentos  funtrab.ms.gov.br Hashioka visita prefeito Germino e reforça parceri...  Assembleia Legislativa de Mato Grosso do Sul - Prefeitura de Batayporã MS abre processo seletivo com 4 vagas  Folha Dirigida Prefeitura de Batayporã - MS abre processo seletivo para profissionais alfabetizados  PCI Concursos Prefeitura de Batayporã MS abre processo seletivo com 2 vagas  Folha Dirigida Prefeitura de Batayporã - MS abre processo seletivo para professor de ensino fundamental  PCI Concursos
Bela Vista,15,"bela, vista, mpms, notícias, midiamax","Conheça os espetáculos participantes da Mostra Internacional de Teatro de São Paulo - Guia Folha Credencial Sesc facilita o acesso a lazer, educação, cultura, saúde e turismo para trabalhadores do comércio - agorams.com.br Cidade do MS se consolida como portal do Mercosul - O Antagonista Virada Cultural 2025 de SP: veja programação completa do evento, que completa 20 anos - G1 Cine Sesi tem 2º maior público do ano em Bonito com 4,9 mil pessoas - Agência de Notícias da Indústria MPMS participa de reunião técnica para ampliar oportunidades a jovens em situação de vulnerabilidade em Bela Vista - MPMS GIRO FUNTRAB DE NOTÍCIAS – 03/06/2025 a 16/06/2025 - funtrab.ms.gov.br Corpo de Bombeiros divulga novo resultado da seleção para bombeiros temporários - Midiamax Procurando estágio? IEL tem mais de 1,7 mil vagas pelo Brasil, com bolsa de até R$ 2 mil - Agência de Notícias da Indústria Oferta inédita no IFMS abre curso de informática para mulheres - Correio de Corumbá Justiça determina venda de parte do Asilo de Bela Vista para quitar dívidas trabalhistas - Midiamax MPMS solicita transferência imediata da gestão de Instituição para Idosos à Prefeitura de Bela Vista - Fátima em Dia Proteção à infância: MPMS recomenda restrição à divulgação de imagens de crianças por órgãos públicos em Bela Vista - MPMS Após sentença, prefeitura cobra ata para agilizar transferência de idosos em Bela Vista - Midiamax Descarte irregular de resíduos de saúde: MP investiga vereador em Bela Vista - Campo Grande News Conheça os espetáculos participantes da Mostra Internacional de Teatro de São Paulo  Guia Folha Credencial Sesc facilita o acesso a lazer, educação, cultura, saúde e turismo para trabalhadores do comércio  agorams.com.br Cidade do MS se consolida como portal do Mercosul  O Antagonista Virada Cultural 2025 de SP: veja programação completa do evento, que completa 20 anos  G1 Cine Sesi tem 2º maior público do ano em Bonito com 4,9 mil pessoas  Agência de Notícias da Indústria MPMS participa de reunião técnica para ampliar oportunidades a jovens em situação de vulnerabilidade em Bela Vista  MPMS GIRO FUNTRAB DE NOTÍCIAS – 03/06/2025 a 16/06/2025  funtrab.ms.gov.br Corpo de Bombeiros divulga novo resultado da seleção para bombeiros temporários  Midiamax Procurando estágio? IEL tem mais de 1,7 mil vagas pelo Brasil, com bolsa de até R$ 2 mil  Agência de Notícias da Indústria Oferta inédita no IFMS abre curso de informática para mulheres  Correio de Corumbá Justiça determina venda de parte do Asilo de Bela Vista para quitar dívidas trabalhistas  Midiamax MPMS solicita transferência imediata da gestão de Instituição para Idosos à Prefeitura de Bela Vista  Fátima em Dia Proteção à infância: MPMS recomenda restrição à divulgação de imagens de crianças por órgãos públicos em Bela Vista  MPMS Após sentença, prefeitura cobra ata para agilizar transferência de idosos em Bela Vista  Midiamax Descarte irregular de resíduos de saúde: MP investiga vereador em Bela Vista  Campo Grande News"
