municipio,qtd_noticias_encontradas,temas_frequentes,resumo_para_slide
Jardim,5,"jardim, turismo, pantanal, bonito, atraem","MS Cidadão fortalece gestão municipalista do Governo do Estado e chega à 3ª edição em Jardim - agenciadenoticias.ms.gov.br Com biodiversidade única, turismo e conservação no Pantanal e em Bonito atraem olhares do mundo todo - www.ms.gov.br IPÊ – 1º Encontro de Arte e Cultura LGBTQIAPN+ celebra diversidade cultural em Jardim – FCMS - fundacaodecultura.ms.gov.br Homem é baleado em frente à oficina mecânica no Jardim Nashville - Primeira Página Turismo do Pantanal e Bonito (MS) atraem olhares do mundo - iG Turismo MS Cidadão fortalece gestão municipalista do Governo do Estado e chega à 3ª edição em Jardim  agenciadenoticias.ms.gov.br Com biodiversidade única, turismo e conservação no Pantanal e em Bonito atraem olhares do mundo todo  www.ms.gov.br IPÊ – 1º Encontro de Arte e Cultura LGBTQIAPN+ celebra diversidade cultural em Jardim – FCMS  fundacaodecultura.ms.gov.br Homem é baleado em frente à oficina mecânica no Jardim Nashville  Primeira Página Turismo do Pantanal e Bonito (MS) atraem olhares do mundo  iG Turismo"
Ladário,5,"corumbá, turismo, ladário, feapan, cultura","27ª Feapan impulsiona negócios, turismo e cultura no Pantanal com apoio da Prefeitura de Corumbá - Município de Corumbá Fórum Estadual dos Pontos de Cultura acontece em Corumbá, fortalecendo e democratizando tradições - agenciadenoticias.ms.gov.br Curso forma Condutores Pantaneiros e abre oportunidades no turismo para jovens de Corumbá e Ladário - turismo.ms.gov.br Ladário: Carnaval Antecipado com Shows Nacionais em Fevereiro - Campo Grande News Feapan em Corumbá/Ladário vai ter experiência inédita para visitantes conhecerem o Pantanal - Diário MS News 27ª Feapan impulsiona negócios, turismo e cultura no Pantanal com apoio da Prefeitura de Corumbá  Município de Corumbá Fórum Estadual dos Pontos de Cultura acontece em Corumbá, fortalecendo e democratizando tradições  agenciadenoticias.ms.gov.br Curso forma Condutores Pantaneiros e abre oportunidades no turismo para jovens de Corumbá e Ladário  turismo.ms.gov.br Ladário: Carnaval Antecipado com Shows Nacionais em Fevereiro  Campo Grande News Feapan em Corumbá/Ladário vai ter experiência inédita para visitantes conhecerem o Pantanal  Diário MS News"
Miranda,5,"águas, miranda, prefeitura, municipal, bonito",Esporte inclusivo e de excelência: MS renova planejamento até 2035 para fortalecer modalidades - www.ms.gov.br Riedel oficializa trocas no secretariado para eleições - Campo Grande News Folia de Reis de Águas do Miranda mantém viva há mais de meio século a fé e a ancestralidade - fundacaodecultura.ms.gov.br Distrito de Águas do Miranda: Governo dá início à recuperação da ponte na MS-345 - agenciadenoticias.ms.gov.br Inscrições abertas para o 4º Torneio de Pesca Esportiva no Águas do Miranda - Prefeitura Municipal de Bonito - Prefeitura Municipal de Bonito - MS Esporte inclusivo e de excelência: MS renova planejamento até 2035 para fortalecer modalidades  www.ms.gov.br Riedel oficializa trocas no secretariado para eleições  Campo Grande News Folia de Reis de Águas do Miranda mantém viva há mais de meio século a fé e a ancestralidade  fundacaodecultura.ms.gov.br Distrito de Águas do Miranda: Governo dá início à recuperação da ponte na MS-345  agenciadenoticias.ms.gov.br Inscrições abertas para o 4º Torneio de Pesca Esportiva no Águas do Miranda - Prefeitura Municipal de Bonito  Prefeitura Municipal de Bonito - MS
Mundo Novo,5,"mato, grosso, livro, organiza, construção",1977–2027: o livro que organiza a construção da imagem de Mato Grosso do Sul - msemfoco.com.br Nova rota aérea para MG amplia a integração de MS com grandes centros e fortalece logística local - agenciadenoticias.ms.gov.br Corpo de Policial Rodoviário que atuou em Marechal Rondon é encontrado no Rio Paraná e amigo continua desaparecido - Educadora AM 630 Mato Grosso do Sul investe R$ 250 milhões em aeroportos neste ano - Brasilturis Com disputas de futsal e voleibol Três Lagoas sedia a 3ª divisão dos Jogos Escolares da Juventude de MS - fundesporte.ms.gov.br 1977–2027: o livro que organiza a construção da imagem de Mato Grosso do Sul  msemfoco.com.br Nova rota aérea para MG amplia a integração de MS com grandes centros e fortalece logística local  agenciadenoticias.ms.gov.br Corpo de Policial Rodoviário que atuou em Marechal Rondon é encontrado no Rio Paraná e amigo continua desaparecido  Educadora AM 630 Mato Grosso do Sul investe R$ 250 milhões em aeroportos neste ano  Brasilturis Com disputas de futsal e voleibol Três Lagoas sedia a 3ª divisão dos Jogos Escolares da Juventude de MS  fundesporte.ms.gov.br
Naviraí,5,"naviraí, mato, grosso, garante, milhões",Naviraí garante R$ 53 milhões em investimentos em infraestrutura em parceria com o Governo do Estado - navirai.ms.gov.br Hashioka participa de evento de prestação de contas e assinatura de convênios em Naviraí - Assembleia Legislativa de Mato Grosso do Sul - Sebrae realiza Startup Day simultaneamente em 12 cidades de Mato Grosso do Sul - Diário Corumbaense Naviraí-2º CarnaKids promoveu uma tarde de lazer e alegria com as famílias na Seleta - TáNaMídia Última etapa regional dos JAMS em Naviraí define classificados para a fase final - fundesporte.ms.gov.br Naviraí garante R$ 53 milhões em investimentos em infraestrutura em parceria com o Governo do Estado  navirai.ms.gov.br Hashioka participa de evento de prestação de contas e assinatura de convênios em Naviraí  Assembleia Legislativa de Mato Grosso do Sul - Sebrae realiza Startup Day simultaneamente em 12 cidades de Mato Grosso do Sul  Diário Corumbaense Naviraí-2º CarnaKids promoveu uma tarde de lazer e alegria com as famílias na Seleta  TáNaMídia Última etapa regional dos JAMS em Naviraí define classificados para a fase final  fundesporte.ms.gov.br
Nova Andradina,5,"nova, andradina, municipal, uems, mato","36ª Corrida do Trabalhador em Nova Andradina está com inscrições abertas - Prefeitura Municipal de Nova Andradina Plano de Desenvolvimento Municipal vai consolidar Nova Andradina como polo regional e acelerar a economia - ms.agenciasebrae.com.br UEMS de Nova Andradina recebe “Startup Day” do SEBRAE e reúne comunidade acadêmica e empreendedores - uems.br Hashioka homenageia dois artesãos com Medalha Conc... - Assembleia Legislativa de Mato Grosso do Sul - Jogos Abertos de Mato Grosso do Sul terão seis etapas regionais em 2026, entre abril e setembro - agenciadenoticias.ms.gov.br 36ª Corrida do Trabalhador em Nova Andradina está com inscrições abertas  Prefeitura Municipal de Nova Andradina Plano de Desenvolvimento Municipal vai consolidar Nova Andradina como polo regional e acelerar a economia  ms.agenciasebrae.com.br UEMS de Nova Andradina recebe “Startup Day” do SEBRAE e reúne comunidade acadêmica e empreendedores  uems.br Hashioka homenageia dois artesãos com Medalha Conc...  Assembleia Legislativa de Mato Grosso do Sul - Jogos Abertos de Mato Grosso do Sul terão seis etapas regionais em 2026, entre abril e setembro  agenciadenoticias.ms.gov.br"
Paranaíba,5,"paranaíba, contra, acesso, menores, carnaíba","Acesso de Menores ao Carnaíba 2026: O que você precisa saber - Prefeitura Municipal de Paranaíba-MS Polícia Civil cumpre, em Paranaíba, mandado de prisão preventiva contra homem investigado por importunação sexual contra 4 vítimas - pc.ms.gov.br Carnaval 2026: veja onde curtir a folia neste domingo em MS - G1 Nova usina em Paranaíba reforça papel estratégico da transição energética e da sustentabilidade em MS - agenciadenoticias.ms.gov.br VÍDEO: ‘Virado no Jiraya’, prefeito de Paranaíba planta bananeira em palco com DJ - Midiamax Acesso de Menores ao Carnaíba 2026: O que você precisa saber  Prefeitura Municipal de Paranaíba-MS Polícia Civil cumpre, em Paranaíba, mandado de prisão preventiva contra homem investigado por importunação sexual contra 4 vítimas  pc.ms.gov.br Carnaval 2026: veja onde curtir a folia neste domingo em MS  G1 Nova usina em Paranaíba reforça papel estratégico da transição energética e da sustentabilidade em MS  agenciadenoticias.ms.gov.br VÍDEO: ‘Virado no Jiraya’, prefeito de Paranaíba planta bananeira em palco com DJ  Midiamax"
Paranhos,5,"incêndio, mulher, aldeia, feminicídio, indígena","Incêndio mata mulher em aldeia e polícia investiga 7º feminicídio do ano em MS - G1 Mulher indígena Kaiowá morre após incêndio em casa e caso é investigado como feminicídio em Paranhos (MS) - Revista Afirmativa Agendão: fim de semana tem Mostra Cerrado Abierto, Festival do Japão, cinema e festa de tradições pantaneiras - www.ms.gov.br Primeira turma do Empretec Indígena de 2025 é formada na Aldeia Paraguassu, em Paranhos - ms.agenciasebrae.com.br Dupla sertaneja nacional fará dois shows gratuitos em MS - Primeira Página Incêndio mata mulher em aldeia e polícia investiga 7º feminicídio do ano em MS  G1 Mulher indígena Kaiowá morre após incêndio em casa e caso é investigado como feminicídio em Paranhos (MS)  Revista Afirmativa Agendão: fim de semana tem Mostra Cerrado Abierto, Festival do Japão, cinema e festa de tradições pantaneiras  www.ms.gov.br Primeira turma do Empretec Indígena de 2025 é formada na Aldeia Paraguassu, em Paranhos  ms.agenciasebrae.com.br Dupla sertaneja nacional fará dois shows gratuitos em MS  Primeira Página"
Porto Murtinho,5,"porto, murtinho, turismo, rota, bioceânica","Porto Murtinho avança em obras de saúde, infraestrutura e turismo, de olho na consolidação da Rota Bioceânica - agenciadenoticias.ms.gov.br Porto Murtinho lança Plano de Desenvolvimento Municipal com foco em oportunidades ligadas à Rota Bioceânica - ms.agenciasebrae.com.br TRF3 e JFMS realizam abertura solene do JEF Itinerante em Porto Murtinho/MS - trf3.jus.br Nova orla do Rio Paraguai impulsiona turismo em Porto Murtinho - Campo Grande News Jogos Abertos de Mato Grosso do Sul terão seis etapas regionais em 2026, entre abril e setembro - www.ms.gov.br Porto Murtinho avança em obras de saúde, infraestrutura e turismo, de olho na consolidação da Rota Bioceânica  agenciadenoticias.ms.gov.br Porto Murtinho lança Plano de Desenvolvimento Municipal com foco em oportunidades ligadas à Rota Bioceânica  ms.agenciasebrae.com.br TRF3 e JFMS realizam abertura solene do JEF Itinerante em Porto Murtinho/MS  trf3.jus.br Nova orla do Rio Paraguai impulsiona turismo em Porto Murtinho  Campo Grande News Jogos Abertos de Mato Grosso do Sul terão seis etapas regionais em 2026, entre abril e setembro  www.ms.gov.br"
Ribas do Rio Pardo,5,"ribas, livro, robótica, sesi, atrai","Do livro à robótica: Sesi atrai mão de obra e integra comunidade em Ribas do Rio Pardo - agorams.com.br Manutenção em Indústria da celulose leva rede hoteleira ao limite em 3Lagoas, Ribas e Inocência - aguaclarams.com.br Fórum das Juventudes reúne jovens de sete municípios e consolida 40 propostas para o Plano Estadual - www.ms.gov.br XI Copa Pelezinho de Futsal inicia sábado em MS - Campo Grande News Com expectativa de 35 mil pessoas, show do Guns N' Roses terá operação diferenciada no trânsito da BR-262 - G1 Do livro à robótica: Sesi atrai mão de obra e integra comunidade em Ribas do Rio Pardo  agorams.com.br Manutenção em Indústria da celulose leva rede hoteleira ao limite em 3Lagoas, Ribas e Inocência  aguaclarams.com.br Fórum das Juventudes reúne jovens de sete municípios e consolida 40 propostas para o Plano Estadual  www.ms.gov.br XI Copa Pelezinho de Futsal inicia sábado em MS  Campo Grande News Com expectativa de 35 mil pessoas, show do Guns N' Roses terá operação diferenciada no trânsito da BR-262  G1"
Sete Quedas,5,"sete, quedas, água, umuarama, castela","Destino do MS abriga sete quedas d'água cristalinas e atrai visitantes para o interior do estado - Gazeta de São Paulo Após chuvas intensas, volume de água em balneário aumenta e gera alerta para turismo no Carnaval em Rio Verde - Midiamax Ciclismo de Umuarama conquista seis pódios em duas competições - Prefeitura de Umuarama 'Wakeboard na lama': Ana Castela se despede de MS com brincadeira em família - G1 Pai de Ana Castela adota cachorra que o seguiu em Sete Quedas (MS) - band.com.br Destino do MS abriga sete quedas d'água cristalinas e atrai visitantes para o interior do estado  Gazeta de São Paulo Após chuvas intensas, volume de água em balneário aumenta e gera alerta para turismo no Carnaval em Rio Verde  Midiamax Ciclismo de Umuarama conquista seis pódios em duas competições  Prefeitura de Umuarama 'Wakeboard na lama': Ana Castela se despede de MS com brincadeira em família  G1 Pai de Ana Castela adota cachorra que o seguiu em Sete Quedas (MS)  band.com.br"
Sonora,5,"cidades, carreta, cultura, interior, sonora","Espetáculo em Sonora abre programação que leva teatro, dança e circo a diversas cidades de MS - www.ms.gov.br Carreta-palco rodará 3.500 quilômetros levando arte e cultura a 40 cidades do interior de Mato Grosso do Sul - agenciadenoticias.ms.gov.br Carreta-palco rodará 3.500 km levando arte e cultura a cidades do interior do Estado - fundacaodecultura.ms.gov.br Circula Cultura MS 2026 começa por Sonora e leva espetáculos ao interior - A Crítica de Campo Grande Carreta percorre 40 cidades de MS com apresentações gratuitas de teatro, dança e circo - G1 Espetáculo em Sonora abre programação que leva teatro, dança e circo a diversas cidades de MS  www.ms.gov.br Carreta-palco rodará 3.500 quilômetros levando arte e cultura a 40 cidades do interior de Mato Grosso do Sul  agenciadenoticias.ms.gov.br Carreta-palco rodará 3.500 km levando arte e cultura a cidades do interior do Estado  fundacaodecultura.ms.gov.br Circula Cultura MS 2026 começa por Sonora e leva espetáculos ao interior  A Crítica de Campo Grande Carreta percorre 40 cidades de MS com apresentações gratuitas de teatro, dança e circo  G1"
Tacuru,5,"tacuru, governo, investe, milhões, restauração","Feira do Produtor ganha força em Tacuru e se consolida como vitrine após ações do programa Cidade Empreendedora - ms.agenciasebrae.com.br Educação e infraestrutura marcam início do ano com agenda intensa do Governo de MS no interior - agenciadenoticias.ms.gov.br Governo de Mato Grosso do Sul investe R$ 236,8 milhões na restauração de rodovias entre Tacuru e Eldorado - capitalnews.com.br Briga generalizada entre familiares termina com um esfaqueado em Tacuru - Midiamax Governador Eduardo Riedel investe R$ 236,8 milhões na restauração de rodovias entre Tacuru e Eldorado - Idest Feira do Produtor ganha força em Tacuru e se consolida como vitrine após ações do programa Cidade Empreendedora  ms.agenciasebrae.com.br Educação e infraestrutura marcam início do ano com agenda intensa do Governo de MS no interior  agenciadenoticias.ms.gov.br Governo de Mato Grosso do Sul investe R$ 236,8 milhões na restauração de rodovias entre Tacuru e Eldorado  capitalnews.com.br Briga generalizada entre familiares termina com um esfaqueado em Tacuru  Midiamax Governador Eduardo Riedel investe R$ 236,8 milhões na restauração de rodovias entre Tacuru e Eldorado  Idest"
