municipio,qtd_noticias_encontradas,temas_frequentes,resumo_para_slide
Naviraí,15,"vagas, naviraí, cursos, técnicos, campo","Governo licita obras de CEUs da Cultura em quatro cidades e fortalece acesso à arte, educação e cidadania - Portal Único ms.gov.br Neno Razuk investe mais de R$ 5 milhões em emendas e transforma municípios de MS - Assembleia Legislativa de Mato Grosso do Sul - Agendão: bandeirinhas, forró e quitutes marcam o início das festas juninas em Mato Grosso do Sul - agenciadenoticias.ms.gov.br Calendário Oficial de Eventos Culturais de 2025 é definido pela Gestão Compromisso com o Futuro - navirai.ms.gov.br Colônia de Férias da FIRJAN, matrículas no SESI-MS e museu de ciência 4.0 na BA - Agência de Notícias da Indústria Senai MS: 2 mil vagas em cursos técnicos com bolsa de R$ 300; inscreva-se - Campo Grande News IFMS divulga vagas remanescentes em cursos técnicos integrados - Correio de Corumbá IFMS abre vagas em cursos técnicos em 7 cidades; matrícula é por ordem de chegada - Campo Grande News Naviraí lança 1º Feirão de Emprego ‘Acelera Naviraí’ com mais de 200 vagas e 100 cursos de qualificação - funtrab.ms.gov.br Bioenergia: rodada de empregabilidade oferece mais de 630 vagas em 15 municípios de MS - agenciadenoticias.ms.gov.br Justiça de MS suspende cargo de procurador-geral adjunto preenchido sem concurso - Primeira Página Naviraí contrata empresa por R$ 1,4 milhão para revitalizar iluminação pública - Midiamax Naviraiense sob investigação: uso irregular de recursos públicos? - Campo Grande News Em Naviraí corte de salário do Prefeito pode impactar em redução de serviços na Saúde - navirai.ms.gov.br Naviraí recebe edição do programa ‘UEMS na Comunidade’ com atendimentos e ações cidadãs - funtrab.ms.gov.br Governo licita obras de CEUs da Cultura em quatro cidades e fortalece acesso à arte, educação e cidadania  Portal Único ms.gov.br Neno Razuk investe mais de R$ 5 milhões em emendas e transforma municípios de MS  Assembleia Legislativa de Mato Grosso do Sul - Agendão: bandeirinhas, forró e quitutes marcam o início das festas juninas em Mato Grosso do Sul  agenciadenoticias.ms.gov.br Calendário Oficial de Eventos Culturais de 2025 é definido pela Gestão Compromisso com o Futuro  navirai.ms.gov.br Colônia de Férias da FIRJAN, matrículas no SESI-MS e museu de ciência 4.0 na BA  Agência de Notícias da Indústria Senai MS: 2 mil vagas em cursos técnicos com bolsa de R$ 300; inscreva-se  Campo Grande News IFMS divulga vagas remanescentes em cursos técnicos integrados  Correio de Corumbá IFMS abre vagas em cursos técnicos em 7 cidades; matrícula é por ordem de chegada  Campo Grande News Naviraí lança 1º Feirão de Emprego ‘Acelera Naviraí’ com mais de 200 vagas e 100 cursos de qualificação  funtrab.ms.gov.br Bioenergia: rodada de empregabilidade oferece mais de 630 vagas em 15 municípios de MS  agenciadenoticias.ms.gov.br Justiça de MS suspende cargo de procurador-geral adjunto preenchido sem concurso  Primeira Página Naviraí contrata empresa por R$ 1,4 milhão para revitalizar iluminação pública  Midiamax Naviraiense sob investigação: uso irregular de recursos públicos? Campo Grande News Em Naviraí corte de salário do Prefeito pode impactar em redução de serviços na Saúde  navirai.ms.gov.br Naviraí recebe edição do programa ‘UEMS na Comunidade’ com atendimentos e ações cidadãs  funtrab.ms.gov.br"
Nova Andradina,15,"nova, andradina, prefeitura, vagas, cursos","36ª Corrida do Trabalhador reúne em Nova Andradina atletas de quatro estados - Prefeitura Municipal de Nova Andradina Festival de Dança Coreografada da Melhor Idade define campeões - fundesporte.ms.gov.br UEMS lança Pantanal Tech MS 2026 com programação que integra ciência, produção e qualidade de vida - Portal de Lauro Prática da atividade física movimentou a comunidade neste fim de semana - UFMS Neno Razuk investe mais de R$ 5 milhões em emendas e transforma municípios de MS - Assembleia Legislativa de Mato Grosso do Sul - Senai MS: 2 mil vagas em cursos técnicos com bolsa de R$ 300; inscreva-se - Campo Grande News Mais de 1.400 vagas gratuitas em cursos de qualificação estão com inscrições abertas em MS - funtrab.ms.gov.br Bioenergia: rodada de empregabilidade oferece mais de 630 vagas em 15 municípios de MS - agenciadenoticias.ms.gov.br IFMS divulga vagas remanescentes em cursos técnicos integrados - Correio de Corumbá IFMS abre vagas em cursos técnicos em 7 cidades; matrícula é por ordem de chegada - Campo Grande News Prefeitura de Nova Andradina é alvo de investigação após não incluir cotas em contratações - Midiamax Detentos iniciam atividades na limpeza urbana de Nova Andradina - - Prefeitura Municipal de Nova Andradina Agepen e Prefeitura firmam parceria para utilização de mão de obra prisional na limpeza urbana de Nova Andradina - agepen.ms.gov.br Parceria entre Agepen e Nova Andradina garante economia superior a 50% e amplia política de trabalho prisional - agenciadenoticias.ms.gov.br Acordo garante transporte escolar para alunos do Assentamento São João - Prefeitura Municipal de Nova Andradina 36ª Corrida do Trabalhador reúne em Nova Andradina atletas de quatro estados  Prefeitura Municipal de Nova Andradina Festival de Dança Coreografada da Melhor Idade define campeões  fundesporte.ms.gov.br UEMS lança Pantanal Tech MS 2026 com programação que integra ciência, produção e qualidade de vida  Portal de Lauro Prática da atividade física movimentou a comunidade neste fim de semana  UFMS Neno Razuk investe mais de R$ 5 milhões em emendas e transforma municípios de MS  Assembleia Legislativa de Mato Grosso do Sul - Senai MS: 2 mil vagas em cursos técnicos com bolsa de R$ 300; inscreva-se  Campo Grande News Mais de 1.400 vagas gratuitas em cursos de qualificação estão com inscrições abertas em MS  funtrab.ms.gov.br Bioenergia: rodada de empregabilidade oferece mais de 630 vagas em 15 municípios de MS  agenciadenoticias.ms.gov.br IFMS divulga vagas remanescentes em cursos técnicos integrados  Correio de Corumbá IFMS abre vagas em cursos técnicos em 7 cidades; matrícula é por ordem de chegada  Campo Grande News Prefeitura de Nova Andradina é alvo de investigação após não incluir cotas em contratações  Midiamax Detentos iniciam atividades na limpeza urbana de Nova Andradina -  Prefeitura Municipal de Nova Andradina Agepen e Prefeitura firmam parceria para utilização de mão de obra prisional na limpeza urbana de Nova Andradina  agepen.ms.gov.br Parceria entre Agepen e Nova Andradina garante economia superior a 50% e amplia política de trabalho prisional  agenciadenoticias.ms.gov.br Acordo garante transporte escolar para alunos do Assentamento São João  Prefeitura Municipal de Nova Andradina"
Paranaíba,13,"funtrab, paranaíba, oferece, prefeitura, programação","Tradição, aventura e cultura: Confira o roteiro de eventos que agitam o Brasil no mês de Setembro - www.gov.br Sesc Movimenta oferece 27 atividades gratuitas em Uberlândia e Uberaba; veja programação - G1 Agenda de Carnaval: desfiles das escolas de samba e blocos de rua tomam conta da programação - agenciadenoticias.ms.gov.br GIRO FUNTRAB DE NOTÍCIAS – 19/07/2025 a 29/07/2025 - funtrab.ms.gov.br Bioenergia: rodada de empregabilidade oferece mais de 630 vagas em 15 municípios de MS - agenciadenoticias.ms.gov.br Rodada de Empregabilidade mostra a diversidade de profissões que movem o setor de Bioenergia em MS - Cana Online GIRO FUNTRAB DE NOTÍCIAS – 30/07/2025 a 06/08/2025 - funtrab.ms.gov.br Cursos para mulheres em MS: bolsa de até R$ 720 em 8 cidades - Campo Grande News Paranaíba pagará R$ 10,5 milhões para empreiteira construir escola de tempo integral - Midiamax Prefeitura suspende diárias após decisão judicial sobre obras de drenagem - Campo Grande News Investigado por crimes contra a administração pública da Prefeitura de Inocência é preso em Jales/SP - pc.ms.gov.br Paranaíba é destaque estadual no Programa AdaptaCidades - Prefeitura Municipal de Paranaíba-MS Arauco oferece 560 vagas em cursos técnicos com bolsa de até 1,5 mil em Inocência, Paranaíba e Três Lagoas - funtrab.ms.gov.br Tradição, aventura e cultura: Confira o roteiro de eventos que agitam o Brasil no mês de Setembro  www.gov.br Sesc Movimenta oferece 27 atividades gratuitas em Uberlândia e Uberaba; veja programação  G1 Agenda de Carnaval: desfiles das escolas de samba e blocos de rua tomam conta da programação  agenciadenoticias.ms.gov.br GIRO FUNTRAB DE NOTÍCIAS – 19/07/2025 a 29/07/2025  funtrab.ms.gov.br Bioenergia: rodada de empregabilidade oferece mais de 630 vagas em 15 municípios de MS  agenciadenoticias.ms.gov.br Rodada de Empregabilidade mostra a diversidade de profissões que movem o setor de Bioenergia em MS  Cana Online GIRO FUNTRAB DE NOTÍCIAS – 30/07/2025 a 06/08/2025  funtrab.ms.gov.br Cursos para mulheres em MS: bolsa de até R$ 720 em 8 cidades  Campo Grande News Paranaíba pagará R$ 10,5 milhões para empreiteira construir escola de tempo integral  Midiamax Prefeitura suspende diárias após decisão judicial sobre obras de drenagem  Campo Grande News Investigado por crimes contra a administração pública da Prefeitura de Inocência é preso em Jales/SP  pc.ms.gov.br Paranaíba é destaque estadual no Programa AdaptaCidades  Prefeitura Municipal de Paranaíba-MS Arauco oferece 560 vagas em cursos técnicos com bolsa de até 1,5 mil em Inocência, Paranaíba e Três Lagoas  funtrab.ms.gov.br"
Paranhos,12,"paranhos, midiamax, atividades, milhões, concursos","Perifeirarte leva formação e mobilização comunitária a Porto Murtinho com programação integrada e atividades culturais - ArapuaNews Neno Razuk investe mais de R$ 5 milhões em emendas e transforma municípios de MS - Assembleia Legislativa de Mato Grosso do Sul - Trabalhadores indígenas do MS encontram oportunidade de emprego formal na colheita de maçãs no RS - funtrab.ms.gov.br MS tem sete concursos com inscrições abertas e salários de até R$ 8 mil - Midiamax Mineradora abre vagas para Jovem Aprendiz em Mara Rosa (GO) - stgnews.com.br Secretaria de Educação-MS abre 415 vagas para Assistente de Atividades Educacionais - Ache Concursos Finais da edição 2023 da Copa Anderson Mansano de Futebol serão nesta quarta em Amambai - A Gazeta News Câmara de Paranhos apresenta resumo das sessões dos dias 13, 22 e 27 de abril e de 4 maio de 2026 - A Gazeta News Pacote de R$ 10 milhões prevê de ambulâncias no interior de MS - Midiamax Sem licitação, Paranhos contrata assessoria contábil por R$ 240 mil - Midiamax Equipe da Justiça Federal/MS realiza visita técnica em Paranhos para tratar da próxima edição do projeto “Caminho do Acordo” - trf3.jus.br Novo prefeito de Paranhos faz exoneração em massa e nomeia novos integrantes do primeiro escalão - G1 Perifeirarte leva formação e mobilização comunitária a Porto Murtinho com programação integrada e atividades culturais  ArapuaNews Neno Razuk investe mais de R$ 5 milhões em emendas e transforma municípios de MS  Assembleia Legislativa de Mato Grosso do Sul - Trabalhadores indígenas do MS encontram oportunidade de emprego formal na colheita de maçãs no RS  funtrab.ms.gov.br MS tem sete concursos com inscrições abertas e salários de até R$ 8 mil  Midiamax Mineradora abre vagas para Jovem Aprendiz em Mara Rosa (GO)  stgnews.com.br Secretaria de Educação-MS abre 415 vagas para Assistente de Atividades Educacionais  Ache Concursos Finais da edição 2023 da Copa Anderson Mansano de Futebol serão nesta quarta em Amambai  A Gazeta News Câmara de Paranhos apresenta resumo das sessões dos dias 13, 22 e 27 de abril e de 4 maio de 2026  A Gazeta News Pacote de R$ 10 milhões prevê de ambulâncias no interior de MS  Midiamax Sem licitação, Paranhos contrata assessoria contábil por R$ 240 mil  Midiamax Equipe da Justiça Federal/MS realiza visita técnica em Paranhos para tratar da próxima edição do projeto “Caminho do Acordo”  trf3.jus.br Novo prefeito de Paranhos faz exoneração em massa e nomeia novos integrantes do primeiro escalão  G1"
Porto Murtinho,15,"porto, murtinho, funtrab, midiamax, turismo","Com apoio do Governo, Taboadão 2026 movimenta turismo, cultura e economia da região - agenciadenoticias.ms.gov.br Perifeirarte leva formação e mobilização comunitária a Porto Murtinho com programação integrada e atividades culturais - O sul-mato-grossense Maio Amarelo: Detran-MS promove o evento de qualificação de instrutores sobre as normas do CNH do Brasil - ArapuaNews Funtrab, MS Qualifica e Mais Social realizam cursos gratuitos em Sonora e Porto Murtinho - funtrab.ms.gov.br Caracol celebrou 61 anos com entregas de casas, lançamentos de obras e agenda cultural - Portal Único ms.gov.br Candidatos aprovados na seleção para bombeiro são convocados para curso de capacitação - Midiamax Estado abre curso gratuito de Comércio Exterior voltado à Rota Bioceânica e jovens do interior - Aquidauana Notícias Seis Casas do Trabalhador fecham no feriado de 8 de dezembro em MS - funtrab.ms.gov.br Acabou a desculpa! SENAI tem mais de 8,3 mil vagas em vários cursos pelo Brasil - Agência de Notícias da Indústria Corpo de Bombeiros divulga novo resultado da seleção para bombeiros temporários - Midiamax Porto Murtinho avança em obras de saúde, infraestrutura e turismo, de olho na consolidação da Rota Bioceânica - agenciadenoticias.ms.gov.br Pacote de R$ 10 milhões prevê de ambulâncias no interior de MS - Midiamax Moradores de Porto Murtinho/MS recebem serviços de cidadania em nova edição do Juizado Especial Federal Itinerante - trf3.jus.br Justiça Federal inicia dia 24 serviços de cidadania a trabalhadores rurais e indígenas em Porto Murtinho/MS - trf3.jus.br Polícia Civil inaugura a 53ª Sala Lilás do MS, em Japorã - sejusp.ms.gov.br Com apoio do Governo, Taboadão 2026 movimenta turismo, cultura e economia da região  agenciadenoticias.ms.gov.br Perifeirarte leva formação e mobilização comunitária a Porto Murtinho com programação integrada e atividades culturais  O sul-mato-grossense Maio Amarelo: Detran-MS promove o evento de qualificação de instrutores sobre as normas do CNH do Brasil  ArapuaNews Funtrab, MS Qualifica e Mais Social realizam cursos gratuitos em Sonora e Porto Murtinho  funtrab.ms.gov.br Caracol celebrou 61 anos com entregas de casas, lançamentos de obras e agenda cultural  Portal Único ms.gov.br Candidatos aprovados na seleção para bombeiro são convocados para curso de capacitação  Midiamax Estado abre curso gratuito de Comércio Exterior voltado à Rota Bioceânica e jovens do interior  Aquidauana Notícias Seis Casas do Trabalhador fecham no feriado de 8 de dezembro em MS  funtrab.ms.gov.br Acabou a desculpa! SENAI tem mais de 8,3 mil vagas em vários cursos pelo Brasil  Agência de Notícias da Indústria Corpo de Bombeiros divulga novo resultado da seleção para bombeiros temporários  Midiamax Porto Murtinho avança em obras de saúde, infraestrutura e turismo, de olho na consolidação da Rota Bioceânica  agenciadenoticias.ms.gov.br Pacote de R$ 10 milhões prevê de ambulâncias no interior de MS  Midiamax Moradores de Porto Murtinho/MS recebem serviços de cidadania em nova edição do Juizado Especial Federal Itinerante  trf3.jus.br Justiça Federal inicia dia 24 serviços de cidadania a trabalhadores rurais e indígenas em Porto Murtinho/MS  trf3.jus.br Polícia Civil inaugura a 53ª Sala Lilás do MS, em Japorã  sejusp.ms.gov.br"
Ribas do Rio Pardo,13,"ribas, pardo, funtrab, cidadania, desenvolvimento","De cidadania à cultura, turismo, memória e desenvolvimento, MS coloca territórios quilombolas em evidência - ArapuaNews Ribas do Rio Pardo transforma aniversário em vitrine de investimentos e amplia infraestrutura em diversas áreas - agenciadenoticias.ms.gov.br Confira a programação completa do Delas Day 2026 - funtrab.ms.gov.br Neno Razuk investe mais de R$ 5 milhões em emendas e transforma municípios de MS - Assembleia Legislativa de Mato Grosso do Sul - Do livro à robótica: educação do Sesi envolve comunidade e atrai mão de obra - JD1 Notícias Funtrab abre processo seletivo com 14 vagas para trabalhar em Ribas do Rio Pardo - funtrab.ms.gov.br Vagas abertas: 500 chances de terminar o ano com um novo emprego na área de tecnologia - Agência de Notícias da Indústria Multinacional brasileira Suzano busca profissional para atuar como Técnico de Segurança do Trabalho em Ribas do Rio Pardo (MS) - CPG Click Petróleo e Gás Ribas do Rio Pardo: quando indústria e educação se unem para outra cidade nascer - FIEMS Polícia Civil inaugura a 53ª Sala Lilás do MS, em Japorã - sejusp.ms.gov.br Justiça Federal inicia dia 24 serviços de cidadania a trabalhadores rurais e indígenas em Porto Murtinho/MS - trf3.jus.br Dispensa em licitação de R$ 3,8 milhões para coleta de lixo em Ribas entra na mira de inquérito - Midiamax Ribas do Rio Pardo recebe comitiva de Bataguassu para troca de experiências sobre desenvolvimento e gestão - Boca do Povo News De cidadania à cultura, turismo, memória e desenvolvimento, MS coloca territórios quilombolas em evidência  ArapuaNews Ribas do Rio Pardo transforma aniversário em vitrine de investimentos e amplia infraestrutura em diversas áreas  agenciadenoticias.ms.gov.br Confira a programação completa do Delas Day 2026  funtrab.ms.gov.br Neno Razuk investe mais de R$ 5 milhões em emendas e transforma municípios de MS  Assembleia Legislativa de Mato Grosso do Sul - Do livro à robótica: educação do Sesi envolve comunidade e atrai mão de obra  JD1 Notícias Funtrab abre processo seletivo com 14 vagas para trabalhar em Ribas do Rio Pardo  funtrab.ms.gov.br Vagas abertas: 500 chances de terminar o ano com um novo emprego na área de tecnologia  Agência de Notícias da Indústria Multinacional brasileira Suzano busca profissional para atuar como Técnico de Segurança do Trabalho em Ribas do Rio Pardo (MS)  CPG Click Petróleo e Gás Ribas do Rio Pardo: quando indústria e educação se unem para outra cidade nascer  FIEMS Polícia Civil inaugura a 53ª Sala Lilás do MS, em Japorã  sejusp.ms.gov.br Justiça Federal inicia dia 24 serviços de cidadania a trabalhadores rurais e indígenas em Porto Murtinho/MS  trf3.jus.br Dispensa em licitação de R$ 3,8 milhões para coleta de lixo em Ribas entra na mira de inquérito  Midiamax Ribas do Rio Pardo recebe comitiva de Bataguassu para troca de experiências sobre desenvolvimento e gestão  Boca do Povo News"
Sete Quedas,13,"sete, quedas, news, copa, gazeta","Quebra-Torto com Letras valoriza literatura latino-americana e tradição pantaneira no Festival América do Sul - ArapuaNews Sete Quedas amplia infraestrutura, saneamento e lazer com investimentos superiores a R$ 23 milhões - msemfoco.com.br Ponta Porã recebe etapa dos Jogos da Melhor Idade com disputas de bocha - Portal Único ms.gov.br Com R$ 3,2 bilhões, MS teve aumento de 227% nos investimentos públicos nos últimos três anos - agenciadenoticias.ms.gov.br Finais da edição 2023 da Copa Anderson Mansano de Futebol serão nesta quarta em Amambai - A Gazeta News Senai MS: 2 mil vagas em cursos técnicos com bolsa de R$ 300; inscreva-se - Campo Grande News Seis Casas do Trabalhador fecham no feriado de 8 de dezembro em MS - funtrab.ms.gov.br Finais da edição 2023 da Copa Anderson Mansano de Futebol serão nesta quarta em Amambai - A Gazeta News Sete Quedas sedia neste domingo 4ª etapa da Copa Sulmems de Velocross 2026 - A Gazeta News Abastecimento da frota municipal custará R$ 2,9 milhões em Sete Quedas - Midiamax Processo seletivo simplificado Prefeitura de Sete Quedas MS Educação - Folha Dirigida Sete Quedas pede à Justiça entrada forçada em imóveis após alta de chikungunya - A Crítica de Campo Grande Sete Quedas define nesta sexta-feira Dia do Trabalhador os campeões da Copa Verão de Suíço 2026 - A Gazeta News Quebra-Torto com Letras valoriza literatura latino-americana e tradição pantaneira no Festival América do Sul  ArapuaNews Sete Quedas amplia infraestrutura, saneamento e lazer com investimentos superiores a R$ 23 milhões  msemfoco.com.br Ponta Porã recebe etapa dos Jogos da Melhor Idade com disputas de bocha  Portal Único ms.gov.br Com R$ 3,2 bilhões, MS teve aumento de 227% nos investimentos públicos nos últimos três anos  agenciadenoticias.ms.gov.br Finais da edição 2023 da Copa Anderson Mansano de Futebol serão nesta quarta em Amambai  A Gazeta News Senai MS: 2 mil vagas em cursos técnicos com bolsa de R$ 300; inscreva-se  Campo Grande News Seis Casas do Trabalhador fecham no feriado de 8 de dezembro em MS  funtrab.ms.gov.br Finais da edição 2023 da Copa Anderson Mansano de Futebol serão nesta quarta em Amambai  A Gazeta News Sete Quedas sedia neste domingo 4ª etapa da Copa Sulmems de Velocross 2026  A Gazeta News Abastecimento da frota municipal custará R$ 2,9 milhões em Sete Quedas  Midiamax Processo seletivo simplificado Prefeitura de Sete Quedas MS Educação  Folha Dirigida Sete Quedas pede à Justiça entrada forçada em imóveis após alta de chikungunya  A Crítica de Campo Grande Sete Quedas define nesta sexta-feira Dia do Trabalhador os campeões da Copa Verão de Suíço 2026  A Gazeta News"
Sonora,15,"vagas, sonora, mato, grosso, agenciadenoticias","Carreta-palco rodará 3.500 quilômetros levando arte e cultura a 40 cidades do interior de Mato Grosso do Sul - agenciadenoticias.ms.gov.br Sonora Brasil Sesc terá mostra comemorativa em Porto Alegre e apresentações em 6 cidades do interior do RS - Sesc/RS Neno Razuk investe mais de R$ 5 milhões em emendas e transforma municípios de MS - Assembleia Legislativa de Mato Grosso do Sul - Moinho in Concert entra na reta final dos ensaios para celebrar os caminhos que levam ao céu - Diário MS News Carreta-palco do Circuito Cultura MS segue para a região central com nova rodada de apresentações - agenciadenoticias.ms.gov.br Funtrab e SENAI-MS abrem vagas para cursos gratuitos e fortalecem qualificação profissional no Estado - funtrab.ms.gov.br Bioenergia: rodada de empregabilidade oferece mais de 630 vagas em 15 municípios de MS - agenciadenoticias.ms.gov.br Senai MS: 2 mil vagas em cursos técnicos com bolsa de R$ 300; inscreva-se - Campo Grande News Faça um curso no Senai e ganhe R$ 300: abertas 2 mil vagas em cursos como Açúcar e Álcool, Administração, Agroindústria, Eletromecânica, Logística, Planejamento e Controle da Produção e Segurança do Trabalho - CPG Click Petróleo e Gás Anota aí: concursos em MS têm 279 vagas e salários de até R$ 23,5 mil - Midiamax Show nacional é interrompido após fechamento de avenida e som acima do permitido em Cuiabá - G1 Casa do Trabalhador de Sonora realiza seletiva com a empresa Cargill - funtrab.ms.gov.br Concurso Secretaria Municipal de Educação Sonora MS abre 2 vagas - Folha Dirigida Polícia Civil inaugura a 52ª Sala Lilás do MS, em Aparecida do Taboado - pc.ms.gov.br Sonora fecha contrato de R$ 2 milhões com empresa envolvida em fraudes em Mato Grosso - Midiamax Carreta-palco rodará 3.500 quilômetros levando arte e cultura a 40 cidades do interior de Mato Grosso do Sul  agenciadenoticias.ms.gov.br Sonora Brasil Sesc terá mostra comemorativa em Porto Alegre e apresentações em 6 cidades do interior do RS  Sesc/RS Neno Razuk investe mais de R$ 5 milhões em emendas e transforma municípios de MS  Assembleia Legislativa de Mato Grosso do Sul - Moinho in Concert entra na reta final dos ensaios para celebrar os caminhos que levam ao céu  Diário MS News Carreta-palco do Circuito Cultura MS segue para a região central com nova rodada de apresentações  agenciadenoticias.ms.gov.br Funtrab e SENAI-MS abrem vagas para cursos gratuitos e fortalecem qualificação profissional no Estado  funtrab.ms.gov.br Bioenergia: rodada de empregabilidade oferece mais de 630 vagas em 15 municípios de MS  agenciadenoticias.ms.gov.br Senai MS: 2 mil vagas em cursos técnicos com bolsa de R$ 300; inscreva-se  Campo Grande News Faça um curso no Senai e ganhe R$ 300: abertas 2 mil vagas em cursos como Açúcar e Álcool, Administração, Agroindústria, Eletromecânica, Logística, Planejamento e Controle da Produção e Segurança do Trabalho  CPG Click Petróleo e Gás Anota aí: concursos em MS têm 279 vagas e salários de até R$ 23,5 mil  Midiamax Show nacional é interrompido após fechamento de avenida e som acima do permitido em Cuiabá  G1 Casa do Trabalhador de Sonora realiza seletiva com a empresa Cargill  funtrab.ms.gov.br Concurso Secretaria Municipal de Educação Sonora MS abre 2 vagas  Folha Dirigida Polícia Civil inaugura a 52ª Sala Lilás do MS, em Aparecida do Taboado  pc.ms.gov.br Sonora fecha contrato de R$ 2 milhões com empresa envolvida em fraudes em Mato Grosso  Midiamax"
