municipio,qtd_noticias_encontradas,temas_frequentes,resumo_para_slide
Naviraí,15,"naviraí, vagas, cursos, técnicos, news","Governo licita obras de CEUs da Cultura em quatro cidades e fortalece acesso à arte, educação e cidadania - Portal Único ms.gov.br Neno Razuk investe mais de R$ 5 milhões em emendas e transforma municípios de MS - Assembleia Legislativa de Mato Grosso do Sul - Agendão: bandeirinhas, forró e quitutes marcam o início das festas juninas em Mato Grosso do Sul - agenciadenoticias.ms.gov.br Calendário Oficial de Eventos Culturais de 2025 é definido pela Gestão Compromisso com o Futuro - navirai.ms.gov.br Colônia de Férias da FIRJAN, matrículas no SESI-MS e museu de ciência 4.0 na BA - Agência de Notícias da Indústria Naviraí lança 1º Feirão de Emprego ‘Acelera Naviraí’ com mais de 200 vagas e 100 cursos de qualificação - funtrab.ms.gov.br Bioenergia: rodada de empregabilidade oferece mais de 630 vagas em 15 municípios de MS - agenciadenoticias.ms.gov.br Senai MS: 2 mil vagas em cursos técnicos com bolsa de R$ 300; inscreva-se - Campo Grande News IFMS divulga vagas remanescentes em cursos técnicos integrados - Correio de Corumbá IFMS abre vagas em cursos técnicos em 7 cidades; matrícula é por ordem de chegada - Campo Grande News Justiça de MS suspende cargo de procurador-geral adjunto preenchido sem concurso - Primeira Página Sebrae/MS, Governo do Estado e Prefeitura de Naviraí lançam Plano de Desenvolvimento Municipal nesta quinta-feira (14) - A Gazeta News Naviraí contrata empresa por R$ 1,4 milhão para revitalizar iluminação pública - Midiamax Polícia Civil inaugura a 53ª Sala Lilás do MS, em Japorã - pc.ms.gov.br Em Naviraí corte de salário do Prefeito pode impactar em redução de serviços na Saúde - navirai.ms.gov.br Governo licita obras de CEUs da Cultura em quatro cidades e fortalece acesso à arte, educação e cidadania  Portal Único ms.gov.br Neno Razuk investe mais de R$ 5 milhões em emendas e transforma municípios de MS  Assembleia Legislativa de Mato Grosso do Sul - Agendão: bandeirinhas, forró e quitutes marcam o início das festas juninas em Mato Grosso do Sul  agenciadenoticias.ms.gov.br Calendário Oficial de Eventos Culturais de 2025 é definido pela Gestão Compromisso com o Futuro  navirai.ms.gov.br Colônia de Férias da FIRJAN, matrículas no SESI-MS e museu de ciência 4.0 na BA  Agência de Notícias da Indústria Naviraí lança 1º Feirão de Emprego ‘Acelera Naviraí’ com mais de 200 vagas e 100 cursos de qualificação  funtrab.ms.gov.br Bioenergia: rodada de empregabilidade oferece mais de 630 vagas em 15 municípios de MS  agenciadenoticias.ms.gov.br Senai MS: 2 mil vagas em cursos técnicos com bolsa de R$ 300; inscreva-se  Campo Grande News IFMS divulga vagas remanescentes em cursos técnicos integrados  Correio de Corumbá IFMS abre vagas em cursos técnicos em 7 cidades; matrícula é por ordem de chegada  Campo Grande News Justiça de MS suspende cargo de procurador-geral adjunto preenchido sem concurso  Primeira Página Sebrae/MS, Governo do Estado e Prefeitura de Naviraí lançam Plano de Desenvolvimento Municipal nesta quinta-feira (14)  A Gazeta News Naviraí contrata empresa por R$ 1,4 milhão para revitalizar iluminação pública  Midiamax Polícia Civil inaugura a 53ª Sala Lilás do MS, em Japorã  pc.ms.gov.br Em Naviraí corte de salário do Prefeito pode impactar em redução de serviços na Saúde  navirai.ms.gov.br"
Nova Andradina,15,"nova, andradina, vagas, prefeitura, cursos","36ª Corrida do Trabalhador reúne em Nova Andradina atletas de quatro estados - Prefeitura Municipal de Nova Andradina Festival de Dança Coreografada da Melhor Idade define campeões - fundesporte.ms.gov.br UEMS lança Pantanal Tech MS 2026 com programação que integra ciência, produção e qualidade de vida - Portal de Lauro Prática da atividade física movimentou a comunidade neste fim de semana - UFMS Neno Razuk investe mais de R$ 5 milhões em emendas e transforma municípios de MS - Assembleia Legislativa de Mato Grosso do Sul - Senai MS: 2 mil vagas em cursos técnicos com bolsa de R$ 300; inscreva-se - Campo Grande News Mais de 1.400 vagas gratuitas em cursos de qualificação estão com inscrições abertas em MS - funtrab.ms.gov.br Bioenergia: rodada de empregabilidade oferece mais de 630 vagas em 15 municípios de MS - agenciadenoticias.ms.gov.br IFMS divulga vagas remanescentes em cursos técnicos integrados - Correio de Corumbá IFMS abre vagas em cursos técnicos em 7 cidades; matrícula é por ordem de chegada - Campo Grande News Prefeitura de Nova Andradina é alvo de investigação após não incluir cotas em contratações - Midiamax Detentos iniciam atividades na limpeza urbana de Nova Andradina - - Prefeitura Municipal de Nova Andradina Agepen e Prefeitura firmam parceria para utilização de mão de obra prisional na limpeza urbana de Nova Andradina - agepen.ms.gov.br Corrida dos Bombeiros de Nova Andradina reúne mais de 600 participantes e leva militares ao pódio - bombeiros.ms.gov.br Parceria entre Agepen e Nova Andradina garante economia superior a 50% e amplia política de trabalho prisional - agenciadenoticias.ms.gov.br 36ª Corrida do Trabalhador reúne em Nova Andradina atletas de quatro estados  Prefeitura Municipal de Nova Andradina Festival de Dança Coreografada da Melhor Idade define campeões  fundesporte.ms.gov.br UEMS lança Pantanal Tech MS 2026 com programação que integra ciência, produção e qualidade de vida  Portal de Lauro Prática da atividade física movimentou a comunidade neste fim de semana  UFMS Neno Razuk investe mais de R$ 5 milhões em emendas e transforma municípios de MS  Assembleia Legislativa de Mato Grosso do Sul - Senai MS: 2 mil vagas em cursos técnicos com bolsa de R$ 300; inscreva-se  Campo Grande News Mais de 1.400 vagas gratuitas em cursos de qualificação estão com inscrições abertas em MS  funtrab.ms.gov.br Bioenergia: rodada de empregabilidade oferece mais de 630 vagas em 15 municípios de MS  agenciadenoticias.ms.gov.br IFMS divulga vagas remanescentes em cursos técnicos integrados  Correio de Corumbá IFMS abre vagas em cursos técnicos em 7 cidades; matrícula é por ordem de chegada  Campo Grande News Prefeitura de Nova Andradina é alvo de investigação após não incluir cotas em contratações  Midiamax Detentos iniciam atividades na limpeza urbana de Nova Andradina -  Prefeitura Municipal de Nova Andradina Agepen e Prefeitura firmam parceria para utilização de mão de obra prisional na limpeza urbana de Nova Andradina  agepen.ms.gov.br Corrida dos Bombeiros de Nova Andradina reúne mais de 600 participantes e leva militares ao pódio  bombeiros.ms.gov.br Parceria entre Agepen e Nova Andradina garante economia superior a 50% e amplia política de trabalho prisional  agenciadenoticias.ms.gov.br"
Paranaíba,13,"funtrab, oferece, vagas, brasil, programação","Tradição, aventura e cultura: Confira o roteiro de eventos que agitam o Brasil no mês de Setembro - www.gov.br Sesc Movimenta oferece 27 atividades gratuitas em Uberlândia e Uberaba; veja programação - G1 Agenda de Carnaval: desfiles das escolas de samba e blocos de rua tomam conta da programação - agenciadenoticias.ms.gov.br Feirão de Empregos da Arauco Celulose do Brasil S.A. oferece vagas na área florestal em Cassilândia - funtrab.ms.gov.br Bioenergia: rodada de empregabilidade oferece mais de 630 vagas em 15 municípios de MS - agenciadenoticias.ms.gov.br Cursos para mulheres em MS: bolsa de até R$ 720 em 8 cidades - Campo Grande News GIRO FUNTRAB DE NOTÍCIAS – 30/07/2025 a 06/08/2025 - funtrab.ms.gov.br GIRO FUNTRAB DE NOTÍCIAS – 10/09/2025 a 25/09/2025 - funtrab.ms.gov.br Investigado por crimes contra a administração pública da Prefeitura de Inocência é preso em Jales/SP - pc.ms.gov.br Paranaíba pagará R$ 10,5 milhões para empreiteira construir escola de tempo integral - Midiamax Prefeitura suspende diárias após decisão judicial sobre obras de drenagem - Campo Grande News Arauco oferece 560 vagas em cursos técnicos com bolsa de até 1,5 mil em Inocência, Paranaíba e Três Lagoas - funtrab.ms.gov.br Vereador cria lei que isenta IPTU de quem mora em rua com buraco ou sem luz - SEMANA 7 Tradição, aventura e cultura: Confira o roteiro de eventos que agitam o Brasil no mês de Setembro  www.gov.br Sesc Movimenta oferece 27 atividades gratuitas em Uberlândia e Uberaba; veja programação  G1 Agenda de Carnaval: desfiles das escolas de samba e blocos de rua tomam conta da programação  agenciadenoticias.ms.gov.br Feirão de Empregos da Arauco Celulose do Brasil S.A. oferece vagas na área florestal em Cassilândia  funtrab.ms.gov.br Bioenergia: rodada de empregabilidade oferece mais de 630 vagas em 15 municípios de MS  agenciadenoticias.ms.gov.br Cursos para mulheres em MS: bolsa de até R$ 720 em 8 cidades  Campo Grande News GIRO FUNTRAB DE NOTÍCIAS – 30/07/2025 a 06/08/2025  funtrab.ms.gov.br GIRO FUNTRAB DE NOTÍCIAS – 10/09/2025 a 25/09/2025  funtrab.ms.gov.br Investigado por crimes contra a administração pública da Prefeitura de Inocência é preso em Jales/SP  pc.ms.gov.br Paranaíba pagará R$ 10,5 milhões para empreiteira construir escola de tempo integral  Midiamax Prefeitura suspende diárias após decisão judicial sobre obras de drenagem  Campo Grande News Arauco oferece 560 vagas em cursos técnicos com bolsa de até 1,5 mil em Inocência, Paranaíba e Três Lagoas  funtrab.ms.gov.br Vereador cria lei que isenta IPTU de quem mora em rua com buraco ou sem luz  SEMANA 7"
Paranhos,11,"paranhos, milhões, atividades, abre, vagas","Neno Razuk investe mais de R$ 5 milhões em emendas e transforma municípios de MS - Assembleia Legislativa de Mato Grosso do Sul - Perifeirarte leva formação e mobilização comunitária a Porto Murtinho com programação integrada e atividades culturais - ArapuaNews Trabalhadores indígenas do MS encontram oportunidade de emprego formal na colheita de maçãs no RS - funtrab.ms.gov.br Mineradora abre vagas para Jovem Aprendiz em Mara Rosa (GO) - stgnews.com.br MS tem sete concursos com inscrições abertas e salários de até R$ 8 mil - Midiamax Secretaria de Educação-MS abre 415 vagas para Assistente de Atividades Educacionais - Ache Concursos Equipe da Justiça Federal/MS realiza visita técnica em Paranhos para tratar da próxima edição do projeto “Caminho do Acordo” - trf3.jus.br Câmara de Paranhos apresenta resumo das sessões dos dias 13, 22 e 27 de abril e de 4 maio de 2026 - A Gazeta News Pacote de R$ 10 milhões prevê de ambulâncias no interior de MS - Midiamax Novo prefeito de Paranhos faz exoneração em massa e nomeia novos integrantes do primeiro escalão - G1 Novo prefeito de Paranhos exonera secretariado em 7 de novembro - Campo Grande News Neno Razuk investe mais de R$ 5 milhões em emendas e transforma municípios de MS  Assembleia Legislativa de Mato Grosso do Sul - Perifeirarte leva formação e mobilização comunitária a Porto Murtinho com programação integrada e atividades culturais  ArapuaNews Trabalhadores indígenas do MS encontram oportunidade de emprego formal na colheita de maçãs no RS  funtrab.ms.gov.br Mineradora abre vagas para Jovem Aprendiz em Mara Rosa (GO)  stgnews.com.br MS tem sete concursos com inscrições abertas e salários de até R$ 8 mil  Midiamax Secretaria de Educação-MS abre 415 vagas para Assistente de Atividades Educacionais  Ache Concursos Equipe da Justiça Federal/MS realiza visita técnica em Paranhos para tratar da próxima edição do projeto “Caminho do Acordo”  trf3.jus.br Câmara de Paranhos apresenta resumo das sessões dos dias 13, 22 e 27 de abril e de 4 maio de 2026  A Gazeta News Pacote de R$ 10 milhões prevê de ambulâncias no interior de MS  Midiamax Novo prefeito de Paranhos faz exoneração em massa e nomeia novos integrantes do primeiro escalão  G1 Novo prefeito de Paranhos exonera secretariado em 7 de novembro  Campo Grande News"
Porto Murtinho,15,"porto, murtinho, agenciadenoticias, bombeiros, midiamax","Com apoio do Governo, Taboadão 2026 movimenta turismo, cultura e economia da região - agenciadenoticias.ms.gov.br Perifeirarte leva formação e mobilização comunitária a Porto Murtinho com programação integrada e atividades culturais - O sul-mato-grossense Maio Amarelo: Detran-MS promove o evento de qualificação de instrutores sobre as normas do CNH do Brasil - ArapuaNews Caracol celebrou 61 anos com entregas de casas, lançamentos de obras e agenda cultural - Portal Único ms.gov.br Jogos da Melhor Idade de MS começam na próxima semana promovendo inclusão de idosos-atletas - agenciadenoticias.ms.gov.br Funtrab inaugura Casa do Trabalhador de Brasilândia e amplia acesso a emprego e qualificação profissional - funtrab.ms.gov.br Estado abre curso gratuito de Comércio Exterior voltado à Rota Bioceânica e jovens do interior - Aquidauana Notícias Corpo de Bombeiros divulga novo resultado da seleção para bombeiros temporários - Midiamax Bombeiros divulgam resultado da seleção que ofertou 230 vagas para soldado auxiliar - Midiamax Acabou a desculpa! SENAI tem mais de 8,3 mil vagas em vários cursos pelo Brasil - Agência de Notícias da Indústria Porto Murtinho avança em obras de saúde, infraestrutura e turismo, de olho na consolidação da Rota Bioceânica - agenciadenoticias.ms.gov.br Pacote de R$ 10 milhões prevê de ambulâncias no interior de MS - Midiamax Moradores de Porto Murtinho/MS recebem serviços de cidadania em nova edição do Juizado Especial Federal Itinerante - trf3.jus.br Justiça Federal inicia dia 24 serviços de cidadania a trabalhadores rurais e indígenas em Porto Murtinho/MS - trf3.jus.br Delegacia de Porto Murtinho passa a contar com “Sala Lilás” - pc.ms.gov.br Com apoio do Governo, Taboadão 2026 movimenta turismo, cultura e economia da região  agenciadenoticias.ms.gov.br Perifeirarte leva formação e mobilização comunitária a Porto Murtinho com programação integrada e atividades culturais  O sul-mato-grossense Maio Amarelo: Detran-MS promove o evento de qualificação de instrutores sobre as normas do CNH do Brasil  ArapuaNews Caracol celebrou 61 anos com entregas de casas, lançamentos de obras e agenda cultural  Portal Único ms.gov.br Jogos da Melhor Idade de MS começam na próxima semana promovendo inclusão de idosos-atletas  agenciadenoticias.ms.gov.br Funtrab inaugura Casa do Trabalhador de Brasilândia e amplia acesso a emprego e qualificação profissional  funtrab.ms.gov.br Estado abre curso gratuito de Comércio Exterior voltado à Rota Bioceânica e jovens do interior  Aquidauana Notícias Corpo de Bombeiros divulga novo resultado da seleção para bombeiros temporários  Midiamax Bombeiros divulgam resultado da seleção que ofertou 230 vagas para soldado auxiliar  Midiamax Acabou a desculpa! SENAI tem mais de 8,3 mil vagas em vários cursos pelo Brasil  Agência de Notícias da Indústria Porto Murtinho avança em obras de saúde, infraestrutura e turismo, de olho na consolidação da Rota Bioceânica  agenciadenoticias.ms.gov.br Pacote de R$ 10 milhões prevê de ambulâncias no interior de MS  Midiamax Moradores de Porto Murtinho/MS recebem serviços de cidadania em nova edição do Juizado Especial Federal Itinerante  trf3.jus.br Justiça Federal inicia dia 24 serviços de cidadania a trabalhadores rurais e indígenas em Porto Murtinho/MS  trf3.jus.br Delegacia de Porto Murtinho passa a contar com “Sala Lilás”  pc.ms.gov.br"
Ribas do Rio Pardo,13,"cidadania, funtrab, ribas, pardo, serviços","De cidadania à cultura, turismo, memória e desenvolvimento, MS coloca territórios quilombolas em evidência - ArapuaNews Funtrab leva serviços de emprego e cidadania em ação social do Projeto Asas do Futuro na Cohab - funtrab.ms.gov.br Agendão: 30 anos do Bando do Velho Jack, Sarau da Consciência Negra, circo e atrações no interior agitam o fim de semana – Agência de Noticias do Governo de Mato Grosso do Sul - agenciadenoticias.ms.gov.br Neno Razuk investe mais de R$ 5 milhões em emendas e transforma municípios de MS - Assembleia Legislativa de Mato Grosso do Sul - Do livro à robótica: educação do Sesi envolve comunidade e atrai mão de obra - JD1 Notícias Funtrab abre processo seletivo com 14 vagas para trabalhar em Ribas do Rio Pardo - funtrab.ms.gov.br Vagas abertas: 500 chances de terminar o ano com um novo emprego na área de tecnologia - Agência de Notícias da Indústria Multinacional brasileira Suzano busca profissional para atuar como Técnico de Segurança do Trabalho em Ribas do Rio Pardo (MS) - CPG Click Petróleo e Gás Moradores de Porto Murtinho/MS recebem serviços de cidadania em nova edição do Juizado Especial Federal Itinerante - trf3.jus.br Polícia Civil inaugura a 53ª Sala Lilás do MS, em Japorã - pc.ms.gov.br Ribas do Rio Pardo: quando indústria e educação se unem para outra cidade nascer - A Crítica de Campo Grande Justiça Federal inicia dia 24 serviços de cidadania a trabalhadores rurais e indígenas em Porto Murtinho/MS - trf3.jus.br Ribas do Rio Pardo recebe comitiva de Bataguassu para troca de experiências sobre desenvolvimento e gestão - Boca do Povo News De cidadania à cultura, turismo, memória e desenvolvimento, MS coloca territórios quilombolas em evidência  ArapuaNews Funtrab leva serviços de emprego e cidadania em ação social do Projeto Asas do Futuro na Cohab  funtrab.ms.gov.br Agendão: 30 anos do Bando do Velho Jack, Sarau da Consciência Negra, circo e atrações no interior agitam o fim de semana – Agência de Noticias do Governo de Mato Grosso do Sul  agenciadenoticias.ms.gov.br Neno Razuk investe mais de R$ 5 milhões em emendas e transforma municípios de MS  Assembleia Legislativa de Mato Grosso do Sul - Do livro à robótica: educação do Sesi envolve comunidade e atrai mão de obra  JD1 Notícias Funtrab abre processo seletivo com 14 vagas para trabalhar em Ribas do Rio Pardo  funtrab.ms.gov.br Vagas abertas: 500 chances de terminar o ano com um novo emprego na área de tecnologia  Agência de Notícias da Indústria Multinacional brasileira Suzano busca profissional para atuar como Técnico de Segurança do Trabalho em Ribas do Rio Pardo (MS)  CPG Click Petróleo e Gás Moradores de Porto Murtinho/MS recebem serviços de cidadania em nova edição do Juizado Especial Federal Itinerante  trf3.jus.br Polícia Civil inaugura a 53ª Sala Lilás do MS, em Japorã  pc.ms.gov.br Ribas do Rio Pardo: quando indústria e educação se unem para outra cidade nascer  A Crítica de Campo Grande Justiça Federal inicia dia 24 serviços de cidadania a trabalhadores rurais e indígenas em Porto Murtinho/MS  trf3.jus.br Ribas do Rio Pardo recebe comitiva de Bataguassu para troca de experiências sobre desenvolvimento e gestão  Boca do Povo News"
Sete Quedas,11,"sete, quedas, arapuanews, milhões, seis","Quebra-Torto com Letras valoriza literatura latino-americana e tradição pantaneira no Festival América do Sul - ArapuaNews Sete Quedas amplia infraestrutura, saneamento e lazer com investimentos superiores a R$ 23 milhões - msemfoco.com.br Ponta Porã recebe etapa dos Jogos da Melhor Idade com disputas de bocha - Portal Único ms.gov.br Governo de MS garante repasse de R$ 1,32 milhão para o carnaval de Corumbá 2025 - agenciadenoticias.ms.gov.br Sebrae busca as melhores reportagens sobre empreendedorismo para premiar - ArapuaNews Seis Casas do Trabalhador fecham no feriado de 8 de dezembro em MS - funtrab.ms.gov.br Abastecimento da frota municipal custará R$ 2,9 milhões em Sete Quedas - Midiamax Diante da baixa procura por vacina contra chikungunya, prefeitura cria unidade volante - Dourados Informa Processo seletivo simplificado Prefeitura de Sete Quedas MS Educação - Folha Dirigida Seis Casas do Trabalhador fecham no feriado de 8 de dezembro em MS - funtrab.ms.gov.br Com 5,8 mil casos e 12 mortes, três cidades de MS decretam emergência por chikungunya - Midiamax Quebra-Torto com Letras valoriza literatura latino-americana e tradição pantaneira no Festival América do Sul  ArapuaNews Sete Quedas amplia infraestrutura, saneamento e lazer com investimentos superiores a R$ 23 milhões  msemfoco.com.br Ponta Porã recebe etapa dos Jogos da Melhor Idade com disputas de bocha  Portal Único ms.gov.br Governo de MS garante repasse de R$ 1,32 milhão para o carnaval de Corumbá 2025  agenciadenoticias.ms.gov.br Sebrae busca as melhores reportagens sobre empreendedorismo para premiar  ArapuaNews Seis Casas do Trabalhador fecham no feriado de 8 de dezembro em MS  funtrab.ms.gov.br Abastecimento da frota municipal custará R$ 2,9 milhões em Sete Quedas  Midiamax Diante da baixa procura por vacina contra chikungunya, prefeitura cria unidade volante  Dourados Informa Processo seletivo simplificado Prefeitura de Sete Quedas MS Educação  Folha Dirigida Seis Casas do Trabalhador fecham no feriado de 8 de dezembro em MS  funtrab.ms.gov.br Com 5,8 mil casos e 12 mortes, três cidades de MS decretam emergência por chikungunya  Midiamax"
Sonora,15,"vagas, sonora, sesc, funtrab, senai","Carreta-palco do Circuito Cultura MS segue para a região central com nova rodada de apresentações - agenciadenoticias.ms.gov.br Neno Razuk investe mais de R$ 5 milhões em emendas e transforma municípios de MS - Assembleia Legislativa de Mato Grosso do Sul - Sonora Brasil Sesc terá mostra comemorativa em Porto Alegre e apresentações em 6 cidades do interior do RS - Sesc/RS Moinho in Concert entra na reta final dos ensaios para celebrar os caminhos que levam ao céu - Diário MS News Semana Modos de Acessar 2021 - Sesc São Paulo Funtrab e SENAI-MS abrem vagas para cursos gratuitos e fortalecem qualificação profissional no Estado - funtrab.ms.gov.br Bioenergia: rodada de empregabilidade oferece mais de 630 vagas em 15 municípios de MS - agenciadenoticias.ms.gov.br Senai MS: 2 mil vagas em cursos técnicos com bolsa de R$ 300; inscreva-se - Campo Grande News Faça um curso no Senai e ganhe R$ 300: abertas 2 mil vagas em cursos como Açúcar e Álcool, Administração, Agroindústria, Eletromecânica, Logística, Planejamento e Controle da Produção e Segurança do Trabalho - CPG Click Petróleo e Gás Semana começa com 14 processos seletivos abertos em MS; veja todos aqui! - Enfoque MS Show nacional é interrompido após fechamento de avenida e som acima do permitido em Cuiabá - G1 Concurso Secretaria Municipal de Educação Sonora MS abre 2 vagas - Folha Dirigida Casa do Trabalhador de Sonora realiza seletiva com a empresa Cargill - funtrab.ms.gov.br Polícia Civil inaugura a 53ª Sala Lilás do MS, em Japorã - pc.ms.gov.br Sonora fecha contrato de R$ 2 milhões com empresa envolvida em fraudes em Mato Grosso - Midiamax Carreta-palco do Circuito Cultura MS segue para a região central com nova rodada de apresentações  agenciadenoticias.ms.gov.br Neno Razuk investe mais de R$ 5 milhões em emendas e transforma municípios de MS  Assembleia Legislativa de Mato Grosso do Sul - Sonora Brasil Sesc terá mostra comemorativa em Porto Alegre e apresentações em 6 cidades do interior do RS  Sesc/RS Moinho in Concert entra na reta final dos ensaios para celebrar os caminhos que levam ao céu  Diário MS News Semana Modos de Acessar 2021  Sesc São Paulo Funtrab e SENAI-MS abrem vagas para cursos gratuitos e fortalecem qualificação profissional no Estado  funtrab.ms.gov.br Bioenergia: rodada de empregabilidade oferece mais de 630 vagas em 15 municípios de MS  agenciadenoticias.ms.gov.br Senai MS: 2 mil vagas em cursos técnicos com bolsa de R$ 300; inscreva-se  Campo Grande News Faça um curso no Senai e ganhe R$ 300: abertas 2 mil vagas em cursos como Açúcar e Álcool, Administração, Agroindústria, Eletromecânica, Logística, Planejamento e Controle da Produção e Segurança do Trabalho  CPG Click Petróleo e Gás Semana começa com 14 processos seletivos abertos em MS; veja todos aqui! Enfoque MS Show nacional é interrompido após fechamento de avenida e som acima do permitido em Cuiabá  G1 Concurso Secretaria Municipal de Educação Sonora MS abre 2 vagas  Folha Dirigida Casa do Trabalhador de Sonora realiza seletiva com a empresa Cargill  funtrab.ms.gov.br Polícia Civil inaugura a 53ª Sala Lilás do MS, em Japorã  pc.ms.gov.br Sonora fecha contrato de R$ 2 milhões com empresa envolvida em fraudes em Mato Grosso  Midiamax"
