municipio,qtd_noticias_encontradas,temas_frequentes,resumo_para_slide
Mundo Novo,14,"funtrab, vagas, campo, grande, cine","Sesc Teatro Prosa oferece semana de arte e lazer gratuito em Campo Grande - capitalnews.com.br Cine Sesi tem 2º maior público do ano em Bonito com 4,9 mil pessoas - Agência de Notícias da Indústria Projeto Artesania fomenta cultura e geração de renda no interior por meio do artesanato - Portal Único ms.gov.br Cine Sesi Cultural finaliza 3ª etapa com 101,6 mil pessoas em 32 cidades - Agência de Notícias da Indústria Funtrab e SENAI-MS abrem vagas para cursos gratuitos e fortalecem qualificação profissional no Estado - funtrab.ms.gov.br Educação profissional muda a vida de estudantes e impulsiona mobilidade social em Mato Grosso do Sul - Portal Único ms.gov.br Confira a programação completa do Delas Day 2026 - funtrab.ms.gov.br Senai abre 2,7 mil vagas em cursos técnicos e graduação em 2026 - Campo Grande News CCR MSVia está com 30 vagas de trabalho abertas em municípios de MS - Motiva Rodovias Com Fiems, Paulo Corrêa articula desconto de até 20% na conta de energia para 74 municípios de MS - O CORREIO NEWS Fazer o ´número 1´ ou o ´número 2´ na Câmara de Dourados é um aperto - o progresso Polícia Civil inaugura a 53ª Sala Lilás do MS, em Japorã - sejusp.ms.gov.br Polícia Civil inaugura a 51ª Sala Lilás em Mundo Novo - pc.ms.gov.br Ex-prefeito de Japorã ganha cargo semelhante ao do prefeito e passa a ser investigado - Midiamax Sesc Teatro Prosa oferece semana de arte e lazer gratuito em Campo Grande  capitalnews.com.br Cine Sesi tem 2º maior público do ano em Bonito com 4,9 mil pessoas  Agência de Notícias da Indústria Projeto Artesania fomenta cultura e geração de renda no interior por meio do artesanato  Portal Único ms.gov.br Cine Sesi Cultural finaliza 3ª etapa com 101,6 mil pessoas em 32 cidades  Agência de Notícias da Indústria Funtrab e SENAI-MS abrem vagas para cursos gratuitos e fortalecem qualificação profissional no Estado  funtrab.ms.gov.br Educação profissional muda a vida de estudantes e impulsiona mobilidade social em Mato Grosso do Sul  Portal Único ms.gov.br Confira a programação completa do Delas Day 2026  funtrab.ms.gov.br Senai abre 2,7 mil vagas em cursos técnicos e graduação em 2026  Campo Grande News CCR MSVia está com 30 vagas de trabalho abertas em municípios de MS  Motiva Rodovias Com Fiems, Paulo Corrêa articula desconto de até 20% na conta de energia para 74 municípios de MS  O CORREIO NEWS Fazer o ´número 1´ ou o ´número 2´ na Câmara de Dourados é um aperto  o progresso Polícia Civil inaugura a 53ª Sala Lilás do MS, em Japorã  sejusp.ms.gov.br Polícia Civil inaugura a 51ª Sala Lilás em Mundo Novo  pc.ms.gov.br Ex-prefeito de Japorã ganha cargo semelhante ao do prefeito e passa a ser investigado  Midiamax"
Naviraí,15,"naviraí, vagas, municípios, assembleia, legislativa","Neno Razuk investe mais de R$ 5 milhões em emendas e transforma municípios de MS - Assembleia Legislativa de Mato Grosso do Sul - Governo licita obras de CEUs da Cultura em quatro cidades e fortalece acesso à arte, educação e cidadania - agenciadenoticias.ms.gov.br Calendário Oficial de Eventos Culturais de 2025 é definido pela Gestão Compromisso com o Futuro - navirai.ms.gov.br Colônia de Férias da FIRJAN, matrículas no SESI-MS e museu de ciência 4.0 na BA - Agência de Notícias da Indústria Projeto Artesania fomenta cultura e geração de renda no interior por meio do artesanato - Portal Único ms.gov.br Bioenergia: rodada de empregabilidade oferece mais de 630 vagas em 15 municípios de MS - Portal Único ms.gov.br Senai MS: 2 mil vagas em cursos técnicos com bolsa de R$ 300; inscreva-se - Campo Grande News Com educação profissional e qualificação, MS é beneficiado com melhores oportunidades de emprego - tanamidianavirai.com.br IFMS abre inscrições para curso que amplia acesso ao ensino médio técnico - Correio de Corumbá IFMS abre vagas em cursos técnicos em 7 cidades; matrícula é por ordem de chegada - Campo Grande News Sebrae/MS, Governo do Estado e Prefeitura lançam Plano de Desenvolvimento Municipal de Naviraí - navirai.ms.gov.br Parque Municipal de Naviraí pode se tornar novo po... - Assembleia Legislativa de Mato Grosso do Sul - MPMS investiga pagamento de salários abaixo do mínimo em Naviraí - MPMS Naviraí contrata empresa por R$ 1,4 milhão para revitalizar iluminação pública - Midiamax Polícia Civil inaugura a 53ª Sala Lilás do MS, em Japorã - sejusp.ms.gov.br Neno Razuk investe mais de R$ 5 milhões em emendas e transforma municípios de MS  Assembleia Legislativa de Mato Grosso do Sul - Governo licita obras de CEUs da Cultura em quatro cidades e fortalece acesso à arte, educação e cidadania  agenciadenoticias.ms.gov.br Calendário Oficial de Eventos Culturais de 2025 é definido pela Gestão Compromisso com o Futuro  navirai.ms.gov.br Colônia de Férias da FIRJAN, matrículas no SESI-MS e museu de ciência 4.0 na BA  Agência de Notícias da Indústria Projeto Artesania fomenta cultura e geração de renda no interior por meio do artesanato  Portal Único ms.gov.br Bioenergia: rodada de empregabilidade oferece mais de 630 vagas em 15 municípios de MS  Portal Único ms.gov.br Senai MS: 2 mil vagas em cursos técnicos com bolsa de R$ 300; inscreva-se  Campo Grande News Com educação profissional e qualificação, MS é beneficiado com melhores oportunidades de emprego  tanamidianavirai.com.br IFMS abre inscrições para curso que amplia acesso ao ensino médio técnico  Correio de Corumbá IFMS abre vagas em cursos técnicos em 7 cidades; matrícula é por ordem de chegada  Campo Grande News Sebrae/MS, Governo do Estado e Prefeitura lançam Plano de Desenvolvimento Municipal de Naviraí  navirai.ms.gov.br Parque Municipal de Naviraí pode se tornar novo po...  Assembleia Legislativa de Mato Grosso do Sul - MPMS investiga pagamento de salários abaixo do mínimo em Naviraí  MPMS Naviraí contrata empresa por R$ 1,4 milhão para revitalizar iluminação pública  Midiamax Polícia Civil inaugura a 53ª Sala Lilás do MS, em Japorã  sejusp.ms.gov.br"
Nova Andradina,15,"nova, andradina, vagas, municípios, prefeitura","Senadora Soraya garante mais de R$ 28 milhões para 23 municípios de Mato Grosso do Sul em maio - MS Todo dia 36ª Corrida do Trabalhador reúne em Nova Andradina atletas de quatro estados - Prefeitura Municipal de Nova Andradina Plano Estadual de Esporte e Lazer de MS trará diretrizes do setor para os próximos 10 anos - fundesporte.ms.gov.br Prática da atividade física movimentou a comunidade neste fim de semana - UFMS Neno Razuk investe mais de R$ 5 milhões em emendas e transforma municípios de MS - Assembleia Legislativa de Mato Grosso do Sul - IFMS abre vagas na graduação para portador de diploma, transferência e reingresso - Correio de Corumbá Senai MS: 2 mil vagas em cursos técnicos com bolsa de R$ 300; inscreva-se - Campo Grande News IFMS abre vagas em cursos técnicos em 7 cidades; matrícula é por ordem de chegada - Campo Grande News Últimos dias de inscrições para qualificação profissional a distância no IFMS - Correio de Corumbá Bioenergia: rodada de empregabilidade oferece mais de 630 vagas em 15 municípios de MS - Portal Único ms.gov.br Detentos iniciam atividades na limpeza urbana de Nova Andradina - - Prefeitura Municipal de Nova Andradina Parceria entre Agepen e Nova Andradina garante economia superior a 50% e amplia política de trabalho prisional - sejusp.ms.gov.br Agepen e Prefeitura firmam parceria para utilização de mão de obra prisional na limpeza urbana de Nova Andradina - agepen.ms.gov.br Corrida dos Bombeiros de Nova Andradina reúne mais de 600 participantes e leva militares ao pódio - bombeiros.ms.gov.br Mutirão de Documentação atendeu mais de 600 assentadas em Nova Andradina (MS) — Incra - GOV.BR Senadora Soraya garante mais de R$ 28 milhões para 23 municípios de Mato Grosso do Sul em maio  MS Todo dia 36ª Corrida do Trabalhador reúne em Nova Andradina atletas de quatro estados  Prefeitura Municipal de Nova Andradina Plano Estadual de Esporte e Lazer de MS trará diretrizes do setor para os próximos 10 anos  fundesporte.ms.gov.br Prática da atividade física movimentou a comunidade neste fim de semana  UFMS Neno Razuk investe mais de R$ 5 milhões em emendas e transforma municípios de MS  Assembleia Legislativa de Mato Grosso do Sul - IFMS abre vagas na graduação para portador de diploma, transferência e reingresso  Correio de Corumbá Senai MS: 2 mil vagas em cursos técnicos com bolsa de R$ 300; inscreva-se  Campo Grande News IFMS abre vagas em cursos técnicos em 7 cidades; matrícula é por ordem de chegada  Campo Grande News Últimos dias de inscrições para qualificação profissional a distância no IFMS  Correio de Corumbá Bioenergia: rodada de empregabilidade oferece mais de 630 vagas em 15 municípios de MS  Portal Único ms.gov.br Detentos iniciam atividades na limpeza urbana de Nova Andradina -  Prefeitura Municipal de Nova Andradina Parceria entre Agepen e Nova Andradina garante economia superior a 50% e amplia política de trabalho prisional  sejusp.ms.gov.br Agepen e Prefeitura firmam parceria para utilização de mão de obra prisional na limpeza urbana de Nova Andradina  agepen.ms.gov.br Corrida dos Bombeiros de Nova Andradina reúne mais de 600 participantes e leva militares ao pódio  bombeiros.ms.gov.br Mutirão de Documentação atendeu mais de 600 assentadas em Nova Andradina (MS) — Incra  GOV.BR"
Paranaíba,15,"notícias, oferece, bioenergia, vagas, prefeitura","Tradição, aventura e cultura: Confira o roteiro de eventos que agitam o Brasil no mês de Setembro - GOV.BR Sesc Movimenta oferece 27 atividades gratuitas em Uberlândia e Uberaba; veja programação - G1 Cine Sesi Cultural finaliza 3ª etapa com 101,6 mil pessoas em 32 cidades - Agência de Notícias da Indústria Noticias - Secretaria de Estado de Cultura e Turismo - SECULT Cine Sesi tem 2º maior público do ano em Bonito com 4,9 mil pessoas - Agência de Notícias da Indústria Bioenergia: rodada de empregabilidade oferece mais de 630 vagas em 15 municípios de MS - Portal Único ms.gov.br Últimos dias de inscrições para qualificação profissional a distância no IFMS - Correio de Corumbá Setor de bioenergia oferece 630 vagas de emprego em 15 cidades de MS - - Folha de Campo Grande - Rodada de Empregabilidade mostra a diversidade de profissões que movem o setor de Bioenergia em MS - Cana Online GIRO FUNTRAB DE NOTÍCIAS – 30/07/2025 a 06/08/2025 - funtrab.ms.gov.br Prefeitura de Paranaíba é condenada a pagar indenização após professora ser exposta em vídeo sobre atestados médicos - RCN 67 Justiça condena prefeitura de MS após professora ser exposta em vídeo sobre atestados médicos - G1 TJMS condena município por exposição vexatória de servidora em rede social de prefeito - Enfoque MS TJMS mantém indenização de R$ 10 mil a servidora exposta por prefeito em Paranaíba - JD1 Notícias Prefeitura de Paranaíba-MS abre vagas de R$ 1.719 para alfabetizados - Ache Concursos Tradição, aventura e cultura: Confira o roteiro de eventos que agitam o Brasil no mês de Setembro  GOV.BR Sesc Movimenta oferece 27 atividades gratuitas em Uberlândia e Uberaba; veja programação  G1 Cine Sesi Cultural finaliza 3ª etapa com 101,6 mil pessoas em 32 cidades  Agência de Notícias da Indústria Noticias  Secretaria de Estado de Cultura e Turismo - SECULT Cine Sesi tem 2º maior público do ano em Bonito com 4,9 mil pessoas  Agência de Notícias da Indústria Bioenergia: rodada de empregabilidade oferece mais de 630 vagas em 15 municípios de MS  Portal Único ms.gov.br Últimos dias de inscrições para qualificação profissional a distância no IFMS  Correio de Corumbá Setor de bioenergia oferece 630 vagas de emprego em 15 cidades de MS -  Folha de Campo Grande - Rodada de Empregabilidade mostra a diversidade de profissões que movem o setor de Bioenergia em MS  Cana Online GIRO FUNTRAB DE NOTÍCIAS – 30/07/2025 a 06/08/2025  funtrab.ms.gov.br Prefeitura de Paranaíba é condenada a pagar indenização após professora ser exposta em vídeo sobre atestados médicos  RCN 67 Justiça condena prefeitura de MS após professora ser exposta em vídeo sobre atestados médicos  G1 TJMS condena município por exposição vexatória de servidora em rede social de prefeito  Enfoque MS TJMS mantém indenização de R$ 10 mil a servidora exposta por prefeito em Paranaíba  JD1 Notícias Prefeitura de Paranaíba-MS abre vagas de R$ 1.719 para alfabetizados  Ache Concursos"
Paranhos,14,"news, paranhos, notícias, gazeta, milhões","Neno Razuk investe mais de R$ 5 milhões em emendas e transforma municípios de MS - Assembleia Legislativa de Mato Grosso do Sul - Cine Sesi tem 2º maior público do ano em Bonito com 4,9 mil pessoas - Agência de Notícias da Indústria Cine Sesi Cultural finaliza 3ª etapa com 101,6 mil pessoas em 32 cidades - Agência de Notícias da Indústria Notícias, galeria de fotos, vídeos de Amambai-MS e região | Página 52 - A Gazeta News Paranhos realiza ação de plantio de mudas e limpeza às margens do Rio Iguatemi no dia 4 de junho - A Gazeta News Mineradora abre vagas para Jovem Aprendiz em Mara Rosa (GO) - stgnews.com.br Confira 7 Editais de Especialização EAD abertos em Junho de 2024 - PEBSP Reunião entre AGEHAB e Prefeitura de Paranhos discute avanços na área de moradia - A Gazeta News Secretaria de Educação-MS abre 415 vagas para Assistente de Atividades Educacionais - Ache Concursos Equipe da Justiça Federal/MS realiza visita técnica em Paranhos para tratar da próxima edição do projeto “Caminho do Acordo” - trf3.jus.br Pacote de R$ 10 milhões prevê de ambulâncias no interior de MS - Midiamax Novo prefeito de Paranhos faz exoneração em massa e nomeia novos integrantes do primeiro escalão - G1 Novo prefeito de Paranhos exonera secretariado em 7 de novembro - Campo Grande News Polícia Civil inaugura a 52ª Sala Lilás do MS em Aparecida do Taboado - Costa Leste News Neno Razuk investe mais de R$ 5 milhões em emendas e transforma municípios de MS  Assembleia Legislativa de Mato Grosso do Sul - Cine Sesi tem 2º maior público do ano em Bonito com 4,9 mil pessoas  Agência de Notícias da Indústria Cine Sesi Cultural finaliza 3ª etapa com 101,6 mil pessoas em 32 cidades  Agência de Notícias da Indústria Notícias, galeria de fotos, vídeos de Amambai-MS e região | Página 52  A Gazeta News Paranhos realiza ação de plantio de mudas e limpeza às margens do Rio Iguatemi no dia 4 de junho  A Gazeta News Mineradora abre vagas para Jovem Aprendiz em Mara Rosa (GO)  stgnews.com.br Confira 7 Editais de Especialização EAD abertos em Junho de 2024  PEBSP Reunião entre AGEHAB e Prefeitura de Paranhos discute avanços na área de moradia  A Gazeta News Secretaria de Educação-MS abre 415 vagas para Assistente de Atividades Educacionais  Ache Concursos Equipe da Justiça Federal/MS realiza visita técnica em Paranhos para tratar da próxima edição do projeto “Caminho do Acordo”  trf3.jus.br Pacote de R$ 10 milhões prevê de ambulâncias no interior de MS  Midiamax Novo prefeito de Paranhos faz exoneração em massa e nomeia novos integrantes do primeiro escalão  G1 Novo prefeito de Paranhos exonera secretariado em 7 de novembro  Campo Grande News Polícia Civil inaugura a 52ª Sala Lilás do MS em Aparecida do Taboado  Costa Leste News"
Porto Murtinho,15,"municípios, midiamax, funtrab, porto, murtinho","Perifeirarte leva formação e mobilização comunitária a Porto Murtinho com programação integrada e atividades culturais - Radio Quarteto Potencial turístico da Rota Bioceânica abre nova perspectiva de negócios para Mato Grosso do Sul - semadesc.ms.gov.br Caravana da Castração avança em MS com mais de 1 mil atendimentos nos primeiros municípios do programa - Portal Único ms.gov.br Rota Bioceânica gera desenvolvimento para municípios de MS e impacta economia e educação - agenciadenoticias.ms.gov.br Protagonismo de mulheres indígenas ganha espaço no mundo das artes - Sesc São Paulo Candidatos aprovados na seleção para bombeiro são convocados para curso de capacitação - Midiamax Funtrab e Biosul anunciam 2ª Rodada de Empregabilidade do Setor de Bioenergia com mais de 630 vagas em 15 municípios de MS - funtrab.ms.gov.br Acabou a desculpa! SENAI tem mais de 8,3 mil vagas em vários cursos pelo Brasil - Agência de Notícias da Indústria GIRO FUNTRAB DE NOTÍCIAS – 03/06/2025 a 16/06/2025 - funtrab.ms.gov.br Corpo de Bombeiros divulga novo resultado da seleção para bombeiros temporários - Midiamax Com Fiems, Paulo Corrêa articula desconto de até 20% na conta de energia para 74 municípios de MS - O CORREIO NEWS Cetran/MS promove palestra sobre bicicletas elétricas e ciclomotores em Porto Murtinho - sejusp.ms.gov.br Porto Murtinho avança em obras de saúde, infraestrutura e turismo, de olho na consolidação da Rota Bioceânica - agenciadenoticias.ms.gov.br Pacote de R$ 10 milhões prevê de ambulâncias no interior de MS - Midiamax De saúde a lazer, mutirão leva mais de 300 serviços gratuitos ao Jardim Anache - Midiamax Perifeirarte leva formação e mobilização comunitária a Porto Murtinho com programação integrada e atividades culturais  Radio Quarteto Potencial turístico da Rota Bioceânica abre nova perspectiva de negócios para Mato Grosso do Sul  semadesc.ms.gov.br Caravana da Castração avança em MS com mais de 1 mil atendimentos nos primeiros municípios do programa  Portal Único ms.gov.br Rota Bioceânica gera desenvolvimento para municípios de MS e impacta economia e educação  agenciadenoticias.ms.gov.br Protagonismo de mulheres indígenas ganha espaço no mundo das artes  Sesc São Paulo Candidatos aprovados na seleção para bombeiro são convocados para curso de capacitação  Midiamax Funtrab e Biosul anunciam 2ª Rodada de Empregabilidade do Setor de Bioenergia com mais de 630 vagas em 15 municípios de MS  funtrab.ms.gov.br Acabou a desculpa! SENAI tem mais de 8,3 mil vagas em vários cursos pelo Brasil  Agência de Notícias da Indústria GIRO FUNTRAB DE NOTÍCIAS – 03/06/2025 a 16/06/2025  funtrab.ms.gov.br Corpo de Bombeiros divulga novo resultado da seleção para bombeiros temporários  Midiamax Com Fiems, Paulo Corrêa articula desconto de até 20% na conta de energia para 74 municípios de MS  O CORREIO NEWS Cetran/MS promove palestra sobre bicicletas elétricas e ciclomotores em Porto Murtinho  sejusp.ms.gov.br Porto Murtinho avança em obras de saúde, infraestrutura e turismo, de olho na consolidação da Rota Bioceânica  agenciadenoticias.ms.gov.br Pacote de R$ 10 milhões prevê de ambulâncias no interior de MS  Midiamax De saúde a lazer, mutirão leva mais de 300 serviços gratuitos ao Jardim Anache  Midiamax"
Ribas do Rio Pardo,15,"três, suzano, ribas, lagoas, arapuanews","Três Lagoas leva cultura e protagonismo à Teia Nacional 2026, no Espírito Santo - ArapuaNews Jogos da Melhor Idade movimentam Três Lagoas com 800 atletas de 48 municípios - RCN 67 Fundtur-MS lança guia de afroturismo e apresenta estratégia para fortalecer o segmento - ArapuaNews Neno Razuk investe mais de R$ 5 milhões em emendas e transforma municípios de MS - Assembleia Legislativa de Mato Grosso do Sul - Mais R$ 536 milhões: investimento do Governo de MS em rodovias impulsiona o desenvolvimento do Estado - Portal Único ms.gov.br Suzano abre 9 processos seletivos para Ribas do Rio Pardo e Três Lagoas - RCN 67 Funtrab anuncia vários cursos gratuitos de qualificação no Estado, veja como se inscrever - funtrab.ms.gov.br Suzano abre vagas em 3 cidades de MS para áreas florestal e de manutenção - Midiamax Suzano abre três processos seletivos para vagas operacionais em Ribas do Rio Pardo - ArapuaNews Suzano oferece bolsas de R$ 1,8 mil em curso de eletromecânica em MS - diariodigital.com.br Com Fiems, Paulo Corrêa articula desconto de até 20% na conta de energia para 74 municípios de MS - O CORREIO NEWS Justiça Federal inicia dia 24 serviços de cidadania a trabalhadores rurais e indígenas em Porto Murtinho/MS - trf3.jus.br Polícia Civil inaugura a 53ª Sala Lilás do MS, em Japorã - sejusp.ms.gov.br Ribas do Rio Pardo: quando indústria e educação se unem para outra cidade nascer - agorams.com.br Dispensa em licitação de R$ 3,8 milhões para coleta de lixo em Ribas entra na mira de inquérito - Midiamax Três Lagoas leva cultura e protagonismo à Teia Nacional 2026, no Espírito Santo  ArapuaNews Jogos da Melhor Idade movimentam Três Lagoas com 800 atletas de 48 municípios  RCN 67 Fundtur-MS lança guia de afroturismo e apresenta estratégia para fortalecer o segmento  ArapuaNews Neno Razuk investe mais de R$ 5 milhões em emendas e transforma municípios de MS  Assembleia Legislativa de Mato Grosso do Sul - Mais R$ 536 milhões: investimento do Governo de MS em rodovias impulsiona o desenvolvimento do Estado  Portal Único ms.gov.br Suzano abre 9 processos seletivos para Ribas do Rio Pardo e Três Lagoas  RCN 67 Funtrab anuncia vários cursos gratuitos de qualificação no Estado, veja como se inscrever  funtrab.ms.gov.br Suzano abre vagas em 3 cidades de MS para áreas florestal e de manutenção  Midiamax Suzano abre três processos seletivos para vagas operacionais em Ribas do Rio Pardo  ArapuaNews Suzano oferece bolsas de R$ 1,8 mil em curso de eletromecânica em MS  diariodigital.com.br Com Fiems, Paulo Corrêa articula desconto de até 20% na conta de energia para 74 municípios de MS  O CORREIO NEWS Justiça Federal inicia dia 24 serviços de cidadania a trabalhadores rurais e indígenas em Porto Murtinho/MS  trf3.jus.br Polícia Civil inaugura a 53ª Sala Lilás do MS, em Japorã  sejusp.ms.gov.br Ribas do Rio Pardo: quando indústria e educação se unem para outra cidade nascer  agorams.com.br Dispensa em licitação de R$ 3,8 milhões para coleta de lixo em Ribas entra na mira de inquérito  Midiamax"
Sete Quedas,13,"news, gazeta, sete, quedas, amambai","Sete Quedas amplia infraestrutura, saneamento e lazer com investimentos superiores a R$ 23 milhões - Notícias em Rede Fazenda eleva para 4,5% estimativa de inflação com guerra e petróleo - A Gazeta News Com apoio do Governo, Taboadão 2026 movimenta turismo, cultura e economia da região - A Gazeta News Baile do Trabalhador acontece neste sábado no CTG em Amambai - A Gazeta News Notícias, galeria de fotos, vídeos de Amambai-MS e região | Página 30 - A Gazeta News Corpo de Bombeiros controlam incêndio à residência em Amambai - A Gazeta News Secretaria de Educação-MS abre 415 vagas para Assistente de Atividades Educacionais - Ache Concursos Casa do Trabalhador disponibiliza 53 oportunidades de emprego em Amambai - A Gazeta News Com Fiems, Paulo Corrêa articula desconto de até 20% na conta de energia para 74 municípios de MS - O CORREIO NEWS Abastecimento da frota municipal custará R$ 2,9 milhões em Sete Quedas - Midiamax Polícia Civil inaugura a 53ª Sala Lilás do MS, em Japorã - sejusp.ms.gov.br Processo seletivo simplificado Prefeitura de Sete Quedas MS Educação - Folha Dirigida Sete Quedas pede à Justiça entrada forçada em imóveis após alta de chikungunya - A Crítica de Campo Grande Sete Quedas amplia infraestrutura, saneamento e lazer com investimentos superiores a R$ 23 milhões  Notícias em Rede Fazenda eleva para 4,5% estimativa de inflação com guerra e petróleo  A Gazeta News Com apoio do Governo, Taboadão 2026 movimenta turismo, cultura e economia da região  A Gazeta News Baile do Trabalhador acontece neste sábado no CTG em Amambai  A Gazeta News Notícias, galeria de fotos, vídeos de Amambai-MS e região | Página 30  A Gazeta News Corpo de Bombeiros controlam incêndio à residência em Amambai  A Gazeta News Secretaria de Educação-MS abre 415 vagas para Assistente de Atividades Educacionais  Ache Concursos Casa do Trabalhador disponibiliza 53 oportunidades de emprego em Amambai  A Gazeta News Com Fiems, Paulo Corrêa articula desconto de até 20% na conta de energia para 74 municípios de MS  O CORREIO NEWS Abastecimento da frota municipal custará R$ 2,9 milhões em Sete Quedas  Midiamax Polícia Civil inaugura a 53ª Sala Lilás do MS, em Japorã  sejusp.ms.gov.br Processo seletivo simplificado Prefeitura de Sete Quedas MS Educação  Folha Dirigida Sete Quedas pede à Justiça entrada forçada em imóveis após alta de chikungunya  A Crítica de Campo Grande"
