municipio,qtd_noticias_encontradas,temas_frequentes,resumo_para_slide
Naviraí,15,"naviraí, vagas, cursos, técnicos, municipal","Governo licita obras de CEUs da Cultura em quatro cidades e fortalece acesso à arte, educação e cidadania - Portal Único ms.gov.br Calendário Oficial de Eventos Culturais de 2025 é definido pela Gestão Compromisso com o Futuro - navirai.ms.gov.br Semana do Artesão começa nesta quarta-feira com uma programação recheada de atrações - agenciadenoticias.ms.gov.br Colônia de Férias da FIRJAN, matrículas no SESI-MS e museu de ciência 4.0 na BA - Agência de Notícias da Indústria Agendão: bandeirinhas, forró e quitutes marcam o início das festas juninas em Mato Grosso do Sul - agenciadenoticias.ms.gov.br Bioenergia: rodada de empregabilidade oferece mais de 630 vagas em 15 municípios de MS - Portal Único ms.gov.br Senai MS: 2 mil vagas em cursos técnicos com bolsa de R$ 300; inscreva-se - Campo Grande News IFMS divulga vagas remanescentes em cursos técnicos integrados - Correio de Corumbá IFMS abre vagas em cursos técnicos em 7 cidades; matrícula é por ordem de chegada - Campo Grande News GIRO FUNTRAB DE NOTÍCIAS – 03/06/2025 a 16/06/2025 - funtrab.ms.gov.br Prefeitura de Naviraí - MS abre seleção para Operador de Serviços Públicos - PCI Concursos Parque Municipal de Naviraí pode se tornar novo po... - Assembleia Legislativa de Mato Grosso do Sul - Sebrae/MS, Governo do Estado e Prefeitura lançam Plano de Desenvolvimento Municipal de Naviraí - navirai.ms.gov.br Plano de Desenvolvimento Municipal vai orientar crescimento sustentável e fortalecimento da economia em Naviraí - ms.agenciasebrae.com.br Ação do MPMS reforça saúde pública em Naviraí com doação de equipamentos e mobiliários à vigilância sanitária - MPMS Governo licita obras de CEUs da Cultura em quatro cidades e fortalece acesso à arte, educação e cidadania  Portal Único ms.gov.br Calendário Oficial de Eventos Culturais de 2025 é definido pela Gestão Compromisso com o Futuro  navirai.ms.gov.br Semana do Artesão começa nesta quarta-feira com uma programação recheada de atrações  agenciadenoticias.ms.gov.br Colônia de Férias da FIRJAN, matrículas no SESI-MS e museu de ciência 4.0 na BA  Agência de Notícias da Indústria Agendão: bandeirinhas, forró e quitutes marcam o início das festas juninas em Mato Grosso do Sul  agenciadenoticias.ms.gov.br Bioenergia: rodada de empregabilidade oferece mais de 630 vagas em 15 municípios de MS  Portal Único ms.gov.br Senai MS: 2 mil vagas em cursos técnicos com bolsa de R$ 300; inscreva-se  Campo Grande News IFMS divulga vagas remanescentes em cursos técnicos integrados  Correio de Corumbá IFMS abre vagas em cursos técnicos em 7 cidades; matrícula é por ordem de chegada  Campo Grande News GIRO FUNTRAB DE NOTÍCIAS – 03/06/2025 a 16/06/2025  funtrab.ms.gov.br Prefeitura de Naviraí - MS abre seleção para Operador de Serviços Públicos  PCI Concursos Parque Municipal de Naviraí pode se tornar novo po...  Assembleia Legislativa de Mato Grosso do Sul - Sebrae/MS, Governo do Estado e Prefeitura lançam Plano de Desenvolvimento Municipal de Naviraí  navirai.ms.gov.br Plano de Desenvolvimento Municipal vai orientar crescimento sustentável e fortalecimento da economia em Naviraí  ms.agenciasebrae.com.br Ação do MPMS reforça saúde pública em Naviraí com doação de equipamentos e mobiliários à vigilância sanitária  MPMS"
Nova Andradina,15,"nova, andradina, prefeitura, vagas, agenciadenoticias","Festival de Inverno de Bonito movimenta cultura, turismo e economia em Mato Grosso do Sul - agenciadenoticias.ms.gov.br 36ª Corrida do Trabalhador reúne em Nova Andradina atletas de quatro estados - Prefeitura Municipal de Nova Andradina Programa Rouanet Centro-Oeste é lançado com R$ 29 milhões para fortalecer a cultura regional - agenciadenoticias.ms.gov.br UPF abre inscrições para capacitação em Nova Andradina - fundesporte.ms.gov.br Casa do Homem Pantaneiro: acesso público à cultura e ciência fica como legado em palco da COP15 - agenciadenoticias.ms.gov.br Bioenergia: rodada de empregabilidade oferece mais de 630 vagas em 15 municípios de MS - Portal Único ms.gov.br Senai: programa Jovens do Amanhã oferece 2 mil vagas para cursos com auxílio de R$ 300 - FIEMS Senai MS: 2 mil vagas em cursos técnicos com bolsa de R$ 300; inscreva-se - Campo Grande News IFMS divulga vagas remanescentes em cursos técnicos integrados - Correio de Corumbá Senai abre 2 mil vagas com auxílio de R$ 300 - diariodigital.com.br Detentos iniciam atividades na limpeza urbana de Nova Andradina - - Prefeitura Municipal de Nova Andradina Agepen: mão de obra prisional será empregada na limpeza urbana de Nova Andradina - agenciadenoticias.ms.gov.br Corrida dos Bombeiros de Nova Andradina reúne mais de 600 participantes e leva militares ao pódio - bombeiros.ms.gov.br Prefeitura de Nova Andradina é alvo de investigação após não incluir cotas em contratações - Midiamax Prefeitura adota mão de obra prisional e economiza mais de 50% aos cofres municipais - Prefeitura Municipal de Nova Andradina Festival de Inverno de Bonito movimenta cultura, turismo e economia em Mato Grosso do Sul  agenciadenoticias.ms.gov.br 36ª Corrida do Trabalhador reúne em Nova Andradina atletas de quatro estados  Prefeitura Municipal de Nova Andradina Programa Rouanet Centro-Oeste é lançado com R$ 29 milhões para fortalecer a cultura regional  agenciadenoticias.ms.gov.br UPF abre inscrições para capacitação em Nova Andradina  fundesporte.ms.gov.br Casa do Homem Pantaneiro: acesso público à cultura e ciência fica como legado em palco da COP15  agenciadenoticias.ms.gov.br Bioenergia: rodada de empregabilidade oferece mais de 630 vagas em 15 municípios de MS  Portal Único ms.gov.br Senai: programa Jovens do Amanhã oferece 2 mil vagas para cursos com auxílio de R$ 300  FIEMS Senai MS: 2 mil vagas em cursos técnicos com bolsa de R$ 300; inscreva-se  Campo Grande News IFMS divulga vagas remanescentes em cursos técnicos integrados  Correio de Corumbá Senai abre 2 mil vagas com auxílio de R$ 300  diariodigital.com.br Detentos iniciam atividades na limpeza urbana de Nova Andradina -  Prefeitura Municipal de Nova Andradina Agepen: mão de obra prisional será empregada na limpeza urbana de Nova Andradina  agenciadenoticias.ms.gov.br Corrida dos Bombeiros de Nova Andradina reúne mais de 600 participantes e leva militares ao pódio  bombeiros.ms.gov.br Prefeitura de Nova Andradina é alvo de investigação após não incluir cotas em contratações  Midiamax Prefeitura adota mão de obra prisional e economiza mais de 50% aos cofres municipais  Prefeitura Municipal de Nova Andradina"
Paranaíba,15,"paranaíba, prefeitura, programação, municipal, oferece","Sesc Movimenta oferece 27 atividades gratuitas em Uberlândia e Uberaba; veja programação - G1 Tradição, aventura e cultura: Confira o roteiro de eventos que agitam o Brasil no mês de Setembro - GOV.BR Agenda de Carnaval: desfiles das escolas de samba e blocos de rua tomam conta da programação - agenciadenoticias.ms.gov.br Cine Sesi tem 2º maior público do ano em Bonito com 4,9 mil pessoas - Agência de Notícias da Indústria Lenine encanta público no MS ao Vivo com sucessos antigos e novos em Campo Grande - ArapuaNews IFMS mantém inscrições abertas para cursos técnicos gratuitos em Paranaíba - RCN 67 Cursos para mulheres em MS: bolsa de até R$ 720 em 8 cidades - Campo Grande News Últimos dias de inscrições para qualificação profissional a distância no IFMS - Correio de Corumbá Bioenergia: rodada de empregabilidade oferece mais de 630 vagas em 15 municípios de MS - Portal Único ms.gov.br Rodada de Empregabilidade mostra a diversidade de profissões que movem o setor de Bioenergia em MS - Cana Online Secretaria de Esportes abre novo Processo Seletivo - Prefeitura Municipal de Paranaíba-MS Justiça condena prefeitura de MS após professora ser exposta em vídeo sobre atestados médicos - G1 Prefeitura de Paranaíba é condenada a pagar indenização após professora ser exposta em vídeo sobre atestados médicos - RCN 67 Prefeitura anuncia programação oficial do aniversário de 169 anos de Paranaíba - Prefeitura Municipal de Paranaíba-MS Paranaíba é destaque estadual no Programa AdaptaCidades - Prefeitura Municipal de Paranaíba-MS Sesc Movimenta oferece 27 atividades gratuitas em Uberlândia e Uberaba; veja programação  G1 Tradição, aventura e cultura: Confira o roteiro de eventos que agitam o Brasil no mês de Setembro  GOV.BR Agenda de Carnaval: desfiles das escolas de samba e blocos de rua tomam conta da programação  agenciadenoticias.ms.gov.br Cine Sesi tem 2º maior público do ano em Bonito com 4,9 mil pessoas  Agência de Notícias da Indústria Lenine encanta público no MS ao Vivo com sucessos antigos e novos em Campo Grande  ArapuaNews IFMS mantém inscrições abertas para cursos técnicos gratuitos em Paranaíba  RCN 67 Cursos para mulheres em MS: bolsa de até R$ 720 em 8 cidades  Campo Grande News Últimos dias de inscrições para qualificação profissional a distância no IFMS  Correio de Corumbá Bioenergia: rodada de empregabilidade oferece mais de 630 vagas em 15 municípios de MS  Portal Único ms.gov.br Rodada de Empregabilidade mostra a diversidade de profissões que movem o setor de Bioenergia em MS  Cana Online Secretaria de Esportes abre novo Processo Seletivo  Prefeitura Municipal de Paranaíba-MS Justiça condena prefeitura de MS após professora ser exposta em vídeo sobre atestados médicos  G1 Prefeitura de Paranaíba é condenada a pagar indenização após professora ser exposta em vídeo sobre atestados médicos  RCN 67 Prefeitura anuncia programação oficial do aniversário de 169 anos de Paranaíba  Prefeitura Municipal de Paranaíba-MS Paranaíba é destaque estadual no Programa AdaptaCidades  Prefeitura Municipal de Paranaíba-MS"
Paranhos,9,"paranhos, milhões, interior, abre, vagas","Cine Sesi tem 2º maior público do ano em Bonito com 4,9 mil pessoas - Agência de Notícias da Indústria Neno Razuk destina R$ 5,3 milhões para cidades do interior - capitalnews.com.br Mineradora abre vagas para Jovem Aprendiz em Mara Rosa (GO) - stgnews.com.br Secretaria de Educação-MS abre 415 vagas para Assistente de Atividades Educacionais - Ache Concursos Caminho do Acordo conclui 12ª edição com cerca de 750 atendimentos a comunidades indígenas de Paranhos/MS - trf3.jus.br TRF3 e JFMS abrem a 12ª edição do projeto “Caminho do Acordo”, na Aldeia Pirajuí, em Paranhos/MS - trf3.jus.br Novo prefeito de Paranhos faz exoneração em massa e nomeia novos integrantes do primeiro escalão - G1 Pacote de R$ 10 milhões prevê de ambulâncias no interior de MS - Midiamax Prefeitura de Paranhos - MS publica editais retificados de Processos Seletivos - PCI Concursos Cine Sesi tem 2º maior público do ano em Bonito com 4,9 mil pessoas  Agência de Notícias da Indústria Neno Razuk destina R$ 5,3 milhões para cidades do interior  capitalnews.com.br Mineradora abre vagas para Jovem Aprendiz em Mara Rosa (GO)  stgnews.com.br Secretaria de Educação-MS abre 415 vagas para Assistente de Atividades Educacionais  Ache Concursos Caminho do Acordo conclui 12ª edição com cerca de 750 atendimentos a comunidades indígenas de Paranhos/MS  trf3.jus.br TRF3 e JFMS abrem a 12ª edição do projeto “Caminho do Acordo”, na Aldeia Pirajuí, em Paranhos/MS  trf3.jus.br Novo prefeito de Paranhos faz exoneração em massa e nomeia novos integrantes do primeiro escalão  G1 Pacote de R$ 10 milhões prevê de ambulâncias no interior de MS  Midiamax Prefeitura de Paranhos - MS publica editais retificados de Processos Seletivos  PCI Concursos"
Porto Murtinho,15,"porto, murtinho, funtrab, rota, bioceânica","- Enfoque MS UEMS lança Pantanal Tech MS 2026 com programação que integra ciência, produção e qualidade de vida - Portal Único ms.gov.br Investimento do Governo de MS ‘abre as portas’ para a Rota Bioceânica e ao desenvolvimento de Porto Murtinho - ArapuaNews Mato Grosso do Sul no início do século XXI: entre transições e permanências - OpenEdition Journals Caravana da Castração avança em MS com mais de 1 mil atendimentos nos primeiros municípios do programa - agenciadenoticias.ms.gov.br Funtrab e SENAI-MS abrem vagas para cursos gratuitos e fortalecem qualificação profissional no Estado - funtrab.ms.gov.br Cursos Técnicos em MS: Oportunidades de Qualificação em 2026 - Campo Grande News Candidatos aprovados na seleção para bombeiro são convocados para curso de capacitação - Midiamax Funtrab oferece vagas para advogado, informática, RH, vigilante (PcD) e costureira - funtrab.ms.gov.br Acabou a desculpa! SENAI tem mais de 8,3 mil vagas em vários cursos pelo Brasil - Agência de Notícias da Indústria Moradores de Porto Murtinho/MS recebem serviços de cidadania em nova edição do Juizado Especial Federal Itinerante - trf3.jus.br Porto Murtinho avança em obras de saúde, infraestrutura e turismo, de olho na consolidação da Rota Bioceânica - agenciadenoticias.ms.gov.br Polícia Civil inaugura a 53ª Sala Lilás do MS, em Japorã - sejusp.ms.gov.br Justiça Federal leva cidadania a trabalhadores rurais e indígenas em Porto Murtinho/MS de 24 a 28 de novembro - trf3.jus.br MP recorre para condenar prefeito de Porto Murtinho por contratação de apadrinhados - Midiamax MS lança o 1º Festival de Cultura da Rota Bioceânica e abre seleção para artistas! Enfoque MS UEMS lança Pantanal Tech MS 2026 com programação que integra ciência, produção e qualidade de vida  Portal Único ms.gov.br Investimento do Governo de MS ‘abre as portas’ para a Rota Bioceânica e ao desenvolvimento de Porto Murtinho  ArapuaNews Mato Grosso do Sul no início do século XXI: entre transições e permanências  OpenEdition Journals Caravana da Castração avança em MS com mais de 1 mil atendimentos nos primeiros municípios do programa  agenciadenoticias.ms.gov.br Funtrab e SENAI-MS abrem vagas para cursos gratuitos e fortalecem qualificação profissional no Estado  funtrab.ms.gov.br Cursos Técnicos em MS: Oportunidades de Qualificação em 2026  Campo Grande News Candidatos aprovados na seleção para bombeiro são convocados para curso de capacitação  Midiamax Funtrab oferece vagas para advogado, informática, RH, vigilante (PcD) e costureira  funtrab.ms.gov.br Acabou a desculpa!"
Ribas do Rio Pardo,15,"ribas, pardo, arapuanews, vagas, suzano","As vagas são para três cargos diferentes para atuar nos municípios de Suz - instagram.com Programa MS Supera está com inscrições abertas até o dia 11 de março; tire suas dúvidas - agenciadenoticias.ms.gov.br Suzano abre três processos seletivos para vagas operacionais em Ribas do Rio Pardo - ArapuaNews Suzano amplia presença feminina e encerra 2025 com 556 mulheres contratadas em MS - Notícias do Cerrado Interiorização da saúde aproxima pacientes do tratamento ortopédico especializado em Ribas do Rio Pardo - ArapuaNews Justiça Federal leva cidadania a trabalhadores rurais e indígenas em Porto Murtinho/MS de 24 a 28 de novembro - trf3.jus.br Polícia Civil inaugura a 52ª Sala Lilás do MS, em Aparecida do Taboado - pc.ms.gov.br PENTE FINO | A prisão de Idelson Mendes (PRD), ex-presidente da Câmara Municipal de Rio Verde, realizada em meio à quarta fase da Operação Regra de Três no início de fevereiro, levou ao anulamento de contratos avaliados em R$ 9 milhões. Segundo - instagram.com Ribas do Rio Pardo: quando indústria e educação se unem para outra cidade nascer - agorams.com.br Sesc MS lança prêmio inédito de R$ 400 mil para fortalecer artes cênicas em Mato Grosso do Sul  RCN 67 Destaque nacional: Estudo apresenta benefícios e conquistas de MS rumo à universalização do saneamento  ArapuaNews UEMS lança Pantanal Tech MS 2026 com programação que integra ciência, produção e qualidade de vida  agenciadenoticias.ms.gov.br Com apoio do Sebrae/MS, Expo Ribas 2026 impulsiona desenvolvimento econômico em Ribas do Rio Pardo  ms.agenciasebrae.com.br Escola Sesi transforma Ribas do Rio Pardo com educação  Campo Grande News Funtrab e SENAI-MS abrem vagas para cursos gratuitos e fortalecem qualificação profissional no Estado  funtrab.ms.gov.br A Suzano, empresa fabricante de bioprodutos desenvolvidos a partir do cultivo de eucalipto, recebe, somente até este domingo (29), inscrições para novas oportunidades de trabalho. As vagas são para três cargos diferentes para atuar nos municípios de Suz  instagram.com Programa MS Supera está com inscrições abertas até o dia 11 de março; tire suas dúvidas  agenciadenoticias.ms.gov.br Suzano abre três processos seletivos para vagas operacionais em Ribas do Rio Pardo  ArapuaNews Suzano amplia presença feminina e encerra 2025 com 556 mulheres contratadas em MS  Notícias do Cerrado Interiorização da saúde aproxima pacientes do tratamento ortopédico especializado em Ribas do Rio Pardo  ArapuaNews Justiça Federal leva cidadania a trabalhadores rurais e indígenas em Porto Murtinho/MS de 24 a 28 de novembro  trf3.jus.br Polícia Civil inaugura a 52ª Sala Lilás do MS, em Aparecida do Taboado  pc.ms.gov.br PENTE FINO | A prisão de Idelson Mendes (PRD), ex-presidente da Câmara Municipal de Rio Verde, realizada em meio à quarta fase da Operação Regra de Três no início de fevereiro, levou ao anulamento de contratos avaliados em R$ 9 milhões."
Sete Quedas,8,"concursos, vagas, sete, quedas, midiamax","Semadesc e Sebrae entregam Plano de Desenvolvimento para seis municípios de MS - funtrab.ms.gov.br Concursos em MS oferecem 170 vagas com salários de até R$ 13,1 mil - - Folha de Campo Grande - Secretaria de Educação-MS abre 415 vagas para Assistente de Atividades Educacionais - Ache Concursos Morre Marcelo Miranda, ex-governador de Mato Grosso do Sul - Diário Corumbaense Com apoio do Cidade Empreendedora, simplificação avança em Sete Quedas e torna abertura de empresas mais rápida - ms.agenciasebrae.com.br Abastecimento da frota municipal custará R$ 2,9 milhões em Sete Quedas - Midiamax Procura por vacina contra Chikungunya segue baixa e Prefeitura cria unidade volante - Dourados News Entre prevenção e espera por exames, 11 cidades de MS vivem epidemia de chikungunya - Midiamax Semadesc e Sebrae entregam Plano de Desenvolvimento para seis municípios de MS  funtrab.ms.gov.br Concursos em MS oferecem 170 vagas com salários de até R$ 13,1 mil -  Folha de Campo Grande - Secretaria de Educação-MS abre 415 vagas para Assistente de Atividades Educacionais  Ache Concursos Morre Marcelo Miranda, ex-governador de Mato Grosso do Sul  Diário Corumbaense Com apoio do Cidade Empreendedora, simplificação avança em Sete Quedas e torna abertura de empresas mais rápida  ms.agenciasebrae.com.br Abastecimento da frota municipal custará R$ 2,9 milhões em Sete Quedas  Midiamax Procura por vacina contra Chikungunya segue baixa e Prefeitura cria unidade volante  Dourados News Entre prevenção e espera por exames, 11 cidades de MS vivem epidemia de chikungunya  Midiamax"
Sonora,15,"vagas, sesc, abre, rodada, sonora","Sesc MS abre caminho para novas produções e investe R$ 400 mil em artes cênicas - O Estado Online Carreta-palco do Circuito Cultura MS segue para a região central com nova rodada de apresentações - agenciadenoticias.ms.gov.br Sonora Brasil Sesc terá mostra comemorativa em Porto Alegre e apresentações em 6 cidades do interior do RS - Sesc/RS Show Diaspora’S de Negoativo e Douglas Din leva sonoridade afromineira para o Brasil - Mangue Jornalismo Projeto Artesania fomenta cultura e geração de renda no interior por meio do artesanato - Portal Único ms.gov.br Bioenergia: rodada de empregabilidade oferece mais de 630 vagas em 15 municípios de MS - Portal Único ms.gov.br GIRO FUNTRAB DE NOTÍCIAS – 03/06/2025 a 16/06/2025 - funtrab.ms.gov.br Senai MS: 2 mil vagas em cursos técnicos com bolsa de R$ 300; inscreva-se - Campo Grande News Programa Jovens do Amanhã oferece 2 mil vagas para cursos no Senai - Diário Corumbaense Rodada de Empregabilidade mostra a diversidade de profissões que movem o setor de Bioenergia em MS - Cana Online Hospital Municipal de São Gabriel do Oeste abre processo seletivo para cadastro reserva - Idest Concurso Secretaria Municipal de Educação Sonora MS abre 2 vagas - Qconcursos Folha Dirigida Câmara de São Gabriel do Oeste analisa projetos da prefeitura e demandas de bairros na sessão desta terça-feira - Idest Governador Eduardo Riedel cumpre agenda em Coxim, Sonora e Pedro Gomes nesta sexta-feira com entrega de obras estruturantes e lançamento do CER - Prefeitura de Coxim Show nacional é interrompido após fechamento de avenida e som acima do permitido em Cuiabá - G1 Sesc MS abre caminho para novas produções e investe R$ 400 mil em artes cênicas  O Estado Online Carreta-palco do Circuito Cultura MS segue para a região central com nova rodada de apresentações  agenciadenoticias.ms.gov.br Sonora Brasil Sesc terá mostra comemorativa em Porto Alegre e apresentações em 6 cidades do interior do RS  Sesc/RS Show Diaspora’S de Negoativo e Douglas Din leva sonoridade afromineira para o Brasil  Mangue Jornalismo Projeto Artesania fomenta cultura e geração de renda no interior por meio do artesanato  Portal Único ms.gov.br Bioenergia: rodada de empregabilidade oferece mais de 630 vagas em 15 municípios de MS  Portal Único ms.gov.br GIRO FUNTRAB DE NOTÍCIAS – 03/06/2025 a 16/06/2025  funtrab.ms.gov.br Senai MS: 2 mil vagas em cursos técnicos com bolsa de R$ 300; inscreva-se  Campo Grande News Programa Jovens do Amanhã oferece 2 mil vagas para cursos no Senai  Diário Corumbaense Rodada de Empregabilidade mostra a diversidade de profissões que movem o setor de Bioenergia em MS  Cana Online Hospital Municipal de São Gabriel do Oeste abre processo seletivo para cadastro reserva  Idest Concurso Secretaria Municipal de Educação Sonora MS abre 2 vagas  Qconcursos Folha Dirigida Câmara de São Gabriel do Oeste analisa projetos da prefeitura e demandas de bairros na sessão desta terça-feira  Idest Governador Eduardo Riedel cumpre agenda em Coxim, Sonora e Pedro Gomes nesta sexta-feira com entrega de obras estruturantes e lançamento do CER  Prefeitura de Coxim Show nacional é interrompido após fechamento de avenida e som acima do permitido em Cuiabá  G1"
Tacuru,7,"tacuru, agendão, bandeirinhas, forró, quitutes","Agendão: bandeirinhas, forró e quitutes marcam o início das festas juninas em Mato Grosso do Sul - agenciadenoticias.ms.gov.br Secretaria de Educação-MS abre 415 vagas para Assistente de Atividades Educacionais - Ache Concursos Coronel David é homenageado em Tacuru por investimentos e parceria com o município - A Crítica de Campo Grande Tacuru (MS) recebe segunda etapa do Mutirão de Documentação - GOV.BR Após articulação de Paulo Corrêa, 74 municípios de MS podem ter acesso a desconto de até 20% na conta de luz - O CORREIO NEWS Sala do Empreendedor de Tacuru é reinaugurada para apoiar empreendedores urbanos e rurais - ms.agenciasebrae.com.br Presidente da Câmara de Sinop morre em acidente na BR-163; velório será realizado no plenário do Legislativo - Notícia Exata Agendão: bandeirinhas, forró e quitutes marcam o início das festas juninas em Mato Grosso do Sul  agenciadenoticias.ms.gov.br Secretaria de Educação-MS abre 415 vagas para Assistente de Atividades Educacionais  Ache Concursos Coronel David é homenageado em Tacuru por investimentos e parceria com o município  A Crítica de Campo Grande Tacuru (MS) recebe segunda etapa do Mutirão de Documentação  GOV.BR Após articulação de Paulo Corrêa, 74 municípios de MS podem ter acesso a desconto de até 20% na conta de luz  O CORREIO NEWS Sala do Empreendedor de Tacuru é reinaugurada para apoiar empreendedores urbanos e rurais  ms.agenciasebrae.com.br Presidente da Câmara de Sinop morre em acidente na BR-163; velório será realizado no plenário do Legislativo  Notícia Exata"
